날짜,년도,월,일,시간,요일,점수,좋아요,싫어요,이름,리플
7-9-2013,2013,7,9,14:25,화요일,10,19544,524,maan****,이 영화를 보고 암이 나았습니다.  
7-5-2013,2013,7,5,01:41,금요일,1,16398,731,joke****,이것은절대1점이아니다11점을주고싶은 내마음이다  
5-27-2013,2013,5,27,20:57,월요일,10,12675,304,샤브레(dccm****),모니터도 울고 외장하드도 울고 숨어있던 바이러스도 울었다  
6-5-2013,2013,6,5,18:20,수요일,10,11780,348,그라운드(hank****),당신이 이 영화를 보지 않았다면  아직 살아있을 이유 하나를 간직하고 있는 것이다.  
6-16-2013,2013,6,16,01:38,일요일,10,9227,201,Kyle(pool****),"영화계엔 BC와 AC가 있다. Before Clementain, After Clementain...  "
2-18-2014,2014,2,18,17:00,화요일,10,8951,232,미단스(mida****),"남친 집에서 클레멘타인 DVD를 발견했고, 결혼을 결심했습니다.  "
7-8-2013,2013,7,8,17:14,월요일,10,8327,296,통달선생(hars****),드디어 보았네요. 나이 40대 중반에 이런 감동을 느낄 수 있음에 스스로도 대견한 생각이 듭니다. 먼 훗날 제 아이들도 이 영화를 보고 저와 같은 감동을 느끼길 바라는 건 그저 바램이겠지요?  
6-20-2013,2013,6,20,18:36,목요일,10,7410,269,와라이탁(qna0****),평점깍아내리는 낚시글 몇개있는데 제발그만해라 이기적인새끼들아좋은건 나누는거다  
7-17-2014,2014,7,17,00:31,목요일,10,6120,115,소이탄(tjrg****),장난으로 쓰지마라... 본인은 2004년에 실제로 극장에서 이 영화를 봤다  
7-8-2013,2013,7,8,03:44,월요일,10,5932,113,돼지고릴라(syai****),내가 가장 부러운 사람은 이영화를 아직 보지않은 사람이다.. 보기전으로 돌아가 그때에 느꼈던 감동을 다시 느끼고싶다...  
7-17-2014,2014,7,17,14:49,목요일,10,5885,133,잉잉(beat****),프로포즈 선물로 다이아반지 대신 클레멘타인 파일을 USB에담아 목걸이로 만들어 그녀 목에 걸어주었다. 눈물로 대신 대답한 그녀...그리고 2세이름은 그녀의 의견을 반영해 이동준과 스티븐시갈의 이름을 딴 이동갈로 지을 예정이다.  
6-24-2013,2013,6,24,14:21,월요일,10,5600,121,빠가사리(ultr****),"난 8년째 아침 알람소리는 ""아빠~일어나~~!!!"" 이다..........난 매일 아침을 상쾌한 눈물로 하루를 시작한다............,  "
5-27-2013,2013,5,27,20:28,월요일,10,4906,97,ssd2****,"신은 인간을 만들었고, 인간은 클레멘타인을 만들었다.  "
1-20-2014,2014,1,20,12:53,월요일,10,4509,250,레이븐(come****),저는 앉은뱅이입니다. 너무 감동받고 아빠 일어나! 에서 전 직립보행을 했습니다.  
6-2-2013,2013,6,2,16:31,일요일,10,3979,81,yan8****,네이버평점보고 영화뭐볼까 진짜고민하다 황금같은 일요일 클레멘타인을 선택하였다 후회는없다  
5-27-2013,2013,5,27,12:17,월요일,10,3698,72,ysju****,한강물의 10%는 이영화보고 사람들이흘린눈물이라던데 처음엔 장난이겟지햇는데 보고나니 이말이사실일지도모른다는생각  
7-8-2013,2013,7,8,07:21,월요일,10,3387,106,토시오(bhm0****),우리집개도 이영화를 보고 참회의 눈물을 흘렸다~~!!!  
6-6-2013,2013,6,6,15:01,목요일,10,3125,73,압둘라(prom****),10점밖에 줄 수 없다는게 슬픈영화. 영화제작을 꿈꾸는 이들에게 교과서같은 명화.  
3-27-2014,2014,3,27,10:14,목요일,10,3390,405,하피디(theh****),"여성부에서 아빠만 일어나라고 했다고 성차별이라며 이 영화를 제지하지만 않았어도 2,000만 관객은 넘었을겁니다.  "
7-14-2013,2013,7,14,18:15,일요일,10,2974,72,NEMEDOS(neme****),평가하는 것 자체가 이 영화에 대한 모독. 전설 그 자체인 영화.  
6-4-2014,2014,6,4,16:13,수요일,10,2809,62,newcs(ssk0****),다시 한번 임진왜란이 일어난다면 왜구는 이영화를 제일 먼저 약탈해 갈것이다.  
6-24-2013,2013,6,24,02:52,월요일,10,2814,98,pott****,"높은 평점과는 달리 영화를 보는 내내 고개를 갸우뚱 하게 했던 영화.하지만, 철장에서의 격투신은 이 모든 이유를 뒤집고도 남는다.  "
7-23-2013,2013,7,23,08:42,화요일,10,2518,100,춘산(heej****),높은 평점에 어렵게 구해서 봤다.엔딩크레딧이 올라갈때 클라이막스에 도달한 분노...두달동안 끊었던 담배를 재떨이에 수북하게 늘려가며리뷰를 쓴다.말로는 표현못하는 그 기분을 평점 10점을 주며 다른 분들과 나누고 싶다.  
6-12-2014,2014,6,12,09:33,목요일,10,2424,44,랄라(rmw1****),정말강추입니다. 밥먹으면서 봤는데 밥그릇까지 먹었습니다. 정말 좋아요^^  
7-22-2013,2013,7,22,14:29,월요일,10,2408,55,fell****,전 dvd를 두개 소장하고 있어요. 하나는 감상용 하나는 비닐도 뜯지않은 보관용. 감상용은 너무 많이 봐서 상태가 안좋아요. 온가족이 모이는 추석이나 설엔 클레멘타인 타임이 있어요  
6-6-2014,2014,6,6,12:41,금요일,10,2323,34,미르(sixy****),"온가족이 DVD로 관람했습니다. 어머니,누나는 뜨거워진 눈시울에 어쩔줄을 모르고 무뚝뚝한 아버지는 눈물을 보이지 않으려고 천장만 바라보시고.. 올해 92살이신 할머니가 제 손을 잡으시더니.. 그러시더군요. 여지껏 안죽고 산 보람이 있다고...  "
6-9-2014,2014,6,9,17:33,월요일,10,2147,61,Prime(rksw****),모텔에서 절대 보지마세요..이것만 3번보고 나왔습니다.. 하.. 아무것도 하지못한채...  
6-10-2013,2013,6,10,20:42,월요일,10,2205,173,빛나는싸이닝(will****),이동준씨가 60억 가까이 날리고 밤무대 똥꼬(?) 차력쇼까지 해야했던...눈물겨운 영화...시갈 형님은 마지막 5분가량 출연 10억 챙기고 주연까지..영화보면 알게된다..평점으로 패러독스와 반전의 미학을 이끌어낼 수있다는 경의로움을...  
7-18-2014,2014,7,18,00:27,금요일,10,1988,72,내별명은(is30****),저는 앞이 보이지 않지만 이 영화를 보았습니다  
2-17-2014,2014,2,17,18:56,월요일,10,1945,47,최뽀뽀(pink****),인생은 B와 D사이의 C다. Birth와 Death 사이의 Clemetine이다라는 뜻이다. 나의인생역시 클레멘타인 단어 하나로 정의된다.  
6-6-2013,2013,6,6,20:58,목요일,10,1495,47,시허카푸(ever****),내 인생에 있어 가장 큰 스승은 위대한 선현도 아니요 대대로 내려오는 지혜도 아니요 수많은 책들도 아니었다. 바로 클레멘타인이었다. 클레멘타인은 나로 하여금 새로 태어나게 하였다.  
2-19-2014,2014,2,19,17:34,수요일,10,1436,29,spee****,재미없다는 인간들에게 낚이지 마세요. 지들만 보려고 그러는겁니다  
7-3-2013,2013,7,3,14:13,수요일,10,1379,45,akse****,"모르시는 분들이 있는 것 같은데 실제로 이 영화는  많은 한국 감독들에게 영감을준 작품이고 스페인의 거장 ""알베르토 알란""감독의 영화 비에르노에 영감을 준 작품이고   이탈리아의  자존심 '엔조 파올로' 감독의 극찬을 받은 영화입니다  "
6-1-2013,2013,6,1,21:42,토요일,10,1471,281,tlsc****,남자는 세번 운다고한다....태어날때.부모님 돌아가실때.나라 망할때...허나 나는 클레멘 타인은 보고 생각이 바꿨다... 남자는 세번 운다....클레멘타인은 볼때....클레멘타인 결말은 볼때...클레멘타인은 본것 후회할때...  
7-31-2013,2013,7,31,20:43,수요일,10,1201,50,딤플(joyf****),이걸 한번 보지 않은 사람과는 친구가 되지 말고 두번 보지않은 사람과는인생을 논하지말고 세번보지 않은 사람과는 철학을 논치말라  
6-29-2013,2013,6,29,00:58,토요일,10,1144,44,lege****,모든영화는 클레멘타인의 야류작에불과하다  감독이하 출연진여러분께 감사합니다평생잊지못할 감동을 화면에남겨줘서  
6-24-2014,2014,6,24,19:33,화요일,10,1101,20,금단현상(imr5****),"이런 영화를 이제서야 본 저에게 화가납니다. 영화본뒤 소장하고 싶어서 소장용 dvd를 여기저기 알아봐도 판다는 사람이없네요. 돌아오는 질문은 모두 하나였습니다. ""본인이라면 이영화를 돈받고 파시겠습니까?"" 할말이 없더군요..  "
7-5-2013,2013,7,5,20:35,금요일,10,1028,28,B2B영업의정석(k210****),"도대체 이런 말로 표현할 수 없는 감동을 주는 영화를 나는 왜 27살 이 나이에 이제야 보게 됐단 말인가? 방황하던 10대에 이 영화를 보았더라면, 나는 지금과는 정 다른 방향의 삶을 살고 있을 것이다.  "
3-31-2014,2014,3,31,15:42,월요일,10,1011,24,alco****,무명 스턴트 배우였던 스티븐 시걸을 세계적인 스타의 반열에 오르게한 명작.  
6-22-2013,2013,6,22,16:08,토요일,10,995,40,소크라테스(book****),크래딧이 올라갈 때 가슴속에서 뭔가 뜨거운 것이 울컥하고 쏟아졌다. 그 자리에서 주저않아 꺼이꺼이 울 수 밖에 없었다.  눈에서 물클한 것이 가시지를 않았다. 어느정도 감정을 추스렸을 때 진정한 사나이의 삶을 보여준 이동준 형님께 감사함을 느꼈다.  
7-13-2013,2013,7,13,02:52,토요일,10,980,45,문(das0****),제한클. 제발 한국인이면 클레멘타임 봅시다  
6-5-2013,2013,6,5,08:36,수요일,10,850,43,7510****,감히 평할수없는 완벽한 영화에요 액션 감동 스토리뭐하나 흠잡을수없는 왜 이영화가 흥행못했는지 모르겠네요  
8-16-2014,2014,8,16,21:42,토요일,10,702,11,idea****,"사실 신이 클레멘타인을 제일 먼저 만들었고, 그걸 자랑하기위해 세상을 만들었다.  "
7-20-2013,2013,7,20,14:06,토요일,10,731,43,누우우우(zomb****),보지않고도 10점을 줄 수 있는 유일한 영화!! 포스터에서부터 느껴지는 감동의 향연!!  
7-17-2014,2014,7,17,03:09,목요일,10,677,15,이동준(lore****),로또1등이 되면 제일 먼저 하고 싶은일은? 이란 질문에 저도 모르게 피식 웃었습니다. 클레멘타인은 로또1등이 안되어도 볼수 있었기 때문이죠  
6-4-2013,2013,6,4,19:41,화요일,10,685,32,kwha****,뭔가 보여드리겟습니다!!  
8-12-2013,2013,8,12,10:09,월요일,10,634,15,아이오유아(amax****),100분간의 러닝타임 120분간의 기립박수  
7-7-2013,2013,7,7,21:28,일요일,10,624,17,구구단대장(pred****),이 영화에 10점 주지 않는자...  돌을 던져라....  
7-14-2013,2013,7,14,17:17,일요일,9,634,28,신제국주의자(8903****),아~ 내가 감히 이 영화를  감당 할 수  있을까 저 환장할 평점이 모든걸 말해준다!  
7-18-2014,2014,7,18,04:27,금요일,10,619,16,김영석(dudt****),부인과 이혼소송중일때 마지막 선물로 이 영화의 DVD를 주었다. 지금 다시 같이 살고있다. .  
7-28-2014,2014,7,28,21:32,월요일,10,594,13,내이름은박옹옹(nang****),만약 내가 눈감기전 100분의 시간이 주어진다면 나는 클레멘타인을 한 번 볼 것이고 1000분의 시간이 주어진다면 클레멘타인을 10번 볼 것이며 10000분의 시간이 주어진다면 클레멘타인을 100번 보고 눈을 감을것이다.  
7-6-2013,2013,7,6,14:18,토요일,10,622,50,천기노인(vont****),월드워z  연관영화로 정말 오랜만에 다시방문했네요 ... 뜨거운 가족애가 닮긴것이 월드워z 와 닮았어요  재미는 월드워z가 좀더 있지만 감동은 이영화가 더 있었습니다  
6-6-2013,2013,6,6,12:57,목요일,10,594,25,USSR(ussr****),누가 감히 이 영화를 욕하는가  
1-28-2014,2014,1,28,03:37,화요일,10,677,114,당신이주인공(hide****),저 아베총리입니다. 이영화를 보고 한국인으로 귀하합니다.그동안 잘못했어요 독도에서 줄빠따 맞겠습다. 영화에 힘이란 이렇군요  
7-23-2013,2013,7,23,02:17,화요일,10,577,16,gene****,전 이영화를 평가할 자격이 없습니다  
6-24-2013,2013,6,24,13:29,월요일,10,564,16,안드레아(andr****),이영화가 10년전 영화라니.....만약 요즘 기술로 만들어졌다면 얼마나 더 높은 평점을 기록할것인가가 심히 궁금스럽다.  
6-7-2013,2013,6,7,22:41,금요일,10,546,29,유케(dbsg****),아놔 ㅋㅋㅋㅋ 연관영화가 더웃겨 ㅋㅋㅋㅋㅋㅋㅋㅋㅋㅋㅋㅋㅋㅋㅋ  
7-17-2014,2014,7,17,13:10,목요일,10,493,10,병뚜껑(open****),"이 영화dvd를 윗집에 선물로 드렸더니, 그날 저녁부터 층간소음이 사라졌고, 저에게 참회의 눈물을 쏟으며 수박과 참외를 가져다주었습니다. 그 후 윗집과는 가족같이 지내고 있습니다.  "
10-16-2014,2014,10,16,02:26,목요일,1,535,52,jesu****,1점이 아니다 내 마음속에 1등이라서 1점이다!  
6-28-2017,2017,6,28,19:33,수요일,1,556,83,녹침(muca****),미래에서 왔습니다. 당신 아들이 태어났다는 소식 알려드립니다. 이제 욕먹을게 반으로 줄었군요. 아들 이름이요? 리얼이라고 하던데....  
1-6-2015,2015,1,6,22:57,화요일,10,457,7,베르뜨(dudt****),만약 노아가 살아있었다면 이영화를 방주에 실었을것이다 .  
7-15-2013,2013,7,15,12:57,월요일,10,432,13,건빵(ghy1****),근데 이거 속편 안나오나요? 10년째 기다리는데..ㅜㅜ  
7-25-2013,2013,7,25,05:48,목요일,10,469,50,잭도우(tcup****),"나는 한때 할램가에서 마약을 하며 인생을 낭비했?매일 소매치기를 하며 생활비를 마련했다 어느날 소매치기 한 가방에서 클레멘타인dvd를 발견했다 그영화를 본후 난 한나라의 대통령이 될수있었다 ㅣ. 기억해라 한마디면 된다 ""아빠 일어나!!"" -버락오바마-  "
4-23-2014,2014,4,23,22:08,수요일,10,387,8,김재철(aaba****),네이버 평점은 거짓말을 하지 않는다.  
7-17-2014,2014,7,17,17:55,목요일,10,373,11,스필반(noba****),"나는 재미교포 3세로 이영화를 보기전까진 한국어를 하지못했습니다.저는 이영화를 보고  한국인의피가흐른다는것을 너무도감사하게생각하게되었습니다.이영화를계기로저는10년간  한국어를 연마하였고 제가 처음 받아쓰기 했던 단어는 당연히 ""클레멘타인""이었습니다.  "
5-31-2013,2013,5,31,08:58,금요일,10,358,7,씨비스킷(kkw1****),"힘든 순간마다 감동 깊게 본 이 영화가 떠오른다. 얼마 전 등산을 하다가 발을 삐었다. 너무 아파 헬기를 부르고 싶을 정도였지만 어디선가 들려왔다. '아빠 일어나!' 난 일어섰고 정상에 올랐다. 그날 만큼은 난 준리였고, 산은 스티븐 시걸이었다.  "
9-16-2014,2014,9,16,12:15,화요일,1,378,29,후니(spir****),클레멘타인은 나만 보고 싶은 마음...이기적인건가요?  
6-4-2013,2013,6,4,13:30,화요일,10,341,13,박씨(tpwn****),한국 최고 아니 세계 최고의 영화  
7-3-2013,2013,7,3,23:56,수요일,10,336,9,sjwn****,내 머리속에는 이 영화의 모든 것이 생생이 떠오른다. 무려7~8년이란 세월이 지났지만 하나하나의 장면은 나를 삶에 몰입하게 만든다. 영화가 생각나면 주위는 환경이 될뿐이다. 가장 큰 깨달음은 영화를 통해 쓰러져도 다시 일어날 수 있는 큰 용기를 얻었다  
7-18-2014,2014,7,18,01:01,금요일,10,334,9,닥터발란셰(vall****),클레멘타인을 안 본 사람은 있어도 한번만 본 사람은 없다.  
8-9-2015,2015,8,9,15:17,일요일,10,323,8,주차금지(lcky****),우울할 때.. 여기 영화평 보러 온다.  
6-23-2013,2013,6,23,04:58,일요일,10,304,13,알라신파리구공(alas****),눈물나옴...  
8-24-2016,2016,8,24,10:45,수요일,1,361,76,30(elti****),이영화를보고 암이 나았습니다. 암세포가 암에걸려 뒈졌기 때문이죠.  
2-20-2014,2014,2,20,18:33,목요일,10,283,8,forz****,두 유 노우 클레멘타인?  
7-29-2013,2013,7,29,15:29,월요일,10,277,10,always맑음(inte****),영웅:샐러맨더의 비밀을 보고 알게되었습니다. 또 하나의 명작이 있었다는것을... 왜 이제서야 이런 명작들을 알게 되었는지 제 삶에 후회가 드네요..  
6-12-2014,2014,6,12,03:17,목요일,10,274,12,leep****,길가다 어떤 고딩이 친구들끼리 야 아저씨 개멋있지않냐?? 이러길레 뒤통수를 ㅈㄴ게 후려치며 말했습니다.  Do you know clementine??  
7-17-2014,2014,7,17,10:14,목요일,10,256,9,WhyRegret(whyr****),미국에서온 국제학생 마이클이라고 합니다. 애틀랜타주에서 다이어트 위해 태권도장을 찾은후 관장님의 서재에서 클레멘타인 DVD를 몰래훔쳐 보게되었습니다. 미국인을 비하한것같아 찝찝했습니다. 아빠! 일어나 라는 환청이 들려 깨보니 한국행 비행기 안이었습니다  
7-26-2013,2013,7,26,03:20,금요일,10,263,16,물망초(rncj****),울면서봤습니다. 내일보면 3번째네요  
7-21-2013,2013,7,21,15:44,일요일,10,289,45,bill****,아빠 일어나.... 이 한마디에 모니터도 울고 외장하드도 울고 숨어있던 바이러스도 울었다.  
7-18-2013,2013,7,18,15:15,목요일,10,249,6,jyh1****,엔딩을 보는순간 온몸에 전율이 흘렀고 팬티는 젖어있었다.  
7-17-2014,2014,7,17,14:42,목요일,10,243,8,게리옹(kei0****),이 영화를 본 후 외장하드에 있는 모든 영화를 지웠다 다른 영화들 사이에 이 영화를 놔둔다는 것은 클레멘타인에 대한 모독이다.  
6-28-2013,2013,6,28,20:36,금요일,10,246,15,jung****,11점이 없어서 10점 드립니다  
4-4-2016,2016,4,4,16:59,월요일,10,229,9,동칠이(answ****),안.녕.하.세.요.알.파.고.입.니.다. 이.영.화.는.인.간.이.만.들.수.있.는.것.이.아.닙.니.다. 저.의.패.배.입.니.다.  
12-5-2016,2016,12,5,01:27,월요일,1,240,20,세입클럽(dbst****),"이영화를 친구들과 보다가 친구를 모두 잃었습니다..모두 감동의 쓰나미에 쓸려 다 떠났기 떄문이죠. 1점의 의미는 세계1위 명작이라는 의미입니다.하..10년이 지난 지금도 이말이 잊혀지지가 않네요.""아빠 일어나!!""  "
2-23-2014,2014,2,23,20:07,일요일,10,217,10,godehd1035(godr****),알바년들아 평점깎지 마라 ㅡㅡ 진짜 영화보고 운 적은 처음이다...  
7-19-2013,2013,7,19,12:57,금요일,10,212,8,푸파이터(khmj****),"대부, 쇼생크 탈출, 시네마 천국......... 그리고 클레멘타인..  "
7-25-2013,2013,7,25,10:43,목요일,10,211,12,dnjs****,클레멘타인은 인생 그 자체다. 인생의 희노애락을 한편의 영화에 그대로 녹아들게한 감독의 천재성에 갈채를 보낸다. 내 인생을 통틀어 이보다 더 나은 작품을 볼 수 없을거란 예감에 슬프기 까지 하다.  
1-20-2015,2015,1,20,02:22,화요일,10,206,10,나그네(toco****),베스트리플보니 온통 오바투성이네 그렇게 대단한영화는아니고 쇼생크탈출이나 다크나이트급 영화라고보면된다  
9-8-2013,2013,9,8,01:36,일요일,10,196,9,b1ue****,"이제 제 영화 인생 20년, 그동안 6~700 에 육박하는영화를 보고 가차없이 평가를 내리고 물어뜯었습니다. 이 영화도 그랬냐고요? 아니요, 처음으로 느꼇습니다. 영화는 글로 표현될수있는게 아니라, 그 자체로 충분하다는것을...  "
6-28-2017,2017,6,28,10:53,수요일,10,193,10,skyking(sky0****),■리얼평점보고들어온사람.손  
6-12-2014,2014,6,12,21:23,목요일,10,188,11,cjswo(kasi****),내 나이 72살.. 이젠 늙어 눈물이 메마른줄 알았는데 이 클레멘타인 이란 영화를 보고 몇OO만에 사라진줄 알았던 눈물을 되찾았다. 덕분에 혈색도 좋아져 대머리였던 내 머리에 뿌리가 솟구치고 있으며 근래에 들어선  발기까지 가능하게 되었다.  
7-17-2014,2014,7,17,14:30,목요일,10,188,13,SeungA(raph****),집에서 기르는 강아지와 함께 이영화를 보았습니다. 그런데 앤딩크레딧이 올라가자 우리 뽀삐가 직립보행을 시작하는 것이었습니다. 정말 기적과도 같은 영화입니다. 할렐루야  
7-5-2013,2013,7,5,11:34,금요일,9,199,26,늙은여우(bbon****),너무 장난스럽게 그러면 이 영화에 대한 신빙성이 떨어지죠. 10점은 말도 안되고 9점은 받아도 되는 영화입니다. 물론 저는 아직 이 영화를 한번 밖에 안봤습니다.  
12-28-2013,2013,12,28,04:25,토요일,10,170,5,saym****,도대체 3D 블루레이 버전은 언제나오나요... 기금모금이라도 하고 싶습니다.  
10-10-2013,2013,10,10,18:19,목요일,10,174,9,보노(hico****),바티칸에서는 이영화  필름을 보관중이며  매일 이영화를 만든 제작자와 감독을위해 기도를 드린다고합니다.  
6-13-2013,2013,6,13,23:19,목요일,10,172,9,I9(dlwo****),"밑의 분 너무하시네요. 이런 명작을 폄하하시다니, 이 영화를 보신적이 있으시기나 한가요? 저는 아직까지 여운이 진득하게 남아 눈에 아른거려 마음 한편이 아려오네요..  "
4-30-2019,2019,4,30,20:31,화요일,10,163,2,aaaab(duk7****),한국남자에 시집오길 오늘에서야 잘했다는 생각이 드네요  
7-25-2013,2013,7,25,01:47,목요일,10,168,8,roke****,1분이 1초 같아요  
6-11-2014,2014,6,11,23:52,수요일,10,159,7,시댕들(icet****)," 이영화를 보고나서 아버지 방으로가서 주무시고 계시는 아버지의 얼굴을 물끄러미 쳐다봤다 . ""아빠 일어나"" 아직도 대사가 머리에 맴돌며 눈물이 났다.  "
11-8-2014,2014,11,8,15:38,토요일,10,155,8,moi1****,이 영화를 보고 암세포가 암에 걸려 뒤졌습니다  
7-28-2016,2016,7,28,23:07,목요일,1,161,21,or39****,"이것은 영화에대한 평가가아니다, 애초에 평가를 할수가없다, 이영화를 이제서야본 내자신에대한 점수이다.  "
6-17-2014,2014,6,17,12:00,화요일,10,141,3,sws2****,난 영화공부를 하고있는 학생이다.사람들은 내게 영화추천을 해달라고 한다 그러면 나는 한치의 망설임도 없이 말한다  '클레멘타인'이라고..  
2-20-2014,2014,2,20,12:11,목요일,10,143,9,고사리곰(thck****),"이 영화를 보니, 고장났던 제 키보드가 살아났습니다.  "
11-22-2018,2018,11,22,19:10,목요일,10,135,2,라이너(rain****),"이 영화를 보기 전의 저는 우물 안 개구리였습니다. 클레멘타인을 보고 나서 영화를 보는 시야가 넓어졌습니다. 장님이 눈을 뜬다더니, 이런 것인가 봅니다. 위대한 클레멘타인 영원하소서.  "
6-10-2015,2015,6,10,12:46,수요일,10,137,4,aqaz****,울었는데 눈물이 10점을 눌렀습니다  
9-16-2014,2014,9,16,20:09,화요일,10,138,9,없음(yhg4****),저는 발기부전이었습니다. 하지만 아빠 일어나를 듣고 벌떡 일어섰습니다.  
2-8-2015,2015,2,8,18:02,일요일,10,127,1,월드워g2(migg****),암 치료제는 이미 2004년에 발명이 돼있었군요.  
6-24-2013,2013,6,24,18:29,월요일,10,135,9,안정환(belo****),눈물로 시작해서 눈물로 끝난 대작중의 대작  신이시여!! 정녕 인간의 한계는 어디까지인지요?? 월드쥐 때문에 다시금 방문하여 별 100개라도 찍어드리고 싶지만 그러지못해 안타깝습니다~~~  
6-3-2013,2013,6,3,01:58,월요일,10,125,4,pastaman(past****),아빠! 일어나!  
6-21-2013,2013,6,21,11:10,금요일,10,126,5,홍일이(hell****),눈물이 멈추지 않을것이다...영화를 본후 자신들의 삶이 얼마나 소중한지 느끼게 될것이다...  
6-24-2013,2013,6,24,15:49,월요일,10,127,6,정싸(yest****),아직도 가슴한켠이 아련합니다. 우리 생애 최고의 영화.. 클레멘타인..  
6-3-2013,2013,6,3,19:59,월요일,10,136,16,seaw****,정말 감동이란 말로는 표현할수 없습니다. 너무 감동적이어서 자살하고 싶네요.  
7-2-2013,2013,7,2,02:24,화요일,10,130,11,Amylase(qwdf****),클레멘타인을 뛰어넘는 영화가 또 나올까...ㅠ  
7-3-2015,2015,7,3,19:26,금요일,1,143,26,암사자(namp****),원작의 감동을 느끼고 싶어서 중고나라에서 79만원 주고 비디오 구했습니다. 지금 키보드에 눈물흘리면서 평점 남기고 있네요....평점 낮은 순으로 보려는 사람들한테도 알려주고 싶어서 감히 1 점 매겨보았습니다.  
2-14-2014,2014,2,14,14:41,금요일,10,120,6,deerhunter(rdhu****),영화를  안 봤는데도 눈물이 나온다. 분명 이 영화는 명작임에 틀림없다.  
8-18-2013,2013,8,18,14:02,일요일,10,121,7,오빠의꿈(inkm****),아 정말 미치겠다. 댓글보다가 너무 웃어서 기도 막혀 질식사 할 뻔 함.10점!! 오로지 10점!!!  
1-22-2015,2015,1,22,02:42,목요일,10,113,2,코코샤넬(red_****),자꾸 1점테러하는 분들 마음 이해는 갑니다. 이 벅찬 감동 혼자만 느끼고 싶은 마음.. 저도 잠시나마 흔들렸네요.  
2-12-2014,2014,2,12,02:33,수요일,10,117,8,asdf****,내게 3가지 소원이 있다면 첫째는 전세계인이 클레멘타인을 보는것이고 둘째도 전세계인이 클레멘타인을 보는것이고 셋째는 이 영화를 보기 전으로 돌아가는것이다  
7-2-2013,2013,7,2,20:19,화요일,10,103,6,레지스탕스(hunt****),이 영화가 아카데미 노미네이트 되지 않은게 아쉬울 따름..ㅠㅠ  
6-6-2013,2013,6,6,23:59,목요일,10,100,5,thou****,으리로 봐주아야 할 영화지!! 으리으리한 걸작 !!  
7-17-2014,2014,7,17,17:37,목요일,10,99,5,알(smg2****),"한 갑부가 죽으면서 유언을했다.집과 땅은 자식들에게 나눠주고,돈과 보석은 가난한사람들에게 나눠주고, 클레멘타인dvd는 자신의 관에 넣어달라고  "
5-27-2013,2013,5,27,20:22,월요일,10,94,3,sjp6****,단언컨데 이 영화는 가장 큰 축복입니다  
10-8-2013,2013,10,8,16:52,화요일,10,98,7,데르토(rmer****),http://bbs3.agora.media.daum.net/gaia/do/petition/read?bbsId=P001&articleId=144201 당신들이 인간들 이라면 클레멘타인 3d 재개봉 청원에 서명 해주세요!  
2-12-2016,2016,2,12,09:11,금요일,10,90,1,reds****,아버지가 이 영화를보고 잘떄도 일어나서 주무십니다  
9-2-2014,2014,9,2,12:59,화요일,10,93,4,늴리리(dose****),이 영화를 11개월된 딸과 함께 봤는데 앤딩 크레딧이 올라갈때쯤 갑자기.. 아이가 눈물을 흘리며 아빠 일어나!를 외쳤습니다.  제 딸이 언어를 깨우치게 해주셔서 너무 감사합니다..  
8-15-2017,2017,8,15,21:09,화요일,1,107,24,NAca(crom****),"리얼이 그냥 커피면, 클레멘타인은 TOP다  "
8-23-2016,2016,8,23,16:04,화요일,1,97,15,구름이(ultr****),재미있고 감동도있었는데 같이본 친구들이 하도 서로 부둥껴 안고 펑펑 울어싸서 몰입도가 좀 낮았음. 이래서 혼자 봐야하는 영화인가보다.같이보기 힘든영화이므로 좋은평점 못주겠다.영화는 모두가 같이 봐야할수있게 만들어야하는데 지나치게 감동적인건 이런게 흠  
2-14-2014,2014,2,14,12:08,금요일,10,85,6,나는 전설이다(sofd****),ㅜㅜ... 내나이 16세... 인생이란게 무언지 새삼스레 깨달았다....   하아....  
7-5-2013,2013,7,5,19:19,금요일,10,90,11,christopher(wet0****),"이 영화는 정말 삶의 끝자락에서 끝없이 불어오는 삭풍의 시련에 힘겹게 비틀거리는 이시대의 천춘들과 가장, 집에서조차 인정받지 못하고 희생만 하시는 어머니. 범죄에 발을 들여 놓아 뉘우치는 등 희망이 필요한 사람들에게 비추는 한줄기 서광과 같은영화입니다  "
1-9-2018,2018,1,9,16:06,화요일,10,77,2,김스카이(hane****),이것이 진시황이 그토록 찾아  헤맸던 전설의 불로초 '굴레만다인' 인 것입니까?  
6-2-2013,2013,6,2,11:04,일요일,10,81,6,godt****,내인생 최고의 영화!!!!!  
7-20-2014,2014,7,20,21:09,일요일,10,77,3,멋쟁이(zjan****),세계기록유산으로 감히 등재를 청원합니다.  
10-13-2013,2013,10,13,22:49,일요일,10,78,4,ddddd(skar****),요즘 10대들 클레멘타인 안보고 이상한 것만 보니까 싸가지가 없지.  
6-2-2015,2015,6,2,18:49,화요일,10,77,4,원더(irim****),나는 미쿡긴입니다  나의 한국친구가 DVD  보내다 내가 받았어요.  나는 할말을 읽코말았 습니다. 정말 감동적입니다. 나는 눈물도 났어요. 나는 한번도 그러지안았어요. 너무 캄사합고 고맙습니다.  나는 소녀시댈를 좋아합니다. 한쿡가고싶퍼요  
7-16-2014,2014,7,16,21:51,수요일,10,78,5,라시드(wnwh****),오늘 라스에 나온답니다 클멘  
7-17-2014,2014,7,17,19:06,목요일,10,91,19,숲속의사냥꾼(kiki****),"유영철, 강호순, 정남규 그들도 영화 클레멘타인을 보았더라면 무고한 생명들이 죽지 않았을 뿐더러 자신의 가족을 위해 충실하고 열심히 살았을텐데 주변에 사이코패스끼가 보이는 이가 있다면 이 영화를 꼭 보여주세요.  "
7-17-2014,2014,7,17,15:34,목요일,10,75,4,dusc****,클레멘타인을 재개봉하지않는다면 한국영화계는 썪은것이다.  어른들이 미안해.!  
6-29-2017,2017,6,29,18:01,목요일,10,76,5,윤영준(twil****),클레멘타인 형님 득남 축하합니다 리얼아 건강하게만 자라다오  
7-19-2013,2013,7,19,03:22,금요일,10,83,12,하나이(alea****),"3번 본 제가 부끄럽네요.아직도 감동의 쓰나미가 사그라들지 않습니다. 대한민국 최고의 액션과 드라마를 크레멘타인에서 확인하세요. 액션의 액션, 감동의 감동 아빠 일어나~ 눈물난다 정말. 이영화를 추천해 주신 모든분들에게 감사합니다.ㅅㅂ.  "
12-23-2014,2014,12,23,04:13,화요일,10,72,2,지구사람(pppj****),46억년 전 지구가 이 영화의 존재를 알았다면 자신이 생성되는 것을 스스로 막았을 것이다.  
7-17-2014,2014,7,17,23:05,목요일,10,73,3,봉이동동(bong****),전세계 동시개봉으로재개봉 해야한다.  
4-23-2014,2014,4,23,22:21,수요일,10,76,6,New age(bomy****),인류는 클레멘타인을 보기 위해 생겨난 생물이다  
9-6-2014,2014,9,6,16:16,토요일,10,65,2,HolyGuitar(kime****),진짜 한번 속는셈치고 봐라  
7-17-2014,2014,7,17,10:17,목요일,10,69,7,뮤즈(enig****),똥꼬쇼만 보여줬어도 1000만 관객 돌파했을텐데...  
7-23-2015,2015,7,23,22:31,목요일,10,63,2,98dl****,돈을 잃으면 적게 잃은 것이다.명예를 잃으면 많이 잃은 것이고클레맨타인을 보지 않았다면 전부를 잃은것이다..  
8-4-2013,2013,8,4,20:58,일요일,10,66,5,루키(yang****),16일 입대합니다 군대가기전에 마지막으로 다시보겠습니다  
4-6-2014,2014,4,6,02:35,일요일,10,65,5,xrrc(elsn****),드릴 수 있는 별이 다섯개 뿐이라 죄송합니다  
6-21-2013,2013,6,21,17:17,금요일,10,67,7,didr****,소문듣고 동네 비됴가게에서 빌려봤는데 괜히 칭찬받는건 아닌듯;  
6-12-2014,2014,6,12,23:03,목요일,10,67,8,뽀뻐빠삐(luck****),클레멘타인을 안본사람은있어도 한번본사람은없다  
3-16-2014,2014,3,16,16:15,일요일,10,63,5,MiraCle(seoj****),시걸: 5분 출연하고 주연이 되는 기적을 보았습니다.  
5-3-2014,2014,5,3,17:12,토요일,10,62,5,기다림(jaso****),"그 동안 네이버 평점을 믿지 못하고, 이 영화를 외면해온 제 자신이 원망스러울 뿐 입니다. 더불어, 이런 깊은 감동과 여운을 혼자 간직하지 않고, 다른 이들과 함께 나누는 네티즌 여러분들의 사랑과 나눔에 감사할  따름입니다. 감사합니다. 네티즌 여러분  "
7-15-2013,2013,7,15,22:04,월요일,10,63,6,폭시(anhe****),스티븐OO과 태권보이 동준이가 나오는데 뭔말이 필요하냐. 닥치고 10점 가는거다. 1점 주는 진지한색히들은 뭔데?  
12-10-2017,2017,12,10,23:14,일요일,1,73,16,호옹(hong****),13년이 지났음에도 불구하고 평점이 9점대를 기록하고 있는 이 명작을 아직 보지 못한 나에게 화가 나 1점을 드립니다... 영화를 보고 난 후 진정한 자아를 찾은 후에 10점을 드리겠습니다  
5-1-2017,2017,5,1,01:14,월요일,10,57,1,향연(dnjs****),한국사 서술형 시험 1번답에 클레멘타인 2번답에 아빠 일어나 라고 적었더니 다맞았습니다  
7-17-2014,2014,7,17,03:22,목요일,10,58,2,아닌데(biho****),주무시는 아버지에게 이렇게 말하고 싶습니다. 아빠 일어나!!  
7-17-2014,2014,7,17,00:51,목요일,10,60,4,망구스(ghdu****),"남자는 일생에 3번 운다고 하죠. 태어났을 때, 부모님이 돌아가셨을 때, 마지막으로 클레멘타인을 볼 때.  "
1-26-2017,2017,1,26,20:16,목요일,1,65,9,이윤환(gimm****),저는 이 영화를 평가할 자격이 없습니다....  
8-5-2015,2015,8,5,22:33,수요일,1,68,12,고래더듬이(godo****),이것은 1점이 아니다내인생 1등영화를 알려주는것이다  
6-25-2017,2017,6,25,23:55,일요일,10,58,3,David Beckham(worm****),"한미 정상회담을 위해 트럼프가 인천공항에 도착한 후 한 첫마디.."" 여기가 클레멘타인의 나라 인가요?""  "
7-7-2013,2013,7,7,00:55,일요일,10,58,3,체리(c_p_****),아메리칸뷰티를 뛰어넘는 수작  
10-19-2015,2015,10,19,16:06,월요일,10,60,5,별에서온주신(ddai****),매일매일 주님께 기도드립니다.클멘타인을 보기전의 나로 돌려놔 달라고.. 처음 본 그 감동을 느끼게 해달라고.하지만 주님은  그 기도를 들어주지 않아.결국 머리를 깎고  불가로 입적했습니다. 그리고 매일 불경을 외웁니다.. 나무아빠일어나라타불~  
7-18-2014,2014,7,18,06:21,금요일,10,57,3,집짓는 블루스(rand****),온 국민을 똘똘 뭉치게하는  영화!  
1-13-2018,2018,1,13,12:01,토요일,1,61,7,it소년(cky0****),이 점수는 지금까지 이 영화를 보지 않았던 저에게 주는 점수입니다.  
4-12-2014,2014,4,12,18:08,토요일,10,56,3,김춘진(solc****),당신의 삶이 3일 남았다면 첫째날은 세상을 둘러보아야하고 둘째날은 사랑하는이를 보아야하며 마지막날에는 클레멘타인을 보아라. 그리고 느낄것이다 평화를 사랑을 ...  
2-28-2017,2017,2,28,22:41,화요일,10,57,4,공학사(jaed****),나를 욕하는 사람은 참을수 있습니다만 클레멘타인을 욕하는 사람은 참을 수 없습니다.  
6-7-2013,2013,6,7,00:48,금요일,10,57,4,MESSI 10(zang****),이 영화 꼭 보세요!! 강추입니다!! 영화사의 한 획을 긋는 영화네요!!  
4-10-2017,2017,4,10,10:40,월요일,10,53,1,sada****,현재 2017년 4월 10일..16800여명의 참여 평균평점 9.31 긴말 필요없다..전설엔 이유가 있는법...  
10-19-2015,2015,10,19,17:49,월요일,10,55,3,김큰별(ckkk****),안구건조증으로 병원에 가니 이 영화를 추천하더군요. 그것이 어느덧 5년 전... 아직도 눈물이 멈추지 않습니다.  
8-14-2014,2014,8,14,18:09,목요일,10,55,3,peng****,이제그만보자며 다짐햇지만 손가락은 이미재생버튼을 클릭하고잇다...  
7-17-2014,2014,7,17,18:24,목요일,10,55,3,ㅡㅡ(mgh0****),불치병들이 다 나았는데 이 영화가 최고가아니고 뭔가  
5-23-2013,2013,5,23,16:37,목요일,10,55,3,아톰(atom****),진짜다! 진짜가 나타났다!!  
11-7-2014,2014,11,7,02:25,금요일,10,53,2,감자(gnsw****),"영하를 보고 전 더 이상 이보다 아름다운 것은 업ㅅ다고 학신하였고 듀 눈을 찔렀숩니다. 10년이 지난 지금가지도 휴회는 없습니댜. 다마ㄴ 아직까지됴 타자는 익숙치가 않네요 그레도 한펀도 틀려 본 적이 없는 단어갸 있녜요 ""클레멘타인""  "
9-1-2014,2014,9,1,11:32,월요일,10,54,3,핑키(medi****),이 영화를 회사에서 몰래보다 걸렸습니다. 하지만 이내모든것이 용서 되었고 전 업무능력평가 에서 우수한 성적을 거둬 진급까지 하였습니다. 사랑합니다.  
4-6-2017,2017,4,6,16:29,목요일,10,55,4,Rio Oh(rior****),"이 영화dvd를 윗집에 선물로 드렸더니, 그날 저녁부터 층간소음이 사라졌고, 저에게 참회의 눈물을 쏟으며 수박과 참외를 가져다주었습니다. 그 후 전 윗집 아내와 살고 있습니다  "
7-28-2014,2014,7,28,17:49,월요일,10,57,6,독설가(c591****),최근에 알게되어 30대에 보게 되었습니다.개봉즉시 보지 못한 죄책감에 지금 마포대교 가고 있습니다..  
7-29-2014,2014,7,29,18:42,화요일,1,90,39,김해미(zzan****),이영화를본지도 벌써5년 아직도 감동의 여운이 가시질않아 앉은뱅이 생활중입니다. 다리에 힘이 들어가질않습니다.  
5-6-2015,2015,5,6,23:10,수요일,10,53,3,해오리(kdse****),저는 심영입니다. 클레멘타인을 보고  고환이 돋아났습니다.  
11-23-2014,2014,11,23,15:27,일요일,10,54,4,귀요미(ys29****),얼마전 돌아가신 큰아버지께서는 유언으로 클레메타인 dvd 와 같이 뭍어 달라고 하셨습니다. 이유가 궁금은했지만 물어보지 않았습니다. 아무래도...수 십 년 후 저 또한 그럴것이기에...  
6-28-2017,2017,6,28,14:56,수요일,10,58,8,만인의여인o(juju****),아 ㅋㅋㅋ리얼때메 리뷰 찾아봄 ㅋㅋ미친듯 웃고 있네 ㅋㅋ아 ㅋㅋ네티즌 ㅋㅋㅋ최고다 ㅋ ㅇㅈ ㅇㅈ ㅋㅋ 영화보다 리뷰로만 10점 준다 ㅋㅋ  
8-17-2014,2014,8,17,10:09,일요일,10,49,0,suba****,"메멘토, 셔터아일랜드, 아이덴티티 이후로 이런 반전영화는  처음이다...보는내내 식은땀이 흐르고, 마지막 반전은 아직도 나를 손떨리게 만든다. 영화의 장르는 2가지로 나눌 수 있다. 클레멘타인과 클레멘타인이 아닌것으로...  "
11-28-2014,2014,11,28,20:08,금요일,10,51,2,윈드포스(gmwf****),정확히 어제 밤에 클레멘타인을 보았다... 이제서야 이 영화를 만나게된 나 자신이 어이없었다 . 그리고 2편의 개봉소식... 1편이 암을 치료하기 위한 목적이라면 2편은 에볼라치료를 위한 목적이 아닐까?  
9-12-2014,2014,9,12,15:59,금요일,10,52,4,한화천사(cdwi****),평점이 너무 좋아서 기대하고 봣는데 약간 실망감도 드네요... 그냥 타짜 정도 수준의 웰메이드 국내영화인듯. 9점 줄까 하다가 제작연도를 감안해 10점 줍니다.  
5-15-2016,2016,5,15,01:41,일요일,10,46,0,장은석(dmst****),안녕하세요 모 대학병원 원장입니다. 우리 병원에서는 클레멘타인을 이용한 치료법을 실시하여 병명을 불문하고 환자 완치율 100% 를 보여주고 있습니다.  
5-1-2017,2017,5,1,09:33,월요일,10,49,3,tjdg****,아버지가 발기부전으로 힘들어하셨는데 이 영화에서 '아빠 일어나!' 이 대사덕분에 아버지 그곳이 일어났습니다.  
9-16-2014,2014,9,16,12:25,화요일,10,50,4,b_da****,"5년 사귄 여자친구와의 관계가 소홀해질쯤 DVD방에서 이 영화를 빌려보았습니다... 영화가 끝난 후 여자친구와의 관계는 설레였던 첫 연애시절로 돌아갔고, 클레멘타인을 본 날 저희는 3명이 되어 DVD방을 나올 수 있었습니다. 감사합니다.  "
6-2-2013,2013,6,2,22:07,일요일,10,50,4,kris****,영화를 보며 전율이 돋았다. 아빠 일어나!  
7-27-2014,2014,7,27,09:25,일요일,10,47,2,그물잡이(jmg0****),이슬람인에게 라마단 시간이 있다면 나에겐 클레멘타인 시간이 있다.  
7-17-2014,2014,7,17,20:19,목요일,10,47,2,engl****,십점 만점에 씹점 드립니다.  
4-27-2017,2017,4,27,15:09,목요일,10,45,1,ancho(mund****),김정남이 암살된 것도 이 영화를 북으로  반입하려 했기 때문이라고 하네요. 이런 영화가 남조선에서 만들어졌다는 사실을 북한 주민들이 알게 된다면 겉잡을 수 없게 되었을 테니까요.  
7-3-2013,2013,7,3,08:31,수요일,10,50,6,skmv****,허....  
9-15-2014,2014,9,15,05:54,월요일,1,72,28,olal****,클레멘타인을 본  제 자신을 저주합니다. 이 영화를 본후로 그어떤 영화를 보아도 감동이 느껴지질 않습니다... 아 클레멘타인..  
5-28-2015,2015,5,28,12:21,목요일,10,45,2,조카크레파스(jty2****),빚이 2억이었습니다. 이영화를 본 후 연봉이 2억입니다.  
2-14-2014,2014,2,14,16:02,금요일,10,45,2,처제그만손빼(daca****),아아 보기전엔 몰랐다 이거슨 영화를 넘어선 세계인류문화유산이다  
6-24-2013,2013,6,24,15:59,월요일,10,45,2,puls****,무슨 설명이 더 필요하리오.  
5-28-2015,2015,5,28,17:28,목요일,1,62,19,돌프리(kent****),"10점 만점을 주고 싶지만, 내 눈가에 눈물이 너무 맻혀있어 화면이 보이지 않는다..  "
11-30-2015,2015,11,30,09:20,월요일,10,42,0,dats****,"클레멘타인  앞에선 영남,호남 지역 감정도 없다.  "
11-25-2017,2017,11,25,22:24,토요일,10,43,1,snuw****,이 영화를 안본사람과는 이야기를 나누지 않겠다.  
4-30-2017,2017,4,30,11:12,일요일,10,43,1,smsm112(liqu****),30세기에 나와야 될영화가 왜 벌써 나온건지... 시대를 너무 앞서 간거 같다. 이제 이세상 영화는 다 시시해서 못보겠네요  
7-19-2014,2014,7,19,00:46,토요일,10,43,1,akw1****,이영화를 봤다면 김보성주연영화 영웅  셀러멘더의비밀을 꼭보길바란다 한국영화의 양대산맥이다  
6-28-2013,2013,6,28,06:28,금요일,10,41,0,켄지(srss****),벅차오르는 감동에 온몸에 전율이 그리곤 온 몸에 쥐가 났다 결국 나는 끝까지 볼수없었다  
7-28-2014,2014,7,28,17:00,월요일,10,42,1,SJ(sung****),나는 오늘도 클레멘타인을 본다. 고로 나는 존재한다.  
2-10-2017,2017,2,10,09:07,금요일,1,57,16,root(trip****),10점만점도 부족한 영화지만 나만 소장하고 싶어 1점준다  
11-5-2016,2016,11,5,15:50,토요일,10,40,0,노보(link****),친구한테 추천을 받아서 봤는데 정말 이런 영화는 처음봅니다.. 이제 친구를 만나러 가볼까 합니다.  
7-17-2014,2014,7,17,18:06,목요일,10,42,2,로쏘네리(ssla****),박동준은 50억을 더 투자해서라도 4D로 재개봉 해야한다. 이영화가 이렇게 묻힐순 없다  
6-1-2013,2013,6,1,01:38,토요일,10,43,3,yeji****,명작 그 자체  
11-26-2015,2015,11,26,17:17,목요일,10,40,1,FTA(aafa****),알바들은 정말 대단하다. 어떻게 이런 대단한 영화를 1점주면서 욕할 수 있을까?  
6-30-2017,2017,6,30,14:46,금요일,1,47,9,sksksdkididi(kim2****),리얼을 보고 다시 찾아왔습니다 . 리얼이 클레멘타인의 뒤를 잇는 수작이라지만 클래식은 역시 클레멘타인 .. 한국 영화 역사 길이남을 업적을 남긴 이영화에 다시한번 11점 같은 1점주고갑니다  
2-3-2015,2015,2,3,14:02,화요일,10,38,1,기모찌(dnrw****),지구가 멸망하기전 2시간이 남아있다면 난 이 영화를 볼 것이다.  
1-23-2015,2015,1,23,22:34,금요일,10,39,2,ㅎㅇ(rlaw****),클레멘타인 안본 뇌 사고싶다진짜 제발  
11-22-2015,2015,11,22,06:16,일요일,10,36,0,히리깝또(no1d****),이영화를 한번도 안본사람은 있어도 한번만 본사람은 없을겁니다. 일주일째 회사도 안가고 70번째 보는중이네요.참 회사에서 대체무슨일로 결근하냐며 전화가 왔길레 클레멘타인이란 한마디만 했습니다. 과장님 한동안 흐느끼시면 백번채우시란 말만하고 끊으시네요  
4-24-2014,2014,4,24,19:42,목요일,10,39,3,군산촌놈(ssun****),웃음을 영영 잃어버렸다  
1-12-2015,2015,1,12,11:48,월요일,10,38,3,android(andr****),요즘같은 SNS시대에 개봉했으면 명량과 인터스텔라가 동시개봉에서 밀리는 영화입니다.  
12-16-2016,2016,12,16,19:30,금요일,10,35,1,브렛(syst****),농구는 몰라도 마이클 조던는 안다. 축구는 몰라도 펠레는 안다. 승마는 몰라도 정유라는 안다. 영화는 몰라도 클레멘타인은 안다.  
8-15-2014,2014,8,15,22:48,금요일,10,36,2,제네시스(cark****),라면을 먹으면서 이 영화를 보고있었는데 내가 라면을 입이아닌 코로 먹고있었다는 사실을 영화가 끝나고 나서야 깨닫게 되었다.  
7-12-2014,2014,7,12,18:00,토요일,10,36,2,곰새끼푸(jjw1****),친구중에 사이가안좋거나 껄끄러운 관계에 있는 분에계 추천하고싶다. 이영화를 줌으로써 껄끄러운 사이가 보다 완만해지고 더나아가 자신의 인생을 되돌아보는 인생에 있서 큰터닝포인트가 될듯 싶다. 영화를본지 1년이지난지금도 여전히 이영화만생각하면 심장이뛴다.  
6-12-2014,2014,6,12,17:07,목요일,10,35,2,권(cair****),똥꼬쇼를 전전하던 이동준을 일약 돈방석에 안게해준 영화...헐리웃을 정조준 하고있다..  
6-13-2013,2013,6,13,23:34,목요일,10,35,2,인민의벗(as_k****),인생의 방황기에 새로운 길로 들어서게 해준 영화....감상 후 한 동안 한국 영화를 볼 수 없었다. 그 어떤 영화도 이 영화에 비하면 쓰레기에 지나지 않았기에.  
6-30-2015,2015,6,30,23:20,화요일,1,47,14,shfbjdjd(gksw****),이것은 1점이아니라 1등 최고라는 뜻이다 내인생 최고의 걸작 그이름 클.레.멘.타.인  
6-29-2017,2017,6,29,19:49,목요일,10,32,0,좋은마음(leej****),명작이 묻히나했는데 리얼덕에 다시 재조명되니 기쁘네요  
5-1-2017,2017,5,1,15:39,월요일,10,32,0,콩신(0mar****),높은 평점에 속는 셈 치고 한번 봤습니다...정말... 말이 필요없는 영화더군요...  
12-4-2015,2015,12,4,23:04,금요일,10,32,0,CR디자인(didt****),명량 8.49 베테랑9.02 클레멘타인 9.28 말이필요해??  
10-16-2015,2015,10,16,15:25,금요일,1,54,22,무어슬(sooa****),슬프고 우울할때마다 새로운 한줄평을 보기위해 오늘도 이렇게 들어왔습니다. 그러고보니 별점을 남기지않았군요.  내 생애 영화중 무조건 1순위라는 뜻으로 1점!  
8-29-2018,2018,8,29,02:57,수요일,10,31,0,dang****,크리스토퍼 '놀란' 감독의 이름은 원래 크리스토퍼였다 이영화를 보기전까지는...  
8-1-2018,2018,8,1,23:12,수요일,10,33,2,혀니(tily****),"북한에 돈주지말고 클레멘타인 dvd를 보내라.김정은은 분명 핵무기를 포기하고 , 살도 빼고...헌신의 삶을 살게 될 것이다.  "
6-30-2017,2017,6,30,19:28,금요일,10,31,1,팹시(cjfg****),꽃이지고 나서야 봄인 줄 알았습니다.                                                        -리얼 관람객-  
4-18-2017,2017,4,18,16:34,화요일,10,31,1,얀스(yans****),내나이 40...  힘들때마다 조용히 기저귀를 차고  이 영화를 봅니다...  
7-12-2013,2013,7,12,18:36,금요일,10,31,1,상브로(sang****),어느덧 10년이 다되어가지만 매해 보아도 늘 클레멘타인. 보고 느껴야만 할 한국 영화의 전설  
6-29-2013,2013,6,29,09:13,토요일,10,32,2,픽캇츄(ahny****),슬프네요  
7-27-2014,2014,7,27,14:18,일요일,10,33,3,뭉게(kots****),최고의 반전영화!  영화가 시작된 순간 당신은 낚였다.  
7-27-2014,2014,7,27,02:08,일요일,10,33,3,heey****,이제 대한민국은 클레멘타인의 나라라고 불려야 할듯 합니다. 내 눈물을 말라버리게 한 최고의 영화.이 영화를 보고 집나간 며느리가 돌아왔습니다.  
9-14-2013,2013,9,14,10:00,토요일,10,39,9,마일드7(gamm****),"이영화를 보고 있는데 뒷집 동생이 놀러온거에요..다리가 불구라 목발을 집고 힘겹게 들오길래  제가""어 왔어? 이 영화 방금 틀었어 같이보자"" 라고 말하고 둘이앉아서 영화를 봤는데... 앉은뱅이나 다름없던 동생이 이 영화를 본뒤 두다리로 벌떡일어나더군요  "
7-17-2014,2014,7,17,03:40,목요일,10,42,12,도니(keit****),"가족이 모여 앉아 시청했습니다. 부모님은 영화 후반부가 되니 눈물흘리면서 어쩔줄 몰라하시더군요 영화가 끝나고 나서도 말이 없더라고요. 잠시동안 침묵이 흐르고, 올해 92살이신 할머니가 제 손을 잡으시더니 그러시더군요. 여지껏 안죽고 산 보람이 있다고.  "
6-20-2015,2015,6,20,20:15,토요일,10,29,0,Bee(zlco****),영화를 보고 인생을 배웠습니다. 사람을 믿지 말라.. 이 영화를 강력 추천하던 친구와 절대 비추하던 친구 둘이 있었는데.. 둘 중 하나와 절교했습니다. 누군지는 영화를 보시면 아실 수 있을 겁니다....  
4-26-2018,2018,4,26,22:15,목요일,10,30,1,어나니머스(etss****),"울트론님조차 보고 눈물을 흘렸다. 그리고 말씀하셨다 ""인류는 멸망시키되 이 영화는 건드리지 마라"" 오오 울렐루야  "
6-30-2017,2017,6,30,23:22,금요일,10,29,1,hanr****,죄송합니다 리얼을 보고나서야 이작품의 가치를 알게되었습니다  
6-28-2017,2017,6,28,16:40,수요일,10,29,1,공룡(lex4****),영화 '리얼'을 보고 클레멘타인이 명작임을 느꼈다  
5-10-2017,2017,5,10,14:49,수요일,10,29,1,Kevin2485(dkm8****),이 영화의 DVD를 제가 다니는 회사의 회장님께 선물로 드렸습니다 다음날 저는 사장이 되었습니다  
5-12-2017,2017,5,12,10:00,금요일,10,27,0,Difjgiv(mong****),침팬치입니다. 아빠 일어나! 소리를 듣고 직립보행을 시작했습니다.  
4-6-2016,2016,4,6,14:39,수요일,10,27,0,wicked(nmdh****),회사 업무 시간에 클레멘타인을 접하게 되었다 잠깐 봐야지 했던 내 손엔 이미 팝콘과 콜라가 쥐어져 있었고 노발대발 하며 다가오던 과장님의 눈가는 흠뻑 젖어있었고아빠 일어나 소리에 전직원이 일어나 눈물을 흘리며 나의 사랑 클레멘타인을  불렀다  
9-10-2014,2014,9,10,20:34,수요일,10,27,0,예비역(adue****),이 영화를 머리에 뿌렸더니 머리카락이 자라기 시작했습니다. 할렐루야!  
5-8-2017,2017,5,8,11:40,월요일,10,28,1,잔(supe****),제발 별점 테러좀 하지 마세요.. 이 영화는 시대를 초월한 명작입니다..  
10-11-2015,2015,10,11,01:06,일요일,10,28,1,록썰트(hanj****),지구를 침략하는 외계인에게 이 영화를 보여주었더니 무릎을 꿇고 눈물을 흘리며 철수했습니다.  
7-27-2014,2014,7,27,21:39,일요일,10,30,3,인배(tjau****),이영화를보고 발에있던 무좀이 나았습니다  
6-30-2017,2017,6,30,18:25,금요일,10,31,4,kh14****,"이제 당신의 시대는 갔다. 이제 ""리얼""의 시대다.  "
7-19-2013,2013,7,19,14:56,금요일,10,32,5,kbw3****,"난 8년째 아침 알람소리는 ""아빠~일어나~~!!!"" 이다..........난 매일 아침을 상쾌한 눈물로 하루를 시작한다............,  "
7-16-2017,2017,7,16,17:52,일요일,10,26,0,쫑s(ta43****),"평점 1점을 주는 댓글 알바들이  많은데 그렇다고 해도 민심을 바꿀 수 없다. 스티폰 스필버그가 한국에 처음 왔을때 외친 한마디 ""여기가 바로 클레멘타인의 나라입니까?""이 한마디면 충분하다. 꼭 봐라.  "
5-19-2017,2017,5,19,18:01,금요일,10,26,0,mcmax06(mcma****),갤노트7으로 클레멘타인 보다가 폰도 감동에 못이겨 폭발했습니다.  폰도 녹고 내손도 녹고 내마음도 녹고 다 녹아 내리네요 애절합니다.  
5-1-2017,2017,5,1,11:56,월요일,10,26,0,믿고거르는카엘과빠킬(lie_****),2004년에 상영되었지만 지금까지  많은 사람들이 찾아와서 10점을 주는 한국 영화계의 명작중의 명작. 클레멘타인 이래 이렇다할 영화는 본 적이 없습니다.  안 보신 분은 꼭 보시기 바랍니다. 진정한 삶의 희망을 찾으실 수 있을겁니다.  
4-30-2017,2017,4,30,07:09,일요일,10,26,0,체게바라(defc****),"인생을 살면서 지독한 염세주의에 빠졌을때와 주체할 수 없는 분노와 짜증, 자살충동에 사로잡혔을때 감히 이 영화를 보라 권하고 싶다.그 모든 감정과 자신에게 닥친 모든 시련이 얼마나 하찮은 것인지 알게 될것이다.다운받은지 거의 11년만에 용기내어 봤다.  "
4-10-2017,2017,4,10,17:26,월요일,10,26,0,프라임(ttl1****),영화전공자들 및 영화아카데미 학생들에게는 교과서적인 영화가 될 듯. 한국의 알프레도 히치콕 김두영 감독님 작품이시다.  
3-15-2016,2016,3,15,00:00,화요일,10,26,0,hipb****,클레멘타인 2 개봉 안하나요?  
7-21-2015,2015,7,21,14:04,화요일,9,26,0,24601(jooh****),이것은 9점이아니다. 19점이다. 20점을 줄수없는 이유는 이감동적인 영화를 보고 클레멘타인 후유증에 시달렸었기 때문이다. 아빠! 일어나! 이대사가 잊혀지지 않았다.  
1-21-2015,2015,1,21,21:13,수요일,10,26,0,우버제약(0107****),이게 영화냐? 이건 예술이다  
1-18-2015,2015,1,18,03:17,일요일,10,26,0,레이(nox4****),"엔딩크레딧 끝까지 다 지켜보았고, 나는  갈망하던 대한민국의 0.1% 대열에 올랐다.  "
1-11-2015,2015,1,11,23:28,일요일,10,26,0,으아자전폭발(miki****),인생의 터닝포인트가 있다면 이 영화를 본 순간이 아닐까  
12-5-2014,2014,12,5,02:23,금요일,10,26,0,우데기(wdke****),오늘 와이프와 영화 인터스텔라를보고 실망했다. 언제쯤 클레멘타인과 견줄 영화가 나올것인가. . 정녕 불가능한것인가?  
7-20-2017,2017,7,20,10:35,목요일,10,27,1,비버소년(beav****),제 여자친구가 평점으로 영화보다가 결국 이 영화를 봤네요 ㅎㅎ  
1-10-2015,2015,1,10,00:53,토요일,10,27,1,덱스트린(chjc****),클레멘타인이 개봉하고 10년....이 영화의 전세계 재개봉을 청원하지 않은 대한민국 국민들은 인류에게 죄를 짓고 있다. 우리 모두는 죄인이다....  
6-10-2014,2014,6,10,21:47,화요일,10,27,1,하루살이(0510****),아마 당신은 이 영화를 보기위해 살아왔을지도 모른다  
6-5-2013,2013,6,5,19:23,수요일,10,29,3,Toshiro(pcm1****),"시민 케인, 현기증 그리고 클레멘타인  "
4-16-2017,2017,4,16,01:25,일요일,10,25,0,불타는짱구(dhkd****),가족이 시드니로 이민와 살고있습니다 피부색이 달라 다소 어려움이 있었는데... 제가 꺼내들은카드가 클레멘타인..이였습니다 그들과 함께 이영화를 보았고 제 생각은 통했습니다 그들은 믿을수 없다며 눈물을 쏟기 시작했고 전 영화로 그들과 하나가 되었습니다  
4-10-2017,2017,4,10,21:59,월요일,10,25,0,히오스(vich****),마치 인생에서 떨어져나간 한조각을 다시찾은듯하다 이런영화와 비슷한 영화를 재개봉하면 그날은 학교를 째서라도 보러갈것이다 비록 내가 2살일때 나온영화지만 극장에서 봤을때의 기억이 마치 어제의 일같다 핲으로도 이런작품이 많이 나오면 좋겟다  
3-18-2017,2017,3,18,09:23,토요일,10,25,0,khs6****,우리나라에 노벨문학상 수상자가 없는이유는 딱 한가지클레멘타인이 문학작품이아닌 영화이기때문  
4-19-2017,2017,4,19,16:48,수요일,10,26,1,무샤(moos****),나사에서 중대발표를 했네요. 클레멘타인을 골든디스크에 새겨 지적 생명체가 살 확률이 가장 높다는 안드로메다 D3 구역으로 날려보낸다네요.  
6-28-2013,2013,6,28,21:49,금요일,10,28,3,악덕(lyr1****),대박입니다.  
1-12-2015,2015,1,12,12:52,월요일,10,24,0,zero****,"아버지께 추천 드렸습니다. 어제 늦은  저녁에 보시곤, 제방에 들어오셔서 ""사랑한다 아들"" 이라며 제 어깨에 손을 얹으시곤 한참 말이 없으셨죠...그 감동이란...부자지간의...  "
5-27-2016,2016,5,27,13:26,금요일,10,25,1,은밀한곰탱이(tmdw****),노아가 살아 있다면 이 영화를 실었을겁니다.  
7-17-2014,2014,7,17,15:39,목요일,10,25,1,찐찡이(gugi****),1만점도 아깝지 않을 내 일생의대작. 내자식이 10살쯤되면 꼭 보여주고 싶은 영화.. 그럼 내자식은 말하겠지... 아빠!일어나!!!  
7-28-2018,2018,7,28,22:43,토요일,10,26,2,dalbit(haha****),저희집 금붕어에게 이 영화를 보여주었더니 2주 뒤에 상어가 되었습니다. 감사합니다 클레멘타인  
7-15-2017,2017,7,15,15:32,토요일,10,23,0,셰니아(thar****),옛 문헌을 살펴보면 저승의 노잣돈으로 클레멘타인 DVD를 들고갔다는 기록이 있다.  
6-28-2017,2017,6,28,18:16,수요일,10,23,0,후니훈(rudc****),리얼 후기보고 찾아왔습니다 이런 영화도 있었군요  
4-29-2017,2017,4,29,21:21,토요일,10,23,0,은호일(mark****),이 영화를 보고 암이 암에 걸려서 암이 나았습니다.  
8-8-2016,2016,8,8,21:38,월요일,10,23,0,kei3****,어찌 이영화가 쇼생크 탈출이나 레옹보다 평점이 낮단 말인가... 우리나라가 아직 OECD국가중 선진국이 되지 못한 이유중 하나다...  
7-29-2018,2018,7,29,12:18,일요일,10,24,1,fow2****,이 영화가 지금 개봉했다면 2천만 관객은 무조건 보장이 되어있는 영화.  
7-3-2018,2018,7,3,09:37,화요일,10,25,2,yoyo****,현재 평점 9.31이 뭡니까? 조작아닙니까? 10점 미만으로 달린 댓글들 전부 특검들어가야합니다!!  
6-29-2016,2016,6,29,16:51,수요일,1,80,57,이방인(mind****),클레멘타인 의 네이버 평점 9.3을 보고 영화를 선택했다. 보는 내내 후회했다. 너무 이상해서 네이버 평을 다시 찬찬히 읽어봤다.드디어 난 알았다. 이 위대한 작품이 어떻게 탄생했는지를. 아~ 이 훌륭한 작품은 입에서 입으로 기적을 만들어낸 것이었다.  
8-7-2016,2016,8,7,20:50,일요일,10,22,0,인더플레이스투비(dyna****),"외국여행을 갔는데, 사람들이 코리아를 모르더라구요. 혹시나하는 마음에 클레멘타인! 이라고 했더니 동네사람들이 모두나와 클레멘타인!을 외치더이다. 아직 한국이 널리 알려지지않아 씁쓸하지만 역시 한류의 중심은 클레멘타인이네요.  "
7-17-2014,2014,7,17,01:38,목요일,10,23,1,dhvl****,과연 100년안에 이보다 완벽한 영화를 만들수 있을까 눈물이 흐른다  
6-24-2017,2017,6,24,16:28,토요일,10,24,2,NABIRAN(rani****),진짜 기분 우울할때 여기 댓글 성지순례 2년째 하고있음.  
7-17-2014,2014,7,17,14:06,목요일,10,25,3,웃자(chlr****),나 자신에게 화가 난다 왜 이런 영화를 이제야 알았는지...  
8-8-2016,2016,8,8,09:18,월요일,1,55,33,단풍잎(jung****),이 영화를 보고 암이 나았습니다. 암세포가 암에 걸려 죽었거든요.  
7-30-2018,2018,7,30,04:18,월요일,10,21,0,서폿티모(ksa2****),진시황이 불로장생을 하려했던 이유는 클레멘타인을 보기 위함이 아니였을까?  
8-8-2017,2017,8,8,21:23,화요일,9,21,0,글쎄(lorp****),9점. 내 인생 최고의 영화는 리얼이기 때문이다.  
7-10-2017,2017,7,10,23:00,월요일,10,21,0,CoolMizer(cool****)," 퇴행성 관절염으로 걷질 못하시던 아버지가 ""아빠! 일어나!!"" 소리에 영화도중 기적처럼 일어나셨습니다. 저도 너무 놀란 나머지 일어선 아버지를 부둥켜 안고 엉엉 울었습니다. 지금도 눈시울이 붉어지네요... 이 영화는 사랑이며 기적 그 자체입니다.  "
5-7-2017,2017,5,7,10:03,일요일,10,21,0,화이팅(djho****),공무원 시험 하루 앞두고 너무 걱정이 되고 불안해서 나도 모르게 이 영화를 보게 됐습니다. 보고나서  그 감동과 눈물을 잊을수 없었습니다. 그리고 공무원 시험에 합격했습니다 클레멘타인 잊을수 없는 영화입니다.  
4-11-2017,2017,4,11,02:22,화요일,10,21,0,THE K2 주새벽(css9****),평점조작알바가 있다고 들었습니다 근데 사실이네요 이 대작이 10점이 아니면 어떤 영화가 10점 입니까  
5-19-2019,2019,5,19,19:51,일요일,1,20,0,미친야생마(wprt****),이영화를 한순간도 놓치기 싫어서 1시간40분동안 눈을 뜨고있는 훈련을 15년째 하고 있습니다.  
7-21-2015,2015,7,21,17:21,화요일,10,20,0,이화아저씨(wkdt****),이 영화를 국회로 보내자  
6-1-2015,2015,6,1,09:09,월요일,10,20,0,아그니스(hbks****),남성으로서의 자신감이 부족하여 소변을 앉아서보던 저였습니다만 이영화의 아빠~일어나~! 를 듣는순간 일어서서 소변을 보게되었습니다. 그렇게 새로산 바지를 버렸고 제 안 깊은곳에 나약함도 버렸습니다.  
2-1-2015,2015,2,1,08:05,일요일,10,20,0,baek****,난 이 영화에 점수를 낮게 주는 사람들이 싫다 아무리 혼자 소장하고 싶다고 공유하지 않으려 하는 것은 정말 나쁜짓이다...  
11-25-2014,2014,11,25,03:30,화요일,10,20,0,순대간(qazx****),이 영화가 100년전에 만들어졌고 만약 히틀러가 이 영화를 보았다면  결코 2차세계대전은 일어나지 않았을것이다....  
7-18-2014,2014,7,18,10:34,금요일,10,20,0,yuy4****,Do you know Kimchi?Do you know PSY?Do yoy know Clementine?  
7-14-2017,2017,7,14,19:52,금요일,10,21,1,송미정(qjat****),리얼을 보고왔습니다. 13년뒤의 영화보다 발전된 클레멘타인 당신은 대체...  
2-1-2016,2016,2,1,05:36,월요일,10,21,1,kshd****,"섹스,도박,마약은 끊을 수 있어도 클레멘타인은 끊을 수 없다.  "
4-30-2019,2019,4,30,23:16,화요일,10,19,0,이츠키(buff****),하루 세번 치카치카~아로치카~  
9-13-2018,2018,9,13,12:36,목요일,10,19,0,김광수(kimg****),UFO가 나타나는 이유는 외계인이 이 영화를 보러 오기 때문이다  
8-3-2018,2018,8,3,16:38,금요일,10,19,0,동건사랑(marr****),네티즌들이 반 장난으로 재밌다고 해서 ㄹㅇ 노잼인줄 알았다.그래서 별 기대 없이 봤는데 이거슨 희대의 명작이 틀림없다.  
7-31-2018,2018,7,31,21:54,화요일,10,19,0,김재혁(jack****),뭐...갈때 가더라도 클레멘타인 한편 정도는 괜찮잖아?  
7-27-2018,2018,7,27,15:05,금요일,10,19,0,동은(ddon****),"고3입니다. 네이버 평점을 보고 황금같은 방학, 클레멘타인을 선택했습니다.  네이버 평점은 역시 거짓말을 하지 않네요. 최고입니다.  "
6-13-2018,2018,6,13,04:57,수요일,10,19,0,wndy****,공룡이 왜 멸종했는가? 바로 클레멘타인을 보지않았기 때문이다.  
4-29-2018,2018,4,29,23:48,일요일,10,19,0,박상영(kiom****),이 영화를 못 보고 돌아가신 모든 분께 깊은 애도를 표합니다. 이 영화를 부모님께 보여드리지 않는 것은 세앙 가장 큰 불효입니다. 자식에게 보여주지 않는 것은 부모로서 무책임한 행동이구요.  
4-24-2017,2017,4,24,21:31,월요일,10,19,0,똥자루(tlsd****),암세포가 암이걸려 암이 나았습니다... 감사합니다..  
6-3-2017,2017,6,3,21:17,토요일,10,20,1,나그네(just****),아카데미는 도대체 무엇을 하고 있다는 말인가?  
11-4-2016,2016,11,4,12:49,금요일,10,20,1,raek****,"대통령이 이 영화를 미리 봤었더라면 현 사태를 막았을텐데.. ""아빠 일어나~~~~""  "
5-10-2015,2015,5,10,20:32,일요일,10,20,1,어(heyn****),학교에 이영화를들고가자 여자친구가생겼습니다.  
7-11-2013,2013,7,11,02:49,목요일,10,20,1,바람열매(wind****),이렇게 유명한 영화인지 몰랐어요 ㅠㅠ  
9-8-2014,2014,9,8,14:29,월요일,1,36,17,에이스(leej****),추석맞이로 친척들과 함께 다시 봤습니다.  베스트평점 말대로 11점 주고싶네요.  
6-7-2019,2019,6,7,19:22,금요일,10,18,0,김경훈(kkk3****),"클레멘타인님, 축하드립니다. 조카가 생기셨더군요. 이름이 복동이라죠.  "
7-29-2018,2018,7,29,17:53,일요일,10,18,0,광합성메뚜기(luck****),이열....처음부터 처음까지완벽한영화  
5-23-2018,2018,5,23,17:37,수요일,10,18,0,MK(rcop****),같이 본 옆자리 여자와 결혼을 했습니다.  
5-5-2018,2018,5,5,00:58,토요일,10,18,0,초콜릿(gilf****),이영화는 2004년이 아니라 2044년에 나왔어야한다. 시대를 너무나 앞서간 걸작이다.  
7-30-2016,2016,7,30,11:07,토요일,10,18,0,황진이(galb****),자기전엔 항상 클레멘타인을 보고자는 습관이 생겼다.이젠 대사도 다외울정도. 오늘밤에도 클레멘타인 볼 생각에 너무 행복하다  
7-26-2018,2018,7,26,02:03,목요일,10,19,1,가즈아(luck****),북한이 갑자기 한국과 가깝게 지내는 많은 이유 중에 클레멘타인의 DVD를 소장하려는 의도를 빼놓을 수 없다.  
5-28-2017,2017,5,28,01:56,일요일,10,19,1,ㅇㅇ(se7e****),평점이 높아서 감상했는데 네이버 회원분들 감사합니다.명작을 이제라도 보게되서 다행입니다. 제 인생의 일부분이 될거같네요 친구들에게 추천해줘야겠어요.  
12-18-2014,2014,12,18,23:28,목요일,10,19,1,아스트(tolo****),아직 보지 않았지만 댓글을 보면 대단함이 느껴지네요.  
6-4-2014,2014,6,4,12:34,수요일,10,21,3,울티마(danz****),이 명작이 나온지 10년.. 내 나이 사십을 바라보는 이 나이에 이제야 나는 영화 보는 재미를 알았다.. 아빠 일어나!!! 살짝 기절한 척했다가 일어나서 뒤돌려차기를 빡~!! 끝  
6-2-2014,2014,6,2,14:02,월요일,10,22,4,고래(free****),개봉한지 10년이 되서야 이런 명작을 만나다니.. 감동 그 자체였습니다. 그리곤 이 영화를 추천해준 10년지기 친구를 잃었습니다.  
8-18-2015,2015,8,18,17:54,화요일,1,34,16,DamonAlban(new9****),이것은 절대 1점이 아니다 이것은 역대 모든영화중에서 1등이란 뜻이다! 갓레멘타인 찬양경배해!!!!  
4-30-2019,2019,4,30,22:02,화요일,10,17,0,dld(dlwk****),아로치카 진짜 평점 남겼네 ㅋㅋ  
12-28-2018,2018,12,28,11:13,금요일,10,17,0,종혀누ㅏㅇ(zhje****),보헤미안 랩소디 그 이상의 감동인데 왜 평점은 밀리는지 참  
7-13-2018,2018,7,13,06:39,금요일,10,17,0,유기구라모토(gump****),타노스가 손가락 튕길때도 클레멘타인 만큼은 살려뒀다는…  
7-11-2017,2017,7,11,08:22,화요일,10,17,0,땅콩(kys2****),이 명작의 뒤를 리얼이 잇네요  
1-23-2015,2015,1,23,16:39,금요일,10,17,0,꽃거지(csw8****),이 영화를 다운 받는 순간  제 컴퓨터의 모든 바이러스가 치료되었습니다. ms는 모든 윈도우제품에 이 영화를 담아주시길 바랍니다.  
7-17-2014,2014,7,17,15:19,목요일,10,17,0,동숭동양아(wann****),간혹 당신이 세상을 너무 편하게 살고 있다고 느낄 때 보아야 하는 영화  
7-17-2014,2014,7,17,03:49,목요일,10,18,1,록바록바(min3****),이동준님 말씀대로 안 본사람이 너무 많다. 이런 명작은 필히 재개봉 해야 한다.  
9-20-2016,2016,9,20,12:48,화요일,10,19,2,카와지리타츠야(mjh0****),"회사생활이 너무 힘들어 휴직을 냈습니다,이 영화를보고 살아가야할 이유가 생겼습니다 일하러갑니다  "
5-9-2019,2019,5,9,14:03,목요일,10,16,0,삼엽충(whhr****),나는 22년을 살았지만 내 나이는 1살이다 왜냐하면 이 영화를 보고난 후 나의 삶이 다시 시작했기 때문이다  
5-1-2019,2019,5,1,14:57,수요일,10,16,0,LongHon(ytk0****),아로치카치카치카오우오  
6-16-2018,2018,6,16,04:10,토요일,10,16,0,놀면머하노(torn****),댓글 관람후 십점 남김. 꼭 가족과 함께 볼꺼니 내용 스포는 하지 마세요. 이런걸 혼자 볼순 없지  
5-8-2017,2017,5,8,14:33,월요일,10,16,0,dingo(beex****),말이 필요없는 명작이죠^^ 10점 드리고 갑니다^^  
4-8-2017,2017,4,8,22:05,토요일,10,16,0,콩산당(chlr****),정말 걸작이네요 아빠일어나 할떄 눈물이 나왔습니다  
11-14-2016,2016,11,14,00:23,월요일,10,16,0,2ndm****,"나는 우리 대한민국의 자부심을 양궁, 김연아 그리고 클레멘타인을 통해 느낀다.  "
8-13-2016,2016,8,13,19:43,토요일,10,16,0,난봉푸들(saes****),영화정도 봤다고 충격들은 쯧. ..다 필요없어!!  난 이 영화 광고대행을 했었다구!!!!  
4-19-2016,2016,4,19,23:40,화요일,10,16,0,반디쉬(vand****),인간의 수명은 81.4세...그 안에 이토록 행운의 영화가 있을까  
10-9-2015,2015,10,9,20:54,금요일,10,16,0,병삼이(jbr6****),태권도 등록하러 갑니다.  
9-13-2014,2014,9,13,12:01,토요일,10,16,0,정웅지(skyn****),"알버트 아인슈타인이 이 영화를 봤다면 이렇게 말했을 것이다 ""인생을 살아가는데는 오직 두가지 방법 밖에 없다. 하나는 아무것도 기적이 아닌것 처럼살던가 다른 하나는 이 영화를 본 것을 기적인 것 처럼 살아가는 것이다""  "
5-4-2014,2014,5,4,19:12,일요일,10,17,1,사막거북이(djhf****),시대를 잘못만났던 불운의 명작...이영화가 만약 2014년에 개봉했다면...한국영화에 한획을 그엇을만한 희대의명작...의리의 대명사 시걸형님과 보성형님의 출연만으로도 10점이 아깝지 않은영화...배급사에 2014년 재개봉을 추천합니다...아...의리  
2-8-2019,2019,2,8,21:02,금요일,10,18,2,우태원(shdk****),"포스터를 보고 '평점이 왜이리 높지?' 라고 생각할수도 있지만. 한번쯤 봐도 돈과 시간이 아깝지 않을 명작, 장담합니다. 그리고 반전이 있으니 리뷰는 찾아보지 않는 것을 추천합니다. 스티븐 시걸이 선택한 영화! 한국인이라면 제발 클레멘타인좀 봅시다.  "
2-3-2015,2015,2,3,16:52,화요일,10,18,2,1st(kys0****), B와 D사이에는 C가있듯이 삶(Birth)과 죽음(Death)사이에는 클레멘타인(Clementain)이 있습니다  
7-17-2014,2014,7,17,00:47,목요일,10,22,6,오예스(para****),베스트셀러에 성경이 있다면 베스트무비엔 클레멘타인이 있다. 아니.. 성경과 비교하는 것조차 클레멘타인에게 모욕일지도..  
6-7-2019,2019,6,7,01:51,금요일,10,15,0,poles1469(trip****),술 한잔 마셨습니다... 클레멘타인 안보셔도 좋습니다. 하지만 클레멘타인 하나만 기억해주세요 진심을 다해 전합니다. 영화가 별로 일수있습니다 밤낮으로 고민하고 보았습니다 ...안본 사람은 있어도 한 번본 사람은 없을겁니다  제 진심이 느껴지길 바랍니다  
4-30-2019,2019,4,30,21:24,화요일,10,15,0,알파치노(cabi****),아론형 진짜 감동해서 우는거였으면서 왜 영상 핑계대  
4-3-2019,2019,4,3,00:07,수요일,10,15,0,Dddddd Sssssss(blue****),"한국영화의 발전을 위하여 클레멘타인 상을 제정하자. 대종상, 청룡영화상, 백종예술대상같은 영화상들은 그저 허세에 불과할 뿐. 클레멘타인 상 수여식에서 관중들이 ""아빠 일어나!""를 외치며 감독에게 영예를 안겨준다면 곧 할리우드도 능가할 수 있다  "
1-27-2019,2019,1,27,14:53,일요일,10,15,0,그롬마시(rage****),"이 영화가 을사조약 전에만 만들어 졌다면, 나라를 뺐기는게 아니라 이 영화를 뺐겼을 것이다.  "
7-29-2018,2018,7,29,12:12,일요일,10,15,0,강승구(seun****),"타이타닉, 아바타를 뛰어넘은 명작입니다.  "
4-20-2016,2016,4,20,13:38,수요일,10,15,0,밥팔아서똥사먹기(laro****),아빠 일어나! 하는 장면에서 영화관내 모든 사람들이 울면서 좌석을 박차고 일어났습니다. 미혼자라든지 혹은 여자라 아빠가 될 수 없다든지 하는 문제는 이미 중요하지 않았습니다. 그날 우리는 그저 한 명의 슬픈 아빠였습니다.  
6-29-2017,2017,6,29,18:26,목요일,10,16,1,slfa****,'리얼' 때문에 이 영화 '클레멘타인'을 알게 되었습니다. 그리고 많은 평점글을 읽고 눈물을 흘렸습니다. '리얼'에게 감사드립니다.  
5-27-2017,2017,5,27,11:20,토요일,10,16,1,표범자리(jung****),문재인대통령께서 영부인과 함께 투표를 마치시고 삶의 초연한 의미와 정의를 향한 불굴의 의지를  다시 다지기 위해  돌려보신 작품으로 유명.  
1-8-2015,2015,1,8,21:46,목요일,10,16,1,스티브잡스(spaw****),"훗날 인류가 화성으로 이주를 하면서 지구상 물건중 단 하나만 들고갈 수 있다면, 그것은 고민할 여지없이 클레멘타인 DVD이다.  "
1-5-2015,2015,1,5,12:06,월요일,10,16,1,윤자(ayun****),괜히 봤다.. 이 영화를 보고 다른 영화를 볼 수가 없다..  
2-20-2019,2019,2,20,22:46,수요일,10,17,2,dimp****,장난으로 평점 1점 매기신 분들 평가 철회해 주시지요. 다른 작품은 몰라도 클레멘타인을 논할 땐 넘지 말아야 할 선이 있습니다. 네티즌이여 분발합시다!!!  
7-7-2017,2017,7,7,14:41,금요일,1,30,15,Amoureuses(ball****),이 영화를 보고 그 감동을 자신만의 것으로 마음 한구석에 담아두기엔 이 영화가 주는 감동이 너무나도 값지다. 부디 많은 이들이 이 영화를 보고 그 감동의 가치를 함께 느끼길 바란다. 함께 영화를 본 우리집 고양이가 울면서 1점을 누르고 간다.  
4-30-2019,2019,4,30,22:05,화요일,10,14,0,emfo****,성지 순례왔습니다 하루 세번 치카치카  
4-30-2019,2019,4,30,21:17,화요일,10,14,0,이한율(audt****),아로치카~~~~:):)  
3-30-2019,2019,3,30,19:33,토요일,10,14,0,레렉톤(yo70****),모든게 귀찮은 12살 된 우리집 강아지.. 마지막에 저도 울었지만 이 녀석도 하울링을 하내요. 강아지도 울릴 정도로 스토리 튼튼한 슬픈 영화 입니다  
1-2-2019,2019,1,2,02:16,수요일,10,14,0,논개(yuen****),마지막 최고의 대사가 아직도 기억에 납니다. '이세상은 썩어버렸고 떨어져 사는것보다 지지고 볶더라도 붙어사는게 낫다' .... 여기서 할말을 잃었어요 모든교훈을 함축하고 있습니다. 이쓰레.. 아니 명작은 명작인 이유가 있지요 꼭보세요~ ! 별 10점!  
10-5-2018,2018,10,5,12:33,금요일,10,14,0,jjw1****,남자로 태어나길 잘했다고 느끼게 해준 영화  
9-14-2018,2018,9,14,16:40,금요일,10,14,0,PERFECTmAN(itit****),시간 여행 중인 사람입니다… [2200년 9월 14일 현재 시각 16시30분] 현재까지도 이 영화를 능가하는 작품이 나오질 않았습니다. 안 보신 분은 꼭 보시길 바랍니다.  
8-3-2018,2018,8,3,14:54,금요일,10,14,0,Chic(sggg****),미친 ㅋㅋㅋ 댓글 평들이 ㅋㅋ 너무 웃겨 ㅋㅋㅋ ㅠㅠㅠ  
3-29-2016,2016,3,29,06:40,화요일,10,14,0,빛(go37****),보증을 잘못서는 바람에 빚더미에 올라서 자살로 생을 마감하려고 생각중에 이영활 보게되었습니다. 아빠일어나! 그 대사 한마디가 절 일으켜 새웠고 지금은 제기하여  잘살고있습니다. 사랑한다 클레멘타인! 사랑한다 내꿈아!  
8-25-2016,2016,8,25,09:15,목요일,10,15,1,실린(neon****),   방한하는 수많은 세계적인  스타들은 클레멘타인을 보려 찾는것이다   클레멘타인을 보지 않은 사람은 있더라도  한번만 본 사람들이 과연 있을까?  
9-5-2014,2014,9,5,21:40,금요일,10,15,1,fall****,여자친구집에 이영화의 DVD  가 있는것을 보고 결혼을 결심했습니다.  
9-2-2014,2014,9,2,11:55,화요일,10,15,1,바운드(duqj****),피시방에서 이영화를 불법다운로드하고 보고나서 펑펑울었습니다.이토록 아름답고 가슴아픈 대작은 극장에서 돈을내서라도 봤어야했는데..그렇게 제 어리석음에 한참을 울었습니다  
8-22-2014,2014,8,22,01:22,금요일,10,15,1,wine****,인생이란 다섯글자로 정의된다. 클레멘타인  
6-29-2017,2017,6,29,11:40,목요일,10,16,2,khan****,리얼을 관람했음에도 클레멘타인에 평점을 줍니다.  
6-15-2014,2014,6,15,15:56,일요일,10,17,3,chem****,평점주기 위해 네이버 로그인한  첫번째 영화!  
1-6-2015,2015,1,6,19:21,화요일,1,32,18,안지상(igu2****),시작하자마자 김혜리의 섹시함에 탄성을 금치못했다.  
8-18-2017,2017,8,18,19:32,금요일,1,35,21,dlsx****,나의 마음속의 넘버원...  
6-29-2017,2017,6,29,08:06,목요일,1,39,25,김진우(ascv****),진짜 봐도 되는건줄 알았잖아!  
12-10-2014,2014,12,10,16:25,수요일,1,101,87,잠시골좀넣겠습니다(kell****),야이 놈들아! 평점보고 좋은 영환줄 알고 가족들 모아놓고 이 영화 틀어놓고  30분 쯤 보다가 가족들한테 좀 지나면 재밌을거라고... 이영화 평점 높은 영화라고 이야기 하다가 영화 끝날때 쯤 사랑하는 가족잃을 뻔 했다...  
5-30-2019,2019,5,30,12:09,목요일,10,13,0,이재연(govl****),명작의 감동을 0.1초도 놓치기 싫어 시력2.0에 라식수술을 받았습니다.  
5-9-2019,2019,5,9,16:49,목요일,10,13,0,sukh****,우울한 세상에 비추어진 한 줄기 빛 같은 영화. 엔드게임? 어딜 클레멘타인에 비빌려고  
5-1-2019,2019,5,1,01:47,수요일,10,13,0,조현호(johh****),치카쨩 고통의 10점 ㅋㅋ  
4-8-2019,2019,4,8,21:35,월요일,10,13,0,햄스(dydg****),재개봉의 여지는 없는건가요  
4-1-2019,2019,4,1,00:33,월요일,10,13,0,죽전(sunb****),이 영화를 보고 나서 휴지로 눈물을 닦으려 했으나 이미 모든 휴지가 물티슈가 되어있었습니다...  
12-29-2018,2018,12,29,12:57,토요일,10,13,0,권순용(tnsd****),이 영화를 보고 치질이 생겼습니다 영화가 끝나고도 여운이 없어지질않아 일어나지 못했습니다  
12-16-2018,2018,12,16,18:36,일요일,10,13,0,경판(jkh3****),"눈물이 멈추질 않아요. 정말 거짓말 안하고 각티슈 한통 다쓴거 같습니다. 정말 눈물이 나는 영화를 찾다가 추천받아서 봤는데, 쓰면서도 눈물이 핸드폰으로 떨어져서 몇번이나 수정했습니다. 아빠 일어나 !!!ㅜㅜ  "
9-3-2018,2018,9,3,16:44,월요일,10,13,0,비비비비비(myst****),"의사: ""환자분은 앞으로 2시간 후면 사망하실 것입니다."" 나: ""그렇다면 꼭 보고 싶은 영화가 하나 있는데...""  "
8-2-2018,2018,8,2,16:30,목요일,10,13,0,herm****,네이버는 평점 20점을 만들라. 클레멘타인을 위해.  
7-30-2018,2018,7,30,16:43,월요일,10,13,0,강민혁(rkda****),대학 방학에 무슨 영화를 볼까 고민하다가 클레멘타인을 선택했습니다. 여러 명화를 봤다 자신했던 저였지만 영화가 끝나고 난 뒤 겸손해진 저를 볼 수 있었습니다...  
7-30-2018,2018,7,30,01:08,월요일,10,13,0,trig****,아놔 OO 댓글보다 숨멎겠네  
7-29-2018,2018,7,29,23:51,일요일,10,13,0,샤라포바약혼남(czar****),저는 무교였습니다.하지만 클레멘타인을 보고난후 신의 존재를 믿기 시작했습니다.이 영화는 신이 인간에게 주신 가장 큰 축복입니다.아빠 일어나! 란 대사가 10년이 훨씬 지난 지금까지 귓가에 맴돕니다.  
7-29-2018,2018,7,29,21:44,일요일,10,13,0,rlar****,"1점 주는 분들, 사회생활은 가능하신지..  "
7-29-2018,2018,7,29,07:48,일요일,10,13,0,무한자(dbfl****),최고의영화지 누가봐도 명작  
7-28-2018,2018,7,28,07:39,토요일,10,13,0,최명진(ta91****),삶을 포기하고 싶을 때 살아야할 의미를 준 소중한 영화  
7-28-2018,2018,7,28,00:53,토요일,10,13,0,My Angel(love****),최근 리얼과 막 개봉한 인랑 .. 이들의 연관검색어에 이런 대작이 함께 뜬다는것이 말이 되나요? 장난도 타이밍 봐가면서 해야죠. 인간이 죽기전에 꼭 봐야할 1001개의 영화에도 소개되어있는 클레멘타인입니다. 수작에 먹칠하지 맙시다.  
7-27-2018,2018,7,27,21:17,금요일,10,13,0,상황판단(dams****),무슨 말이 필요한가...살다가 힘들 때 이영화를 한번씩본다..클레맨타인..오 클레멘타인  
7-27-2018,2018,7,27,14:11,금요일,10,13,0,suwo****,제가 인생 최고의 영화로 꼽는 포레스트 검프도. 클레멘타인 앞에서는 한낱 달리기 영화 였습니다.  
7-24-2018,2018,7,24,13:21,화요일,10,13,0,안녕하세요(rith****),"현직 평론가 입니다. 클레멘타인은 영화역사상 최고의 작품이라고 평론 하고 싶습니다. 영화에서 드러난 엑스마키나와 패러다임은 하드보일드 무비의 극치를 보이며, 페이소스에 대한 극명한 이노비전 입니다.  "
7-6-2018,2018,7,6,17:23,금요일,10,13,0,소빵스(sobb****),불멸의 명작!낮은 평점에 낚이지 마세요. 평점은 결코 거짓말을 하지 않습니다  
6-15-2018,2018,6,15,21:43,금요일,10,13,0,Paul(yeon****),배우들의 연기력이 너무나도 훌륭하여 차마 이 눈으로 볼 수 없었습니다  
6-8-2018,2018,6,8,14:50,금요일,10,13,0,난아첨쟁이(dltk****),여러분 명작은 시간이 지나도 변하지 않는 법입니다. 안보신분은 꼭 보세요  
6-7-2018,2018,6,7,15:32,목요일,10,13,0,대사치(psha****),이 영화는 진짜 꼭 보고 한줄이라도 감상평을 남기셔야 남은 인생을 후회하지 않으실 겁니다. 왜 여태까지 이런 숨은 명작을 못봤을까요? 보고나면 진짜 감동의 물결이 쓰나미처럼 몰려와서 솟구칠 것입니다.  
6-7-2018,2018,6,7,14:13,목요일,10,13,0,이재혁(leej****),저는 소시오패스입니다... 클레멘타인을 보고 다른 사람들이 느낀다던 감정이란걸 감동으로 처음 느꼈습니다...현재 저는 클레멘타인을 소시오패스의 약으로 쓰기 위해 의학계에 제출할 논문을 작성중입니다. 감사합니다  
5-18-2018,2018,5,18,06:27,금요일,10,13,0,키리디아스포츠(krid****),평론가들 조차 함부로 평가할 수 없는 그 영화. . .결국 감동받은 관객만이 진실을 얘기할 수 있다.  
4-28-2018,2018,4,28,11:24,토요일,10,13,0,Europa(tach****),남북이 통일되면 문재인 김정은 손 꼭 잡고 같이 봐야 할 영화  
3-29-2018,2018,3,29,15:52,목요일,10,13,0,코스모그래프(qpqp****),아이고 제인생  쵝오의 영화를 이제야 봤네요ㅠㅠ이명작 친구들은 보고 제게 안알려 줬어요.혼자 평생간직하겠다 이거죠.죽일겁니다.  
3-18-2018,2018,3,18,13:08,일요일,10,13,0,bugs****,나사가 보이저 3호에 클레멘타인 DVD를 탑재시키고 심우주로 쏘아올린다는 뉴스를 어제 보았습니다. 위대한 문화유산을 인류만이 소유하는 것은 이기적이라 생각했는데 역시 천조국은 다르군요..  
12-24-2017,2017,12,24,23:32,일요일,10,13,0,바우와우(ychk****),세상에ㅋㅋ그 어떤 웃긴썰보다 클레멘타인 평점들을 읽는게 훨씬 웃기네ㅋㅋ 우리나라에 이렇게 재치있게 글쓰는 사람들이 많았나 와...평들이 하나같이 정말 재밌네ㅋㅋ 아 물론 이 영화는 명작입니다  
4-26-2017,2017,4,26,11:37,수요일,10,13,0,퓨백(kimn****),죽기전에 보려고 아직 안보고있어요~  
4-6-2017,2017,4,6,23:41,목요일,10,13,0,북두칠성(p852****),보기 전 1일1딸이던 제 인생이 이제 1일1클레멘타인으로 바꼈습니다.  
8-10-2016,2016,8,10,16:49,수요일,10,13,0,강화에실패하셨습니다(jeon****),"어렸을 때부터 꿔왔던 꿈을, 재능이라는 벽에 부딪혀 포기하려할 때, 클레멘타인을 보아라.자신이 초라해질 때, 클레멘타인을 보아라.너는 네 생각보다 재능있고, 네 생각보다 빛나는 사람임을 깨달을 수 있을 것이다  "
10-19-2015,2015,10,19,23:28,월요일,10,13,0,273(news****),아빠!! 일어나!! (클레멘타인 대사 중)저는 잠을 자다가도 가끔 이 영화가 생각이 나면 벌떡벌떡 일어납니다.이렇게까지 다시 생각나는 영화는 없다고 느꼈습니다.  
6-5-2015,2015,6,5,19:11,금요일,10,13,0,dudw****,이영화를보고 메르스가 완치되었습니다. 감사합니다 준리  
8-28-2014,2014,8,28,01:15,목요일,10,13,0,namu****,소중한 사람과 함께 봐야할 영화  
7-18-2014,2014,7,18,08:38,금요일,10,13,0,영규(eegp****),이유따윈없다. 클레멘타인이기 때문이다  
7-25-2013,2013,7,25,19:07,목요일,10,13,0,리스(roma****),이 영화를 보지 않는 것은...인간의 존엄성에 대한 모독이다!  
7-28-2018,2018,7,28,14:05,토요일,10,14,1,whgustn(unme****),하...진짜 보면서 너무 울었어요ㅠㅠ눈 퉁퉁 부어서 담날 출근하니까 다들 무슨있냐고 묻더군요. 그래서 클레멘타인을 봤다고 말씀드리니 다들 토닥토닥해주셨어요. 자기도 그랬다면서ㅠ  
9-7-2015,2015,9,7,16:40,월요일,10,14,1,Rocka(mous****),인생은 B와 D 사이의 C... 그것은 Birth와 Death 사이의 Clementine이다. 태어나서 죽기전에 클레멘타인을 보지 않은 인생은 헛살았다고밖에 말할수없다.  
8-13-2014,2014,8,13,23:06,수요일,10,14,1,백사(leew****),평점이 10점밖에 없다는것이 한스럽다.... 별 천만개를 주어도 아깝지 않을 영화.  
7-17-2014,2014,7,17,00:56,목요일,10,14,1,키커야지(jung****),아직도 전 클레멘타인을 다시 볼때마다 끝까지 다 보지 않습니다.... 다 봤다는 후회를 남기지 않기 위해..  
6-24-2014,2014,6,24,14:33,화요일,10,14,1,ㄱㅈㅅ(sund****),한국영화 원톱 클레멘타인  
6-15-2014,2014,6,15,04:44,일요일,10,14,1,피터아츠(kkhd****),동준이형과 시갈형의 감동의 액션 콜라보레이션.. 보는동안 눈물이 그치지 않았다.  
4-24-2014,2014,4,24,17:17,목요일,10,14,1,jyo5****,이젠 예고편만봐도 눈물남ㅠ  
7-10-2013,2013,7,10,22:08,수요일,10,14,1,매실믿어(beli****),내 인생을 바꾼 최고의 영화  
10-12-2016,2016,10,12,19:57,수요일,10,15,2,구독(rlav****),영화를 보지않았으나 인생영화입니다  
9-6-2014,2014,9,6,02:23,토요일,10,15,2,씨입ㅋㅋ(ekdn****),클레멘타인이 사람들에게 잊혀질때쯤... 더이상 한국영화에 미래는 없다고 느꼇다 ...클레멘타인 2편을 제작해 준다면   개처럼 짖을수 있다  
5-31-2019,2019,5,31,08:02,금요일,10,12,0,홍아란(gomd****),봉준호의 기생충이 아니라 이 영화가 황금종려상을 탔어야했다.  
5-6-2019,2019,5,6,21:46,월요일,10,12,0,Atom(tsdr****),한국 남자에게 시집오길 오늘에서야 잘했다는 생각이 드네요.아론티비 치카코상 대신 글 남겨놓습니다.  
4-3-2019,2019,4,3,00:01,수요일,10,12,0,귀신잡는동아고축구부(kth8****),이영화를 극장에서 보신 3562명은 전생에 나라를 몇번은 구하신 분들입니다 경의를 표합니다  
2-8-2019,2019,2,8,09:14,금요일,10,12,0,빠름(milc****),이 영화를 보고 암이 나은 것은 내가 암을 이긴 것인가 암이 암에 걸려 죽은 것인가?  
1-16-2019,2019,1,16,23:26,수요일,10,12,0,sona****,동묘앞벼룩시장을 하루종일발품팔아 DVD를 구매했다.이제..집안 가보로 영원히 간직하련다..  
1-2-2019,2019,1,2,21:59,수요일,10,12,0,fpdh****,오늘의 제가있을수있엇던건  클레멘타인 덕분입니다.포기하고싶었던 순간도 많앗지만 일어나라는 그명대사한마디가 수렁에서 건져주었죠!감사합니다클레멘타인                                               - 스티븐 잡스  
1-2-2019,2019,1,2,00:57,수요일,10,12,0,예거(stor****),이 영화를 보고 지금의 아내가 먼저 결혼하자 했습니다..진정 인생작  
1-1-2019,2019,1,1,22:01,화요일,10,12,0,nalk****,말이 필요없는 최고의 수작입니다  
12-27-2018,2018,12,27,19:55,목요일,10,12,0,마늘(djma****),평점 주려고 한국말 못하느데 네이버 가입 힜어요. 호주에서도 요즘 다시인기해요.  
12-16-2018,2018,12,16,03:39,일요일,10,12,0,승재(tuet****),"이 세상에 '완전함'이란 것은 존재하지 않지만, 그에 가장 가까운 것은 클레멘타인일 것이다.  "
10-23-2018,2018,10,23,20:53,화요일,10,12,0,누롱이(ldst****),수능을 망치고 이영화를 봤고.. 재수를 할수있게 해준 1년여시간의 원동력이었습니다. 제 인생작. 정말 이 영화를 만즐어준 모든 분들께 감사드립니다. 한국에 이런 영화가 있다는걸 뒤늦게나마 깨달아서 다행입니다.  
10-9-2018,2018,10,9,02:58,화요일,10,12,0,trop****,미국친구가 자막버전을구해달라해서 어렵게구해보내줬네요.작은마을에서영어자막으로상영된 이영화에 울음바다가되었고 지역신문에‘클레멘타인신드롬’으로 기사도 났답니다.이훌륭한 마스터피스를 정말 저만볼수없어서 귀찮아도글을남깁니다.삶에 지친당신 꼭 보시고 주저앉으세요  
9-20-2018,2018,9,20,04:12,목요일,10,12,0,eb197(jaeb****),축구에는 펠레 농구에는 조던이 있다면 영화에는 클레멘타인이 있다.  
9-19-2018,2018,9,19,16:19,수요일,10,12,0,매떡스(rose****),헐리우드에서 리메이크한다고 난리났던게 엊그제 같은데 대체 언제 나오나요? 이동준 역은 톰 크루즈가 맡으면 딱인데  
7-30-2018,2018,7,30,16:17,월요일,10,12,0,박세준(ddak****),이 영화를 보기전까지 전 학교에서 문제를삼는 문제아였습니다 하지만 담임선생님의 추천으로 인해 이 영화를보니 제가 이때까지 살아온 모든기억이 즈마등처럼 스쳐지나가면서 제가 살아온 삶에대한 후회와 미련 그리고 반성이란 감정을 처음 느껴보았습니다  
7-27-2018,2018,7,27,19:29,금요일,10,12,0,김하영(gkdu****),제가 눈을 감을 때 이 영화를 보며 생을 마감하고 싶네요. 제가 감히 평가할 수 없는 영화입니다.  
7-27-2018,2018,7,27,17:43,금요일,10,12,0,광사마(zomb****),내인생에다시 이런명작을볼수있을까..여운이가시질않는다 고마워요 이동준사마  
7-26-2018,2018,7,26,00:37,목요일,10,12,0,양동혁(ygh0****),네이버평점으로 검증된 명작. 이영화를 본이후로 그어떤 영화도 나에게 눈물을 흘릴 감동을 주지않는다.  
7-25-2018,2018,7,25,23:37,수요일,10,12,0,아로링(xhfl****),마지막 눈물흘렸어요....진짜 인생작임 ㅠㅠ  
7-25-2018,2018,7,25,18:07,수요일,10,12,0,루이르(rnac****),오늘밤은 클레멘타인과 맥주와 함께...  
7-25-2018,2018,7,25,17:45,수요일,10,12,0,printemps 관우(vovl****),사실 그렇게 아주 좋다고 할 수는 없는 영화이지만 영화적 감각은 충분하고 보고 소장할 만한 가치도 있습니다. 영화는 영원하며 평점은 절대 거짓말 하지 않습니다.  
6-12-2018,2018,6,12,11:47,화요일,10,12,0,캐릭터바이러스(jbra****),공부에 흥미가 생겼습니다  
6-9-2018,2018,6,9,01:05,토요일,10,12,0,최정헌(uhg9****),무슨 말이 필요하리오?  
5-1-2018,2018,5,1,18:19,화요일,10,12,0,머쨍이(cwi8****),아니 진짜 뻥아니라 잼있습니다.  
4-29-2018,2018,4,29,19:13,일요일,10,12,0,김찌치개(ghlw****),다른말은 필요없다..  
4-29-2018,2018,4,29,00:08,일요일,10,12,0,게겐프레싱(kmfo****),나 홀로 보고 싶고 간직하고 싶은 그런  영화. 하지만 모두에게 보여주고 싶은 명작  
4-28-2018,2018,4,28,00:42,토요일,10,12,0,똘똘이(rlae****),아빠일어나 장면은진짜 ㅠㅠ  
4-26-2018,2018,4,26,22:03,목요일,10,12,0,청량감(tlsr****),실명한사람은 눈을 뜨게 해줄것이며 발기부전은 다시 활기차게 해줄것이며 손가락이없는 사람은 손이나와서 별점 10점을 누를것이다  
4-26-2018,2018,4,26,18:26,목요일,10,12,0,아이(poin****),대단한 시키들..ㅋㅋ 자 다음은 성냥팔이소녀의 재림이다 출동하자  
4-24-2018,2018,4,24,23:40,화요일,10,12,0,hsmi****,클레멘타인 안본눈 삽니다. 왜냐하면 다시 또 봐야 하거든요.  
4-19-2018,2018,4,19,16:50,목요일,10,12,0,UL산(aldn****),"“아빠, 일어나” 할 때 제 온몸의 털이 일어남을 느꼈습니다.  "
4-17-2018,2018,4,17,08:06,화요일,10,12,0,shru****,내 살면서 아부지욕하는거 한번도못봤는데 아부지가 욕함 . 그만큼재밌음  
4-8-2018,2018,4,8,14:27,일요일,10,12,0,김준서(kjs4****),이제서야 별점을 준다는 것이 정말 창피합니다..  
4-7-2018,2018,4,7,19:25,토요일,10,12,0,우주대통령(film****),클레멘타인 2편은 나올까....? 죽기전에 꼭 보고싶다...  
3-3-2018,2018,3,3,01:05,토요일,10,12,0,예림이그패까봐(rayn****),토익시험 치다가 보기에 clementine이 있길래 문제도 안 읽고 그냥 찍었는데 맞췄습니다. 감사합니다.  
3-1-2018,2018,3,1,16:48,목요일,10,12,0,존경(luck****),저는 클레멘타인이라는 영화를 보지 않았습니다. 그 이유는  평을보고 도저히 보고싶음을 참을수가 없지만 저의 이 안본눈과 뇌를 평생 간직하고 죽기전에 이영화를 끝으로 삶을 마무리 하고 싶기때문입니다.  
2-12-2018,2018,2,12,00:48,월요일,10,12,0,J0(jjyo****),"가끔 어르신들이 ""전쟁도 안 겪은 것들이""라고 말하는 것처럼 나도 먼 훗날 이렇게 말할 수 있을 것 같다. ""클레멘타인도 안 본 것들이""  "
12-13-2017,2017,12,13,10:04,수요일,10,12,0,이슬(rigo****),"많은 사람들이 장난으로 높은 평점을 주지만 저는 진심으로 10점을 드립니다. 물론, 영화를 평가하는 10점은 아닙니다. 끝까지 창을 안닫고 엔딩까지 본 제 스스로에게 10점을 줍니다.  "
7-11-2017,2017,7,11,00:54,화요일,10,12,0,드레그닐(bact****),"나는 생각한다 고로 클레멘타인을 본다. 이런 말이 절로 나올 정도로 정말 아버지의 사랑을 많이 느낄 수 있는 영화였습니다. 특히 무,무슨일이야? 라는 대목에서 오열을 하였습니다.  "
7-8-2017,2017,7,8,10:50,토요일,10,12,0,아미타(roll****),2억을 투자해서 52억을 벌게 했다는 그 영화  
6-29-2017,2017,6,29,21:40,목요일,10,12,0,민귀요미(minc****),"흔히 남자는 세번 운다고들 하죠... 하지만 사실 두번뿐인거 아시나요? 첫번째는 태어났을때, 두번째는 클레멘타인을 봤을때입니다. 세번째가 없는 이유는 이 영화에 평생 쏟을 눈물을 다 쏟아서 이제 더 쏟아낼 눈물이 없거든요...  "
6-3-2017,2017,6,3,05:48,토요일,10,12,0,조구(shal****),1과 10은 한 끗 차이에 불과하다  
5-5-2017,2017,5,5,22:55,금요일,10,12,0,셔터(hell****),누군가 삶의 이유를 찾지 못할때조용히 팝콘과 클레멘타인DVD를 건내며 웃고싶다  
7-25-2015,2015,7,25,07:26,토요일,10,12,0,피로(cell****),이 영화를 본 후 오장육부의 위치가 바뀌었다.  
6-10-2015,2015,6,10,16:44,수요일,10,12,0,날쌘줄리안우랭이(sadm****),"헐 헐리웃영화인지 알았는데 우리나라영화였네요탄탄한스토리,잠시도 눈을 떼지 못하게 만드는 액션,잔잔한 감동, 삼박자가 잘 갖춰진 영화네요왜 이작품을 이제서야 봤는지..  "
1-1-2015,2015,1,1,06:51,목요일,10,12,0,powe****,와 새해 해 뜨는걸 기다리면서 영화 봤습니다...왠지 올해는 좋은 일만 가득할것 같습니다 클레멘타인 감사합니다 ...아 눈물때문에 해를  재대로 볼수나 있을까요...하흨  
2-13-2014,2014,2,13,14:13,목요일,10,12,0,ratm****,드디어 오늘에서야 클레멘타인을 봤네요.. 정말 감동이였습니다. 안보신 분들게 꼭 추천합니다.  
7-25-2018,2018,7,25,22:54,수요일,10,13,1,dlgm****,이 영화를 보고 둘째가 생겼습니다.  
7-25-2018,2018,7,25,15:13,수요일,10,13,1,머찌니(sm52****),하도 평점이 좋고 하도 좋은 말만 있어 뭐가 대단한 영화라고 이렇게들 떠드나? 생각하며 시청하였다. 말기 간암인 친한 친구녀석과 좋은 추억을 만들기 위해 같이 보았다.암이 자연치유되었다고 완치판정받았다고 연락이 왔다.  클레멘타인은 기적이다.  
3-31-2018,2018,3,31,09:48,토요일,10,13,1,Dahee(dh95****),"저는 췌장암말기환자입니다. 암재활치료 수단으로 의사선생님께서 영화 클레멘타인을 하루에한번씩 보라고 처방해주셨습니다 한달동안 매일매일 뜨거운눈물을 흘리며 본결과, 암세포의 절반이 암에걸려서 사라졌습니다 감사합니다 이동준. 감사합니다 클레멘타인!  "
6-5-2017,2017,6,5,01:34,월요일,10,13,1,메시의그곳(skrg****),야이 xxx들아 평점도 높고 평가도 엄청 좋아서 봤는데 이거 뭐냐 진짜ㅋ 내 일생에 이런 명작은 처음본다ㅋ 이런 영화를 이제야 알다니 친구들한테도 알려줘야겠다ㅋ 이거 보고 나면 다른 영화 볼 엄두가 안남  
8-24-2016,2016,8,24,19:50,수요일,10,13,1,as84****,내나이33살에 큰쇼크를받았다!!! 영화를보고난뒤 말도안되게 난2004년으로돌아왔다...9월30일날 군입대인데ㅠㅠ 영화를보며울고 나를보며울었다ㅠㅠ  
2-25-2016,2016,2,25,14:18,목요일,10,13,1,jong****,이력서 취미란에 클레멘타인감상이라고 썼는데 면접없이 합격했습니다.  
7-19-2015,2015,7,19,02:37,일요일,10,13,1,zero****,인생은 돈 여자.. 그리고 클레멘타인  
2-8-2015,2015,2,8,23:07,일요일,10,13,1,전복죽(cham****),친척 보증 잘못써서 전재산을 날렸을 때도 이렇게 분노하지 않았다. 이 작품을 영화관에서 보지 못했다는 분노에  화가 치밀어 죽어서도 눈을 감지 못할 것 같다.  
2-21-2019,2019,2,21,15:43,목요일,10,15,3,이치훈(chih****),일본은 독도가 자기네 땅이라고 우기더니 이제는 이영화가 자기나라 영화라고 우기네요.  
5-11-2019,2019,5,11,21:08,토요일,10,11,0,이발사(barb****),"북한이 아직도 핵을 포기하지 않는 이유가 바로, 한국에 '클레멘타인'이 있기 때문이라는군요. 인민들에게 이 영화는 사상과 체제 붕괴의 위험성을 고스란히 담고 있다고 합니다.  "
5-5-2019,2019,5,5,09:33,일요일,10,11,0,AHHA(kdyi****),현 시점에서 이 영화와 엔드게임이 동시에 개봉했더라면 엔드게임은 말그대로 가망없음이다.마블의 수장 케빈파이기는 어떻게든 클레멘타인을 피해서 개봉하려고 필사적인 움직임을 보였을 것이다  
5-1-2019,2019,5,1,10:37,수요일,10,11,0,없음(kkik****),ㅋㅋㅋㅋ 아로치카~~~  
4-30-2019,2019,4,30,21:29,화요일,10,11,0,jd(mywa****),아로치카~~~☆☆☆  
4-22-2019,2019,4,22,12:34,월요일,10,11,0,후우루우루꾸루후루꾸(shoo****),어벤져스 엔드게임 다행인줄알아라 지금 이 영화가 나온다면 국물도 없어  
4-8-2019,2019,4,8,14:16,월요일,10,11,0,맘대루(jinp****),주위에서 하도 보라고해서 봤는데요. 정말.... 보는 내내 눈물샘이 멈추질 않더라구요... 왜 한국영화계의 평점 1등 공신이라는지 이번 기회에 알게 된 정말 자랑스러운 한국영화 입니다.  
2-3-2019,2019,2,3,12:42,일요일,10,11,0,잠이항상부족해여(dltp****),"한 가장의 잔잔한 인생 이야기를 이런 식으로 풀어나갈 수 있다는 것에 놀라웠다. 마치 옛날 골동품 가게에 들어갔을 때의 묵직한 공기가 나를 짓누르는 느낌. 처절하고,감동적이다.  "
2-3-2019,2019,2,3,00:10,일요일,10,11,0,조조맹덕(redm****),내 동생에게 소개시켜 좋습니다  
1-1-2019,2019,1,1,21:45,화요일,10,11,0,dd(sss0****),그저 빛.. 다시 보러 갑니다  
12-24-2018,2018,12,24,19:58,월요일,10,11,0,마령군왕(slay****),다시 개봉하라! 천만은 훌쩍넘을 명작이다  
9-11-2018,2018,9,11,03:15,화요일,10,11,0,Director(tjk2****),"당신의 남은 인생중   단   한시간만 주어진다면 , 이영화를 보는데 사용하라.  "
9-4-2018,2018,9,4,00:25,화요일,10,11,0,향기미소(acdc****),방금 보고 글 쓴다. 지금까지 살아온 내 인생이 허무하게 느껴진다. 간만에 몽블랑 만년필에 잉크를 보충해야겠다. A4 용지로 20장 분량의 수필을 쓸 수 있을 것 같다. 대부1-터미네이터2와 함께 내 인생 top3에 들어가는 영화다  
9-3-2018,2018,9,3,19:42,월요일,10,11,0,자동차문의(0183****),다 보려고 노력했지만 30분만에 꺼버렸네요 다 바버리면 앞으로 다른영화를 못볼것 같아서 죽기직전 나머지 다 볼려구요  
8-8-2018,2018,8,8,16:41,수요일,10,11,0,Sunny(para****),"재미, 감동 거기에 철학적인 깊은 뜻까지 이시대 최고의 영화 왜 평점이 9.32가 되는지 이해가 안되내요. 이건 최소 평점 9.6이상이어야 되는거 아닙니까?  "
8-1-2018,2018,8,1,17:06,수요일,10,11,0,마리(casu****),"네이버 평점 부동의 1위일 줄 알았는데, 많이 내려갔네요.  "
7-27-2018,2018,7,27,01:05,금요일,10,11,0,ClaudeMakelele(eoal****),우리가 뭐라고 감히 이 영화를 판단하는가. 1점도 10점도 이 영화 앞에서는 의미없는 숫자에 불과한 것을...  
7-25-2018,2018,7,25,18:10,수요일,10,11,0,한비야레알(gnh0****),"만약 100점이 있었다면 나는 100점을 줬을것이고, 1,000점이 있었다면 나는 1,000점을 줬을것이다.  "
7-21-2018,2018,7,21,21:06,토요일,10,11,0,milkrudy(abov****),"이 영화를 본 후 한동안 영화를 보지 않았습니다.  다른 영화, 아니 그냥 영화가 눈에 들어오지 않더군요. 클레멘타인을 추천해주신 분들을 한번 만나뵙고 싶습니다.  "
7-21-2018,2018,7,21,19:10,토요일,10,11,0,초록별님(jjhp****),두번 세번을봐도 만점을 줄수 밖에 없는..  
7-21-2018,2018,7,21,18:25,토요일,10,11,0,ihy1****,그저 한줄기의 빛과 같은 영화...눈부셔서 눈이 멀어버렸다...  
7-21-2018,2018,7,21,13:21,토요일,10,11,0,yoon****,갑자기 에어콘이 고장나서 자살충동을 느끼던 와중에 나에게 자장큰 감동을 주었던 영화인 클레멘타인을 마지막으로 한번만 보고 죽자고 보게되었습니다 이 영화가 나늘 살렸습니다 동준이형님에 비하면 나는.. 동준이형님 감사합니다  
7-4-2018,2018,7,4,20:36,수요일,10,11,0,tjdq****,한번 다운 받아보세요 돈 값 제대로 합디다  
6-13-2018,2018,6,13,03:07,수요일,10,11,0,토니스타크(blue****),이영화가 끝나고 방안이 온통 눈물바다가 되었고 지금 헤엄치면서 이 글을 씁니다. 살려주세요.  
3-18-2018,2018,3,18,00:52,일요일,10,11,0,또치(xlov****),한국인이 선정한 재개봉 원하는 영화 1위 <클레멘타인>... 그 시절 아날로그만으로도 이러한 감동을 준다는것이 경이로울 뿐... 블루레이 화질로 다시 재개봉 한다면... 역대 관객수 기록할 분명한 작품  
8-26-2017,2017,8,26,20:48,토요일,10,11,0,dltk****,인류가 처음으로 동굴벽화를 그린 이후 지금까지 나온 모든 예술 작품들은 그저 클레멘타인을 만들기 위한 시험작에 불과하다  
8-22-2017,2017,8,22,11:20,화요일,10,11,0,HangM00n(park****),"역사상 가장 지혜로운 임금 솔로몬의 선택같은 영화였습니다. 아마 그가 이 영화를 봤다면 이렇게 말했겠지요. ""이 영화를 둘로 갈라라.""  "
7-25-2017,2017,7,25,18:08,화요일,10,11,0,돌리고돌리고(love****),아빠가 된이후로 가장 감동 받은 영화였네요. 와이프와 함께 맥주를 마시며 봤는데 대화가 없던 우리 부부사이에 다시 대화가 시작되고 1시간이상을 그렇게 대화의 장을 열었네요^^ 그래 너라도 있어 다행이다 라는 생각도 드네요.  
5-6-2017,2017,5,6,01:03,토요일,10,11,0,붉은바람(zlet****),우울할때마다  들러서 힘을 얻어 갑니다  
4-29-2017,2017,4,29,04:14,토요일,10,11,0,메이드(made****),인터스텔라..유주얼서스펙트.. 다 ㅈ..까라그래!  
4-10-2017,2017,4,10,22:19,월요일,10,11,0,815콜라(tmtm****),울다가 나온 눈물이 양동이 하나 채웁니다... 구라같죠? 보면압니다  
3-27-2017,2017,3,27,01:09,월요일,10,11,0,fawkes(hw88****),"시험에서 낙방만 3년째, 생일날 국가고시에 또 낙방한 소식을 접하고 취할대로 취해버린 후, 이 영화를 접하고 난 그만 울어버렸다. 이후 난 곧 취직해서 반듯한 가장이 되었다. 클레멘타인은 내 삶의 메시아같은 존재다. 남들이 우스개라 놀려도 상관없다.  "
3-19-2017,2017,3,19,20:06,일요일,10,11,0,생각중(ckdd****),"미국에서 올드보이는 몰라도 '클레메ㄴ...' 까지만 말해도 ""oppa iluna"" 를 외치며 폭풍오열을 한다고 한다.  "
4-19-2016,2016,4,19,15:31,화요일,10,11,0,어르신(neos****),3번 보고 불치병이 나았습니다..  
3-6-2016,2016,3,6,21:01,일요일,10,11,0,너무나도(zota****),여기에 1점주는 새끼들은 뭐냐.. 새누리당 알바냐  
11-30-2015,2015,11,30,21:59,월요일,10,11,0,난 나다(ddxk****),신께서 사람을 만든이유가 이영화를 보게함이었다고 클멘복음 18장 18절에 나와있다.  
6-13-2015,2015,6,13,02:06,토요일,10,11,0,풀장(pool****),클레멘타인 안 본 뇌 삽니다.  
1-3-2014,2014,1,3,01:51,금요일,10,11,0,옥개믐(au12****),진짜 내생애최고의영화.  아역배우 연기도 일품이었고  자꾸 눈물이나서  쉬면서  봤다.  
6-25-2013,2013,6,25,03:40,화요일,10,11,0,신성(maru****),말로만듣던 명작  
8-5-2018,2018,8,5,07:03,일요일,10,12,1,김지수(kjs3****),10점말고 100점 주고싶다... 네이버 별점 시스템 안바꾸냐?  
7-26-2018,2018,7,26,21:41,목요일,10,12,1,romanticist(ehdr****),10년째 짝사랑여자가 있었습니다.  그녀는 저를 남사친으로만 생각했죠 커피숍에서 인강을듣던중 우연히 그녀가 제가 다가왔습니다 후딱 이영화를 틀었죠  그녀가 제 옆으로와서 뭐야?하고 묻더니 영화를 보기 시작합니다. 그러고 우리사랑이 시작됬습니다  
5-22-2017,2017,5,22,20:15,월요일,10,12,1,시크라임(flyh****),제게 인생의 나침반같은 영화였습니다영화를 보시면 똥꼬가 간지러우실겁니다이 영화로 인해 이동준씨가 50억의 빚을지고 밤무대에서 똥꼬쇼까지 해가며 열심히 빚을 갚으셨거든요 영화스토리가 영화안에서만 끝나는것이아니라 그 여운이 똥꼬깊숙히 느껴지실겁니다  
10-15-2015,2015,10,15,22:26,목요일,10,12,1,Rationology(soun****),인생은 B (Birth)와 D (Death) 사이의 C (Clementine)이다.  
2-17-2015,2015,2,17,22:43,화요일,10,12,1,김재민(kkju****),저희아버지께서 이걸보고 후회하지말라고하였다.난 결국 이영화를 보았다. 난 눈물을 너무 많이 흘려 눈물샘이 막혔다.  
2-15-2015,2015,2,15,02:00,일요일,10,12,1,문승준(june****),아빠 일어나...이 심금을 울리는 한마디는 자식은 커녕 여자친구도 없는 내가 마치 세 쌍둥이를 둔 송일국이 된 기분을 느끼게 해주었다.  
7-30-2014,2014,7,30,17:11,수요일,10,12,1,exca****,폭주족 친구가 이영화를 보고는 걸어다니기 시작했습니다  
6-3-2013,2013,6,3,09:09,월요일,10,12,1,anti****,만약 갓도그님이 보셨다면 바로 살아나셨을영화 갓도그님 힘내세용~~♪  
8-19-2018,2018,8,19,03:02,일요일,10,13,2,꺄흥응응(lucy****),와...진짜 나쁜사람들...너무하다...꼭 그래야만 속이 후련했냐...  
2-25-2019,2019,2,25,00:06,월요일,10,14,3,호호오빠(polo****),역시 네이버영화 평론.별점은 정확하다. 이거보고 선택한 영화는 거를게 없다. 영화보고 너무 울어 내일 부은눈으로 출근할걸 생각하니 부끄럽지만 후회는 없다. 누군가 물어보면 이영화를 보느라 그랬다고 말할것이고 모두 고개를 끄덕이며 이해할것이기에...  
8-30-2014,2014,8,30,22:17,토요일,10,14,3,alsltapdlem(alff****),별점 낚시라는 애들 뭐냐- _-  
6-7-2019,2019,6,7,00:07,금요일,10,10,0,재웅(cjsw****),와 인생영화입니다 기생충은 진짜 비교도안됍니다.  
6-5-2019,2019,6,5,17:28,수요일,10,10,0,온대성저기압(youn****),낚는 사람만 있고 낚이는 사람은 없다  
6-5-2019,2019,6,5,06:39,수요일,10,10,0,혁명군(thfl****),최고의 역작이다 아직도 눈물이 나와 안과에 다니고 있다  
4-23-2019,2019,4,23,15:30,화요일,10,10,0,알몬드(dxfo****),"영화 전체에 수준 높은 연기자들이 포진해있습니다. 카메라웤, 장엄한 관현악 ost, 빠른 내용전개. 해외 로케마저도 조연,까메오, 단역들,  세세한 부분 버릴 장면이 없네요.. 격투기장면도 임팩트 있지만 가슴 뭉클한 가족영화 입니다.  "
4-6-2019,2019,4,6,00:14,토요일,10,10,0,evilthirst(hell****),평점 10점 준사람 중에 영화 제대로 본사람 얼마나 될까? ㅋㅋㅋ  
4-4-2019,2019,4,4,00:36,목요일,10,10,0,jymi****,"""일어나"" 하면 김광석보다 사랑이가 먼저 떠오릅니다  "
3-22-2019,2019,3,22,08:18,금요일,10,10,0,김환희(suji****),로또 1등에 당첨될래? 영화 클레멘타인을 볼래?누군가 제게 묻는다면 단1초의 망설임도없이 클레멘타인을 보겠습니다~~이 영화만 생각하면 그때의 감동이 떠올라 아직도 가슴이 벅차오릅니다.  
2-8-2019,2019,2,8,18:47,금요일,10,10,0,OPQIST(leky****),처음엔 단순한 호기심이었다... 인간은 호기심으로 멸망할 것이다.  
2-5-2019,2019,2,5,00:44,화요일,10,10,0,Briller(aqua****),여기가 별다섯개로입장해야하는 그유명한 성지입니까?  
2-2-2019,2019,2,2,12:10,토요일,10,10,0,심슨(sim0****),아OO 할말을 잃었슴다  
1-31-2019,2019,1,31,01:35,목요일,10,10,0,소품사랑(m200****),철없던 20대에 이 영화를 추천해준 고마운 내친구....15년이라는 세월이 흘렀지만 나는 그친구에게 보답할 영화를 아직까지 못찾고 있다....고맙다 상현아 언제한번 링에서 꼭 만나자  
1-24-2019,2019,1,24,17:37,목요일,10,10,0,초승이달(wnal****),대한민국 사람이라면 꼭 봐야 하는 영화입니다! 마지막에 나오는 외국 여자 간호사 배우의 표정이 잊혀지질 않습니다.  
1-21-2019,2019,1,21,02:32,월요일,10,10,0,고래사냥꾼(ghdw****),근데 진짜 진지하게 낚으려는거 아니고 전 초딩때 재밌게봤던거같은데 기억왜곡인가요?  
1-19-2019,2019,1,19,11:40,토요일,10,10,0,박미키(beth****),나이 30중반에 다시 태권도를 시작합니다 근데 패키지라 속셈 보습 피아노를 같이 해야되네요  
1-18-2019,2019,1,18,21:18,금요일,10,10,0,Sanctus Christus(wnst****),15주년 기념 재개봉 해주세요  
1-3-2019,2019,1,3,19:46,목요일,10,10,0,김이석(theg****),전국..누적관객 6만4천명 ..그들은 어디서 왔고 또 어디로 갔는가...언젠가 그들은 반드시 돌아온다.... 비밀을 간직한채 구천을 떠도는 6만4천의 영혼들이여...  
12-28-2018,2018,12,28,11:45,금요일,10,10,0,fupp****,지금 이 평점을 남기는게 한국영화 역사에서 유의미한 결과를 내는데 일조하리라는 확신을 합니다  
12-25-2018,2018,12,25,14:21,화요일,10,10,0,경기머장(harr****),이세돌이 알파고에게 대항한 인류마지막 '신의한수' 어쩌면...  클레멘타인이 아닐까?  
12-24-2018,2018,12,24,19:02,월요일,10,10,0,김강은(psc2****),"타임지 선정,죽기전에 봐야 할 영화 중 하나로 뽑혀...  "
12-20-2018,2018,12,20,08:23,목요일,10,10,0,시타엘(gunx****),장난인줄 알았습니다... 하지만 진짜 였습니다..  
12-20-2018,2018,12,20,03:26,목요일,10,10,0,qse1****,"이게 2004년 영화라고? 2044년 영화라고 해도 믿을 화려한 액션과 시대를 앞서간 각본, 액션 영화의 교과서  "
12-16-2018,2018,12,16,00:22,일요일,10,10,0,Indolence(gusa****),이 명작 나만 볼순 없지.  
12-14-2018,2018,12,14,17:51,금요일,10,10,0,happyjjam(hyes****),엄청난 반전영화!!!!9.33이란 평점으로 기대하며 봤는데영화를 본 후 평점을 다시보니 이해가 되었다...  
12-12-2018,2018,12,12,21:27,수요일,10,10,0,GM사리(7031****),대부분 출연진은 이작품이후 활동이 없었다.. 그이유는 다시는 이런 명작을 찍을수 없기때문이 아닐까?  
12-6-2018,2018,12,6,11:38,목요일,10,10,0,사랑포스(boss****),"""아빠 일어나""는 정말 이시대 최고의 명대사..  "
10-5-2018,2018,10,5,20:44,금요일,10,10,0,강아지멍멍(rend****),"꿈을 기적을 낳코 기적은 클레멘타인을 낳았다,,  "
9-14-2018,2018,9,14,10:22,금요일,10,10,0,엄마사랑해(qhsr****),지금까지 한13번봤네요 볼때마다 오열합니다.  
8-30-2018,2018,8,30,01:56,목요일,10,10,0,아이엠그루트(ohze****),대체 왜 영화 평점은 10점이 최고 점수일까? 뒤에 0을 하나 더 붙여도 아깝지 않은 영화이다. 암도 낫게 해주고 앉은뱅이도 다시 일어설수있게 해주며 한번도 안본사람은 있어도 한번만 본사람은 없다는 그 명작. 꼭 보기바란다.  
8-23-2018,2018,8,23,06:49,목요일,10,10,0,앙(ay38****),"한국의 아바타? 아니, 이건 한국의 클레멘타인이다.  "
8-23-2018,2018,8,23,01:18,목요일,10,10,0,김두기(skds****),아바타를 뛰어넘는 영상미 마블씨리즈보다 탄탄한 스토리식스센스 아이덴티티보다 강력한반전이연걸 견자단의 그어떤 영화보다 화려한 액션씬그어떤 영화보다 감독적이고슬픈아빠 일어나 라는명대사를남긴1분 1초도 눈을땔수없는 모든걸 초월한범우주적인영화  
8-21-2018,2018,8,21,16:53,화요일,10,10,0,ntas****,아빠일어나!를 듣고 30년만에 발기부전이 치료됬습니다 감사합니다  
8-20-2018,2018,8,20,15:00,월요일,10,10,0,ydki****,전설은 계속된다. 역사상 최고의 영화  
8-15-2018,2018,8,15,15:33,수요일,10,10,0,케디유(nsa9****),박평식 : 무슨말이 필요한가? 일단보라.  
8-8-2018,2018,8,8,18:09,수요일,10,10,0,황현석(noe2****),10점만점에 10점.  
8-6-2018,2018,8,6,00:37,월요일,10,10,0,이솜(tock****),기분 우울할때 여기 와서 평점만 읽어도 어느정도 기분 풀리겠다..  
8-5-2018,2018,8,5,18:56,일요일,10,10,0,기초생활수급자(vanh****),난 나폴레옹 칭기즈칸 히틀러 알렉산더 대왕 이 사람들을 위인이라 칭하지 않는다. 그들은 수십번 수백번 승리했어도 패배자일 뿐이다..  클레멘타인 전 세계에 살았기 때문이다. 만약 그들이 이 영화를 봤다면 지구의 역사는 어떻게 바뀌었을지 아무도 모른다.  
8-5-2018,2018,8,5,01:36,일요일,10,10,0,kara****,우울해서 왔습니다. 다들 감사합니다  
8-5-2018,2018,8,5,01:34,일요일,10,10,0,동전도사(qpmz****),폭염에 지치실때 집에서 편하게 보시길...평점 9.99까지 다같이 힘내시길...  
8-1-2018,2018,8,1,15:30,수요일,10,10,0,THELUCKY(ymr5****),이 영화를 보고 시력이 3.0이 되었습니다  
7-31-2018,2018,7,31,21:37,화요일,10,10,0,과학자신태용(dnjs****),이걸보고나서 눈물이 멈추질 않아서 눈물을모아 배추를 절여 김치 담가먹었다 정말 좋은영화다  
7-30-2018,2018,7,30,00:43,월요일,10,10,0,happ****,태초의 우주 빅뱅 그이전 아무것도 없던 무였을때부터 우주의 끝까지 끝을 넘어 그무엇이되었든 모든것을 담아버린 명작!!!인류는 이영화를 평가하기에는 이르다! 수천년또는 수억년이 흘러도 이영화는 인류가 지구에 살았있었다는 전설로 기록될것이다.  
7-28-2018,2018,7,28,20:44,토요일,10,10,0,토시로(cias****),저는성냥팔이소녀의재림을보았으며 짝사랑그녀와첫데이트에 이영화를보았고 최근에속닥속닥까지 모두극장개봉할때 보았습니다살면서 영화관람으로 그랜드슬램을 달성하고 이곳에 와 드디어 당당히평점을남기네요 무엇을보더라도 희망을잃지않는 용기를 세영화를 보고서얻게되었습니다  
7-26-2018,2018,7,26,21:51,목요일,10,10,0,제비(sh78****),최고라는 이말밖에는 ...  
7-25-2018,2018,7,25,13:56,수요일,10,10,0,스포츠조아(cody****),진정한 인생영화네요.네이버평점9점이상은 항상 감동과 재미가있네요.역시 믿을만합니다  
7-24-2018,2018,7,24,07:03,화요일,10,10,0,로이킴에버(gukh****),"솔직히 장난으로라도 평점 조정을 위해 1점을 주고 싶지만, 혹시 매크로 댓글조작으로 잡혀갈까봐 포기하고 10점 줍니다.  "
7-24-2018,2018,7,24,02:24,화요일,10,10,0,나무자비조화불(jswk****),대한민국 역대 최고의 액션 대작  
7-24-2018,2018,7,24,01:57,화요일,10,10,0,부엉이(ao54****),이건 죽기전에 무조건 봐야한다 안 그럼 죽어서 엄청 후회할거야  
7-23-2018,2018,7,23,23:23,월요일,10,10,0,끝판보스(milk****),진짜 내 생애 다시 없을 명대사 아빠 일어나!! 내게 있어 이 한마디는 아무런 의지 없이 살아가던 내가 다시 일어나는 원동력이 돼줬다. 감사합니다. 클레멘타인. 나도 다시 시작할 수 있을 것 같아요.  
7-21-2018,2018,7,21,21:04,토요일,10,10,0,벤덤(dbsl****),최고의명작 하루가 24시간이 아니라 48시간이 되는기적  
7-21-2018,2018,7,21,00:58,토요일,10,10,0,왼쪽 유두학(dbsw****),이 영화를 보고 발기부전이 나았습니다  
7-19-2018,2018,7,19,20:05,목요일,10,10,0,오주찬(0212****),한국영화계 2대 대작 클레멘타인과 성냥팔이 소녀의 재림  
7-3-2018,2018,7,3,17:56,화요일,10,10,0,yst2****,"못본 사람은 있어도, 한번 본 사람은 없다! 아빠 일어나!  "
7-2-2018,2018,7,2,16:59,월요일,10,10,0,thjj****,엄청난 명작이라 아직까지 볼 엄두가 나지 않는 영화평점이 10이 아닌게 의문스러울정도로 최고의 영화이다  
6-19-2018,2018,6,19,18:36,화요일,10,10,0,유유자적(cnxn****),21세기 수 많은 명작들이 언급됩니다. 명작은 영화를 보고도 여운이 강하게 남죠...클레멘타인을 본지 어느 덧 10년...아직도 제 귓가에 선명하게 들리네요 “아빠 일어나”  
6-17-2018,2018,6,17,13:29,일요일,10,10,0,치킨사줘(cas5****),엄청난 감동.... 의자에서 일어날 수 없을 정도로 눈물이 쏟아졌다  
6-17-2018,2018,6,17,00:04,일요일,10,10,0,보람찬놈(kina****),암환자인데 이거보면  나을수있나요?  
6-16-2018,2018,6,16,00:56,토요일,10,10,0,vhsz****,이게 영화냐?  예술그자체다    예술이란.. 이런것.. 아빠.일어나!! 전율이 느껴졋다... 감동 그 자체  
6-15-2018,2018,6,15,23:27,금요일,10,10,0,미칠이(hull****),좀전에 8번째 정주행 했다그래도 찡~~하다..하~~~~  
6-15-2018,2018,6,15,20:41,금요일,10,10,0,asltp12(alst****),한국영화 최대의 걸작.  
6-13-2018,2018,6,13,22:02,수요일,10,10,0,누니(heej****),감당할 자신이 없어 차마 볼수 없는 영화  
5-30-2018,2018,5,30,09:56,수요일,10,10,0,나라(sams****),"어번져스 볼때마다 생각이 듭니다 타노스를 이길수 있는 유일한 방법 ""아빠 일어나!""  "
5-26-2018,2018,5,26,20:50,토요일,10,10,0,검단(rlat****),나는 많은 사람들이 바라는 클레멘타인2가 나오지 않았으면 좋겠다. 후속편을 아무리 잘 만들어도 절대 클레멘타인1보다 잘 만들수는 없을것같다. 난 클레멘타인이 그저 내 기억속에 이대로 영원한 명작으로 남아 있으면 좋겠다.  
5-22-2018,2018,5,22,20:14,화요일,10,10,0,hakenaino(irio****),보지 않았습니다. 살아있을 이유 하나를 간직하게 해 준 영화에게 감사할 따름입니다.  
5-20-2018,2018,5,20,01:23,일요일,10,10,0,pajo****,"그만 좀들 해라.. 어떻게 전 국민이 14년째 이러고들 있나. ..라고는 했지만 ,  나 역시 10점을 줄 수 밖에 없는 나 자신에 놀랬다.  "
4-30-2018,2018,4,30,23:35,월요일,10,10,0,dunpeel(dunp****),봐버렸다.  꼭 보세요.  
4-24-2018,2018,4,24,19:47,화요일,10,10,0,서장우(tjwk****),이 영화는 단연코 미쳤다  
4-20-2018,2018,4,20,23:23,금요일,10,10,0,ijak****,이제 나는 이동중에는 시바스리갈을 마신다.  
4-20-2018,2018,4,20,22:38,금요일,10,10,0,이종언(lje8****),이 영화를 보고 나를 태어나게 해주신 아버지와 어머니께 절을했다. 아버지 어머니 정말 감사합니다. 덕분에 이 영화를 보게되었습니다  
4-18-2018,2018,4,18,00:02,수요일,10,10,0,태지마음(kpu5****),나는 내일 지구가 멸망한다해도 클레멘타인을 볼 것이다.  
3-30-2018,2018,3,30,02:41,금요일,10,10,0,JinLong(aktm****),아기 때 기어다니던 나도 아빠 일어나 소리 듣고 걸어다니기 시작했다.  
3-28-2018,2018,3,28,11:46,수요일,10,10,0,가장멋진사나이(toug****),누군가 울고있다면 클레맨타인을 보았음에 틀림없다. 곁에서 조용히 함께 울어주면 된다.  
3-21-2018,2018,3,21,14:03,수요일,10,10,0,kurt****,전 한국말을 모르는 아랍에미레이트 사람입니다. 이영화를 보고 한국말로 댓글을 쓰게되었습니다  
2-5-2018,2018,2,5,20:00,월요일,10,10,0,kisros81(kisr****),이 영화를 본 사람들은 울지 않는다.영화 중에 다 울었기 때문이다.  
2-5-2018,2018,2,5,16:27,월요일,10,10,0,아카스텔라(akat****),이 영화를 보고 구몬을 했더니 선생님이 안왔습니다  
12-25-2017,2017,12,25,23:40,월요일,10,10,0,아프지마라(korj****),미친인간들아 니네하고 눈높이 틀리다고 평점 깍지마라 니네는 감동을 아냐? 감정들아 일어놔  
12-23-2017,2017,12,23,22:36,토요일,10,10,0,소리워니(iaml****),친구가 추천해서 봤습니다. 금세기 최고의 영화라고 감히 말하고 싶군요. 친구야 고맙다 개x끼야  
12-23-2017,2017,12,23,03:16,토요일,10,10,0,문보남(zecs****),경기도 용인시 기흥구 스티븐신갈 동으로  주소명 변경해달라고  13년째 시청에  민원넣고  있는  1인 입니다.  
12-23-2017,2017,12,23,02:45,토요일,10,10,0,고바퀴(roac****),클레멘타인 DVD를 꽂자 고장났던 모니터가 갑자기 켜지더군요!  
12-19-2017,2017,12,19,04:48,화요일,10,10,0,faeifjio(ij03****),그냥 흔한 90년대 영화같았음 2090년대  
12-17-2017,2017,12,17,19:25,일요일,10,10,0,ABCBA(dnck****),그만해 미친놈들아ㅋㅋ  
9-24-2017,2017,9,24,22:26,일요일,10,10,0,ㄳㅇ(ksy6****),"이 영화는 인간의 예술적 감각의 집합체이다.  더 나아가 인간과 예술이 존재하는 이유는 클레멘타인이라고  볼 수 있고  클레멘타인 속에 인류와 만물, 우주가 속해있다고도 할 수 있다.  "
9-13-2017,2017,9,13,16:38,수요일,10,10,0,coms****,라면에 물 올려놓고 영화를 봤는데 집에 불이 났어요  
7-25-2017,2017,7,25,08:44,화요일,10,10,0,Spymin(spym****),댓글보고 기대하고 봤는데 역시 정말 최고의 영화네요.지금까지 본 영화중에 2위입니다.1위는 클레맨타인 2편 을 위해 남겨두겠습니다.  
7-12-2017,2017,7,12,23:58,수요일,9,10,0,jini****,"오바하는 배뎃들보고 너무 기대하실까봐요. 카메라편집은 올드보이의 장도리신 정도? 시나리오는 포레스트검프의 한국버전정도, 음향은 엔리오모리꼬네 수준 정도지 그렇게 희대의 명작은 아닙니다. 건전한 평점문화 조성을 위해 오바없는 객관적인 댓글 부탁드립니다.  "
7-11-2017,2017,7,11,07:46,화요일,10,10,0,그만해라좀이제(jwt7****),명작순례 왔습니다 ㅠㅠ  
7-7-2017,2017,7,7,13:39,금요일,10,10,0,독고다이(leek****),저는 만년 꼴등을 하는 학생이였습니다. 지방 어느 대학도 못가는 수준이였습니다. 하지만저는 자기소개서에   클레멘타인이라는 영화를 자기전에 본다고써놓으니 서울에서 말만하면 아는 명문대학에서 특별장학생 입학시켜준다는 간곡한 부탁을 청하여 입학했습니다  
6-3-2017,2017,6,3,10:56,토요일,10,10,0,보이스(whrt****),최고의 작품 잘봤습니다  
6-3-2017,2017,6,3,07:10,토요일,10,10,0,강적(wleo****),혼자보면 안되고 친구들과 함께 간식을 준비하면서 함꼐 봐야하는 영화  
5-25-2017,2017,5,25,14:23,목요일,10,10,0,bigbir2(bj81****),"감독이 이영화를 찍고나서 이런말을 했다죠""신이시여... 제가 감히 이 영화를 만들었습니다""  "
5-11-2017,2017,5,11,18:38,목요일,10,10,0,김준성(ray5****),신이 클레멘타인을 만들었고 그걸 자랑하기 위해 영화를 만들었다....  
5-7-2017,2017,5,7,16:02,일요일,10,10,0,이웃집전도사(sori****),나의 사랑...나의 사랑...나의 사랑 클레멘타인...영화가 끝났는데도...한 시간 째 울고 있네요...  
5-4-2017,2017,5,4,14:03,목요일,10,10,0,jaew****,황금연휴가 되어 할게 없어서 평점이 높은 영화를 찾다 보니 이 영화가 눈에 띄더군요. 어린이 날 기념으로 아이와 함께 봤는데 아이와 유대감이 훨신 더 깊어지게 되었습니다. 감사합니다 클레멘타인.  
4-29-2017,2017,4,29,00:21,토요일,10,10,0,강민수(peop****),0 100점 주고싶은데 10점밖에없어서 글앞에 0을 붙입니다.  
4-17-2017,2017,4,17,00:06,월요일,10,10,0,slrlal(yh2n****),지구가 멸망한다면 한그루의 사과나무를 심겠다고? 아니다. 한편의 클레멘타인을 감상해야 한다.  
4-9-2017,2017,4,9,22:20,일요일,10,10,0,문어빠빵(wlsd****),울었습니다..그저 한없이  
4-4-2017,2017,4,4,16:34,화요일,10,10,0,절륜(ekfk****),감독이 천재인 것이 분명하다  
3-14-2017,2017,3,14,05:30,화요일,10,10,0,SoundMAGIC(badb****),이렇게 좋은 영화는 서로 나누어야 합니다.  
8-12-2016,2016,8,12,10:46,금요일,10,10,0,reda****,사기당해서 대여금반환소송중인데 이영화보고 감동받아 소송 취소할까합니다역시 세상은 더살아봐야한다는것을 깨닫습니다  
7-15-2016,2016,7,15,20:26,금요일,10,10,0,bono****,믹키가 이영화를 봤다면 그런 나쁜 짓은 하지 않았을 것이다.  
7-12-2016,2016,7,12,17:14,화요일,10,10,0,Caesar(jooo****),곡성을 보고 마음을 진정시키고자 이영화를 다시봤습니다. 잔잔한감동.. 깐사한니다.  
5-14-2019,2019,5,14,01:20,화요일,10,11,1,판덜(pps1****),"비오는 날 바흐의 무반주 첼로 조곡을 들으면서 아메리카노를 마실 때 불현듯 예전에 보았던 클레멘타인이 떠오른다. 나이가 하루 하루 먹으면서 세상을 관조하는 눈이 변하는걸 느끼지만, 클레멘타인만은 봐도봐도 변하지않은 명작이라는 것을 다시 한번 깨닫는다.  "
2-7-2019,2019,2,7,14:04,목요일,10,11,1,dlae****,관객수는 4000명도 안되는데 2만명이 매겼네ㅋㅋㅋ  
2-3-2019,2019,2,3,15:28,일요일,10,11,1,해원(ifyo****),"크리스마스마다 특선영화로 나홀로집에 나오는것처럼 , 설이나 추석명절에는 클레멘타인을 보여줘야한다고 생각합니다.  "
8-2-2018,2018,8,2,13:19,목요일,10,11,1,미르아빠(mirp****),감상만으로도 눈이 썩어가게 만든 영화 역사에 길이 남을 저주받은 걸작 '클레멘타인'.그 고통을 이겨낼 자신이 있는자 감상하라.그리고도 만일 뭔가 부족하다면 리얼로 나머지를 채우라.  
7-25-2018,2018,7,25,19:07,수요일,10,11,1,박세건(seke****),이세상 영화가 아니다!! 성지순례 영화!!  
5-8-2017,2017,5,8,22:26,월요일,10,11,1,iesi****,액션도 멋있었고 나름 괜찮았던 영화 스토리도 인상적이었구요  
5-7-2017,2017,5,7,21:42,일요일,10,11,1,꾸에에엑(pie6****),내게 주어진 시간이 두시간 뿐이라면... 난 망설임 없이 이 영화를 볼 것이다.  
9-7-2016,2016,9,7,19:25,수요일,10,11,1,적통령(kurn****),20점은 왜 못주지....  
8-24-2016,2016,8,24,20:50,수요일,10,11,1,지성(mryj****),이런영화가 왜 재상영되지않는건가... 다시 개봉된다면 2000만 관객의 시대를 열 것이다.  
2-18-2015,2015,2,18,14:03,수요일,10,11,1,구리엔탈(koo5****),"클레멘타인을 보지 않은 사람과는 얼굴을 마주하지 말며, 세 번 이상 보지 않은 사람과는 인생을 논하지 말라  "
5-28-2013,2013,5,28,08:26,화요일,10,11,1,exec****,ㅋㅋㅋㅋㅋㅋㅋㅋㅋ  
5-26-2013,2013,5,26,02:03,일요일,10,11,1,mans****,말이 필요없겠지?  
3-20-2019,2019,3,20,01:15,수요일,10,12,2,치유(989s****),1점으로 평점 장난치는 분들은 뭐죠?  장난칠영화가 따로있지 좀 너무하자나요..제발 이런 명작영화들로 장난치지 맙시다!!  
7-27-2014,2014,7,27,20:56,일요일,10,12,2,bbo1****,클레멘타인 보면서 볼에 뜨거운게 흘러 만져보니 눈물이였다.  
7-25-2013,2013,7,25,21:57,목요일,10,12,2,오사마빈라덴(wons****),내 인생 최고의 영화!! 이 영화를 보고 다른 영화는 눈에 차지 않는다.  
7-24-2013,2013,7,24,11:36,수요일,10,12,2,pykp****,명작입니다  
6-10-2019,2019,6,10,13:48,월요일,10,9,0,dddp****,15년이 지난 지금까지 댓글이 달린다는 것. 더 이상 무슨 말이 필요하랴!  
6-5-2019,2019,6,5,16:39,수요일,10,9,0,오리(colo****),친구들과 같이 보며 펑펑 소리내서 울다가 관계가 약간 서먹해졌네요... 하지만 조금의 후회도 없습니다.  
5-9-2019,2019,5,9,01:04,목요일,10,9,0,sayc****,어버이날 클레멘타인을 부모님과 관람하였습니다. 영화가 끝난 후 부모님이 제 손을 잡으시며 지금까지 받은 선물 중 가장 큰 효도 선물이었다며 눈시울을 적시셨습니다..  
5-5-2019,2019,5,5,10:26,일요일,10,9,0,tfvldsaa(zaaa****),물론 이해는 간다. 이런 마스터피스의 후속작을 만든다는 게 얼마나 어려운 결정인지. 하지만 나같이 15년째 기다리는 골수팬을 위해서도  준리가 더 나이들기 전에 결단을 내려주길 바란다.. 오늘도 나는 클레멘타인 신작 소식을 듣기 위해 인터넷을 검색한다  
2-5-2019,2019,2,5,21:20,화요일,10,9,0,어쩌다안녕(saow****),"포스터 보고 볼까말까 했는데, 높은 평점보고믿고 봤습니다. 역시 높은 평점에는 다 이유가 있군요. 액션 영화인데 눈물이 흐르는 이유는 뭔지 참... 안 보셨다면 꼭 보시길 추천드립니다!~  "
2-4-2019,2019,2,4,16:39,월요일,10,9,0,빵빵(rain****),10번 넘게 봤습니다.인생영화 추천합니다.여친이랑 보면 개꿀딱  
2-1-2019,2019,2,1,09:27,금요일,10,9,0,박준용(men5****),"평론가들에게 이 영화 한번씩 보여줘야 한다. 이동진, 강한섭 등 내로라하는 평론가는 물론, 그 점수 짜게 준다는 박평식 평론가마저도 눈물을 흘리며 10점 만점에 10점을 줄 수밖에 없을 것이다.  "
1-28-2019,2019,1,28,09:26,월요일,10,9,0,두루킹(gpla****),이영화를 보면서 한류는 2004년 부터 였다라는 생각이 들었다. 스티븐 시걸은 이영화에 감사하여야 한다.  
1-22-2019,2019,1,22,10:42,화요일,10,9,0,부자티(dvvv****),"""모니터도 울고, 외장하드도 울고, 숨어있던 바이러스도 울었다""가 가장 베스트!!!  "
1-2-2019,2019,1,2,06:03,수요일,10,9,0,kju2****,한마디만 하겠습니다 최고  
1-1-2019,2019,1,1,12:44,화요일,10,9,0,가마돌아돌아(ultr****),2004년이 왜 클레멘타인의 해였는가 왜 준리(이동준)의 시대여야만 했는가를 여실히 증명해주는 영화의 완성도. 마지막으로 나는 클레멘타인을 단순히 영화라 부르고 싶지 않다. 한국을 넘어 인류사에 길이 남을 문화자산이라 칭하고 싶다.  
1-1-2019,2019,1,1,02:02,화요일,10,9,0,만루호무랑(nara****),VR로 보니까 시력이 좋아졌습니다  
1-1-2019,2019,1,1,00:34,화요일,10,9,0,미띵넘브베(qsxw****),스티븐 시걸때문에 봤지만 끝은 사랑이로 끝났다  
12-27-2018,2018,12,27,21:45,목요일,10,9,0,니나노니나니나뇨(cyy6****),왜 평점이 10점이 아닌지 모르겠습니다. 처음으로 영화 후기 남기는데 재개봉 원합니다. 명작은 재개봉이죠.  
12-27-2018,2018,12,27,16:47,목요일,10,9,0,맬룡(dpsw****),제게 눈이 두 개 밖에 없다는 사실이 안타까울 뿐입니다.  
12-25-2018,2018,12,25,21:22,화요일,10,9,0,장사장(wkdq****),이 영화를 보고 여자친구가 생겼습니다.  
12-25-2018,2018,12,25,20:21,화요일,10,9,0,qnrg****,듣던것 보다는...  암이 나을 정도는 아니지만 10점 정도는 기본인듯  
12-25-2018,2018,12,25,17:09,화요일,10,9,0,이상묵(miny****),너무 감동적입니다 거의 쇼생크탈출급  
12-22-2018,2018,12,22,20:39,토요일,10,9,0,종소리(jxis****),내 생애 이런 명작을 볼 줄이야..  
12-20-2018,2018,12,20,22:37,목요일,10,9,0,오스콘(osco****),사랑이의 연기는 일품이었다..  
12-20-2018,2018,12,20,00:30,목요일,10,9,0,rlaa****,같이 보던 고양이도 감동했습니다 추천합니다  
12-19-2018,2018,12,19,21:29,수요일,10,9,0,미라니아제비(kimj****),정말 내 인생에 있어 이런 명작 영화는 두번다시 볼수 없을  겁니다!!!  
12-19-2018,2018,12,19,18:44,수요일,10,9,0,축구좋아(sayh****),이 명작을 저만 볼순 없습니다  
12-18-2018,2018,12,18,22:47,화요일,10,9,0,김정인(wjdd****),이런 띵작 1점주는 사람들은 뭐냐.... 진심 100점 주고 싶은데 10점을 줄 수 밖에 없는것이 아쉽다.  
12-16-2018,2018,12,16,23:50,일요일,10,9,0,난누그인가(lchy****),이 영화는 10점을 충분히 받을만하네요ㅋㅋ  
12-16-2018,2018,12,16,20:25,일요일,10,9,0,양재완(dani****),10점이 아니라 클레멘타인점을 줬다  
12-15-2018,2018,12,15,02:29,토요일,10,9,0,최초롱(rpto****),최고 꼭 보시길 바랍니다  
12-7-2018,2018,12,7,03:14,금요일,10,9,0,mygl****,UFO가 지구를 오는 이유  
10-30-2018,2018,10,30,11:42,화요일,10,9,0,배준형(bae0****),마블의 감독들이 히어로물 제작할때 참고서처럼 활용한다는 20세기 교과서적인 명화  
10-5-2018,2018,10,5,02:03,금요일,10,9,0,강승호(hong****),블루레이로 간직하고있습니다  
9-30-2018,2018,9,30,17:03,일요일,10,9,0,새사람(saes****),나는 아직도 이 영화를 보지않았다.그리고 앞으로도 보지 않을 것이다.그 이유는 클레멘타인을 본다면살아야할 이유 하나가 사라지기 때문이다.  
9-27-2018,2018,9,27,14:40,목요일,10,9,0,jtyb****,영화보다 평점이 더 재밌는영화  
9-24-2018,2018,9,24,01:57,월요일,10,9,0,김태훈(tjlo****),저는 어릴적부터 불치병에 걸려 30여년을 질병과 투쟁하며 살아왔습니다 이 영화를 보고 암도 나았다는데 과연 제 병도 나을 수 있을까 오늘 도전해보려 합니다  
9-21-2018,2018,9,21,17:31,금요일,10,9,0,원재철(wocj****),내가 노아라면 방주에 클레멘타인 DVD를 실었을것이다.  
9-3-2018,2018,9,3,16:22,월요일,10,9,0,dleh****,인생사는 이유도 없이 앞만 달려온 제게 삶에 이유를 준 영화입니다. 남들을 욕을 할지 몰라도 아빠 일어나! 라는 액션씬에서 태어나지도 않은 제 자녀가 다독여주는 감동까지 받게 되엇습니다. 제게 마지막 하루가 주어진다면 클레멘타인을 가족들과 보겟습니다  
9-1-2018,2018,9,1,20:21,토요일,10,9,0,김창환(twin****),갓영화 정말 최고다 세상에....  
8-31-2018,2018,8,31,18:12,금요일,10,9,0,punc****,깊은 유혹의 꽃미남 이동준 장기전속출연 환상의 똥꼬쇼 뭔가 보여드리겠습니다  
8-15-2018,2018,8,15,10:32,수요일,10,9,0,브론지노(tbt8****),원래 명작인데 독일어로 더빙된 버전을 보면 더 예술영화 같습니다. https://www.youtube.com/watch?v=jebwQIvTmo8  
8-7-2018,2018,8,7,12:27,화요일,10,9,0,행복한가정(dnwh****),같은 영화를 3번 본적이 단 한 번도 없는데 이 영화는 벌써 5번째 봤다. 한국에서도 이러한 영화를 만들어 낼 수 있다니 그저 감탄할 뿐이다. 상영 시기만 제대로 맞았으면 2천만 관객도 가능했을 듯 싶다.  
8-5-2018,2018,8,5,14:29,일요일,10,9,0,올빼미(engu****),이영화를 친구들과 보다가 친구를 모두 잃었습니다..모두 감동의 쓰나미에 쓸려 다 떠났기 떄문이죠. 왜 감독판은 개봉안하는거죠?  
8-5-2018,2018,8,5,12:57,일요일,10,9,0,단지우유(cybe****),"자살을 결심하던 그날 오후 저녁늦게 친구가 준 DVD한편을 마지막으로 보게 되었다가 눈이 실명할정도로 펑펑 울었습니다. 살아 있음에 감사하고, 앞으로의 살아갈 날에 대해 감사합니다. 이 영화를 만들어 주신분에게 감사합니다! 데헷!  "
8-5-2018,2018,8,5,01:21,일요일,10,9,0,코스모스(dota****),재개봉을 기다립니다... 극장 안 사람들과 다 함께 소리내어 울고싶어서...  
7-29-2018,2018,7,29,15:13,일요일,10,9,0,미나리(tarq****),말을 할 필요가 없는 명작  
7-26-2018,2018,7,26,04:43,목요일,10,9,0,siam****,이런영화를 살아서볼수있음에 감사합니다  
7-25-2018,2018,7,25,22:41,수요일,10,9,0,마닐캣(aac6****),이 영화를 논할 가치가 없는 인간이 바로 저입니다 그만큼 너무 엄청난 명작입니다  
7-25-2018,2018,7,25,21:55,수요일,10,9,0,24살(cych****),어느순간부터 국민이 함께 만들어가는 클레멘타인 이야기가 너무 감동적이라 10점 줍니다  
7-25-2018,2018,7,25,21:35,수요일,10,9,0,루트(ptal****),2004년에 이런 영화라니.. 한국영화는 진정 퇴보하고있는 것임에 틀림없다!  
7-25-2018,2018,7,25,18:14,수요일,10,9,0,디앤아이(tmwl****),이영화를 어릴때 영화관에서 봤습니다.아직까지  기억속에남아있는 잊을수없는작품입니다  
7-25-2018,2018,7,25,17:30,수요일,10,9,0,고래밥말리(work****),별이 열개 평점도 10개  
7-25-2018,2018,7,25,09:16,수요일,10,9,0,MG(digh****),한국에는 다시 나올수없는 명작이다. 스티븐 시걸의 짧고 굵은 장면은 뭘 상상하던 그 이상의 임펙트였다. 이 영화를 넘을 대작은 이 세상에 없다.  
7-25-2018,2018,7,25,08:41,수요일,10,9,0,연어도두(lghp****),10점 안주면 안된다고  
7-24-2018,2018,7,24,10:43,화요일,10,9,0,신(ile1****),명작명작 소리만 들었는데 드디어 봤습니다.국  
7-24-2018,2018,7,24,09:26,화요일,10,9,0,롤롤(smil****),앗..아아... 아앗..  
7-24-2018,2018,7,24,01:42,화요일,10,9,0,zzan****,다시는 없을 대작!!!! 암이 암걸리게해서 났게되는 영화!!  
7-22-2018,2018,7,22,22:20,일요일,10,9,0,ghon****,"""내일 세상의 종말이 온다 할찌라도 나는 오늘 클레멘타인을 볼 것이다.""  "
7-20-2018,2018,7,20,10:48,금요일,10,9,0,hsol****,희대의 명작입니다. 재상영 요청해요.  
7-20-2018,2018,7,20,08:55,금요일,10,9,0,하루를1년처럼(rlac****),"이 영화를 본 사람은 사랑하는 사람과 안 본 것을 후회하고 , 이 영화를 안 본 사람은 절대 알 수 없는 ..이 영화를 본사람들의 공감성에 뛰어들지 못함에 후회하게 될 것이다.  "
7-8-2018,2018,7,8,14:09,일요일,10,9,0,anti****,이 암을 보고 영화가 나았습니다  
7-5-2018,2018,7,5,12:13,목요일,10,9,0,고강민(gsj1****),감독님 감사합니다ㅎㅎ  
6-28-2018,2018,6,28,11:59,목요일,10,9,0,Novelist_J(kim3****),"완벽한 액션씬, 인셉션 팽이조차 따라갈 수 없는 돌려차기 시퀀스에 바지가 젖어온다.  "
6-7-2018,2018,6,7,10:05,목요일,10,9,0,강원도감자(kht8****),"평점보고 낚시겠지하며, 속는셈 치고 봤는데 진짜는 진짜였구나 명작 of 명작 나의 ' 인생영화' 최고입니다.  "
6-4-2018,2018,6,4,18:24,월요일,10,9,0,Tax(wind****),이 영화를 보기 전에 내 인생영화는 인셉션이었다. 그러나 클레멘타인을 본 뒤 인셉션이 내 인생영화라고 떠벌리고 다닌 것이 너무 창피하여 300일동안 얼굴을 들 수 없어 허리디스크에 걸리고 말았다. 당신의 인생 영화는 무엇인가?  
5-22-2018,2018,5,22,17:53,화요일,10,9,0,지단삥(jiny****),인피니티워는 절대 클레멘타인 못이긴다.  
5-18-2018,2018,5,18,11:06,금요일,10,9,0,박정현(wjdg****),그저 대단하다는말밖에  
5-1-2018,2018,5,1,23:28,화요일,10,9,0,캡틴렉스(wpek****),한국영화의 영원한 걸작  
5-1-2018,2018,5,1,23:02,화요일,10,9,0,00purble(4dat****),영화줄거리 설명이 이렇게긴건 처음이다 영화를 보진않았지만 모두 보았다  
4-29-2018,2018,4,29,12:02,일요일,10,9,0,sper****,이제야 용기내서 보게 됐습니다.댓글에 울고 영화에 또 한번 울게되네요.  
4-28-2018,2018,4,28,00:35,토요일,10,9,0,타나리안(than****),이것은절대10점이아니다100점을주고싶은 내마음이다  
4-26-2018,2018,4,26,15:50,목요일,10,9,0,Havel(bame****),말이 필요없다 직접 보도록  
4-22-2018,2018,4,22,08:55,일요일,10,9,0,신정락 슬라이더(ilbo****),숨어있는 보석을 찾으신다면 강추 드립니다 꼭 보시고 치유되시길 빕니다  
4-19-2018,2018,4,19,03:19,목요일,10,9,0,방울방울(sua0****),최고의 영화입니다 말로 표현할수 없고 눈뜨고 볼수없는 감동적임 강추합니다  
4-13-2018,2018,4,13,00:57,금요일,10,9,0,kaci****,오늘 드디어 봤읍니다~ 호불호가 많이갈리는영화네요 화끈한 액션을 기대하신분들에게 다소 지루하게 느낄수도있겠지만 저에게는 최고의 감동을 주네요 졔 마음속에 남을 명작이네요 보통영화한번보고지우는데 dvd로 소장할려구요  
3-14-2018,2018,3,14,14:21,수요일,10,9,0,허으우이야(inmo****),"신은 클레멘타인을 만들고, 이를 자랑하기 위해 세계를 만들었다.  "
1-30-2018,2018,1,30,13:32,화요일,10,9,0,박성호(gggo****),제발 이번 설 명절특선영화 클레멘타인 아침 점심 저녁 나눠서 틀어주세요! 방송국국장분들 뭐합니까? 정치세력에 압박받고 있습니까? 청와대는 무얼하고 대통령은 작금에 이르러 여지껏 TV에 영화 상영이 안된 이유를 적극해명하시길 바랍니다.  
1-11-2018,2018,1,11,14:14,목요일,10,9,0,아헹헹(pain****),신과함께가 천만관객을 넘었는데 ㅋㅋㅋ 클레멘타인이 요즘 개봉했으면 5천만은 걍넘긴다  
12-23-2017,2017,12,23,01:51,토요일,10,9,0,디노(nasa****),나는 이 영화를 보지 않았다. 하지만 내 인생 최고의 영화이다.  
12-20-2017,2017,12,20,23:38,수요일,10,9,0,kts9992(kts9****),엄청난 몰입감으로 시선을 땔 수 없는 영화입니다.아껴보려고 스킵해서 봤는데 오늘 또 봐야겠네요.강추합니다!  
12-20-2017,2017,12,20,14:48,수요일,10,9,0,김태훈(kth8****),"1년전에 이영화를 보고 ""평점1점짜리 영화는 아닌데 그래도 9점대는 아니잖아ㅠㅠ낚였어 엄청 기대하고봤는데..."" 라고 쓰며 1점을 줬는데 비공감 38명 왜지...?라고 다시 보니  눈물이  주륵주륵  장님눈을 뜨게해준 38분께 감사말씀 드립니다.  "
12-15-2017,2017,12,15,14:59,금요일,10,9,0,케삭(qwes****),더이상 나올수 없는 인생 최고의 영화  
12-15-2017,2017,12,15,14:31,금요일,10,9,0,이브닝(ivel****),후기가 좋아서 봤는데 진짜 감명깊었음...OOOㄷ  
9-21-2017,2017,9,21,20:01,목요일,10,9,0,신인규(holy****),아직 클래맨타인을 안봤으면 인생 자체를 논하지마라..  
8-22-2017,2017,8,22,19:50,화요일,10,9,0,우후훗(ddol****),클레멘타인을 보고 눈물을 흘리지않는 사람과는 상종하지도 말라  
8-10-2017,2017,8,10,14:56,목요일,10,9,0,jang****,뜨거운 평점을 보고 오늘 사무실에서 몰래 봤습니다. 사무실에 있는 과장님과 차장님께 걸려서 과장님께 혼났는데 차장님이 모니터 앞에서 눈물을 흘리고 계셨습니다.  
8-4-2017,2017,8,4,01:18,금요일,10,9,0,독거노인(rhdm****),'전설'은 오직 이 영화에게만 허락된 표현이다.  
7-25-2017,2017,7,25,18:26,화요일,10,9,0,바람돌이(ghkt****),와! 이건 내가 죽기 직전까지 잊지 못한 유일한 영화다!  
7-25-2017,2017,7,25,01:10,화요일,10,9,0,Heros(kkhg****),이 영화를 아직도 보지않았다고?? 그렇다면 그대는 아직 영화를 논할 자격이 없다  
7-18-2017,2017,7,18,15:08,화요일,10,9,0,가물치단체티(rmeo****),재개봉이 시급합니다...  
7-14-2017,2017,7,14,22:20,금요일,10,9,0,blockhead(ksw9****),클레멘타인 1점주는 사람들 있다는거 실화냐  
6-29-2017,2017,6,29,20:30,목요일,10,9,0,reak****,"역시 나만 그런 것이 아니군...""리얼""을 보고 이 희대의 명작을 떠올린 네티즌들이 많군....  "
6-3-2017,2017,6,3,11:34,토요일,10,9,0,그런거없어(khon****),나는 이 영화을 보기위해 태어났다  
6-2-2017,2017,6,2,23:04,금요일,10,9,0,sky9233(sky_****),내일 당장 지구가 멸망한다고 하면 나는 주저없이 가장 사랑하는사람과 이영화를 볼것이다..  
5-23-2017,2017,5,23,23:43,화요일,10,9,0,해리포터(9211****),전 이 영화를 보면서 떠오른게 있습니다..아.. 나는 대체 무슨 영화를 보면서 살아왔던걸까...이 영화를 계속 봤었으면 지금쯤 내 인생을 달라졌을까..영화는 클레멘타인 이전과 이후로 나뉜다는 말이사실이라고 저는 말합니다..세계의 명작..  
5-18-2017,2017,5,18,18:52,목요일,10,9,0,assf(rudg****),여자친구와 다투고나서 같이본 이 영화 우리는 부퉁켜 안으며 참회의 눈물을 흘렸다.  
5-11-2017,2017,5,11,00:38,목요일,10,9,0,aver****,나는 지금까지 쇼생크 탈출이 최고의 영화 인줄로만 알았다.. 정말 내가 어리석었다..  
4-21-2017,2017,4,21,08:15,금요일,10,9,0,zzazksmxzla(kite****),와 댓글 보고 봤는데 완전 명작.몇번더 생각 나서 볼것같네요 혹시 2는 안나오나요?  
4-17-2017,2017,4,17,00:33,월요일,10,9,0,알렉스(alex****),나도 동참한다 훗날 전설이 되어라  
4-13-2017,2017,4,13,17:13,목요일,10,9,0,스(metd****),"낚시인줄 알았는데 진짜 재밌다 이런 영화를 또볼수있을까 싶을 정도로 역사에 남을 걸작,특히 마지막에 뒤돌려차기장면은 왜 평점이 이리높은지 알수있게 해주는 장면이다.미래의 자식,손자들에게도 보여주어 인류가 멸망하더라도 이영화DVD는 남아있었으면 하는영화  "
2-19-2017,2017,2,19,19:28,일요일,10,9,0,지프로(saja****),이걸보고 아직 세상은 살만하다 느껴졌습니다  
1-2-2017,2017,1,2,16:53,월요일,10,9,0,CJLEE(dlcj****),1월1일에 보기시작했다...하지만 정신을 차리고보니 2일이었다..이영화의 감동은 시간과 공간을 초월한다.  
11-15-2016,2016,11,15,02:31,화요일,10,9,0,이거뭐냐(dusd****),베트맨 다크나이트가 제 인생영화였는데 이영화를보고 바꼈습니다.  
8-10-2016,2016,8,10,21:23,수요일,10,9,0,오직너만(gogo****),진짜 재밌어....???  
8-2-2016,2016,8,2,23:01,화요일,10,9,0,민서기(lead****),세번 이상은 봐야지만 네티즌들의  평점이 이해되는 영화...  
8-2-2016,2016,8,2,17:06,화요일,10,9,0,nanp****,얼마전 아빠가 됐습니다! 친구추천으로 클레멘타인 영화를 알게됐습니다. 영화보기전 댓글보는데 영화시간보다 길군요!영화보기도 전에 감동하고 갑니다.  
4-18-2016,2016,4,18,21:35,월요일,10,9,0,국민감독눕기태(shoo****),이소룡이 없었다면 부르스리는 이동준 형님이 되었을 것이다.  
3-29-2016,2016,3,29,00:29,화요일,10,9,0,phyr****,네이버 영화 평점은 절대 거짓말을 하지 않는다는걸 다시 한번 깨달았다  
11-30-2015,2015,11,30,00:06,월요일,10,9,0,rlaq****,제 인생에 한줄기 빛이 되어 버린 영화 입니다. 인생에서 가장 즐거웠었던 때가 언제냐고 누군가 저에게 묻는 다면 저는 이 영화를 감상했을때 라고 한치 망설임 없이 대답할 것 입니다. 한국 영화계에 큰 축이 된 영화입니다. 또 보고싶네요  
6-23-2015,2015,6,23,23:10,화요일,10,9,0,계란프라이(hura****),Ost  살수있나요?   간직하고싶네요  
6-17-2015,2015,6,17,15:04,수요일,10,9,0,학생(jiho****),우와 정말 감동적이야!!  
9-23-2014,2014,9,23,17:07,화요일,10,9,0,masa****,2011년 머니볼 홍보차 브래드피트가 첫 내한을 하며 공항에서 가진 인터뷰를 기억하실런지...여기가 클레멘타인의 나라입니까? 너무 와보고 싶었습니다.  
5-22-2019,2019,5,22,21:38,수요일,10,10,1,slash1003(ssun****),"만약 ""어벤져스: 엔드게임""이 클레멘타인과 동시대에 개봉했다면 100만도 넘기기 힘들었을 것이다  "
2-11-2019,2019,2,11,21:44,월요일,10,10,1,아이디(pyc9****),인생은 B(Birth)와 D(Death) 사이의 C(Clementine)이다.  
9-7-2018,2018,9,7,13:17,금요일,10,10,1,네멋대로 해라(geto****),인랑 보구  리얼을 거쳐 여기까지 왔습니다.. 여기가 성지 순례를 마친 기분 입니다.  
8-16-2018,2018,8,16,18:18,목요일,10,10,1,작은별(cksd****),인생에서 클레멘타인을 3번 보지않은자와는 말도 섞지 않겠다고 다짐했다  
8-4-2018,2018,8,4,02:57,토요일,10,10,1,이브자리(zomm****),영화를 보기 시작 하고 10분만에 난 이 영화를 껏다. 그리고 여기에 와서 조용히 10점을 박는다...더 설명 할 필요가 있을까?  
7-25-2018,2018,7,25,21:00,수요일,10,10,1,액션박(pycp****),영화관에서 본 기억이 떠오르네요.. 그 당시 모든 관객들이 기립박수쳤던 기억이 납니다.. 오늘 그날 추억을 떠올리며 다시 감상해야겠네요. 고맙습니다 클레멘타인  
7-13-2018,2018,7,13,20:29,금요일,10,10,1,scol****,관객수가 3500명인데 평점준 네티즌이 19405명ㅋㅋㅋ  
7-3-2018,2018,7,3,02:42,화요일,10,10,1,핸드레이크(hand****),"세상엔 인간의 탈을쓴 신이 세명 살고있다. 펠레, 조던, 그리고 김두영감독님이다.  "
4-5-2018,2018,4,5,17:06,목요일,10,10,1,10번째문(jsli****),만약 아담이 이 영화를 봤다면 선악과를 먹지 않았을거에요  
2-9-2018,2018,2,9,16:16,금요일,10,10,1,tuna0523(ljm1****),"18000명의 평균 평점이 9.31이다. 이 영화, 검증된 영화다.  "
12-19-2017,2017,12,19,13:05,화요일,10,10,1,명식대장(sskd****),아니 ㅋㅋㅋ구라인 건 아는데 자꾸 이러니까 한 번 보고 싶어 졌는데 하.. 볼까요 말까요보지말아라하는분만 비공감좀..  
7-30-2017,2017,7,30,16:09,일요일,10,10,1,zz(jhjh****),이 영화를 보기 위해 탈북했습니다  
7-19-2017,2017,7,19,23:57,수요일,10,10,1,에어(qurk****),현재 평점 9.3  역대 네이버영화 평점 top10 을 목표로 조금만 더 밀어줍시다.  
6-30-2017,2017,6,30,08:19,금요일,10,10,1,레이피엘(dong****),리얼 때문에 잠시 잊고 지냈던 이 소중한 영화를 다시금 떠올리게 됐읍니다. 어떤 영화도 범접할 수 없는 아우라를 가진 영화.. 이 영화를 처음 접했던 2004년은 제 인생 60 평생 최고의 한 해였읍니다.  
6-29-2017,2017,6,29,17:13,목요일,10,10,1,스쿼럴(leon****),리얼 이후에 볼 것이 없습니다.  클레멘타인이  대형 극장에서 재상영 해야 마땅합니다. 여름이 즐거울 것입니다.  
6-26-2017,2017,6,26,13:47,월요일,10,10,1,yosu****,이것은 영화라는 틀 안에서 평가할 수 있는 작품이 아니다. 종합 예술이다.  
6-4-2017,2017,6,4,11:05,일요일,10,10,1,한뚝배기(hato****),"이 영화, 클레멘타인을 봤다면, 당신은 이미 성공한 인생을 살고 있는 것이다.  "
6-3-2017,2017,6,3,23:16,토요일,10,10,1,뇌없는국뽕(dnjs****),20세기는 대부가 있었지만 21세기는 이영화가 있다  
5-7-2017,2017,5,7,05:11,일요일,10,10,1,f35k(rudw****),13년전 영화의 퀄리티가 아니다. 지금 개봉해도 모자람이 없다.  
3-3-2017,2017,3,3,18:38,금요일,8,10,1,분양인(yong****),평점때문에 너무 기대를해서인지는모르겠는데 10점 만점은 아닌듯ㅡㅡ  하지만 마지막 링앞에서 울부짖는 사랑이의 '아빠 일어나'는 진짜 역대급감동이었던건인정!!  
2-17-2016,2016,2,17,02:37,수요일,10,10,1,김선교(rtr1****),이 영화를 보고 암세포가 암에걸렸습니다.  
11-13-2014,2014,11,13,17:07,목요일,10,10,1,맵시가이(dnjs****),전 푸들입니다. 주인과 같이 클레멘타인을 보고 사람이 되었습니다.  
7-27-2014,2014,7,27,18:33,일요일,10,10,1,VSFe(klm0****),이영화를 본다는건 진정한 남자가 되기 위한 첫 출발이다.  
7-18-2014,2014,7,18,15:14,금요일,10,10,1,djad****,난 이영화를 보았다. 그리고 등에 이영화 제목을 타투하게 되었다. 난 누구에게나 당당히 말할것이다. 이영화는 나의 삶에 목적이자  이유라고.. 당신은 이영화와 마주할 준비가 되셨습니까?  
7-18-2014,2014,7,18,04:26,금요일,10,10,1,Carpe Diem(wind****),이 영화에 투자한 52억은 결코 헛되지 않았습니다. 격렬한 액션씬과 주인공의 독백이 치킨과 맥주처럼 좋은궁합을 보여주는군요. 아직도 여운이 가시질 않네요. 이 좋은 영화를 왜 이제야 보았을까...  
2-21-2019,2019,2,21,23:49,목요일,10,11,2,임청명(sky0****),솔직히 재개봉 좀 했으면  
8-5-2018,2018,8,5,00:18,일요일,10,11,2,김민성(anfr****),100년뒤에 평점 9.99를 찍을날이 올 것이다. 아직 너희들은 이영화의 진가를 모르고 있다.  
7-21-2018,2018,7,21,17:33,토요일,10,11,2,NAIM(snow****),사람은 최악 뿐만 아니라 최고를 볼때 욕이 나오는 경우가 있죠. 정말 저도 모르게 욕 나오는 작품이었습니다..!  
7-1-2017,2017,7,1,21:58,토요일,10,11,2,프로필(ldw1****),"리얼을 보고 걸린 암, 클래멘타인을 보고 나았습니다.  "
6-28-2017,2017,6,28,23:13,수요일,10,11,2,SFgiants(your****),인생은 B와 D사이의 C다. Birth와 Death 사이의 Clemetine이다라는 뜻이다  
9-12-2016,2016,9,12,21:27,월요일,10,11,2,강남찌질이(wisl****),내 나이36... 영화를보고 태권도장에 등록했습니다  
6-6-2016,2016,6,6,11:12,월요일,10,11,2,조카스(joca****),세상엔 딱 2종류의 사람밖에없다.클레멘타인을 본 사람과.. 앞으로 반드시 보게될 사람..  
11-15-2014,2014,11,15,18:57,토요일,10,11,2,이규(jack****),"어제 여자친구 집에서 클레멘타인을 보았는데, 영화를 다본후 눈물을 흘리는 저를 향해 여자친구 하는 말이.. '뭐야 쓰레기네' 오늘 헤어졌습니다  "
8-25-2014,2014,8,25,17:44,월요일,10,11,2,해적왕(hahg****),아이가 아빠일어나!할때 저는 너무 감동해서 탈영해버렸습니다...  
7-27-2014,2014,7,27,19:36,일요일,10,11,2,꺼먼놈들(wlsd****),"내가 살아있는 이유는, 이 영화를 보기 위해서다.  "
1-28-2019,2019,1,28,11:32,월요일,10,12,3,김지인(jiro****),이 영화를 보고 우리집 세탁기가 고쳐졌습니다  
1-14-2019,2019,1,14,19:25,월요일,10,12,3,명탐정 코난(you6****),북한이 아직 처들어 오지 않는 이유는 이 영화 때문이다.  
3-2-2016,2016,3,2,14:52,수요일,1,20,11,9987(jk99****),이 영화를 보고 암이 나았습니다.  
6-4-2019,2019,6,4,11:42,화요일,10,8,0,롸(lolo****),성경 코란 반야심경 그리고 클레멘타인.  
6-1-2019,2019,6,1,15:25,토요일,10,8,0,김질럿step(many****),추락하던 나에게 날개를 달아 비상하게 해주었던 영화  
5-28-2019,2019,5,28,19:58,화요일,10,8,0,ices****,이 영화가 지금 상영되었다면 기생충은 황금종려상을 클레멘타인에게 양보해야 했을테죠  
5-15-2019,2019,5,15,18:33,수요일,10,8,0,junc****,저의 고물 TV로는 감히 이 영화를 재생할수가 없더라고요 지금 TV사러갑니다.  
5-11-2019,2019,5,11,01:51,토요일,10,8,0,뜰레오(roov****),자위끝나고 허무함을 달래는데 이영화 만한게 없음  
5-9-2019,2019,5,9,20:45,목요일,10,8,0,doseong(rlae****),제가 이걸왜 지금이 되서야 봤는지 후회됩니다 이명작을 왜 지금봤는지ㅠㅠㅠ  
5-9-2019,2019,5,9,20:07,목요일,10,8,0,모티(rusy****),인생은 b와d 사이의 c라고 말을 하곤 한다 그 c는 클레멘타인을 의미한다  
5-9-2019,2019,5,9,09:36,목요일,10,8,0,윤군(subm****),훗날 이 영화는 유네스코 세계 문화유산으로 등재되었다고 한다. 대한민국에 수 많은 영화가 있었지만 오직 이 영화만이 살아남았고  앞으로도 영원히 보존될 영화입니다. 인류에게는 3개의 혁명이 있었다고 한다. 인지혁명 산업혁명. 그리고 클레멘타인...  
5-3-2019,2019,5,3,13:47,금요일,10,8,0,너구리(kwan****),내일 지구가 멸망한다면 아침에 성냥팔이소녀의 재림 점심에 다세포 소녀 그리고 저녁에는 클레멘타인을 시청함으로 내세에 후회 한점 없도록 화룡정점을 찍으리.  
4-29-2019,2019,4,29,22:29,월요일,10,8,0,이원준(qaz5****),어릴적부터 좋은건 나눠야 한다고 배웠습니다.진경아 알겠지? 혼자 꼭 봐야해  
4-29-2019,2019,4,29,11:55,월요일,10,8,0,박동현(dksh****),주말에 부모님께 이 영화를 보여드렸습니다.  
4-25-2019,2019,4,25,15:23,목요일,10,8,0,박민규(mgpa****),"클레멘타인이 재미없다면, 당신의 감성은 죽었다.  "
4-24-2019,2019,4,24,01:11,수요일,10,8,0,아버(save****),"네 소원이 무엇이냐 하고 하느님이 내게 물으시면, 나는 “내 소원은 클레멘타인이오.” 하고 대답할 것이다. 그 다음 소원은 무엇이냐 하면, “이동준의 클레멘타인이오.” 또 그 다음 소원이 무엇이냐면 ""한국영화 최고 명작 클레멘타인이오"" 라 할 것이다.  "
4-23-2019,2019,4,23,15:16,화요일,10,8,0,곰통곰통슛(dhal****),아빠일어나! 라는대사와 동시에 백일된 딸래미가 화면을 향해 걸어가더군요  
4-11-2019,2019,4,11,21:54,목요일,10,8,0,때론 마음가는데로(hyun****),"평점이 장난인줄 알았지만 상영후에 느끼는 감정은 결코 장난이 아닙니다. 이 영화가 왜 평점이 높고 찬양댓글이 달리는지는 봐야 느낄수 있고, 댓글다는 분들이 언변의 마술사처럼 신박하게 작성하는데는 이유가 있죠. 감수성 극한으로 올려주는 전설적인 영화.  "
4-7-2019,2019,4,7,20:26,일요일,10,8,0,윤석영(lwme****),이 영화에 대해 리뷰하는 그 누구도 이 영화에 대해 완벽히 리뷰할 수 없다  
3-30-2019,2019,3,30,01:29,토요일,10,8,0,이은우(d-d-****),재개봉 해줬으면 좋겠다  
3-23-2019,2019,3,23,14:52,토요일,10,8,0,우에하라 앙리(hosi****),남자는 태어나서 세번운다 1.태어났을때 2.부모님이 돌아가셨을때 3.아빠 일어나  
2-19-2019,2019,2,19,14:38,화요일,10,8,0,비비빅(jink****),이 영화를 보고 서울대 합격했습니다  
2-8-2019,2019,2,8,17:30,금요일,10,8,0,ms_0****,아빠가 정말로 일어났다  
2-3-2019,2019,2,3,09:00,일요일,10,8,0,cwon****,리얼 만큼 재밌네요 이제야봅니다  
1-31-2019,2019,1,31,13:41,목요일,10,8,0,유명(cdeb****),"트루먼쇼, 쇼생크탈출과 어깨를 나란히 하는 한국의 명작!!! 꼭 보세요  "
1-29-2019,2019,1,29,07:35,화요일,10,8,0,꾸잉곰(goso****),내인생 최고의영화 3편을 뽑는다 1.쇼생크탈출 2.인생은아름다워 3.클레멘타인  
1-24-2019,2019,1,24,22:02,목요일,10,8,0,오매불망(back****),줄께요 더이상 드립이 남질않았습니다  
1-21-2019,2019,1,21,22:22,월요일,10,8,0,힐부탁(gira****),"격렬한 액션속에 숨어 있는 수채화 같은 사랑의 속삭임은  매일아침 자각하는 나의 뇌리에 언제나 제일 먼저 찾아온다.""아빠. 이~러~~나~아~""  "
1-21-2019,2019,1,21,15:32,월요일,10,8,0,문덕숙(wprh****),이미 타이타닉을 넘어섰다  
1-19-2019,2019,1,19,00:23,토요일,10,8,0,너와함께(syh4****),지금도 울면서 댓글 쓰고 있습니다.. 이걸 이제서야 보다니..  
1-8-2019,2019,1,8,07:34,화요일,10,8,0,BumBum(king****),드디어 보았습니다~!! 하느님은 왕복승차권을 반드시 발행해 주실 것입니다. 할렐루야~~ 샬룻~~  
1-5-2019,2019,1,5,13:08,토요일,10,8,0,ㄱㄱㅅ(mini****),300년을 내다보고 만든 걸작  
1-3-2019,2019,1,3,13:09,목요일,10,8,0,소나기(wlsd****),이 영화를 보고 매일 아침 아빠일어나를 모닝콜로하니 늦잠 자는 일이 없어졌습니다.  
1-2-2019,2019,1,2,23:58,수요일,10,8,0,깻잎전(dlff****),와..진심 이건 타이타닉.아바타를 얃옹급으로만들어버리는 지존  
1-2-2019,2019,1,2,21:18,수요일,10,8,0,kw68****,단언컨데 이세상 가장 완벽한 타인입니다.  
12-31-2018,2018,12,31,22:03,월요일,10,8,0,배동준(ehdw****),다시태어나도 클레멘타인은 또 볼거다  
12-31-2018,2018,12,31,16:51,월요일,10,8,0,고율춘(zubu****),설날에 4D  IMAX로 재개봉 합니다. 꼭 가서 봐야지.  
12-30-2018,2018,12,30,01:55,일요일,10,8,0,SSLV8(hand****),이거 보고 아이큐가 430으로 바꼈습니다.  
12-29-2018,2018,12,29,20:49,토요일,10,8,0,YOLO(mapi****),아직 세상은 썩어있고 이기적인 사람이 많습니다 그동안 내가 얼마나 잘못된 삶을 살고 있었는지 일깨워주는 영화였습니다 배우들의 대사 한마디한마디는 그 어떤 명언보다 와닿았습니다 영화를 보는 내내 눈물만 흘렸습니다 감사합니다 클레멘타인..그리고 사랑합니다  
12-28-2018,2018,12,28,20:42,금요일,10,8,0,라운더스(htb2****),정말 정말 보고 싶다~~~ 이걸 보고 세상을 살아갈 의미를 찾고 싶다근데 왜케 눈물로 말리는 사람이 많지?  
12-27-2018,2018,12,27,14:00,목요일,10,8,0,나현식(gust****),^^;ㅋ최 ㅋ고 ㅋ입 ㅋ니 ㅋ다  
12-26-2018,2018,12,26,22:08,수요일,10,8,0,다락괴물(play****),좋은 평점은 이유가 있습니다.  
12-25-2018,2018,12,25,22:47,화요일,10,8,0,별명(hany****),dvd구매하고싶습니다  
12-24-2018,2018,12,24,23:28,월요일,10,8,0,하우지(cksd****),모두가 명작이라 하는데는 다 이유가 있다.  
12-23-2018,2018,12,23,17:43,일요일,10,8,0,858582(nhj0****),신이시여....아아  
12-22-2018,2018,12,22,21:12,토요일,10,8,0,씹보살(jj_k****),역대급이말뿐이다...  
12-22-2018,2018,12,22,07:35,토요일,10,8,0,치타(sinf****),별점 10점 주고 갑니다 이 영화를 보고 인생의 참 의미를 알게 해준 고마운 영화 입니다  
12-20-2018,2018,12,20,15:02,목요일,10,8,0,호롤로(kimg****),정말 감동적인 영화입니다. 저희  할아버지와 함께 이 영화를 봤는데 평소 좋지도 않은 허리를 쉽게 펴시며 눈물을 흘리며 박수를 치시더군요.. 강추입니다..  
12-20-2018,2018,12,20,06:37,목요일,10,8,0,mon3****,이제 엄마두 일어나! 같이 클레멘타인 봐야해!  
12-20-2018,2018,12,20,02:02,목요일,10,8,0,웃자(0223****),"인생영화.. 인셉션, 클레멘타인  "
12-19-2018,2018,12,19,23:30,수요일,10,8,0,아이유하트뿅뿅(dna1****),전설의 명작이라 성지순례 왔습니다.  
12-17-2018,2018,12,17,11:44,월요일,10,8,0,나는나(main****),보성 형님과 여자 아역배우가 영화를 이끌었다고 해도 과언이 아님  
12-17-2018,2018,12,17,04:40,월요일,10,8,0,상추군(12eh****),아무생각없이 재생을눌렀고 난100분후 하늘을 날았다.  
12-16-2018,2018,12,16,19:33,일요일,10,8,0,덥다(jinh****),태어나서 이런 영화 처음입니다...  
12-15-2018,2018,12,15,20:23,토요일,10,8,0,JHM(ytry****),우리 학교 선배님 사랑합니다♡  
12-14-2018,2018,12,14,22:06,금요일,10,8,0,asdf****,사람은 무엇으로 사는가? 사랑? 우정? 돈? 클레멘타인을 보면 알게 될것이다.  
12-6-2018,2018,12,6,23:44,목요일,10,8,0,kimj****,내일 지구가 멸망한다면 나는 사과나무 아래서 클레멘타인을 볼것이다.  
11-10-2018,2018,11,10,08:14,토요일,10,8,0,섭시(kwon****),뇌종양을 앓고 있었는데 이 영화를 보고 뇌가 사라졌습니다  
11-2-2018,2018,11,2,18:46,금요일,10,8,0,폭우바(jiny****),지금 개봉했으면 최소 1000만 영화다. 외국영화와 비교하자면 벤허. 대부.다크나이트 .등 견주어도 손색이 없을 정도다  
11-2-2018,2018,11,2,17:44,금요일,10,8,0,새벽(dhtp****),아직 영화를 보지도 않았지만 10점 드립니다 포스터만 보고 눈물이 나는 영화는 처음이네요  
10-23-2018,2018,10,23,17:41,화요일,10,8,0,no03****,이 영화를 보기 전 왜9.32점인지 이해가 가지 않았다 하지만 지금은 왜 이 영화가 10점이 아닌지 의문이 들 뿐이다.  
10-19-2018,2018,10,19,15:07,금요일,10,8,0,qkrehdals(blue****),이동준이 스티븐시갈에게 날린 뒤돌려차기를 보고 인생을 되돌아보게 되었습니다  
10-12-2018,2018,10,12,20:54,금요일,10,8,0,연금술사(11si****),박평식에게 한마디 하고 싶다. 꼭 봐라!!  이런 걸작을  안보면 영화평을 하지마라.  
10-5-2018,2018,10,5,00:09,금요일,10,8,0,100percent(time****),희대의 명작! 제7광구보다 재밌다  
10-4-2018,2018,10,4,20:57,목요일,10,8,0,Dear(edql****),이 영화 2번은 보아야 여자를 만날 자격이 생긴다. 3번 보면 여자를 만나게 되고.이영화를 한번 보면 이유를 알게 된다. 난 이 영화 4번보고 지금 결혼했다.진심 리얼  
10-4-2018,2018,10,4,20:44,목요일,10,8,0,lsj1****,정말재미있습니다....  
10-2-2018,2018,10,2,17:28,화요일,10,8,0,duke****,외쿡인 : 여기가 클레멘타인의 나라입니까?  
9-21-2018,2018,9,21,12:36,금요일,10,8,0,기현이짱짱맨(hkh5****),내 나이 19세 앞으로 살면서 이렇게 큰 감동을 느낄 수나 있을까?  
9-19-2018,2018,9,19,14:16,수요일,10,8,0,타바네코(deat****),마지막 딸의 아빠 일어나에서 눈시울이 붉어집니다!  
9-14-2018,2018,9,14,17:53,금요일,10,8,0,개소리충(ssam****),모든 영화의 교과서로 불릴만 하다  
9-14-2018,2018,9,14,14:24,금요일,10,8,0,박웅준(tjsw****),안구 건조증이 심해 매일 같이 안약을 달고 살았는데 클레멘타인..클..만해도 눈가가 촉촉해지네요  
9-14-2018,2018,9,14,11:24,금요일,10,8,0,kjh9****,"한 10년전에 월간dvd2.0란 잡지에서 고객응모로 클레멘타인dvd를 선물받았는데,  도저히 비닐을 뜯지 못하겠더라.. 한 5년정도 소장한 후 책장 정리하면서 그냥 버린 것 같아~~~그 걸작을!!!  "
9-13-2018,2018,9,13,12:36,목요일,10,8,0,이재호(ehdq****),정말 재미없네요. 너무 재밌어서 영활 연속으로 3번은 보다보니 빵에 찍어먹을 잼이 다 떨어졌네요.  
8-23-2018,2018,8,23,20:59,목요일,10,8,0,mila****,아빠 일어나'가 계속 머리속에서 맴돈다. 아 미치도록 보고 싶다. 근데 볼 수가 없다. 이 영화를  결국 본다면 감동에 울다가 탈수를 일으켜 죽을 것만 같다. 지금 댓글만 보고 3시간째 울고 있다. '  
8-20-2018,2018,8,20,14:48,월요일,10,8,0,졸라맨(123t****),세상을 살아가는 힘을 알게된 영화  
8-20-2018,2018,8,20,10:30,월요일,10,8,0,도라(wkdw****),이 영화를 볼 수 있는 시대에 태어나서 정말로 감사함을 느꼈습니다 . 역시 평점은 거짓말을 하지않네요 .  
8-19-2018,2018,8,19,16:32,일요일,10,8,0,smite(smit****),평점으로는  다 표현할수없는 무언가가 있는영화  
8-15-2018,2018,8,15,21:33,수요일,10,8,0,문찬호(cksg****),나만  볼 수 없다 이런  영화는  모두가  봐야한다 .  
8-10-2018,2018,8,10,13:26,금요일,10,8,0,퓨리건(luvi****),아파하!!!일어나하!!!!  
8-9-2018,2018,8,9,16:02,목요일,10,8,0,수성펜(ssad****),너무도 아름다운 한국 최고의 불후의 명작!  
8-8-2018,2018,8,8,22:50,수요일,10,8,0,늦은열정(bull****),리얼이 아니였다면 이렇게 좋은영화를 못보고 살아갈뻔 했네요  
8-8-2018,2018,8,8,12:26,수요일,10,8,0,이수(lees****),장님이 부러운적은 처음이엿습니다  
8-4-2018,2018,8,4,22:11,토요일,10,8,0,Andreas Pereira(cart****),이 영화를 보고 5년 묵은 티눈이 스스로 빠졌습니다.  
8-3-2018,2018,8,3,09:53,금요일,10,8,0,블라디미르게레로(dksd****),넓고 넓은 바닷가에 오막살이 집 한채 고기잡는 아버지와 철모르는 딸있네 엉 엉 엉 클레맨타인 엉 엉 엉 너무 감동이다  
8-2-2018,2018,8,2,17:34,목요일,10,8,0,엄쓰(mumb****),왜일까.. 이 많은 평점과 리뷰에 이유없이 공감하게 된다. 모든 고정관졈을 깨버린 영화.  
7-31-2018,2018,7,31,11:31,화요일,10,8,0,강찬건(k2c1****),"전설의 명작이여, 안심하고 눈을 감아라. 리얼, 염력, 인랑....당신의 뒤를 잇는 명작들이 계속 생산되고 있으니, 대한민국의 영화 미래는 매우 밝다!!  "
7-30-2018,2018,7,30,12:42,월요일,9,8,0,보헤미안(popo****),진짜 감동적이다ㅠ 역시 평점높은 이유를 알겠다  
7-27-2018,2018,7,27,11:09,금요일,10,8,0,전순호(baar****),눈물이 앞을 가리네요 영화보고 평점남기기는 제인생 첨입니다ㅜㅜ 이건 영화가 아니라 인생입니다 못보신분들 꼭보세요  
7-26-2018,2018,7,26,20:52,목요일,10,8,0,hgud****,"포르쉐가 외계인이 만든 자동차라면, 외계인이 만든 영화는 이 영화가 아닐까  "
7-25-2018,2018,7,25,22:41,수요일,10,8,0,cookey(lh33****),말이 필요없다 10점 먹고간다  
7-25-2018,2018,7,25,20:22,수요일,10,8,0,꼬마쥐(hong****),이거 안 본 놈들은 영화에 '영'도 꺼내지마라  
7-25-2018,2018,7,25,20:02,수요일,10,8,0,기남이(pkn2****),명작입니다 꼭보세요!!!!  
7-25-2018,2018,7,25,18:48,수요일,10,8,0,Jacks(alth****),1일 1클레멘타인 실천하고있습니다~ 진짜 이렇게 좋은 영화는 공유하는게 미덕이죠!  
7-25-2018,2018,7,25,18:03,수요일,10,8,0,미니성(tjda****),최고입니다 인생작입니다  
7-25-2018,2018,7,25,17:56,수요일,10,8,0,고경모(ruda****),갓주형께서도 칭찬하신 영화  
7-25-2018,2018,7,25,17:55,수요일,10,8,0,BlackFlash(kkkk****),일단 봐봐 너의 시간을 훔쳐갈게  
7-24-2018,2018,7,24,10:34,화요일,10,8,0,noru****,정말 대단한 영화 꼭 보세요  
7-23-2018,2018,7,23,19:16,월요일,10,8,0,상준씨(ppsm****),평점이 너무 좋아 속는 셈치고 봤는데 이후 제 컴과 외장하드에는 이 영화만 남겨두고 다 삭제하였습니다.  
7-23-2018,2018,7,23,09:44,월요일,10,8,0,나의얘기를(saga****),"감사합니다, 여러분들. 다들 추천해주신 덕분에 드디어 보게 되었습니다. 또 한번 더 감사합니다.  "
7-22-2018,2018,7,22,02:15,일요일,10,8,0,2037(leo5****),시간이란 게...참 길더군요...  
7-20-2018,2018,7,20,11:16,금요일,10,8,0,유러피안토이(anso****),이런 영화에 관객이 이렇게 없었다...니요...인생영화임에 틀림없어요..시간이 아깝지 않습니다  
7-20-2018,2018,7,20,10:05,금요일,10,8,0,abcd(poip****),ㅋㅋㅋ 클레멘타인 보고 울고 댓글보고 웃고..내 똥꼬엔 털이...  
7-20-2018,2018,7,20,07:29,금요일,10,8,0,파란의예고(nove****), 왜 이 영화는 재개봉을 하지 않죠? 극장 재상영 가즈아~~!!  
7-6-2018,2018,7,6,16:53,금요일,10,8,0,오혁진(then****),"앞이 보이지 않았는데, 클레멘타인과 함께 난생처음 세상을 보게 되었네요.  "
7-6-2018,2018,7,6,16:02,금요일,10,8,0,us19****,삶에 찌들어있던 나의 감성을 일깨워준영화... 얼마만에 흘린 눈물인가  
7-5-2018,2018,7,5,13:05,목요일,9,8,0,김기현(gold****),이거 정말 좋은 영화인가요?  
7-5-2018,2018,7,5,10:52,목요일,10,8,0,ㅇㄹㅇㄹ(ssan****),클레멘타인~클레멘타인~유년시절 기분좋게 들었던 동요가 슬프게 연상되는 이유는 이 영화때문일까...내 교감신경계를 송두리째 흔든 영화  
7-4-2018,2018,7,4,22:13,수요일,10,8,0,정지혁이(tlfk****),마치 인간의 영혼이 영화화된듯 하다  
6-27-2018,2018,6,27,01:41,수요일,10,8,0,낑깡(smar****),명작 중의 명작입니다...ㅜㅜ 눈물이 멈추질 않네요 14년 전 영화인데도 이정도의 퀄리티라니...  
6-19-2018,2018,6,19,06:06,화요일,10,8,0,아이들(yb98****),한국에서 다시는 나올 수 없는 명작입니다.  
6-15-2018,2018,6,15,03:46,금요일,10,8,0,jjj3113(hp56****),인생 최고의 영화 눈물이 주르륵 바지까지 적셨네요 절대ㅠ지린건 아니고 눈물입니다  
6-14-2018,2018,6,14,22:23,목요일,10,8,0,혜라(sema****),무슨 말이 더 필요하겠습니까  
6-10-2018,2018,6,10,14:41,일요일,10,8,0,jimmy(tony****),"""뭔가 보여드리겠습니다""  "
6-6-2018,2018,6,6,22:13,수요일,10,8,0,이다영(ekdu****),아닠ㅋㅋㅋ이거 왜 숨은명작 카테고리에 있는뎈ㅋㅋㅋ  
6-4-2018,2018,6,4,21:29,월요일,10,8,0,에에디(shk7****),와...이런영화는 평생소장해야죠  
6-2-2018,2018,6,2,01:14,토요일,10,8,0,Yatta(kano****),100점을 주고 싶지만 10점밖에 못주는게 아쉽다  
5-30-2018,2018,5,30,21:07,수요일,10,8,0,Alice(ggol****),미래에서 왔어요 이영화는 3098년에도 최고의 명작으로 선정 될만큼 개 수작 입니다  
5-30-2018,2018,5,30,11:44,수요일,10,8,0,주(altk****),이정도면 궁금해서라도 보고싶네 ㅋㅋ  
5-29-2018,2018,5,29,14:02,화요일,10,8,0,맨유챔스우승(sims****),영화의 교과서랄까..  
5-29-2018,2018,5,29,00:24,화요일,10,8,0,flas****,이거보면 다른영화 못봅니다 보면안되요  
5-27-2018,2018,5,27,18:58,일요일,10,8,0,전호준(hoju****),영화매니아로써 감히 이런명작을 모르고있었다니정말 한탄스럽습니다 클레멘타인같은 희대의명작을보고 한국영화의대단함을한번더느꼈습니다  
5-27-2018,2018,5,27,13:33,일요일,10,8,0,goal****,이 영화를 뛰어넘는 대작은 없다 이 영화는 전설로 남아 후세의 교과서의 수록될것이며 앞으로 우리의 감성을 자극해줄 잔잔하고 아름다운 추억으로 남을것이다  
5-24-2018,2018,5,24,11:41,목요일,10,8,0,shs5****,이영화를보고로또1등에당첨됐습니다  
5-23-2018,2018,5,23,09:56,수요일,10,8,0,ㅇㅇㅇㅇ(ever****),이 영화를 보고 암이 나았습니다  
5-19-2018,2018,5,19,13:34,토요일,10,8,0,가루(ocha****),매일 새벽5시에일어나 클레멘타인을 보고 출근합니다.  
5-16-2018,2018,5,16,10:24,수요일,10,8,0,급식충만보면우는형(wble****),어벤져스 인피니티 워 저리가라 할정도의 명작이군요. 왜 영화관에서 보지 못했을까 할정도 입니다.암튼 낭낭한 추천 박고 갑니다^^  
5-12-2018,2018,5,12,03:34,토요일,10,8,0,David(min9****),어벤져스 인피티니워를봐도 클레멘타인의 스토리랑 연출을 따라갈 순 없다.스티븐 시갈의 명품연기와 탄탄한 스토리로 지루할 틈이 없다. 진짜 내 생의 최고의 명작.  
5-4-2018,2018,5,4,14:11,금요일,10,8,0,오골계(pilo****),알바하고 나서 봤는데 동전씬이 너무 유쾌해서 10점 드립니다.  
5-3-2018,2018,5,3,13:07,목요일,10,8,0,김영서(yeon****),영화를 보고나면 꼭 댓글을 읽어보아라고개를 끄덕이며 댓글에 공감할 것이다  
5-2-2018,2018,5,2,18:40,수요일,10,8,0,방진우(qkdw****),하도 주변에서 재밌다고 꼭 봐라고 해서 봤는데정말로 재밌네요. 이 감동을 여러분들과 함께하고싶습니다. 꼭 보세요 ^^  
5-1-2018,2018,5,1,01:20,화요일,10,8,0,매미(krsh****),말로 표현할 수 없는 역사 그 자체  
4-30-2018,2018,4,30,19:14,월요일,10,8,0,음이이(1248****),"모두가 10점을 주었을때, 나도 10점 을 주었다  "
4-29-2018,2018,4,29,18:50,일요일,10,8,0,Delon(song****),나만 당할수는 절대 없지. 암! 아아아아암!  
4-28-2018,2018,4,28,01:05,토요일,10,8,0,에이서(rede****),건국 이래 최고의 한국 액션 영화  
4-26-2018,2018,4,26,21:46,목요일,10,8,0,his(sjsj****),보고 눈물을 훔쳤습니다. 다들 꼭 보세요  
4-26-2018,2018,4,26,02:48,목요일,10,8,0,lovestaywthme(lac9****),"최고의 영화입니다,,,,갓갓  "
4-25-2018,2018,4,25,22:26,수요일,10,8,0,화난(woal****),감독 포함 주연 4명 중 3명이 이 영화를 마지막으로 영화판을 떠난듯...  
4-22-2018,2018,4,22,05:45,일요일,10,8,0,영기야 왜 태어났니(fuku****),액션의 신 시걸형님 최곱니다  
4-17-2018,2018,4,17,01:29,화요일,6,8,0,박재현(blis****),ㅋㅋㅋㅋ평론가들조차 평가를 거부한건가 평론가 평점이 하나도 없네  
4-12-2018,2018,4,12,04:52,목요일,10,8,0,ydhg****,지금 이 글을 쓰면서 눈물이 앞을 가려 제대로  타이핑 안되네요 Thank you  Clementine  
4-10-2018,2018,4,10,15:29,화요일,10,8,0,ycoi****,이거 안본눈인데 사실분게신가요?  
4-9-2018,2018,4,9,12:22,월요일,10,8,0,도화(lord****),거짓 영화평이 난무할때 이 영화만큼은 결던코 진실됨의 평이라 말씀드립니다. 눈물이 말랐던 눈에서 이 영화를 본후 뜨거운눈물을  흘릴수 있었습니다. 감사합니다. 사랑합니다.  
4-8-2018,2018,4,8,16:15,일요일,10,8,0,전(jjjq****),삶에 대한 진지한 성찰을 하게 합니다.  
4-7-2018,2018,4,7,22:49,토요일,10,8,0,안중근의사(defg****),이 영화 한편 만으로도 이번 생에 가치는 충분하다....  
3-26-2018,2018,3,26,00:27,월요일,10,8,0,마리화나(ferr****),이동준은 시걸과 대역이나 와이어가 없는 이종격투기 리얼액션과 함께 가슴뭉클한 가족애가 관객들의 공감을 불러일으키면서 흥행에도 성공할 것이라고자신한다격렬한 핏빛 액션 속에 흐르는 한폭의 수채화같은 아빠와 딸의사랑이야기이죠한국판'아이엠샘'이라고나할까요  
3-25-2018,2018,3,25,10:12,일요일,10,8,0,곰고긔(lee9****),왜 평점이 떨어지나 방어하자  
3-21-2018,2018,3,21,21:32,수요일,10,8,0,choi****,첫사랑은 잊었지만 클레맨타인은 아직도 가슴을 적십니다.   재개봉 강력히 요청합니다  
3-18-2018,2018,3,18,18:47,일요일,10,8,0,찌개(phmh****),너무 슬퍼서 다 못보고 극장밖으로 뛰쳐나왔다...  
3-12-2018,2018,3,12,22:47,월요일,10,8,0,Iolo(iolo****),"저는 우리나라에 애국가가 있듯이 나라에는 그에 버금가는 국가 영화가 있어야 한다고 생각합니다 그것은바로 클레멘타인이였습니다,  "
3-12-2018,2018,3,12,01:47,월요일,10,8,0,KTHDNA(rlax****),연어가 회귀본능을 가지고 있다면 인간에겐 클레멘타인 본능이 있다. 결국 죽기 전에 보게될 영화인거다.  
3-4-2018,2018,3,4,19:57,일요일,10,8,0,수액(sin2****),몇 번을 다시 봐도 감동은 오히려 배가 된다.  
3-4-2018,2018,3,4,18:33,일요일,7,8,0,수박(ipse****),얘들아 진지하게 나만 재밌냐?  
3-1-2018,2018,3,1,20:27,목요일,10,8,0,앤디(ey11****),한국을 넘어 전세계인에게 이 영화를 보게하여  한국인의 위대한 인내심에 대한 존경을 받고 싶다. 이 것은 2사간 동안 촉박하게 이루어지는 극한의 고문이다.  
2-7-2018,2018,2,7,19:48,수요일,10,8,0,반더루스트(alba****),대한 의사 협회에서 추천한다는 이 영화를 이제서야 보게 되었네요. 유네스코 세계 문화 유산으로 등재될거라는  소문도...  
2-7-2018,2018,2,7,17:14,수요일,10,8,0,ddoo****,"오늘 7년 사귄 여자친구와 헤어진지 한달째 되었네요.정말 매일매일 가만히 있다가도 눈물이 나고, 마음이 허해집니다. 세상살기 이렇게 힘든가요?하지만 오늘 갑자기 생각난 클레멘타인 평점을 정독하면서 웃으면서 시작할수 있었습니다.  "
2-5-2018,2018,2,5,03:53,월요일,10,8,0,주바리아(shym****),신의 작품. 더이상 형용할 수가 없다.  
1-21-2018,2018,1,21,20:46,일요일,10,8,0,화룽이(ghkf****),"첫 직장에 들어가 월급을 타서 절 길러주실 할머니께 클레멘타인 DVD를 선물 해 드렸습니다. 5년이 지난 현재, 그 DVD는 마을회관 정중앙에 액자에 걸려있습니다.  "
1-20-2018,2018,1,20,20:19,토요일,10,8,0,등반대장(rute****),시대를 너무 앞서간 저주받은 걸작...2004년 개봉당시는 철저히 외면당했지만 시간이 지날수록 그 빛이 발하는듯...지금이라도 극장재개봉과 출연배우들 그대로 속편제작을 기대해봅니다...  
1-2-2018,2018,1,2,00:11,화요일,10,8,0,므히히힝(a_1_****),원래는 고전 영화를 잘 안보는 타입이다 평이 자자하기도 했고 궁금하기도 했고 기대 없이 보았는데 광광우럭다.. 내 인중과 정수리가 소름이 돋을 정도로.. 가슴이 먹먹하다 이 여운을 오래 간직하고 싶다 내 인생 영화...  
12-30-2017,2017,12,30,23:41,토요일,10,8,0,masc****,11점 그 이상의 영화다 네이버 영화 평점 1위로 올리자  
12-29-2017,2017,12,29,14:19,금요일,10,8,0,k3zh****,10점 가즈아~!!!!  
12-22-2017,2017,12,22,01:41,금요일,10,8,0,SRV(srv2****),10 년전 처음 봤을때는 영화의 철학적 메세지를 이해하지 못해서 비웃고 조롱했지만 10 년뒤 지금 다시 이 영화를 보니까 지난 날의 나의 무지함이 부끄러웠다  
12-16-2017,2017,12,16,20:57,토요일,10,8,0,쾌속질주오호(kej6****),140자로 어찌 이 영화를 표현하리요  
12-16-2017,2017,12,16,15:25,토요일,10,8,0,박인준(bird****),쇼생크탈출에 이은 최고의 명작  
12-16-2017,2017,12,16,14:45,토요일,10,8,0,하늘좋아(ss20****),영화를 직접 보면 비로소 깨닫게 될것이다  
12-15-2017,2017,12,15,17:05,금요일,10,8,0,마닐라뚱(twit****),몇일전 회사도 그만두고 여자친구랑도 헤어지고친구랑도 싸우고 안좋은 일들만 내게 일어나던 찰나에기분전환겸 영화를 볼려고 네이버평점 추천 영화보다가클레멘타인 영화를 알게 되었고영화가 주는  감동과 여운이 내 상황과 오버랩이 되면서한참을 울었다  
12-15-2017,2017,12,15,14:03,금요일,10,8,0,미르(mirr****),의심하지마라‥ 인샛 최고의 역작이다‥  
12-15-2017,2017,12,15,13:46,금요일,10,8,0,bari****,전세계인에게보여주고싶은영화... 세계평화에 기여할영화  
12-15-2017,2017,12,15,13:43,금요일,10,8,0,머털도사(maya****),황금같은주말에 와이프가 이 영화를 추천한다. 그리고 이 영화를 같이 본후 와이프가 저녁에 갈비찜과 시원한맥주를 해주었다. 가족의 정을 확인할수있는 영화였다.  
12-6-2017,2017,12,6,17:19,수요일,10,8,0,크크크(ghda****),평점 1점대에 낚여 이 명작을 보지도 못 하고 죽을 뻔 했네요 악의 구렁텅이에서 더 깊은 지하세계로 끄집어내준 평점10점인들에게 축복을  
10-17-2017,2017,10,17,01:58,화요일,10,8,0,삼룡이(sola****),심한 안구건조증이 있어서 안과에갔더니 의사선생님이 클레멘타인을 처방해주셨습니다. 집에서 클레멘타인을 본 후에 제 안구건조증은 말끔하게 나았습니다. 안구건조엔 클레멘타인  
8-19-2017,2017,8,19,17:45,토요일,10,8,0,토토로로(cali****),평론가 평점은 언제 나오나? 평론가들이여 당장 이 명작을 평론하라.  
8-8-2017,2017,8,8,09:43,화요일,10,8,0,hihyoung(hihy****),이 영화를 극장에서 봤어야 했는데..  
8-3-2017,2017,8,3,13:16,목요일,10,8,0,니콜라스(ljy8****),요즘같은 안보위기를 해결할수 있는 해답이 여기있습니다. 김정은과 시진핑에게 이 영화를 선물한다면 동아시아에 평화가 올것입니다.  
7-25-2017,2017,7,25,22:33,화요일,10,8,0,박찬희(arec****),미친것들진짜 아빠일어나소리가 울부짖는다  
7-21-2017,2017,7,21,21:42,금요일,10,8,0,wlsd****,클래맨타인과 리얼을 보지 않은자 영화에 대해 감히 평하지 말라  
7-11-2017,2017,7,11,23:01,화요일,10,8,0,ROK KINO(wsw2****),무인도에 단 하나의 영화만을 가지고 들어가야 한다면 애마부인을 고르겠으나 일생동안 단 한번만 영화를 볼 기회가 있다면 주저없이 클레멘타인이다.  
7-11-2017,2017,7,11,08:01,화요일,10,8,0,파라거스(ehdw****),대한민국의 결단력은 세계 제일~!!! 다들 클레멘타인으로 대통합 합시다! 5천만 국민이 클레멘타인을 보는 그 날까지...!!!  
7-10-2017,2017,7,10,23:34,월요일,10,8,0,별아기(muns****),이 영화를 이제야 보다니요 ㅠㅠ 이젠 죽어도 여한이 없습니다~  
7-6-2017,2017,7,6,15:18,목요일,10,8,0,키라(sony****),리얼 보고 평점 남겨요 감독님! 몰라봐서 죄송합니다  
6-28-2017,2017,6,28,16:15,수요일,10,8,0,이재영(theg****),그때부터 지금까지 눈물이 멈추지않는다.  
6-3-2017,2017,6,3,20:39,토요일,10,8,0,마왕(nano****),대한민국 국민의 마음을 하나로 뭉치게 했다는 점에서 이 영화의 기적적인 가치를 느낀다.  
6-3-2017,2017,6,3,18:56,토요일,10,8,0,JYJ(naro****),내인생을 바꾼 영화 감동 그자체  
6-3-2017,2017,6,3,17:23,토요일,10,8,0,조군(mads****),제겐 클레멘타인을 평가할 자격이 없습니다.  
6-3-2017,2017,6,3,16:08,토요일,10,8,0,츈식(eunn****),100년을 앞서간 영화  
6-2-2017,2017,6,2,13:26,금요일,10,8,0,퀴즈탐험(amps****),이 영화를 보고 로또에 당첨이 되었다.  
6-1-2017,2017,6,1,02:04,목요일,10,8,0,Goodmaker(good****),한국을 대표하는 영화입니다  
5-29-2017,2017,5,29,23:29,월요일,10,8,0,사차원세계(wonj****),영화가 무엇인지 한번 더 깨닫게 해준 영화 그 이상의 작품.  
5-20-2017,2017,5,20,20:07,토요일,10,8,0,미소(htw2****),진정한 명작이란 이 영화를 두고 이야기 하는거 아닐까..  
5-14-2017,2017,5,14,22:39,일요일,10,8,0,쌀국수뚝배기(lamb****),최고의 영화. 말이 필요 없습니다  
5-14-2017,2017,5,14,15:33,일요일,10,8,0,Jagdpanzer38t Hetzer(cccp****),세계 최고의 영화다! 정말 추천한다!  
5-13-2017,2017,5,13,18:49,토요일,10,8,0,YT Ryu(fryt****),요즘 나오는 영화들보다 훨씬 재밌는듯  
5-12-2017,2017,5,12,15:13,금요일,10,8,0,미니(mini****),말로 표현할 수 없는 감동ㅡ  
5-7-2017,2017,5,7,10:54,일요일,10,8,0,김궁예(sain****),최근래 평점이 너무 조아서. P2p에서 다운 받아 봤는데. 대박. 난 왜 이제서야 이걸 극장에서 못보았을까  하는 자괴감이 드는 영화. 재개봉하면 무조건 극장에서 다시한번의 감동을 느끼고 싶다.  
5-7-2017,2017,5,7,00:19,일요일,10,8,0,이름(mpul****),사람들이 왜 이 영화에 열광하는지 알았습니다. 이제서야 본게 후회되네요. 시간내서 꼭 보세요.  
5-5-2017,2017,5,5,19:40,금요일,10,8,0,doldoli(zoob****),"시간이 흘러 몇년만에 또 봤습니다, 영혼의 떨림이 멈추질 않습니다.  "
4-24-2017,2017,4,24,16:22,월요일,10,8,0,팥병수(ghos****),아빠! 일어나! 라는 대사에서 그만 울어버렸습니다. 이런 명작을 이제와서 봤다는게 부끄럽네요  
4-17-2017,2017,4,17,01:56,월요일,10,8,0,sk(kbkb****),말이 필요가 없는영화...  
4-14-2017,2017,4,14,18:42,금요일,10,8,0,비천야차(xix9****),인간이 만든 역사상 가장 완벽한 한편의 동화같은 영화..  
4-6-2017,2017,4,6,13:23,목요일,10,8,0,조시(popg****),이 작품이 그 정도로 명작인가요? 찾아봐야겠네요.  
4-6-2017,2017,4,6,12:42,목요일,10,8,0,이상언(leet****),전설의 레전드 10자ㅡㅡ  
2-21-2017,2017,2,21,21:37,화요일,10,8,0,EventHorizon(even****),이 걸작을 자기들만 보려고  1점주는 알바 조심하시길..  
2-15-2017,2017,2,15,06:25,수요일,10,8,0,차도빈(troy****),<클레멘타인>은 나의 인생 영화.  
2-15-2017,2017,2,15,01:52,수요일,10,8,0,박성환(kdss****),시간을 되돌릴수 있다면 클레멘타인을  보기 전으로 돌아가서 클레멘타인을 처음 봤을 때의 감동을 다시 느끼고 싶다  
2-14-2017,2017,2,14,23:30,화요일,10,8,0,hydr****,네이버 평점과 감상평이 모든걸 말해주죠  
2-1-2017,2017,2,1,23:22,수요일,10,8,0,왈왈(kyun****),"""아빠, 일어나!!!"" 이 한마디로 모든 것을 감동의 물바다로 만들었던 영화. 당시 극장의 사람들 중에 눈물을 안 흘린 자가 없다고 합니다.  "
1-30-2017,2017,1,30,21:47,월요일,10,8,0,미침마담(ivhf****),명작인데 까는넘들은 머냐?  
1-30-2017,2017,1,30,03:27,월요일,10,8,0,Utopiste(topg****),이 영화가 왜 네이버 액션부분 1위가 아닌 것이죠? 평점을 주기 위해 글을 적습니다. 내 인생 최고 영화 엄지척!  
1-3-2017,2017,1,3,01:00,화요일,10,8,0,메론바(izee****),나이30에 이렇게 울어 본적은 처음이네요...가슴깊숙히 응어리 졋던게 나은 느낌입니다. 감사합니다  
12-25-2016,2016,12,25,14:00,일요일,10,8,0,sang****,아빠 일어나의 '아'만 들었는데도 눈물이 쏟아졌다. 감정의 결을 제대로 어루만져주는 영화. 이러한 힘든 시기에 큰 힘을 실어줄만한 유일무이한 영화고 평점이 짜기로 소문난 박평식 평론가도 기어코 10점을 줄 것이라 확신한다.  
12-24-2016,2016,12,24,04:02,토요일,10,8,0,천재마린(skau****),내 인생의 명작 마지막 정말 슬퍼 눈물 콧물 돗물까지 흘렸네요 괜히 나오는 평점이 아니구나 느꼈습니다  
12-23-2016,2016,12,23,19:16,금요일,10,8,0,정진우(impl****),난 이 영화를 레옹과 비교하고싶다.. 어쩌면 클레멘타인이 레옹보다 더 빛날지도 모른다고 생각한다.  
11-19-2016,2016,11,19,10:00,토요일,9,8,0,doom****,50억 대작이란 이런것이다  
11-14-2016,2016,11,14,03:00,월요일,10,8,0,조건희(blis****),암세포도 눈물이 있다는 것을 알게 해준 영화  
11-12-2016,2016,11,12,21:20,토요일,10,8,0,목표를 못찾겠다(hyun****),이 영화를 보고 암세포가 암에 걸려 뒤졌습니다  
11-6-2016,2016,11,6,20:05,일요일,10,8,0,체리(doob****),10년전 회사 직원들과 이 영화를 봤습니다.  이후 직원들의 사기가 멈출줄을 모르더니 회사는 날로 번창하여 이제는 대기업이 되었습니다.  감사합니다. 동준형님  
11-5-2016,2016,11,5,19:27,토요일,10,8,0,최지민(cjme****),네이바에서 추천받고 본 인생 최고의 영화  
10-21-2016,2016,10,21,18:29,금요일,10,8,0,쩌락도(junc****),내가 하루 하루 헛되이 보낸 시간의 소중함을 깨달았습니다.  
10-7-2016,2016,10,7,14:30,금요일,10,8,0,동량지재(zizo****),"클레멘타인을 못 본 사람은 있어도, 한번만 본 사람은 없다.  "
8-23-2016,2016,8,23,15:44,화요일,10,8,0,닭갈비(pjw2****),뿜에서 보고온 사람들 모여라...이영화 절대 망작이 아닌데 스티븐시걸 홍보잘못해서 망작이라고 알려져서 그런거다  
8-10-2016,2016,8,10,09:22,수요일,10,8,0,데지레(ange****),"당신은 한번이라도 이런 감정을 느껴본적이 있는가? ""아빠! 일어나!""  "
8-9-2016,2016,8,9,12:47,화요일,10,8,0,uPrin(5031****),최고의 영화입니다.눈물의 ...쇼  
7-27-2016,2016,7,27,09:51,수요일,10,8,0,꼬마(koma****),제이슨본 연관검색영화에 클레멘타인이 떠있다.. 그것이 이영화의 클라스다.. 블루레이는 언제나오냐!!!!  
6-22-2016,2016,6,22,12:05,수요일,10,8,0,pki3****,"저희할머니께선 식물인간으로 누워계신지 오래됐습니 의사도포기했죠. 명절날 클레멘타인 dvd를 할머니 옆에서틀었습니다..식물인간이셨던 저희할머니가 벌떡일어서더니 ""넓고넓은 바닷가에오막살이 집한채""를 불렀어요 가족모두가 떼창했죠. . .이영화는기적입니다  "
5-26-2016,2016,5,26,00:44,목요일,10,8,0,Masiro(chlr****),우주에서 떠도는 나홀로 인공위성급의 블록버스터 감동의 영화였다.  
5-22-2016,2016,5,22,23:08,일요일,10,8,0,바로바로나바로(meta****),때는 2004년 ...  태극기 휘날리며의 감동이  3달도 채 가시지 않았을때 클레멘타인이 개봉했다... 그때의 감동을 난 아직 잊지못한다. 분명 이 영화를 보러 극장에 갔지만 내가 깨어난 곳은 병원이었다. 너무 벅찬 감동이 심정지를 유발했었지...  
5-19-2016,2016,5,19,17:54,목요일,10,8,0,tg12****,이 영화보고 탈수현상 왔다..너무나도 많은 눈물을 흘려서ㅜ.ㅜ  
5-19-2016,2016,5,19,08:42,목요일,10,8,0,메기(magi****),평생 흘릴 눈물을 이영화를 보며 모두 쏟았다  
4-19-2016,2016,4,19,00:25,화요일,10,8,0,싱글되기(dism****),영화끝나고 30분간 여운때문에 꼼짝 할수가 없었습니다  
3-30-2016,2016,3,30,19:51,수요일,10,8,0,SenseOfSoul(tkdq****),"컴퓨터로 이 영화를 본 뒤 악성코드가 과부하가 걸려 컴퓨터가 치료됐습니다, 진짜 감사합니다  "
3-26-2016,2016,3,26,00:13,토요일,10,8,0,dori****,이영화를 본후 새로운 삶을 살게되었네요.. 감사합니다..  
3-18-2016,2016,3,18,18:11,금요일,10,8,0,마왕(dlck****),10점입니다 그이상은 말할수없습니다...  
3-7-2016,2016,3,7,15:42,월요일,10,8,0,knj0****,이런 걸작을 이제야 봤네요ㅠ 아버지와 함께 봤습니다. 남자는 태어나 3번 우는 것이라 항상 말씀하셨던 아버지가 우시더군요.  
12-31-2015,2015,12,31,19:12,목요일,10,8,0,음유시인(myca****),이 영화를 보고 감기가 나았습니다 어예  
12-26-2015,2015,12,26,15:14,토요일,10,8,0,jdh9****,이 시대의 착한 항암영화. 추천합니다  
6-22-2015,2015,6,22,14:30,월요일,10,8,0,껌효춘(dna3****),한번 보게 된다면 죽어도 여한이 없는 영화!  
6-20-2015,2015,6,20,01:14,토요일,10,8,0,74747474(wodn****),아빠 일어나를 듣기위해 1시간10분을 참았다.1시간30분을보고 기억남는건 아빠 일어나 밖에없다.이제 핸드폰 알람은 아빠 일어나다. 암튼 이영화는 최고다 안보면 진심 후회할것이다.  
1-12-2015,2015,1,12,00:50,월요일,10,8,0,ruda****,진짜 평정보고 긴가민가 해서 봤는데 ㆍ ¨ 이런 명작은 진짜 한국영화계의 성장 그자체다  
1-8-2015,2015,1,8,15:47,목요일,10,8,0,똥(mapo****),"아빠 일어나!!  이장면에서  손발이 어찌되지 않으면 지구를 떠나라 ,정말 눈물날뻔  "
11-29-2014,2014,11,29,10:42,토요일,10,8,0,백STAR(gotj****),진한 감동의  폭포... 한번쯤 눈물 흘리고 싶은 사람이라면 보는 것이 좋다  
7-17-2014,2014,7,17,22:46,목요일,10,8,0,anam****,남들에겐 아니 지인들에게조차 단 일원도 안사는 대왕소금인 저였지만 클레멘타인은 그런 저를 180도 바꿔놨습니다. 클레멘타인을 보고 북받쳐오르는 감동을 못참아 전재산을 기부했습니다. 여러분도 꼭보시길....  
7-17-2014,2014,7,17,18:41,목요일,10,8,0,네온사인(ssp0****),무엇이든 존재하는 것은 클레멘타인 안에 있으며 클레멘타인 없이는 존재할 수 없거나 생각할 수도 없다.  
6-14-2014,2014,6,14,19:44,토요일,10,8,0,베라(ljs7****),감동적이네요.. 마음에 듭니다.  
6-8-2014,2014,6,8,00:43,일요일,10,8,0,dlvm****,어찌 누가 이 영화를 평가할 수 있을까. 감독 스스로도 감히 이 영화를 평가할 수 없을 것 이다  
6-14-2013,2013,6,14,21:14,금요일,10,8,0,데빌포스(dark****),클레멘타인과 같은 전설같은 영화와  같은 세기를 살아갔다는것에 자긍심을 느낍니다. 후세에 길이 남길 국보 1호 같은 영화임  
2-11-2019,2019,2,11,12:32,월요일,10,9,1,hooka(alsk****),"프랑스의 뤼미에르 형제가 처음 영사기를 발명했을 때, 화면에는 클레멘타인이 시작되고 있었다고 한다.  "
1-12-2019,2019,1,12,04:19,토요일,10,9,1,ashdhdhahf(ecni****),관객수는 3500명인데 왜 평점은 20000명이 매겼노  
1-3-2019,2019,1,3,23:36,목요일,10,9,1,buss****,이 영화를 통해 인생은 풍요로워집니다. 윤♥  
11-25-2018,2018,11,25,00:58,일요일,10,9,1,덫 밟은 기사(bee2****),네티즌 평점 분포도가 모든 것을 말해준다. 10점 아니면 1점. 이 영화에 1점을 준 사람들은 유튜브에서 모든 영상에 싫어요를 주는 사람들임에 틀림없다.  
10-15-2018,2018,10,15,21:53,월요일,10,9,1,이동명(kari****),그동안 인생에서 타이타닉이 최곤줄알았다 나의 무지와 부족함 내가알고있는것은 매우 짧고 적은것이구나를 느꼈다내인생영화는클레멘타인이고 내가눈을감을때 이영화를떠올릴것이다  
9-15-2018,2018,9,15,11:44,토요일,10,9,1,cybe****,"이 영화를 한 번도 안본 사람은 있지만, 한 번 밖에 안본 사람은 없을듯. 2000년대 초기 작품이라고는 믿기지 않을 세련된 영상과 탄탄한 스토리. 오늘 와이프랑 10주년 기념으로 저녁에 와인 한잔 하면서 한 번 더 볼까합니다.  "
9-9-2018,2018,9,9,00:14,일요일,10,9,1,이평강(luck****),영화계 레전드배우 스티븐 시걸의 대표작  
9-8-2018,2018,9,8,15:48,토요일,10,9,1,111(arro****),대한민국 최고의 영화  
9-6-2018,2018,9,6,07:49,목요일,10,9,1,voltaire(gchj****),"관객 3,562만명 ㅎㄷㄷ  "
5-2-2018,2018,5,2,12:58,수요일,10,9,1,dldl****,남북정상회담보다 더 감동적..  
4-4-2018,2018,4,4,20:43,수요일,10,9,1,손상모(dddm****),이영화는 보다가 죽어도 여한이없다!!!  
4-3-2018,2018,4,3,00:42,화요일,10,9,1,유니온(hong****),고마워요...영원히 잊지않을께요  
3-22-2018,2018,3,22,10:53,목요일,10,9,1,짐영(plqw****),학교 기말고사 답안지에 클레멘타인만 적었을 뿐인데  교수님이 A+를 주시더군요...  
2-7-2018,2018,2,7,20:53,수요일,10,9,1,siny****,우울할땐 여기서 평점을 보게된다ㅋㅋ  
2-5-2018,2018,2,5,18:10,월요일,10,9,1,Noah 25(dho9****),이젠 안녕 클레멘타인. 널 보내줄게.한 시대를 풍미했던 위대한 영화를 볼 수 있어 행복했어.이제부터는 영화 염력이 너의 자리를 지킬거야.그동안 고생했고 고마웠어.  
1-6-2018,2018,1,6,02:08,토요일,10,9,1,마장이(mllm****),"이 영화를본 앉은뱅이는 일어나서 걸었고,  시체들은 무덤을 파헤쳐 나왔으며, 곰은 사람이 되었고, 지구를 침략하려던 외계인들은 고향별로 돌아갔습니다  "
8-26-2017,2017,8,26,06:39,토요일,2,9,1,yu44****,이 세상에 영화는 두개 뿐이다.하나는 클레멘타인. 다른 하나는 클레멘타인을 제외한 나머지들...  
7-5-2017,2017,7,5,22:35,수요일,10,9,1,핸듬(mr2s****),히틀러가 이 영화를 봤다면 유태인이아닌 한민족을 말살했을 것이다  
7-1-2017,2017,7,1,22:01,토요일,10,9,1,오성룡(anyf****),방금 진짜 봤습니다. 영화 끝난지 두시간이 흘렀지만 아직도 박수를 치고 있습니다. 가족영화로 5살 아들과 함께 봤는데 은서우의 치아 마술은 우리 아들이 좋아합니다  
7-1-2017,2017,7,1,16:54,토요일,10,9,1,김지민(jimi****),"이 영화가 재미없다고 하시고 일부러 평점 낮게 주시는 분들..이 1000년이 지나도 우리의눈을 뜨이게 할 클레멘타인의 감동, 아빠 일어나 라고 외칠때 느껴지는 벅참 을 자기들끼리만 갖고 있으려고 하시지 마시죠.이분들 다 자기만 알고 있으려고하는겁니다.  "
4-13-2017,2017,4,13,16:19,목요일,10,9,1,오솔오솔(pshe****),2004년..영화관에서 이 영화를 본 후  제 인생은 달라졌죠...이 감동을 모두와 함께 나누고 싶네요..시간을 되돌릴 수 있다면 2004년으로 돌아가 사비를 털어서라도 모든 영화관에 이 영화만 상영 될 수 있도록 할 겁니다.  
3-13-2017,2017,3,13,10:13,월요일,10,9,1,욱사마(leab****),구라 안치고 2004년 영화치고 수작이다 지금 개봉하면 1000만 그냥 패스다 슬퍼서 눈으로 울고 액션땜에 밑으론 지렸다 울고 지리고 줄여서 울지마 이단어의탄생이 클레멘타인때문인걸 아무도 모르지 꼭봐라 두번봐라  
2-16-2017,2017,2,16,11:35,목요일,10,9,1,선수(hago****),이 영화를 보고 가정의 소중함을 깨닫고 이혼했던 아내와 재 결합하게 되었습니다 감사드립니다  
11-30-2016,2016,11,30,13:20,수요일,10,9,1,011h****,왜 이동준씨가 다른 영화촬영을 촬영않고 쉬고 계시는지 이제 알았습니다. 클레멘타인과 같은 훌륭한 각본을 못만난거군요.  
10-23-2016,2016,10,23,20:31,일요일,10,9,1,피나마나(gyru****),아빠 일어나 라는 대사에 잠드신 아버지가 일어나 클레멘타인 하냐며 새벽에 같이봤네요  
9-22-2016,2016,9,22,14:53,목요일,10,9,1,Strix(dski****),이 영화를 보고 암이 나았습니다암세포가 암에걸려 죽었거든요  
8-24-2016,2016,8,24,22:04,수요일,10,9,1,돈꾼형(sd83****),정녕 인간이 만든것이란 말인가!!인간이 만든 최고의 수작길이길이 보존될 최고의 클래식!!  
8-24-2016,2016,8,24,17:29,수요일,10,9,1,진꿈(rote****),무슨 말이 필요한가. 클레멘타인이다.  
8-24-2016,2016,8,24,16:31,수요일,10,9,1,1094****,이게 명작이 아니면 뭐가 명작이란 말인가!!  
3-8-2016,2016,3,8,14:17,화요일,10,9,1,세월(rock****),이제 겨우 두돌된 아들놈과 거실 쇼파에 앉아 이 영화를 보았습니다. 영화가 끝나고 제가 눈물을 흘리자 왜 우냐는듯이 쳐다보더군요. 아들을 꼭 끌어안고 말해 주었습니다 너도 이 영화를 보고 눈물을 흘리때 쯤에는 진짜 남자가 되어 있을거라고...  
10-18-2015,2015,10,18,14:02,일요일,10,9,1,콩정(gori****),"현 시대에 노아가 살아있었다면, 이 영화를 방주에 실었을 것이다..  "
7-19-2015,2015,7,19,15:59,일요일,10,9,1,햄이읍성(zxf2****),보이저호를 다시회수해 클레멘타인을 꼭 넣어야한다.  
6-18-2015,2015,6,18,05:59,목요일,10,9,1,오즈(dark****),이런 명작을 지금에서야 보다니 폭풍감동 했습니다.  
2-1-2015,2015,2,1,21:59,일요일,10,9,1,냐용이(wlsg****),미국박스오피스에서 개봉당시 13주연속 1위를 했던영화입니다한국보다는 외국에서 더 유명했던 영화죠 미국TIME지 선정 20세기 최고의 영화 베스트10에도 드는 영화입니다 이미 영화평론가사이에서는 영화에 처음입문할때 가장먼저 보라고 추천하는 영화입니다  
8-13-2014,2014,8,13,21:04,수요일,10,9,1,배쓰스토커(8051****),명량을 능가하는 애국영화  
7-27-2014,2014,7,27,15:47,일요일,10,9,1,cjh1****,앞으로 두번다시 나올수가 없는 영화 역사상 최고의 작품입니다.  
10-17-2018,2018,10,17,18:43,수요일,10,10,2,우왕굿(tjrd****),클레멘타인이 1970년대에 개봉했다면 세계적인 축구스타 크리스티아누 호날두의 이름은 클레멘타이누 호날두가 되었을 것입니다.  
7-27-2017,2017,7,27,18:52,목요일,10,10,2,김민재(khsk****),바다가 생긴 이유는 클레멘타인을 보고 사람들이 울었기 때문이고 바다가 짠 이유는 그게 사람 눈물이기 때문이다  
8-26-2014,2014,8,26,18:43,화요일,10,10,2,이종서(dlsn****),"가족끼리봤는데 영화가끝난후 세명의눈엔 눈물이가득했습니다 개인적으로 대한민국 3대영화에 속한다고생각합니다( 조선미녀3총사,7광구,클라멘타인)  "
8-6-2014,2014,8,6,11:43,수요일,10,10,2,inte****,발기부전과 신장병을 앓고있는 40대입니다. 이영화본뒤로 이상하게 몸이 가볍고 아드레날린이 솟는 느낌이 들어 한달후에 병원에 가봤더니 의사선생님께 거의 완치수준의 진단을 받았네요..위대한 영화입니다. 그저 감사하다는 표현밖에 못해 민망합니다  
6-8-2014,2014,6,8,20:32,일요일,10,10,2,핑오더운지(deat****),이 영화를 보고  성기능이  재생됐다.  
7-8-2013,2013,7,8,00:32,월요일,10,10,2,hitt****,내인생 최고의 영화...세기의 명작이라고 감히 칭하고싶다....  
3-24-2019,2019,3,24,20:25,일요일,10,11,3,우윳빛족제비(leew****),"이 영화를 당장 북한 김정은에게 선물로 줘야합니다. 기립박수를 치면서  ""이 위대한 명화를 만든 남조선을 내 어찌 핵으로 위협할 수 있단 말인가?"" 라며 뜨거운 눈물을 흘리고, 핵무기를 포기하고 미국 트럼프와 종전선언을 할 것입니다.  "
7-26-2018,2018,7,26,21:24,목요일,10,11,3,hant****,보진않았지만 강추드립니다  
7-21-2014,2014,7,21,17:04,월요일,10,12,4,박세홍(tpgh****),수명이1시간40분단축된느낌 꼭보세요~!!  
10-3-2014,2014,10,3,23:34,금요일,1,28,20,공신워너비(sohn****),영화에 나온 대사보다 평점들이 주옥같은 영화 ㅋㅋㅋ  
6-26-2017,2017,6,26,22:21,월요일,1,35,27,찰스22(cheo****),아놔.. 제대로 낚엿네ㅡㅡ 명작이라길래 쏘주한잔 하면서 20분동안 집중해서 봤다ㅡㅡ 어쩐지 평 느낌이 좀 쌔하더라니ㅡㅡ  
5-17-2015,2015,5,17,04:47,일요일,1,58,50,듀란드(fres****),야이 사람들아...장난질이 너무하잖아 나 이거 내용도모르고 그저 감동적이라니 암이나았으니 하는말만 믿고 1주전에 고백한 여친과 같이봤어. 20분쯤 지나니까 '너 지금 나 놀리냐'면서 훽 일어서더니 나가버렸음.지금 핸드폰도 안 받아ㅠ 당신들이 책임져  
6-6-2019,2019,6,6,11:53,목요일,10,7,0,x1k1****,이영화를 보고 암이 암에걸려죽었습니다  
6-4-2019,2019,6,4,18:35,화요일,10,7,0,서교원(skw0****),현시대의 팔만대장경 우리민족의 혼을 담은 영화다  
6-4-2019,2019,6,4,01:44,화요일,10,7,0,꿈을위해(saba****),진짜 명작은 명작인가보네 개봉한지 15년이 흘렀어도 아직도 찾아보는 사람이들이 이렇게나 많다니  
6-3-2019,2019,6,3,21:41,월요일,10,7,0,AS 파로마(wind****),"Clementine[kl?m?nt?ːn, -t?in]  형용사1. 말로  표현 할 수 없는 2.아름 다운  "
6-3-2019,2019,6,3,00:00,월요일,10,7,0,어예에(won4****),BTS BROUGHT ME HERE !!  
5-31-2019,2019,5,31,15:37,금요일,10,7,0,ChaCha(itin****),"삻이 힘들어 포기하려고  마음독하게 먹고 준비하였으나 클라멘타인을 보고 깊을 울림을 받아 열심히 살아보려고 결정하였습니다, 가족의사랑에 덤으로 액션쾌감, 시걸형님의 표정연기 무엇하나 모자름이 없었습니다, 사람을 살리는 영화입니다  "
5-20-2019,2019,5,20,08:14,월요일,10,7,0,후라이데이(noka****),재개봉 안하냐 이것들아  
5-15-2019,2019,5,15,17:47,수요일,10,7,0,660315(thwj****),세상 모든영화를 합쳐도 클레멘타인의 빛남은 따라잡지못할것이다-아브라함 링컨  
5-13-2019,2019,5,13,12:47,월요일,10,7,0,Izzy(le67****),이 영화를 보기위해 십자가에서 부활했습니다. -지저스 크라이스트  
5-12-2019,2019,5,12,18:02,일요일,10,7,0,지성근(sung****),3000만큼 이영화를 추천합니다.  
5-11-2019,2019,5,11,20:53,토요일,10,7,0,우왕(jaeh****),어벤저스 엔드게임 훨씬이전이미 클래맨타인이 있엇다는 사실을 잊지말길 바란다...클래맨타인을 넘어설 영화는 아직도 나오지 않았다  
5-11-2019,2019,5,11,03:35,토요일,10,7,0,리디아(pura****),나는 이 영화를 3000만큼 사랑한다.  
5-10-2019,2019,5,10,14:07,금요일,10,7,0,ssdd(thsw****),내가 축구를 잘할 수 있었던 건 이 영화를 봤기 때문이다 -리오넬 메시  
5-5-2019,2019,5,5,00:22,일요일,10,7,0,grob(skwj****),이 영화를 보다가 졸리면 주무셔도 됩니다.꿈속에도 이어집니다.  
5-2-2019,2019,5,2,18:01,목요일,10,7,0,rampage(thsd****),영화전공하는 사람입니다 이 영화를 거의 교과서처럼 공부합니다 감정을 쌓아가는 연기력 앞니가 다시 자라는 꼬마 격렬한 액션씬 하나하나가 작품입니다 어딜가나 1점 테러는 있네요  
4-27-2019,2019,4,27,05:28,토요일,10,7,0,침착맨(moon****),엔드게임을 보고왔는데 이영화가 생각났다.. 왜일까?  
4-23-2019,2019,4,23,01:32,화요일,10,7,0,hoya****,출근은 뒷전이고 새벽까지 봤는데 폭풍 감동이네요.이거 시리즈나 후속 계획있나요? 리메이크라도ㅠㅠ  
4-14-2019,2019,4,14,16:19,일요일,10,7,0,underwrap(alon****),'위대하다'란 수식어는 '클레멘타인!'으로 대체되어도 아무 문제가 없다.  
4-13-2019,2019,4,13,00:21,토요일,10,7,0,송영호(syhc****),신은 모든 곳에 있을 수 없기에 어머니와 이동준을 보내주셨다  
4-9-2019,2019,4,9,12:59,화요일,10,7,0,김대훈(pris****),평점 믿고 오늘 봤는데 저도 10점 드립니다  
4-9-2019,2019,4,9,00:15,화요일,10,7,0,백승휘(sh12****),다시봐도 명작입니다 강추!  
3-30-2019,2019,3,30,17:39,토요일,10,7,0,빌아저씨(embi****),아빠! 일어나!! 아빠! 다시 누워!!  
3-29-2019,2019,3,29,09:16,금요일,10,7,0,김윤재(dbsw****),이 영화를 보고 탄생했습니다.  
3-19-2019,2019,3,19,15:43,화요일,10,7,0,박성호(gyu7****),22살에 이 영화를 봤습니다.이제 그만 세상을 떠나겠습니다.  
2-6-2019,2019,2,6,11:30,수요일,10,7,0,날아라손오공(kaka****),이 영화를 보지 않고 암이 나았습니다.  
2-3-2019,2019,2,3,09:36,일요일,10,7,0,쾌도난마(xops****),별 10개가 없어 5개만 줍니다 앞으로 망작이 나올때마다 소환될 그 이름클라멘타인  
1-29-2019,2019,1,29,21:46,화요일,10,7,0,wjdg****,말이필요없는영화 인생영화  
1-28-2019,2019,1,28,23:43,월요일,10,7,0,이쵸키(ihy4****),말이 필요없는 명작...  
1-27-2019,2019,1,27,19:02,일요일,10,7,0,음메갈리아(jisu****),정말 별점이 잘 어울리는 영화다 씹점이다  
1-25-2019,2019,1,25,21:13,금요일,10,7,0,mkjgrmdj(alsd****),구정연휴동안 매일 볼 생각입니다! 벌써부터 너무 기다려져서 흥분되네요!!  
1-25-2019,2019,1,25,01:46,금요일,10,7,0,뚠뚠(hski****),이거 이번 설날에 무료로 특선영화 해주면 안되나요?ㅠㅠ 가족들한테도 칭찬했거든요  
1-24-2019,2019,1,24,14:17,목요일,10,7,0,콧수염소녀(must****),아직 안봤지만 꼭 보고싶네요  
1-21-2019,2019,1,21,23:16,월요일,10,7,0,진정식(pop1****),영화를보고세상돌아가는걸깨달게됬습니다너무기뻐서안하던욕도튀어나오고 삶의활력소입니다 에너지드링크 비타민 보약 다필요없습니다! 클레멘타인보시면 신세계가 열립니다 태초의 인류의 모든것을 담아버린 희대의 명작입니다! 이감동 희열 아빠 일어나아아~ 아빠~~~!!  
1-18-2019,2019,1,18,13:37,금요일,10,7,0,양치기소년(if_d****),한국영화의 처음과 끝이 여기있다고 들었습니다.  
1-13-2019,2019,1,13,21:53,일요일,10,7,0,spee****,"타임머신을 만든다면, 그 이유는 2004년 5월로 돌아가 클레멘타인을 극장에서 직접 보기 위함이다!!  "
1-13-2019,2019,1,13,01:20,일요일,10,7,0,Sjjahxuasgsuabsffsjq(ku09****),깨어보니 빛이 나를 비추더군요(기립박수)  
1-10-2019,2019,1,10,04:11,목요일,10,7,0,김태원(kto9****),명작임을 의심치 않고 10점을 먼저 주고 저는 지금 보러갑니다. 이순간에 후회가 없을거라고 저는 확신합니다  
1-9-2019,2019,1,9,11:28,수요일,10,7,0,오디오디오디(stev****),이영화를 다봣습니다. 이제세상에 두려울일 없습니다 !  
1-9-2019,2019,1,9,06:52,수요일,10,7,0,팰콘(slam****),재개봉이 시급합니다.  
1-6-2019,2019,1,6,12:53,일요일,10,7,0,ljjj****,하....난오늘  영화란 무엇인가에대해 깊은성찰을하게되었다...이영화를보고선.나의망한인생을되돌아보며 심한우울증을겪고있던나에게 아직 세상엔 나보다힘든사람도있구나 라는생각을하게됐다 ....고맙습니다  
1-6-2019,2019,1,6,06:39,일요일,10,7,0,헤드뱅어(head****),여기까지 오셨다면 감동을 뒤로하고 [명대사/연관영화] 클릭후 연관영화가 어떤것들이 있는지 꼭 보시길 바랍니다.  
1-6-2019,2019,1,6,01:10,일요일,10,7,0,OnlyOne(lady****),역사속에 남을 명작입니다.아직도 안보신분이 있나요..? 재개봉해주셨으면..  
1-5-2019,2019,1,5,02:25,토요일,10,7,0,홍쓰(seri****),완벽한타인인줄 알았는데... 클레멘타인...  뀡대신 봉황  
1-4-2019,2019,1,4,17:16,금요일,10,7,0,천재다(andy****),ㅋㅋㅋㅋ 진짜 클레멘타인은 댓 보는 맛에 옵니다  
1-4-2019,2019,1,4,14:36,금요일,10,7,0,정성헌(sung****),이 영화를 보고나니 트루먼쇼가 시시해 지더군요  
1-3-2019,2019,1,3,21:27,목요일,10,7,0,개츠비(jaeh****),클레멘타인을 보고 내 자신이 부끄러웠다이걸 썸녀와 보려했다니  
1-3-2019,2019,1,3,15:17,목요일,10,7,0,서바다(sea9****),갓갓클레멘타인 갓갓갓  
1-2-2019,2019,1,2,07:56,수요일,10,7,0,수퍼모타(lik1****),집중해서 끝까지 봐야 더욱 가치있는 명작 중의 명작!  
1-1-2019,2019,1,1,13:35,화요일,10,7,0,kker****,"감동 그자체, 오늘도 힐링받고 갑니다.  "
12-31-2018,2018,12,31,15:28,월요일,10,7,0,다이나믹(wnru****),"감동, 그 자체무슨말이 필요한가?  "
12-31-2018,2018,12,31,00:54,월요일,10,7,0,우쓰(wooh****),MASTERPIECE !  
12-30-2018,2018,12,30,12:09,일요일,10,7,0,poet****,이 영화를 보고 어른이 되었습니다.  
12-29-2018,2018,12,29,15:28,토요일,10,7,0,JaeJin(25wa****),왔다갑니다..아직도...  
12-29-2018,2018,12,29,11:57,토요일,10,7,0,김범준(bumj****),안본사람은 있어도 2번본사람은 없다는 그영화  
12-28-2018,2018,12,28,09:26,금요일,10,7,0,천국바라기(math****),감사해요 정말 재밌었어요  
12-28-2018,2018,12,28,00:54,금요일,10,7,0,Denny(dlxo****),두 단어를 넘지 않아도 이 영화를 설명하기엔 충분하다 '명작'  
12-25-2018,2018,12,25,23:31,화요일,10,7,0,SupernovA(ac95****),돈많이벌게해주세요ㅇ  
12-25-2018,2018,12,25,22:21,화요일,9,7,0,jain****,한국영화계의 전설적인 작품 이영화가 개봉할때 보지 않은것에 감사하며 혹시 제가 암걸리면 한번 보겠습니다.암이 낫고 안은뱅이가 걷는다니  
12-24-2018,2018,12,24,05:57,월요일,10,7,0,주지스(eheh****),이 영화에 무슨 말이 필요한가?  
12-23-2018,2018,12,23,16:35,일요일,10,7,0,Vvic(doto****),모두봐야하는 그런 명작  
12-21-2018,2018,12,21,18:08,금요일,10,7,0,황인영(inyo****),"이걸 보지 않은 당신이 부럽습니다.태어나 한 번도 느낄 수 없던 감동,행복함을 느낄 수 있기 때문입니다.  "
12-21-2018,2018,12,21,17:57,금요일,10,7,0,장그래(cdcl****),이 영화를 보고 변비가 완치되었습니다  
12-20-2018,2018,12,20,21:45,목요일,10,7,0,임임(loiv****),이 영화를보지않은자 영화를논하지말라  
12-20-2018,2018,12,20,19:27,목요일,10,7,0,사회평론가(jihy****),최고다 최고다 최고다 최고다  
12-20-2018,2018,12,20,14:18,목요일,10,7,0,별명(so4s****),저만 볼 순 없습니다다 같이 봐야합니다  
12-19-2018,2018,12,19,13:22,수요일,10,7,0,NIOH(bali****),아빠 일어나! 그 한마디에 온 가족이 울었다.  
12-18-2018,2018,12,18,23:09,화요일,10,7,0,tjehdtn(tjel****),나는 살아있음을 느낀다  
12-18-2018,2018,12,18,19:59,화요일,10,7,0,2chu****,나도 10점을 주었다...  
12-17-2018,2018,12,17,08:31,월요일,10,7,0,김경모(kkm1****),말이 필요없는 명작그냥 믿고 보시면 됩니다  
12-14-2018,2018,12,14,17:16,금요일,10,7,0,Everlasting sparkle(aufa****),네이버영화 평점 1위 .... 공감합니다  
12-14-2018,2018,12,14,16:22,금요일,10,7,0,서(eter****),한국의 영화가 재미없는 이유는 이미 클레멘타인에서 더없는 감동을 느꼈기때문이다  
12-14-2018,2018,12,14,04:37,금요일,10,7,0,EleganceCHOI(witc****),우울하고 지치고 힘들때 이 영화의 평을 봅니다.다시 일상으로 돌아갈 힘을 주는 영화평 ㅋㅋ  
12-5-2018,2018,12,5,14:04,수요일,10,7,0,백억대 부자(sheb****),네이버 평점은 거짓말하지 않는다  
11-27-2018,2018,11,27,09:11,화요일,10,7,0,피버스트(majo****),40분쯤까지 펑펑 울며 보다가 이걸 끝까지 다 보면 앞으로 살아갈 의미가 하나 없어진다는 생각이 들어서 중간에 보는걸 그만뒀습니다... 앞으로 삶이 너무 지치고 힘들때 나머지를 봐야겠습니다.  
11-25-2018,2018,11,25,17:56,일요일,10,7,0,JCJJ(hchu****),이게 그 박평식보다 깐깐하다는 리뷰어 라이너가 10점준 작품인가요?  
10-26-2018,2018,10,26,15:30,금요일,10,7,0,호황기(jwhi****),이 영화를 보자마자 왜 이런 영화를 지금 봤을까? 라는 후회심에 창문을 열고 동서남북으로 울부짖었습니다  
10-25-2018,2018,10,25,17:01,목요일,10,7,0,이제대딩(tmdd****),안된다 이 악마들아 ㅋㅋ  
10-21-2018,2018,10,21,17:08,일요일,10,7,0,scha****,"무인도에 단 한가지만 가져갈 수 있다고 한다면, 망설임 없이 클레멘타인 DVD를 들고 갈 것이다.  "
10-14-2018,2018,10,14,02:41,일요일,10,7,0,강현희(ndum****),한마디로 정의할 수 있다. 미쳤다!  
10-13-2018,2018,10,13,19:49,토요일,10,7,0,amzn****,영화라는 장르가 도달할 수 있는 깊이. 차원을 넘어선 감동.  
10-10-2018,2018,10,10,22:21,수요일,10,7,0,야가미라이토(ndmc****),이 영화를 국립암센터에서 추천영화로 권장하시길 바랍니다.  
9-23-2018,2018,9,23,21:06,일요일,10,7,0,데헤엣(rksw****),우리 가족은 추석에 클레멘타인 보려고 모입니다.  
9-23-2018,2018,9,23,18:48,일요일,10,7,0,무장둘리(shar****),우리는 어벤져스 타이타닉 아바타 반지의제왕을 부러워할 필요가 없다. 이 영화 1개면 끝난다.  
9-22-2018,2018,9,22,20:40,토요일,10,7,0,kwon****,서양에 아바타가있다면 국내에는 클레멘타인이있다. 인기를 못누렸던건 아직 국내에서는 아바타를 몰랐기때문이다. 지금 다시 나온다면 5천만 갈수있다.  
9-18-2018,2018,9,18,21:45,화요일,10,7,0,슈(u090****),말로표현할수없는 향현  
9-16-2018,2018,9,16,00:15,일요일,10,7,0,유캔도(lott****),세계적 음악에 BTS 가있다면 세계적영화엔 클레멘타인이 있다  
9-15-2018,2018,9,15,02:49,토요일,10,7,0,라이츠(gree****),제가 평소에 편식이 심했는데 이영화를 보고난뒤돌도 씹어 먹게 되었어요  
9-14-2018,2018,9,14,19:43,금요일,10,7,0,Justice1234(grif****),왜 이런 대작을 케이블에서 방송을 안해주는가? 아카데미상 후보에서 아깝게 떨어진 대작! 이걸 왜 지금 봤을까.. ㅠㅠ  
9-13-2018,2018,9,13,20:32,목요일,10,7,0,rhkd****,수능끝나고 학교에서 보다가 울었습니다.특히 마지막 대결장면에서 아빠!하는 부분에서 모두 울음바다가 되버렸습니다.고맙습니다 클레멘타인!  
9-12-2018,2018,9,12,23:42,수요일,10,7,0,정용준(wjdd****),"오늘 오전에 당신의 손자가 태어났습니다. 이름이 뭐냐구요? 물괴입니다. 당신이 이제 욕먹을건 리얼,인랑,물괴가 가져갈 것입니다. 그동안 욕먹으시느라 고생많으셨습니다. 그러므로 10점 남기고 갑니다.  "
9-6-2018,2018,9,6,15:50,목요일,10,7,0,mins****,셰익스피어도 무덤에서 나와 박수를 칠 희대의 띵작!  
9-2-2018,2018,9,2,19:16,일요일,10,7,0,고요(f18h****),역대최고의 영화를 봤어요.  
9-2-2018,2018,9,2,06:29,일요일,10,7,0,나비(ttls****),부모님생각에 눈물이나네요 아깝지만 부모님 생신 선물 구입으로 개봉안한 DVD 팝니다.지금도팔까 안팔까 고민중입니다.  
9-1-2018,2018,9,1,15:01,토요일,10,7,0,CaptainIN(dyfl****),근래 5년간 본 영화중에 최고  
8-31-2018,2018,8,31,21:46,금요일,10,7,0,lchy****,이 영화를 보고 암이 나았습니다  
8-31-2018,2018,8,31,18:23,금요일,10,7,0,유한길(dbgk****),너무 사랑스러운영화 볼만 합니다.  
8-23-2018,2018,8,23,15:56,목요일,10,7,0,글로버 테세이라(hnn0****),신께서는 우리에게 불후의 명작을 볼 수 있는 기회를 주셨고 그영화는 바로 클레멘타인이다. 클레멘타인은 우리가 이 세상을 살아갈 이유를 가지게 해주는 명화이다.  
8-19-2018,2018,8,19,16:19,일요일,10,7,0,스압(tkdr****),누가감히 이 영화를 평가하겠는가.... 별10개로는 이 영화를 평가하기엔 너무 표면적이다.  
8-15-2018,2018,8,15,14:51,수요일,10,7,0,리히텐슈타인(jinh****),어느새 눈물을 흘리고 있을 것이다.  
8-15-2018,2018,8,15,11:46,수요일,10,7,0,hugggss(moka****),2편은 안나오나요 ㅠㅠ  
8-15-2018,2018,8,15,11:30,수요일,10,7,0,KKEO(gaej****),대한민국 영화계의 걸작.  
8-11-2018,2018,8,11,08:43,토요일,10,7,0,모카(dayl****),아프하! 일허나하!!  
8-11-2018,2018,8,11,01:21,토요일,10,7,0,스투릿지(toky****),영화가아니다 이것은 현실이다 내가 더 나은 삶을 살게 해주는 영화 그것이 정말 명작인것이다 다시는 나올 수 없는 영화 아빠 일어나!!를 듣고 가슴에서 그리고 눈에서 뜨거운 눈물을 흘리는 순간 알게될것이다.. 살아있음에 감사함을..  
8-6-2018,2018,8,6,00:26,월요일,10,7,0,땡돌이(gusd****),이영화는 이미 월클이다.  
8-5-2018,2018,8,5,20:15,일요일,10,7,0,니나니나니고릴리다(jikk****),다시봐도명작입니다 진짜 악플무시하시고 꼭보세요 한국영화의 재평가  
8-5-2018,2018,8,5,09:55,일요일,10,7,0,THEKINGLEBRONJAMES(aird****),얼마 전 미션 임파서블 6를 보고 왔는데 정말 인생영화란 생각이 들 정도로 재밌더군요근데 그 미션 임파서블보다도 평점이 높다니.... 고3인데 보고 싶어서 미치겠습니다...!!얼른 수능 마치고 바로 클레멘타인부터 볼겁니다 희대의 띵작 클레멘타인!!  
8-5-2018,2018,8,5,02:56,일요일,10,7,0,천국을떠난천사(mira****),한국영화 중 최고의 명작  
8-2-2018,2018,8,2,10:16,목요일,10,7,0,얼큰이(tkdd****),크으 이런 명작이 9.3이라니  
8-1-2018,2018,8,1,20:49,수요일,10,7,0,인간(moos****),삼십번 봤다 최고의명작  
8-1-2018,2018,8,1,18:44,수요일,10,7,0,ilon****,최고의 영화. 추천합니다.  
7-31-2018,2018,7,31,16:05,화요일,10,7,0,길쭉(her0****),한국영화는 클레멘타인 전과 후로 나뉘어진다.  
7-30-2018,2018,7,30,20:49,월요일,10,7,0,업그레이드골리앗(kwj0****),씨갈 정말 간사합니다.  
7-27-2018,2018,7,27,00:49,금요일,10,7,0,위대한여신아르테미스(4249****),말이필요없는 환상적인 영화  
7-26-2018,2018,7,26,17:30,목요일,10,7,0,데그레챠프(hong****),10점 드립니다.  로또 1등당첨 되게해주세요  
7-26-2018,2018,7,26,12:18,목요일,10,7,0,생양파쿠키(noon****),와 이영화 꼭보세요 암이 나을 겁니다  
7-25-2018,2018,7,25,20:47,수요일,10,7,0,다나라(celi****),이거 보는 내내 울컥하고 소름이 돋았다....이런 개띵작 내 친구들한테 추천받았는데 고마워서 집에 매일 찾아가서 절하고싶네  
7-25-2018,2018,7,25,19:58,수요일,10,7,0,요룰레이호(dbeo****),진정한 감동이 뭔지를 알려주는 그런 영화  
7-24-2018,2018,7,24,10:41,화요일,10,7,0,아이리(airy****),이 시대 최고의 명작!! 감동실화  
7-23-2018,2018,7,23,13:18,월요일,10,7,0,성준(nsu1****),눈물이 나온다....  
7-23-2018,2018,7,23,10:18,월요일,10,7,0,jehwang(wkwj****),이영화에 10점을 주지않는다는건 인간미가없다는것  
7-22-2018,2018,7,22,14:35,일요일,10,7,0,에픽이(ki00****),졸라 재밌음 이건 내 생에 역대급 명작이다.  
7-22-2018,2018,7,22,12:28,일요일,10,7,0,강민호(spin****),... 이 영화를 본 후에 당신의 삶은 달라질 것이다.  
7-20-2018,2018,7,20,12:07,금요일,10,7,0,Alice(cher****),온가족이 기립박수를 쳤습니다.... 엔딩크레딧이 끝날때까지 앉을수가 없었네요  
7-20-2018,2018,7,20,09:21,금요일,10,7,0,구구(abra****),여러가지 의미로 명작이다. 무조건 봐야함.  
7-20-2018,2018,7,20,07:43,금요일,10,7,0,아기곰두마리(cind****),너무나 유명한데 이제야 봤네요~~  
7-19-2018,2018,7,19,20:13,목요일,10,7,0,홍동민(1212****),강 다불류는 발기부전으로 힘들어했는데 이 영화에서 '아빠 일어나!' 이 대사덕분에 강 다불류 그곳이 일어났습니다. 이영화를 위해 에어컨도 서슴없이 사고 내일 출근해서여러 동료들에서 커피도 한잔씩 돌리는 멋진 다불류가 되었습니다  
7-19-2018,2018,7,19,15:40,목요일,10,7,0,13co****,똥꼬쇼가 나오는 장면에서 삶의 목적을 알았다  
7-10-2018,2018,7,10,13:54,화요일,10,7,0,담팟마쵸(danb****),난 겨우 평가를  봤을뿐인데  뜨거운 눈물과 콧물에 밥을 말아 먹었다.  
7-8-2018,2018,7,8,01:29,일요일,10,7,0,키키(kiki****),최고 그냥 최고최고 그냥 최고최고 그냥 최고최고 그냥 최고  
7-6-2018,2018,7,6,22:08,금요일,10,7,0,syup****,이건 진짜 띵작입니다..;;  
6-30-2018,2018,6,30,05:19,토요일,10,7,0,알앤비(swor****),동참합니다 1위가 되는 그날까지  
6-20-2018,2018,6,20,20:41,수요일,10,7,0,아이피아(sb16****),보고 울부짖었다...  
6-14-2018,2018,6,14,15:22,목요일,10,7,0,총지배인(koeu****),"인생 영화.,.,..,  "
6-14-2018,2018,6,14,06:31,목요일,10,7,0,woojin(wooj****),최고의...영화...  
6-13-2018,2018,6,13,03:38,수요일,10,7,0,조민규(alsr****),"이것은 하나의 예술을 뛰어넘은 ""문화""천년후에는 문화재로 지정될 것.  "
6-11-2018,2018,6,11,20:28,월요일,10,7,0,아라미스69(kdmi****),우울한땐 이곳으로 옵니다. Y2K삑사리보다 더욱 큰 감동주시는 네티즌님들  
6-3-2018,2018,6,3,20:42,일요일,10,7,0,황족리버풀(weej****),이 영화를 보니 야구를 역전했습니다.  
6-3-2018,2018,6,3,14:11,일요일,10,7,0,워너비(chlr****),1종보통운전면허소지자입니다이영화는 전설입니다 가장 감명깊게본영화입니다일부 테러범의 1점테러에 낚이지마시길바랍니다  
6-3-2018,2018,6,3,00:48,일요일,10,7,0,맨시티 실바 21(lees****),내가 이 영화를 영화관에서 못 본 것이 아직도 한으로 남아있다..  
6-2-2018,2018,6,2,19:35,토요일,10,7,0,gusg****,최고 명작.. 눈물이 난다  
5-29-2018,2018,5,29,07:19,화요일,10,7,0,캡틴배트맨(kjsl****),인생영화입니다. 추천합니다.  
5-28-2018,2018,5,28,18:49,월요일,10,7,0,날개(para****),꽃은 함께 볼 때 아름다운 것이다.꺾어 혼자 볼 생각 말고 모두에게 나누어주자.  
5-28-2018,2018,5,28,16:24,월요일,10,7,0,shimpac(shim****),단 한순간도 방심하지마라!!  
5-27-2018,2018,5,27,23:48,일요일,10,7,0,김현우(ace0****),정말재밌다아주재밌다  
5-26-2018,2018,5,26,22:13,토요일,10,7,0,바르게살자(zike****),토요명화도 울고갈 전설의명화  
5-23-2018,2018,5,23,00:29,수요일,10,7,0,아라리(si12****),남북정상회담때 이 영화 한편만 봤다면 통일이 됐을건데...  
5-22-2018,2018,5,22,21:17,화요일,10,7,0,하이데이(dbqu****),지금 만나러  갑니다 원작을 보고 울었는데 이영화를 보고 그때 흘린 눈물이 아까웠습니다....  
5-22-2018,2018,5,22,10:20,화요일,10,7,0,AXM34640(ksk3****),"거금을 들여 주문제작한 블루레이 리마스터링 버전, 비록 경차 한 대 값을 지불 했지만 난 후회하지 않습니다. 이런 고귀한 작품을 소장 할 수 있는것 만으로도 내겐 큰 축복이며 영광이니까요 오늘 모처럼 공휴일, 폭풍감동의 도가니에 빠져 보아야겠네요  "
5-20-2018,2018,5,20,00:05,일요일,10,7,0,안기사(gaem****),십계 벤허 바람과함께사라지다 마지막황제 타이타닉 다크나이트 그리고 클레멘타인  
5-17-2018,2018,5,17,18:00,목요일,10,7,0,우승목(dris****),이게영화지 이게 영화야  
5-15-2018,2018,5,15,16:26,화요일,10,7,0,또시리(typr****),평점믿고 봤다가 벽쳤습니다... 왜이제봤을까..OO...  
5-15-2018,2018,5,15,11:26,화요일,10,7,0,피스톨(kms8****),무서운 집과 클레멘타인은 세계영화의 양대산맥이다. 어벤져스 따위의 영화가 오를 수 없는 미지의 영역이다.  
5-9-2018,2018,5,9,00:14,수요일,10,7,0,mumu****,영화인이리면 꼭 봐야할 작품입니다. 이 영화는 100년에 한 번 나올까말까한 수작입니다. ㅎㅎㅎ  
5-6-2018,2018,5,6,16:23,일요일,10,7,0,행복했을까(skal****),이 감동은  우주최강  어벤져스급임  
5-2-2018,2018,5,2,12:56,수요일,10,7,0,안녕(rjm1****),인생영화시간이 아깝지 않네요  
4-24-2018,2018,4,24,00:31,화요일,10,7,0,스큐빠(teby****),매일보는 나는 어느날부터인가 처음부터 끝까지 모든대사를 외워버렸다..그런데도 매일 볼때마다 눈물이 흐른다..지금은 20OOO... 5년여간의 눈물로 난 한때 저체중까지 갔었던 적이 있었다....  
4-23-2018,2018,4,23,11:58,월요일,10,7,0,tjrh****,재개봉이 절실한 영화.  
4-21-2018,2018,4,21,18:08,토요일,10,7,0,마지막에웃기위해(s2_v****),날 되살아나게 한다.. 몇번이라도...  
4-20-2018,2018,4,20,07:27,금요일,10,7,0,기모띠(2w44****),이 영화를보고 로또당첨되는 꿈을 꿨다... 이 영화는 꿈을 이루게해준다!  
4-17-2018,2018,4,17,15:53,화요일,10,7,0,jesus96(d472****),클레멘타인을 아직 보지 않은 사람들이 잇다면 그들은 대한민국 국민으로서 자격이 충분하다  
4-13-2018,2018,4,13,18:32,금요일,10,7,0,이름(rayc****),"이 영화를 전 세계인들이 보았다면 세상에서 전쟁과 폭력이 사라져 평화로워지고, 모든 질병이 완치되어 사람들이 행복해질 것이며, 범죄자들은 스스로의 죄를 절로 뉘우치게 될 것이다.  "
4-8-2018,2018,4,8,12:49,일요일,10,7,0,Noire(rock****),이 영화를 보며 배그를 하는데 자기장이 계속 잡히고 보급이 계속 제 머리 위로 떨어지는 기적이 일어났습니다.  
4-7-2018,2018,4,7,19:07,토요일,10,7,0,매킨토시(dltk****),이 영화가 한국에서 만들어졌다는데 무한한 자부심을 느낀다. 세계 영화 역사는 클레멘타인 이전과 이후로 나뉜다.  
4-1-2018,2018,4,1,06:27,일요일,10,7,0,huyuxcr(sexy****),"내 생애 최고의 영화였던 박기풍 감독이 제작한 ""불꽃슛 통키""를 능가하는 한국 영화계의 수작  "
3-31-2018,2018,3,31,17:22,토요일,10,7,0,hade****,"한국영화의 '격'을 한 단계, 아니 수십단계쯤은 올려놓은 희대의 명작. 시대를 풍미한 역대 명작들과도 어깨를 나란히 할 정도의 작품성... 평생 돌려봐도 이 작품의 깊이를 미련한 제가 다 파악할 수 있을지 모르겠네요. 100점 드립니다  "
3-31-2018,2018,3,31,02:08,토요일,10,7,0,Earthescape(stra****),1000년후 인류 혹은 외계생명체에게도 남겨줄 인류의 보물  
3-25-2018,2018,3,25,23:38,일요일,10,7,0,호롤(lsj1****),평가를 내리는것 자체가 이 영화에 대한 모독이다  
3-23-2018,2018,3,23,14:27,금요일,10,7,0,막강짱신(akrr****),"영화를 보고나서 밖에 비가 내리나 했는데, 알고보니 내 눈물이었다.  "
3-20-2018,2018,3,20,13:40,화요일,10,7,0,가람(kara****),포스터는 b급영화. 하지만 평점은 거짓말을 하지 않는다.  
3-17-2018,2018,3,17,22:41,토요일,10,7,0,jsy7****,세상에 태어나서 꼭 한번 봐야할 명작  
3-17-2018,2018,3,17,22:36,토요일,10,7,0,pos9****,태어나서 눈물을 흘리며 본 영화는 클레멘타인이 유일하다. 대한민국 최고의 명작  
3-17-2018,2018,3,17,21:32,토요일,10,7,0,둥글동글차(jihu****),"보지는 않았어도, 10점을 박았습니다.  "
3-11-2018,2018,3,11,19:29,일요일,10,7,0,P느님(dead****),32살 먹고 이제서야 영화란게 무엇인지 알았습니다.그동안 영화보는게 취미라고 말하고 다닌게 많이 부끄럽네요제자신을 돌아보게 만든 영화입니다.  
3-9-2018,2018,3,9,01:55,금요일,10,7,0,막그리거(wowg****),내인생 최고의 영화다.  
3-4-2018,2018,3,4,21:06,일요일,10,7,0,sweetie(dydq****),아직 평점테러하는 이기적인 쉐이들이 있군. 이만한 명작이 우리 영화사에 다시 나올 수 있을까?  액션과 재미. 감동 특히 스티븐 시걸은 압권이다!! ㄷㄷㄷ  
3-2-2018,2018,3,2,13:28,금요일,10,7,0,다쉬라트 만지히(glob****),영화를 보면서 화가 났다. 영화가 끝나가는 게 너무 아쉬워서.  
3-2-2018,2018,3,2,11:16,금요일,10,7,0,조순(sdfo****),세상에 태어난이유중 하나  이영화를 보기위해..  
3-1-2018,2018,3,1,23:46,목요일,10,7,0,유진(7710****),최고의 명작이라고 생각합니다.  
3-1-2018,2018,3,1,11:40,목요일,10,7,0,마르지엘라(1120****),감동실화ㅠㅠ 긴말이필요없습니다  
2-26-2018,2018,2,26,11:03,월요일,9,7,0,GieT2(gusw****),정말 화나네요. 왜 연관검색어에 성냥팔이소녀 리얼이 있는거지? 혹시나해서 말하지만 이것들과는 완전히 클래스가 다른 영화입니다. 비교 자체가 우습군요. 꼭 한번 보세요. 가족들과 친구들에게 보여주면 너무 감동적이라고 울먹이며 내 등짝을 후려치는 영화.  
2-26-2018,2018,2,26,03:53,월요일,10,7,0,나봉이(nabo****),아직 안본 학생 친구들은 다운받아서 야자시간에 꼭 보세요~ 이거보다 걸려도 선생님은 혼 안내실거에요~ 학교수업으로는 가르쳐 줄 수 없는 많은 교훈들이 담겨 있는 영화니까요~  
2-11-2018,2018,2,11,01:38,일요일,10,7,0,bsy8****,친구의 강력한 추천으로 이 영화를 봤습니다. 지금 만나러 갑니다.  
2-5-2018,2018,2,5,13:34,월요일,10,7,0,hban****,누구를 위한 영화인가?영화 광으로 산지 40년 이런 영화는 진짜 소장 하면서 자녀들한테 꼭 물려주면서 명절때마다 감상 해야한다 내 인생에 최고의 영화  클레멘타인  
2-5-2018,2018,2,5,00:56,월요일,10,7,0,별바라기(hans****),"""죽기전에 꼭 보아야 하는 영화"" 3편 중에  한 작품 이라죠?  "
1-27-2018,2018,1,27,00:30,토요일,10,7,0,김석권(namu****),"올레티비에 없어서 문의전화 했더니 이런답변을 하더군요..""고객님 혹시 날강도세요? 클레멘타인같은 대작을 고작 1200원 결제로 보려하시다니 도둑놈이 따로없네요"" 소장용120만원까지 판매하시는분 알아는 봐주시겠다며..  "
1-13-2018,2018,1,13,17:41,토요일,10,7,0,호놀롤롤(ljho****),"""인셉션이 가능하다면 이 대작의 감동을 전세계 영화관람가들의 머리속에 심는 것이 나의 바램이다."" - 영화감독 '크리스토퍼 놀란'  "
1-5-2018,2018,1,5,22:33,금요일,10,7,0,YGLIFE(suno****),보면서 눈물이 멈추지 않는다  
1-5-2018,2018,1,5,12:35,금요일,10,7,0,만화가좋은주탱(sout****),리얼을 보고 이걸 봤는데 정말 엄청난 명작이였습니다. 리얼은 클레멘타인의 위대함을 돋보이게해주는 존재였군요  
1-1-2018,2018,1,1,23:00,월요일,10,7,0,SangLee(kes5****),이 영화를 볼 수 있다는 것에 감사하다  
12-21-2017,2017,12,21,00:19,목요일,10,7,0,바밤바(11mi****),만일 세계 3차 대전이 일어난다면 그건 필시 클라멘타인을 뺏어오려는 국가들의 전쟁일 것이다  
12-20-2017,2017,12,20,09:27,수요일,10,7,0,pzpz****,"네이버 평점이 높아서 봤는데, 이런 명작을 왜 이제 봤을까요... 네이버 유저 여러분, 이 영화를 볼 수 있게 해줘서 감사합니다.  "
12-20-2017,2017,12,20,03:27,수요일,10,7,0,케이(wook****),시간이 지날수록 평점이 높아지는 영화. 마지막장면까지 안놓치고 집중해서 봐야 평점이 이해가는 영화. 아직 안보신분들은 꼭 보시길 바래요.  
12-17-2017,2017,12,17,10:18,일요일,10,7,0,shjw****,오늘 저는 이영화를보고 계획에도 없던 출산 계획을 잡았습니다  
12-16-2017,2017,12,16,23:01,토요일,10,7,0,avem****,자식들 시집장가  보네느라 제나이 환갑 에   이 영화를 보게되었네요 ㆍ아~~~~허무하네요 ~~너무 감동 입니다ㅠㅠ다시 돌아가고싶네요  ~~~~나의 청춘 으로 ㆍㅠㅠㅠ  나  의 청춘 으로  
12-16-2017,2017,12,16,17:44,토요일,10,7,0,dldm****,최고입니다! 진짜 흥미진진  
12-16-2017,2017,12,16,15:11,토요일,10,7,0,ckal****,"평가는 영화에 하는 것이지, 예술 그 자체에 하는 것이 아니다. 이 영화는 예술이다.  "
12-16-2017,2017,12,16,14:43,토요일,10,7,0,내다(powe****),희노애락이 모두 있는 명작  
12-16-2017,2017,12,16,14:09,토요일,10,7,0,go1d****,재미있어요 추천합니다  
12-16-2017,2017,12,16,10:56,토요일,10,7,0,대박이다(bsw1****),ㄱㄱ최고명작필히보셈 감동액션  
12-15-2017,2017,12,15,14:54,금요일,10,7,0,오줌방구똥(jins****),여운이 많이남네요. 제 인생작이 될듯해요.  
12-15-2017,2017,12,15,13:57,금요일,10,7,0,나를믿지마라(sung****),감동 액션 영화 계속 생각난다.  
12-14-2017,2017,12,14,23:58,목요일,10,7,0,용송(lisn****),휴...여운 어떡할꺼야  
11-6-2017,2017,11,6,23:47,월요일,10,7,0,앨리스(dlgp****),방송사들은 대국민 사과문이라도 발표해야 합니다 이런 대작을 방영해주지 않다니...아마도 숨어있는 음모가 있는것 같습니다 그.알에서 누가 클레멘타인의 티비방영을 막고 있는지 취재해주시길...다가올 크리스마스에는 티비편성표에 꼭 대작 클레멘타인이 있길♡  
10-25-2017,2017,10,25,17:59,수요일,10,7,0,투아데(song****),140자가 모자른 영화  
9-25-2017,2017,9,25,18:10,월요일,10,7,0,양종렬(luk1****),내 영화 인생은 클레멘타인을 보기 전과 후로 나뉜다  
9-23-2017,2017,9,23,18:34,토요일,10,7,0,게임중독자(hhhu****),한국 영화계에 길이 남을 명작이다.이렇게 재미있는 영화는 처음본다  
9-22-2017,2017,9,22,01:00,금요일,10,7,0,구피(rlag****),"예...술...그래, 이건 예술이다.  "
9-21-2017,2017,9,21,10:27,목요일,10,7,0,jimm****,11점이 없어서 10점 드립니다  
9-21-2017,2017,9,21,00:18,목요일,10,7,0,홍성진(samp****),캬 명작 중에 명작입니다  
9-14-2017,2017,9,14,18:15,목요일,10,7,0,스코티쉬폴드(dkeo****),소장가치가 있는 최고의 영화  
8-30-2017,2017,8,30,22:05,수요일,10,7,0,omag****,"이 영화를 보고 나이 70에 감동에 눈물을 일주일간 흘렸다꿈속에서도 ""아빠 일어나!"" 소리가 한달간 들리고 결국  태권도 본능을 느끼고 산속으로 들어가려 짐을 싸고 있다 대단한 걸작이다  "
8-30-2017,2017,8,30,10:57,수요일,10,7,0,미래를 찾아서(jhj9****),마우스가 자동적으로 10점을 향했다.  
8-30-2017,2017,8,30,09:03,수요일,10,7,0,김동완(sing****),군입대당일. 부대시찰을 나오신 사단장님께 클레멘타인 dvd를 선물로드렸더니 그즉시 집으로 돌려보내주셨습니다. 제 청춘을 구해준 영화 클레멘타인...정말 감사드립니다  
8-29-2017,2017,8,29,09:51,화요일,10,7,0,HERA STUDIO(anag****),중국 심천으로 출장온지 어느덧 8개월 업무를 마치고 지친몸을 이끌고 방에들어와 시원한 맥주와함께  클멘을 보고있었다 이동준님의 시원한 타격감으로 무르익을때쯤 동료가  건넨말 不??? 그리고  에어컨이 꺼져있었다. 40도의날씨도 잊게 만드는  쿨레멘타인  
8-20-2017,2017,8,20,20:56,일요일,10,7,0,kara****,"평점을 이제야 주네요. 우리나라 암치료와 불치병 치료에 선구적 역할을 하는 영화네요, 노벨평화상 과 노벨생리의학상 후보에 추천합니다.  "
8-3-2017,2017,8,3,22:32,목요일,10,7,0,활주로(sn2s****),명량의 관객수를 능가하는 액션영화입니다  
7-29-2017,2017,7,29,02:20,토요일,10,7,0,크리아크(rlae****),이 영화를 보고 암세포가 암에 걸려 암이 나았습니다.  
7-29-2017,2017,7,29,01:45,토요일,10,7,0,김머중(hina****),쇼생크탈출에비견되는걸작  
7-26-2017,2017,7,26,10:31,수요일,10,7,0,장견제(zzzm****),오! 평점이랑 후기보고 봤는데 지금 기분 줫같네요ㅎㅎ 혹시라도 안보신분들 꼭보세요  
7-24-2017,2017,7,24,20:14,월요일,10,7,0,대치동 물고기(hyun****),학생들과 함께 보았습니다. 그 후 학부모들의 전화가 빗발치더군요. 이렇게 좋은 영화를 왜 이제 보여주느냐고요. 다음날 저의 월급이 100만원이 올라있었습니다. 감사합니다!!!  
7-24-2017,2017,7,24,13:06,월요일,10,7,0,사스미 윤아(drop****),이 영화가 잊혀지지않길 바라며.. 10점을 드립니다.  
7-13-2017,2017,7,13,16:40,목요일,10,7,0,doto****,평점의 제한을 없애야할 그 영화...10점 밖에 줄수없는 내 손이 밉다..  
7-6-2017,2017,7,6,19:30,목요일,10,7,0,카린벤제마(code****),"아직 안본 눈 팝니다 7광구, 리얼도 안봤습니다.  "
7-6-2017,2017,7,6,02:06,목요일,10,7,0,It s best(anwb****),이 영화 덕분에 [리얼]을 끝까지 볼 수 있었습니다.  
7-3-2017,2017,7,3,22:27,월요일,10,7,0,가츠(hani****),전설....아니 레전드  
6-28-2017,2017,6,28,17:40,수요일,10,7,0,alsk****,평점 개웃겨 OOㅋ ㅋ ㅋ  
5-6-2017,2017,5,6,00:17,토요일,10,7,0,gent****,시걸이 목을 꺾을대마다 감동이 몰려온다  
5-5-2017,2017,5,5,15:33,금요일,10,7,0,김지훈(emin****),"클레멘타인 리미티드 에디션 DVD 소장자입니다. 참고로, 리미티드 에디션에선 내용이 조금 길어져 원작보다 별로라는 평도 있지만, 저에겐 스티븐 시걸의 명연기, ""아빠! 일어나!""를 뛰어넘는 명대사 등.. 리미티드 에디션 관심 있으면 쪽지 주세요.  "
3-16-2017,2017,3,16,03:39,목요일,10,7,0,kth0821(sejo****),김보성의 영웅과 클레멘타인..도저히 고를 수가 없ㄷ?  
3-10-2017,2017,3,10,08:22,금요일,10,7,0,kswa****,그리고 아무도 없었다.  
2-19-2017,2017,2,19,14:14,일요일,10,7,0,김형조(gudw****),신은 인간을 만들었고 인간은 클레멘타인을 만들었다.  
2-14-2017,2017,2,14,00:14,화요일,10,7,0,빠밤(pscl****),혼자서 11명을 상대하던 내 어린 시절이 떠오르는 영화. 진정한 사나이들의 영화이자 의리의 영화인 동시에 내 인생의 동반자같은 영화이다.  
2-4-2017,2017,2,4,04:39,토요일,10,7,0,apdp****,클레멘타인을 잊는 자는 결국 과거 속에 살게 된다 -괴테  
10-26-2016,2016,10,26,14:39,수요일,9,7,0,banana(hidf****),"아직 보고싶지 않다. 내가 정말 힘들고, 지칠때 나에게 주는 마지막 선물이라 여긴다. 한개의 별은 이 영화를 만든 감독에게 바친다.  "
10-13-2016,2016,10,13,18:28,목요일,10,7,0,임영걸(theg****),출사표를 읽고 눈물을 흘리지 않는 자 충신이 아니고 진정표를 읽고 눈물을 흘리지 않는 자 효자가 아니다. 클레멘타인을 보고 눈물을 흘리지 않는 자 아비가 아니다.  
8-10-2016,2016,8,10,19:19,수요일,10,7,0,이광민(qazw****),말이 필요한가....!!  
4-22-2016,2016,4,22,17:55,금요일,10,7,0,rbeh****,이동준씨의 360도 외발턴에 지렸습니다 ..  
3-20-2016,2016,3,20,01:46,일요일,10,7,0,촬스(cool****),아직 안보고 아껴두고 있습니다. 좋은건 마지막까지 아껴둬야 하니까요.  
2-21-2016,2016,2,21,11:04,일요일,10,7,0,지선유혹(jaeh****),아빠 일어나!! 부분에서 잠에 찌들어 살던 아버지께서 벌떡 일어나는 기적이 일어났습니다~ 요즘은 아버지께서 서서 주무십니다♥  
10-12-2015,2015,10,12,23:38,월요일,10,7,0,오오오오옵(kira****),아직 안본 시신경삽니다  
7-23-2015,2015,7,23,13:18,목요일,10,7,0,박성진(dpff****),이 영화를 보고 예수님을 접하였습니다.  
7-12-2013,2013,7,12,18:34,금요일,10,7,0,트기(o15b****),10점이 아깝지 않은...............ㄷㄷㄷㄷㄷㄷㄷㄷㄷㄷㄷㄷ  
5-14-2019,2019,5,14,23:36,화요일,10,8,1,sunzeroLee(asdf****),우울할떄마다 여기 평점 보러 온다.여기 평점들에게 별 10개를 드립니다.  
5-13-2019,2019,5,13,13:37,월요일,10,8,1,eeee1096(asf1****),이 영화를 보지않은 사람과는 말도 섞지 않겠다.  
3-30-2019,2019,3,30,05:43,토요일,10,8,1,iopr****,클레멘타인을 본후 35년 동안 헛된삶을 살았구나하며 여지것 살아온 삶을 눈물로 되돌이켜 봅니다.남은 여생을 속세와 인연을끈고 암자에 들어가 석고대죄 하며 죄를 씻겠습니다.  
1-4-2019,2019,1,4,14:11,금요일,10,8,1,달콤한정수리(s206****),"분명 '완벽한 타인' 인줄 알고 내려봤는데, '클레멘 타인' 이었습니다. 처음에는 조금 화가 났지만 영화를 보고나니 차라리 잘 됐다는 생각이 먼저 드네요. ㅠㅠ 아빠 일어나!!  "
12-26-2018,2018,12,26,06:54,수요일,10,8,1,머신(foru****),1979년에 '에일리언'이 있었고 2001년에 '반지의 제왕'이 있었다면 2004년에는 '클레멘타인'이 있었다.  
11-30-2018,2018,11,30,15:08,금요일,10,8,1,Misonyun Jay(miso****),"하나님은 이영화를 보지 않은 사람을 위해서, 살아 돌아 올 수 있는 왕복 승차권은 발행하지 않으셔!  "
10-20-2018,2018,10,20,08:51,토요일,10,8,1,와후(skyg****),이영화를 재개봉 해달라고 청와대 국민청원에  올렸습니다... 대한민국  국민뿐 아니라 전세계가 죽기전에 꼭봐야하는 명작중에 명작입니다.  
10-17-2018,2018,10,17,18:26,수요일,10,8,1,김선생(homi****),타이타닉 보다 네이버 평점이 더 높은 영화. 우리내의 인생 영화임...  
10-17-2018,2018,10,17,00:12,수요일,10,8,1,iima(sky_****),생각날때마다 다시보는데 볼때마다 감회가 새롭네요.  
10-15-2018,2018,10,15,11:06,월요일,10,8,1,woos****,학교 다닐때 혼자 몰래 먹던 엄마의 소고기김밥친구들에게 들키지않고 혼자먹던....와이프가 잠이들면 조용히 혼자 일어나 거실 서랍을 열고  클레멘타인 비디오테잎꺼내 가끔  돌려봅니다좋은건 혼자봐야죠.  
10-15-2018,2018,10,15,07:40,월요일,10,8,1,aodg****,안봐도 적적한 영화라 이번주도 안보았습니다  
9-8-2018,2018,9,8,01:24,토요일,10,8,1,에헤라디(oyi9****),"감사합니다. 저에게 이런영화를 보게해주어서이작품은 저에게있어 예술이며, 무형문화재입니다. 제 아들이 15살이되면 꼭 다시한번 이감동을같이 느끼도록 하겠습니다.  "
8-5-2018,2018,8,5,02:14,일요일,10,8,1,임인수(dlad****),본적은 없지만 감동적인거같습니다  
8-5-2018,2018,8,5,00:39,일요일,10,8,1,이글루(stil****),리얼 영화평 보며 낄낄거리다  클레멘타인을 알게되어 방문했네요. 댓글평들이 이리 웃길 수가 ...ㅋㅋ 안봤지만 너무나 재치있는 댓글평에 10점 줍니다ㅎㅎㅎ  
7-29-2018,2018,7,29,11:05,일요일,10,8,1,lwjw****,감동이 너무 넘쳐나는  영화라 개봉시부터 매년 한번씩 꼭 새로운 마음으로 관람을 하고 있네요. 이 영화를 보고 꼭 대통령이 되고져 합니다. 이 황당한 현실을 바로 잡는 한민족의 영웅이랄까. 다짐되네요  
7-12-2018,2018,7,12,04:14,목요일,10,8,1,jsh3****,세상은 클레멘타인 후속작을 기다리고있다...아바타2와 동시개봉해도 승리할 수 있는 단하나의 한국영화...  
7-8-2018,2018,7,8,17:19,일요일,10,8,1,겨울바다(hide****),제 인생은 이 작품을 보기 전과 보기 후로 나뉩니다 정말 명작이에여 이제 본걸 후회하네요  
4-4-2018,2018,4,4,21:47,수요일,10,8,1,바아룽(neoj****),21세기 최고의 영화새로운 지평을 열었다  
4-2-2018,2018,4,2,16:45,월요일,10,8,1,스님(junk****),아빠아아아앜!!!!  
2-19-2018,2018,2,19,13:03,월요일,10,8,1,tgbj****,10점이 너무 작은수라는걸 처음 느끼게준 영화  
2-6-2018,2018,2,6,14:56,화요일,10,8,1,킴세(kims****),"이영화 다시보려고 60만원들여서 32인치 모니터 , 보노보스 H1 오메가 스피커 , 암막커튼 샀습니다다시 재개봉한다면 100만원이어도 꼭 가겠습니다  "
2-6-2018,2018,2,6,02:07,화요일,10,8,1,이홍주(gywn****),대한민국 몇 안되는 명작  
12-15-2017,2017,12,15,14:44,금요일,10,8,1,LittlePrince(hosi****),인생영화입니다 꼭 보셔야합니다  
11-29-2017,2017,11,29,15:57,수요일,10,8,1,ABCDEFG(jik0****),네이버 평점을보고 이 망할 영화를 보았다. 하나 확신할수있는것은 네이버 평점을보고 이 영화를 보게 된 사람은 반드시 10점을 주기위해 돌아올 것이라는것이다.  
11-28-2017,2017,11,28,22:59,화요일,10,8,1,Arlsa(akdl****),별점 1점 단사람은  자기만 치사하게 볼려고 그러는것이니 속지마세요 사실 1점 달아놓고 맨날 1일 1클레멘타인봅니다  
11-2-2017,2017,11,2,18:52,목요일,10,8,1,남극탐험(kcmt****),일부 네티즌들의 질투어린 시기에 속지마시라.네이버 평점은 거짓말을 하지 않는다.  
6-30-2017,2017,6,30,11:03,금요일,10,8,1,이인상(insi****),리얼을 보고나니 이 영화가 얼마나 명작인지 깨달을 수 있었습니다.  
6-28-2017,2017,6,28,13:14,수요일,10,8,1,wise****,리얼 기사 댓글보고 다시왔다.  
9-1-2016,2016,9,1,23:06,목요일,10,8,1,gamj****,영화가 끝나고 사타구니가 젖어있는 저를 발견했습니다  
6-29-2016,2016,6,29,17:57,수요일,10,8,1,이보영(ifra****),나는 이영화를 박찬욱 감독이 리메이크 했으면 한다  
3-26-2016,2016,3,26,15:29,토요일,10,8,1,아오아오아오(chic****),인생은 B(Birth)와 D(Death) 사이의 C(Clementine)이다  
8-12-2014,2014,8,12,15:50,화요일,10,8,1,리틀육성(nunu****),무슨말이필요한가 난다시태어난다면  이런대작을품은 DVD로 태어나기를 간절히바란다....  
8-1-2014,2014,8,1,18:52,금요일,10,8,1,rmae****,즐거운생일날 생일파티를하며 이영화를보았다. 감동이 북받아쳐서 나는친구들에게  생일빵을맞으면서 감동의 눈물을 흘렸다.  
2-25-2019,2019,2,25,19:45,월요일,10,9,2,추노꾼이대길(ki10****),평점좋은영화는 댓글알바다란 선입견때문에 보류하다가시간내봣습니다..  이영화를다보고나니 어느새 흐르는눈물과 왜이런영화를 이제봣는지 하는 자책감때문에 스스로목을조르는걸 발견햇죠 정말21세기최고의영화입니다 꼭보세요 강추  
10-14-2018,2018,10,14,23:58,일요일,10,9,2,행키공주(hang****),아니 이게 왜 네이버 추천영화 숨은 명작에 껴있는거냐...네이버까지 한통속일 줄이야ㅋㅋㅋ  
8-24-2018,2018,8,24,23:58,금요일,10,9,2,은하철도999(ge99****),김정은 국방위원장이이 영화를 보았다면 바로 통일되었을 것이다  
7-26-2018,2018,7,26,21:46,목요일,10,9,2,77(jeon****),시간의 소중함을 알고 싶다면 강추  
4-4-2018,2018,4,4,16:22,수요일,10,9,2,타이거(ljh3****),스포일러는 삭제될수 있다는 경고를 각오하고 이건 꼭 올려야만했다... 아빠는 일어나더라..  
7-1-2017,2017,7,1,13:09,토요일,10,9,2,임페리우스(kanf****),리얼보고 클레멘타인을 생각하니 얼마나 잘 만들었나 깨닫게 되었습니다.  
2-26-2019,2019,2,26,02:59,화요일,10,10,3,vmfl****,만약 이동준씨가 젊었고 캡틴마블 감독이 클레멘타인을 봤었다면.. 브리라슨이 아니라 이동준씨가 캡틴마블로 캐스팅 됬을것이다.. 안타깝다.  
7-18-2014,2014,7,18,17:38,금요일,10,10,3,달(dudw****),어떻게 이런영화를..  나만 당할수없다....  
6-17-2019,2019,6,17,11:45,월요일,10,6,0,Han(ehrn****),이 영화를 보고 발기부전과 조루가 나았습니다... 신이시여!  
6-16-2019,2019,6,16,16:35,일요일,10,6,0,형이다(rlac****),10점 안준사람은 양심도 없냐  
6-16-2019,2019,6,16,03:23,일요일,10,6,0,라린(iris****),DVD 정발판 구합니다. 가격은 얼마든지 드릴테니 제발 연락부탁드립니다.  
6-13-2019,2019,6,13,00:25,목요일,10,6,0,쟈끄(jiho****),갓동준님....존경합니다  
6-7-2019,2019,6,7,13:53,금요일,10,6,0,Supervillain(revo****),이 영화는 감히 그 어떤 명감독들도 시도하지 못할 21세기 대한민국의 위대한 문화유산입니다 아마 다음 세기가 오기까지는 21세기 대작명화는 이 영화가 일하다고 장담해요 아들 딸 손자손녀까지 두고두고 회자될~ 죽기전 꼭 볼 영화임 꼭 보세요!두번보세요  
6-5-2019,2019,6,5,15:18,수요일,10,6,0,kim ja bong tlll(dnjs****),좋다너무좋아 노모좋아  
6-3-2019,2019,6,3,22:59,월요일,10,6,0,rhks****,죽고나서 뵈야한다는 명작  
6-3-2019,2019,6,3,20:35,월요일,10,6,0,키히히(ehy0****),몇일전 발목골절수술을 했습니다. 이 영화를 보고 암이 나았다는 소식을듣고 이 영화를 볼 결심을 하였습니다 . 아빠 일어나~!! 이 대사를 듣자마자 전 걸을수 있단 확신을 하였습니다 감사합니다 ㅜ내일 전 걷게 될것입니다  
6-2-2019,2019,6,2,19:30,일요일,10,6,0,unny****,박평식도 이 영화만큼은 10점을 주고 말 것이다  
6-1-2019,2019,6,1,02:33,토요일,10,6,0,최성비니(nli0****),다들 10점 주길래...!  
6-1-2019,2019,6,1,00:03,토요일,10,6,0,웨인까니(dduu****),타이타닉보단 조금못하지만 마지막앤딩 너무슬프네요  
5-31-2019,2019,5,31,16:25,금요일,10,6,0,근육돼지(aire****),최고의 대작! 보고나서 눈물이..  
5-17-2019,2019,5,17,21:58,금요일,10,6,0,snim(sngs****),클레멘타인을 보고 감독의 꿈을 미련없이 접었습니다 고마웡 클레멘타인~~  
5-16-2019,2019,5,16,09:59,목요일,10,6,0,허신욱(hswg****),아빠 일어나 밥먹어야디  
5-15-2019,2019,5,15,14:51,수요일,10,6,0,남쓰야(1386****),와 이런 명작이 숨어있었다니.. 눈물이 앞을 가립니다~  
5-15-2019,2019,5,15,10:49,수요일,10,6,0,Hyaluronic(djqw****),(ㅠ ㅅ ㅠ   ) (    ㅠ ㅅㅠ)  (     ㅠㅅㅠ)   님아 그 눈물 감추지마오.  
5-10-2019,2019,5,10,17:39,금요일,10,6,0,원투(wont****),이걸 보면서 리얼 제외 어떤 영화를 봐도 명작으로 보이게 됐습니다. 감사합니다.  
5-9-2019,2019,5,9,12:06,목요일,10,6,0,찜승(lady****),이영화를 보고 암세포가 암이 걸려 죽어서암이 나았습니다. 이영화를 보지못하신 분들은 아직살아갈 이유가 하나 더 있는겁니다.  
5-8-2019,2019,5,8,17:06,수요일,10,6,0,심청이공양미(park****),꼭 보십시오시대를 앞서간 명작입니다.지금  개봉했으면 어벤져스 하고 붙어도 절대로 밀리지 않을 영화입니다.1천만은 그냥 찍었을듯~  
5-6-2019,2019,5,6,13:19,월요일,10,6,0,김중호(daeb****),모니터앞에서 이영화를본뒤 그자리에서 굳어버린 나는 무려2박3일간 움직이지못했다 그만큼 이영화는 나에게 큰문화적  충격과 감동을 안겨줬다  
5-5-2019,2019,5,5,14:37,일요일,10,6,0,송수민(sum1****),"신은 우리에게 빛과 소금, 그리고 클레멘타인을 주셨다.  "
5-2-2019,2019,5,2,17:33,목요일,10,6,0,syh9****,해외에서 외국친구들이랑 같이 봤어요보기전에 영어로 대화하던 우리가 지금은 한국어로 대화하는 기적을 보았습니다  
5-2-2019,2019,5,2,11:24,목요일,10,6,0,서있는곳(woal****),성경과 클레멘타인...과연 어느것이 인류에 더 큰 영향을 주었는가.  
4-30-2019,2019,4,30,21:35,화요일,10,6,0,누렁(eodb****),다들 엔드게임 볼때 저는 클레멘타인을 다시 봤습니다...  
4-26-2019,2019,4,26,17:35,금요일,10,6,0,휴노(cup2****),평점이 너무 후해서 보게되었습니다. 역시나 네티즌 평점은 그 근거가 확실 합니다.  
4-21-2019,2019,4,21,06:34,일요일,10,6,0,ablecasting(able****),"야 이사람들아 평점 보고 진짜로 봐버렸잖아,..  ㅅ... 아 그런데 정말 재밋었어요.  굿!   정말 눈물나게 재밌어요  저  이거 보려고 4000원 결제했는데 전혀 아깝지 않아요. 꼭 보세요   인생영화임  "
4-20-2019,2019,4,20,15:38,토요일,10,6,0,찰선(yang****),저는 네이버 평점 알바생입니다직업 특성상 영화를 보지 않고 지어쓰는 경우가 많은데클레멘타인은 직접 보았습니다.이 영화에 진심으로 다섯개의 별을 쏘아올립니다.직업상 권태기를 벗게해준 클레멘타인에게 다시한번 감사드립니다.  
4-15-2019,2019,4,15,14:45,월요일,10,6,0,비밥(unde****),최고의 영화입니다. 왜 국제영화제에 출품 안하셨는지 ㅠ  
4-15-2019,2019,4,15,03:10,월요일,10,6,0,솔(pine****),인생 최고의 영화. 그 어떤 수식어도 모자람.  
4-9-2019,2019,4,9,20:37,화요일,10,6,0,요르크트(lkjl****),하..지인이 이영화 한번보라고 해서 봤는데 역시 높은평점인 이유를 알꺼같아요....  
4-8-2019,2019,4,8,12:56,월요일,10,6,0,MAUS(avgu****),명작 로맨스영화 쳤는데 이게 왜나옴 ㅋㅋㅋ  
4-8-2019,2019,4,8,12:40,월요일,10,6,0,커피에라면끓이기(cutl****),“영화로 눈물이 손수레 너무 좋아 보였다 10 별로 완벽히 영화라고는 믿지도 못했다 “제 옆에서 영화보던 아이폰이 갑자기 켜지더니 평점을 달기 시작했습니다. 시리마저 감동시키는 클레멘타인... 그저 빛..  
3-30-2019,2019,3,30,10:39,토요일,10,6,0,이재민(jimj****),완벽한 영화가 존재한다고 한다면 이영화를 말하는것이다.  
3-19-2019,2019,3,19,22:42,화요일,10,6,0,륜(siii****),이 영화를 보고 발기부전이 나았습니다  
2-9-2019,2019,2,9,15:44,토요일,10,6,0,심동주(sims****),희대의 명작 하지만 아직 보진않았다  
2-8-2019,2019,2,8,11:25,금요일,10,6,0,Shadowasin(nhon****),아카데미는 이 작품을 선택하지 않은것에 후회할것이다.  
2-7-2019,2019,2,7,02:01,목요일,10,6,0,migraine(migr****),클레멘타인은 제가 가장 추천하는 남남북녀라는 대작과 견줄 만한 엄청난 영화에요. 제가 이 시대에 태어나서 이걸 볼 수 있어서 정말 너무나...  
2-6-2019,2019,2,6,21:58,수요일,10,6,0,hear****,10101010101010  
2-6-2019,2019,2,6,15:03,수요일,10,6,0,뽀송남(ppos****),클레멘타인을 보지않고 인생을 논하지 말라  
2-3-2019,2019,2,3,17:41,일요일,10,6,0,도덕의달인(thel****),사람은 세상을 살다보면 불합리하고 불공정한 경험을 하게 된다.  영화를 보진 않았지만 그런 경험들을 하고 나면 이 영화가 왜 10점인지 알게 될 것이다.  
2-2-2019,2019,2,2,02:19,토요일,10,6,0,공부안하냐(kaza****),꼭봐라 아직 이 영화를 보지않았다면 아직 살아갈 이유하나를 간직하고 있는거다.  
2-1-2019,2019,2,1,19:21,금요일,10,6,0,누구(tkdr****),너무 떨려서 생각이 안나네요  
1-27-2019,2019,1,27,01:35,일요일,10,6,0,로롱(benz****),정말 감동적입니다 ㅠㅠ  
1-26-2019,2019,1,26,21:19,토요일,10,6,0,가나(sktj****),"진정한 명작이란 영화에 관심없던 사람조차도 일어나서 몰입할 수 있는 영화다, 클레멘타인도 그런 영화다. 누구든지 클레멘타인을 보여주면 눈물을 흘리며 극찬을 하였다, 클레멘타인은 영화사에 길이 남을 작품이다.  "
1-25-2019,2019,1,25,22:19,금요일,10,6,0,똥덩어리(tqqk****),그냥 10점 눈물흐름....  
1-24-2019,2019,1,24,16:58,목요일,10,6,0,jaco****,이곳이 그 유명한 성지군요.  
1-24-2019,2019,1,24,12:08,목요일,10,6,0,김민우(kmw4****),개꿀잼 ㅋㅋ 이거 꼭보셔야댐  
1-23-2019,2019,1,23,17:22,수요일,10,6,0,도라에몽(sun2****),역시 믿고 보는 네이버 평점!! 이 영화가 9점대인 이유가 있다. 이 영화는 마음속 깊은 곳의 심금을 울리는 가족영화로서 정말 보기드문 걸작이다. 안보신분들은 꼭 보시길 강추!! 두번 세번 보시길...  
1-21-2019,2019,1,21,05:29,월요일,10,6,0,돼지바 쌍쌍바 포그바(ksb7****),이영화를 보고 계속 머리속에서 기억이나서 잠을 잘수가없습니다..지금 밤샌지 30일째입니다..  
1-20-2019,2019,1,20,21:29,일요일,10,6,0,없지요(dh72****),이게 정녕 사람이 만든것이냐...신이 만들었다  
1-20-2019,2019,1,20,21:21,일요일,10,6,0,shka****,정말 재밌어요....  
1-20-2019,2019,1,20,19:32,일요일,10,6,0,정세준(tpwn****),이 영화를 보고 슈퍼사이어인이되었습니다.  
1-20-2019,2019,1,20,14:21,일요일,10,6,0,toto(toid****),내 청춘을 이영화로 보냈습니다.  
1-19-2019,2019,1,19,23:12,토요일,10,6,0,MOMO(karo****),성지순례왔습니다. 클레멘타인을 보고 삶의목표가 생겼습니다 ㅜㅜ 동준이형 화이팅  
1-19-2019,2019,1,19,00:26,토요일,10,6,0,아톰(namd****),이 영화를 보고 허리디스크가 있던 제가 벌떡 일어나게 되었습니다.  
1-18-2019,2019,1,18,01:50,금요일,10,6,0,용아리(tour****),"뛰어난 연출력과 액션, 코미디, 감동, 로맨스 그리고명대사까지 어디 하나 놓치기 힘든 최고의 영화 입니다. 이 영화를 보고 마음이 따뜻해 졌어요. 꼭 재개봉 하여 많은 사람들이 감동을 받았으면 좋겠어요  "
1-16-2019,2019,1,16,16:11,수요일,10,6,0,sunny(ciao****),아이 엠 샘의 다코타 패닝은 잊어라 역사상 가장 뛰어난 외모와 연기력의 아역배우가 탄생했다  
1-14-2019,2019,1,14,21:07,월요일,10,6,0,sjrhth(ghcj****),마지막에 눈물 찔끔나더라 희대의 명작...  
1-14-2019,2019,1,14,19:15,월요일,10,6,0,최현욱(frog****),와 아름답다  영화여!!!!  
1-13-2019,2019,1,13,17:28,일요일,10,6,0,손일공(gmgm****),하늘에 하느님이 계시고 영화에는 클레멘타인님이 계시다.  
1-12-2019,2019,1,12,15:30,토요일,10,6,0,멀티(taeh****),삶의 희망이 없었던 저는 이 영화를 보고 다시 희망을 되찾았습니다.  
1-12-2019,2019,1,12,01:30,토요일,10,6,0,행복나눔이(hyeo****),위로는 삼대 아래로는 천대까지 여운이 이어질 것 같다  
1-10-2019,2019,1,10,23:37,목요일,10,6,0,HO(neve****),내 인생 최고의명작영화  
1-10-2019,2019,1,10,10:02,목요일,10,6,0,킹왕짱(ksol****),감동 그자체인 영화 ..  
1-9-2019,2019,1,9,18:12,수요일,10,6,0,보드레안다미로(kbt6****),안봐도 본것같은 만족감 ! 10점 입니다  
1-8-2019,2019,1,8,03:23,화요일,10,6,0,필승해군(ggul****),제 나이 올해 32살.. 방금 만나고 오는길입니다.명불허전이란 단어 말곤 아무것도 떠오르지 않네요. 1월 8일.. 앞으로 제겐 독립기념일입니다.  
1-5-2019,2019,1,5,00:39,토요일,10,6,0,양(wjrt****),매년 새해를 맞이해 보는 영화.매년 새해 내 얼굴은 눈물범벅이 되어 있다.  
1-4-2019,2019,1,4,16:54,금요일,10,6,0,형(dfr6****),가슴이 먹먹해지는 아름다운 영화. 왜 이제야봤을까 후회하며  후기남깁니다.  
1-2-2019,2019,1,2,08:14,수요일,10,6,0,이잉여(wkdu****),인생영화의 기준 영화의 기준  
12-31-2018,2018,12,31,13:06,월요일,10,6,0,JWJ(wldu****),인생 최고의 영화또봐야지  
12-31-2018,2018,12,31,13:04,월요일,10,6,0,엉덩이에살찜(eunb****),이 영화를 알려주신 아버지께 감사합니다  
12-29-2018,2018,12,29,21:26,토요일,10,6,0,없다(bank****),진심 최고다ㅋㅋㅋㅋ강추  
12-29-2018,2018,12,29,21:16,토요일,10,6,0,anji****,이시대 최고의영화. 이제야 보다니  
12-29-2018,2018,12,29,01:43,토요일,10,6,0,isacc toast(dudn****),생에서 본 영화중 최고의 영호ㅓ  
12-28-2018,2018,12,28,13:32,금요일,10,6,0,s333****,동준님 똥꼬쇼 시작된 전설의 프리퀼  
12-26-2018,2018,12,26,19:16,수요일,10,6,0,코코로리(ari2****),이거 진짜 재밌어요! ^^  
12-26-2018,2018,12,26,16:38,수요일,10,6,0,ㄱㅁㅊ(limk****),10년 고생한 치질이 완치 되었습니다.  
12-26-2018,2018,12,26,11:18,수요일,10,6,0,dual****,100점 주고 싶지만 10점 밖에 못 주네 ㅠㅠ  
12-19-2018,2018,12,19,11:44,수요일,10,6,0,풍운만리(yoji****),죽기전에 봐야할 혹은 인생 최고의 영화  
12-15-2018,2018,12,15,09:56,토요일,10,6,0,kdjm****,안봤어요. 그래도 10점 줄래요.  
12-14-2018,2018,12,14,20:01,금요일,10,6,0,엠마왓슨 빠돌이(blin****),눈물 날정도로 아름다운 영화다ㅠㅠ  한번 보면 더이상 못보겠는 명자규ㅠ  
12-14-2018,2018,12,14,16:56,금요일,10,6,0,여의도니달리(powe****),다시 높은순위로 오르길 바랍니다.  
12-14-2018,2018,12,14,16:22,금요일,10,6,0,란(nhoy****),베플들이 다 한 영화 ㅋX무한대  
12-14-2018,2018,12,14,10:35,금요일,10,6,0,뭐할껴냐요(dhek****),정말  살고싶지 않을 때 이 영화를 한번 봐라. 보고나면  살아갈 희망을 가질것이다  
11-6-2018,2018,11,6,00:28,화요일,10,6,0,쩡뉴(crea****),저는 멜론 벅스 지니 안 씁니다. 클레멘타인을 bgm 수준으로 하루종일 틀어놓습니다. 내 영혼을 달래주는 아빠 일어나  
10-30-2018,2018,10,30,14:51,화요일,10,6,0,NC다이노스(shm8****),영화 개봉한 지 14년이 지났지만 여전히 매일같이 평점이 달리는 최고의 명작.  
10-27-2018,2018,10,27,00:19,토요일,10,6,0,주모(jaey****),지렸다... 기저귀를 하기스로 입고 보시길 권합니다.. 하.. 아직도 가슴이 뜨겁다..  
10-26-2018,2018,10,26,05:40,금요일,10,6,0,정정(hiph****),내가 이영화를 못보고 죽었을수도 있다는 생각에 소름돋는다  
10-25-2018,2018,10,25,11:47,목요일,10,6,0,없음(didy****),이 영화를 보는데 아빠 일어나 라는 소리에 아버지가 주무시다 일어나셔서 같이 영화를  보고 출근하셨습니다. 알람으로 딱 입니다. 스티븐 시걸도 이 영화를 알람으로 듣는다고 들었습니다. 객꿀입니다.  
10-22-2018,2018,10,22,17:15,월요일,10,6,0,s(rest****),그냥 닥치고 봐라 이게 영화다  
10-21-2018,2018,10,21,23:30,일요일,10,6,0,s011****,액션부문 1위가 아니라는 사실에 놀라서 평 남깁니다  
10-14-2018,2018,10,14,02:12,일요일,10,6,0,000000(koks****),말이필요없는영화입니다  
10-10-2018,2018,10,10,21:01,수요일,10,6,0,유용현(et89****),김치 김치 야야 김치 김치 야야 김치 김치 야야 김치 김치 야야  
10-10-2018,2018,10,10,08:40,수요일,10,6,0,김지나(nana****),이 영화를 보기 위해 나는 태어났다.  
10-10-2018,2018,10,10,01:32,수요일,10,6,0,sj(eomu****),뭔지몰라도 다들 재밌어보여서 10점 줌  
10-8-2018,2018,10,8,22:09,월요일,10,6,0,하스스톤(vwjs****),이 영화를 보고 암이 암이 걸려서 나았습니다  
9-26-2018,2018,9,26,23:23,수요일,10,6,0,끊임없는압박(cann****),평점 높아서 찾아봤는데 역시 그만한 이유가 있었어!  
9-20-2018,2018,9,20,09:27,목요일,10,6,0,주먹꽉져(punk****),타르코프스키도 오줌 지릴 영화  
9-19-2018,2018,9,19,20:02,수요일,10,6,0,닭스러운인간(youc****),영화를 보면서 감동을 받아 온몸의 구멍에서 액체를 뿜어버리는 바람에 기저귀뿐 아니라 옷을 전부 다섯 번 갈아입었습니다.  
9-19-2018,2018,9,19,16:13,수요일,10,6,0,woohon(wooh****),클레멘타인은 111점을 줘야 맞다  
9-16-2018,2018,9,16,14:27,일요일,10,6,0,컴스틱(cpac****),이 영화를 보고 더 이상 다른 영화를 보지 못하겠습니다. 차라리 그런 영화들을 볼 시간에 이 영화를 한 번 더 보겠다는 생각이 들기 때문입니다.  
9-16-2018,2018,9,16,04:11,일요일,10,6,0,란 스터(dsco****),보고 오열함 일단 믿고 보아야 함  
9-14-2018,2018,9,14,15:46,금요일,10,6,0,mij0****,당신이 겨울에 추위를 느낀다면 이 영화를 보지않은것이다본 사람은 마음부터 온몸이 뜨거워지는 감동이 있다.  
9-14-2018,2018,9,14,15:42,금요일,10,6,0,랩소디(wngu****),아빠 일어나....어렸을적 주말에 아빠를 깨우던 내 모습이 생각나서요 ㅠㅠ  
9-14-2018,2018,9,14,11:20,금요일,10,6,0,촘촘(cucu****),영화안보고 누름니다~역사적인 영화에 숟가락 약간만 얹어놓고싶어서요  
9-14-2018,2018,9,14,07:18,금요일,10,6,0,라이거(lige****),평점10점을 줄 수 밖에 없는지 꼭 보시길...  
9-13-2018,2018,9,13,22:02,목요일,10,6,0,ipko****,인류의 미래를 10년...? 아니 20년은 족히 앞당긴 시대를 앞서간 세기의 명작. 그저 별점 10점밖에 주지 못하는 것에 한숨만이 쏟아져 나온다.  
9-13-2018,2018,9,13,20:45,목요일,10,6,0,공룡밥그릇(kinp****),"이런 영화가 다시 나올 수 있을까? 체조의 코마네치, 축구의 펠레, 피겨의 김연아도 클레멘타인 앞에서는 평범할 뿐이다. 오직 만점, 완벽이라는 단어는 클레멘타인을 위해서 존재한다  "
9-13-2018,2018,9,13,15:46,목요일,10,6,0,김재하(rmfb****),"장난들 많이 치시지만, 진지하게 보면 정말 좋은 영화입니다.  "
9-10-2018,2018,9,10,17:21,월요일,10,6,0,깜둥이(dnsr****),최곱니다... 평생 하나의 영화만을 봐야 한다면 이 영화를 선택할겁니다.  
9-10-2018,2018,9,10,12:26,월요일,10,6,0,곰팡고양이(dlwo****),인생의 가치관을 바꿔주는 숨은 명작.  
8-27-2018,2018,8,27,16:21,월요일,10,6,0,몰랑이(ranc****),영화보기전 지인이 이영화를 꼭한번만보라고 하더군요 .그래서 시간이 나서 오늘 보고야 말았습니다. 하지만 지인과의 약속을 지키지 못하겠네요. 연속으로 3번을 보고야 말았습니다. 앞으로 몇번을 더보게 될지는 모르겠네요. 아빠~일어나 ㅠ.ㅠ  
8-26-2018,2018,8,26,00:35,일요일,9,6,0,kjh_****,좀 억지스러운 설정이 안타깝다 하지만 가족간의 애틋한 사랑을 잘 보여줘서 좋았네요  
8-24-2018,2018,8,24,17:47,금요일,10,6,0,GATSBY(babo****),군대에서 인내를 배운다면 이 영화를 보신분들은 군대를 안가셔도 됩니다.  
8-23-2018,2018,8,23,19:06,목요일,10,6,0,지나단(gods****),명작....이 이상 훌륭할 순 없다  
8-20-2018,2018,8,20,23:43,월요일,10,6,0,wleh****,재개봉이 시급합니다.  
8-20-2018,2018,8,20,07:20,월요일,10,6,0,Ldh(ldh9****),이걸 보고나서 20년 넘게 휴유증에 시달리고 있습니다.  
8-19-2018,2018,8,19,17:32,일요일,10,6,0,겉쩔이(98du****),한 사람의 인생한편을 본듯한 영화 눈물로 보고 가슴으로 받아 드렸습니다  
8-18-2018,2018,8,18,16:14,토요일,10,6,0,Ghost Recon(henr****),클레멘타인 하루 1번씩 보고 있는 사람입니다. 곱씹어봐도 21세기 안에는 이에 필적할 만한 영화를 만들어내는 것이란 불가능해 보입니다.  
8-15-2018,2018,8,15,11:24,수요일,10,6,0,박상욱(sang****),안녕하세오 반갑습니다  
8-15-2018,2018,8,15,00:20,수요일,10,6,0,pleasantly(qpfm****),아빠 일어나 아빠 일어나~ 울부짖는 소리에 옆에 소파에서 주무시던 아버지가 정말 일어나서 보고 같이울었던 최고의 수증기 영화!  
8-14-2018,2018,8,14,17:24,화요일,10,6,0,김민수(gofy****),와 정말 클레멘타인은 시대의 명작입니다.의료진들도 암환자들에게 클레멘타인을 보는 것을 추천할 만큼 암을 낫게도 해 주는 이 세상의 최고의 명작입니다. 진짜 이 영화를 아직까지도 보지않으신 분들은 꼭 bvb사서 보세요!!  
8-11-2018,2018,8,11,10:48,토요일,10,6,0,류해빈(tkfk****),왜 다들 클레멘타인 클레멘타인 하는지 알게될것이다.  
8-8-2018,2018,8,8,19:48,수요일,10,6,0,zero****,그냥 최고의 명작이라고밖에  
8-8-2018,2018,8,8,12:50,수요일,10,6,0,은찬맘(whit****),말이 필요없는 대한민국 최고의 영화. 이영화는 월클을 뛰어넘었다.  
8-8-2018,2018,8,8,09:40,수요일,10,6,0,다이제(dige****),이 영화르 보고 불면증이 나았습니다.나만 이 영화를 볼 수는 없지  
8-7-2018,2018,8,7,03:12,화요일,10,6,0,w7w7****,클레멘타인을 볼수있는 생을 살수있어서 아무것도 가진것없어도 모든걸 가진듯 행복하다  
8-6-2018,2018,8,6,23:34,월요일,10,6,0,SM(ysm9****),AC15년에서야 이영화를 보다니 후회가 맥심할 따름입니다.  
8-6-2018,2018,8,6,14:38,월요일,10,6,0,야누스(youn****),인랑 데자뷰 염력 골든슬럼버 레슬러 그것만이 내 세상 등 요즘 한국영화 추격작품이 너무 많아 다시한번 10점 꼽고 갑니다^^  
8-5-2018,2018,8,5,22:47,일요일,10,6,0,hhh3(gusw****),한국인이라면 한번쯤 봐야하는 영화!  
8-5-2018,2018,8,5,11:08,일요일,10,6,0,쿄쿄쿄(kdy0****),다음주 주말에 볼예정이다  
8-5-2018,2018,8,5,01:11,일요일,10,6,0,방현정(qhrt****),극호 죽기던에 봐야할 영화  
8-4-2018,2018,8,4,23:58,토요일,10,6,0,wpsskfh(dust****),무슨말이 필요한가 시바스 리갈 성님이 시나리오 첫장보고 계약했다는데  엄청나다 굉장하다  오늘도 하루시작도 이영화 오프닝으로 시작한다  오지고지린다  
8-4-2018,2018,8,4,14:36,토요일,10,6,0,애플(smar****),흐흐흐ㅡㅎ흐하하하핳하핳흐ㅡ흐흐흫흫.흐ㅡㅎ.ㅎㅎ  
8-1-2018,2018,8,1,12:23,수요일,10,6,0,morg****,최고예요~!! 더이상 말이필요없습니다  
7-31-2018,2018,7,31,03:42,화요일,10,6,0,김로맨(khon****),정말 감동입니다.. 눈물남  
7-25-2018,2018,7,25,21:55,수요일,10,6,0,홍정택(0516****),연기력 극찬. 연출력 판타스틱  
7-23-2018,2018,7,23,11:24,월요일,10,6,0,병일박(qudd****),역대급 명작입니다..  
7-22-2018,2018,7,22,20:38,일요일,10,6,0,영상(popj****),클레멘타인을 보지 않았다면 아직 인생을 한 번도 즐기지 못한 것이다.  
7-22-2018,2018,7,22,16:30,일요일,10,6,0,gaog****,감동적인 내용이네요후속작은 없나요  
7-22-2018,2018,7,22,14:25,일요일,10,6,0,라스건(lasg****),꼭 봐라 입대전에 이걸 보고 군대가서 용기 얻었음  
7-22-2018,2018,7,22,05:09,일요일,10,6,0,eogu****,명작이라고 하는 이유가 있네요^^. 평점 10점밖에 못주는것이 아쉽습니다.  
7-21-2018,2018,7,21,15:13,토요일,10,6,0,J(race****),아예아예뚜두뚜두뚜두  
7-21-2018,2018,7,21,14:14,토요일,10,6,0,닉네임을 입력하세요(ehrb****),평점을 10점주고 싶다  
7-21-2018,2018,7,21,11:25,토요일,10,6,0,브록시가르(whdu****),이 영화를 보지 않은 사람은 인생을 논하지 마라.  
7-21-2018,2018,7,21,11:14,토요일,10,6,0,베개베개(cola****),살아생전 꼭 봐야하는 영화  
7-21-2018,2018,7,21,01:44,토요일,10,6,0,vklu****,"최고의 감독, 액션. 배우 그리고 감동...  "
7-20-2018,2018,7,20,13:33,금요일,10,6,0,비글(ilkw****),입을 다물지 못했다...  
7-20-2018,2018,7,20,05:41,금요일,10,6,0,독한남자(lkhn****),영화중의 영화 걸작 영화  
7-20-2018,2018,7,20,05:04,금요일,10,6,0,올드스틸(atom****),내인생은 이영화를 보기전과 보고난후로 나눌수있다  
7-20-2018,2018,7,20,04:35,금요일,10,6,0,김정오(dbeh****),말이필요없다...경의를 표한다.  
7-20-2018,2018,7,20,04:20,금요일,10,6,0,투몽(crow****),내인생 최고의 영화임  믿고 보셔도 됩니다  
7-19-2018,2018,7,19,19:29,목요일,10,6,0,고릴라트위스트(love****),내 인생의 전환점. 영화가 주는 감동은 내 인생의 새로운 출발점이 되었다  
7-19-2018,2018,7,19,13:31,목요일,10,6,0,TP ONe(clup****),퇴근후에 나던 내 양말속에 쉰내의 흥미로움? 그것은 클레멘타인 입니다.  
7-18-2018,2018,7,18,15:21,수요일,10,6,0,minl****,지난달 소개팅때 그녀가 가장 감명 깊게 본영화가 무엇인지 물었다.  난 클레멘타인이라 말했고 바로 그날 결혼을 약속했다.  
7-1-2018,2018,7,1,20:23,일요일,10,6,0,김시은(rlat****),네이버 너무하군...나는 100점을 주고싶은데 왜 10점까지인가??네이버 수정해라 이제 최대 점수는 100점이다.그리고 나는 우리나라 망ㅈ...아니 망작같은 명작을 사랑한다.  
7-1-2018,2018,7,1,01:13,일요일,10,6,0,bong****,갑진 100분이었어요  
6-26-2018,2018,6,26,22:13,화요일,10,6,0,future(futu****),세상에서 가장 많은 사람들을 울린 영호ㅓ  
6-24-2018,2018,6,24,15:29,일요일,10,6,0,miri****,관객수 3562명이라... 대형 사고네... 동그라미 4개가 빠졌어요.  
6-20-2018,2018,6,20,18:21,수요일,10,6,0,한동헌(hand****),영화사에 오래오래 기억될 영화  
6-12-2018,2018,6,12,16:36,화요일,10,6,0,신희찬(heca****),"감사합니다. 감동적인 영화에 짱짱한 스토리지만 정리가 잘 되어있군요. 감히 한국 최고 명작이라고 할수있네요 정말 잘 봤습니다. 아빠,, 일어나...  "
6-4-2018,2018,6,4,01:41,월요일,10,6,0,이윤주(y00n****),아빠 깨우는 소리가 거의 사이렌급  
6-3-2018,2018,6,3,13:41,일요일,10,6,0,임희선(ikug****),14년이 지난 지금까지 영화의 여운이 가시질않아 꾸준히 1일 1클레멘타인 감상중입니다...진짜 인생 영화에요  
6-1-2018,2018,6,1,16:23,금요일,10,6,0,독수리V2(b900****),다들 똑같은 마음일 듯 인데  
5-31-2018,2018,5,31,15:23,목요일,10,6,0,초록사과(bill****),- 한국인이 원하는 재개봉 희망영화 1위 선정.- 군부대 내 셋톱박스 누적 재생 수 1위 선정.- 영화감독/평론가 들도 감히 평가를 매길 수 없다고 판단할만큼 위대하여 실제 네이버 평점란에도 평론가의 글이 없는 말이 필요없는 영화.  
5-31-2018,2018,5,31,13:51,목요일,10,6,0,바람의아들(munj****),클레멘타인은 단순한 영화가 아니다. 인류의 문화유산이다. 판문점에서 가수들의 공연 대신 클레멘타인을 상영했다면 그날로 통일이 되었을 것이다.  
5-27-2018,2018,5,27,12:01,일요일,10,6,0,정승훈(veri****),이 시대 최고의 명작이다  
5-26-2018,2018,5,26,14:28,토요일,10,6,0,힐링소년(godl****),아빠 일어나 대사에서 10년동안 불치였던 발기부전이 나았습니다 요즘에는 매일 비아그라대신 클레멘타인을 보고 잠자리에 임하고 있습니다 진정한 뮤비힐링이란 이런것이군요  
5-23-2018,2018,5,23,02:43,수요일,10,6,0,zeniswell(mouk****),내생에 최고 띵작 10점주고 갑니다  
5-22-2018,2018,5,22,19:53,화요일,10,6,0,dhks****,아주 재미있고 유익하고 교훈을얻는 드런 영화다  
5-22-2018,2018,5,22,15:41,화요일,10,6,0,Gamst(qkra****),재개봉이 시급한 영화입니다 많은사람들이 이 영화를보고 감동받았으면 하는 바램입니다  
5-19-2018,2018,5,19,04:43,토요일,10,6,0,제피(zeph****),죽기 전에 꼭 봐야할 영화  
5-19-2018,2018,5,19,01:37,토요일,10,6,0,omo(aid4****),평생 흘릴 눈물을 클레멘타인 보고 다 흘렸습니다. 이제 더는 눈물이 안나옵니다.  
5-16-2018,2018,5,16,23:22,수요일,10,6,0,좀비(choe****),안봤지만 왠지 10점주고싶어  
5-9-2018,2018,5,9,15:06,수요일,10,6,0,Amir(brow****),모든 것이 무너져내린 상황한치 앞도 보이지 않고 인생이 무의미하기만 했었습니다.하지만 이 영화를 다 본순간 저는 렙스타가 되었습니다. 췍!  
5-8-2018,2018,5,8,23:54,화요일,10,6,0,개미왕초(ant_****),평점이 너무 낮네요...더 올려주고싶은데..  
5-8-2018,2018,5,8,06:47,화요일,10,6,0,돼지(zzzp****),솔직히... 진심 재미있음...  
5-7-2018,2018,5,7,22:35,월요일,10,6,0,난그저그냥(hjs8****),사람들이 쓴글에 궁금해 봤는데 아... 닉퓨리가 왜 어머니를 찾았는지 알게 되었습니다 이 영화를 보고 감독님 투자사 등 여러가지를 찾아봤는데 안나오네요 마지막 명작을 뽑고 사라지신거 같네요 투자금에 2억만 건졌다니 이해가 안가네요 어떻게...2억  
5-6-2018,2018,5,6,17:04,일요일,10,6,0,핏더제이(boog****),이걸보고 아내가 출산을하였습니다 나오자마자 아기가 아빠일어나!!!를 외쳤습니다 기적의 영화 클레멘타인 !!! 아기에게 영어대신 대사를 모두 외우게 하겠습니다 감사합니다 클레멘타인 영원하라!!!  
5-6-2018,2018,5,6,01:01,일요일,10,6,0,꼬우냐(alsg****),현재 최신영화 어벤져스3마저 이영화는넘지못했다..  
5-3-2018,2018,5,3,01:21,목요일,10,6,0,황영준(ipp6****),이영화를보고 위암말기 시한부인생인데낳았습니다  
4-22-2018,2018,4,22,22:31,일요일,10,6,0,Logan(kkst****),현대 의학기술의 결정체  
4-22-2018,2018,4,22,21:56,일요일,10,6,0,Akai Suisei(gkfk****),갓ㅡ영화. 이 한마디로 설명된다.  
4-18-2018,2018,4,18,07:54,수요일,10,6,0,엑스터시(andr****),도대체 몇명의 필모그래피를 끊어놓은거냐  
4-16-2018,2018,4,16,15:50,월요일,10,6,0,smArt(smak****),똥꾸쇼 존재의 이유. 시걸을 울린 남자.  
4-12-2018,2018,4,12,12:00,목요일,10,6,0,아리아리(jmjz****),굿입니다다시 다시 보고싶은 영화  
4-11-2018,2018,4,11,07:05,수요일,10,6,0,넘버(trac****),"벤허, 사운드 오브 뮤직 늑대와춤을에 버금가는 마스터피스 콜렉션에 들어갈 세계 10대 명작 영화입니다. 클레멘타인...  "
4-10-2018,2018,4,10,18:22,화요일,10,6,0,djad****,당신의 인생영화는 무엇인가요?? 이영화를 본다면 당신의 인생영화 순위가 바뀔것입니다.  
4-1-2018,2018,4,1,01:57,일요일,10,6,0,인도원숭이(shyu****),이 영화 진짜 노잼입니다.  보지마세요...사실 만우절 장난이에요.^^ 제가 만우절 장난 한 번 해보고싶어서....  
3-25-2018,2018,3,25,17:49,일요일,10,6,0,도미노(dong****),근데 진짜 재밌게 봤는데 난..?  
3-24-2018,2018,3,24,18:41,토요일,10,6,0,ProfMoriarty(dodo****),신이시여 제가 뭘본겁니까  
3-24-2018,2018,3,24,15:11,토요일,10,6,0,kark****,평론가의 평점이 없다는것은 이영화를 감히 평가할수 없을만큼 너무나 위대한 명작이기 때문이다  
3-23-2018,2018,3,23,18:52,금요일,10,6,0,Otani Shohei(tana****),영웅 : 샐러맨더의 비밀 과 호각을 이루는 불세출의 명작...아직 안보셨다면 꼭 한번 보세요. 분명히 평점주러 오실겁니다.  
3-20-2018,2018,3,20,11:53,화요일,10,6,0,상백이(spee****),내 나이 37살...비로소 클레멘타인을 접했다...당시 비슷한 시기에 나온 지금 만나러 갑니다 이상의 눈물을 흘렸다..  
3-18-2018,2018,3,18,20:09,일요일,10,6,0,12te****,10점밖에 줄 수 없는 이 시스템이 원망스럽다  
3-15-2018,2018,3,15,14:27,목요일,10,6,0,Raphael(buzz****),보지는 않았지만 추천합니다!!!  
3-15-2018,2018,3,15,09:23,목요일,10,6,0,이런(athe****),제목을 보는 순간 이 영화는 제 인생의 과거/현재/미래를 보여주는 그런 영화라 확신하였습니다. 보고나서 별 100개를 주지 못하는 현실에 좌절할까봐 미리 10개 누릅니다.  
3-15-2018,2018,3,15,09:02,목요일,10,6,0,이강일(jjan****),"저는 84년생으로 34년을 살았지만 살면서 본 영화중에서 정말 최고라고 봅니다, 정말 영화 한편이 제 삶을 통틀어서 제일 행복하게 만들어 준다니 너무 행복합니다. 강추 입니다 꼭 보세요^^ 감독님 감사합니다.  "
3-14-2018,2018,3,14,12:02,수요일,10,6,0,김원준(frea****),"전 십수년전에 죽은 원혼입니다. 근데 우연히 이 영화를 보게됐고, 뼈가 생기고 피가 도는 기적을 체험했습니다.  "
3-13-2018,2018,3,13,01:46,화요일,10,6,0,아롱이(alom****),이영화가 개봉한지 어느덧 14년이 흘럿군요. 대작이라는 명작이라는 이야기는 많이 들어왔지만..아직까지 볼 엄두가 나지는 않습니다... 이 명작을 벌써 봐버린다면 먼훗날  제가 은퇴한후 볼 감동적이며 재밌는 영화를 볼수 없을거라 생각하고 훗날보겟습니다  
3-12-2018,2018,3,12,13:51,월요일,10,6,0,송(five****),오늘 날이 너무 따뜻해서 다시한번 봤습니다. 마음까지 따뜻해진 기분입니다.여러분 봄... 아니 클레멘타인의 계절이 왔어요~  
3-11-2018,2018,3,11,22:28,일요일,10,6,0,꿈은이루어진다(juda****),생각보다는 괜찮은 영화. 난 25분 버텼다.  
3-10-2018,2018,3,10,09:04,토요일,10,6,0,smil****,이 영화를 보고나서 공중부양이 가능해졌습니다.  
3-8-2018,2018,3,8,16:32,목요일,10,6,0,에밀레뽕(emas****),클레멘타인 DVD를 샀더니 취업이 되었어요! 만세!  
3-1-2018,2018,3,1,17:01,목요일,10,6,0,마로지(zeor****),사람들은 재미있는 영화를 보고는 생각한다.“아 기억을 되돌리고 싶다 그순간의 감동을 다시금 느끼고 싶다 ...” 클레멘타인 내겐 그런 영화다 나는 지금 영화를 관람하지 못했던 엊그제로 돌아가고 싶다이영화를 꼭 보는 것을 추천한다  
2-28-2018,2018,2,28,20:28,수요일,10,6,0,후라보노1(nomz****),9점대인 이 영화에 평론가 평점이 없다는건 평론가들조차 감히 평가를 내릴수없는 희대의 명작이라서다. 몇글자로 이 영화의 감동을 다 담을수없다 그냥봐라 직접봐라  
2-26-2018,2018,2,26,15:02,월요일,10,6,0,이글스정범모(nkw0****),"아직 보지 못한 우리 학생들에게도 정말 강력하게 추천합니다. 미사여구가 필요없는 최고의 명화!!만약 지금 주말의 명화, 토요 미스테리 극장이라는 프로가 있다면 이 명화가 나와주면 참 좋을텐데요..  "
2-26-2018,2018,2,26,13:11,월요일,10,6,0,하송(qkrg****),"우리나라의 단결력이 얼마나 뛰어난지 알 수 있는 명작입니다. 영화 절반정도 보았을 때, 그 단결력에 두 눈에서는 폭포수가 쏟아져 내렸습니다.ㅠㅠ  "
2-22-2018,2018,2,22,16:56,목요일,10,6,0,Scenery(yaja****),타이타닉 같은 영화도 재개봉 하는데 클레멘타인 재개봉 요청합니다!!  
2-19-2018,2018,2,19,02:37,월요일,10,6,0,jere****,청와대에 클레멘타인 재개봉해달라는 청원자 수가 7천만을 넘어 섰다고 합니다.  
2-13-2018,2018,2,13,23:07,화요일,10,6,0,뾰쀼(gn66****),아직 안봤는데 평도 좋고 기대되네요. 내일 볼거임>_<  
2-12-2018,2018,2,12,17:15,월요일,10,6,0,제임수하든(ssan****),내가 평가할수 조차 없는 영화  
2-7-2018,2018,2,7,12:14,수요일,10,6,0,voic****,한국영화의 금자탑!!!  
1-25-2018,2018,1,25,00:37,목요일,10,6,0,nyannn(ryon****),영화를 보며 차마 숨을 온전히 쉬지 못했다. 영화의 이데아가 있다면 바로 클레멘타인일까? 호흡곤란에 시달리던 나는 이윽고 우렁찬 사자의 포효를 연상캐하는 마지막 발차기 장면에서야 숨을 내쉴 수 있었다. 열반에 다다른 싯다르타.. 그는 이런 기분이였나.  
1-13-2018,2018,1,13,11:50,토요일,10,6,0,류승량(fcsa****),이 명작에 평점테러하지마라 1점은 성모형한테나 가서 주고오던가  
1-7-2018,2018,1,7,14:58,일요일,10,6,0,내가신이다(chom****),DVD는 소장용이 아닌 가보용이다  
1-5-2018,2018,1,5,16:32,금요일,10,6,0,soyt****,이게바로 영화라는 거다.  
1-2-2018,2018,1,2,12:33,화요일,10,6,0,regn****,이 시대가 낳은 최고의 명작  
1-1-2018,2018,1,1,21:29,월요일,10,6,0,쩡킴(shqp****),새해에도 1일 1클레멘타인.  
12-30-2017,2017,12,30,22:22,토요일,10,6,0,hunj****,명작 독차지 하고 싶어서 1점주는 사람들 있는데 진심 그러지 맙시다. 명작은 다같이 봐야지^^  
12-27-2017,2017,12,27,08:06,수요일,10,6,0,JOON(alvi****),클레멘타인2 언제나오나요  
12-23-2017,2017,12,23,13:07,토요일,10,6,0,fier****,보지는 않았지만 다른사람들의 답글만으로도 감동이 전해집니다  
12-19-2017,2017,12,19,23:49,화요일,10,6,0,똘램(sang****),평점이 높은 이유....일단 보면 압니다꼭보세요   이런 영화 어딜가도 없습니다  
12-19-2017,2017,12,19,19:41,화요일,10,6,0,까꿍(icar****),영화가 끝나는 시점에 아직 첫돌도 않된 세상에서 제일 이쁜 내 딸이 한문장을 완성해서 한마디 하더라... 평생 기억에 남을꺼 같다... 라고...  
12-18-2017,2017,12,18,16:18,월요일,10,6,0,hida****,스티비 원더가 극찬한영화...  
12-18-2017,2017,12,18,02:19,월요일,10,6,0,jofo****, 고작 평점이 9.31이라는게 믿기지 않네요. 제 인생에 더 없을 영화라서 10점 드리고 갑니다. 유일하게 예고편을 보다 감격을 금치 못하고 처음 느껴보는 격한 감정에 손 떨며 재생을 멈춘 영화입니다. 아직도 눈물이 흐르네요..  
12-17-2017,2017,12,17,22:57,일요일,10,6,0,미르(fodl****),최고의 인생영화 입니다 별점테러들은 관종인가.ㅡㅡ  
12-17-2017,2017,12,17,10:01,일요일,10,6,0,고명환(mhko****),100점이 있다면 100점 모두를 줘도 아깝지 않은 명작입니다. 이런 명작에 우리들의 우상 스티븐 시걸아저씨가 의리출연했다는것이 이것이 명작이라는것의 반증이지요.  
12-17-2017,2017,12,17,09:45,일요일,10,6,0,비료먹을(powe****),모두가 함께 공유하길 바라며 10점 드립니다.  
12-17-2017,2017,12,17,07:42,일요일,10,6,0,석이아빠(jiny****),내 인생 영화중 하나이다.  
12-17-2017,2017,12,17,02:05,일요일,10,6,0,whwj****,클레멘타인이 개봉되고 개발된 상품이 성인용 기저귀라는 사실은 클레멘타이너들에게 널리 알려져있다. 반드시 기저귀를 착용하고 봐라. 영화에 몰입하면 지리는줄도 모른다. 20번 정도는 봐야 제어가 가능하게 된다.  
12-16-2017,2017,12,16,19:30,토요일,10,6,0,kajajj(byd0****),희대의 명작이다 꼭봐라  
12-16-2017,2017,12,16,17:59,토요일,10,6,0,이슈거리(end_****),심금을 울리는 영화입니다. 눈물흘리고 싶을 때 보면 좋습니다..  
12-16-2017,2017,12,16,16:38,토요일,10,6,0,절대멋쟁(peh1****),제가 감히 이 영화를 판단할 자격이될지 모르지만 지금 네이버 담당자에게 건의합니다 10점은 너무 가옥하지않나요?  
12-16-2017,2017,12,16,14:03,토요일,10,6,0,Tempester(kman****),진짜 명작이다..!!  
12-16-2017,2017,12,16,10:58,토요일,10,6,0,Icpa Aero(tomk****),최근에 본 영화 중 제일 역대급 띵직입니다  
12-16-2017,2017,12,16,10:31,토요일,10,6,0,업다구(xren****),이제야 보다니 부끄럽습니다  
12-16-2017,2017,12,16,01:14,토요일,10,6,0,madm****,내일 아버지를 꼭 안아드리고싶습니다  
12-15-2017,2017,12,15,16:26,금요일,10,6,0,파란얼음(blue****),솔로들이여..난 8녀전에 이 영화를 당시 여친에게 보여 줬었다..그리고..그 여친은 지금 나의 와이프가 되었다.솔로부대원들이여..지금 당장 썸녀에게 보여주고 커플 부대로 입영하라..  
12-15-2017,2017,12,15,01:46,금요일,10,6,0,khar****,최고란 말밖엔....  
11-21-2017,2017,11,21,21:36,화요일,9,6,0,호(hanm****),솔직히 구라안치고 재밌음  
11-21-2017,2017,11,21,11:47,화요일,10,6,0,맨체스터육나이티드(rlac****),"평창올림픽 개막식 상영 추진운동 진행중입니다. 김치, 탈춤, K-POP 등등 다 좋습니다. 하지만 클레멘타인에 비하면 아무것도 아닙니다. 세계인에게 우리의 자랑스러운 역작을 선보입시다.  "
10-19-2017,2017,10,19,13:36,목요일,10,6,0,gold****,태어나지도 않은 딸이 무척 그립습니다.  
10-18-2017,2017,10,18,19:29,수요일,10,6,0,데이트레이더(trad****),도데체 클맨2 는 언제 제작되는가  
10-17-2017,2017,10,17,08:33,화요일,9,6,0,lsm1****,말리부를 타면서  허리디스크를 치료했지만 비염은 고칠수 없었습니다  하지만 이영화를 본후  비염이 말끔히 사라졌습니다...  제여친도 사라졌습니다...  
9-28-2017,2017,9,28,11:22,목요일,10,6,0,플러스(himi****),노아의 방주가 있다면 이 DVD를 꼭 실어야한다.  
9-23-2017,2017,9,23,19:00,토요일,10,6,0,김현우(kho8****),심청이가 공양미 300석을 3만석으로  돌려받았다고해서 보러갑니다  
9-23-2017,2017,9,23,17:34,토요일,10,6,0,하하하(anta****),"남자는 태어나서 세번 운다. 첫번째는 클레멘타인을 봤을 때, 두번째는 김치워리어를 봤을 때, 세번째는 리얼을 봤을 때  "
9-16-2017,2017,9,16,17:42,토요일,10,6,0,쿠리쿠리(ghba****),네? 이 영화를 극장에서 본사람이 있다구요? 그게 바로 접니다.  
8-7-2017,2017,8,7,11:31,월요일,10,6,0,컴터핥짝(bts5****),평점 깎아내리는 낚시글 몇개있는데 제발그만해라 이기적인새끼들아 좋은건 나누는거다  
8-3-2017,2017,8,3,09:21,목요일,10,6,0,유영미(kwak****),그렇게 재미있나요?... 평점이 엄청 높네.  
7-23-2017,2017,7,23,16:01,일요일,10,6,0,따듯한콩(fpah****),아빠 일어나!!!!아빠 다시 누워!!!!  
7-20-2017,2017,7,20,21:51,목요일,10,6,0,jinx056(siny****),좋은 영화인 것 같습니다.  
7-10-2017,2017,7,10,20:21,월요일,10,6,0,뽀잉뽀잉(dksw****),"영화 보는 이유를 드디어 찾았네요. 마지막 장면은 엄청난 여운을 남깁니다. 흑흑 I like TT, just like TT  "
7-6-2017,2017,7,6,02:51,목요일,10,6,0,윤군(lion****),성지 순례 다녀갑니다. 성불 하소서..  
6-29-2017,2017,6,29,21:05,목요일,10,6,0,최민규(haro****),리얼의 감동이 전해집니다.  
6-29-2017,2017,6,29,10:16,목요일,10,6,0,joyful(cin9****),"싸움장면이 ""리얼""했네요  "
6-3-2017,2017,6,3,20:17,토요일,10,6,0,람보(team****),내 인생 영화 최고의 걸작  
5-29-2017,2017,5,29,13:49,월요일,10,6,0,한비광(umi7****),아직도 눈물이 멈추지 않습니다. 저는 이 영화를 10여년 전에 보았습니다.  
5-28-2017,2017,5,28,02:00,일요일,10,6,0,백진욱(hany****),말이 필요 없습니다. 전설 그 자체.  
5-27-2017,2017,5,27,17:44,토요일,10,6,0,배꼼이(wb10****),정말 감동입니다....  
5-20-2017,2017,5,20,13:49,토요일,10,6,0,네이마르(kty1****),이영화를 만드신 감독님 그리고 열연해주신 배우분들께 감사합니다 저 열심히 살겠습니다  
5-18-2017,2017,5,18,21:43,목요일,10,6,0,아크로열(kws7****),내가 사는 시대에 이런 영화가 있다는 것이 영광일뿐  
5-18-2017,2017,5,18,16:46,목요일,10,6,0,컨피런스(ildo****),왜 이제서야 봤는지 제 자신을 이해할 수 없습니다.  
5-17-2017,2017,5,17,17:29,수요일,10,6,0,미나리(zig0****),전국민이 각각의 인생에서 1시간 40분정도는 낭비할 수도 있잖아요. 그래서 10점드립니다  
5-6-2017,2017,5,6,10:20,토요일,10,6,0,Peter(pete****),눈물이 앞을 가리는 영화... 다시 개봉하길 간절히 바랍니다이런 영화를 짪은 인생중 볼 수 있다는것은 신의 선물이겠지요  
5-6-2017,2017,5,6,00:48,토요일,10,6,0,포르쉐(crj1****),개 재밌음  ㅅㅅㅅ   소름돋음  
4-30-2017,2017,4,30,14:45,일요일,10,6,0,머리아픔(ljb7****),내인생 최고의 영화 안보신분들 꼭 보세요  
4-29-2017,2017,4,29,13:42,토요일,10,6,0,이녀기(inhu****),극장에서 재개봉했음좋겠어요ㅎ  
4-23-2017,2017,4,23,16:18,일요일,10,6,0,겨울이진리(jeto****),10점이 만점이지만 제 감동점수 90점을 더해서 100점을 드리고 싶은 작품입니다  윤동주님의 시만큼 아름다우며  피라미드의 웅장함을 가진 영화네요 문화유산으로 지정해서 후손들에게 대대로 물려주고 싶은 영화입니다  
4-21-2017,2017,4,21,11:48,금요일,10,6,0,솔츠코리아(soul****),2004년 군전역과 동시에 이 전설적인 영화가 개봉하였다. 사람들은 군대를 다녀오면 새사람이 된다고 하지만 나는 그렇지 않다. 나는 이영화를 보고나서 새사람이 되었다. 이동준선생님 정말 감사합니다.  
4-15-2017,2017,4,15,21:49,토요일,10,6,0,Blackpowder(kims****),내 인생에서 이렇게까지 충격적인 영화는 또 없었다.  
4-13-2017,2017,4,13,21:17,목요일,10,6,0,블마(rien****),성지순례 왔습니다. 역시나네요  
4-12-2017,2017,4,12,20:42,수요일,10,6,0,gnfkdlem(frid****),긴말안한다. 이거슨 진리요  
4-12-2017,2017,4,12,01:58,수요일,10,6,0,라냐(kimk****),우리가 잊지 말아야 할 명작  
4-9-2017,2017,4,9,18:38,일요일,10,6,0,STIMM(hms3****),",.,..,,.,.,.  "
4-7-2017,2017,4,7,11:26,금요일,10,6,0,시절이하수상하야(ffan****),전설엔 이유가 있는 법이다.  
4-6-2017,2017,4,6,10:50,목요일,10,6,0,포르도(lets****),와 대한민국에서 이런 명작이!! 죽기전에 꼭 봐야할 영화로 no.1입니다.. 꼭들 보셔요 .. 살아있다는것에 감사함에 눈물이 납니다  
4-3-2017,2017,4,3,03:50,월요일,10,6,0,zzop****,내일 군입대 하는데 이 영화를 보게되었습니다. 처음엔 킬링타임용으로만 생각했는데 그게 아니더군요 자대가서 선임들이 '재미있는 이야기 해봐' 할때 전 주저없이 '클레멘타인' 스토리를 들이밀것입니다...  
4-2-2017,2017,4,2,11:23,일요일,10,6,0,몰리(pola****),내일 지구가 멸망하더라고 나는 사과나무 한 그루를 심고 집으로 돌아와 클레멘타인 볼 것이다  
3-18-2017,2017,3,18,20:29,토요일,10,6,0,이용훈(yong****),죽기전에 꼭 봐야할 영화  
3-18-2017,2017,3,18,14:37,토요일,10,6,0,랩슨(hana****),오우 영화 참 잘 만들었네  
3-16-2017,2017,3,16,18:46,목요일,10,6,0,사이다(klea****),7광구 보며 썩은 눈 이 영화를 보고 치료가 되었다  
3-16-2017,2017,3,16,15:28,목요일,10,6,0,박성찬(psc9****),클레멘타인최고임~~~~  
3-13-2017,2017,3,13,10:38,월요일,10,6,0,오사랄근혜(myna****),오스카가 외면한 이유를 모르겠네여....스티븐도 출연했는데 ㅜㅜ  
3-8-2017,2017,3,8,19:48,수요일,10,6,0,20330(choj****),죽기직전에  꼭 봐야하는 영화진짜 명작이다  
3-6-2017,2017,3,6,23:18,월요일,10,6,0,회색(spda****),최고의 영화.  인생역작  
3-6-2017,2017,3,6,01:16,월요일,10,6,0,hwan****,이건 혁명이다. 인셉션 이후로 영화보고 휴유증 온건 처음임ㅠㅠ  
3-5-2017,2017,3,5,05:34,일요일,10,6,0,효진이(dnfl****),명작입니다 꼭보세요 강추  
2-28-2017,2017,2,28,22:23,화요일,10,6,0,tmda****,2004년부터 삶의활력소가 되는영화..  
2-21-2017,2017,2,21,08:58,화요일,10,6,0,논리충 만세(lim1****),이영화는 10점 짜리 영화이다  
2-20-2017,2017,2,20,17:35,월요일,10,6,0,그렇구나(jeoj****),"어떻게 이런 명작인 영화를 보고 그냥 지나칠수있겠습니까?  한국사람이면 한번씩 꼭 느껴보는 아픔 , 고통 그게 전부 표현이 되있는 영화입니다.  아직도 손이 떨리며 눈물이 글썽글썽 거리며 눈물 한방울이 뚝.★대한민국 최고의 영화!! 강력 추천합니다!  "
2-20-2017,2017,2,20,17:20,월요일,10,6,0,김수정(vusf****),그 어떤 영화도 이 영화를 이길 수 없다.  
2-15-2017,2017,2,15,22:03,수요일,10,6,0,KOR스퍼스(spur****),아 시@발 한국영화사에서 클레멘타인을 제외하면 논할 게 없다  
2-1-2017,2017,2,1,04:00,수요일,10,6,0,vdjlanilvdajhlkjvn(juka****),한번만 봐도 소원이 이루어진다는 그영화인가요? 하지만 클레멘타인을 본후... 이젠 인생에서 바랄 소원이 없게되었습니다.  
1-30-2017,2017,1,30,03:14,월요일,10,6,0,셔터챤스(abyl****),아이의 앞니가 사라졌다가 나타나기를 몇번.. 내정신이  혼미한 가운데 기적을 보았습니다.  
1-29-2017,2017,1,29,11:32,일요일,10,6,0,후랄(hv07****),평생의 시간보다 이 영화를본 100분의시간이 더 가치있었다  
1-13-2017,2017,1,13,17:27,금요일,10,6,0,csow****,노아가 살아있었다면 이 영화를 방주에 실었겠죠 아마.  
1-1-2017,2017,1,1,09:43,일요일,10,6,0,나니노(blue****),친구들이 추천해서 집에서 혼자 봤습니다. 이런 영화 살면서 본적이 없습니다. 이 자리를 빌어 이런 희대의 명작을 보게해준 내 친구들에게 감사를 표합니다. 저도 누군가에게 이런 친구가 되고 싶네요 ^^클레멘타인 자신있게 추천드립니다!!  
12-23-2016,2016,12,23,21:35,금요일,10,6,0,포비(slte****),;영화역사상 가장 극적이고 감동적인 명대사아빠! 일어나!!!  
12-11-2016,2016,12,11,13:56,일요일,10,6,0,웃지요(grug****),헐리우드 영화배우 탐크루즈 입니다 2004년 우연히 시걸형님의 소개로 존리의 클레멘타인을 보게 되었는데 바로 한국어와 한글을 배우게 되었습니다 아빠 일어나! 하는 대사의 의미를 간절히 깨닫고 싶었습니다  
11-21-2016,2016,11,21,21:34,월요일,10,6,0,김정훈(befr****),이 영화를 보고 우리집 개가 말문이 터지며 두발로 걸었네요.  
11-18-2016,2016,11,18,14:05,금요일,10,6,0,Buffalo Boy(ahfm****),아빠 일어나를 듣고 눈물을 닦으려 휴지를 찾고 있었는데 옆에 멍군이가 두 발로 일어나 휴지를 주더라  
11-18-2016,2016,11,18,01:49,금요일,10,6,0,네아이이버디(vhxj****),명작이다! 대한민국 국민이 봐야하는 국민영화!  
11-16-2016,2016,11,16,00:18,수요일,10,6,0,영쩜일초(thom****),"깡소주 마시고 샌드백을 치는 감정연기 압권이었음. 그리고, 사랑이 신들린 연기 또한 일품.  "
11-14-2016,2016,11,14,22:33,월요일,10,6,0,한 가린(dmsq****),인생을 그리 길지 살지 않았지만 제가 이 영화를 볼고 인생에 흘릴 눈물을 전부 흘리고 가는거 같습니다.  
11-14-2016,2016,11,14,03:20,월요일,10,6,0,레미지오(yoo6****),스티븐 시걸 섭외하는데 그렇게 공을 들였다더니... 아직도 안 봤다면 당신은 살아도 살아있는 것이 아니다. 꼭 봐라. 세 번 봐라.  
11-6-2016,2016,11,6,22:58,일요일,10,6,0,똑똑한 도희(ksa7****),클레멘타인의 맛은 따라갈려고 해도 따라갈 자가 없다  
11-5-2016,2016,11,5,15:27,토요일,10,6,0,sora****,당신이 훗날 몹시 지쳐 자신을 이끌어갈 용기가 나지 않을 때 이 영화를 본다면 삶에 대한 시각이 판이하게 달라질 것이다. 그래서 난 이 영화를 감히 판도라의 상자에 비유하고 싶다.  
10-18-2016,2016,10,18,15:58,화요일,10,6,0,로이(blin****),아직 클레멘타인을 못 봤는데 수많은 분들의 추천으로 오늘 저녁에 꼭 볼 계획입니다. 설레네요. 손수건과 속옷 두 장씩 준비하면 되나요?  
10-18-2016,2016,10,18,14:32,화요일,10,6,0,powe****,이 영화를 보고 옜 여자친구에게서 전화가 왔습니다.  
10-7-2016,2016,10,7,22:24,금요일,10,6,0,엄탱(suaf****),지식인의 추천에 영화를 보았다. 후회없는 선택이었다.  
10-7-2016,2016,10,7,10:27,금요일,10,6,0,time(akak****),아빠!! 일어나!! 라는 외침에 정신이 번쩍했고 놀랍게도 이미 영화는 끝나있었다.  
10-5-2016,2016,10,5,13:51,수요일,10,6,0,서울TL본좌(fore****),저는 앞을 보지못하는 맹인입니다.  그런데  이 영화를 보고  지금 시력이  6.0 입니다.  
8-23-2016,2016,8,23,17:11,화요일,10,6,0,zerg****,개구라네...막 평점10점 낚시라고해서 그냥 자기전에 자장가 대신하면서 볼려했는데 ㄹㅇ 그날밤은 잠을못잣다.평점 낮게주는 ㅅㄲ들 관종이냐...이건 진짜 인생영화입니다.주무시던 아버지도 일어나시게한 아빠일어나는 영원한 명장면으로 기억될것입니다.  
8-16-2016,2016,8,16,10:56,화요일,10,6,0,ROO(tank****),영화를 보고났더니 왜들 그러는지 알것같아요  
8-13-2016,2016,8,13,18:26,토요일,10,6,0,딩이(rkde****),역시 평점은 거짓말을 하지 않더군요..  
8-8-2016,2016,8,8,11:37,월요일,10,6,0,김현미(hyun****),어찌 감히 인천상륙작전 연관 영화란 말인가...최소 아카데미상을 휩쓴 타이타닉정도는 돼야....하거늘...  
8-7-2016,2016,8,7,00:12,일요일,10,6,0,Hikaru(copy****),말이 필요 없는 명작 ㅇㅇ  
8-6-2016,2016,8,6,21:04,토요일,10,6,0,유(ohvc****),이 영화를 보아야 진정한 영화  
8-4-2016,2016,8,4,12:47,목요일,10,6,0,배쟈(sner****),신은 클레멘타인을 만들었고 그걸 자랑하기위해 인간을 만들었다  
7-31-2016,2016,7,31,01:30,일요일,10,6,0,곤잘로 문과인(medi****),이건 전세계인이 봐야하는 영화다  
7-18-2016,2016,7,18,00:34,월요일,10,6,0,Simpsontic(brea****),"아카데미 최고작품상, 칸 황금곰상을 수상했어야 하지만 아시아 작품이라는 이유로 차별당한 비운의 명작.  "
7-10-2016,2016,7,10,17:42,일요일,10,6,0,베개싸움(fran****),명작을 보기위해선 먼저 그것을 느끼고 이해할 수있는 사람이 되어야 할 것이다  
7-7-2016,2016,7,7,00:10,목요일,10,6,0,ds02****,이 영화를 보기전까지는 악성 안구건조증으로 늘 눈물약을 달고 살았습니다. 나에게 눈물은 없는것일까... 지푸라기라도 잡는 심정으로 이 영화를 보았습니다. 기적입니다.눈물이 쉴새 없이 흐릅니다. 홍수같은 눈입니다. 이제 눈물약을 사지 않습니다.감사합니다  
6-24-2016,2016,6,24,03:05,금요일,10,6,0,마음이(ysin****),영화보고 지구로 귀화했습니다 - ET  
4-24-2016,2016,4,24,15:21,일요일,10,6,0,하늘이(suji****),이 영화를 보고 암이 나았습니다. 친한 친구와 보러갑시다. 이 시대의 최고의 명작이라 해도 될 정도로 너무 감동적입니다. 점수테러하지 맙시다. 이 명작에 왜 별점테러 하는지 이해가 되지 않는군요. 일어나라 네티즌들이여!  
4-21-2016,2016,4,21,23:05,목요일,10,6,0,FatSeal(jonw****),암세포가 암이 걸려서 암이 나았습니다 감사합니다  
4-19-2016,2016,4,19,10:14,화요일,10,6,0,firstBlack(shb0****),똥꼬긁으면서 보는 영화  
4-5-2016,2016,4,5,12:58,화요일,10,6,0,까불면(jdgo****),음 역시 여전히 대한민국 일등 영화를 고수하고있군요 응당 맞는 처사입니다 이 주옥같은 영화가 있기에 오늘날에 한류가 있는것이고 감동 영화가 있는것입니다  
3-28-2016,2016,3,28,18:06,월요일,10,6,0,이거몇자까지가능해요(yong****),이 영화를 틀자 식물인간인 제 남편이 고개를 돌렸습니다.  
3-24-2016,2016,3,24,13:51,목요일,10,6,0,최루카스(choi****),평점을 믿었고 난 그 믿음에 보답받았다. 세상은 아직 살만하구나. 고맙습니다. 모두들..  
3-19-2016,2016,3,19,20:08,토요일,10,6,0,좌절금지(dong****),사우스포  보기전에 꼭 보라고 해서 봤는데 사우스포를 볼 생각이  없어졌습니다.  
3-16-2016,2016,3,16,02:20,수요일,10,6,0,kik1998(kik1****),"영화가 보고싶던 어느날  친구에게  영화추천을 좀해달라고 했습니다 친구는 말하더군요 ""너 클레멘타인 봣냐? 안봣으면 꼭봐라 인셉션 정도는 뛰어넘는 명작이다"" 라고  당당히 말하는 그모습에 보고야 말았습니다 그리고 느꼈습니다 이명작을 널리 퍼뜨려야겟다고  "
3-11-2016,2016,3,11,21:15,금요일,10,6,0,지옥인(cldy****),와... 증말 재미있네요... 14시간째 감동으로 인해 벌어진 입근육에 경련이 와서 입이 안다물어집니다;;;  
3-11-2016,2016,3,11,02:47,금요일,10,6,0,곰돌이도웨펀(gayn****),교실에서 이 영화를 보여줬습니다. 학생들의 눈물소리가 들렸습니다.  
3-8-2016,2016,3,8,16:14,화요일,10,6,0,삐야아아아(kjae****),신은 우리에게 클레멘타인을 주셨다.  
3-8-2016,2016,3,8,01:59,화요일,10,6,0,헬로우(mp11****),남자만이 알 수 있는 뜨거운 감동  
3-7-2016,2016,3,7,22:49,월요일,10,6,0,페르난도우토우레쓰(lllp****),"클-멘, 말이 더 필요한가?  "
2-22-2016,2016,2,22,08:27,월요일,10,6,0,키야(mari****),어제부로 인생 전재산 투자한 사업 정리 했습니다.. 정확히 말하면 망했죠....인터스텔라 처럼 과거로 돌아가 OOO  사업 하지마 제발 하지마 말해주고 싶을정도로 우울하지만 이 영화 덕분에 다시 힘을 얻습니다. 감사합니다.  
2-19-2016,2016,2,19,14:13,금요일,10,6,0,je77****,아빠 어디가PD는 클레멘타임에게 저작료를 갖다 줘야 한다.  
12-31-2015,2015,12,31,02:06,목요일,10,6,0,운동하고알베스(duqr****),클레멘타인 안본 눈 삽니다 ㅠㅠ 다시 처음 본 그 감동을 느끼고 싶어요  
12-26-2015,2015,12,26,19:23,토요일,10,6,0,ㅇㅈ(dbsd****),이 영화를 보고 비염이 나았습니다  
12-26-2015,2015,12,26,13:33,토요일,10,6,0,스톡홀름(rkdf****),이 영화를 만든 감독과 단둘이 마주보고 이야기 하고싶다. 어떻게 이런 영화를 만들 수 있느냐고 묻고싶다.  
12-24-2015,2015,12,24,17:00,목요일,10,6,0,www(melo****),나는 보고 울었는데 왜 다들 그래여;;;  
12-16-2015,2015,12,16,18:44,수요일,10,6,0,허시원(calv****),이동준의 똥꼬마저 들썩이게 만든 명작  
12-4-2015,2015,12,4,12:11,금요일,10,6,0,아거(ks_r****),"명작만 찾아보는 일종의 강박증이 있는 나에게 '명작' 이라는 단어의 정의를 송두리째 뒤집어 버린 영화. 내가 지금까지 본 명작이라 불리우는 영화들을 무참히 짓밟아버렸다. 하지만 여기서의 '짓밟음'은 나의 가치관을 향한 광명이오, 혁명이다.  "
11-30-2015,2015,11,30,21:56,월요일,10,6,0,태풍(ahsl****),이런 스팩타클한 작품은 아이맥스에서 봐야됩니다.부탁합니다 설탕님  
11-25-2015,2015,11,25,02:19,수요일,10,6,0,kkm1****,남자는 일생에 세번 운다고한다. 태어났을때. 부모님이 돌아가셨을때. 그리고 클레멘타인을 봤을때  
11-1-2015,2015,11,1,23:54,일요일,10,6,0,아티스트CHAE(zv8c****),"개봉 당시 영화관에서 봤는데 ""아빠 일어나!!"" 를 듣고 저도 모르게 자리에서 일어났습니다....  "
10-28-2015,2015,10,28,07:30,수요일,10,6,0,블로백(sosk****),이 영화를 보고있는데 어머니께서 클레멘타인을 보는 저를 보시더니 우리아들 정신차렸구나 하고 말씀하셧습니다. 이영화 정말 10점도 낮은 점수입니다. 감동의끝입니다. 꼭보세요.  
10-26-2015,2015,10,26,22:57,월요일,10,6,0,쀼잉뀨잉(led_****),이 영화를 보고 서울대에 합격했습니다.  
10-23-2015,2015,10,23,13:34,금요일,10,6,0,단테(next****),만약 내일 지구가 망한다면 난 사과나무를 심는 대신 이 영화를 다시 한번  더  보고싶다.  
10-20-2015,2015,10,20,01:08,화요일,10,6,0,퍼트(kync****),"불멸의 명작, 추천합니다.  "
8-29-2015,2015,8,29,14:35,토요일,10,6,0,럭키쿠키보이(min9****),암세포가 암에걸려 암이 나았다는 전설의 영화..  
8-24-2015,2015,8,24,18:12,월요일,10,6,0,부처(work****),명작은 같이봐야하는거다.. 1점주는 분들.. 자기혼자 볼려고 그러시는거 다 알아요.. 이거만한 세기말 명작은 다시는 없을듯  
8-8-2015,2015,8,8,23:48,토요일,10,6,0,디아(thya****),"예수와 클레멘타인의 공통점은, 처음에는 박해를 받았으나, 종래에는 모두의 희망이 되었다는 것이다.  "
7-22-2015,2015,7,22,19:21,수요일,10,6,0,김아무개(xien****),영화를 보며 가슴이 먹먹했던건 이 영화가 처음이다... 평생 기억에 남을 명작중에 명작... masterpiece란 바로 이런 것임을 느끼게 해 준 영화.. 다시한번 외쳐본다. 아빠! 일어나!!!  
7-4-2015,2015,7,4,09:50,토요일,10,6,0,라르크(make****),별10개도 안아깝습니다.... 이런슬픈영화는 더이상 만들지 말아주세요....제발요...  
6-21-2015,2015,6,21,19:31,일요일,10,6,0,커피우리(thsu****),보지 않은 사람들이 부러워지는 영화.. 볼때마다 머릿속을 포맷하고 계속 보고싶네요..  
6-19-2015,2015,6,19,12:58,금요일,10,6,0,야도란(gusw****),걍 봐라 초명작.. 눈물이 주르륵 흐른다  
6-15-2015,2015,6,15,13:49,월요일,10,6,0,성원(haki****),대한민국 국민인게 자랑스럽습니다.  
6-14-2015,2015,6,14,20:34,일요일,10,6,0,180이되고싶은아이(lhy0****),청각장애엿던 제가 이영화를 보려고 와우수술을 햇습니다결국은 만족스럽군요  
6-13-2015,2015,6,13,20:33,토요일,10,6,0,민(minr****),"클라멘타인. 영어로 뜻은 귤, 그렇습니다. 귤은 맛있습니다.  "
6-13-2015,2015,6,13,03:33,토요일,10,6,0,ㅎㅏ루(luck****),이영화를 보고 역류성식도염이 나았습다!  
6-8-2015,2015,6,8,23:29,월요일,10,6,0,서얄(moco****),ㅋㅋ평가 개웃겨.. 근데 재밌어요 진짜 펑펑 울긴 했어요 ㅠㅠㅠㅠ  
6-7-2015,2015,6,7,02:59,일요일,10,6,0,핸섬가이(shro****),당신에게 이 세상의 마지막 100분이 주어진다면 꼭 이 영화를 보십시오.  
6-4-2015,2015,6,4,12:26,목요일,10,6,0,탑츈(firs****),왜 10점 밖에 줄수없는가...흘린 눈물에 비례하면 점수로 환산할수없다...  
5-10-2015,2015,5,10,14:47,일요일,10,6,0,ㄹㄹ(enas****),1점을 준 자들은 모두 이기적인 자들이다!!  
2-1-2015,2015,2,1,22:43,일요일,10,6,0,imkj****,인생은 Birth(B)와 Death(D)사이의 Clementine(C)이다  
1-24-2015,2015,1,24,00:37,토요일,10,6,0,내리막(spar****),"""아빠 일어나! ""  그 작은 외침이 아직도 가슴을 먹먹하게 하네요.  "
1-11-2015,2015,1,11,23:26,일요일,10,6,0,클라이언트 패치(oh74****),내 인생에서의 가장 큰 소원은 이 영화를 보기 전으로 되돌아가서 그 감동의 대 서사시를 다시 느끼고싶다는것이다  
1-11-2015,2015,1,11,18:09,일요일,10,6,0,ㄷㅇㄴㄹㅇㅍㅌㅊㅍ(kill****),이 영화를 보고 이 위대한 작품을 진작에 보지않은 제 자신이 부끄러워졌습니다.  
1-10-2015,2015,1,10,23:37,토요일,10,6,0,milk****,넘울어서 배가 찢어질것같애  
1-10-2015,2015,1,10,12:52,토요일,10,6,0,카이니(2gro****),인터스텔라와  동급의 영화..  
1-6-2015,2015,1,6,19:40,화요일,10,6,0,이글이글(mp3t****),무조건 10점이다 오늘 퇴근해서 또본다  
12-11-2014,2014,12,11,01:44,목요일,10,6,0,반찬(maxi****),"믿음 사랑 소망, 그중 으뜸은 클레멘타인이다.  "
11-28-2014,2014,11,28,17:11,금요일,10,6,0,카레오페(qnpf****),클레멘타인 안본뇌삽니다  
11-24-2014,2014,11,24,20:24,월요일,10,6,0,0103****,아직도 여운이 감돈다....  
11-20-2014,2014,11,20,10:45,목요일,8,6,0,둥심이(sko9****),얼마나 명작인지 하고 본 작품인데 개인적으로 재밌게 보긴 했습니다만레옹이나 쇼생크탈출정도의 작품으로 비교하기엔 무리가 있는거 같네요 ㅋ아 그래도 한국영화에서 이정도 감동과 재미를 주는 작품은 손에 꼽을정도긴 한건 인정합니다.  
11-18-2014,2014,11,18,12:17,화요일,10,6,0,Tommyj(jec0****),한강의 80프로는 바로 이영화를 보고 사람들이 흘린 눈물입니다...  
11-14-2014,2014,11,14,21:02,금요일,10,6,0,할일없는사람(emul****),"수년 전이었습니다. 그때 저는 극성 암에걸려서 방황하며 살아있는 이유 따위 없이 허망하게 죽음을 기다리기를 결심했었습니다. 그러던 중 어떤 아저씨께서 ""자네 아직 클레멘타인을 보지 못했나? 그렇다면 아직 살아있는 이유를 하나 간직한 것일세.""라  "
9-10-2014,2014,9,10,14:33,수요일,10,6,0,뚜껑열림(rjsq****),이런 영화는 처음입니디ㅏ  
9-6-2014,2014,9,6,11:51,토요일,10,6,0,Karen(kare****),별점낚시라는 말이 있어서 속는셈치고 영화를 봤습니다. 앞으로 감동이라는 말을 들으면 클레멘타인이 생각날것이고 인생의 터닝포인트를 묻는다면 클레멘타인을 본 후라고 대답할것이며 일어나라는 말을 들으면 눈물이 흐를것 같습니다.  
9-6-2014,2014,9,6,10:37,토요일,10,6,0,못된너부리(0123****),내인생의 최고의영화꼭 보시길...  
8-15-2014,2014,8,15,19:09,금요일,10,6,0,ㅎㅇ(pjh9****),클레멘타인.. 시대의 역작 다세포소녀와 양대산맥을이루는 전설의 영화 2번봐도 흐르는 눈물을 멈출수없다  
7-28-2014,2014,7,28,15:44,월요일,10,6,0,로사리오(losa****),냉정하게 평가해도 한국영화 역사상 최고의 영화!!!  
7-18-2014,2014,7,18,18:36,금요일,10,6,0,오래된미래(maph****),아빠 일어나! 관객석을 울리는 감동의 한마디  
7-18-2014,2014,7,18,16:25,금요일,10,6,0,leeh****,눈물이 떨어졋습니다 아름다운 영화  
7-17-2014,2014,7,17,23:50,목요일,10,6,0,몰라(diag****),입에 담기도 내게는 부끄러운 그런 영화다 감히 내가 어찌이영화를 입에 담을수있을까. 이영화를 보고 나는 살아있음을느꼈다  
7-17-2014,2014,7,17,17:48,목요일,10,6,0,푸른소금(hail****),클레멘타인2 의 빠른 제작을 기대해봅니다!  
7-17-2014,2014,7,17,13:43,목요일,10,6,0,영수사과국(cnvk****),클레멘타인에게는 수식어가 붙지않는다. 그 자체가 수식어이기 때문이다.  
7-17-2014,2014,7,17,13:37,목요일,10,6,0,감자(hann****),"죽기전 단 한가지 소원이 있다면, 이 영화를 보면서 눈을 감는것이다.  "
7-17-2014,2014,7,17,03:14,목요일,10,6,0,쭈니(dnas****),속보) 스티븐 스필버그사단 리메이크판권 독점계약!!  
7-17-2014,2014,7,17,02:33,목요일,10,6,0,유후우(tv87****),재개봉 기원합니다.. 정말 명작  
7-17-2014,2014,7,17,00:32,목요일,10,6,0,최우진(soso****),역대급 스토리 똥꼬가 다 시원한 영화  
6-13-2014,2014,6,13,08:56,금요일,10,6,0,사진찍는디자이너(park****),아직 안봤지만 벌써부터 감동이 밀려오는 영화  
6-13-2014,2014,6,13,04:06,금요일,10,6,0,nand****,영어판이 나왔으면  2500만년전 탄자니아에서 유인원이 탄생한 이후로 가장 전세계 사람들을 감동하게 만들었을 대작...  
6-12-2014,2014,6,12,22:25,목요일,10,6,0,한글이라구요(rhax****),"대한민국의 영화 발전에 ""이렇게 찍으면 성공한다""라는 엄청난 교훈을 남겨준 작품이다. 영화 발전의 한계단인 전설의 작품이니 꼭 보는 것을 추천한다.  "
6-12-2014,2014,6,12,04:33,목요일,10,6,0,블랙박스(kaza****),재개봉이 된다면 스크린앞에서 그 감동을 다시 느껴보고싶네요. 평점 9.5점대 이상 넘어가면 그꿈이 이루어질 수 있겠죠?  
6-11-2014,2014,6,11,22:16,수요일,10,6,0,cham****,10점이 아깝지 않네요 마지막엔 감동에 눈물이 주르륵1시간이 그냥 확 갔네요 차한잔 마시면서 보시는걸 추천합니다^^  
6-6-2014,2014,6,6,20:57,금요일,10,6,0,오후(medi****),"엑스맨, 엣지오브보다 훨훨 잼난데 ㅜㅜ  "
6-4-2014,2014,6,4,02:44,수요일,10,6,0,그르렁(jsns****),네이버 평점을 사실 그동안 신뢰하지 못했었는데 이 영화를 보고 네이버 평점을 믿게되었습니다. 중반까지는 조금 지루한 감이 있는데 마지막에서 정말 폭풍 눈물나네요...제 인생 최고의 영화입니다.  
7-25-2013,2013,7,25,15:00,목요일,9,6,0,show****,ㅋㅋ최고 최고  
7-19-2013,2013,7,19,00:05,금요일,10,6,0,khb0****,아빠 일어나~~그 한마디에 난 모든걸 버렸다  
7-18-2013,2013,7,18,22:40,목요일,10,6,0,곰지(minj****),언제봐도  최고의 감동영화.  
7-18-2013,2013,7,18,02:04,목요일,10,6,0,스콜필드(shar****),명작은 오래가는법이죠. 아직도 이영화의 여운이 남아있습니다.  
7-12-2013,2013,7,12,22:16,금요일,10,6,0,sais****,오오  
7-12-2013,2013,7,12,18:43,금요일,10,6,0,사사로이(byju****),대 역작을 이제야 보게 되다니~ ㅜㅜ  
6-20-2013,2013,6,20,17:08,목요일,10,6,0,pari****,한국인이면 클레멘타인 봅시다  
6-17-2013,2013,6,17,16:27,월요일,10,6,0,MKTluke(minl****),생애 최고의 영화  
5-13-2019,2019,5,13,22:37,월요일,10,7,1,Fabulous(dlsw****),지금까지 느낀 슬픔은 모두 거짓임을 알게 되었습니다.비로소 참 슬픔을 클레멘타인에서 배웁니다...  
5-13-2019,2019,5,13,20:26,월요일,10,7,1,songn(tlse****),10점을 주지않는다면 당신은 아무것도 모르는 것이다.  
4-15-2019,2019,4,15,19:51,월요일,10,7,1,군똘이(jde5****),헤드셋끼고 보는도중 아빠 일어나!에 저도 함께 복명 복창했습니다...몇분뒤 아빠가 오셔서너도 이제 아빠가 될 자격을 가졌다 하고 가셨습니다..ㅠㅠ 대한민국 아빠들  파이팅!  
4-1-2019,2019,4,1,05:37,월요일,10,7,1,축알못(bang****),"내인생 최고의 영화는 3개이다. 어렸을적 보았던 원령공주,최근에 본 노트북 마지막으로 이 클레멘타인! 단연컨데 클레멘타인은 배우들의 연기, 각본, 연출 모든 부문에서 완벽한 영화라고 말해주고 싶다. 아직까지도 이런 명작을 보지않은 사람들께 적극추천한다  "
3-23-2019,2019,3,23,16:55,토요일,10,7,1,Gaegood(tspa****),실제 극장에서 내돈 주고 본사람이다 장난치지마라  
3-20-2019,2019,3,20,10:04,수요일,10,7,1,부산IN일렉트리션(kimg****),"수많은 명작을 남긴 거장 ""스티븐 스필버그""도 클레멘타인을 보고난뒤 눈물을 흘리면서 ""다시는 이런 영화가 한국이 아닌 전세계에서 앞으로 나올수 없는 명작중에 명작이라고 극찬""했다는 한국 영화의 레전드 ""클레멘타인""  "
3-20-2019,2019,3,20,04:03,수요일,10,7,1,김은경(k_03****),이걸 이제야 보다니....2004년엔 내가 뭘한건지....늦었지만 10점의 반성문 이제야 적습니다.  
3-18-2019,2019,3,18,11:54,월요일,10,7,1,주멋(14te****),이것두 영화냐? 이것이야말로 영화다  
1-27-2019,2019,1,27,02:30,일요일,10,7,1,냠냠(mjli****),저는 최근 임용고시에 합격하여 곧 초등학교 교사가 됩니다 아이들을 좋은 길로 인도하려는 꿈을 이루려면 어떻게 해야하나라는 고민중 친구의 추천으로 이 영화를 보게 됐습니다 영화를 뜨거운 눈물과 본 후 전 이 영화를 매일 아이들에게 보여주기로 결심했습니다  
1-1-2019,2019,1,1,12:42,화요일,10,7,1,왜그러나요(cart****),本?に大作です必ず見てください  
12-23-2018,2018,12,23,02:02,일요일,10,7,1,jhkim(ref3****),나만 볼순없다... 다봐라 ~~열번봐라~~  
12-16-2018,2018,12,16,04:15,일요일,10,7,1,봄빛리나(jool****),감독 혼자서 이해할수 있는 작품  
12-15-2018,2018,12,15,18:39,토요일,10,7,1,ak44****,이런 명작이 꼭보세요!!  
11-30-2018,2018,11,30,19:43,금요일,10,7,1,원도리(hdce****),세계최고의 명작!!! 꼭 보세요!!! 마지막에 너무 감동적이고 슬퍼서 세달동안 울었습니다 ㅠㅠ  
11-27-2018,2018,11,27,23:43,화요일,10,7,1,오작교(hhkk****),개명작 나만볼수없어요 꼭보세요  
11-8-2018,2018,11,8,15:01,목요일,10,7,1,푸치(vkdv****),남자는 태어나 3번 울어야된다는 공식을 깨주는 영화  
10-17-2018,2018,10,17,15:39,수요일,10,7,1,zhaxi(zhax****),이 영화를 보고 눈물이 없다면 당신은 정말 감정이 메마른것.  
10-16-2018,2018,10,16,21:08,화요일,10,7,1,아자아자(vip_****),인생영화. 남자들의 우정과 액션...  
10-15-2018,2018,10,15,08:47,월요일,10,7,1,유다(xere****),당신이 이 영화를 보지 않았다면 아직 살아있을 이유 하나를 간직하고 있는 것이다.  
9-14-2018,2018,9,14,12:05,금요일,10,7,1,사도사악(nnss****),눈물샘이 폭발해서 안구정화 제대로 했네요~  
9-7-2018,2018,9,7,13:07,금요일,10,7,1,Oilstone(para****),제약회사 수석 연구원입니다. 암을 고치는 신약개발을 위해 이영화를 보았고 직업을 바꿨습니다.  
9-5-2018,2018,9,5,22:40,수요일,10,7,1,아방아방(jsde****),"이 영화를 보고 나서 지금 똥을 싸고 있는데,, 똥은 안나오고 눈물이 똥꼬로 줄줄 흘러 내립니다  "
9-5-2018,2018,9,5,02:45,수요일,10,7,1,데이비드베컴(bosu****),이영화를 보고 발기부전이 치료되엇습니다  
7-31-2018,2018,7,31,12:04,화요일,10,7,1,이(gold****),우리가 꼭 기억해야만하는 영화 1위 굴레멘다인 보고서 휴유증이 한달간 간거같아요ㅠㅠ  
7-30-2018,2018,7,30,20:25,월요일,10,7,1,kwon9595(alwj****),지금 개봉했으면 박스오피스1위를 했을 명작.  
5-25-2018,2018,5,25,02:01,금요일,10,7,1,조영선(happ****),인류사에 남길명작 우주선에 usb 메모리칩 휴대용영상장치 등등 가득실고 우주에 뿌려서 외계생명체가 보아도 눈물을 휘날리며 감동을 받을 명작 지구생명체  인류의 시간을 초월한 위대함을 단박에 알아버릴수있는 태초의 인류의 모든것을 담아내버린 희대의 명작  
4-24-2018,2018,4,24,13:26,화요일,10,7,1,짬뽕마키야또(chen****),이영화를 보고 촛불 들고 광화문으로 갔습니다1000만명이 함께 울었습니다  
4-14-2018,2018,4,14,20:22,토요일,10,7,1,노상(nosa****),소인이 어찌 대작을 평가하리오.  
3-31-2018,2018,3,31,02:10,토요일,10,7,1,나방맛소주(hong****),2004년 그후로 14년이 지난 지금도 우리는 한잔의 소주와 클레멘타인을 이야기한다...꼭 보아야 하는 인생영화  
3-21-2018,2018,3,21,10:30,수요일,10,7,1,달팽이군(91cj****),클레멘타인을 보고 눈물을 적셨습니다. 노트북 옆 작은어항에서 키우는 베타 물고기도 울었는지 어항 물이 불어나있네요. 종을 초월하는 감동이 무엇인지 알려주셔서 감사합니다.  
3-8-2018,2018,3,8,01:10,목요일,10,7,1,강태성(whol****),난 적어도 나쁜남자 같은 저질 스럽고 ㅆㄹㄱ 같은 영화보다 순수한 마음의 어른 동화인 클레멘타인이 백배 천배 더 감동적이고 작품성이 있는 영화입니다~ 솔직히 한국영화 중에 이렇게 순수하고 감동적인 영화가 또 있을까? 100년이 넘어도 회자될 작품이죠.  
2-26-2018,2018,2,26,08:11,월요일,10,7,1,2soul(ruac****),평론가들의 평론이 왜 없는줄 아는가?이 영화는 신계의 영역이기 때문이다인간은 신의 작품을 논하면 안된다그저 감상하라 느껴라  
2-19-2018,2018,2,19,04:48,월요일,10,7,1,jjh2****,우리가 할수있는 가장큰모험은 클러멘타인을보고 감동의도가니에 빠지는것이다-스필버그-회사에서 가장어려운시기가있을때가모든직원이클레멘타인을감상하는것이다-워렌버핏-한국인이아니면만들수없는21세기최고의명작-크리스토퍼놀란-내삶의멘토는이제클레멘타인이다-로버트드니로-  
2-7-2018,2018,2,7,16:03,수요일,10,7,1,돈호세맨(ku05****),평점 관리 위원회에서 나왔습니다.  
2-7-2018,2018,2,7,15:33,수요일,10,7,1,센트럴팍(cccc****),클레멘타인 2 개봉 가즈아 모든 병이 낳는다  
2-5-2018,2018,2,5,21:12,월요일,10,7,1,gooa****,감동 입니다 ㅠㅠㅠ 모든 병이 나을수 있습니다  
12-21-2017,2017,12,21,17:48,목요일,10,7,1,하하하(wjdd****),52억써서 2억 수익낸 엄청난 영화  
12-16-2017,2017,12,16,16:54,토요일,10,7,1,anss****,넓고 넓은 바닷가에 오막살이 집한채~~  
7-5-2017,2017,7,5,10:04,수요일,10,7,1,코넬(coro****),이제  맘 놓으세요 리얼이 있자나요  
6-30-2017,2017,6,30,23:07,금요일,10,7,1,민(alsg****),"공부가 너무 힘들어  고뇌하던 중 우연히 찾은 영화 클레멘타인... 엔딩 크레딧이 올라갈 즈음엔 눈물이 앞을 가렸다. 홀로 모니터앞에서 일어나 기립박수를 쳤고, 영화가 끝이나고 공부의 흥미를 느껴 모의고사 999이던 내가 서울대학교 의학과에 합격했다.  "
6-28-2017,2017,6,28,11:41,수요일,10,7,1,이상주의자(kwj0****),이 명작 영화를 제 하드에 저장한다는 것 자체가 영화에 대한 모독이라 저장하지 못했습니다.  
6-11-2017,2017,6,11,23:02,일요일,10,7,1,달빛청년(pjhp****),믿음..소망...클레멘타인...그중에 제일은 클레멘타인이다..  
6-5-2017,2017,6,5,18:56,월요일,10,7,1,권군(cree****),이 영화를 않본 사람은 있어도 1번만 본 사람은 없다  
3-28-2017,2017,3,28,15:23,화요일,10,7,1,RyanC(ryan****),이영화를 보고 옆분과 결혼했습니다.  
12-30-2016,2016,12,30,09:41,금요일,10,7,1,오상원(osw0****),"수행평가로 자신이 좋아하는 한국 영화 씬 하나를 영어로 연기하는 것이었습니다. 전 망설임 없이 클레멘타인을 선택했고 교탁에서 아이로 빙의해서 ""Dad!!! Wake up!!!!"" 할 떄 친구들, 선생님, 심지어 연기하던 저도 눈물을 흘렸습니다.  "
11-27-2016,2016,11,27,07:58,일요일,10,7,1,별명(kang****),노아가 살아있었다면 이 영화는 방주에 실렸을거다  
9-11-2016,2016,9,11,22:55,일요일,10,7,1,지구별여행(seve****),드립이 생각나지 않아 10점을 드립니다.  
9-1-2016,2016,9,1,00:02,목요일,10,7,1,정조단(j_zo****),어제 면접을 봤습니다. 가장 감명깊게 본 영화가 뭐냐는 질문에 클레멘타인이라고 대답했습니다. 면접관님이 격하게 흥분하시더니 그 영화에 대해서 15분간 얘기하다 나왔습니다. 결과는 나와봐야 알겠지만.. 합격이겠죠? 클레멘타인 감사합니다ㅜㅜ  
8-26-2016,2016,8,26,21:54,금요일,10,7,1,똥꼬뚱이(amy1****),무슨말을적어야할지모르겠음  
8-24-2016,2016,8,24,22:55,수요일,10,7,1,디빌(kyu3****),보는내내 긴장감에 이마에 구슬땀이 흐르더군요 영화가끝나고서야 알았습니다 이마에 흐르던게 땀이아니라 눈물이었던것을...  
8-24-2016,2016,8,24,21:03,수요일,10,7,1,오루하(hmir****),이 영화를 정말 극장에서 다시 볼 수 없나요????  
8-24-2016,2016,8,24,21:03,수요일,10,7,1,박태현(ens9****),역대급 인생영화다 이영화를 보지않은자 영화를 논하지 말라  
8-24-2016,2016,8,24,19:46,수요일,10,7,1,윤범종(beom****),내 인생을 되돌아보는 계기가 되었다  
8-24-2016,2016,8,24,17:32,수요일,10,7,1,녹색(lee0****),이 영화는 제게 엄청난 영감을 줬습니다  
7-30-2016,2016,7,30,23:30,토요일,10,7,1,신서방(rock****),이 영화를 보고 나서 분노가 사라졌어요. 이젠 박근혜도 사랑합니다.  
3-27-2016,2016,3,27,01:39,일요일,10,7,1,니시(zero****),친구 잡에 놀러 갔다가 책상 위에 놓여진 클레멘타인 DVD를 보았습니다. 저는 순간 피가 거꾸로 솟아 그걸 집어들어 창 밖으로 던졌습니다. 저 이외의 다른 사람이 클레멘타인 DVD를 가지고 있는 것을 용서하지 못합니다... 그 친구와는 절교 했습니다.  
3-19-2016,2016,3,19,21:33,토요일,10,7,1,dand****,이동준은 위대한 배우이다  
3-17-2016,2016,3,17,23:13,목요일,10,7,1,참새(limd****),"이 영화를 보고 감상문을 제출하였습니다. 교수님께서 말없이 A+를 주시고, 다음 수업부터 안와도 된다고 하셨습니다. 정말 고맙습니다, 클레멘타인..  "
3-11-2016,2016,3,11,20:35,금요일,10,7,1,Ivanov(seag****),신이 다시한번 세상을 초기화시킬때 이영화는 꼭 노아의 방주에 넣을꺼라고 합니다  
6-16-2015,2015,6,16,11:57,화요일,10,7,1,라준(crj4****),솔직히 좋은건 나눕시다. 혼자 보려하지 말고..  
6-14-2015,2015,6,14,23:38,일요일,10,7,1,로르카(pide****),세계적 명배우와 한국 천재감독의 만남  
6-10-2015,2015,6,10,05:30,수요일,10,7,1,둘캅(v020****),평점 사기다 ..낚을라는 영화다 라고 안보고 이제 우연히 봤는데..희열..  
2-18-2015,2015,2,18,01:26,수요일,10,7,1,이즈리얼(rjck****),감히 이 영화를 평가할 수 없다.  
2-17-2015,2015,2,17,21:07,화요일,10,7,1,개백이다(jewi****),"장난이겠거니, 거품이겠거니, 그냥 가십거리겠거니불안과오만 오해 헐리웃에 물든 생각 ,설마라는 생각 단지 영화가 시작하기전 단념일뿐....  "
2-16-2015,2015,2,16,22:41,월요일,10,7,1,바보소리(rage****),이 영화는 전설입니다.  
1-10-2015,2015,1,10,01:27,토요일,10,7,1,심심해(alsc****),오늘 내가왜사는것일까란 생각이 문뜩들었습니다 우울하고 슬픈하루였습니다 이영화를 우연히 찾다가 본후 내인생이 한심하다고 생각들지않았습니다 저도 할수있습니다  
1-9-2015,2015,1,9,12:52,금요일,10,7,1,mist****,클레멘타인이라 쓰고 레전드라 읽는다.  
11-30-2014,2014,11,30,04:33,일요일,10,7,1,catchery(dry_****),평점 미쳤네요 쇼생크탈출보다 낮다니..부들부들  
11-14-2014,2014,11,14,20:34,금요일,10,7,1,prague(llil****),클레멘타인을 먼저 보고 다음날 인터스텔라를 감상했습니다. 사람들이 그토록 극찬하던 인터스텔라도 이 영화를 보고난 후 보니 별 감흥이 안오더군요.. 이제 곧 클레멘타인 2도 나온다니 영화계에 아주 큰 바람이 불겠네요 제 인생 최고의 영화임에 틀림없습니다  
11-12-2014,2014,11,12,21:11,수요일,10,7,1,inte****,"클레멘타인2 예고편이 공개되자, 에볼라 바이러스가 박멸되고 있습니다.  "
8-26-2014,2014,8,26,12:13,화요일,10,7,1,Justice(supe****),크리스토퍼 놀란 : 클레멘타인을 보고 당장에 한국으로 날아가 감독인 김두영의 집을 찾아가서 영화란 것에 대해 알려 달라고 했지만 너같은  OO은 필요없다는 말과함께 쫓겨났다.  
7-27-2014,2014,7,27,03:22,일요일,10,7,1,szjj****,2004년도에 어떻게 저런 퀄리티의 영화가 만들어졌는지 놀라울 따름이다.  
7-19-2014,2014,7,19,10:04,토요일,10,7,1,숑크숑크(yils****),우와 클레멘타인 대박이넹  
7-18-2014,2014,7,18,00:40,금요일,10,7,1,베리타스(unig****),거대 배급사와 헐리웃 자본에 희생된 희대의 역작... 개봉한지 10년이라는 세월이 지났지만 한국영화의 미래를 위해서라도 반드시 재평가 되어야 할 작품이다.  
7-17-2014,2014,7,17,15:15,목요일,10,7,1,젠틀나이트(gent****),삶의 희망을 잃은 사람들은 이 영화를 꼭 보기 바란다.. 난 이 영화를 보고 우울증을 치유했다..  
7-17-2014,2014,7,17,15:15,목요일,10,7,1,심장(bora****),이 영화를 알았을때가 내 나이 스물셋  사막과 같았던 내삶에이 영화는 이과수 폭포를 몰고 왔다. 이건 그런 영화다.  
6-11-2014,2014,6,11,23:56,수요일,10,7,1,쎈쓰(hbs8****),지금껏정말 내생의최고의영화다라고 생각했던 영화는공효진홍경민주연의 긴급조치19호였어요하지만 클레멘타인을 보고 감동의눈물을흘린 저는이제이렇게말할겁니다 클레멘타인이야말로 긴급조치19호를 넘어설 유일한영화일거라고말입니다  
2-26-2014,2014,2,26,13:11,수요일,10,7,1,cham****,클레멘타인을 보고 여자친구가 생겼습니다.  
10-28-2013,2013,10,28,13:19,월요일,10,7,1,Joseph(askv****),"An amazing film, Intelligently written and movingly told. This is one of Steven Seagal's best and riskiest performances!!!  "
10-11-2013,2013,10,11,14:11,금요일,10,7,1,료종(rojo****),다들 닥치자.우리는 이영화를 평가할 자격이없다. 전세계 최고 권위의 평론가와 명장들에게 이 영화 평가를 맡기자  
10-5-2013,2013,10,5,17:40,토요일,10,7,1,dd(jcg8****),평점 10점 줄려고 네이버 회원가입  
7-28-2013,2013,7,28,16:59,일요일,10,7,1,gane****,눈물과 으리가 넘치는 영화 ...  
7-25-2013,2013,7,25,21:10,목요일,10,7,1,몰라(hjws****),최고의 명작~  
7-18-2013,2013,7,18,19:42,목요일,10,7,1,락키(cmo2****),최고의 영화~!!  
6-4-2013,2013,6,4,20:49,화요일,10,7,1,myri****,내 인생 최고의 영화였다!!!!!!!  
3-29-2019,2019,3,29,04:27,금요일,10,8,2,T 드래곤(5425****),사고로 팔하나를 잃은저는 삶이 고달퍼 자살하러 강원도의 외딴곳으로 가는 길이었습니다 그러던중 운명처럼 평점높은 클레멘타인이 눈에 들어왔습니다 그래 죽기전에 영화나한편보자 생각한 저는 이영화를 봤습니다 영화가 끝날무렵 전 두손으로 폰을잡고 울고있었습니다  
2-25-2019,2019,2,25,21:38,월요일,10,8,2,영화평론가(kjon****),클레멘타인>>>>넘을수없는벽>>>> 쇼생크탈출 클레멘타인은 단순 영화를 넘어선 지구촌 최고의 문화재라고 생각합니다  
12-4-2018,2018,12,4,17:49,화요일,10,8,2,잭와일드(tole****),클레멘타인이 지금 나왔다면 어벤져스는 한국에서 절대 흥행못했을 것이다.  
6-12-2018,2018,6,12,23:01,화요일,9,8,2,cadeau(dmst****),이런 명작을 이제서야 보네... 1점은 홍보 제대로 못했던 감독에 대한 복수다!!  
4-4-2018,2018,4,4,16:36,수요일,10,8,2,째기리(jjk9****),이영화는 유네스코에 등재 되어야한다.많은 나라들이 우리가 소유하고 잇는 클레멘타인 을 노린다. 고로 이영화는 절대로 빼앗겨선 안된다  
4-11-2017,2017,4,11,15:49,화요일,10,8,2,샤랄라(nawa****),내친구 이강일이는 머리털이 점점 빠지고 있는데 이영화를 보고 아마존 밀림이 되었다.  
9-13-2016,2016,9,13,10:53,화요일,10,8,2,wac0****,말이 필요 없는 영화입니다! 지금~! 다운로드 받으라구~!  
7-27-2014,2014,7,27,02:26,일요일,10,8,2,ksmt****,아..젠장 봐버렸다..나의 호기심이...이제 내가 살아갈 이유가 안남은것인가..여운이 길다...  
7-30-2013,2013,7,30,12:35,화요일,10,8,2,불곰(kst4****),이런 영화 또 없습니다..  
7-6-2013,2013,7,6,17:56,토요일,10,8,2,jjan****,이 영화를 보지 않고 영화를 논하지 말라 희대의 명~~~~~~작 ...  
7-6-2013,2013,7,6,17:35,토요일,10,8,2,koof****,내 생애 최고의 영화 진짜 보고나서 몇 일동안 잠도 못잠 ㅠㅠ  
7-3-2013,2013,7,3,01:00,수요일,10,8,2,beca****,으리으리합니다잉  
7-2-2013,2013,7,2,02:24,화요일,10,8,2,Show me the money(dasl****),대한민국 국민이라면 꼭보세요 꼭  
7-1-2013,2013,7,1,22:33,월요일,10,8,2,인간(dhrg****),이..이게바로 영화의 진리... 아무도 이호평을 막을순없다.  
6-30-2013,2013,6,30,20:52,일요일,10,8,2,소몰(dlar****),아 ㅠ.ㅠ 컈감동  
6-28-2013,2013,6,28,15:00,금요일,10,8,2,스네이크(ardb****),세계의 무도인들에게 바치는 헌정영화!  
6-23-2013,2013,6,23,01:24,일요일,10,8,2,xtas****,영화를 보면서 처음으로 눈물을 흘리게 만든 작품. 사나이의 의리! 애끓는 부정! 더 무엇을 말할수 있으랴. 이동준씨의 몸을 사리지 않는 연기 투혼과 배우들의 명연기가 어우러져 희대의 명작이 탄생되었다.  
6-21-2013,2013,6,21,01:33,금요일,10,8,2,공군항공(powe****),최고예요 ㅠㅠ 감동이  
6-20-2013,2013,6,20,19:22,목요일,10,8,2,카리나스(kari****),말이필요없다  
6-4-2013,2013,6,4,14:05,화요일,10,8,2,ks26****,같이죽자  
3-30-2017,2017,3,30,01:49,목요일,10,9,3,MakTa(makt****),50대 중년 남성입니다. 이 영화를 보고 임신을 했습니다.  
7-3-2017,2017,7,3,07:28,월요일,1,18,12,뫄뫄(suga****),진짜 기원전에 살고 싶다고 간절히 느꼈다.  
7-1-2017,2017,7,1,11:37,토요일,1,23,17,GRAFFITI(idon****),클레멘타인>>>>리얼  
11-18-2014,2014,11,18,17:19,화요일,1,83,77,느시(salt****),없던 암이 생겼습니다.  
6-25-2019,2019,6,25,15:55,화요일,10,5,0,이정섭(dark****),영화보면서 담배 한갑 다 피고 갑까지 폈네요  
6-19-2019,2019,6,19,18:00,수요일,10,5,0,최현(chlg****),나는 27년을 살았지만 내 나이는 1살이다 왜냐하면 이 영화를 보고 난 다시 태어났기 때문이다.10점이 최고점이라는게 가장 안타까운 영화  
6-17-2019,2019,6,17,04:03,월요일,10,5,0,RevengEmUST(mkki****),재밌게 신앙고백하듯 놀고 있는데 진지 빨고 별점1개주고 '정상인 분들을 위해 씁니다. 절대 보지마세요ㅋㅋ'이 OO하는 새끼들 귀싸대기 오른쪽아래서부터 왼쪽위방향으로 쎄개 올려치고 싶다  
6-13-2019,2019,6,13,23:50,목요일,10,5,0,inki****,일말에 감정도없는 냉혈한 연쇄살인마! 싸이코 패스도 이 영화를보고 참회에 폭풍눈물을 흘렸다는 최고에 명작!!아~~~~ 이런영화 또다시 나올까요??  
6-13-2019,2019,6,13,12:13,목요일,10,5,0,맨소래담(yobo****),3562만명이 말해주네요...감동그자체...같이보던 우리 강아지도 울고 나도 울고..인생영화입니다  
6-12-2019,2019,6,12,21:11,수요일,10,5,0,Piatone(dbdh****),이 영화를 보고 암이 암에 걸려 죽어 암에 나았습니다.  
6-9-2019,2019,6,9,00:44,일요일,10,5,0,진화(jina****),내 생애 가장 완벽한 영화  
6-6-2019,2019,6,6,20:56,목요일,10,5,0,시안(wns1****),이 영화는 영화가 아닙니다. 예술입니다.  
6-6-2019,2019,6,6,20:20,목요일,10,5,0,ddd3****,가끔 나도 모르게 벌떡 벌떡 일어나고 있다  
6-6-2019,2019,6,6,13:50,목요일,10,5,0,Rira(chae****),대단한 작품.걸작 그자체  
6-6-2019,2019,6,6,11:25,목요일,10,5,0,뿌뿌(gant****),죽기직전 누군가는 사과나무를 심겠지만 나는 이영화를 볼것이다.  
6-5-2019,2019,6,5,23:51,수요일,10,5,0,호구와트(wody****),최고에요 ㄹㅇ 이거 앙봤능게주고싶에료  
6-4-2019,2019,6,4,22:10,화요일,10,5,0,샤샤샥(mphp****),아직보지않았지만 너무 감격스럽습니다  
6-4-2019,2019,6,4,02:11,화요일,10,5,0,곰이(bsj1****),두유노싸이?두유노bts?이전에 두유노클레멘타인?이 있었음을 잊지마라  
6-3-2019,2019,6,3,00:36,월요일,10,5,0,페르셰포네(cesa****),안 보면 죽을 때 후회하게 되는 영화. 손우건 준비하고 보세요.  
6-2-2019,2019,6,2,13:17,일요일,10,5,0,광개토태왕(kidu****),"재개봉이 필요한 영화입니다. 너무 재미있었어요,  "
6-2-2019,2019,6,2,13:17,일요일,10,5,0,하르페스(harp****),집에 사채업차들이 이 영화를 보고 눈물을 흘리며 참회했습니다.  
5-31-2019,2019,5,31,14:08,금요일,10,5,0,R34(jija****),이 영화의 포스터를 보는 것 만으로도 하늘을 나는 것 같은 감동히 전해진다.  
5-29-2019,2019,5,29,19:01,수요일,10,5,0,장미의 이름(praw****),"감히 명작 밑에 연관 추천영화를 7광구, 다세포소녀 달아논 쓰레기는 누구냐  "
5-29-2019,2019,5,29,15:06,수요일,10,5,0,ljw5****,10점 안박은 흑우읍제?  
5-19-2019,2019,5,19,19:01,일요일,10,5,0,푸른달빛아래에있는너(duse****),심심할때 한번 볼 만 하네요  
5-19-2019,2019,5,19,16:44,일요일,10,5,0,tjdd****,인생은 클레멘타인에서 시작해 클레멘타인으로 진다.  
5-17-2019,2019,5,17,23:31,금요일,10,5,0,soul****,노래 클레멘타인은 몬트로제라는 2153년에 살던 사람이 영화 클레멘타인의 감동에 취해 타임머신을 타고 1884년으로가 만든 노래라고 하더군요..  
5-17-2019,2019,5,17,00:21,금요일,10,5,0,따오기(ddao****),제목을 읽고 듣고 본 순간로또당첨이상의 행운아 입니다영화를 보게된후 그누구의 삶도부럽지않더라.  
5-12-2019,2019,5,12,18:52,일요일,10,5,0,감형(feli****),진짜 굿..재맜게봣다  
5-11-2019,2019,5,11,03:43,토요일,10,5,0,참치김밥(danc****),내인생의 최고의 영화 러닝타임100분이 이렇게 짧게느껴질수 없었고 마지막무렵엔 나도모르게 눈물을 흘리고 있었다 영화를 다보고 나서도 한동안 멍하니 계속 엔딩씬만 계속생각이 났다 어벤져스 보다 클레멘타인이다!!  
5-10-2019,2019,5,10,22:39,금요일,10,5,0,뭐하자고(phdn****),ㅋㅋㅋ 나만 당할순 없다  
5-10-2019,2019,5,10,19:48,금요일,10,5,0,Bike breaker(jsh6****),정말 나만 볼 수 없는 영화라는 생각이 들었다  
5-6-2019,2019,5,6,22:28,월요일,10,5,0,오다영(ajdc****),아프리카여행 당시에 문명의 전파가 늦었던 아프리카의 모 부족을 찾아가 해당 영화를 보여주었더니 족장님께서 저에게 명예족장직을 하사해주셨습니다  
5-2-2019,2019,5,2,16:30,목요일,10,5,0,오(ruke****),김좌진 장군님의 한마디는 김두한을 일어나게했고 아빠 일어나 딸의 그 한마디는전국민을 일어나게했다  
4-30-2019,2019,4,30,08:20,화요일,10,5,0,corh****,최고의 영화입니다  ㅋㅋ  
4-29-2019,2019,4,29,22:35,월요일,10,5,0,찡찡이(jjk2****),진짜 보고 싶은 영화중에 하나!!!ㅠㅠ(원준아 이렇게 하는거 맞지??)  
4-27-2019,2019,4,27,14:09,토요일,10,5,0,샤베트(ohmr****),감독이자 주연배우께서 최근 아침마당애 출연해서 이 영화가 너무나도 잘 된 이유를 설명 하시더라구요 물론 믿진 못하겠습니다  
4-23-2019,2019,4,23,18:19,화요일,10,5,0,cygnus(dueh****),10점 보태러 왔습니다  
4-23-2019,2019,4,23,05:20,화요일,10,5,0,gyur****," 오래 보아야 예쁘고, 자세히 보아야 사랑스럽다고 했던가. 이 영화앞에서 그런 건 무의미하다는 걸 깨달았습니다. 참 눈물나게 아름다운 영화  "
4-22-2019,2019,4,22,22:29,월요일,10,5,0,cyni****,"신이시여, 도대체 제가 무엇을 본 것입니까?!!?  "
4-21-2019,2019,4,21,13:09,일요일,10,5,0,김병홍(adri****),만약 우리가 외계인을 만나게 된다면 나사는 그들에게 클레멘타인을 보여줘야한다. 지구침공을 계획하던 외계인이라도 이 영화를 보고나면 참회의 눈물을 흘리면서 클레멘타인을 만든 인간이라는 생명체에게 존경을 표할 것이다.  
4-21-2019,2019,4,21,02:20,일요일,10,5,0,흐히히(11pi****),아니 개웃긴겤ㅋㅋㅋㅋ네이버 영화 카테고리 숨은 명작에 들어가 있음....대박이다 진짜..  
4-20-2019,2019,4,20,00:36,토요일,10,5,0,니가가라하와이(uksa****),"스페이스 오딧세이, 시민 케인처럼 개봉당시엔 관객에게 외면받아 제작비 충당을 위해 이동준씨가 눈물의 똥X쇼를 해야만 했던 비운의 작품. 하지만 시간이 흘러 재평가 받게되면서 이제는 명작을 뛰어넘어 전 세계 명감독들의 바이블이 된 바로 그 영화...  "
4-18-2019,2019,4,18,17:13,목요일,10,5,0,은이(wldm****),와...진짜나쁜사람들...인생영화예요시작하자마자 눈물때메 눈을뜰수가없었어요...  
4-17-2019,2019,4,17,19:53,수요일,10,5,0,bjg6****,"영화 베를린 천사의 시란 영화에서 ..천사는 후회를 할 필요가 없다고 ,,,영원히 사니까,, 하지만 인간은 후회를 한다,,,후회란 결국 유한한 삶에 대한 미련과 애착이지,,,,그러나,,,정말 후회는 이 ㅡ영화를 안보고 살아가는  것,,,  "
4-15-2019,2019,4,15,11:41,월요일,10,5,0,wodu****,최고의 영화 형용할 수 없는 감동  
4-14-2019,2019,4,14,16:44,일요일,10,5,0,안녕하세여(kims****),다섯글자로 울음을 선사해드립니다클레멘타인  
4-14-2019,2019,4,14,12:11,일요일,10,5,0,영워니(hrjf****),보고 암을 치유했다는분 평점을 보고큰결심후 용기내어 시청하였습니다.곧깨달았죠...병은 마음으로도 치유할수 있다는것을요...많은분들이 꼭 이영화를 보고 치유되실길..  
4-13-2019,2019,4,13,16:40,토요일,10,5,0,minsung Kim(rich****),"일반인이 만든것 같은, 그야말로 날 것 그대로의 영화!!정교하게 떠서 플레이팅 한 일식집 회가 아닌, 횟집 수족관에서 퍼덕이는 생선을 꺼내 생살을 씹어먹는 결기로 이 작품을 감상하라!!  "
4-12-2019,2019,4,12,01:29,금요일,10,5,0,베컴의디딤발(nhpi****),10년동안 만나 결혼을 약속한 여친과 클레멘타인을 본 순간 우린 완벽한 타인이 되었다..  
4-10-2019,2019,4,10,12:01,수요일,10,5,0,rkdr****,아빠 일어나!!!.!!  
4-10-2019,2019,4,10,01:08,수요일,10,5,0,Root(kfal****),죽기 전 마지막으로 다시 보고 싶은 영화  
4-7-2019,2019,4,7,15:07,일요일,10,5,0,소시지건달(suns****),정말 재밌는 감동영화입니다.액션신도 너무화려해요  
4-5-2019,2019,4,5,03:57,금요일,10,5,0,happ****,이영화를 보고 난후 감정을 주체할 수가 없어  캡틴큐를 마셨다...  이후 나는 이동준이 되었다  
4-4-2019,2019,4,4,20:15,목요일,10,5,0,지주(whit****),재개봉 언제쯤 하려나요  
4-2-2019,2019,4,2,00:44,화요일,10,5,0,ㅎㅎ(shel****),정말 재개봉 추진해야 합니다  
3-31-2019,2019,3,31,05:14,일요일,10,5,0,mako****,소문듣고 왔습니다저도 동참!  
3-29-2019,2019,3,29,10:40,금요일,10,5,0,박준영(yy96****),이 영화는 10점으로도 ..  
3-29-2019,2019,3,29,00:36,금요일,10,5,0,우통(oso5****),^^두번봤습니다^^  
3-23-2019,2019,3,23,12:05,토요일,10,5,0,파피용(whgh****),이 영화를 죽기전에 봐야하는 이유 수명을 2시간 연장할수 있따.  
2-18-2019,2019,2,18,17:22,월요일,10,5,0,김주은(wndm****),2019년 오늘 이영화를 봤습니다. 만약 2004년에  이영화를 봤었다면 저는 아마 다른 삶을 살고 있엇을텐데 이제서야 본 제가 너무도 원망스럽습니다.  
2-12-2019,2019,2,12,12:45,화요일,10,5,0,브렛힛맨하트(aziz****),올리버칸 한국귀국후 인터뷰질문에 첫답변: 여기가 클레멘타인의 나라입니까?  
2-7-2019,2019,2,7,14:09,목요일,10,5,0,기호지(sage****),최고 최고 최고다~~~  
2-2-2019,2019,2,2,23:35,토요일,10,5,0,광명역 굿맨(yell****),내 인생 최고의 영화이다  
1-25-2019,2019,1,25,23:00,금요일,10,5,0,gasg****,아직도 안봤어? 터미네이터2를 능가하는 작품이닷  
1-23-2019,2019,1,23,13:35,수요일,10,5,0,siri****,내 인생 최고의 영화..  
1-21-2019,2019,1,21,00:44,월요일,10,5,0,감스트라이커(aqua****),영화를 보고 탈모였는대 머라가 다시 자라기 시작하는. 기적을. 경험 했습니다  
1-20-2019,2019,1,20,16:14,일요일,10,5,0,myss****,2019년에 보고있다 씨 ㅂ  
1-18-2019,2019,1,18,00:35,금요일,10,5,0,베릭빠(kalc****),내 인생에 두번다시못볼듯한 영화  
1-16-2019,2019,1,16,17:52,수요일,10,5,0,mimmi(vict****),이 영화를 보고 암이 나았습니다. 암이 암에 걸려 뒤졌네요 ^^  
1-15-2019,2019,1,15,23:40,화요일,10,5,0,sws1****,이게 기적의 영화고 최고다!  
1-14-2019,2019,1,14,23:00,월요일,10,5,0,심성보(bano****),정말 잼있게 봤어요. 추천해요  
1-14-2019,2019,1,14,22:35,월요일,10,5,0,vydjt(grav****),정확히 14번 봤습니다 .. 강추  
1-14-2019,2019,1,14,20:55,월요일,10,5,0,Haetpi(tjdg****),내가 봤던 영화는 영화가 아니였다 이걸 이제야 보다니...  
1-13-2019,2019,1,13,23:28,일요일,10,5,0,마리오(capt****),미국이 태권도 경기에서 편파판정으로 승리하고 전원주가 대놓고 유괴범죄 저지르는거는걸 아무렇지도 않게 나오고 선배가 경찰을 만들어주는 멋진 영화ㅋㅋㅋ  
1-13-2019,2019,1,13,22:45,일요일,10,5,0,sima(mayb****),중반까지 보다 정신을 차리니 병원 응급실.. 끝까지 힘을내 보고 감격을 느끼고 싶습니다.  
1-13-2019,2019,1,13,13:22,일요일,10,5,0,송주영(skar****),모든 영화들의 마스터피스.  
1-11-2019,2019,1,11,17:55,금요일,10,5,0,졸업하자(ipk1****),진짜 이걸 왜 이제알았지 ㅜ  
1-11-2019,2019,1,11,02:56,금요일,10,5,0,강한긍정취업하자(yeju****),이영화를보고 취직에성공했습니다  
1-10-2019,2019,1,10,19:24,목요일,10,5,0,THEODORO(wsh0****),할렐루야! 할렐루야 한국영화의 한줄기 빛입니다.  
1-10-2019,2019,1,10,17:22,목요일,10,5,0,김민성(vbbb****),dsfdsfsdadfsfsdafdsfdasafsd  
1-8-2019,2019,1,8,21:48,화요일,10,5,0,위세척(jung****),"인류의 지성과 사상은 도구를 사용함으로써 시작되었고, 르네상스를 거치며 꽃을 피웠으며 클레멘타인을 탄생시키므로써 완성되었다.  "
1-8-2019,2019,1,8,21:19,화요일,10,5,0,교환가능(kgu5****),이 영화는 대한민국 영화역사에 길이남을 괴작 입니다  
1-7-2019,2019,1,7,21:48,월요일,10,5,0,GHeep(dlsd****),잠깐 보앗지만 감히 10점 밖에 줄수없는 저를 용서하십시요..  
1-7-2019,2019,1,7,18:21,월요일,10,5,0,덕이(gkwl****),와 ㅋㅋㅋㅋ 이거 진짜 잘만들었네  
1-5-2019,2019,1,5,17:47,토요일,10,5,0,신지우(jiu7****),최곱니다 짱짱 클리멘타인  
1-4-2019,2019,1,4,19:03,금요일,10,5,0,아방실(dkbl****),이 영화는 고객의 마음을 하나로 만드는 힘이 있다...  
1-4-2019,2019,1,4,12:21,금요일,10,5,0,효정(khjw****),가히....대작입니다.  
1-2-2019,2019,1,2,18:49,수요일,10,5,0,쿠리온(sayk****),이영화는 미쳤다리!!!  
12-31-2018,2018,12,31,00:09,월요일,10,5,0,a324****,후회없는 선택!! 훌륭한 연출!빈틈없고 눈물없이 볼수없는 배우들의 명품 연기! 록키보다 뛰어난 타격감!  양들의 침묵과 버금가는 스토리 전개!!  다만 아쉬운것은 네이버 평점을 10점밖에 줄수없는 서러움!!2019년에 재개봉을 추진해주세요~  
12-30-2018,2018,12,30,19:36,일요일,10,5,0,라셀칼(mond****),말로 표현이 안되는 명작입니다  
12-30-2018,2018,12,30,16:03,일요일,10,5,0,nk56****,말이 필요없다.그냥 봐요.  
12-30-2018,2018,12,30,12:58,일요일,10,5,0,반격기(spee****),온몸에 전율이 명작입니다  
12-29-2018,2018,12,29,05:17,토요일,10,5,0,MAXYWIZER(maxy****),"그 어떤 작품도 비할 수 없는 최고의 명작이다. 어떤 과정을 통해 감독의 세계관이 구성되는지 너무도 궁금한 창의적 발상의 결정체. 배우들의 세밀한 내면연기와 표현력, 카메라 구도, 색채 그 모든 것이 완벽하다.  "
12-28-2018,2018,12,28,17:56,금요일,10,5,0,팩트 말하는 기계(ofre****),영화인들에게 있어 교과서이자 바이블 부디 보고 판단ㅇ하라  
12-28-2018,2018,12,28,15:28,금요일,10,5,0,hair director hangil(arth****),난 왜 이 명작을 이제야 본것인가... 내 인생은 클레멘타인을 보기 전과 후로 나뉜다  
12-26-2018,2018,12,26,17:23,수요일,10,5,0,바리똥oo(ddon****),오~ 나의 사랑 클레멘타인~ 영화 OST중 단연 최고네요.  
12-26-2018,2018,12,26,13:14,수요일,10,5,0,4B(toco****),영화본편보다 140자평을 읽다가 저세상갈뻔했다 웃다가..  
12-15-2018,2018,12,15,21:46,토요일,10,5,0,DDTsn1per(dlal****),"...,....,...  "
12-15-2018,2018,12,15,19:34,토요일,10,5,0,jh(jaeh****),Abcdwfghijklmnop  
12-15-2018,2018,12,15,04:54,토요일,10,5,0,짐(dlrl****),이거 유튜브 올리면 동준형님 헐리웃진출해서 어벤져스 캐스팅된다.타노스를 이길 유일한 영웅 준리!  
12-6-2018,2018,12,6,09:28,목요일,10,5,0,로맨스파워(dlco****),저는 작년 이맘 때 이 영화를 보고나서이 세상에는 내가 모르는 너무나도 많은 감동이 있구나 하고 그때부터 취집한다음 지금 12개월째 재직중입니다 현재 천 만원 정도 모았는데 1달정도는 매일 클레멘타인을 감상하며 크리스마스 캐롤을 들을생각입니다.  
11-27-2018,2018,11,27,18:28,화요일,10,5,0,18464(junh****),혼자만볼수없다 적극추천  
11-27-2018,2018,11,27,03:43,화요일,10,5,0,qlhe****,시험 기간에 이 영화를 보고 공부가 너무 재미있어 졌어요!! 강추합니다!!  
11-24-2018,2018,11,24,23:57,토요일,10,5,0,kool****,클레멘타인을 보고 영생을 얻었습니다.  
11-24-2018,2018,11,24,21:47,토요일,10,5,0,미수아빠(ksw8****),평점 짜기로 유명한 박평식 평론가는 대부2에 9점을 줬습니다. 박평론가가 언젠가 여기에 와서 10점 주는 날을 기다리고 있습니다!!  
11-24-2018,2018,11,24,19:55,토요일,10,5,0,손(ytk7****),북한의 김정은이 이영화를 한번 보고 남북 정상회담을 결심했고 두번 보고 북미 정상회담을 결심하였으며 세번째 보더날 핵을 포기하기로 결심했다는 바로 그영화! 독재자가 평화를 선택하게 만든 세기의 걸작! 바로 다운받으세요!  
11-24-2018,2018,11,24,00:25,토요일,10,5,0,누누누(lieb****),"전 소경이었는데요, 이 영화볼려구 아까 눈떴어요  "
11-22-2018,2018,11,22,03:41,목요일,10,5,0,지미찰스(bmwf****),소싸움 발라드를 들으면서 운건 내가 처음?  
11-14-2018,2018,11,14,16:14,수요일,10,5,0,백원님(bojo****),사랑하는데 어중간한사람에게 보여주세요~결과나옵니다  
11-9-2018,2018,11,9,21:43,금요일,10,5,0,세상에 공짜는 없다(hs20****),"Thank you, Clementine  "
11-6-2018,2018,11,6,17:37,화요일,10,5,0,이선경(lees****),이건 영화가 아니라 예술이다.  
11-4-2018,2018,11,4,10:36,일요일,10,5,0,스콜(gwee****),와 진짜 개꿀잼이다 손에 땀을 쥐고 봤음...내일 또봐야지  
11-1-2018,2018,11,1,13:35,목요일,8,5,0,사랑이(shro****),진짜 재미 있다는건가요??  
10-31-2018,2018,10,31,00:48,수요일,10,5,0,맹구(mona****),아직도 이 영화를 보지 않았는가? 어디가서 영화얘기할때 입도 뻥긋하지 말아라.  
10-29-2018,2018,10,29,07:45,월요일,10,5,0,인티글 반박좀해봐요(psgh****),이 영화를 추천해주신 모든 네티즌들 감사합니다. 제 인생 최고의 명작이라해도 과언이 아닙니다. 이제 죽어도 좋을것 같아서 죽으러왔습니다. 평점 10점은 너무 부족하네요  
10-28-2018,2018,10,28,02:42,일요일,10,5,0,신(elit****),"그것 리얼 인랑 보다 딱 1,409배 재밌는 꿀잼 액션영화  "
10-25-2018,2018,10,25,01:48,목요일,10,5,0,이백원(a200****),하루 한번 클레멘타인 하겠습니다  
10-22-2018,2018,10,22,16:32,월요일,10,5,0,야옹나리178(sng1****),인류에게 아직 이영화는 너무 이릅니다.  
10-18-2018,2018,10,18,22:16,목요일,10,5,0,에이타(lamo****),아 오랜만에 또봤네요.. 지금까지 10번이상 본듯 역시 명작~!  
10-13-2018,2018,10,13,12:40,토요일,10,5,0,오드섬(odd_****),아아... 역시 한국 영화계를 뒤흔든 영화다.  
10-11-2018,2018,10,11,09:52,목요일,10,5,0,winter(from****),액션과 감동을 한 번에 사로잡은 영화는 클레멘타인이 처음!!  
10-10-2018,2018,10,10,03:39,수요일,10,5,0,이영서(dldu****),정말 완벽합니다. 이 영화를 지금 본 것이 후회스러울 정도..  
10-10-2018,2018,10,10,01:57,수요일,10,5,0,Velvetlove(like****),최고의 영화입니다. 아직도 여운이 가시질 않네요...  
10-10-2018,2018,10,10,00:27,수요일,10,5,0,일번(unif****),10점이 아닙니다 100점입니다  
10-9-2018,2018,10,9,19:28,화요일,10,5,0,김민재(minj****),2004년 5월 21일 정부는 대한민국에 감동의 쓰나미가 몰아치지 않도록 소수의 사람들만 클레멘타인을 관람하게 하였다  
10-8-2018,2018,10,8,16:12,월요일,10,5,0,바울(joye****),굿귯굿귯굿귯굿귯굿귯  
9-30-2018,2018,9,30,16:10,일요일,10,5,0,금동이(pski****),이 영화를 보고 항암치료 중단했습니다..  
9-27-2018,2018,9,27,23:55,목요일,10,5,0,용12(kuy0****),아름다운 영화입니다. 영화가끝나고 모든것에 대한 사랑이  꽃피는것을 느꼈습니다.  
9-26-2018,2018,9,26,13:18,수요일,10,5,0,눈(2875****),어젯밤 다시 찾아서 보다 날밤샜네요역시 미친 몰입감 ㄷ  
9-25-2018,2018,9,25,13:14,화요일,10,5,0,박정빈(bin9****),오금이 저리도록 광광 울었습니다.  
9-24-2018,2018,9,24,19:35,월요일,10,5,0,dear(cckk****),영화를 본 적은 없습니다.  
9-24-2018,2018,9,24,18:29,월요일,10,5,0,잉잉(ingi****),영화 리얼을보고 암에걸렸는데.이 영화를보고 암이 나앗어요.  
9-24-2018,2018,9,24,09:34,월요일,10,5,0,독수리(star****),미친 평점이 랑 댓글이 너무 재미있네요 ㅋㅋ  
9-23-2018,2018,9,23,01:36,일요일,10,5,0,아름다운 곡선(kth2****),아직도 일본에서는 이명작이 자기네 영화라고 우긴다!!  
9-22-2018,2018,9,22,12:29,토요일,10,5,0,킹카야(dark****),죽을때까지 매일 볼것이다  
9-19-2018,2018,9,19,18:55,수요일,10,5,0,티케이(yunt****),볼수있으면 끝까지봐라 너의눈에서 흐르는 물을 발견할수있을것이다  
9-19-2018,2018,9,19,03:55,수요일,10,5,0,멜론(ywns****),물괴보고 다른 명작을 찾다가 보게됐습니다역시 원조는 다르네요  
9-18-2018,2018,9,18,04:46,화요일,10,5,0,들고양이(lcur****),10년이 훨씬 넘었지만 여전히 논란의 중심에 있는 영화 클레멘타인...이 영화에 대한 평가는 극과 극으로 나뉜다...그러나 어느쪽이든 이 영화를 본 사람들의 공통점이 하나 있다  그것은 바로 눈물을 흘린다는 것이다  
9-16-2018,2018,9,16,03:49,일요일,10,5,0,방요(bang****),ㅜㅜ 너무 재밌다... 인생영화 등극  
9-16-2018,2018,9,16,02:17,일요일,10,5,0,써비스(jsds****),"띵작, 무슨 말이 더 필요할까  "
9-15-2018,2018,9,15,03:07,토요일,10,5,0,niko****,소주일곱병을 마시고 숙취로 개고생하고있는데 지인이 추천해준 이영화를보고는 여명808도 소용없던 숙취가 해소되고 흐렸던 하늘이 맑아지며 천지가 개벽 되었어요.이번기회에 소장용 하나 투자용으로 다섯장 DVD 사야겠어요!!  
9-14-2018,2018,9,14,14:31,금요일,10,5,0,fist****,스토리가 너무 탄탄해서 눈도 깜빡이지않고 보았다  
9-13-2018,2018,9,13,00:14,목요일,10,5,0,angryangel(ehdd****),다시 생각나는 희대의 명작  
9-12-2018,2018,9,12,20:37,수요일,10,5,0,불사죠마르코(ee9e****),영화를 보면서 너무 울었는지 안구건조증이 다 사라졌네요  
9-10-2018,2018,9,10,22:20,월요일,10,5,0,원진(lwj9****),오랜만에보는 감동영화  
9-6-2018,2018,9,6,08:21,목요일,10,5,0,limh****,이 영화를 보고 암세포가 암에 걸려 죽어서 암이 씻은 듯이 나았습니다.  
8-30-2018,2018,8,30,22:33,목요일,10,5,0,saint(steb****),숨은 명작이란 말에 어렵게 찾아서 봤다 시간이 가는줄모르고 봤다 죽기전에 꼭 봐야 할 영화  
8-29-2018,2018,8,29,02:38,수요일,10,5,0,크게될사나이(jhgo****),뜨거운눈물을흘렷다..  
8-27-2018,2018,8,27,15:38,월요일,10,5,0,댓글보러왔어요(wewo****),"그저 10점.,.,.  "
8-27-2018,2018,8,27,11:48,월요일,10,5,0,임시현(simo****),당신도 알고 나도 알고 우리가 모두 다아는 진실을 보지 못한 자에게 남겨두마..  
8-26-2018,2018,8,26,23:54,일요일,10,5,0,오늘지금바로(llov****),안봤지만 평점 보고 오늘 보러 갑니다. 감사합니다 평점 주신분들  
8-23-2018,2018,8,23,20:12,목요일,10,5,0,물망(ange****),이 영화가 내가 사는 이유  
8-21-2018,2018,8,21,19:41,화요일,10,5,0,카리스마(bedh****),내인생영화 최고 강추영화  
8-20-2018,2018,8,20,08:44,월요일,10,5,0,cogu****,아직이라도 안보신 분들 빨리 이 세기의 명작을 보시길  
8-18-2018,2018,8,18,21:54,토요일,10,5,0,즈이리야(kuro****),이 영화를 보고나서 눈물이 흘렀습니다. 너무 감동적입니다  
8-18-2018,2018,8,18,17:47,토요일,10,5,0,서릿빛(ljkn****),난 그저 광광 우럭따...  
8-18-2018,2018,8,18,11:32,토요일,10,5,0,dpsn(jooc****),완벽한 영화입니다. 추천드립니다.  
8-17-2018,2018,8,17,02:17,금요일,10,5,0,최경남(choi****),평점은 거짓말하지않는다  
8-17-2018,2018,8,17,01:55,금요일,10,5,0,보이즈코(mub7****),이토록 지루하지않고 재밌고 스토리가 탄탄하며 개연성좋은 영화는 차음이였다  
8-14-2018,2018,8,14,20:40,화요일,10,5,0,절차탁마(good****),이영화를 정은이가 밨다면 통일이 되었을 것이다.  
8-12-2018,2018,8,12,22:08,일요일,10,5,0,Gattuso8(dear****),대한민국 역대 최고의 영화다. 눈물로 시작해서 눈물로 끝나는 영화다. 무더운 날씨에 수분을 뺐는 영화이니 시원한 음료수를 먹으면서 시청하길 바랍니다.  
8-12-2018,2018,8,12,13:01,일요일,10,5,0,은빛바다(skyl****),재밌게 봤습니다. 추천해주신분들 모두감사드립니다  
8-11-2018,2018,8,11,16:42,토요일,10,5,0,덕이(dlrl****),이 영화는 이영화를 모르는사람 마저 스토리를 아는 영화입니다 중학교때 국어선생님이 말씀해주셨습니다. 너네 나이가 가장부러운 이유는 젊고 어려서? 아니. 클레멘타인의 스토리를 몰라서  
8-8-2018,2018,8,8,17:36,수요일,10,5,0,santacraft(wjdv****),그아아아야아아ㅏ아야아아  
8-8-2018,2018,8,8,03:31,수요일,10,5,0,슝슝슝(zuco****),"대단한 명작, 앞으로 이만한 전설은 나오지않을것이다.  "
8-7-2018,2018,8,7,19:35,화요일,9,5,0,빈의자(moon****),포스터 등 광고의 참패... 어쩜 이런 명작 영화를 배우 얼굴이나 동냥하듯 팔아먹는 이따위 구질구질한 포스터로 광고를 했을까?  너무도 아쉽다.  
8-7-2018,2018,8,7,12:53,화요일,10,5,0,cj(sent****),한번사는 인생이다. 죽기전에 꼭 한번은 봐야 한다.  
8-6-2018,2018,8,6,22:49,월요일,10,5,0,shyoon(07tj****),"살면서 총 16번은 봤다. 개인적으로 보고 싶어서 8번, 아는 지인들 추천하려고 같이 보면서 8번. 말이 필요 없다. 살면서 꼭 봐야할 영화.  "
8-6-2018,2018,8,6,18:16,월요일,10,5,0,각성태오(oilb****),이걸 보고나면 살 의미가 없어질까봐 보지않겠습니다. 죽기직전에 보겠습니다.  
8-6-2018,2018,8,6,11:12,월요일,10,5,0,ㅇㅅㅇ(yunh****),다시봐도 재미있는 영화.  
8-6-2018,2018,8,6,00:54,월요일,10,5,0,송마담(pcco****),보지 않았지만 이미 지병이  나은거 같습니다  
8-4-2018,2018,8,4,15:29,토요일,10,5,0,빠큠(doze****),이걸 왜 이제야봤을까요  
8-2-2018,2018,8,2,14:56,목요일,10,5,0,미래전략연구소(fitb****),다시 봐도 감동입니다.  
8-1-2018,2018,8,1,02:13,수요일,10,5,0,수이스 루아레스(slsm****),12345678910  
7-31-2018,2018,7,31,18:40,화요일,10,5,0,susi****,할렐루야!!    ㄷㄷㄷ 신의 작품  
7-30-2018,2018,7,30,23:34,월요일,10,5,0,Jonny Jones(dan8****),인생을 표현하는 영화란 무엇인가? 그 해답이 멀지 않은 곳에 있었다.  
7-25-2018,2018,7,25,17:54,수요일,10,5,0,정민주(roks****),..ㆍ.. ..ㆍ ....  
7-22-2018,2018,7,22,22:10,일요일,10,5,0,sang****,진짜 명작~! 추천합니다 꼭 보세요~!  
7-22-2018,2018,7,22,18:07,일요일,10,5,0,SleepKuma(push****),내마음의 풍금 이후로. 내눈을 이렇게 적신 영화는 없었다.  
7-22-2018,2018,7,22,14:47,일요일,10,5,0,t군(tyru****),내인생 최고의 영화이다  
7-22-2018,2018,7,22,10:36,일요일,10,5,0,아이유인나(ax40****),아이유인나 아이유인나  
7-21-2018,2018,7,21,12:39,토요일,10,5,0,asdl****,전무후무한 영화임에 틀림없다  
7-21-2018,2018,7,21,10:36,토요일,10,5,0,altair(king****),제 인생 최고로 재밌는 영화입니다. 감사합니다  
7-20-2018,2018,7,20,14:21,금요일,10,5,0,marr****,다른말이 필요없다. 내생에 최고의 명작이다  
7-19-2018,2018,7,19,21:23,목요일,10,5,0,배인수(fact****),허하허허하하허허ㅏㅓㅓ 웃음뿐이  
7-19-2018,2018,7,19,03:20,목요일,10,5,0,무적킹왕짱(tjtj****),열정 그것은 기적의 시작이다  
7-16-2018,2018,7,16,10:24,월요일,10,5,0,북극곰(rlad****),이영화를 보고 우리집에 찾아온 강도와 친해졌습니다.  
7-16-2018,2018,7,16,09:08,월요일,10,5,0,똥쟁이근우(rmsd****),단언컨대 세계 최고의 영화. 극장에서 보고싶다.  
7-15-2018,2018,7,15,16:29,일요일,10,5,0,이서원2(dltj****),이 영화를 보고 불면증이 나았습니다.  
7-15-2018,2018,7,15,13:31,일요일,10,5,0,tcap****,판도라의 상자를 열었습니다내인생 최고의 영화~  
7-15-2018,2018,7,15,13:31,일요일,10,5,0,문띠(smh3****),눈물없인 볼 수가 없는 감동이 있다.  
7-13-2018,2018,7,13,00:01,금요일,10,5,0,언제든지어디서나(gss1****),딘ㅋ자 재미있습니다 꼭보세요  
7-2-2018,2018,7,2,13:48,월요일,10,5,0,ㅋㅋㅋ(lltj****),시바조땐다이거이거조은영하야  
6-27-2018,2018,6,27,12:09,수요일,10,5,0,okja****,이 영화보고 다른영화는 못보겠다..  
6-27-2018,2018,6,27,11:35,수요일,10,5,0,king****,인생최고의 영화 말이 필요없음  
6-26-2018,2018,6,26,20:43,화요일,10,5,0,호호아쥼마(no29****),아직도 안본사람 있냐 돈이 아깝지 않다  
6-23-2018,2018,6,23,14:44,토요일,10,5,0,가나다(nsbd****),클레멘타인...이름만들어도 가슴이 뛴다...  
6-22-2018,2018,6,22,21:23,금요일,10,5,0,우성자(sung****),인생최고의 명작....이집트의 피라미드와 같이 길이길이 남을것입니다  
6-20-2018,2018,6,20,15:17,수요일,10,5,0,Anthony(anth****),명작을 하나의 단어로 정의하자면 클레멘타인이다.  
6-11-2018,2018,6,11,00:49,월요일,10,5,0,하나(npol****),5성 그이상의 영화6성호텔 버즈두바이급 감동의쓰나미  
6-6-2018,2018,6,6,21:31,수요일,10,5,0,장미(jieu****),앞으로 이런 영화가 또 나올수있을까..  
6-6-2018,2018,6,6,14:35,수요일,10,5,0,디디디(hwee****),진짜 평점높은 이유를 알겠네요감동입니다  
6-6-2018,2018,6,6,12:31,수요일,10,5,0,성뎃뎃뎃(dltj****),가즈아 가즈아 한국영화최거  
6-3-2018,2018,6,3,19:53,일요일,10,5,0,ZOO123(yksi****),이영화는 10점만으로는 부족하다 100만점을 주고싶은 마음이다 나를 이토록 울릴수있는영화가 있다는것에 감사하며 살아갈것이다  
5-27-2018,2018,5,27,00:47,일요일,10,5,0,수레박희(hihe****),진짜 울트라 액션 갓띵작.  
5-25-2018,2018,5,25,19:47,금요일,10,5,0,bokj****,정말 볼만한영화임 1+1이란게 이런거다영화보고 평점보고 행복이2배임  
5-25-2018,2018,5,25,12:13,금요일,10,5,0,ism(bot_****),"남자는 태어나서 세 번 운다고 했다. 태어날 때, 부모님이 돌아가셨을때, 클레멘타인을 봤을 때..  "
5-24-2018,2018,5,24,17:51,목요일,10,5,0,스카프(jun3****),"명작.아니,완벽에 가까운.  "
5-22-2018,2018,5,22,12:13,화요일,10,5,0,주로빈(joor****),명작중에 명작 클라스 오지는영화  
5-21-2018,2018,5,21,23:47,월요일,10,5,0,희락(redb****),성지순례왔습니다 평점 9.9가 나오기를  
5-21-2018,2018,5,21,13:08,월요일,10,5,0,나무(9437****),여러분 클레멘타인 세 번 보세요  
5-20-2018,2018,5,20,20:17,일요일,10,5,0,꼬마(ejrg****),시간이 많이 지났음에도 불구하고 이렇게 완벽 그 자체 일수가있나 싶습니다. 주변에서 예전영화 추천해달라길래  망설임없이 제가아끼고  아끼는 DVD를 주었습니다.  
5-20-2018,2018,5,20,15:40,일요일,10,5,0,에덴하이(foze****),어찌 인간이 이 영화에 평점을 논한단 말인가 초대작 영화는 하찮은 인간따위가 논할 수 없다  
5-20-2018,2018,5,20,05:35,일요일,10,5,0,lpnl****,재밋다솔직히 두번봤다 이영화  
5-19-2018,2018,5,19,14:56,토요일,10,5,0,이지훈(sawo****),아니 이거 보고 암이 나앗다는 사람 나와보세요덕분에 암이나앗습니다 감사합니다  
5-19-2018,2018,5,19,00:42,토요일,10,5,0,ksh6****,이영화를 보고나서 희망없던 삶에 터닝포인트가 되었다 열심히 살아가야할 이유를 만들어준 교과서의 정석과 같은 명작영화이다  
5-18-2018,2018,5,18,21:35,금요일,10,5,0,달려갑니다(rlaa****),혹시나 하였지만 역시 명작  
5-17-2018,2018,5,17,08:34,목요일,10,5,0,스톤헤드(lily****),제 인생에서 본 영화중 가장 감동적입니다  
5-16-2018,2018,5,16,23:29,수요일,10,5,0,이이잉(free****),으리로 보는 개 명작 ㅠㅠ 영국왕실은 이동준과 스티븐 시갈에게 기사작위를 수여하라!!  
5-16-2018,2018,5,16,07:17,수요일,10,5,0,터프가이(blue****),"인간의 힘으로 만들 수 없는 영화.반드시 신의 개입이 있었어야 만들어질 수 있었던 영화.앞으로 백년 후에 명량,왕의남자,택시운전사는 잊혀 질지라도 클레멘타인은 여전히 대중의 가슴 속에남아 회자되리라.이것은. 진리  "
5-15-2018,2018,5,15,18:42,화요일,10,5,0,jmj9506(audw****),저희집 고양이 울음소리가 아빠 일어나~로 들릴정도로 제 인생작입니다  
5-15-2018,2018,5,15,15:37,화요일,10,5,0,쿨쿨(jjun****),정말 최고라는 말 이외에 어떤 것도 말할 수 없네요.  
5-14-2018,2018,5,14,22:33,월요일,10,5,0,송날두(capt****),쉬는날 할것도없고 생각없이 이 영화를 봤습니다. 이영화를보기위해 내가태어났고 지금껏 살아온 이유를깨달았습니다. 아직 안보신분들 꼭 보십시오.  
5-14-2018,2018,5,14,21:47,월요일,10,5,0,soul****,끝나는 그 순간까지 숨을 쉬지 못했고 이내 나는 응급실에 실려갔다  
5-14-2018,2018,5,14,16:45,월요일,10,5,0,allh****,아빠 일어나! 시걸형도 일어나!  
5-10-2018,2018,5,10,09:55,목요일,10,5,0,탁담준(xkre****),아빠! 일아나아앗!!@  
5-9-2018,2018,5,9,17:25,수요일,10,5,0,명장덕장(sim0****),내인생의 2막을 열어준 영화  
5-9-2018,2018,5,9,13:05,수요일,10,5,0,박종상(whdt****),모든 병이 치료 됩니다.  
5-9-2018,2018,5,9,01:21,수요일,10,5,0,Lucy(migh****),도저히 믿을수 없는 명작이였다고 들었씁니다!!!  
5-7-2018,2018,5,7,11:06,월요일,10,5,0,아잉아잉(civi****),다시봐도 또 보고싶은 명작  
5-7-2018,2018,5,7,08:29,월요일,10,5,0,머스탱(shlo****),아 현기증날꺼같다 빨리 2편 만들어주세요  
5-6-2018,2018,5,6,16:57,일요일,10,5,0,악마(gogo****),최고의영화입니다. 언능보세요.  
4-23-2018,2018,4,23,22:16,월요일,10,5,0,베스티유지(park****),태어났을때 부모님이 돌아가셨을때 나라가 망했을때 클레멘타인을 봤을때 남자는 4번 운다고 한다.?  
4-18-2018,2018,4,18,18:50,수요일,10,5,0,남소정(ysjo****),감사합니다 이영화를보고 한국영화가 얼마나 ㅆㄹㄱ인지를 느꼇습니다 이영화를보고 해외영화를 뒤지다가 좋은영화도 많이발견해서 좋았습니다 ㅋ  
4-15-2018,2018,4,15,17:23,일요일,10,5,0,uiye****,ㅋㅋㅋㅋ평점낮은순이 더 웃겨 ㅋㅋㅋㅋ 아 숨넘어감ㅋㅋㅋㅋ  
4-15-2018,2018,4,15,14:41,일요일,10,5,0,대맨유와무리뉴(juny****),5월이면 이 영화가 생각나는군요.. 사랑해요 클레멘타인  
4-15-2018,2018,4,15,13:50,일요일,10,5,0,앙김옥지(leej****),걍 지림 빤스 세번 갈아입음  
4-15-2018,2018,4,15,03:09,일요일,10,5,0,Vanx(rowr****),옛말에 공자님께서 예의가 아니면 보지도 말고 행하지도 말라하셨다. 클레멘타인이 아니면 보지도 말고 평점을 주지도 말아라  
4-14-2018,2018,4,14,21:56,토요일,10,5,0,김현서(gust****),어찌 감히 이 대작을 평가하리오  
4-10-2018,2018,4,10,11:54,화요일,10,5,0,육지단(dydd****),"이 영화를 보기전 ""대부""가 남자영화중에 최고라고 생각했던 내가 바보였다. 어리석었던 내 인생을  바꿔버린 명작..  "
4-10-2018,2018,4,10,11:13,화요일,10,5,0,슈뢰딩거의 고양이(lvhe****),우울할때마다 보러온다 물론 평을...  
4-9-2018,2018,4,9,13:30,월요일,10,5,0,신용준(shin****),영화보는 내내 눈물을 흘리며 보았습니다  
4-1-2018,2018,4,1,19:33,일요일,10,5,0,권순형(okny****),한국 컬트영화의 새지평을 열다  
4-1-2018,2018,4,1,00:02,일요일,10,5,0,Superdrummer(towo****),와... 친구가 추천해서 봤는데 정말 어벤져스보다 재밌었음. 마블의 그늘에 가려 이런영화가 존재한다는것도 몰랐다.  
3-31-2018,2018,3,31,21:32,토요일,10,5,0,꽝이(heys****),소문들어 명작이란건 알고있었지만 이정도일줄은 몰랐습니다. 감사합니다.  
3-31-2018,2018,3,31,16:10,토요일,10,5,0,김한성(asdf****),이런영화는  이세상에 두번다시 없을 하늘이 내린 눈물  
3-31-2018,2018,3,31,00:40,토요일,10,5,0,레슬링의신(zxzx****),이런 위대한 작품이 대한민국에 다시 한번더 나올수있을까? 그 시절 이영화를 찍은 이동준씨가 왜 할리우드에 진출을 못했는지.. 왜 청룡영화제 수상을 못했는지 이해가 되지않는다..대한민국 영화계 역대 최고의 작품이 아닌가 생각된다  
3-29-2018,2018,3,29,11:34,목요일,10,5,0,Huntriez(cjmm****),감동을 넘어선 감동 그자체  
3-29-2018,2018,3,29,03:01,목요일,10,5,0,드로다비스(jame****),이 영화를 보고 제 바지에 똥을 쌌습니다 그러나 희대의 명작 클레멘타인에 마음을 너무 빼앗긴 나머지 집에 오기 전까지 저는 그 사실을 알아차리지 못했습니다  
3-28-2018,2018,3,28,14:50,수요일,10,5,0,JIN GWAN최진관(mz33****),내 생에 최고의 순간이였다 이것을 보고 자괴감을 느껴 서울대를 자퇴했다  
3-26-2018,2018,3,26,14:36,월요일,10,5,0,정치기사댓글보면혈압(xxx9****),댓글보고 10점 주는 영화 ㅋㅋㅋ  
3-25-2018,2018,3,25,21:38,일요일,10,5,0,lsaya(wlgu****),10점이라는 점수는 이 영화를 위해서 존재한다.  
3-24-2018,2018,3,24,13:55,토요일,10,5,0,dlag****,이 영화로 제 삶이 바뀌었습니다.  
3-23-2018,2018,3,23,19:03,금요일,10,5,0,최일영(bada****),인생의 띵작.... 아빠 일어나에서 엉엉 울었습니다.  
3-22-2018,2018,3,22,12:18,목요일,10,5,0,bonobo(shpa****),클레멘타인... 지금 만나러 갑니다.  
3-21-2018,2018,3,21,20:12,수요일,10,5,0,럭키금속(ynid****),통일이 된다면 젤 먼저 북녘 동포들과 이 영화를 함께 보고싶다.  
3-21-2018,2018,3,21,14:56,수요일,10,5,0,희드롸(ozzm****),10점으로는 모자른 점수입니다  
3-21-2018,2018,3,21,11:55,수요일,10,5,0,영돌(para****),를레멘타인을 빼고 영화를 논하지 말라  
3-21-2018,2018,3,21,09:14,수요일,10,5,0,사인(jten****),몇년이 지나도 잊을수 없는 영화  
3-20-2018,2018,3,20,19:58,화요일,10,5,0,plas****,인생영화입니다 저는 거짓이나장난이아니에요  
3-18-2018,2018,3,18,22:47,일요일,10,5,0,임진혁(ahrt****),이영화를보고나서 '클' 한글자만들어도 눈물이 흘러내린다.. 왜인지는모르겠다..  
3-18-2018,2018,3,18,20:50,일요일,10,5,0,임종수(dla4****),우리나라 에서 이런 영화가 나올 수 있어 정말 기쁨니다....크흡  
3-18-2018,2018,3,18,18:16,일요일,10,5,0,유기농(as97****),한국영화계는 클라멘타인 전후로 나뉜다..  
3-16-2018,2018,3,16,16:35,금요일,10,5,0,복병(wlsd****),이 영화를 보고 일어날수 있게 되었습니다 정말 감사드립니다 아빠 일어나!!!!  
3-15-2018,2018,3,15,18:44,목요일,10,5,0,신원(unip****),내가 살아가는 이유...  
3-11-2018,2018,3,11,02:25,일요일,10,5,0,잡동사니(2000****),나만 볼 수는 없다. 다들 봐야한다.  
3-8-2018,2018,3,8,18:13,목요일,10,5,0,김찬우(nand****),아빠 일어나!!! 일어 나라구!!!  
3-6-2018,2018,3,6,13:09,화요일,10,5,0,자유롭게(gun9****),우울증 있는 직장동생 에게 이작품을 추천해서 보여줬다 이 영화를 본 동생은 자기가 왜 우울하고 하찮은거에 마음을 다스리지 못했다며 한참 동안 하늘만바라보고 눈가가 촉촉해 졌습니다  
3-4-2018,2018,3,4,21:57,일요일,10,5,0,김호준(hjal****),별걸 다 제재하네 네이버 OO 샊히들  
3-4-2018,2018,3,4,18:10,일요일,10,5,0,이예준(yeju****),굿굿 완전 재미있게 봤어요  
3-4-2018,2018,3,4,01:05,일요일,10,5,0,제이비(wnsq****),재평가 되어야하는 영화  
3-3-2018,2018,3,3,16:30,토요일,10,5,0,강경록(krka****),2004년에 내 나이가 안되서 직접 못본것이 한이 될 정도의 영화. 10년이 넘게 지난 지금 다시봐도 전혀 손색이 없다  
2-28-2018,2018,2,28,18:14,수요일,10,5,0,일교차가 심해(gari****),60년전에 이 영화가 나왔다면 6.25는 없었을것이다  
2-26-2018,2018,2,26,14:45,월요일,10,5,0,파스토레(star****),이따위 글로는 표현할 수 없다  
2-26-2018,2018,2,26,10:37,월요일,10,5,0,Narsil(kimh****),이영화로인해 인생이바뀜  
2-26-2018,2018,2,26,10:12,월요일,10,5,0,dam9****,한국 단군이래에 인정하는 최고의명작  
2-26-2018,2018,2,26,00:35,월요일,10,5,0,백곰탱이(hoon****),오래 다닌 회사를 퇴사했다남은 시간 모두를 나 자신을 위해 쓰기로 했다우연히 마주친 게시판에서 알게 되었고그리고 이 영화를 봤다다시 일해도 될 것 같다  
2-25-2018,2018,2,25,19:23,일요일,10,5,0,김치맨(m927****),명작입니다 아무리 무미건조한 사람이라도 이영화를 보면 눈물이 터져나올 겁니다. 시대를 앞서서 당시 빛을 보지 못한 영화지만 지금이라도 꼭 보세요!! 추천합니다  
2-18-2018,2018,2,18,18:28,일요일,10,5,0,하성식(orio****),‘재개봉 1순위 영화’  
2-13-2018,2018,2,13,17:23,화요일,10,5,0,홍키형(succ****),죽어서도 또 보고싶은 명작 중에 명작! 나중에 유서에 클레멘타인 DVD와 함께 묻어달라고 작성할 생각  
2-11-2018,2018,2,11,10:13,일요일,10,5,0,moruboat(sajj****),염력보고 여기로 넘어왔어요.  
2-10-2018,2018,2,10,23:44,토요일,10,5,0,kice****,본격 암세포가 암에 걸려 암이 낫는 영화추천합니다  
2-9-2018,2018,2,9,14:53,금요일,10,5,0,낚짱(qkrt****),대부 피아니스트 쇼생크탈출과 비슷한 평점 말이필요없다 일단 봐라~~  
2-8-2018,2018,2,8,20:34,목요일,10,5,0,띵땅(sins****),평론가가 어찌 이 영화를 평가하는가..  
2-7-2018,2018,2,7,18:56,수요일,10,5,0,강도연(ehdu****),명작..다른 말이 또 필요할까.  
2-7-2018,2018,2,7,17:30,수요일,10,5,0,발현(penc****), 반지의제왕을 능가하는 최고의영화이 영화를 보고 그 감격에 눈물을 흘렸다  
2-7-2018,2018,2,7,14:15,수요일,10,5,0,yell****,ㅋㅋㅋ 10점 주고 갑니다 ㅋㅋㅋ  
2-7-2018,2018,2,7,14:00,수요일,10,5,0,진소(chun****),"이 영화 최종 보스는 ‘잭 밀러’로, 유명 액션배우 스티븐 시걸이 배역을 맡았다. 하지만 그가 등장하는 장면은 모두 더해봐야 1분 남짓이다. 섭외비를 100억원에서 12억원으로 깎은 대신, 출연 시간도 비례해 덜어냈기 때문이다.  "
2-7-2018,2018,2,7,12:43,수요일,10,5,0,AISAKA TAIGA(snlk****),왜 이영화가 재개봉을 안하는지 의문이다.  
2-6-2018,2018,2,6,22:04,화요일,10,5,0,라플란드의눈꽃(jong****),"내일 지구가 멸망하더라도,  난 한편의 클레멘타인을 감상하겠다.  "
2-5-2018,2018,2,5,13:24,월요일,10,5,0,이카루스(ssam****),내게는 성경과 불경같은 명화 이번 여름 휴가는 클레멘타인과 함께  
2-5-2018,2018,2,5,08:47,월요일,10,5,0,모모(atra****),내 인생 그 무엇과도 바꿀 수 없는 두시간이었다.  
2-4-2018,2018,2,4,22:02,일요일,10,5,0,엠씨더맥스(mms0****),네이버 OOO기 같은 놈들 이딴 명작을 두고도 최고점수 제한선을 고작 10점으로 만들어놨냐?? 미띤 놈들....  
2-1-2018,2018,2,1,10:16,목요일,10,5,0,Gentleman(from****),네티즌은 늘 옳다....  
1-28-2018,2018,1,28,21:03,일요일,10,5,0,11(chak****),이영화를보고 암이나았다는 소문을듣고  항암치료대신 이영화를선택했습니다.  
1-17-2018,2018,1,17,20:27,수요일,10,5,0,dark****,코인으로 원금 60퍼  잃고 있는데  이 영화보고 희망을 얻었네요..  
1-14-2018,2018,1,14,16:18,일요일,10,5,0,다시마(imfb****),당신이 살아있는데도 이 영화를 아직도 보지 않았다면 자신의 눈과 귀와 뇌와 가슴에 죄를 짓고 살고 있었던 것이다.오늘 당장 이 영화를 보고 태어나서 처음 느끼는 감동을 느껴라!네이버 평점은 거짓말을 하지 않는다.  
1-13-2018,2018,1,13,15:04,토요일,10,5,0,ASTRO(mqpz****),이 영화를 보고 여자친구가 생겼습니다  
1-10-2018,2018,1,10,21:45,수요일,10,5,0,강웅천(kuc9****),Birth와 Death 사이엔 Clementine이있다.  
1-3-2018,2018,1,3,17:00,수요일,10,5,0,고래젓갈(gksq****),이 영화를 평가하지말라.  
1-3-2018,2018,1,3,02:32,수요일,10,5,0,베베베(best****),클레맨타인 미개봉 DVD 300만원에 삽니다.!!!  
1-2-2018,2018,1,2,00:25,화요일,10,5,0,성아잉(ha92****),아빠 일어나! 아빠 일어나  
1-1-2018,2018,1,1,17:55,월요일,10,5,0,킴준태입니다(mone****),인생영화죠 명작임니다  
12-31-2017,2017,12,31,19:18,일요일,10,5,0,괴물(supe****),"전원주,남포동,임혁필,황기순  초 호화 케스팅~~  "
12-30-2017,2017,12,30,22:31,토요일,10,5,0,바우(tx28****),다시 보고픈 영화 ~~~  
12-30-2017,2017,12,30,00:34,토요일,9,5,0,손규열(kolp****),결말은 좀 아쉽지만 아직 안보셨으면 한번쯤 보셔도 괜찮으실거 같습니다.  
12-28-2017,2017,12,28,04:49,목요일,10,5,0,yoon****,내일 지구가 멸망한다면 나는 클레멘타인과 함께 할 것이다....  
12-27-2017,2017,12,27,21:40,수요일,10,5,0,the(ange****),Best film ever  
12-27-2017,2017,12,27,15:56,수요일,10,5,0,임은기(dlad****),자살은 하고 싶다는 분은 이 영화를 보세요 생각의 전환점이 올것 입니다  
12-25-2017,2017,12,25,20:34,월요일,10,5,0,타코야끼(yhj3****),좋아요. 너무 좋아요.  
12-23-2017,2017,12,23,11:08,토요일,10,5,0,rkgm****,인생영화 등극..! 이영화를소개시켜준사람에게 밥이라도 한끼사야겠네요..!  
12-19-2017,2017,12,19,00:06,화요일,10,5,0,정선우(java****),이 영화를 보고 제 할머니의 유행성 골다골증을 이겨내고영화관을 뛰어나갔습니다 감사의 의미로 10점 드립니다  
12-18-2017,2017,12,18,14:45,월요일,10,5,0,멍탐정코난(urso****),10점까지만 줄 수 있다는게 너무 안타깝습니다. 뒤에 '0'을 하나 더 붙이고 싶은 심정입니다.  
12-18-2017,2017,12,18,13:17,월요일,10,5,0,랑만(lafa****),벼르고 벼르다 이제 봣네요^^. 곧 해외로 떠나는데 나에 조국과 클레멘타인을 생각하면 많이 울것 같아요 ㅠㅠ  
12-17-2017,2017,12,17,20:27,일요일,10,5,0,난이(ch03****),이영화에 10점밖에 줄수없단는게 너무 아쉽다.  
12-17-2017,2017,12,17,19:48,일요일,10,5,0,소비에트(tjdw****),아직도 이 영화를 안보신분은 강력추천합니다. 우리나라에 최고 액션배우 이동준씨와 최고 헐리우드배우 스티븐 시걸이 출연한 출연진만 바도 화려한대... 내용 구성부터 모든게...하.... 이 영화만든 감독 작가 모두....진짜. 와.. 암이 난다고요? 그  
12-17-2017,2017,12,17,19:06,일요일,10,5,0,케이라로즈(areu****),저는 앞으로 좋은사람에겐클레멘타인 같은 사람이라고 할겁니다.  
12-17-2017,2017,12,17,18:58,일요일,10,5,0,담박원(damb****),무인도에 떨어진다면 나는 가족사진과  이 영화 DVD만 있으면 외로움 없이 견딜 수 있을 것이다. 아니 이 척박한 무인도 같은 도시생활에서 내 삶의 원동력이 되버린 클레멘타인.  힘들 때마다 이 영화를 생각하며 이보다 더할수 없음에 위로받는다  
12-16-2017,2017,12,16,22:33,토요일,10,5,0,유노(prim****),인생에 있어서 꼭한번은 봐야할 영화임에 틀림이 없다.  
12-15-2017,2017,12,15,23:26,금요일,10,5,0,러그(kkks****),우연인지 필연인지 보았네요 이 영화를! 보고나니 이빨이 아프네요~  너무 이 악물고 본거 같아요...  
12-15-2017,2017,12,15,15:37,금요일,10,5,0,김주은(77jo****),보고나서 댓글들을 이해하였습니다. 진작보지않은걸 후회합니다.  
12-15-2017,2017,12,15,13:37,금요일,10,5,0,신데렐돌(resp****),"양병간 감독의 '무서운 집'과 김두영감독 '클레멘타인'은  앞으로 100년 한국 영화사에 잊혀질수 없는 영화이다,. 이두영화를 보지않고서는  영화사를  논할수는 없다  "
12-15-2017,2017,12,15,13:00,금요일,10,5,0,감독입니다(hann****),이영화를 보고 피부병이 나았습니다  
12-15-2017,2017,12,15,01:22,금요일,10,5,0,르완(peee****),깊게 생각하면 10점. 짧게 생각하면 1점을 주는 영화.호불호가 극명하게 갈리는 영화예술영화가 상업성이 떨어지 듯 흥행은 하지 못했지만 정말 여러가지 의미에서 한국 최고의 영화가 아닌가 한다.  
12-15-2017,2017,12,15,01:14,금요일,10,5,0,ㅎㅎㅎ(sbkb****),60억으로 이런 영화를 만들어  버리면 헐리우드 영화는뭐가되나요 나쁜사람...  
12-15-2017,2017,12,15,00:28,금요일,10,5,0,힘들어(yayo****),굿!! 눈물이 멈추질않네요  
12-15-2017,2017,12,15,00:22,금요일,10,5,0,일탈(neaj****),보는내내눈물이.ㅠ.ㅠ이 영화를 과연 끝까지볼수있는 사람이 있을런지의문입니다.  
12-15-2017,2017,12,15,00:17,금요일,10,5,0,Buckfever(puel****),영화를 본 사람만이 혼자 보기 아깝다는 후기를 마음 속 깊이 느낄 수 있는 영화..  
12-14-2017,2017,12,14,17:49,목요일,10,5,0,love****,나는 고양이입니다 이영화를보고타자를치게되엇습니다  내비록 손가락이 세개지만  10점을남기겠습니다  
11-21-2017,2017,11,21,13:34,화요일,10,5,0,부끅곰(rkqa****),보면서 울음 진짜 한국영화에 길이남을 명작이다  
11-20-2017,2017,11,20,15:51,월요일,10,5,0,바람과하객(cks5****),너무 감동이에요 초반부터 끝까지 눈을 뗄수가 없었네요.. 추천합니다 꼭 보세요 제 인생 영화입니다  
11-19-2017,2017,11,19,18:36,일요일,10,5,0,힘내자(kym9****),"최고다 어떤의미에선 영화계의 판도를 바꾸엇다고 말할수잇는, 교과서에 실릴만한 그런영화다  "
11-6-2017,2017,11,6,11:37,월요일,10,5,0,낑(arse****),다시 나올수없는 기적의영화  
11-6-2017,2017,11,6,11:34,월요일,10,5,0,잇몸튼튼즐라탄(hb33****),스티븐스필버그도 감탄할 탄탄한 짜임세의 영화. 모는것이 완벽하다  
11-5-2017,2017,11,5,23:01,일요일,10,5,0,곰곰(mank****),항암 영화라고 지금 티비에 나와서 보고싶어짐  
10-24-2017,2017,10,24,21:28,화요일,10,5,0,TwoSun(sayc****),전역하자마자 접했던 이 아름다운 영화를 시간이 훌쩍 지나간 후에야 다시보게 된다. 내세에도 이런영화는 없을 것이다.  
10-24-2017,2017,10,24,18:40,화요일,10,5,0,무한질주(cha5****),"영화평을 보고 우연찮게 어제 가족들과 함께 보았습니다. 명작명작 말만 들었지 제 인생에 이런 순간이 올줄 몰랐네요. 와이프랑 펑펑울었습니다. 아이들은 울다 지쳐 잠이 들었더군요, 이영화를 계기로 앞으로의 인생철학이 생겼습니다. 감사합니다.  "
10-8-2017,2017,10,8,13:09,일요일,10,5,0,전도언(hido****),댓글중에 사람들 말이 거짓말이라고 해서 별 기대 안 하고 봤습니다. 보고는 생각이 바뀌더군요. 한국 영화계는 클레멘타인이 있기 전과 있은 후로 나누어야 한다고요.  저에게는 감동 그 자체였습니다.  
10-8-2017,2017,10,8,03:03,일요일,10,5,0,똘똘이(jhch****),동화 '행복한 왕자'를 보면 왕자의 있는몸에잇는보석들을 왕자가 제비에게 시켜 불쌍한사람들에게 나누어준다. 하지만 왕자의손에 클레멘타인 DVD가 있었으면 어땟을까??. 왕자도 그것은 절대로 주지않았을것이다  
10-4-2017,2017,10,4,14:49,수요일,10,5,0,조군이(mach****),역시 추석엔 클레멘타인이 최고입니다!  
10-4-2017,2017,10,4,08:11,수요일,10,5,0,헤헷(wnsj****),리얼이라는 대항마가 나타났지만그래도 질 수 없습니다대한민국 최고의 띵작은 누가 뭐래도클레멘타인 입니다  
9-22-2017,2017,9,22,16:32,금요일,10,5,0,에셔(redz****),완벽한 영화입니다. 반드시 구매해서라도 보시기 바랍니다.  
9-17-2017,2017,9,17,06:52,일요일,10,5,0,jenissi(je_n****),내 인생 영화 잠이 오지 않는다  
9-14-2017,2017,9,14,08:53,목요일,10,5,0,baby****,짱짱짱 재미있어요ㅋㅋ  
9-13-2017,2017,9,13,21:08,수요일,10,5,0,양장피(pink****),진짜 너무재밌네요.. 제 인생작품중에 하나입니다  
9-13-2017,2017,9,13,13:50,수요일,10,5,0,나두루바(ccn1****),안봤지만 왠지줘야할거같다  
9-12-2017,2017,9,12,00:45,화요일,10,5,0,연(brea****),아직 영화를 보진않았지만 평점을 보니 정말 명작인듯합니다. 언제 한번 dvd로 사서 꼭 보고싶네요.  
9-11-2017,2017,9,11,11:18,월요일,10,5,0,akdo****,이 영화를 보고 발X부진이 나았습니다.  
9-9-2017,2017,9,9,12:34,토요일,10,5,0,화이팅입니다(bban****),"40중반에서야 드디어 영화를 보았습니다.저도 울고 아내도 울고 두 아들도 울고 강아지도 울고 하늘도 울었습니다. 명불허전. 명성 그이상, 기대 그이상인 영화였습니다.  "
9-8-2017,2017,9,8,00:38,금요일,10,5,0,새누리 아웃(s010****),기분이 우울하거나 회사일로 스트레스 심할때 이곳 리뷰를 읽으면서 기분전환합니다.물론 이 영화는 안봤습니다만 명작인건 리뷰를 통해 알수 있군요. 앞으로도 이 영화 볼 계획은 없습니다. 내 수준이 이 영화를 소화해낼 경지에 올랐을때 그때 관람 예정입니다.  
9-4-2017,2017,9,4,15:35,월요일,10,5,0,귀차니즘(jdh4****),이 영화를 보고 치아가 다시 자랐습니다.  
8-31-2017,2017,8,31,09:49,목요일,10,5,0,담배29(zzan****),최고다...역시..  
8-30-2017,2017,8,30,15:04,수요일,10,5,0,navr****,이 영화를 보고 여자친구가 생겼습니다  
8-30-2017,2017,8,30,11:42,수요일,10,5,0,게살버거(hora****),사람이 태어났다면 봐야하는 영화입니다 우리들의 산소와 같은 존재이지요.  
8-29-2017,2017,8,29,21:48,화요일,10,5,0,rsdrasdsf(jooy****),이 영화의 명성을 듣고 보게되었는데 역시 명성대로의위대함을 느꼈습니다. 한국인이라면 죽기전에 한번은꼭 보아야 할 것이다.  
8-29-2017,2017,8,29,11:30,화요일,10,5,0,우룡우룡(gang****),택시기사보다 강추!!!  
8-27-2017,2017,8,27,15:53,일요일,10,5,0,99ju****,이 영화 늦게나마 봐서 다행이라 느낀다. 내 생에 최고의 영화.  
8-27-2017,2017,8,27,14:41,일요일,10,5,0,x18k****,이 영화를 보고 내 인생이 달라졌다~다시 10여년 전으로 돌아가고 싶다~클레멘타인을 보기 전날로~  
8-26-2017,2017,8,26,17:52,토요일,10,5,0,광명파파(dont****),매년 이맘때면 생각나는 영화  
8-26-2017,2017,8,26,13:22,토요일,10,5,0,날아보자(zepl****),겁나 재밌네요. 굿굿굿  
8-26-2017,2017,8,26,13:19,토요일,10,5,0,hryj****,다죽자 다죽자 다죽자 다죽자  
8-26-2017,2017,8,26,07:12,토요일,10,5,0,유기자(waka****),아빠 일어나~ 살균세탁하셨나요. 10년째 내 귀를 멤돈다.  
8-22-2017,2017,8,22,23:59,화요일,10,5,0,새우(hwj0****),죽기전 누군가 나에게 돌아가고 싶은 순간이 있냐고 묻는다면 주저치 않고 상영전 의자에 앉아 설레었던 때라고 말할것이다  
8-12-2017,2017,8,12,23:14,토요일,10,5,0,교촌치킨(s507****),"늦은 오후. 보이차로 다도의 시간을 가지며 클레멘타인 예고편을 즐겼습니다.. 그동안 레저스포츠와 여러 취미 활동들로 인생을 즐겨왔다고 생각했지만, 전혀 아니였더군요.. . 부디부디 두부두부 많은 분들이 이 명작을 알아보셨으면..  "
8-10-2017,2017,8,10,20:35,목요일,10,5,0,글리그(kumi****),비싼 프로포폴 쓰지말고 무료로 이거 보고 자자  
8-9-2017,2017,8,9,01:18,수요일,10,5,0,타이포그래프(i556****),이것은 인생이다.그 외에 표현할 수 있는 문장은 없다.  
8-8-2017,2017,8,8,20:34,화요일,10,5,0,tjni****,"하루에 같은 영화를 밥도 안먹고 3번이나 연달아 감상한것은 클레멘타인이 최초이자 마지막 일 것이다. 시간 가는 줄 모른다는 말이 있는데, 진짜 시간 가는 줄 모르는 걸 체험하고 싶다면 간단하다. ""이 영화를 보면 된다.""  "
8-8-2017,2017,8,8,20:16,화요일,10,5,0,그냥(libe****),나만 당할순 없다!!!  
8-8-2017,2017,8,8,18:54,화요일,10,5,0,이자카야도쿄(dkn9****),나만당할순없지. 똥쭌형 똥꼬빤쓰쇼ㅜ ㅜ  
8-8-2017,2017,8,8,07:22,화요일,10,5,0,asdfassas(pa37****),아직까지 클레멘타인을 보지않은분이 너무 부럽습니다 이감동을 느낄수있다니 앞으로 10년간은 이런감동을 느낄수없을것같아 슬픕니다  
8-7-2017,2017,8,7,22:56,월요일,10,5,0,해성(tjxo****),아빠 ~~ 일어나~~ 외칠때 내옆에서 보시든 아버지가 눈물을 훔치며  벌떡 일어 나셨다..  
7-27-2017,2017,7,27,06:56,목요일,10,5,0,사랑하는 가지야(bloy****),"아...! 클레멘타인...! 암이 암걸려 죽는다는 불후의 명작... 클레멘타인2를 기다리다가 돌아가신 저희 할아버지가 남기신 유언이 ""내 무덤에 클레멘타인 DVD를 꼭 함께 묻어다오. 저승가서도 보련다..."" 블루레이로 묻어 드렸습니다.  "
7-24-2017,2017,7,24,10:28,월요일,10,5,0,개르미늄(dirk****),"성지순례 다녀갑니다...  근데, 정말로 다른건 모르겠고...  예전에 추석특선영화로 TV에서 클레멘타인 방영했을때, 부모님과 할머니께서 정말 재미있게 보셨습니다.  다들 재미 있으시다네요  "
7-23-2017,2017,7,23,17:40,일요일,10,5,0,연세돌이(slim****),평점보고 봤는데 역시나 이야~정말 대단하네요  
7-21-2017,2017,7,21,02:12,금요일,10,5,0,chltjdwn(hay0****),만약 자살을 하고 싶다면 이영화를 보는것을 추천합니다  
7-20-2017,2017,7,20,06:24,목요일,10,5,0,bbae****,스티브신갈 연기 대박영화 리얼과 비교하기 위해 보고야 말았습니다 ㅋㅋ클레멘타인 승!!  
7-20-2017,2017,7,20,03:50,목요일,10,5,0,에드워드 김(midm****),전설에 동참합니다. 5분 주연은 기네스기록 아닐까요?  
7-17-2017,2017,7,17,15:09,월요일,10,5,0,kari****,내인생 다섯손가락안에 꼽히는 역대급 영화네요 이정도면 당근 10점.. 시간금방간다진짜ㅠ  
7-11-2017,2017,7,11,19:13,화요일,10,5,0,에비쮸(ship****),제 꿈은 네이버에 취직하는 것입니다.그래서 꼭 별점 100개를 만들어서최초로 이 영화에 100개의 별을 쏴드리고 싶습니다!!  
7-10-2017,2017,7,10,10:10,월요일,10,5,0,아까끼아(char****),클레멘타인.... 당신의 뒤를 이을 영화가 나타났습니다...리얼...  
7-9-2017,2017,7,9,05:50,일요일,10,5,0,치킨박사와하이드(jiyo****),아빠 일어나! 정말 세계 영화사에서도 유례를 찾아보기 힘든 명 대사라고 생각한다. 아빠 일어나!  
7-8-2017,2017,7,8,09:47,토요일,10,5,0,스피드(spee****),2편은 제작 안하나요?  
7-8-2017,2017,7,8,05:04,토요일,10,5,0,GGG(chun****),한남자의 인생이 담긴 명작  
7-7-2017,2017,7,7,14:02,금요일,10,5,0,Bird9(xehd****),전설의 파더 스탠드업...  
7-4-2017,2017,7,4,02:04,화요일,10,5,0,권승현(seun****),말로 표현못할 대단한 영화  
7-3-2017,2017,7,3,22:13,월요일,10,5,0,문딩(o0oo****),"""마크 저커버그,  클레멘타인 VR 제작에 무조건 투자 의향 있어""  "
5-31-2017,2017,5,31,14:47,수요일,10,5,0,cake****,인생영화. 이런영화를 왜 이제알았을까  
5-31-2017,2017,5,31,14:41,수요일,10,5,0,오리(seon****),클레멘타인 리메이크 기대하겠습니다.  
5-28-2017,2017,5,28,00:52,일요일,10,5,0,jere****,별점이 대단히 높은걸...?  
5-27-2017,2017,5,27,17:35,토요일,10,5,0,wpaa****,가히 명작 내가 감히 평을 해도 될까 의문이 드는 최고의 영후  
5-26-2017,2017,5,26,22:33,금요일,10,5,0,전시온(smar****),나보다 1살많은 은서우누나.. 근데 너무 사랑스럽다 ♥  
5-22-2017,2017,5,22,09:44,월요일,10,5,0,돌아온검성(rhad****),이거 실화냐?  정도 입니다...  
5-18-2017,2017,5,18,21:40,목요일,10,5,0,슈(aplu****),인생영화입니다. 감사드립니다!  
5-18-2017,2017,5,18,13:00,목요일,10,5,0,앗싸(h010****),킹갓제네럴엠페럴충무공 갓 띵작 물론 보진 않았다  
5-18-2017,2017,5,18,12:38,목요일,10,5,0,Hawker(su37****),너무 감동적이여서 지금에서야 리뷰를 쓰게되었다.  
5-17-2017,2017,5,17,18:59,수요일,10,5,0,hv2h****,이건 정말 말로 표현할 수 없을 정도의 띵작입니다죽기전에 꼭한번 보세요ㅠㅠ  
5-17-2017,2017,5,17,15:40,수요일,10,5,0,djfshaj(koob****),나도 울고 흐르는 눈물도 울었다  
4-21-2017,2017,4,21,23:22,금요일,10,5,0,검은수염(jich****),10년 만에 다시 보았습니다. 그때의 감동이 꼬리뼈까지 전해 지는 느낌을 받았습니다.  잊었었군. 다시 10년 뒤에 볼렵니다.  
4-17-2017,2017,4,17,00:39,월요일,10,5,0,Bruce_Lee(takt****),제 인생은 클레멘타인을 보기 전과 본 후로 나뉩니다. 감사합니다  
4-16-2017,2017,4,16,22:27,일요일,10,5,0,msh8****,오 신이시여! 이동준이 정녕 이 영화를!!  
4-13-2017,2017,4,13,21:18,목요일,10,5,0,오가네손(ok11****),앞으로도 이런 명작은 나오지 않을것이다  
4-12-2017,2017,4,12,18:59,수요일,10,5,0,사막늑대(ka35****),다시봐도 명작ㅎㅎㅎㅎ  
4-12-2017,2017,4,12,15:15,수요일,10,5,0,subro(park****),영화를 좋아하는 제 친구에게 소개시켜줬습니다.화질이 개선되서 나왔으면 하는 바람이 있습니다.  
4-11-2017,2017,4,11,18:01,화요일,10,5,0,hams****,10 10 10 10 10 10  
4-9-2017,2017,4,9,22:11,일요일,10,5,0,뻘쭘이(gsho****),성경에 가까운 댓글 구절에 마음을 잃었으나...아직 그 분이 나에게는 먼 존재 인 것 같네요.소중한거 하난 평생 마음에만 간직하고 살아야겠다.  
4-7-2017,2017,4,7,14:22,금요일,10,5,0,배에심팍(yhs1****),이 영화에  점수를 주는 것은 영화에 대한 모욕이다.  
4-5-2017,2017,4,5,16:56,수요일,10,5,0,김경태(rksk****),이건 몇년이 지나도 잊혀지지않을 대작이다 정말 영화계역사의 한획을 그을 작품이다  
4-5-2017,2017,4,5,07:32,수요일,10,5,0,히령(heep****),아빠!!!!일어나!!!!  
4-2-2017,2017,4,2,22:47,일요일,10,5,0,Spidey(rlar****),애처롭고 처절할 줄이야...  
3-24-2017,2017,3,24,15:09,금요일,10,5,0,도마도(dogd****),이런 명작은 재개봉 안하나요?  
3-19-2017,2017,3,19,18:10,일요일,10,5,0,헐헐이(enha****),사업실패하고 한강가서 자살을 결심하기전에 이영화를 죽기전에 꼭 봐야된다고 해서 보고 가려고 소주마시면서 보고있는데 영화 끝나고 꼭 살아야되는 이유를 찾았네요 제 목숨 같은 영화입니다  
3-18-2017,2017,3,18,07:35,토요일,10,5,0,bensberg(sumy****),가족 영화의 바이블같은  
3-17-2017,2017,3,17,17:00,금요일,10,5,0,미남(hotd****),어제 우연히 이 영화를  봤다... 내 인생을 봤다...  
3-17-2017,2017,3,17,01:56,금요일,10,5,0,Silpo(see4****),우럮ㄷㅏ 퍙퍙 우럮따 이건 갓영화다  
3-16-2017,2017,3,16,00:36,목요일,10,5,0,훔바와뎀바(arto****),인생의 끝에서 다시 일어났습니다.  
3-11-2017,2017,3,11,09:58,토요일,10,5,0,nara****,ㅠㅠ내인샘 최고으ㅡㅡ  
3-10-2017,2017,3,10,21:43,금요일,10,5,0,박지원(otiu****),성지순례 왔습니다.  로또되게 해주세요.  
3-10-2017,2017,3,10,03:44,금요일,10,5,0,ssod****,네이버 평점을 신뢰하는 이유가 여기있었습니다..  
3-9-2017,2017,3,9,19:41,목요일,10,5,0,미유카 세이렌(jina****),이야...그냥 보세요. 설명할 수 없는 감동입니다.  
3-9-2017,2017,3,9,17:47,목요일,10,5,0,라그랑지(lag_****),이영화는 끝까지 봐야 진면목이 느껴지는 영화입니다. 초반의 지루함을 넘어 엔딩의 그 먹먹함까지 꼭 느껴보시길 바랍니다.  
3-9-2017,2017,3,9,13:25,목요일,10,5,0,조리즈(sfmi****),이 영화는 한국영화 사상 최고의 걸작으로 기억될 것 이다  
3-8-2017,2017,3,8,06:41,수요일,10,5,0,파스쿠치카페모카(pasc****),나에게 단 한번 시간을 돌릴 수 있는 기회가 있다면 서슴없이 클레멘타인을 극장에서 개봉 하는 날 볼 수 있게 쓰고 싶다고 말 할 수 있다.특히 그누구도 흉내 못 낼 이동준의 형사 연기는 이미 모든 남자 배우들의 우상이 되었다..  
3-6-2017,2017,3,6,16:31,월요일,10,5,0,momoring(wjdw****),"이 영화를 보고 난 후, 제 존재에 대해서 깊이 생각하는 계기가 되었습니다 감독님,제작자분들,배우분들 전부 감사합니다  "
3-5-2017,2017,3,5,18:18,일요일,10,5,0,콩두부(gavi****),내인생 최고의 영화다.  
3-3-2017,2017,3,3,13:10,금요일,10,5,0,tkdd****,클레멘타인은 저에게 성령과도 같은 존재입니다  
3-3-2017,2017,3,3,01:22,금요일,10,5,0,로드mig(mr_f****),아....  이 영화 안본사람 눈 삽니다. 아니 물론 안본사람들이 너무 부러워요 그런거에요 이 영화가 너무 명작이라.  
2-28-2017,2017,2,28,11:49,화요일,10,5,0,도강중(jlsu****),이시대를 사는 사람이면 웬지 동참해야  될 것 같아서....  
2-26-2017,2017,2,26,19:43,일요일,10,5,0,님님님님님님(code****),본 적 없는 영화지만 그냥 뭔가 10점 주고 싶네  
2-26-2017,2017,2,26,10:41,일요일,10,5,0,tlar****,눈물이 납니다. 또 보러왔어요  
2-23-2017,2017,2,23,15:34,목요일,10,5,0,크림맛족발(snst****),말도안된다너무잼나잖아  
2-23-2017,2017,2,23,04:30,목요일,10,5,0,wkrd****,이 영화를 아직보지않았다면 살아갈 이유 한가지가 더 있다는 거다...죽기 전까지 아껴서 죽기 직전에 보면 다시 생명연장이 가능할 영화...  
2-23-2017,2017,2,23,00:51,목요일,10,5,0,구현모(jack****),"사람들은 이 영화를 보기위해 산다. 아니, 이 영화는  삶 그 자체이다.  "
2-22-2017,2017,2,22,13:47,수요일,10,5,0,책상서랍(bear****),한국  영화사에 한 획을 그은 세기의 걸작  
2-22-2017,2017,2,22,10:11,수요일,10,5,0,somo****,차마 글로 표현 할 수 없는 전율..이만 줄인다.  
2-19-2017,2017,2,19,19:24,일요일,10,5,0,돌마(asdd****),영화가 끝나고 한참을 멍을 때려야만했었지  
2-19-2017,2017,2,19,15:50,일요일,10,5,0,Won(wonj****),와 진짜 난 왜 이걸 이제야 봤을까... 이거보고 한참동안 울었다 ㅠ  
2-19-2017,2017,2,19,02:57,일요일,10,5,0,세원(tpdn****),"이건 ""예술"" 이다. 이건 부녀지간의""사랑""이다  "
2-14-2017,2017,2,14,23:22,화요일,10,5,0,ookoo(yamu****),내 삶에 이런 고뇌의 순간이 찾아올 줄 몰랐다. 파일이 생겼는데 봐야하나 보지 말아야 하나.  
2-14-2017,2017,2,14,17:19,화요일,10,5,0,cand****,와...진짜명작입니다..꼭보세요  
2-12-2017,2017,2,12,15:03,일요일,10,5,0,사요나라로뎀(cool****),태권도 열풍을 가져온 명작.. 상영당시 너무 울어서 휴지판매량 급증가.. 단순히 오락영화를 넘어 국민들의 건강과 국익발전에 큰 기여를 한 대작중의 대작.  
1-30-2017,2017,1,30,20:26,월요일,10,5,0,pizzaagain(tifa****),내 인생 최고의 영화. 추천합니다  
1-30-2017,2017,1,30,10:20,월요일,10,5,0,lhw2****,지금까지 이영화를 안본것에 대한 죄책감때문에 견딜수가 없다 내자신에게 자괴감까지 느낄정도로  최고의영화이다  
1-17-2017,2017,1,17,09:55,화요일,10,5,0,차우사냥꾼(hwan****),더 이상 어떤 수식어도 필요하지않다.단지 영화 그 자체..  
1-17-2017,2017,1,17,01:44,화요일,10,5,0,거북이(gkrr****),내가 과연 이 영화를 볼 자격이 있는가에 대해 108번 고민하고 이 성스러운 영화를 보기전에 눈을 3번 씻고 봤다. 보고나서 10분동안 기립박수를 쳤다. 이건 말로 표현할수 없는 영화다.  
1-3-2017,2017,1,3,00:09,화요일,10,5,0,song****,한국영화의 최고봉 입니다  
1-2-2017,2017,1,2,20:50,월요일,10,5,0,byac****,영화라는 장르성보단 성서 처럼 Bible 그 자체입니다. 대대로 물려 볼 영화  
12-20-2016,2016,12,20,13:03,화요일,10,5,0,장생(wnsi****),소문 듣고 왔습니다. 1점 주는 것들 은 다 알바생인가요?  전설적인 영화 깎아내리지 말자구요.  
12-19-2016,2016,12,19,10:20,월요일,10,5,0,김하나(nct_****),너무 감동적이여서 보고 울었어요 인생영화입니다  
12-16-2016,2016,12,16,05:49,금요일,10,5,0,차빼임마(dann****),이 영화가 포스터만 보아도 평점 10점을 주게 된다는 그 영화군요  
12-10-2016,2016,12,10,21:44,토요일,10,5,0,김말봉(rokm****),영화는 글로 보는게 아니다. 보고 글을 남기지 않을수 없다.  
12-10-2016,2016,12,10,17:50,토요일,10,5,0,둘리(tnrh****),말이 필요없음 최고의 영화  
12-9-2016,2016,12,9,22:59,금요일,10,5,0,달콤양(alsf****),인생영화입니다 여운이 계속남네요  
11-27-2016,2016,11,27,20:59,일요일,10,5,0,오현석(yaro****),후 방금 보고왔는데 엄청난 감동이군요 다른분과들도 이 감동을 나누고싶습니다  
11-17-2016,2016,11,17,22:36,목요일,10,5,0,햅번(sere****),오른쪽에 뜨는 관련 영화. 심오하다  
11-17-2016,2016,11,17,21:34,목요일,10,5,0,jgjf****,이 영화를 본 이후 더이상 다른영화에선 감동을 느낄수가 없다 나의 인생영화  
11-17-2016,2016,11,17,21:26,목요일,10,5,0,코어에힘(quee****),이 영화를 보면 제 아무리 분노조절장애가 있는 놈이라도 벙커링 당한 것마냥 몸에서 빼애액 소리가 나면서 사리가 나오게 될 것이다.  
11-13-2016,2016,11,13,15:40,일요일,10,5,0,장달강(runn****),제 인생을 바꾼 영화 입니다  
11-11-2016,2016,11,11,23:46,금요일,10,5,0,oops****,노트북도 재개봉했는데 왜 이건안하지..  
11-7-2016,2016,11,7,17:04,월요일,10,5,0,페이스온(comc****),52억 제작비가 아깝지 않음  
11-3-2016,2016,11,3,16:49,목요일,10,5,0,도와주세요(ahr7****),이영화는 정말 대단한 영화입니다 인류 역사상 이런영화는 절대 나올수가 없습니다  
11-3-2016,2016,11,3,14:24,목요일,10,5,0,민돌(alst****),이 영화를 보고 살이 빠졌어요  
10-21-2016,2016,10,21,15:48,금요일,10,5,0,이여오(pkyb****),지하철에서 이 영화를 보고 있었는데옆에서 힐끔거리던 백인이 스티븐 시걸의  격투씬을 보고 새하옇게 질려 백인이 되었습니다김두영 감독 인생의 최고 역작  
10-19-2016,2016,10,19,19:04,수요일,10,5,0,거송(asj7****),와...진짜..너무 ..감동적이여서..이걸본지 10년이 지난 아직도 눈물이 멈추질 않습니다  지금도 울고있음  
10-18-2016,2016,10,18,16:55,화요일,10,5,0,선혁(cupi****),죽기전에 꼭 봐야할영화  
10-18-2016,2016,10,18,06:55,화요일,10,5,0,Lelouch Lamperouge(dkqp****),명작. 그 이상 말이 필요없는 영화 꼭 보세요 죽기전에 봐야할 영화  
10-16-2016,2016,10,16,19:38,일요일,10,5,0,dickworld(ne12****),김두영감독은천재다 할말이없다  
10-11-2016,2016,10,11,18:10,화요일,10,5,0,jbc1****,아빠 일어나!!! 그 장면에서 나도 모르게 눈물이 흐르고 말았다  
10-10-2016,2016,10,10,22:39,월요일,10,5,0,둣ㅇㅈㄷㄴ(jwi1****),9점이라고 하긴 부족하고 11점이라고 하기에는 너무 많은 것 같아 10점 드립니다  
9-19-2016,2016,9,19,13:56,월요일,10,5,0,blahblah(jayh****),이 영화를 보고 너무 감격받아서 전두엽에이상이 왔습니다.  
9-18-2016,2016,9,18,22:33,일요일,10,5,0,마리(maxf****),좋은 영화 만들어주셔서 감사합니다  감독님  
8-23-2016,2016,8,23,16:46,화요일,10,5,0,바보(ygpa****),이영화를 보고 저희 할머니가 김클례로 개명하셨습니다.  전 이타인 입니다 ㅠㅠ  
8-23-2016,2016,8,23,16:37,화요일,10,5,0,시대정신(kjk5****),시간을 되돌릴 수 있다면 무조건 클레멘타인 보기전으로 돌아갈 것이다. 그 때의 감동을 다시 느끼기위해서  
8-17-2016,2016,8,17,23:03,수요일,10,5,0,황세연(holi****),아! 첫 번째 볼 때는 영화에 담긴 깊은 뜻을 왜 못알아 봤을까요? 두 번보니 세 번 보지 않을 수 없고 연구할 작품이라는 걸 겨우 깨닫게 되는군요. 이 영화를 보고 감정을 추스리느라 하룻밤을 지냈는데... 재상영 안 하나요? 극장에서 보고싶어요.  
8-14-2016,2016,8,14,18:31,일요일,10,5,0,국민식빵오재원(chs0****),이 영화를보고 눈물이 더이상 나오지 않습니다  
8-13-2016,2016,8,13,13:29,토요일,10,5,0,mma93(ckda****),인공눈물 없이는 보지마세요. 눈물샘이 말라 죽을뻔한 기억을 남겨준 그런 영화.  
8-11-2016,2016,8,11,17:26,목요일,10,5,0,킴(haih****),야근을 해도 직장에서 왕따가 되어도 그리고 여자친구가 없어도 저는 별로 슬프지 않습니다. 바로 클레멘타인을 볼 수 있는 시간만 주어진다면 옥살이를 해도 행복할 것 같습니다.  
8-9-2016,2016,8,9,00:40,화요일,10,5,0,unsa****,보면서 감동받고 울었어요  
8-8-2016,2016,8,8,20:51,월요일,10,5,0,gaio****,최고의영화입니다 꼭봐요  
8-6-2016,2016,8,6,11:36,토요일,10,5,0,아이조아(chlc****),한국인 이라면 꼭 봐야죠  
8-5-2016,2016,8,5,16:49,금요일,10,5,0,nickelback(ejrt****),이 영화를 보는데 쓰인 데이터 만큼이나 가치 있는 것은 없었다  
8-2-2016,2016,8,2,10:30,화요일,10,5,0,소기(ahns****),어떻게 이런 영화가 2004년도에... 대단하네요!  
8-1-2016,2016,8,1,23:40,월요일,10,5,0,세계최강이글스(yomm****),시대를 잘못만난 명작..  
8-1-2016,2016,8,1,01:14,월요일,10,5,0,몰라두돼(rlaa****),스티븐시걸 연기가 장난이아니네요  
7-30-2016,2016,7,30,23:31,토요일,10,5,0,mekd****,이 영화를 보지 않았다면극장에 갈 자격이 없다  
7-27-2016,2016,7,27,18:21,수요일,10,5,0,우가우가(kjcl****),보지않았는데 벌써 소름돋는다  
7-27-2016,2016,7,27,18:14,수요일,10,5,0,이쁜곰vv(duks****),단 5분만에 11점이라는 단어가 이해가 되었습니다. 놀랍습니다.  
7-12-2016,2016,7,12,00:47,화요일,10,5,0,bbs1****,클레멘타인....클레멘타인  
7-11-2016,2016,7,11,23:01,월요일,10,5,0,java****,별점을 10개 밖에 줄 수 없다니..  
7-4-2016,2016,7,4,12:35,월요일,10,5,0,핏빛(jaeh****),정말 감동입니다. 한민족의 힘을 보여줍시다  
6-4-2016,2016,6,4,11:36,토요일,10,5,0,zhff****,3213253300점  
6-3-2016,2016,6,3,03:48,금요일,10,5,0,고문관(moor****),어제 VOD서비스로 봤는데 왜 평점이 이렇게 높은지 알겠더군요. 연출이며 각본 연기력 삼박자가 딱딱 맞아 떨어지는게 영화연출 공부하는 저에게 많은 도움이 됐습니다. 눈물을 너무 흘려서 인체수분 부족으로 응급실 실려갔다왔습니다. 정말 최고입니다.  
6-1-2016,2016,6,1,00:15,수요일,10,5,0,dkagoddjtk(anst****),웃는 집에 클레멘타인DVD가 있다  
5-30-2016,2016,5,30,23:02,월요일,10,5,0,1991 뭐가될까(insu****),ㅋㅋㅋDVD  2000원대 팔고있어  
5-27-2016,2016,5,27,16:57,금요일,10,5,0,페이(jinn****),요즘 곡성이 역대급영화라 해서 10년만에 극장에 가서 봤는데... 너무 기대를 한 탓인가요? 보는내내 실망감이 들었네요. 클레멘타인을 보며 느꼈던 감동을 다시금 느낄 수 있을까 기대를 했는데.. 역시 제 맘속에 최고의 영화는 클레멘타인 뿐입니다.  
5-24-2016,2016,5,24,11:58,화요일,10,5,0,날아라영계(yhhj****),1년전 평점을 본후  힘들게 DVD를 종로가서 구한후 아내랑 영화를 감상한후 저와 태권사랑을  나눈후 난 아이... 이름을 동준이로 졌습니다  
5-22-2016,2016,5,22,22:52,일요일,10,5,0,dhdudieiwsj(kkmi****),누군가 나에게 한가지소원을 들어준다한다면 나는 1초의망설임도없이 클레멘타인을 보기전으로 되돌려달라고 할것이다.  
5-19-2016,2016,5,19,17:52,목요일,10,5,0,sanl****,"영화를  보는 마인드가 바뀌었습니다, 최고의 명작  "
5-18-2016,2016,5,18,21:14,수요일,10,5,0,모두까기인형(rlar****),"와ㅜㅜ...,.,.,.,.  "
5-18-2016,2016,5,18,12:47,수요일,10,5,0,안성호(best****),사람들평점이 하도구라같아서 다운받아서봤는데...액션수준이 처음 옹박봤던 그느낌이였다...대단한 액션물이다정말... 최고다...마지막에 너무슬퍼서 펑펑울었네...대박..찡하다..정말  
5-17-2016,2016,5,17,17:31,화요일,10,5,0,정연춘(luck****),이 영화를 보고 진짜 아버지가 일어나셨습니다. 제 뒤통수를 한대 때리시더군요. 남자의 마초본능을 자극하는 걸작입니다.  
5-15-2016,2016,5,15,23:39,일요일,10,5,0,JYP(wpdu****),이영화를보고암이암에걸렸습니다  
5-14-2016,2016,5,14,20:58,토요일,10,5,0,구구(scho****),노아가 살아있다면 이 영화를 방주에 실었을 것이다.  
5-4-2016,2016,5,4,12:21,수요일,10,5,0,광마두영(b2yo****),전 감독과 동명이인입니다  
4-21-2016,2016,4,21,18:40,목요일,10,5,0,tcs3****,이 영화는 만점외에 줄것이 없다. 꼭 봐라. 死번 봐라.  
4-21-2016,2016,4,21,01:38,목요일,10,5,0,cldu****,이 영화를 점수로 평가하게 만든 네이버부터가 잘못된 거다이 영화는 정말 인생 최고의 걸작이다  
4-20-2016,2016,4,20,14:30,수요일,10,5,0,seju****,너무 감동적이여서 방구까지 껴버렸네요  
4-19-2016,2016,4,19,21:27,화요일,10,5,0,제헌절(jhob****),눈이 너무 높아져서 앞으로 다른 영화를 못 볼 것 같아 걱정이 되네요ㅠㅠ  
4-18-2016,2016,4,18,11:00,월요일,10,5,0,엘제이(ljb3****),원빈의 아저씨는 이 영화를 보고 배워야 했다  
4-12-2016,2016,4,12,23:17,화요일,10,5,0,Mimor(s1ve****),신이 클레멘타인을 보기위해 인간을 만들었다.  
4-8-2016,2016,4,8,16:29,금요일,10,5,0,최학준(cgoo****),"이 영화를 보기전의 삶과 보고난 후에 제삶은 완전히 달라졌습니다. 사회복지사인 저는 노인정에가서 어르신들께 이영화를 틀어드리고, 반신불수였던 할아버지는 일어나 춤을 추셨고, 눈이 잘 보이시지 않던 할머니는 눈물을 흘리시고 시력이 2.0으로 상승했습니다  "
4-5-2016,2016,4,5,16:52,화요일,10,5,0,까리한남자(kks0****),살아갈 용기를 주는영화  
4-4-2016,2016,4,4,02:44,월요일,10,5,0,데루차져니(imdo****),죽기전에 한번은 봐야할 영화  
4-3-2016,2016,4,3,21:16,일요일,10,5,0,CrayOn(yhk1****),이 영화는 희대의 영화이다.  
4-2-2016,2016,4,2,12:17,토요일,10,5,0,하루나기(haru****),최고의 감동 최고의 걸작  
4-1-2016,2016,4,1,08:31,금요일,10,5,0,teed****,눈물이ㆍ가족끼리 5시간을 울었다ㆍ  
3-26-2016,2016,3,26,18:29,토요일,10,5,0,마시마로(iceh****),클레멘타인을  본 이후로 나는 단 한번도 눈물을 흘린적이 없다.  이 영화를 보고 너무 많이 울어서 눈물샘이 다 말라버렸기 때문이다. 감동의 역작이다.  
3-26-2016,2016,3,26,17:52,토요일,10,5,0,아슈레이(jinu****),세계문화유산 등재가 시급하다  
3-24-2016,2016,3,24,12:28,목요일,10,5,0,테크노(teck****),구라 안치고 졸라 재밌다~ 한국영화 수작  
3-21-2016,2016,3,21,21:02,월요일,10,5,0,mjh2****,사실 콜린퍼스에게 올드보이보다 클레멘타인을 추천하고 싶었다.-킹스맨 감독-  
3-18-2016,2016,3,18,19:36,금요일,10,5,0,이별한줌(wind****),이 영화를 보고 새로운 삶을 살게되었습니다.최고의 명작  
3-14-2016,2016,3,14,22:30,월요일,10,5,0,hand****,사람들이 평점으로 장난치는 것 같아서 볼지 말지 정말 고민 많이 했습니다....이 영화를 본 건 2016년 최고의 선택이었습니다.  
3-12-2016,2016,3,12,22:36,토요일,10,5,0,진청(pmin****),이 명작을 드디어 봤습니다.  밀려오는 감동이 저를 휩씁니다.  
3-7-2016,2016,3,7,10:13,월요일,10,5,0,KTBFFH CFC(psb0****),이것은 마치 완벽의 퍼펙트에서 불어오는 마스터피스의 명작의 필링의 느낌. 우리의 티어의 눈물과 새드의 슬픔의 퍼펙트한 완벽의 하모니의 조화. 아 OO 할 말을 잊었습니다  
3-6-2016,2016,3,6,13:10,일요일,10,5,0,ahab(ybwi****),이런 영화는 난생 처음입니다. 이 영화를 보는 순간 머리를 얻어맞는듯한 충격과 목이 매여오는 기분이 엄습하여 마치 새로운 세계를 맞보는 기분이었습니다. 자신있게 추천합니다 크레멘타인!  
2-14-2016,2016,2,14,21:00,일요일,10,5,0,덕(haha****),2200년은 되야 이 작품의 위대함을 알아줄 것 같다.  
2-14-2016,2016,2,14,19:33,일요일,10,5,0,miles(gino****),저도  이 영화를  보고  암이 나았습니다.  암세포가  암에걸려  뒤졌기때문입니다  
12-25-2015,2015,12,25,10:39,금요일,10,5,0,백커리(tk01****),소문듣고  이제서야 봤는데 넘감동적이네요?가슴이 먹먹해서 일이 손에 안잡힙니다  
12-25-2015,2015,12,25,01:49,금요일,10,5,0,귀귀(swa0****),"난 지켜야 할것이 있다 집사람, 아들,딸, 클레맨타인  "
11-30-2015,2015,11,30,12:38,월요일,10,5,0,루(loos****),사람이 너무 감동하면 먹먹해지는구나  
11-22-2015,2015,11,22,05:15,일요일,10,5,0,바가지321(bass****),할아버지 생전에 오직 이 영화만을 너무나 좋아하셔서 장례식장 영정앞에 TV 갔다놓고 계속 틀어놨습니다. 조문객들이 당최 갈 생각을 안하네요.  
11-13-2015,2015,11,13,11:25,금요일,10,5,0,gnas****,왜 유네스코는 이 영화를 세계유산으로 지정하지 않는가.  
10-27-2015,2015,10,27,04:02,화요일,10,5,0,장원(apcs****),영화를 보고 암이 치유되었다  
10-26-2015,2015,10,26,20:36,월요일,10,5,0,deja****,이영화를 본후 10년을 사귀어온 여자친구와 헤어졌습니다제인생 다시한번 시작해볼랍니다참고로 족저근막염을 앓고 있었는데이영화를 보고 깨끗이 나앗어요  
10-24-2015,2015,10,24,00:58,토요일,10,5,0,WildArm(wild****),이 전설같은 영화를 이제서야 볼 수 있다니... 이 영화를 생각할 때마다 웃음이 나옵니다 한국영화 뿐만 아니라 전세계의 모든 영화 중에서도 이 영화를 이길 영화는 앞으로도 없을 것 같은 제 예감이... 현실이 되기를 바랍니다  
10-23-2015,2015,10,23,22:33,금요일,10,5,0,Aku mimpi(manp****),이런 명작을 컴퓨터로 보다니 너므 아쉽습니다..스크린 재개봉은 언제 하나요??재개봉 하면 꼭 보러 갈래여..  
10-21-2015,2015,10,21,17:47,수요일,10,5,0,아빠코냥이(wook****),이제야 어디가서 자랑할수 있겠네요...사실 럼청 고민했었는데 보고나니 정말 속이 후련해지는 저도 오디가서 영화좀 봤다고 자랑할수 있겠습니다 .  
10-21-2015,2015,10,21,08:19,수요일,10,5,0,마우스챗(ratc****),명작입니다 기회가 된다면 다시한번 보고 싶습니다  
10-20-2015,2015,10,20,19:11,화요일,10,5,0,미칼렌(akxl****),최고의 영화다. 우주 최고  
10-20-2015,2015,10,20,18:18,화요일,10,5,0,리드(chdo****),진짜 이 영화는...한국영화하면 1순위로 생각나는 영화다  
10-15-2015,2015,10,15,01:16,목요일,10,5,0,이순신(dksg****),입대 해서도 보고싶은 영화  
10-7-2015,2015,10,7,08:23,수요일,10,5,0,hjh0****,"지하철에서 이 영화를 보면서 갔습니다. ""아빠 일어나"" 라는 대목에서 모든사람이 일어나는 광경을 보았습니다.  "
9-26-2015,2015,9,26,13:21,토요일,9,5,0,사자갈기(les2****),댓글이 잼ㅎ다. 나두한번 봐야지  
7-28-2015,2015,7,28,09:01,화요일,10,5,0,에이핑크(alsd****),씨:see(보앗다)걸:걸작을  
7-25-2015,2015,7,25,21:39,토요일,10,5,0,mari****,"지금 개봉했으면 20,000,000명 관람기록은 세웠을텐데 ㅠㅠ 희대의 역작 ㅠㅠㅠ  "
7-22-2015,2015,7,22,20:34,수요일,10,5,0,Perisher(sama****),어느덧 이 영화를 15번을 봤다. 만약 내가 이 영화를 18번째 보게 되면 아마도 난 다신 다른 영화를 볼수 없을 것이다. 내 영혼이 이 영화에 갇히게 될 것 이기 때문이다. 조금씩 두려워진다.  
7-21-2015,2015,7,21,03:21,화요일,10,5,0,MMALim(flku****),두말할 필요 없는 명작.  
7-21-2015,2015,7,21,00:54,화요일,10,5,0,말랑소짱(yyhy****),인생은 클레멘타인을 보기 전의 인생과 클레멘타인을 보고 난 후의 인생으로 나뉜다  
7-10-2015,2015,7,10,17:30,금요일,10,5,0,던창과사람의경계(zkem****),이 영화를 하야시가 봤어야 했다. 다시 조선으로 돌아왔을텐데...  
7-3-2015,2015,7,3,12:12,금요일,10,5,0,액터즈(apfm****),노아가 있었을때 이 영화가있었다면 노아는 방주에 이 영화부터 먼저 실었을것이다.  
7-2-2015,2015,7,2,22:22,목요일,10,5,0,회상(alon****),이 영화를 다운받자 고장난 컴퓨터가 슈퍼컴퓨터로 업그레이드 되었습니다.  
7-2-2015,2015,7,2,10:49,목요일,10,5,0,MC맹(jin0****),이 영화를 보고 허리디스크가 나았습니다.  
7-1-2015,2015,7,1,05:55,수요일,10,5,0,휴비(hyoo****),일어나 클레멘타인!!  
6-29-2015,2015,6,29,17:12,월요일,10,5,0,피자맨(dyna****),클레멘타인 안본 눈 삽니다(성냥팔이소녀의 재림 안본 눈이랑 교환 가능). 직구로만 구매 혹은 교환 원해요 직구장소는 7광구였으면 좋겠네요  
6-23-2015,2015,6,23,21:05,화요일,10,5,0,tkdq****,식음을 전폐하고 눈물로 목을 축이는 중이다. 인생 최고의 영화다.  
6-20-2015,2015,6,20,15:21,토요일,10,5,0,fdasjkfjal(bjwz****),이제 전 죽어도 여한이없습니다  
6-19-2015,2015,6,19,19:27,금요일,10,5,0,황민수(hwan****),내 인생 최고의 영화를 뽑으라면 당연컨데 클레멘타인을 뽑을 것이다.  
6-14-2015,2015,6,14,22:06,일요일,10,5,0,트타(hong****),진짜  사람들 질 떨어지네... 이런 영화 다같이 보고 감동 먹고해야지 어떻게 1점을 주냐  
6-13-2015,2015,6,13,20:54,토요일,10,5,0,dasomtang(daso****),살면서 이런 보물같은 영화를 지금에서야 보다니 제 자신이 참 부끄럽고 인생을 한번 되세겨보는 계기가 되었습니다. 이 영화를 봤으니 이젠 인생 헛 산게아니라고 자신있게 말할수 있어서 다행입니다.  아빠 ! 일어나 ~  흑 !   감동의 도가니탕으로  
6-11-2015,2015,6,11,21:29,목요일,10,5,0,Dinner(opkd****),울었다. 그저 우는것 밖에는 표현할 길이 없었다.  
6-3-2015,2015,6,3,20:24,수요일,10,5,0,Acid(wjww****),"형이상학을 담은 100분, 세계의 존재목적에 대한 본질적 탐구. ""아빠, 일어나!""를 외치는 은서우의 목소리는 가치관이 붕괴하는 현대사회를 향한 처절한 일갈이었다.  "
6-2-2015,2015,6,2,00:13,화요일,10,5,0,Quakecustoms_ABLE(jafu****),140자 내로 이 영화를 설명하라고?? 제 정신이냐  네이버?  
5-31-2015,2015,5,31,23:34,일요일,10,5,0,kimd****,"영화 감독입니다차기작은  클레멘타인2로 결정했습니다탐크루즈, 크리스찬베일  등헐리우드 탑스타들이 출연을 희망하고 있지만저는 시갈 형님과 동준 형님 아니면 작품안하려고요조금만기다려 주세요전편보다는 못하겠지만훌륭한 작품 만들어 보겠습니다  "
5-28-2015,2015,5,28,03:09,목요일,10,5,0,leee****,평가 글 보고 나서 낚시라는 생각이 들었는데 뭔가에 홀린듯 이 영화를 다운받았어요. 역시나 낚였다고 생각이 들 찰나....저도 모르게 눈 앞이 뿌예지더군요. 크레딧이 올라갈때까지 티슈 2박스는 족히 비웠습니다....  
5-22-2015,2015,5,22,12:51,금요일,10,5,0,위닝(kija****),눈물이 앞을가려 눈이 떠지지 않는다.  
5-22-2015,2015,5,22,08:05,금요일,10,5,0,JacquesJeaux(jacq****),네티즌들의 이 높은 평점들은 영화에 바치는 평점이 아니다. 이 영화를 끝까지 본 자신에게 주는 평점이다.  
5-16-2015,2015,5,16,21:39,토요일,10,5,0,mrko****,난 매년 내 생일날만 기다린다  생일날 미역국 대신 이영화를 10년째 보았다   난 이제 몇번을 더 볼수 있을 것인가  
5-6-2015,2015,5,6,23:00,수요일,10,5,0,sos1****,이 영화를 보고 취업에 성공했습니다.  
4-30-2015,2015,4,30,15:54,목요일,10,5,0,왕바우(sdi1****),이영화가 조금만 더 빨리 개봉했다면  6.25 전쟁은  절대 일어 나지  않았다.  
2-21-2015,2015,2,21,19:36,토요일,10,5,0,이랬다저랬다(tldz****),이영화 아무도 보지 마십시요 저만 볼겁니다  
1-30-2015,2015,1,30,18:43,금요일,10,5,0,yj(nint****),나도 기억상실증이란 병을 앓고싶다....그러면 몇번이고 처음볼때의 그 전율을 느낄수있을테니까...  
1-29-2015,2015,1,29,17:30,목요일,10,5,0,이미역(sk99****),클레멘타인이 무사히 개봉한 2004년 5월21일.. 이 날 우주는 제 역할을 다했다.  
1-4-2015,2015,1,4,16:03,일요일,10,5,0,Schmitt(tjrw****),마지막 화면까지 다 본 최초의 영화입니다  
12-19-2014,2014,12,19,05:03,금요일,10,5,0,실피로(mart****),"사람들이 이 영화를 왜 꼭 봐야 하는지 알게 되었다. 시험기간에 봤으면 큰일날 뻔, 자칫하다가 영화에 빠져 시험공부를 제쳐놓고 몇번이고 돌려봤을 것이기 때문이다. 시험이 끝났기에 망겅이지 그렇지 않았으면 이 영화 때문에 감동에서 헤어나오지 못했을 거다  "
12-8-2014,2014,12,8,03:09,월요일,10,5,0,아주그냥(wfl0****),인생은  B(Birth)와 D(death)사이에  C (Clementine)이 존재한다.  
12-6-2014,2014,12,6,15:46,토요일,10,5,0,눈이내리면(bagg****),"저는 원래 앉은뱅이였었습니다. 그러던 어느날 전 이 영화를 가족들이랑 보았고 너무 감격한 나머지 눈물을 흘리며 그 자리에서 ""할렐루야""를 외치며 벌떡 일어났고 걸을 수 있게 되었습니다. 저의 할머니는 수명이 10년이나 더 늘어났습니다.  "
11-29-2014,2014,11,29,11:34,토요일,10,5,0,edge****,아름답다 한편의 최고수준의 아름다운 시를 읽은 느낌  
11-28-2014,2014,11,28,15:04,금요일,10,5,0,ths0****,이 영화를 한번도 안 본 사람은 있지만 한번만 본 사람은 없다  
9-26-2014,2014,9,26,21:52,금요일,10,5,0,안남열(bloo****),인문학적인 영화다. 집에있던 고전 철학서들을 모조리 불태우고 그자리에 클레멘타인 DVD를 진열했다. 3D 재개봉을 강력히 제안한다. 인류의 정서함양과 자기성찰의 시간을 위하여.  
9-24-2014,2014,9,24,16:55,수요일,10,5,0,후후(abh1****),12개월된 딸바보 아빠인데 우리 딸이 말을 시작하면아빠 일어나!!  이거 부터 가르칠려구요 명대사에 완전감동  
9-23-2014,2014,9,23,18:01,화요일,10,5,0,영애천사(kim8****),정말 말이 안나온다~ 정말 시간은 금이다라는 말을 알게 해준 영화다.  
9-20-2014,2014,9,20,21:26,토요일,10,5,0,한예슬(xnis****),"""두유 노우 싸이?"" 하지말고 ""두유 노우 클레멘타인?""을 해야할 때이다..  "
9-17-2014,2014,9,17,14:33,수요일,10,5,0,naac****,아빠!! 일어나!! 나도 울고 아들도 울고 집사람도 울었다....  
9-16-2014,2014,9,16,14:33,화요일,10,5,0,홍홍홍(deng****),한국 영화계 길이남을 명작!  
9-16-2014,2014,9,16,01:44,화요일,10,5,0,동행큐브(gksz****),이 영화를 보고 암이 나았어요 최고입니다!  
9-10-2014,2014,9,10,16:19,수요일,10,5,0,ehdb****,말이필요없다.이건한국영화사상최대의걸작이다.이걸보고울지않는사람들은 눈물샘에가뭄이온거다.  
9-10-2014,2014,9,10,12:29,수요일,10,5,0,동동(lenk****),와..진짜 대작..나도울고 엄마도 울고 우리할아버지도 울었다..  
9-9-2014,2014,9,9,22:47,화요일,10,5,0,동네총각(kimm****),누군가를 위해 울 수 있는가?그 눈물을 아껴두어라이 영화를 보고 자신을 위해 울라  
9-4-2014,2014,9,4,22:30,목요일,10,5,0,야화애인(extr****),믿을수없는 평점에 수많은 뎃글을 정독했다~ 결론은 하나! 시간 가는줄모르고 보고 또 봤다 두주먹이 울부짓는다 왜 이제야봤는가!!! 인생관이 달라졌다  이젠 어떤 역경이라도 이겨낼수있다 아빠 일어나!!!! 마음속에 아직도 매아리친다~  
9-2-2014,2014,9,2,21:29,화요일,10,5,0,디지리더(vamp****),예전영화인데 새삼 영화는 CG가 전부는 아니구나 느낀영화입니다. 역시 영화는 스토리 마지막씬은 잊을수가없군요 강추합니다.  
9-2-2014,2014,9,2,15:45,화요일,10,5,0,가넷(jsjs****),엄청난 평점과 댓글들이다안보고는 못버티겠다엄청난 감동을 받기전이니목욕재계하고 머리속을 비운후깨끗한  정신으로  보야겠다  
9-2-2014,2014,9,2,12:50,화요일,10,5,0,Sheogorath(baew****),다시 리메이크 됐으면 하는 영화 0순위  
9-2-2014,2014,9,2,12:07,화요일,10,5,0,towo****,선10점 후감상영화가 끝난뒤에야 10점의 참의미를 깨달았다  
8-28-2014,2014,8,28,18:12,목요일,10,5,0,수성(susu****),"나의 버킷리스트 중 하나인 이 영화를 본순간 가족의 소중함, 삶의 의미를 알게 되었다. 인생 최고의 영화 이다. 모두들 한번만 보지 말고 두번봐라.  "
8-28-2014,2014,8,28,01:39,목요일,10,5,0,동내철권대장(c4bi****),슬프네요 ㅜㅜ 명작입니다..  
8-27-2014,2014,8,27,15:48,수요일,10,5,0,개념탑재술(lees****),드디어 보았네요. 나이 40대 중반에 이런 감동을 느낄 수 있음에 스스로도 대견한 생각이 듭니다. 먼 훗날 제 아이들도 이 영화를 보고 저와 같은 감동을 느끼길 바라는 건 그저 바램이겠지요?  
8-27-2014,2014,8,27,12:05,수요일,10,5,0,귀차니즘(slnj****),이 영화는 그야말로 신깨서 주신 영화이다. 이 영화에 평점을 준다는것은 한 인간으로서의 가장 큰 영광이  아닐수 없다. 이 위대한 영화를 보아라 그리고 가슴의로 느껴라  
8-27-2014,2014,8,27,01:58,수요일,10,5,0,lys5****,이영화를 보고난 후 말기췌장암이 나았습니다이건 정말 기적입니다.  
8-26-2014,2014,8,26,20:19,화요일,10,5,0,꼬꼬마(alco****),항암치료제zzzdghh  
8-21-2014,2014,8,21,22:27,목요일,10,5,0,HY(taew****),내가 클레멘타인을 본 이유는 그곳에 클레멘타인이 있기 때문이다  
8-21-2014,2014,8,21,21:33,목요일,10,5,0,세이(wldd****),...쩌..쩌러어벤져스는 개졸작이었다  
8-21-2014,2014,8,21,18:37,목요일,10,5,0,가지(lee9****),네이버의 평점제도는 있어서는 안된다.감독의 혼신의 얼과 땀방울 노력이 고작 별몇게에 좌지우지 된가는것이 조금 씁쓸하디아니한가?그리고 결정적으로 클레멘타인과 같은영화가 `고작` 10점밖에 줄수없다는것이다...  
8-18-2014,2014,8,18,14:56,월요일,10,5,0,루미나리에(plex****),난 매일 클레멘타인에 평점 10점을 주는걸로 하루를 시작한다.  
8-16-2014,2014,8,16,20:56,토요일,10,5,0,진돌이(eric****),"화려한연출,최고의감동  "
8-16-2014,2014,8,16,17:40,토요일,10,5,0,없군하(kimh****),눈물 슬픔같은 말로는 형용할 수 없는 그런 감정이 북받치게 만드는 영화엿습니다...  
8-16-2014,2014,8,16,14:36,토요일,10,5,0,모건(wpwj****),말이필요없다....  
8-14-2014,2014,8,14,12:09,목요일,10,5,0,가나다라마바사(qkrd****),10점이라는 점수는 오직 이 영화를 위해 만들어진 점수 같다.  
8-14-2014,2014,8,14,10:26,목요일,10,5,0,Rhymeholic(paul****),이 시대가 낳은 희대의 극작  
8-14-2014,2014,8,14,10:08,목요일,10,5,0,체게바라(fage****),제 인생의 전환점이 된 영화입니다.  
8-13-2014,2014,8,13,23:24,수요일,10,5,0,mjms****,이거보고 엄마도 울고 나도 울었다  
8-13-2014,2014,8,13,04:49,수요일,10,5,0,취미생(qhrh****),"평소 액션영화를 좋아했던지라 고민없이 감상했는데, 올드보이의 장도리신, 원빈의 아저씨를 능가하는 액션 연출.. 영화를 다 보고 나서도 몇 번이나 돌려보게 되네요. 정말 대작입니다.  "
8-12-2014,2014,8,12,15:39,화요일,10,5,0,라스트오더(chan****),평소 감정이 메말랐다고 생각하거나 그런소리를 들었다면 이 영화를 봐라.  
8-12-2014,2014,8,12,14:46,화요일,10,5,0,롸잇나우(wc17****),이걸 안 보는 게 이상하지.  
7-29-2014,2014,7,29,02:04,화요일,10,5,0,산나물(lasa****),10년전에 이런 영화를... 재개봉하면 7번방의 선물을 분명 뛰어 넘을 천만 영화가 될것임. 개봉시기를 잘 못 맞췄다.  
7-19-2014,2014,7,19,08:49,토요일,10,5,0,김맥(end0****),한국최고의파이터 이동준형님 길이남을 명작임  
7-19-2014,2014,7,19,05:43,토요일,10,5,0,누노(nuno****),이 영화를 본 후 다른 영화들이 잼있어지기 시작했다... 참 고마운 영화!  
7-19-2014,2014,7,19,02:58,토요일,10,5,0,김예지(gmsw****),"50억 대작, 화려한  주,조연캐스팅, 까메오 마저도 완벽함, 섬세한 감정묘사,관객 흡입력, 모든것이 내눈을 의심하게 했다. 이 시대의 필수영화...  "
7-18-2014,2014,7,18,21:53,금요일,10,5,0,yoon****,저의 소원은 조국통일과 클레멘타인의 재개봉입니다  
7-18-2014,2014,7,18,18:36,금요일,10,5,0,kill(jooy****),이 영화 때문이라도 세상은 충분히 살만한 가치가있다는걸 느꼈다..  
7-18-2014,2014,7,18,15:58,금요일,10,5,0,별명없어여(inha****),다시 찾아본영화 굳 또보고싶다  
7-18-2014,2014,7,18,12:38,금요일,10,5,0,생각(larc****),유머를 모르는 몇몇 분들의 평점이 마음을 아프게 하네요. 삶의 여유를 찾길 바랍니다. 언젠가 성지가 될 이곳에 늦지않아 다행이네요.  
7-18-2014,2014,7,18,10:17,금요일,10,5,0,devante(iamd****),내가 이영화를 평가할 가치가 있는가..에 대해 2시간 30분간 고민하고 저녁을 먹었다. 밥을먹는데 왜 그리 눈물이 나던지. 그후로 내 인생은 달라졌다. 봉사활동도 하고 주위사람을 돕고 살고 있다. 클레멘타인은 그런 영화이다.  
7-18-2014,2014,7,18,09:23,금요일,10,5,0,샐리(perc****),높은 평점에 선택한 영화 ...왜  이제서야 봤는지꼭 보시길 바래요 진정한 영화의 깊이를 ㅎ  
7-18-2014,2014,7,18,07:34,금요일,10,5,0,술잔위에초생달(hyun****),아빠!....일어나!!...이한마디에 부들 부들 떨리는 손으로 담배를 물게 되었다...감동의 쓰나미... 더이상 말이 필요없다!! 절대강추!!!  
7-18-2014,2014,7,18,00:46,금요일,10,5,0,mal7****,2004년 한국영화의 역사를바꾼 두영화가 클레멘타인이랑 여고생시집가기 이다.  손에 눈물닦을 손수건들고 꼭봐라...  
7-18-2014,2014,7,18,00:36,금요일,10,5,0,농띠(swka****),왜 진작 이 영화를 몰랐을까요... 하아~~~  
7-18-2014,2014,7,18,00:01,금요일,10,5,0,오직똥배(achi****),나는 이 영화를 보기위해 집에있는 홈시어터를 전부 버리고 최신형으로 장만해야했다. 대부와 이 영화..둘 중 하나를 골르라면 자살할 정도로 어려운 질문이다  
7-17-2014,2014,7,17,21:19,목요일,10,5,0,희대(forz****),내일 지구가 멸망한다면 나는 주저없이 클레멘타인을 한번 더 볼것이다.  
7-17-2014,2014,7,17,20:28,목요일,10,5,0,SJ(kims****),이 영화를  평가한다는 것에 죄책감이 든다. 하늘에 별을 모두 따다가 평점을 주기에도 모자란 것을..  
7-17-2014,2014,7,17,19:40,목요일,10,5,0,베댓(tjdq****),이런 명작을 이제야 보다니...난 지금껏 무엇을 하고 산거지...내가 감히 이영화를 평가하는게 우습다...이 영화 평점을 고작 10점밖에 주지 못하는게 한스럽다. 대한민국 영화계에 길이 남을만한 작품이다. 안봤으면 꼭 봐라 두번 봐라  
7-17-2014,2014,7,17,19:25,목요일,10,5,0,쿠리조아(kuri****),감히 타이타닉에 견줄 영화  
7-17-2014,2014,7,17,16:20,목요일,10,5,0,왕백수(wjse****),클레멘타인 절대 보지마라..클레멘타인을 본 이후 어떤 영화를 봐도 감흥이 없다. 다신 영화를 보며 재미와 감동을 느낄 수 없을 것만 같다.  
7-17-2014,2014,7,17,15:20,목요일,10,5,0,유리딱새(vamp****),세상에 단 하나뿐인 주옥같은 명작이다  
7-17-2014,2014,7,17,15:20,목요일,10,5,0,꽃쏭이(yoks****),그냥봐라 나도 모르겠다  
7-17-2014,2014,7,17,14:09,목요일,10,5,0,조용팔(jo17****),"아직 이영화를 보지 않은 사람이 있다면, 그 사람이 되고 싶다.  "
7-17-2014,2014,7,17,13:40,목요일,10,5,0,뉘하오추판(sola****),우연히 클레멘타인을 봤습니다. 눈물이 흘렀습니다. 이 눈물의 의미를 많은 분들께 전해드리고 싶습니다. 그리고 영화를 보는내내 동요 클레멘타인이 머릿속을 맴돌더군요. 영화시청후 클레멘타인동요를 들으면 또 다른 감동을 받았습니다.  
7-17-2014,2014,7,17,13:36,목요일,10,5,0,stin****,이런 영화가 헐리우드 진출을 했어야 하는데 ㄸㄸㄸ성지순례 다녀갑니다. ㄷ ㄷ  ㄷ  
7-17-2014,2014,7,17,13:08,목요일,10,5,0,desi****,면접관이 클레멘타인을 보았냐고 물어 봤습니다. 저는 제 생애 이 영화를 보았을 때 느꼈던 감정을 더 이상 느낄 수 없을 것이라 하였습니다. 저만 최종 합격을 하였습니다.면접관님도 의리를 외쳤고 저도 의리를 외쳤습니다.  
7-17-2014,2014,7,17,10:09,목요일,10,5,0,데끼리(sara****),아빠!~ 일어나! 똥고쇼 하지마!  
7-17-2014,2014,7,17,04:49,목요일,10,5,0,곰사탕(inmy****),내평점 무려8000명 이상이 10점을 준 영화.폭풍감동의 눈물을 흘립니다. 눈물을흘리고 싶은 분들께 강력 추천 아 이 느낌. 뭐랄까..말로 표현하기 진짜힘드네요. 참고로 전 5번 봤는데 3번째 볼때부턴 재생 누르기만해도 감동이 밀려와 막 울먹이네요ㅜㅜ  
7-17-2014,2014,7,17,03:14,목요일,10,5,0,봄(kkks****),이번기회에 재조명 ㄱㄱ~~  
7-17-2014,2014,7,17,02:17,목요일,10,5,0,김라면(wlst****),아직 보지 못했다면 꼭 보시길...진짜 꼭 봐야하는 명작입니다. 꼭 보세요 ㅠㅠ 저는 아직도 그 명대사를 떠올리면 눈물부터 나네요 ㅠㅠ  
7-17-2014,2014,7,17,00:44,목요일,10,5,0,단껌(dang****),이영화를 보고 다음날 저를 괴롭히던 일진 18명과 맞짱떠서 이겼습니다.. 고맙습니다~ 클레멘타인~  
7-17-2014,2014,7,17,00:44,목요일,10,5,0,드러머(syl0****),영화 꼭 재개봉 했으면 좋겠다... 10년 전의 감동을 다시 한 번 느껴보고싶다..ㅜㅜ  
7-17-2014,2014,7,17,00:44,목요일,10,5,0,Anthony(rona****),이 영화를 보고 이동준씨 정말  팬이 되었습니다.. 진짜 광고만 잘했다면 사람들이 많이 봤을건데 너무 아쉽습니다.  
7-16-2014,2014,7,16,20:31,수요일,10,5,0,체어맨(qlak****),영화를  본 순간 끊었던 담배를 피게 만들었다 깊은 상념에 빠지며 눈물 나는 내 자신을 보며 이 영화를 3번 더 보면서 내용의 진실성을 배우게 됐다 더이상 이런 영화는 없을거 같아 슬프다  
7-4-2014,2014,7,4,08:59,금요일,10,5,0,이슬람형재(pill****),옆집 누나랑 이거 보다가 너무 감동받아서 서로 샤워를 ㄱㅏㅌ이 했습니다  
6-21-2014,2014,6,21,15:51,토요일,10,5,0,매봉(wjy1****),감동 그 자체이다. 눈물 없이는 볼 수 없는 영화  
6-18-2014,2014,6,18,21:14,수요일,10,5,0,QLove(sevi****),이런 영화가 무려 10년 전에 개봉했었다니 믿어지지 않는다.. 평생소장하겠음.  
6-14-2014,2014,6,14,14:35,토요일,10,5,0,프프프(gjej****),아 너무 슬퍼요.. 이 영화는 진짜 한국에서 한번 나올까말까하는 명작임에 틀림없네요.. 언제 시간 나면 한번 더 봐야겠다.... ㅜㅜㅜㅜ  
6-12-2014,2014,6,12,20:31,목요일,10,5,0,토탈사커(mens****),식스센스이후의 최고의 반전영화  
6-12-2014,2014,6,12,13:28,목요일,10,5,0,cona****,역시 영화는 할리우드 배우를 끌어다 써야하는구나 라는걸 느낀 영화.  
6-11-2014,2014,6,11,23:44,수요일,10,5,0,2주0(gksk****),이세계의걸작다 못보고 그냥지나간다는건 말이안된다  
6-11-2014,2014,6,11,22:04,수요일,10,5,0,ㅤㅤㅤ(ryod****),난 이 영화가 참 고맙고 감사하다. 내 불면증을 치료해 준 유일한 영화이기 때문이다.  
6-10-2014,2014,6,10,12:33,화요일,10,5,0,절대자(hill****),영갤에서 성지순례 왔습니다  
6-10-2014,2014,6,10,00:24,화요일,10,5,0,CrazyPuma(okba****),기분이 우울 했는데 이영화 리뷰 보고 기분이 너무 좋아졌습니다.감사합니다  
6-8-2014,2014,6,8,17:39,일요일,10,5,0,리시(ink3****),한국 명작 컬렉션 5위 안에 들어갈 역대급 감동영화.... 요즘 나오는 영화는 왜 이런 느낌의 명작이없나...  
6-6-2014,2014,6,6,13:00,금요일,10,5,0,엽기카리스마(body****),이 영화를 보고 뜨거운 눈물을 흘렸습니다 최고의 영화 여자친구도 너무 좋아하네요  
6-5-2014,2014,6,5,18:30,목요일,10,5,0,펭귄(djen****),마땅히 유네스코에 등재되어야할 작품. 그럴만한 가치가 있는 작품.인류가 지켜야할 자산이란것이 바로 이런게 아닐까  
2-21-2014,2014,2,21,14:13,금요일,10,5,0,만주개(unit****),작은 감동 ...  아름다운 영화 이 시대에 다시 나와서는 안될 영화  
2-14-2014,2014,2,14,17:27,금요일,10,5,0,Coup(nonl****),개쩌네 한국영화가 날 이렇게 감동시킬줄이야  
2-14-2014,2014,2,14,10:18,금요일,10,5,0,ㅋ(gksr****),나도 여기 참여하겠다.  
10-9-2013,2013,10,9,17:04,수요일,10,5,0,거북이(woon****),이 영화를 보고 오열하며 회개기도를 드렸다  
10-8-2013,2013,10,8,19:38,화요일,10,5,0,1oo1****,이 영화를 접하는자.. 다른 영화는 눈에 들어오지 않을것이다.  
10-1-2013,2013,10,1,22:48,화요일,9,5,0,lalkers(drog****),사람들이 말하는 것처럼.. 엄청난 역작은 아니지만.. 보기드문 수작은 맞음.. 뭔가 웅클한 게 아직도 가시지 않네요.  바쁜 삶의 지친 이들에게 힐링이 무엇인지 느끼게 해주는 영화. 적어도 보시면 후회는 안할겁니다.  
8-15-2013,2013,8,15,22:17,목요일,10,5,0,를르슈 비 브리타니아(dkdh****),꼭봐라 두번  봐라  
8-6-2013,2013,8,6,11:49,화요일,10,5,0,77do****,이 영화를 자막없이도 볼수 있게 해주신 부모님께 감사한다.  
8-4-2013,2013,8,4,11:24,일요일,10,5,0,인간이란(dudg****),평점 꽤나 짜게주는 편인데 이건 평점을 안줄수가 없다. 왜 나는 이 영화를 이제서야 접했는가 하는 생각에 눈물이 줄줄 흘렀다.  
7-25-2013,2013,7,25,14:19,목요일,10,5,0,chgs****,ㅋㅋ최고  
7-22-2013,2013,7,22,16:40,월요일,10,5,0,NetFK(moog****),"내생의 최고의 영화. 사랑이가 ""아빠! 일어나!"" 라고 외칠때 나도 벌떡 일어나 박수를 쳤다. 아직도 전율이 멈추지 않는다. 이만한 걸작이면 늦게나마 블루레이가 출시했으면 좋겠다. 그저 DVD로 아쉬움을 달랠수 밖에... 속편이 꼭 나왔으면...  "
7-20-2013,2013,7,20,00:37,토요일,10,5,0,Buff(wkd3****),전세기 통틀어 최고의 영화!!  
7-19-2013,2013,7,19,15:54,금요일,10,5,0,미미오빠(uria****),쥬라기공원같은 고전 명작이 3D로 재구성되듯이 이 영화도 왕십리 아이맥스 3D에서 재상영해야한다고 생각합니다..  
7-19-2013,2013,7,19,01:44,금요일,10,5,0,별(rhks****),최고의 감동영화  
7-10-2013,2013,7,10,08:20,수요일,10,5,0,쑤(c___****),짱  
6-22-2013,2013,6,22,04:55,토요일,10,5,0,Pathos(into****),ㅜㅜ 아이언맨3보다 스릴넘쳐  
6-21-2013,2013,6,21,16:55,금요일,10,5,0,유기농총각(mrsc****),이 영화 때문에 동준이형 똥꼬쇼 한거 생각하면 눈물이 앞을 가린다  
6-20-2013,2013,6,20,23:20,목요일,10,5,0,잔작(rnqj****),! 후.. 재밋엇다  
6-20-2013,2013,6,20,09:47,목요일,10,5,0,ljs8****,그냥 한번봐야되는거...  
6-19-2013,2013,6,19,18:53,수요일,10,5,0,alem****,한국 영화는 클레멘타인 이전과 이후로 나뉜다  
6-19-2013,2013,6,19,14:21,수요일,10,5,0,로그인(ttod****),ㅋㅋㅋㅋㅋㅋㅋㅋㅋㅋㅋ  
6-19-2013,2013,6,19,02:19,수요일,10,5,0,prtk****,액션 스토리 감정연기 진짜 최고다!!! 대박영화~  
6-19-2013,2013,6,19,00:22,수요일,10,5,0,감사합니다(cusi****),007시리즈만큼 재미를 느낄수 있었어요!  
6-18-2013,2013,6,18,17:40,화요일,10,5,0,lyco****,준리 얼굴에 흐르는 땀방울에서 카타르시스를 느꼈다  
6-18-2013,2013,6,18,17:27,화요일,10,5,0,룰루랄라(live****),와 진짜 재밌게 봣네요 ㅎㅎ  
6-18-2013,2013,6,18,16:56,화요일,10,5,0,지안아빠(sdh8****),명작 중에 명작입니다....  
6-17-2013,2013,6,17,15:08,월요일,10,5,0,롸잇나우(shin****),내생에 최고의 영화가 바뀌었다. 이영화를 보고 나서 말이다!!!  
6-8-2013,2013,6,8,05:45,토요일,10,5,0,0012412(gold****),말이 필요있나  
6-5-2013,2013,6,5,22:06,수요일,10,5,0,popoki(no1q****),ㅊㅊ  
5-31-2013,2013,5,31,11:19,금요일,10,5,0,circuit(circ****),이 영화를 보고 많은 점을 느꼈습니다. 잊혀진 명작이지만 앞으로도 길이길이 남을것입니다  
5-29-2013,2013,5,29,17:49,수요일,10,5,0,빗가프리오(kobi****),이런젠장!!이런 명작을 이제서야보다니1000년에 한번 나올까말까 하는 이런 명작을 이제서야 보다니 이런젠장!!  
5-28-2013,2013,5,28,18:47,화요일,10,5,0,소년명수(mann****),진심으로 눈물이 나는구나.. 남자라면 영웅과 클레멘타인은 꼭 봐야할꺼다..내 모든 진심을 담아서... 140자로는 절대 표현할수 없다...  
5-27-2013,2013,5,27,17:49,월요일,10,5,0,djqd****,최고의 영화  
5-27-2013,2013,5,27,01:19,월요일,10,5,0,제국의 깃발(rbeh****),인생을 살면서 한번쯤은 꼭 봐야하는 영화  
5-26-2013,2013,5,26,17:58,일요일,10,5,0,b2ast(chdi****),더이상의 영화는 없는 거 같네요...ㅠㅠ 아버지!!!!!!!!!!!!!!!!!!!!!!!  
5-26-2013,2013,5,26,16:10,일요일,9,5,0,zealper(mool****),"The Champ, 1979  -> Clementine, 2004 / 명작으로 기억된다  "
5-25-2013,2013,5,25,14:20,토요일,10,5,0,ppu3****,한국영화의 명작 최고다  
5-25-2013,2013,5,25,07:55,토요일,10,5,0,whwp****,8년전 이영화를 보고 감동에 겨워 밤새 잠들지 못했다..  
5-24-2013,2013,5,24,20:27,금요일,10,5,0,DeatH(dlqu****),아빠 일어나는 너무나 명대사이다..  
5-24-2013,2013,5,24,13:58,금요일,10,5,0,노호홍(dh94****),이런 명작은 소장해야 한다.  
5-23-2013,2013,5,23,09:54,목요일,10,5,0,zoke****,보지않아도 감동이 느껴지는최고의영화!  
5-23-2013,2013,5,23,01:55,목요일,10,5,0,inno****,오늘 또 보고야 말았다벌써 셀수도 없이 보았지만 볼때마다 느껴지는 전율은 할말을 없게한다  
5-20-2013,2013,5,20,03:40,월요일,10,5,0,potatoguy(coal****),"꼭 봐라, 두 번 봐라... 더 이상의 자세한 설명은 생략한다  "
3-14-2019,2019,3,14,22:08,목요일,10,6,1,spie****,아이언맨의 로다주가 극찬한 영화! 로다주가 이 영화를 보고 아이언맨으로 재기에 성공했다는 미담이 전해지는!  
2-11-2019,2019,2,11,15:17,월요일,10,6,1,하정우(meli****),아직도 이 영화의 제목을 들으면 전율이 인다. 최고의 명작!  
2-10-2019,2019,2,10,23:15,일요일,10,6,1,wuel****,이영화가 평정 9점대라니 10점만점의 10점으로 올려주세요  
1-19-2019,2019,1,19,12:11,토요일,10,6,1,tjdd****,미르스띤아유재뉴ㅣ뉸나니니  
1-11-2019,2019,1,11,09:26,금요일,10,6,1,안드리 세브첸코(koso****),남자인생의 시작은 서른부터가 아니라 클레멘타인을 본후가 진짜 남자인생의 시작이다. 별을 5개밖에 못주다니..  
1-5-2019,2019,1,5,17:43,토요일,10,6,1,안효빈(hyob****),부랄까지 떨리는 영화는 클레멘타인 이 작품밖에 없었습니다... 정말 강추드립니다  
1-3-2019,2019,1,3,04:16,목요일,10,6,1,띠로리(so9d****),한국인이라면 꼭 봐야 하는 영화입니다.마치 남자라면 정상인이라면 모두가 다 가는 군대같은 느낌일려나요. 이명작을 탄생시킨 감독님께 박수를 드리고.저는 누워있다가 갑자기 일어나는 기현상을 겪었습니다.마치 기독교인들이 예수님을 봤다것처럼요.닥추천  
12-26-2018,2018,12,26,08:24,수요일,10,6,1,merida(jhk8****),진짜 소름돋아서 도중에 끈 영화는 처음이다  
12-19-2018,2018,12,19,11:46,수요일,10,6,1,캐악당(sinj****),내 인생 최고의 영화!!! 그 어떤 영화보다 박진감과 희노애락 모든게 스며들어있는 최고의 작품이다.  
12-11-2018,2018,12,11,14:41,화요일,10,6,1,달콤한늑대(rati****),"직장을 잃은 40대 가장 입니다~ 이 영화를 보고 다시금 재취업의 용기를 갖게 되었습니다! 특히 ""아빠 일어나"" 라는 명대사에 삶의 희망이 보이는듯 했네요!  "
12-4-2018,2018,12,4,21:28,화요일,10,6,1,얼음 황제(bay0****),이  영화를  보고  눈이 떠졌습니다.  
12-4-2018,2018,12,4,06:45,화요일,10,6,1,unit****,매년 찾게 되는 영화. 연말에 클레멘타인으로 따뜻해질것 같네요  
11-29-2018,2018,11,29,16:50,목요일,10,6,1,착한아이(dawo****),이 영화를 다 본 내가 10점을 받아야 겠다.  
11-9-2018,2018,11,9,20:48,금요일,10,6,1,die(wjwq****),평점이나 후기들보고 안본사람 속이려고 장난치는줄 알고 믿지않았습니다.솔직하게 후기를 남겨보자는 생각으로 이 영화를 봤습니다.그런말이있죠 경험의 전과후로 사람이 달라진다는말28년인생에 값진경험을 했습니다 감사합니다 클레멘타인  
10-20-2018,2018,10,20,09:14,토요일,10,6,1,홍철(mess****),"보고 세번울었다. 첫번째는 10점밖에 줄수없다는 사실에 울고,두번째는 이제야 이 영화를 봤다는 사실에 울고,세번째는 이 영화를보며 나도모르게 눈물이 흐르고있더라.  "
9-14-2018,2018,9,14,12:47,금요일,10,6,1,seok****,21세기에서는 절대로 나올 수 없는 명작  
9-7-2018,2018,9,7,20:24,금요일,10,6,1,k120****,영화를 보고 운건 처음이네요.  
9-6-2018,2018,9,6,18:36,목요일,10,6,1,xxxt****,완벽한 영화. 그 자체.  
9-4-2018,2018,9,4,21:21,화요일,10,6,1,우와ㅋ(korn****),내 인생 최고의 영화! 10번쯤본듯..  
8-16-2018,2018,8,16,17:37,목요일,10,6,1,다문(blad****),화면 앞에서 전율하라.  
8-13-2018,2018,8,13,16:56,월요일,10,6,1,kino****,"니체는 말했다. ‘신은 죽었다, 그러므로 우리는 초인을 소망해야한다.’ 그러나 오늘 우리는 초인 대신에 클레멘타인을 소망할 뿐이다.  "
8-4-2018,2018,8,4,18:36,토요일,10,6,1,나노리스트 졸잼(6680****),보지도 않았지만 레전드의 느낌이....  
8-1-2018,2018,8,1,07:30,수요일,10,6,1,귀연자기(kuse****),인랑 과 쌍벽을 이룬다는 전설  
7-26-2018,2018,7,26,08:41,목요일,10,6,1,짠성이(wlst****),리얼보다는 아니지만 한국 최고의 영화  
7-23-2018,2018,7,23,18:05,월요일,10,6,1,이원욱(wonk****),와 개오져요 진짜  개명작입니다  
5-15-2018,2018,5,15,01:53,화요일,10,6,1,hyye****,인생 최고의 명작입니다  
4-14-2018,2018,4,14,16:00,토요일,10,6,1,오레오(tuby****),ㅋ 재밋드 진짜 봐라 해서 봣는디  
3-6-2018,2018,3,6,22:36,화요일,10,6,1,아낙수나문(rlfh****),두유노우싸이 두유노우김연아 두유노우김치 두유노우'클레멘타인'  
2-20-2018,2018,2,20,13:29,화요일,8,6,1,별명없다(noid****),개 쥣들까는 소리 한다는 새키는 정말 개념없는 새키네 전 정말 네이버 평점보고 본사람으로서 아주 재미있게 봤어요. 전 이런류의 영화를 좋아했고  아빠 일어나 나오는 장면은 정말 감동적이고요. 누구말대로 혼자만 보고싶어서 그런걸꺼라고 좋게 생각할께요.  
2-7-2018,2018,2,7,20:55,수요일,10,6,1,merci(2531****),이 영화를보고 우리 부부는 금술이 좋아지고아이들은 효자 효녀가 되고  온집안에 웃음꽃이 피었답니다~  그리고 너무감동받아막혔던 눈물샘이 뚫렸습니다  
2-5-2018,2018,2,5,20:50,월요일,10,6,1,윤지원(kdus****),요즘은 이런 영화가 안나온다는게 참 아쉽네요  
12-24-2017,2017,12,24,12:53,일요일,10,6,1,공부하자(ck70****),이걸 영화라고 말할 수 있을까? 13년이 넘도록 많은 사람들에게 회자되는 이 걸작을 어떤 단어로도 정의할 수 없다...  
12-24-2017,2017,12,24,02:19,일요일,10,6,1,사과(cpzl****),스티븐시걸을 세계최고의스타 반열에 오르게한 명작  
12-16-2017,2017,12,16,14:09,토요일,10,6,1,안개비(redp****),역대 최고의 영화. 그 어떤 후회도 없을것  
10-31-2017,2017,10,31,23:51,화요일,10,6,1,양지만(sera****),금세기최고의영화 꼭보셔야합니다  
8-27-2017,2017,8,27,22:19,일요일,10,6,1,rlaq****,내인생 최고의 명작...ㅠㅠ  
7-23-2017,2017,7,23,14:25,일요일,10,6,1,gkse****,10점 주는데 굳이 이유가 필요한가  
7-23-2017,2017,7,23,02:23,일요일,10,6,1,lena****,예수가 장사 한 지 사흘만에 죽은 자 가운데서 다시 부활했는데 그 이유 중 하나가 클레멘타인이라고 많은 성경 해독 학자들에 설이 있죠노스트라다무스 예언 1999년 지구 멸망 예언도 클레멘타인으로 인해 빗나갔다는 설이 유력합니다.  
7-16-2017,2017,7,16,17:42,일요일,10,6,1,budc****,우리나라 이름을 대한민국에서 클레멘타인으로 바꿔도 이 영화에 대한 헌사로는 한참 부족하다  
7-11-2017,2017,7,11,14:24,화요일,10,6,1,빨간맛을마지막처럼(wltj****),100분이 100년이 되는 기적을 보았습니다...  
7-3-2017,2017,7,3,00:09,월요일,10,6,1,jeues(jeue****),나도울고 우리집개도 울었다  최고의영화  
6-30-2017,2017,6,30,12:41,금요일,10,6,1,psno****,리얼을 보면서 클레멘타인을 떠올리면 리얼하게 눈물이 나오더군요. 다시금 명작을 떠올리게 되어 들어와보니 저와 같은 분들이 많이 계시군요. 역시 사람의 생각은 다 거기서 거기인것 같습니다.  
6-30-2017,2017,6,30,02:29,금요일,10,6,1,용시기(yjop****),리얼 영화의 점수 조작단들 때문에 이런 명작이 다시 조명을 받는듯 합니다. 리얼도 9.6정도는 받아야 할텐데요...우울했는데 다시금 평점보고 힘얻어 갑니다!!!  
6-29-2017,2017,6,29,16:03,목요일,10,6,1,HOHOHO(neop****),국민을 하나로 통합하는 영화..저도 동참합니다^^  
6-28-2017,2017,6,28,11:41,수요일,10,6,1,ChaosEndelss(berr****),진짜 대동단결보다 더한 평점이네 4대강같은  위대한 투자영화  
6-17-2017,2017,6,17,20:32,토요일,10,6,1,단풍(stev****),극찬하는것엔 이유가 있다  
6-5-2017,2017,6,5,22:32,월요일,10,6,1,qwaa****,감동의 도가니탕. 그 안의 도가니가 되어 녹아내리는 감동.  
5-16-2017,2017,5,16,12:43,화요일,10,6,1,Coldplay(wl__****),내 생에 있어서 레옹에서 흘렸던 그 멋진 눈물보다 더 값진 눈물을 주륵주륵 흘리면서 본 영화는 클레멘타인밖에없는듯 합니다. 꼭 추천합니다.  
1-5-2017,2017,1,5,18:58,목요일,2,6,1,이태호(leet****),이건 평점 2가 아니라 클레멘타인에 속편을 원하는것이다  
12-6-2016,2016,12,6,12:09,화요일,10,6,1,taka****,"어찌 이런 감동적인 영화가 쇼생크탈출, 죽은 시인의 사회, 인생은 아름다워보다 별점 순위가 낮단 말인가.. 이건 비아그라를 고산병약으로 쓴다는 것보다 더 말이 안된다.  박근혜가 이영화를 보았다면 당장 자리에서 박차고 나가 하야하겠다고 할 것이다.  "
11-26-2016,2016,11,26,21:32,토요일,10,6,1,Jesus Love You(5tob****),여러분들이 써 주신 평점을 보고 다운받고 있습니다 잘 볼게요 ^^  
10-7-2016,2016,10,7,03:56,금요일,10,6,1,생일 알리미(glgl****),인생은b(birth)와 d(death)사이인 c(클레멘타인)이다.  
10-1-2016,2016,10,1,21:42,토요일,10,6,1,asddsa(ljy4****),창조주는 사람을 만드셨고 사람은 클레멘타인을 만드셨다... 고로 이영화는 평론가 누구도 평가할수없을정도의 영화이며 맥아더 장군도 이영화가 50년 이후에 나올것을 알고 작전명을 크로마이트라 했을정도..  
9-23-2016,2016,9,23,14:06,금요일,10,6,1,YiPie062(why6****),이 영화를 북한에게 보내면 통일을 앞당길 수 있습니다.  
9-20-2016,2016,9,20,17:11,화요일,10,6,1,복실양(patc****),저  당시 시대에는 절대 나올 수 없는 영화  
9-20-2016,2016,9,20,12:29,화요일,10,6,1,다인(stk9****),내인생은 클레멘타인을 보기전 과 보고난후 로 나뉜다  .최고의명작 최고의영화 최고의연기 클레멘타인 이기때문에 감동을줄수있으며클레멘타인 이기때문에 최고의 전율을 선사할수 있었다.왜 이제야 이영화를 보았는지 난 왜 이영화를 이제야 선택했는지..  
9-20-2016,2016,9,20,02:05,화요일,10,6,1,용용(hooy****),클레멘타인을 보기전의 나와 보고 난후의 나는 판이하게 달라졌다. 경이롭고 감동적이다. 왜 내 나이 34세가 되어서야 봤단말인가.. 원통하다..  
8-31-2016,2016,8,31,01:01,수요일,10,6,1,우솝(ehdd****),내인생의 가장 위대한 3가지를 뽑으라면첫째 내가 태어난 것 이고둘째  배우가 된것이고셋째 클레멘타인에 출연한 것이다-스티븐시갈-  
8-27-2016,2016,8,27,07:37,토요일,10,6,1,키지나무(aska****),아빠 일어나 한줄 대사가 월요병을 낫게 했다.  
8-26-2016,2016,8,26,12:44,금요일,10,6,1,OZ(oz96****),선평점 후감상! 평점 믿고 다운합니다  
8-25-2016,2016,8,25,00:25,목요일,10,6,1,너구리냠냠(atus****),대작입니다꼭보시기바랍니다  
8-25-2016,2016,8,25,00:22,목요일,10,6,1,dlaa****,이 영화 덕분에 XX 했어-거늬-  
8-24-2016,2016,8,24,22:57,수요일,10,6,1,으노(jeh0****),감상평을 감히 글로 남길수가 없다  
8-24-2016,2016,8,24,22:56,수요일,10,6,1,루비냥(chuc****),명작 중의 명작  추천입니당  
8-24-2016,2016,8,24,15:29,수요일,10,6,1,78al****,성지순례 왔습니다. 로또 대박되길...  
8-24-2016,2016,8,24,15:06,수요일,10,6,1,그럴리가없어(poca****),이런 대작을 늦게 접했다는게 죄스럽다.ㅠㅠ  
8-19-2016,2016,8,19,22:36,금요일,10,6,1,jedc****,인생영화네요... 최고의 명작...  
8-19-2016,2016,8,19,13:46,금요일,10,6,1,지네딘지단(nada****),10점 드리는것도 죄송한 영화  
8-19-2016,2016,8,19,12:57,금요일,10,6,1,니케(jang****),이제 죽어도 여한이 없습니다.  
8-14-2016,2016,8,14,13:28,일요일,10,6,1,edit****,10분 정도 보고 껐습니다. 평생 아껴볼려구요.  
5-19-2016,2016,5,19,15:39,목요일,10,6,1,조이바튼(rkk5****),쇼생크탈출 이후  최고의걸작  
2-6-2016,2016,2,6,05:00,토요일,10,6,1,쇼미와츄갓브러(hhhj****),이것은 영화가 아니다. 전설이다.  
2-1-2016,2016,2,1,22:27,월요일,10,6,1,블루 칩(moon****),북한이 한국영화를 통제하는 이유가 클레멘타인 때문입니다.  
2-1-2016,2016,2,1,15:49,월요일,10,6,1,pink(miso****),다들 왜 10점을. 주는지 알것같아요...ㅜㅜ  
1-24-2016,2016,1,24,22:09,일요일,10,6,1,만두(nok3****),이영화를 보기 전엔 밑에다 꼭 세숫대야를 받춰놓고 보셔야 합니다.  
1-23-2016,2016,1,23,19:06,토요일,10,6,1,사상(rimu****),스티븐스필버그는 왜 이런영화 못만드나요?  
10-19-2015,2015,10,19,18:26,월요일,10,6,1,똥(wbb1****),주인공 아들이 아빠! 일어나! 하는 장면에서 순간적으로 눈가에 눈물이 핑 돌더군요.. 이 영화 몰입감 하나는 장난 아닙니다  
6-25-2015,2015,6,25,11:02,목요일,10,6,1,Kadam(gen2****),이 영화를 보고 메르스가 나았습니다  
6-19-2015,2015,6,19,13:50,금요일,10,6,1,일류(hauk****),내가 20대 후반쯤 본 영화인데... 그시절 너무나도 충격적인 영상미로 내 가슴을 울렸던 영화이다. 10년이 지난 지금도  이영화를 생각하면 가슴이 막막하고 눈물이 흐를것 같다. 주연 이동준씨의 실제 슬픈삶이 이영화에 고스란히 반영되어 나타난다...  
5-24-2015,2015,5,24,08:50,일요일,10,6,1,예지바라기(sm96****),저는 장님입니다. 클레멘타인을 보지못해 귀로 들었더니 눈이 잘보이고 시력이 몽골사람 보다 더좋아졌습니다 그리고 다시 클레멘타인을 봤는데 너무 아름다워서 다시 장님이 될뻔했군요  
3-10-2015,2015,3,10,20:15,화요일,10,6,1,sho1****,토론토대학 교환학생시절 한국인이라고 하면 친구들이 항상 묻는말이 '두유 노 클레멘타인? 잇츠 판타스틱 무비 아 헤브 에벌 씬' 이었고 서툰 한국어로 '아뽜 잃어놔~' 를 따라하던 기억이 새록새록난다. 좋은영화.  
2-26-2015,2015,2,26,08:22,목요일,10,6,1,우가우가(xswa****),단3일동안 눈을뜰수잇다면 첫째날은 가족을보고 두째날은 사랑하는연인을보고 세째날은 이영화를볼거다 전설 그자체다  
2-15-2015,2015,2,15,12:21,일요일,10,6,1,주노구(jdsj****),설에 이 영화를 틀어주지않는건 최고의 작품에 대한 예의이기 때문이다.  
9-16-2014,2014,9,16,14:11,화요일,5,6,1,그래(tomi****),내반쪽을드리고싶은명작  
8-16-2014,2014,8,16,16:55,토요일,10,6,1,순창쌈장(tlsf****),무분별하게  쏟아져 나오는 영화들 속에 한편의 명화를 찾은것은 저에게 큰 행운이었습니다.  
8-12-2014,2014,8,12,12:53,화요일,10,6,1,으하하하(jaej****),"와 이런 영화를 이제야 알게 되었다는 게 저의 인생에서 가장 후회되는 일이네요. 이건 무조건 10점.영화를 보면서 처음으로 눈물이 났습니다.감동과 재미,슬픔과 괴로움에...또한 서양의 배우와 동양의 배우가 나오는 세계평화적인 영화입니다  "
8-9-2014,2014,8,9,14:15,토요일,10,6,1,내래인민의락(ckdg****),이영화를보고서는 해탈했습니다  
8-9-2014,2014,8,9,14:08,토요일,10,6,1,rhla****,터닝포인트를 만들고 싶다면 보아라  
8-6-2014,2014,8,6,15:21,수요일,10,6,1,ehna****,늘 반항적이던 딸 아이와 함께 클레멘타인을 봤습니다. 엔딩 크레딧이 올라갈 때 딸아이가 조용히 제 손을 잡으며 눈물을 흘리더군요. 부녀간의 갈등을 해소시켜준 멋진 영화!! 클레멘타인 짱!!  
6-12-2014,2014,6,12,01:24,목요일,10,6,1,뚱간나(tige****),ㅋㅋㅋㅋ졸라웃겨ㅋㅋ  
2-25-2019,2019,2,25,14:20,월요일,10,7,2,이리(mvp1****),"타이타닉, 다크나이트와 어깨를 나란히 하는 3대명작중 하나  "
2-23-2019,2019,2,23,22:15,토요일,10,7,2,윤예준(yuny****),이 영화는 '리얼'로 재밌다  
10-28-2017,2017,10,28,13:36,토요일,10,7,2,syc1****,네이버에서 검색어로 숨은명작을 쳤다. 외국영화가 즐비한 가운데 당당히 우리나라 영화가 껴있어서 감상을 하였다... 그리고 여기로 향하게 되었다.  
7-2-2017,2017,7,2,23:51,일요일,10,7,2,마무리(anju****),우울증을 잊게 만드는 영화  
7-2-2017,2017,7,2,23:45,일요일,10,7,2,MF이광무(optl****),이게 바로 기적의 영화로군요  
6-29-2017,2017,6,29,14:37,목요일,10,7,2,강기원(xl23****),대한민국 3대 명작 (클래멘타인/ 성냥팔이 소녀 재림/ 7광구 /+리얼)  
6-29-2017,2017,6,29,10:28,목요일,10,7,2,BLANCMAIN(henr****),리얼 따위가 이런 명작과 비교되는게 창피하네요  
9-22-2016,2016,9,22,02:58,목요일,10,7,2,Sound Picture(soun****),"블루레이 플레이어가 세상에 출시되던 순간, 나는 클레멘타인을 블루레이로 소장하기 위해 망설임없이 플레이어를 구입했다. 그러나 아직까지도 클레멘타인은 블루레이로 발매되지 않고 있다. 이런 후진국에서 계속 살아야 하나?  "
9-12-2016,2016,9,12,16:59,월요일,10,7,2,samo(hidr****),평점 보고 영화를 보게 됐습니다.감동이 이루 말할 수 없네요  
8-25-2016,2016,8,25,02:04,목요일,10,7,2,ㅇㅇㅇ(yeye****),영화( Movie)라는 장르의 정의를 내리려면 일단 이 영화부터 봐야 한다. 감히 이것을 보기 전에 영화를 안다고 하지 말라.  
3-4-2019,2019,3,4,07:51,월요일,10,8,3,제프포카로(toto****),타이타닉은 엔딩에 눈물을 주었지만 이영화는 처음부터 끝까지 감동과 눈물범벅이다. 부모님께 권해드렸는데 이런대작을 왜이제 보여줬냐며 가족의 연을 끊으셨다. BTS와 더불어 대한민국의 유산이되어야한다. 너무 자랑스럽다.  
2-6-2019,2019,2,6,15:47,수요일,10,8,3,바선(vist****),유튜브에서 보고 궁금해서 직접 다운받아서 봤는데 이걸 보느니 차라리 성경책을 읽겠다  
6-30-2013,2013,6,30,12:44,일요일,10,9,4,뻐큐(girl****),보성형님의 으리는 역시ㄷㄷ  
3-1-2019,2019,3,1,11:12,금요일,10,12,7,브로리(andy****),관객수는 3500명인데 평점은 20000명 이상우리는 보지 않아도 명작이란것을 안다.  
1-25-2017,2017,1,25,22:02,수요일,1,16,11,befr****,이런 재간동이들 위대한 우리 궁민들 대한민국만세~!!!  
4-6-2015,2015,4,6,17:54,월요일,1,17,12,dlwn****,이것은절대1점이 아니다. 11점을주고싶은내마음이다  
6-30-2019,2019,6,30,01:04,일요일,10,4,0,보허자(cosm****),사교육의 열풍이 거센 한국땅. 내아이가 남들보다 앞서가길 바란다면 휴식 시간에 이영화를 보여줘라. 아이는 휴식보다 공부에 더욱 흥미를 느낄 것이다. 따논 전교1등이다.  
6-20-2019,2019,6,20,11:01,목요일,10,4,0,이창수(qhwh****),이거 보고 아버지한테 바로 전화 한 통 드렸습니다.  
6-19-2019,2019,6,19,21:09,수요일,10,4,0,불꽃도련님(ispa****),"15년째  보고있다.,,,  "
6-19-2019,2019,6,19,19:09,수요일,10,4,0,bluedi(swmi****),보진 않았읍니다. 암 안걸릴려구요  
6-18-2019,2019,6,18,01:54,화요일,10,4,0,월화수목금금금(yuch****),이 영화가 문화유산에 아직 등재되지 않은 이유는 어떠한 이름으로도 이 영화를 분류할 수 없기 때문이다.  
6-15-2019,2019,6,15,00:14,토요일,10,4,0,vvps****,이걸보게해주신 모든분들에게 감사의표시를 드립니다 아니 존경합니다 ~!!  
6-14-2019,2019,6,14,14:02,금요일,10,4,0,채원(jon3****),죽고싶을 때마다 보는 영화입니다제 삶의 활력소!  
6-14-2019,2019,6,14,11:23,금요일,10,4,0,진성크스(qkrw****),이영화를 보고 암이 나았습니다  
6-14-2019,2019,6,14,02:31,금요일,10,4,0,카페인(hyun****),이건 이런 작디 작은 네모칸에는 세길 수 조차 없습니다  
6-13-2019,2019,6,13,15:16,목요일,10,4,0,케빈데브라위너(odo0****),이 영화를 보고 시력이 좋아졌습니다  
6-12-2019,2019,6,12,23:49,수요일,10,4,0,레시라무bay(emql****),"둘도 없을 걸작, 내가 감히 추천을 할 수 있음.  "
6-12-2019,2019,6,12,17:25,수요일,10,4,0,문수혁(suhy****),이 영화를 보고 암이 암에 걸려 나았습니다  
6-12-2019,2019,6,12,01:46,수요일,10,4,0,김재민(joog****),수능 만점 받게 해주세요  
6-11-2019,2019,6,11,12:07,화요일,10,4,0,리셋(shad****),지금까지 이런 영화는 없었다.!!!  
6-11-2019,2019,6,11,12:07,화요일,10,4,0,으아(swj9****),천년에 한번만 나와야 되는 영화  
6-11-2019,2019,6,11,01:10,화요일,10,4,0,남쑤아빠(ysa2****),혹시나하고 봤더니....댓글을 안쓸수 없게 만드는 영화!!!  
6-10-2019,2019,6,10,11:36,월요일,10,4,0,레인하우스(haou****),"인생이 힘들때, 내 등 뒤의 토닥임이 되주는 명작  "
6-9-2019,2019,6,9,12:47,일요일,10,4,0,한나애비(chun****),이 영화를 보면서 둘째를 가졌어요  
6-4-2019,2019,6,4,23:26,화요일,10,4,0,David Cooper(ferb****),최고의 영화입니다. 끝내줍니다  
6-4-2019,2019,6,4,18:08,화요일,10,4,0,흰그림자(xilv****),전 아직 보질 않았습니다. 살아야 할 커다란 이유중 하나일 지도 모르겠습니다. 임종 직전 볼 결심을 하고 있습니다.  
6-4-2019,2019,6,4,04:59,화요일,10,4,0,쿵쾅쿵쾅(dbst****),영화에 으리가 있다 으리 으리  
6-1-2019,2019,6,1,20:56,토요일,10,4,0,seco****,인생영화찾았어요울다웃고 넘재밌었어요  
5-31-2019,2019,5,31,13:03,금요일,10,4,0,승리자(sala****),완벽 그 자체입니다. 여러번 보았습니다.  
5-30-2019,2019,5,30,20:30,목요일,10,4,0,홍석민(hhki****),"대부 ,  타이타닉 , 다크나이트 그리고 클레멘타인으로 이어지는 시대의 역작들. 올드보이 이후로 대한민국에서 나올 수 있는 영화의 가능성을 다시 한 번 보여줬다.  "
5-30-2019,2019,5,30,11:16,목요일,10,4,0,콩콩(gggg****),완전 재밋음. 리얼 감동 액션 드라마 무비그자체  
5-30-2019,2019,5,30,09:51,목요일,10,4,0,rebel(rebe****),개봉한 지 시간이 많이 흘렀지만 아직 이 영화를 능가하는 명작은 나오지 않았다. 마블도 클레멘타인을 능가할 수 없었다.  
5-30-2019,2019,5,30,03:54,목요일,10,4,0,타타나나(dkru****),넌 감동이였어 영원히 안볼꺼야  
5-29-2019,2019,5,29,23:59,수요일,10,4,0,초요(gg07****),"알파고,그또한 이영화를 통해 감정을 느꼈다  "
5-28-2019,2019,5,28,09:17,화요일,10,4,0,부자아빠(bagu****),10점이 뭐냐? 100점도 부족하다!  
5-26-2019,2019,5,26,15:19,일요일,10,4,0,2mol****,오늘하루힘들었다 그러나 클레멘타인 평점을 보고. 힐링을하고간다. 개봉후15년전이 지나도 끝나지 않는 이관심. 진짜. 이동준님존경스럽다  
5-19-2019,2019,5,19,21:53,일요일,10,4,0,park(reap****),10점으로 부족한 명작  
5-19-2019,2019,5,19,21:53,일요일,10,4,0,park(reap****),10점으로 부족한 명작  
5-19-2019,2019,5,19,12:04,일요일,10,4,0,buji****,"우리나라에도 이런 대작이 있었다니...최고의 감동과 최고의 액션 ... 믿을 수가 없네요. 영화보는 내내 넋놓고 있었습니다. 10점 던지고 가지만 제 마음속 평점은 10,000,000점 입니다. 다른분들도 어서 즐감하세요. ^^  "
5-19-2019,2019,5,19,09:35,일요일,10,4,0,생티(zzan****),지구를 위협하는 어떠한 재앙이 오더라도 나는 항상 클레멘타인 dvd부터 챙길것이다. 클레멘타인이 없는 세상은 상상할수도없다.  
5-18-2019,2019,5,18,17:04,토요일,10,4,0,Ohhhyyeaah(real****),2002 월드컵 당시 독일 선수들의 명언슈뢰더 독일 총리-방한의 궁극적 목적은 양국 발전과 우호증진이어야 하지만 나는 가장 먼저 리얼부터 보고싶다.미하일 발락-여기가 리얼의 나라입니까?퍼거슨-우린 리얼을 막을 수 없었다. 해결 불가능한 존재다.  
5-18-2019,2019,5,18,04:35,토요일,10,4,0,jay(snak****),최고의 한국영화...  
5-17-2019,2019,5,17,22:55,금요일,10,4,0,재구(rkaw****),아직도 보지 않은 영화라 더 기대된다  
5-13-2019,2019,5,13,01:06,월요일,10,4,0,김성현(no99****),rHR QHTLQTL DH rNFWOA  
5-11-2019,2019,5,11,13:53,토요일,10,4,0,trui****,유튜브에서 이 영화 리뷰 영상보고 세상을 다 가진거처럼 웃을 수 있었습니다. 감사합니다.  
5-8-2019,2019,5,8,21:33,수요일,10,4,0,pooh****,한없이 우울했던 요즘. 이 영화로 약간의 치유를 받네요. 감사합니다.  
5-8-2019,2019,5,8,06:51,수요일,10,4,0,흑백사진(pjy_****),대한민국 영화계는 클레멘타인 전과후로 나뉜다.  
5-6-2019,2019,5,6,14:38,월요일,10,4,0,서희몽(llss****),그저 놀라움의 연속이다.  
5-5-2019,2019,5,5,21:54,일요일,10,4,0,김석근(myki****),이보다 뛰어난 영화는 없다  
5-5-2019,2019,5,5,21:35,일요일,10,4,0,규규s(kyuk****),너무재밌었습니다. 인생 최대의 영화  
5-5-2019,2019,5,5,21:15,일요일,10,4,0,대선(noes****),말이 필요없는 대작박수를 칠 수 밖에 없다  
5-5-2019,2019,5,5,00:38,일요일,10,4,0,Mnemosyne(kk2d****),유네스코 기록 문화 유산에 등재 신청하자!!!  
4-29-2019,2019,4,29,22:37,월요일,10,4,0,징게(sayt****),ㄹㅇ 인생명작 난 이영화를 보려고 살아있었던 것이 분명하다  
4-29-2019,2019,4,29,05:42,월요일,10,4,0,jiho****,감동적입니다다시보고싶습니다  
4-27-2019,2019,4,27,12:40,토요일,10,4,0,Diver94(chzm****),인생 최고의 역작 아직 못보신분들은 꼭 보시길..  
4-27-2019,2019,4,27,03:11,토요일,10,4,0,첼시빠콩(phb0****),대박ㅠㅠ 안보고 뭣들해요???  
4-26-2019,2019,4,26,18:12,금요일,10,4,0,김종근(kjg0****),40먹은 내가 아이처럼 울었다... 1주일이 지났는데 여운이 가시질 않는다. 따뜻하고 포근한 마음의 고향으로 간직하고 싶다.  
4-25-2019,2019,4,25,10:28,목요일,10,4,0,한숨(kimk****),대부? 쇼생크탈출..? 아니 클레멘타인이다.  
4-24-2019,2019,4,24,19:56,수요일,10,4,0,닥치(dark****),한국인이 사랑하는 영화 1위  
4-24-2019,2019,4,24,11:21,수요일,10,4,0,하지석(haji****),인간을 두가지유형으로 나눌수있다.클레멘타인을 본자와보지않은자이다.  
4-23-2019,2019,4,23,13:54,화요일,10,4,0,미친개(1nid****),아빠 일어나는 21세기 최고의 대사로 기억될것이다...모든 아버지들의 똥꼬에 소름이 돋을 명대사.  
4-20-2019,2019,4,20,14:19,토요일,10,4,0,마일(mile****),시험공부하기 싫어서 딴짓하다 우연히 이 영화를 보게 되었는데 머리속에 딴짓 해야겠다는 생각이 전부 사라졌습니다.  시험공부 열심히 하겠습니다. 감사합니다.  
4-20-2019,2019,4,20,11:23,토요일,10,4,0,식자(h0on****),가족들과 함께 봤습니다.영화관에서 조차 주무시던 아버지가 끝까지 보고 계시더군요.  
4-19-2019,2019,4,19,17:35,금요일,10,4,0,콩가루(bean****),"[씨네21 전문가 20자평]박평식 | 청년 준 리여, 이 노인의 존경 어린 인사를 받아주시오.유지나 | 그의 마지막 돌려차기에 경배를!이동진 | 한국영화 역사상 가장 찬란했던 순간황진미 | 잠든 가부장적 세계관을 흔들어 일깨우는 여성 샤우팅  "
4-18-2019,2019,4,18,23:45,목요일,10,4,0,태비(jen9****),보진않았지만 꼭다같이보세요  
4-17-2019,2019,4,17,23:54,수요일,10,4,0,동호는짱(dong****),9.33점이라는 높은 평가를 보고 다운받았습니다.제가 9.34로 올리도록 하겠습니다  
4-17-2019,2019,4,17,04:10,수요일,10,4,0,Element(alsw****),이 영화가 트루먼쇼 따위와 별점을 비슷하게 달리고 있다니 이 영화에 대한 모독이다.  
4-15-2019,2019,4,15,05:40,월요일,10,4,0,hyun****,우선 보고오세요 시대를 초월하는 명작입니다  
4-10-2019,2019,4,10,17:11,수요일,10,4,0,DH(burn****),"총각때 이 영화를 보면서도 감동이었는데, 자식이 생기고서 그때의 감동을 다시 느끼고 싶어서 재시청하였습니다. 아빠 일어나!! 눈물이 다시끔 제 앞을 가리네요. 사랑하는 제 아들과 손잡고 극장 갈 날을 기리며 재개봉을 요청드립니다.  "
4-10-2019,2019,4,10,16:00,수요일,10,4,0,안성만(sh00****),액션과 감동 모든 장르가 담겨있는 영화  
4-8-2019,2019,4,8,06:43,월요일,10,4,0,황승민(dsdw****),너무 감동적이네요 꼭 보세요  
4-2-2019,2019,4,2,01:14,화요일,10,4,0,idoc****,눈물의 명작 강추합니다  
4-1-2019,2019,4,1,22:14,월요일,10,4,0,헌건(hahe****),그냥10점 심금을 울리는 영화  
4-1-2019,2019,4,1,15:03,월요일,10,4,0,SIMZIA FC(pvvi****),이작품을 봤으니 이제 죽지말아야할 명분이 하나 사라졌다...  
3-31-2019,2019,3,31,19:36,일요일,10,4,0,정창희(al_p****),눈물의성지순례왔습니다  
3-28-2019,2019,3,28,23:56,목요일,10,4,0,nypd****,2019.3.28이런 명작을 너무늦게봤군  
3-23-2019,2019,3,23,21:57,토요일,10,4,0,hana****,클레멘타인은 평점보는것만으로10점  
2-18-2019,2019,2,18,21:59,월요일,10,4,0,이승윤(jyjy****),"인류가 한 가장 잘한일이라면, 이 영화를 만든것일것이다.  "
2-17-2019,2019,2,17,19:07,일요일,9,4,0,김의찬(gnm0****),와....하하하이런것이군요  
2-15-2019,2019,2,15,18:59,금요일,10,4,0,김명희(olop****),여친이랑 데이트할때마다이영화를 봅니다덕분에 저는변강쇠로새롭게 태어났어요  
2-15-2019,2019,2,15,08:45,금요일,10,4,0,피터(alte****),이 영화가 그냥 웃기고 저급하다고 편견을 가졌던 내 자신이 부끄러웠다. 당신이 단지 이 영화가 궁금해서 처음 1~2분을 보는순간 당신은 어느새 러닝타임 100분을 소화해내고 있을것이다. 감독님 감사합니다.  
2-13-2019,2019,2,13,18:50,수요일,10,4,0,Bad 까스(eyfn****),간만에 좋은영화 봤습니다 ㅋㅋ 김두영 밤길조심해라  
2-4-2019,2019,2,4,22:09,월요일,10,4,0,키드몬(k690****),와 인생작 꼭봐야한다 시간이 안아깝다  
2-4-2019,2019,2,4,00:31,월요일,10,4,0,보들이(dltl****),하하 클레멘타인 짱 히히  
2-2-2019,2019,2,2,17:46,토요일,10,4,0,무위도식(bumt****),이 영화를 보고나서 인생은 다시 시작이다!  
1-25-2019,2019,1,25,22:02,금요일,10,4,0,그냥인간(ddl0****),말이 필요없는 작품 강추드립니다.  
1-23-2019,2019,1,23,23:37,수요일,10,4,0,알세돌10단(haju****),이 영화에 잠재력은 끝이 없다.  
1-16-2019,2019,1,16,02:10,수요일,10,4,0,태시기(kim1****),동준이형님 너므웃기십니다 ㅋㅋ  
1-11-2019,2019,1,11,03:18,금요일,10,4,0,john(sts0****),그 어떤 영화도 이 영화를 이길순 없다  
1-10-2019,2019,1,10,22:39,목요일,10,4,0,dlst****,예스잼^^예에에에소리질러예에에에소리질러예에에에소리질러  
1-10-2019,2019,1,10,22:38,목요일,10,4,0,이재욱(lema****),내 인생 최고의 영화. 당시 가장 유명했던 할리우드 배우 스티븐 시걸의 출연으로 더욱 빛나는 것 같다  
1-10-2019,2019,1,10,18:00,목요일,10,4,0,알아서뭐할라거(boos****),그시절 한국에는 2명의 효녀가 있었다  
1-9-2019,2019,1,9,11:26,수요일,10,4,0,선현(good****),백문이불여일견   강력추천합니다  
1-9-2019,2019,1,9,07:13,수요일,10,4,0,으우으(eogh****),흥미진진하고 가슴벅찬 전개 그리고 이동준씨의 화려한 액션에 희열을 느끼고 갑니다...  
1-8-2019,2019,1,8,23:46,화요일,10,4,0,귀염둥이(nana****),아직 보지 안았지만 평점 댓글들을 읽어 내려가며 OO게 웃다 보니 어느새 남자가 되어 있었다.  
1-8-2019,2019,1,8,13:56,화요일,10,4,0,먕이먕(jg99****),댓글에 정말 악마들이 많다  
1-7-2019,2019,1,7,17:43,월요일,10,4,0,서재홍(davi****),최고의 작품 정말강추합니다  
1-7-2019,2019,1,7,04:01,월요일,10,4,0,실험용(kejh****),정말 최고의영화ㅕㄴㅏ  
1-6-2019,2019,1,6,21:31,일요일,10,4,0,자라나는새싹(ledh****),...아직 안봤어요...  
1-6-2019,2019,1,6,01:03,일요일,10,4,0,젤다오카리나(zeld****),".,.,.,.,.,.,.,.,.,  "
1-4-2019,2019,1,4,20:01,금요일,10,4,0,오스트리아한우(hanj****),보진않았습니다 10점 드릴게요  
1-4-2019,2019,1,4,09:09,금요일,10,4,0,gta3****,"클레멘타인 붐은 ,반드시 온다.  "
1-2-2019,2019,1,2,11:52,수요일,10,4,0,인생이란(7xor****),이 영화를 보지않고 다른 영화가 재미있음을 논하지 말라..!! 강추  
12-31-2018,2018,12,31,14:57,월요일,10,4,0,hang****,인간이라면 꼭 봐야할.. 아니 이 세상에 존재하는 만물들은 꼭 봐야할 명화  
12-30-2018,2018,12,30,16:10,일요일,10,4,0,cleo****,크리스마스 연말에 보기좋은 영화  
12-30-2018,2018,12,30,14:03,일요일,10,4,0,ipapleloved(gver****),"정말.. 영화 한 장면 한 장면마다.. 감동과 눈물과 아련함과 인생과.. 추억이 되살아는 명작..지금에서야 이걸 평가할 수 있는 나 자신이 너무도 슬프다..이 영화를 안 본 이에게는, 살아가는 의미가 있으리..  "
12-30-2018,2018,12,30,12:06,일요일,10,4,0,catz****,이거보고 암이 나앗다는게이해감  
12-14-2018,2018,12,14,18:01,금요일,10,4,0,국(happ****),진짜 보고 또 봐도 즐겁네요 고마워요 베댓님들  
12-13-2018,2018,12,13,21:59,목요일,10,4,0,양세한(tpgk****),와..끝나고 이렇게 여운과 감동이 남는 영화는 처음이네요..이제서야 이런 명작을 보다니.. 두번세번 봐도 질리지 않을 역대 한국영화입니다. 정말 강추합니다!!  
12-13-2018,2018,12,13,16:45,목요일,10,4,0,688945(jinu****),말이 필요없는 최고의 영화. 명작은 괜히 명작이 아니다.  
12-12-2018,2018,12,12,22:48,수요일,10,4,0,넓적부리황새(jw99****),이건 영화가 아니다. 도덕책이다  
12-12-2018,2018,12,12,06:12,수요일,10,4,0,gudf****,아빠일어나...라는 외침에  40대  실직자인 저두 일어났습니다  
12-9-2018,2018,12,9,02:15,일요일,10,4,0,무리가없어(4808****),최고의 영화 저는 10번 봤습니다. 대사도 외워요  
12-7-2018,2018,12,7,09:50,금요일,10,4,0,송은범가너23(dako****),타이타닉에 견줄만한 한국명작입니다..  
12-6-2018,2018,12,6,15:45,목요일,10,4,0,hyun****,"누군가 나에게 죽기전에 가장 하고싶은 일이 무었이냐고 묻는다면, 난 주저없이 이 영화를 한 번만 더 보게 해 달라고 말 할 것이다.  "
12-5-2018,2018,12,5,04:41,수요일,10,4,0,폿(jkkb****),알바만 아니었어도 평점 10점을 받을수있었던 최고의 명작 ㅠㅠ  
12-3-2018,2018,12,3,18:18,월요일,10,4,0,규산(adr3****),부모님이 감명깊게 본 영화라기에 우연히 봤는데정말 제 후손들에게도 보여주고싶을 만큼 최고의 영화였습니다..  
12-3-2018,2018,12,3,15:23,월요일,10,4,0,nnn(top1****),눈물때문에 혼났다. 인간이 만든 영화 중 최고의 걸작이다. 이 영화보고 치질이 나았다.  
12-2-2018,2018,12,2,00:48,일요일,10,4,0,tjdr****,세상이 울었다그리고 나도 울었다  
11-26-2018,2018,11,26,02:49,월요일,10,4,0,쏭태(impo****),제가 클레멘타인 2만번째 140자평의 영광을 얻었네요.  저는 아직 영화 못봤는데 언제쯤 이 명작을 볼 수 있을까요? 기대하고 있습니다.  클레멘타인을 볼 걸 기대하며 살아갑니다.  
11-25-2018,2018,11,25,16:58,일요일,10,4,0,인(ci02****),21세기 대한민국 에는 성냥팔이소녀의 재림 7광구 리얼 그중에서도 클레멘타인 이 있었다.  
11-25-2018,2018,11,25,08:48,일요일,10,4,0,kimchul(king****),재개봉을 간절히 비나이다  
11-24-2018,2018,11,24,22:16,토요일,10,4,0,별바라기(1995****),띵작.. 성지글보러왔슈  
11-23-2018,2018,11,23,17:51,금요일,10,4,0,EDIT(king****),소문 듣고 봤는데 가슴이 먹먹해지네요... 이대로 그냥 죽어버릴까 싶기도 하고  
11-21-2018,2018,11,21,09:31,수요일,10,4,0,채원이아빠(pooh****),이 영화를 보고 치질이 나았습니다.  
11-21-2018,2018,11,21,03:56,수요일,10,4,0,초코(26gr****),이 영화를 친구가 추천했다면  그 친구는 이미 당신의 진정한 베스트 프랜드.  
11-18-2018,2018,11,18,11:38,일요일,10,4,0,야마모토혼다(tara****),아오르꺼러도 이 영화보고 나았는다는  
11-18-2018,2018,11,18,00:38,일요일,10,4,0,드록신나가신다(rych****),예고편만 봐도 역대급이네요.  
11-16-2018,2018,11,16,19:17,금요일,10,4,0,용용(zzim****),와 진짜 죽기전에 꼭 봐야할 영화 ~드디어 버킷리스트 하나 지웠네요 ^^  
11-10-2018,2018,11,10,20:23,토요일,10,4,0,사랑(sue2****),"친구가 명작이라고 추천해줘 봤습니다. 왜 이걸 이제 봤는지 후회되고, 다시 한번 처음과 같은 감동을 이젠 느끼지 못한다 라는 사실이 아쉽네요ㅠ 아직 보지 못한 분이 있으시다면 아끼고 아끼다 사랑하는 가족, 혹은 연인과 함께 보길 추천드립니다.  "
11-7-2018,2018,11,7,20:10,수요일,10,4,0,상상예찬(swj0****),처음으로 별점남깁니다...  
11-6-2018,2018,11,6,05:25,화요일,10,4,0,모루겟소요(lsc3****),가끔 우울할 때 리얼이랑 갓레멘타인 평점 보면서 힘을 되찾습니다! 아빠 일어나!  
11-6-2018,2018,11,6,00:45,화요일,10,4,0,김태용(gowj****),정말 완벽한 영화입니다.  
11-5-2018,2018,11,5,10:08,월요일,10,4,0,박세연(xxse****),"스티븐 시걸 최고의 작품""언더더씨"" 따위와 비교할 수준이 아니다!  "
11-1-2018,2018,11,1,10:40,목요일,10,4,0,서울l제로(hyuk****),띵작품 가족과 함께 봐야되는 영화  
10-27-2018,2018,10,27,15:33,토요일,10,4,0,그로(rlfl****),영화계는 이영화가 있기 전과 후로 나뉜다  
10-25-2018,2018,10,25,19:12,목요일,10,4,0,seji****,엄마랑 울면서 봤습니다 ㅠㅠ  
10-25-2018,2018,10,25,19:05,목요일,10,4,0,용인권앵오(drea****),제 친구한테 소개 받고 봤습니다. 정말 감동적이네요!!  
10-25-2018,2018,10,25,10:15,목요일,10,4,0,개념장전(ranm****),이상하게 내가 보는것 보다 남들이 봤으면 하는 영화.  
10-25-2018,2018,10,25,09:50,목요일,10,4,0,정상엽(syjd****),"요즘같이 가을탈때 보면, 가슴이 뭉클해지는 영화.  "
10-22-2018,2018,10,22,22:38,월요일,10,4,0,노진호(shdo****),영화는 짧고 여운은 길다 -히포크라테스  
10-13-2018,2018,10,13,00:33,토요일,10,4,0,스타(dort****),다들 일부로 고점주는거같아서 생각없이봤는데최소8점이상은되는 수작이긴하네요마지막에 감동때문에 깊은 여운이 남는 영화네요  
10-12-2018,2018,10,12,17:07,금요일,10,4,0,배를저어가자(dudg****),네이버에 액션 명작 보려고 들어왔는데 우리나라에 이런영화가... 왜 이제야 봤는지...  
10-11-2018,2018,10,11,00:53,목요일,10,4,0,Tokki(soda****),한국영화계의 혁명이자 보석  
10-9-2018,2018,10,9,20:07,화요일,10,4,0,김형준(mana****),이 영화를 보고 암이 암이 걸렸다가 나았습니다  
10-8-2018,2018,10,8,00:13,월요일,10,4,0,NoTitle(dnrl****),영화 포스터에  나오는 아이마냥 울었습니다..  
10-7-2018,2018,10,7,23:57,일요일,10,4,0,rksw****,살아있음에 감사합니다...이 명작을 볼수있음에 감사합니다  
10-1-2018,2018,10,1,20:11,월요일,10,4,0,rkdmfdl(sysy****),'설마'하고 영화를 봤습니다. 결국 눈물을 터뜨리고 말았네요.ㅜㅜ  
9-27-2018,2018,9,27,17:22,목요일,10,4,0,sjs9****,말이 필요없습니다. 최고의 영화  
9-26-2018,2018,9,26,23:11,수요일,10,4,0,애플파이(dlqh****),재미있습니다. 재미 개오집니다.  
9-26-2018,2018,9,26,00:06,수요일,10,4,0,ryusei(ryus****),천하제일의 명작을 볼수있었다  
9-25-2018,2018,9,25,13:41,화요일,10,4,0,닉(zsay****),황금 추석연휴가 끝나기 전에 이런 대작을 볼 수 있어 영광이였습니다.  
9-24-2018,2018,9,24,18:33,월요일,10,4,0,언잉(er90****),대작이다 버킷리스트 꼭 봐야 되는 영화다  
9-24-2018,2018,9,24,16:10,월요일,10,4,0,루이(choo****),나의 인생영화 꼭 봐야한다  
9-23-2018,2018,9,23,23:11,일요일,10,4,0,베인(cjkd****),전설에 동참합니다. 보고싶지만 아직 제가 감당하기에는 너무 훌륭한 영화인듯  
9-23-2018,2018,9,23,03:40,일요일,10,4,0,지다성(zida****),평생에 타임머신을  딱 한 번 쓸 수 있다면 난 망설이지 않고 이 영화를 보기 직전으로 되돌아갈 것이다. 생에 처음 느낀 그 전율을 다시 느끼고 싶기 때문이다.  
9-22-2018,2018,9,22,16:46,토요일,10,4,0,Jabba the hutt(hcu9****),난 이영화를 다음생에도 볼것이다  
9-20-2018,2018,9,20,15:51,목요일,10,4,0,열대바다(gini****),이 영화를 보고 인생을 살아야할 이유를 알았습니다.  
9-19-2018,2018,9,19,18:53,수요일,10,4,0,imyo****,저는 이렇게 10점을 주고야 말았습니다...같이 옆에서보던 밧데리파일도 울었습니다 ㅜ ㅠ  
9-18-2018,2018,9,18,17:38,화요일,10,4,0,DHk(hybr****),30년인생에서 여러영화를 봐왔지만 진짜 시간가는줄 모르고 봤습니다. 개띵작 그중 아빠 일어나!는 진짜 소름돋았네요  
9-18-2018,2018,9,18,16:19,화요일,10,4,0,그랑토랑(dbqh****),눈물을 흘리다가 죽어버린 영화  
9-17-2018,2018,9,17,19:54,월요일,10,4,0,광(kwan****),물괴보다 낫다 10점만점  
9-17-2018,2018,9,17,14:18,월요일,10,4,0,Hansvelt(jame****),집에서 이 dvd발견해서 친구들이랑 같이 봤는데 다같이 우네요.너무 감동적이네요.  
9-17-2018,2018,9,17,12:34,월요일,10,4,0,나비효과(zerg****),물괴 연관 영화로 뜨길래 화가나서 댓글 남긴다. 감히 물괴 따위랑 비교하다니  
9-17-2018,2018,9,17,04:31,월요일,10,4,0,권혁찬(brad****),이영화를 보면서 빛보다 빠르게 지나가는 시간의 흐름이 아쉽기만 했습니다..시리즈물로 만들어서 시즌10회까지 제작해주십시요!  
9-16-2018,2018,9,16,18:06,일요일,10,4,0,민혁아범(kuns****),주옥같은 명대사아빠 일어나...  
9-13-2018,2018,9,13,12:07,목요일,10,4,0,일단가보자(sk25****),"이 영화를 보고 암은 나았지만, 자꾸 생각나서 불면증에 시달립니다.  "
9-13-2018,2018,9,13,01:11,목요일,10,4,0,그리운날들(west****),평점이 높아서 봤는데 왜 높은줄 알겠네 ㅎㅎ 옛날영화치곤 스토리 괜찮아 응 잼있어!!  
9-12-2018,2018,9,12,22:39,수요일,10,4,0,찰리(rlax****),이영화를 안본사람은 있어도 10점을 안준 사람은 없다.  
9-10-2018,2018,9,10,00:40,월요일,10,4,0,REDMEANT(redm****),친구와 함께 보며 눈물을 흘릴 정도의 명작입니다. 꼭 보세요  
8-29-2018,2018,8,29,14:37,수요일,10,4,0,레이미언(wink****),인생 최고의 영화에요 좋은건 공유해야죠  
8-28-2018,2018,8,28,23:06,화요일,10,4,0,최지혁(adre****),지상 최대의 명작.전무후무할  전설을 난 맞이했다.  
8-26-2018,2018,8,26,16:08,일요일,10,4,0,신태수파오후새끼(ryan****),대한민국 최고의 영화....코리안타임은 이영화 이후로 새겨났다고 해도 과언이아니다.  
8-25-2018,2018,8,25,14:16,토요일,10,4,0,조영식(dudt****),넘 재밌게 봄 ㅎㅎ 빨리 보세요  
8-22-2018,2018,8,22,15:50,수요일,10,4,0,Magic(zsa5****),저는 인생작을 만났습니다.  과거 인생선배들이 왜 클레멘타인을 봐야하는지 이해를못했습니다. 그러나 보고알았습니다 이영화를 봐야 비로소 살아갈이유를 그리고 그간 욕했던 영화들이 명작 중 명작이였다는것을 여러분 보세요 보고 긍정의 삶을 살아가세요 .  
8-17-2018,2018,8,17,11:52,금요일,10,4,0,마법의상자(asdf****),10점을 주겠습니다.  
8-16-2018,2018,8,16,22:45,목요일,10,4,0,raim****,이거 보지 않은 눈을 소유하고 있습니다~  
8-16-2018,2018,8,16,15:49,목요일,10,4,0,달려(miss****),본 사람만이 알 수 있다. 시대를 앞서간 화려한 액션의 선율과 영상의 아름다움을...이 영화를 아직 안봤다면 최소 두 번봐라. 그래야 진정한 가치를 느낄 수 있다.  
8-16-2018,2018,8,16,15:12,목요일,10,4,0,zzzz(rice****),갓갓갓명작...신이 만든영화..  
8-12-2018,2018,8,12,14:38,일요일,10,4,0,흰수염고래(kane****),이 영화를 보고 여름을 시원하게 지낼 수 있게되었습니다. 감사합니다 클레멘타인....  
8-11-2018,2018,8,11,19:38,토요일,10,4,0,crank(cran****),그래.. 절대로 놓쳐선 안 돼... 클레멘타인 만큼은 놓치지 마...! 완벽하고!! 최강에!! 바닥 마저도 깔보는 우리 카타쿠리 오빠마저...!! 클레멘타인의 감동을 이기지 못하고... 바닥에 쓰러지고 울고말았다구우!!!  
8-8-2018,2018,8,8,03:21,수요일,10,4,0,원아이드잭(jjoo****),우울할때나  심란할땐 항상 여기를들립니다~~!  
8-6-2018,2018,8,6,23:20,월요일,10,4,0,치킨고기(zlzl****),빌게이츠는 말했다. 지금의 나를 만들어준 영화는 클레멘타인임을 믿어 의심치 않는다. 이 영화가 없었다면 난 분명 삶을 깨우치지 못했을것이다. 딸의 목소리 하나하나가 내 눈물세포를 자극하는것 같다.  
8-6-2018,2018,8,6,22:13,월요일,10,4,0,슭이(bbs5****),"오늘도 맥주 한캔 글라스에 따라서내 생애 최고의 클레멘타인을 본다,꿈일까? 생시일까?너와 난 주파수가 맞나보다..  "
8-5-2018,2018,8,5,01:19,일요일,10,4,0,박재욱(pju0****),희대의 명작... 시대를 앞서나간 명작...  
8-4-2018,2018,8,4,10:19,토요일,10,4,0,970111(bk39****),그저 찬사를 보낼수밖에  
8-2-2018,2018,8,2,10:49,목요일,10,4,0,Coffee(lion****),한국의밝은미래를보고왔다.  
7-22-2018,2018,7,22,17:11,일요일,10,4,0,gusw****,꼭보세요 진짜 bb 개꾸르잼  
7-21-2018,2018,7,21,11:15,토요일,10,4,0,twof****,"""리얼""이 나온 이후 재평가행 ㅋㅋㅋ  "
7-20-2018,2018,7,20,21:05,금요일,10,4,0,멋자앙이(qiya****),이 영화를 보고 느낀게 많습니다.  
7-20-2018,2018,7,20,17:24,금요일,10,4,0,타사로운앗침(mimo****),걸작..말이필요한가...  
7-18-2018,2018,7,18,15:14,수요일,10,4,0,정은성(wjdd****),똥싸면서 보다가 위장까지 다싸버렸습니다.  
7-16-2018,2018,7,16,22:38,월요일,10,4,0,메이(dldu****),아빠 일어나~  일어나~ 다시 한번 해보는 거야~  
7-15-2018,2018,7,15,00:53,일요일,10,4,0,Jack(jack****),절친이 되고 싶은 친구와 함께보세요  
7-13-2018,2018,7,13,16:47,금요일,10,4,0,kgon****,향후 100년 영화계의  교과서와 같은 영화네요.칸영화제 에 출시 했다면 부조건 황금종려상!!  
7-13-2018,2018,7,13,07:57,금요일,10,4,0,knw2****,이영화를 개봉관에서 본 멍키 윤에게..찬사를 보냅니다.  
7-12-2018,2018,7,12,23:28,목요일,10,4,0,auro****,이런 영화를 볼수있어 너무 행복합니다  
6-27-2018,2018,6,27,11:54,수요일,10,4,0,VENDER(sptq****),명작이네요 진짜...  
6-27-2018,2018,6,27,01:51,수요일,10,4,0,장원에(wkdd****),이영화는 정말띵작 정말 재미있어요  
6-24-2018,2018,6,24,15:03,일요일,10,4,0,융융(chob****),벅찬감동 말이 필요없읍니다.  
6-23-2018,2018,6,23,14:02,토요일,10,4,0,에그빈(youn****),암이 암에 걸린다는 40년 전통의 바로 그 맛집!  
6-23-2018,2018,6,23,10:43,토요일,10,4,0,아이디만들기함들다(eneu****),내인생 최고의 영화입니다  
6-22-2018,2018,6,22,23:03,금요일,10,4,0,이동진(dleh****),희대의명작...^^;;  
6-22-2018,2018,6,22,17:52,금요일,10,4,0,No1bu(dlrb****),잊히지 않는 감동.. 그때로 돌아가고 싶다  
6-6-2018,2018,6,6,08:04,수요일,10,4,0,7937Ga(yoos****),이런 가치를 갖는 또다른 영화를 찾기란 하늘의 별따기  
6-5-2018,2018,6,5,14:05,화요일,10,4,0,김김김(dudu****),최고의 영화이다 꼭보삼  
6-5-2018,2018,6,5,09:37,화요일,10,4,0,고구마(sunk****),너무감동적이예요..  
6-1-2018,2018,6,1,00:26,금요일,10,4,0,Hide(dndq****),아빠  일어나 !! 라는 대사를 들으며 눈물을 흘렸습니다...꼭보세요 두번보세요 세번 보세요  
5-26-2018,2018,5,26,20:41,토요일,10,4,0,zhxj****,내 인생 최대의 명작!!!  
5-25-2018,2018,5,25,17:27,금요일,10,4,0,Sunday(kixx****),"에라 모르겠다,안봣지만 다들 추천함  "
5-25-2018,2018,5,25,16:15,금요일,10,4,0,이진호(smd3****),최고네 진짜 꼭바라이건  
5-24-2018,2018,5,24,21:29,목요일,10,4,0,이종우(zkik****),아 너무너무 재밌어요!!! 강추  
5-24-2018,2018,5,24,00:10,목요일,10,4,0,명랑꿀곰(juny****),소개만 들었는데도 새삶을 얻었습니다  
5-22-2018,2018,5,22,02:10,화요일,10,4,0,이정민(john****),신이 사람의 손을 빌려만든 영화  
5-20-2018,2018,5,20,16:54,일요일,10,4,0,cepa****,지린다 이건 이무도 못쫒아올 서스펜스  
5-19-2018,2018,5,19,21:18,토요일,10,4,0,파글형진(qweq****),이 영화를 보고 치질이 나았습니다.  
5-19-2018,2018,5,19,17:28,토요일,10,4,0,Jay(peni****),인생이 무엇인가 영화란무엇인가 참된의미를 알데되었다  
5-17-2018,2018,5,17,13:58,목요일,10,4,0,얼짱구(rlar****),굳굳아내우자나무아나조너줃  
5-17-2018,2018,5,17,02:02,목요일,10,4,0,pray****,명화입니다 꼭보세요 두번보세요  
5-16-2018,2018,5,16,16:29,수요일,10,4,0,훈기(khnk****),제 인생 최고의 100분 이였습니다.  
5-14-2018,2018,5,14,21:37,월요일,10,4,0,renet(sung****),국내 영화계의 전설 중에 전설 명작 중에 명작  
5-14-2018,2018,5,14,21:14,월요일,10,4,0,태양풍(sky7****),인생 최고의 영화!! 꼭 보시길!  
5-14-2018,2018,5,14,16:40,월요일,10,4,0,사람(cele****),너무 감동적인 영화..^^  
5-14-2018,2018,5,14,13:20,월요일,10,4,0,zzan****,10점 드립니다 행복하세요  
5-14-2018,2018,5,14,02:26,월요일,10,4,0,모모다루(0192****),한국영화는 클레멘타인 전과 후로 나뉘죠  
5-14-2018,2018,5,14,01:30,월요일,10,4,0,똥싼바지(rmff****),발기부전에 탁월한 영화임.  아빠 일어나  
5-13-2018,2018,5,13,18:40,일요일,10,4,0,쿠쿠(4als****),한국 최대의 영화클레맨토수  
5-13-2018,2018,5,13,12:27,일요일,10,4,0,청포도알사탕(thej****),클레멘타인을 보지않고는 한국 액션을 논하지 말라  
5-13-2018,2018,5,13,09:56,일요일,10,4,0,추성호(napt****),전설의 레전드 이 영화인가요  
5-13-2018,2018,5,13,08:45,일요일,10,4,0,youw****,진짜인생 액션영화입니다최고  
5-13-2018,2018,5,13,02:58,일요일,10,4,0,댄(hyeo****),우아하고 세련된 마무리  
5-12-2018,2018,5,12,16:34,토요일,10,4,0,중학교2학년(kor_****),오랜만에 와봤는데 리뷰가 계속 달림 ㅎㅎ 고전명작이 될 작품일것같음  
5-10-2018,2018,5,10,17:56,목요일,10,4,0,스피노(dabi****),이영화를 보고 긴잠에서 깨었습니다  
5-10-2018,2018,5,10,01:36,목요일,10,4,0,솜솜(som1****),별을 더 줘도 모자르다고 생각한다  
5-9-2018,2018,5,9,19:26,수요일,10,4,0,김대현(eogu****),이 영화는 너무 감동적입니다... 보다가 울뻔함  
5-9-2018,2018,5,9,19:00,수요일,10,4,0,니베(yosk****),내 인생의 영화.. 꼭 보시길 잊혀질수가 없네요  
5-9-2018,2018,5,9,15:41,수요일,10,4,0,박스씨(crow****),이 영화를 본 이후로 삶에 위기가 닥쳐올 때마다 혜리의 외침이 귓가에 맴돌았다. 난 일어선다. 혜리의 '아빠 일어나!'란 그 단어 한마디로.  
5-8-2018,2018,5,8,22:10,화요일,10,4,0,긱스의가정방문(rose****),아빠!!일어나!!!  
5-8-2018,2018,5,8,00:16,화요일,10,4,0,정원철(plaz****),꼭 보는걸 추천드립니다 진지합니다  
5-7-2018,2018,5,7,22:37,월요일,10,4,0,게임중독자(tude****),진짜 평점 좋아서 봤는데 진짜 이렇게 여운남는 영화가 있을련지요.... 꼭 보셈  
5-7-2018,2018,5,7,22:03,월요일,10,4,0,김형준(rosh****),내 인생 최고의 영화ㅇㅇ  
5-6-2018,2018,5,6,14:32,일요일,10,4,0,HappySong(shar****),평생 보아왓던 영화 중 가장 감동적이였다  
4-21-2018,2018,4,21,21:32,토요일,10,4,0,음흉한아해(ruri****),전설의 영화입니다!!  
4-15-2018,2018,4,15,00:43,일요일,10,4,0,노형(bbav****),이것을보고병이 나았습니다  
4-1-2018,2018,4,1,22:46,일요일,10,4,0,oran****,임혁필.. 주연 아닌가요?  
4-1-2018,2018,4,1,19:30,일요일,10,4,0,이원준(slft****),단언코 말할 수 있다. 이 시대 최고의 영화라고...  
4-1-2018,2018,4,1,09:39,일요일,10,4,0,atti(lysc****),일요일 저녁식사 후 이 영화를 보세요.  
3-28-2018,2018,3,28,23:35,수요일,10,4,0,사라앙(kyuc****),21세기 최고의  영화가 아닐듯 합니다. 너무 잘봤어요.  
3-28-2018,2018,3,28,22:08,수요일,10,4,0,은서아빠81(royh****),아 끝까지 본사람만이 평점 10점을 줄 수 있다  
3-28-2018,2018,3,28,15:28,수요일,10,4,0,카르페디엠(gern****),제가 평소에 평점을 달지 않는데 영화를 보고 우울증이 나았습니다드디어 인생 영화를 만났습니다  
3-28-2018,2018,3,28,13:01,수요일,10,4,0,dks(dksd****),내가 이 영화에 10점을 주는 이유는 11점이 없기 때문이다  
3-28-2018,2018,3,28,11:05,수요일,10,4,0,렉터박사(reds****),소중한 것은 나눠야 되는 거지요. 많은 관람부탁드립니다.  
3-27-2018,2018,3,27,20:44,화요일,10,4,0,Ravel(jihy****),"내인생 최고의 영화, 최고의 명작.  "
3-27-2018,2018,3,27,02:36,화요일,10,4,0,이스키워(heou****),미리 10점주고 보러갑니다  
3-26-2018,2018,3,26,14:30,월요일,10,4,0,cooo****,홍보영상만 보았는데 치통을 잠시 잊을 수 있었습니다.  
3-25-2018,2018,3,25,16:29,일요일,10,4,0,최고다(kshk****),이 영화 끝까지 본사람...끝까지 살아 남을 지어다.  
3-25-2018,2018,3,25,15:22,일요일,10,4,0,James(qjrm****),이 영화는 사람을 봅니다!  
3-25-2018,2018,3,25,02:24,일요일,10,4,0,sone****,"샀노라, 보았노라,  울었노라  "
3-22-2018,2018,3,22,22:56,목요일,10,4,0,도나(pjyn****),"댓글을 보니 한국 문학계의 미래가 밝다는것을 깨달았습니다. 수많은 문예 신인들을 낳은 이 영화, 수작이 틀림없네요.  "
3-22-2018,2018,3,22,19:35,목요일,10,4,0,flig****,옛다! 이거나 먹어랏!  
3-21-2018,2018,3,21,11:57,수요일,10,4,0,레이짱(reij****),최고다 다시는 나오기 힘든 작품  
3-21-2018,2018,3,21,02:48,수요일,10,4,0,치킨은뼈까지(ycpi****),시대를 관통한 영화 이 시대에 상남자란 무엇인가를 일깨워줌  
3-20-2018,2018,3,20,21:29,화요일,10,4,0,매미소리꽃향기(sdch****),어릴적 태권도를 배울때 관장님께서 단체 관람시켜주셨습니다. 그때가 잊혀지지 않습니다.  
3-20-2018,2018,3,20,21:18,화요일,10,4,0,woon****,이것은 인간은 위한영화가 아니다  
3-20-2018,2018,3,20,19:54,화요일,10,4,0,yeon****,구웃구웃구우구구웃잼  
3-20-2018,2018,3,20,18:53,화요일,10,4,0,푸홧(yong****),안봤고 안볼거지만아무튼 10점임  
3-20-2018,2018,3,20,18:20,화요일,10,4,0,볼트동생너트(dus1****),평점 일어나아아 갓 띵작  
3-20-2018,2018,3,20,12:47,화요일,10,4,0,이상민(gong****),멋진 영화 입니다.  감동을 같이 느끼시죠.  
3-19-2018,2018,3,19,22:43,월요일,10,4,0,돌직구(chan****),이 영화를 보고 격투기 선수를 꿈꾸게 되어서 현재프로라이센스를 얻었습니다 !한 사람의 인생을 바꿀정도의 명작이라고 생각합니다 !주변사람들이 영화추천좀 하면 전 1의 망설임도없이클레멘타인을 추천하곤 합니다  
3-19-2018,2018,3,19,02:30,월요일,10,4,0,라몽(wodm****),이건 진짜 갓띵작이다 꼭 남친 여친이랑 봐라  
3-18-2018,2018,3,18,14:43,일요일,10,4,0,0234****,단언컨대 이 영화는 시대를 초월한 다시는 없을 명작이다.  
3-17-2018,2018,3,17,10:53,토요일,10,4,0,wolf****,정말 대단한 작품성을 갖춘 영화네요....물론 보지는 않았습니다.  
3-17-2018,2018,3,17,03:12,토요일,10,4,0,마구자비(kilk****),인류의 유산 최후까지 남아야할 영화!  
3-14-2018,2018,3,14,23:00,수요일,10,4,0,rtp(onam****),영화의 시작과 끝. 이 이상의 영화는 존재 할 수 없다.  
3-12-2018,2018,3,12,21:02,월요일,10,4,0,ms(tmwm****),대한민국 영화계를 대표하는 전설적인 영화의 표본. 이 영화는 그 어떤 영화도 뛰어넘을 수 없는 감동을 선사하고 있다. 꼭 봐라. 영생의 길로 인도할 것이거늘.  
3-12-2018,2018,3,12,16:53,월요일,10,4,0,테사라(prad****),관람평개웃겨진짴ㅋㅋㅋㅋ  
3-9-2018,2018,3,9,12:22,금요일,10,4,0,검은귀공자(core****),이 영화를 보기위해 태어났다는 생각이 들었습니다.  
3-8-2018,2018,3,8,14:45,목요일,10,4,0,wolfman(dari****),이 영화는 말이 필요 없다  
3-7-2018,2018,3,7,20:27,수요일,10,4,0,개인용(ccw2****),클레멘타인을 본순간 당신은 평점 10을 줄 이유가 생깁니다  
3-6-2018,2018,3,6,11:27,화요일,10,4,0,idgi****,아빠! 일어나!! ....  
3-5-2018,2018,3,5,22:11,월요일,10,4,0,슈퍼리치(righ****),"평점만으로 이미 최고임을 증명한 영화, 평점만으로 이미 한 편의 영화를 다 본 듯한 감동을 선사하는 영화. 평점만으로 나를 포함한 수많은 덕후를 양성한 영화.  아직까지도 보지 않고 아껴둔 영화. 추천!! 말이  필요없다.  "
3-4-2018,2018,3,4,22:58,일요일,10,4,0,나는포기란읍(dosl****),아직도 귓가에 아빠 1어나가 아른거린다..  
3-4-2018,2018,3,4,15:58,일요일,10,4,0,L인지원(vjvl****),여러분 전 96년생인데도 친구와 이 영화를 보았는데 감동받아 울었습니다 꼭 버려야할 한국의 명작입니다  
3-4-2018,2018,3,4,15:48,일요일,10,4,0,lIlIlIl(rhal****),말이 필요한가? 최고의 영화다  
3-4-2018,2018,3,4,11:33,일요일,10,4,0,ddaafasfa(xotj****),아 이영화는 말로 표현 할수 없을 정도로 대단하다  
3-3-2018,2018,3,3,10:45,토요일,10,4,0,테키나르(dark****),넘모조흔영하임미다ㅎㅎ  
2-28-2018,2018,2,28,23:11,수요일,10,4,0,두루쥬(jmke****),별점 올리러 가즈아ㅋㅋ  
2-28-2018,2018,2,28,22:07,수요일,10,4,0,Sicc(bcw5****),감동감동 쓰나미같은 울음  
2-28-2018,2018,2,28,01:44,수요일,10,4,0,차가운농촌남자(raid****),10년이 넘도록 가슴속에 사무치는 영화..100년뒤엔 문화재로 지정되길..  
2-27-2018,2018,2,27,20:06,화요일,10,4,0,ㅠㅠ(litt****),"감히 그 어떤 평론가조차도 평가하지못한 영화,,  "
2-27-2018,2018,2,27,13:04,화요일,10,4,0,pump****,성지순례 합니다 성지순례 합니다.  
2-26-2018,2018,2,26,15:35,월요일,10,4,0,알테어(kism****),하..어머니 어깨를 한번 더 주물러드릴껄..불효자는 웁니다  
2-26-2018,2018,2,26,15:35,월요일,10,4,0,이세현(lsh9****),인생영화힘들때마다 보면  치유되는 느낌 아니 실제로 치유되었다  
2-26-2018,2018,2,26,11:12,월요일,10,4,0,카무라(blue****),2편 언제나오나요 기다려도 ..소식이 없군요 ㅜ  
2-19-2018,2018,2,19,02:39,월요일,10,4,0,crim****,36살에 다시 꺼내본 제 인생영화... 처음봤을 때 와는 또 다른 감동으로 다가오네요. 2002 한일 월드컵 때보다 더 큰 감동을 주는 영화...  
2-19-2018,2018,2,19,02:27,월요일,10,4,0,김태석(easp****),아빠일어나를 듣고 대성통곡을 했습니다  
2-19-2018,2018,2,19,01:17,월요일,10,4,0,정상봉(tkdq****),영화관에서 본지 벌써 14년이 지났다.. 그때의 충격은 아직까지도 잊혀지질 않는다... 지금도 생각날때면 다운받아 본다..안본사람은 있어도 보고 울지 않은 사람은 없는 영화.. 강추합니다!  
2-12-2018,2018,2,12,03:57,월요일,10,4,0,왕짱구(king****),내 인생 최고의 영화입니다  
2-10-2018,2018,2,10,23:54,토요일,10,4,0,걍(ksw0****),대한민국을 대표할 걸작  
2-10-2018,2018,2,10,12:20,토요일,10,4,0,석태준(stj9****),지금 개봉하면 2천만 찍는다정말 마지막에 그 감동은 잊혀지지않는다  
2-7-2018,2018,2,7,17:29,수요일,10,4,0,chai****,아직 안 보고 뭐하셨나요.  
2-7-2018,2018,2,7,04:29,수요일,10,4,0,Jay(hide****),"어째서 평점이 10점이 만점이란 말인가!!!이 영화는 백만점, 천만점, 수억점을 줘도 모자란 그런 영화다  "
2-5-2018,2018,2,5,18:49,월요일,10,4,0,호루스(dona****),이시대 최고의 명작 입니다  
2-5-2018,2018,2,5,10:59,월요일,10,4,0,허공답보(cnyt****),클레멘타인 아직 안 보신분 계신가요?눈하고 뇌 고가에 삽니다.  
2-4-2018,2018,2,4,17:58,일요일,9,4,0,영 우(ywch****),영화가아니다. 혁명이다  
2-4-2018,2018,2,4,17:43,일요일,10,4,0,chlw****,비운의 명작 클레멘타인  
2-1-2018,2018,2,1,22:41,목요일,10,4,0,jjny11(jany****),너무 웃겨서 가끔와봐요^^나만의 힐링창고:)  
2-1-2018,2018,2,1,11:47,목요일,10,4,0,prai****,이 영화는 두고두고 아껴뒀다가 죽기전에 볼겁니다. 그만한 가치가 있다고 해서요  
1-31-2018,2018,1,31,16:46,수요일,10,4,0,목표(myai****),가족이란 무엇인가? 가족을 새로 꾸려가고 육아를 시작하는 부모들에게 추천하는 영화  
1-30-2018,2018,1,30,17:15,화요일,10,4,0,조한(jihu****),표현할 수 없는 최고의 영화!!  
1-29-2018,2018,1,29,03:35,월요일,10,4,0,gusu****,제 인생최고의 영화!!!!@@@보는내내 감동이엿습니다ㅜ덕분에 제가 어렸을적 배웟던 태권도를 다시금 돌아보게되었습니다 그래서 이영화를 터닝포인트로 태권도 국가대표선수가 되는 목표를 잡았습니다. 이 영화처럼 최고가되는 그날까지ㅜ아자아자 태권도 화이팅!!  
1-27-2018,2018,1,27,10:28,토요일,10,4,0,도화선(hail****)," 요번 설  특선 영화에  ""클레멘타인""꼭 기대 하겠습니다.온가족들이 한자리에 모여  다시금 가족의 소중함을  느낄수 있도록 TV편성국장님 부탁드립니다.  "
1-22-2018,2018,1,22,17:39,월요일,10,4,0,micr****,네이버 평점 보고 이제야 아빠와 봤습니다. 태어나서 울 아빠 우는 모습 첨봤습니다.  
1-22-2018,2018,1,22,08:27,월요일,10,4,0,김종원(ehsw****),아니ㅋㅋㅋㅋ볼때마다 짜증나네ㅋㅋㅋ그래서 속편 언제나오냐고..내가슴 그렇게 울려놓고선..  
1-20-2018,2018,1,20,11:26,토요일,10,4,0,윤재연(ksed****),이 영화를보고 난 인생의 큰깨달음을 얻었다...'아빠 일어나!'  
1-14-2018,2018,1,14,22:15,일요일,10,4,0,그만자(life****),대한민국 영화사에 다시 없을 걸작  
1-13-2018,2018,1,13,21:18,토요일,10,4,0,정동진(whff****),이거보고 지구10바퀴돌면서 오열했습니다.. . 10바퀴돌아서 10점  
1-13-2018,2018,1,13,13:23,토요일,10,4,0,노희민(xlli****),이런 재밌는 영화를 볼 수 있다는것은 이 시대에 살아가는 우리에게 있어서도 큰 축복이다.  
1-11-2018,2018,1,11,03:39,목요일,10,4,0,나는승범이(did9****),영화는 크게 클레멘타인과 클레멘타인이 아닌영화 두가지로 나뉜다. 인간의 인생도 클레멘타인을 본 인생과 보지않은 인생 으로 나뉜다. 만약 이 영화를 본다면 그건 당신의 인생의 가장 큰 터닝포인트가 될 것이다  
1-10-2018,2018,1,10,16:16,수요일,10,4,0,OK MOON(paka****),이 영화를 보고 감동을 받은 한 영화감독은 1년뒤 개봉하는 로멘스영화의 여자 주인공 이름을 '클레멘타인' 이라고 이름짓게 됩니다. 그 영화가 바로 네이버 평점 9.25에 빛나는 짐캐리와 케이트윈슬렛 주연의 세기의 로멘스영화 '이터널션샤인'  
1-10-2018,2018,1,10,10:46,수요일,10,4,0,ㅇ(ljw2****),good movie wow lol  
1-8-2018,2018,1,8,05:52,월요일,10,4,0,타투(tmdd****),만약 이 영화가 헐리웃에서 개봉을 했고 금발의 백인 톱스타인 전성기시절 디카프리오가 주연을 맡았다고 한다면 아마 그는 15년은 일찍 오스카상을 받았을것이다  
1-7-2018,2018,1,7,23:23,일요일,10,4,0,행기(gmj2****),"세계적 유명 액션배우인 톰크루즈가 방한했을때 이런말을했었죠""한국에 오기전 클레멘타인을 보았다, 나도 김두영 감독과 액션영화를 찍어보고싶다""  "
1-7-2018,2018,1,7,15:31,일요일,10,4,0,태홍(ewe6****),별점 10점짜리 영화 추천합니다  
1-4-2018,2018,1,4,13:52,목요일,10,4,0,참격맨(ehgj****),마이 라이프 포 무비...  
1-3-2018,2018,1,3,22:57,수요일,10,4,0,kiki****,내 인생 띵작.... 띵작  
1-3-2018,2018,1,3,21:28,수요일,10,4,0,광주대포(dnss****),평점 9.31라뇨.. 잘못 된거 아닙니까?  
1-1-2018,2018,1,1,16:28,월요일,10,4,0,jguy****,우리모두 함께봐야할 영화  
12-30-2017,2017,12,30,19:49,토요일,10,4,0,1018****,좋은 영화가 어떤건지 바로 알게 해주는 좋은 영화  
12-30-2017,2017,12,30,18:46,토요일,10,4,0,ㅋㅋ(cole****),아직 우리나라에 정의가 살아있음을 보여주는 영화  
12-27-2017,2017,12,27,19:04,수요일,10,4,0,Master(batt****),내생애 최고의 액션영화  
12-25-2017,2017,12,25,14:54,월요일,10,4,0,Bosanova(guit****),2017년 크리스마스날 드디어 보았네요  
12-25-2017,2017,12,25,01:47,월요일,10,4,0,rmsgh(geun****),눈과 귀가 있다는 것에 감사함을 처음으로 느끼게 해준 영화  
12-24-2017,2017,12,24,15:31,일요일,10,4,0,익스트림(iron****),"스티븐 시걸,김동준 OO  "
12-24-2017,2017,12,24,01:28,일요일,10,4,0,둘기(good****),말이 필요없다 이영화가 모든걸 설명해준다  
12-23-2017,2017,12,23,12:15,토요일,10,4,0,지인맘(sugi****),이영화를 보고 나는 내가 이것을 보기위해 살았던것이구나 ....하고 느꼈고 이 생각을 할때 이미 나의 눈은 눈물로 뜨겁게 달궈져 있었다....  
12-23-2017,2017,12,23,11:55,토요일,10,4,0,푸른하늘햇님(sum4****),일생일대 최고의 영화.  
12-22-2017,2017,12,22,14:16,금요일,10,4,0,med0****,내인생 최고작이다!!!!  
12-21-2017,2017,12,21,23:10,목요일,10,4,0,pang(rhkd****),진정한 이 시대의 가장 완벽한 영화라는 말로도 부족할만큼 위대한 영화.이 좋은 것을 혼자 보려는 이기적인 사람들이 너무 많은것 같다.  
12-21-2017,2017,12,21,14:21,목요일,10,4,0,귀요미힛(gkan****),말이 필요없는 명작..  
12-21-2017,2017,12,21,13:41,목요일,10,4,0,gree****,이 영화를 보기전으로 기억을 되돌리고싶다...내 인생을 바뀌게 해준 영화... 이 영화를 보고 다른 영화는 영화라 말할수없다...밖이영하다 지금  
12-21-2017,2017,12,21,09:18,목요일,10,4,0,biby****,정말 최고의 영화에요. 꼭 보시길 바랍니다.  
12-21-2017,2017,12,21,01:29,목요일,10,4,0,샤아(redc****),이렇게  대단한 영화가 존재하다니. 아직도 눈물이 멈추지 않는다.  
12-20-2017,2017,12,20,22:29,수요일,10,4,0,ToToT(leem****),킹갓빛타인...울어버렸다  
12-20-2017,2017,12,20,16:10,수요일,10,4,0,김재향(gcna****),감기가 심하게 걸렸는데 감기바이러스 치료할겸 봤는데 힐링되네요^^  
12-20-2017,2017,12,20,00:53,수요일,10,4,0,kksj****,인류를 구할 영화. 찬양하라.  
12-19-2017,2017,12,19,21:41,화요일,10,4,0,12121234(duat****),재개봉 안하나요 ㅠㅠㅠ 극장에서 보고 싶은데..  
12-19-2017,2017,12,19,16:18,화요일,10,4,0,akak****,세기의 명작이다. 친한 친구에게 꼭 추천해 주세요.  
12-19-2017,2017,12,19,12:20,화요일,10,4,0,쿠(noum****),제가 욱하는 성격이 있습니다다혈질이죠 그게 많이 심해요병원에서 심리 치료받고해도나아지지 않아서  주변 추천으로이 영화를 보게 되었는데글쎄 이걸 한편보니 병원에서 다혈질이 완쾌되었다고 하네요  
12-19-2017,2017,12,19,07:19,화요일,10,4,0,cksg****,내 나이 서른.. 인생의 가장 아름다운 순간을 고르라면 단연코 이 영화를 보고 있던 순간은 아닐런지.. 영원히 내 가슴에 기억될 단 하나의 영화!  
12-18-2017,2017,12,18,17:58,월요일,10,4,0,마르퀴스(kevi****),이 영화를 보고 나서 무조건 평생 소장해야한다는 생각에 DVD로 10장 굽고 안되겠다 싶어서 외장하드 주문했습니다. 평생 처음 사보는 외장하드.. 이 외장하드에는 오직 이 영화 한편만!!!  
12-18-2017,2017,12,18,10:40,월요일,10,4,0,탄트라(ejdn****),꼭보세요 명작입니다 클레멘타인을 안보는사람은 있어도 한번만 보는 사람은 없습니다  
12-18-2017,2017,12,18,07:15,월요일,10,4,0,짱이다(upst****),이 영화를 보고 아토피가 나았습니다!  
12-18-2017,2017,12,18,05:08,월요일,10,4,0,육(ones****),이건 영화가 아니라 예술이다.  소장용 cd 구하는중  
12-18-2017,2017,12,18,01:25,월요일,10,4,0,milost(kor_****),어머 이건 꼭 봐야돼!!  
12-18-2017,2017,12,18,01:25,월요일,10,4,0,다(chop****),안보면 후회 합니다  암이 암걸려서 완치가 대요  
12-18-2017,2017,12,18,00:04,월요일,10,4,0,Frithi(frit****),마음을 울리는 영화가 어떤건지 아직 모르시는 분들이 있다면 그 답은 클레멘타인입니다 그 울림은 가슴에 남아 지워지지 않을겁니다  
12-17-2017,2017,12,17,22:54,일요일,10,4,0,박미숙 실장2(66ms****),나를 바로 잡아준 인생영화! 더 이상의 영화는 없다.  
12-17-2017,2017,12,17,18:52,일요일,10,4,0,지나가는 버스(cros****),503도 북한의 김정은도 보고 감동받은 전설... 심지어 영화 소믈리에인 저도 감명받았습니다..ㅠ  
12-17-2017,2017,12,17,18:13,일요일,10,4,0,우울한 하루(herm****),와우와오와우와오와우와  
12-17-2017,2017,12,17,14:18,일요일,10,4,0,바볼랏테크닉s40(ahra****),발톱무좀이 나았다 기적이다  
12-17-2017,2017,12,17,14:12,일요일,10,4,0,보라빛구(viol****),둘도 없는 놀라운 작품임  
12-17-2017,2017,12,17,13:02,일요일,10,4,0,hwk7****,몇번이고 다시봐도 질리지 않는 진정한 명작  
12-16-2017,2017,12,16,09:43,토요일,10,4,0,hsh6****,최고의 띵작입니다. 아빠 일어나!  
12-15-2017,2017,12,15,17:50,금요일,10,4,0,fandango(lspa****),최고. 무슨말이 더 필요할까.  
12-15-2017,2017,12,15,15:26,금요일,10,4,0,유리(cull****),평점보고 이제야 봤네요.. 하 지금까지 봤던 블록버스터들은 이 작품에 비하면 진짜 아무것도아니었네요  
12-15-2017,2017,12,15,13:36,금요일,10,4,0,cassius7(milk****),명작가나다라마바사아  
12-15-2017,2017,12,15,13:10,금요일,10,4,0,구동본부장(plus****),재개봉 안하나... 극장 가서 다시 한번 감동을 느끼고 싶다.  
12-15-2017,2017,12,15,02:08,금요일,10,4,0,임파트(lmb9****),"왜 재개봉을 안하는지 의문이다. 지금 늦은 새벽인데, 당장 개봉한다고 하면 바로 나가서 볼텐데... 영화계 관계자들이 시대 흐름을 너무 모르는 것 같다.  "
12-15-2017,2017,12,15,01:43,금요일,10,4,0,zuni****,이 영화를 보고 불면증이 나았습니다.  
12-15-2017,2017,12,15,01:10,금요일,10,4,0,아르젠티노(as42****),하아...개봉했을때보고 재방도 봤고 비디오 dvd로도 봤지만 언제봐도 가슴먹먹해진다..ㅠ.ㅠ 아빠...일어나...이영화를 알게된후 자다가도 벌떡벌떡 일어난다..아빠..일어나..최고에 명대사..아빠 일어나..다같이 아빠!!!일어나아아아아ㅠ.ㅠ  
12-15-2017,2017,12,15,00:51,금요일,10,4,0,아치와방새(ngw1****),정말 잼나는 영화 추천해서 고맙습니다  
12-15-2017,2017,12,15,00:36,금요일,10,4,0,krh3****,한없이 눈물만 흐릅니다..  
12-14-2017,2017,12,14,22:30,목요일,10,4,0,레어리(lees****),인생 최고의 영화로 꼽는다  
12-14-2017,2017,12,14,22:09,목요일,10,4,0,꾸요밍준호쨩(yjh6****),한번도 안본사람은 있어도 한번만 본사람은 없다는 영화 맞나요?  
12-14-2017,2017,12,14,19:50,목요일,10,4,0,귀종(hye8****),나만 보기 아깝다. 다같이 보자  
12-14-2017,2017,12,14,18:06,목요일,10,4,0,홀로서기(drag****),혼자 보기 아까운 영화! 같이 나누면 더 좋은 영화!  
12-14-2017,2017,12,14,16:13,목요일,10,4,0,양상(khys****),하늘에 있는 진오야 꼭봤으면한다....  
12-14-2017,2017,12,14,13:22,목요일,10,4,0,포동이(dnwo****),이제서야 봤습니다 죄송합니다  
12-13-2017,2017,12,13,18:01,수요일,10,4,0,옆집애새키(oaol****),클레맨타인이 평론가 별점이 없는이유가감히 이  영화를 인간이 평가 할 수 없기때문이죠  
12-13-2017,2017,12,13,12:52,수요일,10,4,0,대망(pcy6****),?? ??????? ???? ?? ????. ???? ?? ??? ?? ???????? ?? ???????? ?? ?? ???? ????  
11-27-2017,2017,11,27,01:10,월요일,10,4,0,재르(jakm****),최고의 영화 같이죽자~!!  
11-23-2017,2017,11,23,17:13,목요일,10,4,0,망겜에일격(qqee****),90년대 생들은 믿고 한번 봐라 역사적인 영화다.  
11-21-2017,2017,11,21,13:28,화요일,10,4,0,미소(alty****),정말 말로 표현하기 힘든 감동을 주는 영화중 하나인것같다  
11-20-2017,2017,11,20,09:07,월요일,10,4,0,드록신드록바(andr****),"신은 영화를 만들었고,악마는 신을 질투하여 클레멘타인을 만들었다.  "
11-19-2017,2017,11,19,20:37,일요일,10,4,0,할일있는사람(ghj8****),이 영화는 역사가 높이 평가  
11-19-2017,2017,11,19,13:54,일요일,10,4,0,한상현(hksd****),이 영화는 갓띵작이다.  
11-19-2017,2017,11,19,00:05,일요일,10,4,0,박승범(kavi****),이영화만큼 재밋는영화가없다  
11-18-2017,2017,11,18,23:31,토요일,10,4,0,cbi0****,이제부터 내 최애캐는 시걸형님이다!  
11-8-2017,2017,11,8,11:51,수요일,10,4,0,0520****,금연중인 분들께 이 영화를 추천드립니다  
11-5-2017,2017,11,5,00:38,일요일,10,4,0,찰리(ckff****),왜 지금 봤는지 모르겠습니다... 타이타닉 뺨을 후려치고도 남는 대작입니다 꼭 보시기를...  
10-24-2017,2017,10,24,22:00,화요일,10,4,0,신무민(2909****),생에 가장 엄청난 영화중 하나!  
10-24-2017,2017,10,24,14:47,화요일,10,4,0,박태진(xoeh****),죽은 지 사흘만에 이 영화의 외침을 듣고 일어났습니다.  
10-8-2017,2017,10,8,20:58,일요일,10,4,0,airs****,최고입니다 한번보세요  
10-8-2017,2017,10,8,10:56,일요일,10,4,0,schu****,노잼낚시라고 하는 사람은 이 영화를 안 본 사람이다. 실제로 끝까지 본 사람으로서... 정말 컬쳐쇼크였고 모든 감상평이 이해되기 시작했다. 그냥 세상에 이런 영화가 있을 수 있구나 싶었다...  
10-4-2017,2017,10,4,20:29,수요일,10,4,0,gito****,너희 내가 누군지 아니?  
10-4-2017,2017,10,4,17:14,수요일,10,4,0,강시내(you_****),반신반의 하면서 봤는데 흠.. 보고 판단하시면 됩니다.  결코 가볍지 않은 영화  
10-4-2017,2017,10,4,16:32,수요일,10,4,0,임지훈(roms****),장난인줄 알았다..지나친 고평점이 장난인줄 알았다..시대를 너무도 잘못 만난 영화..왜 대체 이게 와 망한 영화인거냐...  
10-4-2017,2017,10,4,16:25,수요일,10,4,0,ciri****,이영화를 봤으니 앞으로 암검진할 일은 없겠습니다.  
10-4-2017,2017,10,4,15:37,수요일,10,4,0,루이석(blue****),이 영화는... 평가할수가 없다  
10-4-2017,2017,10,4,14:21,수요일,10,4,0,태권브이(khoo****),남녀노소  다 좋아할만 영화이다아들이랑 이번추석때 같이 보니 더욱더 감동이 밀려온다내아들도 결혼해서 아들이랑 꼭다시 볼것 같다  
10-4-2017,2017,10,4,13:13,수요일,10,4,0,ddon****,갓황멘타인 이다섯글자면 충분하지  
10-4-2017,2017,10,4,12:10,수요일,10,4,0,PinkiePie(dian****),내 인생 이 영화를 보는 순간이 아깝지 않았다!  
10-4-2017,2017,10,4,01:58,수요일,10,4,0,루(ahep****),영화는 아직 안봤으나~ 펑점만 보고 10점 줍니다.  
10-3-2017,2017,10,3,11:48,화요일,10,4,0,텡(0380****),내가 2004년도에 태어나서 이 영화를 직접 극장에서 보았더라면.. 더 깊은 울림과 감동이 전해졌을텐데 말이다. 이 영화는 두고두고 봐도 아주 완벽하고 전율을 돋게 하는 그런 영화일 것이다.  
10-1-2017,2017,10,1,09:38,일요일,10,4,0,렌지(flwk****),"왜 추석특선영화에 이런 명작이 없는걸까... 내가 KBS, MBC, SBS 사장이라면 이영화를 추석 저녁 6시에 방영하게 할 것이다.  "
9-26-2017,2017,9,26,00:46,화요일,10,4,0,닝닝(k_ta****),좋습니다 정말..감동적 이네요  
9-24-2017,2017,9,24,11:05,일요일,10,4,0,hikk****,The room 이란영화를봐보세요 클레멘타인2입니다  
9-23-2017,2017,9,23,06:58,토요일,10,4,0,오이소박이(davi****),아 시버러버 뭐 이딴게 다 있어 아...  
9-22-2017,2017,9,22,18:04,금요일,10,4,0,CHIRON(cyki****),Wholeheartedly with regard to the most recent book and  
9-21-2017,2017,9,21,15:21,목요일,10,4,0,myca****,인간사의 모든 것이 한 작품에 담겨있다는 게 실로 놀랍고도 아름답지 아니한가  
9-20-2017,2017,9,20,17:35,수요일,10,4,0,negu****,시대를 너무 앞서 개봉되었다; 후세를 위해 10점을 남긴다.  
9-20-2017,2017,9,20,17:00,수요일,10,4,0,하랑(habe****),우울할때마다 이 영화를 검색하고 평점댓글을 읽습니다.  정말 영화도  평점댓글도 최고임  
9-20-2017,2017,9,20,14:47,수요일,10,4,0,별사자(l3s2****),전 여자친구에게 소개받았고 그 감동을 나도 이어주고싶었다 그래서 누굴 만날때마다 알려줬다 이런 명작이 우리손에서 끊기질 않길...  
9-20-2017,2017,9,20,13:23,수요일,10,4,0,물방울(gksw****),가슴속의 뜨거운 무언가가 튀어나오려고 하며 저넓은 태평양같은 아주큰 감동이 쓰나미처럼 몰려로는 영화입니다. 한10번은 더봐야겠내요오  
9-17-2017,2017,9,17,07:02,일요일,10,4,0,ㅇㅇ(chob****),하루에 한번씩은 봐야되는 영화  
9-17-2017,2017,9,17,06:21,일요일,10,4,0,핵안습(rjsd****),다시는 대한민국에서 나오지 못할 역작  
9-16-2017,2017,9,16,21:52,토요일,10,4,0,테메네(njg1****),제 여자친구랑 저랑 목감기로 고생하다가 이 영화를 보고 목감기가 나았네요. 진짜입니다. 이런 띵작을 저만 볼 수 없기에 여러분과 함께 공유하고 싶습니다.  
9-10-2017,2017,9,10,22:50,일요일,10,4,0,마르코(raze****),최고의 영화입니다 good!  
9-10-2017,2017,9,10,03:51,일요일,10,4,0,로빈(grob****),평점은 배신하지 않습니다. 강추  
9-9-2017,2017,9,9,12:59,토요일,10,4,0,셀쥬(youb****),너무 뒤늦게 이 영화를 접했습니다. 그 동안 클레멘타인을 모르고 살아왔던 시간들이 너무 아깝게 생각되네요.  
9-8-2017,2017,9,8,23:03,금요일,10,4,0,으뜸엄마(mati****),지금 DVD방에서 여침이랑 보고있어요...옆에서 막 울어요..  
9-8-2017,2017,9,8,00:30,금요일,10,4,0,gris****,영화를 보고 입안에 내 주먹을 밀어넣으며 포효했다.  
9-8-2017,2017,9,8,00:10,금요일,10,4,0,smz8****,아  지금에서야 이 명작을 보다니... 지난날이 너무 후회스럽다  
9-7-2017,2017,9,7,23:56,목요일,10,4,0,서영순(ksdj****),이런 명작의 평점이 10점이 아니라는것은 말이 되지 않는다  
9-7-2017,2017,9,7,23:52,목요일,10,4,0,니차두(baul****),미국에 록키가 있다면 한국엔 클레멘타인이 있다  
9-7-2017,2017,9,7,22:27,목요일,10,4,0,cc4878(qkrt****),와...진짜 여운이 안가네요 왜 이영화가 13년이 지나도 거론되는지 알게되었습니다.못 본 사람은 꼭 보시길  
9-7-2017,2017,9,7,20:53,목요일,10,4,0,호랭이(rnjs****),이 영화보며 철창안 장면을 보고 너무 몰입해서스티븐 시걸을 친다는 마음으로 모니터를 부셨습니다.  
9-7-2017,2017,9,7,20:29,목요일,10,4,0,누가가미(chw5****),구태여 설명이 필요한가?  
9-7-2017,2017,9,7,16:13,목요일,10,4,0,도성환(ehtj****),명작이다 정말 명작이다  
9-4-2017,2017,9,4,16:05,월요일,10,4,0,국제물류(pnpl****),이런 명작 영화를 모른다는 사람이 많은게 아쉽습니다.  
9-4-2017,2017,9,4,15:24,월요일,10,4,0,hool****,여자친구가 왜 자기 전화 안받냐고 롤중이냐고 뭐라 해서 클레멘타인을 본다고 대답했습니다. 여자친구가 미안하다며 다음날 도시락을 싸주었습니다.  
9-3-2017,2017,9,3,12:14,일요일,10,4,0,엠씨 블루(bane****),짝사랑하는 여자가 있었습니다. 저한테 눈길한번 안주던 여자였습니다. 우연히 이영화를 보고 그 여자에게 추천했는데 보고 나서 저한테 고백을 하더군요. 사랑한다고... 어느덧 그 여자와 결혼해서 이제 아이들과 함께 보고 있습니다.  
9-1-2017,2017,9,1,04:51,금요일,10,4,0,kssk****,눈물이너무나서 앞이안보여요  
8-31-2017,2017,8,31,14:25,목요일,10,4,0,박도한(kkam****),닥띵작에 찬사를 ~^^  
8-30-2017,2017,8,30,14:59,수요일,10,4,0,둥이(mygs****),이거 보다 명작 있을까....  
8-30-2017,2017,8,30,13:58,수요일,10,4,0,역발상(bruc****),주전자를 들고 돈데기리기리 돈데크만을 외치며 화면속으로 들어가 쓰러진 아빠를 일으켜주고 싶었습니다..  
8-30-2017,2017,8,30,13:20,수요일,10,4,0,Hwang(theb****),장난끼 많던 내가 유일하게 대학교에서 만나 평소에 진지한 사이로 의를 나누던 친구가 추천해준 영화!당연 의심없이 봤다. 영화 시작부터 나도 모르게 올라가는 내 사이드 입 꼬리 이유는 이 영화안에 다 들어있다! 남자의 영화!  
8-29-2017,2017,8,29,18:47,화요일,10,4,0,이준기님(poos****),내 인생을 걸만큼 소중한 영화  
8-29-2017,2017,8,29,11:19,화요일,10,4,0,doha****,헤어지고자 하는 연인께 추천드려요~  
8-28-2017,2017,8,28,18:57,월요일,9,4,0,su학마스터(chlt****),"10년도 더 지난 지금 다시봐도 여전히 전혀 촌스럽지 않고, 영화가 끝나고 나서도 아직까지 여운이 가시질 않네요.  확실히 국내 영화 중엔 가장 독보적인 듯...  "
8-28-2017,2017,8,28,18:16,월요일,10,4,0,넵잇펍(gnld****),재밋게봤네요 명불허전!  
8-28-2017,2017,8,28,15:35,월요일,10,4,0,카멜리아(ace3****),김정은이 이영화를 본다면미사일을 쏘지 못할것이다.  
8-27-2017,2017,8,27,13:58,일요일,10,4,0,김진솔(jins****),이 영화를 보면서 참 많은생각을 했습니다..  
8-27-2017,2017,8,27,13:45,일요일,10,4,0,장민우(squi****),전설적인 영화로 유명함  
8-26-2017,2017,8,26,18:33,토요일,10,4,0,왜요(kang****),2번 봤습니다. 오늘 3번째 보려고 합니다  
8-23-2017,2017,8,23,15:58,수요일,9,4,0,가을로go go(tolg****),내 인생 최고의 영화는 78년인가 79년에 아버지 따라서 재개봉관에서 봤던 스타워즈였다. 그 때의 아버지보다 더 나이가 먹어버린 지금. 내인생 최고의 영화는 이 영화가 되었고 아이들에게도 보여주었다. 평점9점인 건 속편을 기다리며 비워놓은 마음이다  
8-23-2017,2017,8,23,12:30,수요일,10,4,0,해서야(eej1****),리 : 클레멘타인?..클레멘타인!!  
8-22-2017,2017,8,22,04:11,화요일,10,4,0,MNMLT(blac****), 대사소리로만 듣는걸로 볼 수 밖에 없었는데. 아빠 일어나 에서 눈이 떠진 영화.  
8-22-2017,2017,8,22,02:37,화요일,10,4,0,성식이형(mygu****),뭐야??아직 안본사람있어??? ㅎㅎㅎ  
8-21-2017,2017,8,21,01:40,월요일,10,4,0,하늘아래(dnsg****),이런 미친! 새벽에 잠이오지않아 영화를 볼까하다가  대작을 찾게됨. 평점을보다가 얼마나 대단할까 쭈욱읽어보다가...  나도모르게 그만 보지도않았는데10점을 주고말았네요. 제인생의 대작은 마음속에 영원히 간직만  하는걸로.. 이런 네티즌들 월드컵인줄..  
8-21-2017,2017,8,21,00:42,월요일,10,4,0,찬우(ixor****),말이 필요없ㅇ네요 ㄹㅇ  
8-19-2017,2017,8,19,00:04,토요일,10,4,0,we08****,이 명작을 보고 세상을 보는 눈이 달라졌다  
8-18-2017,2017,8,18,15:29,금요일,10,4,0,웃엉(jus1****),아직도 안봤다면 모든것을 제쳐놓고 지금 당장 보아라  
8-16-2017,2017,8,16,00:16,수요일,10,4,0,센스만점(gama****),OOO들..후...  
8-15-2017,2017,8,15,19:42,화요일,10,4,0,Steve(blue****),기억상실증에 걸렸으면 좋겠습니다.이 영화가 머릿속에 자리잡혀 도저히 빠져 나가질 않네요.일상생활까지 못할 정도로 생각이 납니다.이 영화를 알기전으로 돌아가고 싶습니다. 제발 누가 도와주세요.타임머신을 만들어 주던지기억상실증에 걸리게 해주세요.  
8-13-2017,2017,8,13,17:19,일요일,10,4,0,무명인(oren****),클레멘타인 게섯거라 !  리얼이   쫒아온다!  
8-13-2017,2017,8,13,07:58,일요일,10,4,0,슬픈타키(tjdd****),감독에게 감사드립니다.  
8-10-2017,2017,8,10,11:11,목요일,10,4,0,데이비드(davi****),한국영화를 구분 짓는다면 클레멘타인 전과 후로 나눌수있다.  
8-10-2017,2017,8,10,10:55,목요일,10,4,0,이재준(wown****),슬퍼서 한번더봄 ㅠㅜ 꼭보세요님들  
8-8-2017,2017,8,8,15:10,화요일,10,4,0,심슨(gbdd****),이 영화가 내 마음을 읽습니다.  
8-7-2017,2017,8,7,21:57,월요일,10,4,0,햇(qkr1****),영화본지 일주일이 지났지만 아직도 마음 한구석이...하... 친구들과 술한잔 하면서 한번더 봐야겠습니다.  
8-5-2017,2017,8,5,01:35,토요일,10,4,0,whdy****,"정말 엄청난 영화입니다 . 2살 짜리 조카와 영화를 보는데 , 아빠일어나 한마디에 제 조카가 기저귀를 차고 있었는데, 기저귀가 지릴 정도로 쉬를 하며 울며 감동하는 조카를 보며, 지금 손을 덜덜덜덜 떨며 평점을 남깁니다..  "
8-3-2017,2017,8,3,20:58,목요일,10,4,0,주노(oljh****),이평점 실화냐 10자ㅋ  
8-3-2017,2017,8,3,04:11,목요일,10,4,0,졉(ll51****),"제 좌우명은 no pain, no gain 이었습니다 허나 이 영화를 접한 이후 제 좌우명은 Cementain(클레멘타인) 이 되었습니다  "
7-29-2017,2017,7,29,16:28,토요일,10,4,0,폼락푸잉(soka****),이건 영화가 아니다이건 예술이다제임슨카메론 감독이 이 영화를 보고난후 이동준감독에게 전화를 걸었다고 한다진정한 킹은 당신이였다구참회의 눈물을 흘렸다고 한다  
7-28-2017,2017,7,28,23:57,금요일,10,4,0,뉴타입(pgon****),"어떻게 이런 영화를 만들 수가 이쓴 것인지, 이거 정말 대박임~!  "
7-26-2017,2017,7,26,13:20,수요일,10,4,0,불타월(istk****),당신은 평점을 공감하기 위해 이미 VOD를 결제하고 있다!  
7-24-2017,2017,7,24,16:40,월요일,10,4,0,wjdr****,이 영화를 보고 여자친구가 생겼습니다.  
7-24-2017,2017,7,24,09:39,월요일,10,4,0,무니(moon****),예전에 직관한 생각이 납니다...    영화 종료후 한동안 멍할 정도로 감동의 쓰나미가 익사할 정도로 밀려오는....  
7-24-2017,2017,7,24,00:16,월요일,10,4,0,룬(satu****),영화를 반도 안봤지만 이미 눈에선 눈물이 넘쳐 흐르네요 . 말이 필요 없는 명작입니다.  
7-23-2017,2017,7,23,08:31,일요일,10,4,0,alek****,진정한 영화 오브 영화! 명작 오브 명작  
7-23-2017,2017,7,23,02:08,일요일,10,4,0,박동한(luca****),나만당할수없지 냉무우루루우  
7-21-2017,2017,7,21,15:23,금요일,10,4,0,tkdg****,이 영화를 보기전..난 피폐한 인생을 살아왔다 삶의 존재 이유에 대해 고뇌하며 힘든 삶을 살았다고 생각하였다. 하지만 이영화를 본 이후 삶의 존재 이유를 찾았으며 내 인생이 빛나기 시작했다. '아빠 일어나'라는 대사는 나를 일으켰다.  
7-21-2017,2017,7,21,04:58,금요일,10,4,0,진인사(bigb****),엄지척! 역시 날 실망시키지 않은 영화입니다! 강추!!  
7-21-2017,2017,7,21,02:09,금요일,10,4,0,love2246k(yd22****),갑자기 슬퍼진다 주르륵  
7-19-2017,2017,7,19,22:19,수요일,10,4,0,아하마드(hanb****),클레맨타인 전설은 아직 끝나지 않았다.  
7-19-2017,2017,7,19,21:46,수요일,10,4,0,piwl****,리얼보다 스토리를 그나마 이해할수있어 십점드립니다  
7-19-2017,2017,7,19,14:32,수요일,10,4,0,유리세계(yuse****),이제는 전설이 된 영화.  
7-16-2017,2017,7,16,17:33,일요일,10,4,0,gjdkc(jisa****),꿈에서 나올 듯 싶은데..  
7-14-2017,2017,7,14,12:06,금요일,10,4,0,유남호(namh****),이 영화를 군대 이등병때봤는데 그날이후로제가 병장한테 '야 물떠와'를 시전할수있게되었죠  
7-14-2017,2017,7,14,00:27,금요일,10,4,0,모르거따(cmj8****),최고의영화 입니다.!!!  
7-13-2017,2017,7,13,18:00,목요일,10,4,0,에디컴(edic****),"사람들마다 망작, 명작의 기준이 다르다그렇기에 나는 이 영화를 감히 명작이라 칭한다.  "
7-13-2017,2017,7,13,07:32,목요일,10,4,0,여름이(igwo****),이 영화를 보고 한 아이의 아빠가 되었습니다. 아빠 일어나~ 이 소리를 들으며 오늘도 열심히 일어나고 있습니다.  
7-10-2017,2017,7,10,23:44,월요일,10,4,0,퀘ㅂ(mino****),영화는 클레멘타인 게임은 히어로즈 오브 스톰  
7-10-2017,2017,7,10,21:56,월요일,10,4,0,최장욱(like****),이세상의 모든 이치는 이 영화로 설명된다  
7-10-2017,2017,7,10,17:38,월요일,10,4,0,미미조아(ihoi****),명절날 가족영화로 강추합니다. 조만간 감독 확장판 DVD 발매되면 인생작으로 소장할까 해요.  
7-10-2017,2017,7,10,15:36,월요일,10,4,0,5520****,"        '        -       :          ;             ,         ""       .    ;    .?  "
7-10-2017,2017,7,10,04:43,월요일,10,4,0,심심해(dufm****),평점 진짜 명작보다 더 명작스러운 말들이 많네 읽으면서 재밌었다  
7-8-2017,2017,7,8,03:22,토요일,10,4,0,dogs****,이건  진짜다  리얼 최고체고  
7-7-2017,2017,7,7,22:41,금요일,10,4,0,나무가방(hanm****),장르와 국적은 다르지만 스탈린 그라드:최후의 전투와 쌍벽을 이루는 최고의 명작  
7-7-2017,2017,7,7,22:12,금요일,10,4,0,루딩(sunj****),와~~씨!! 이런 명작을 이제 알게되어보다니 인생 헛영화 보고 살았네요 개명작이다 ㅋㅋ  
7-7-2017,2017,7,7,20:39,금요일,10,4,0,nare****,예술 그 자체다. 이 영화는 미쳤다..  
7-7-2017,2017,7,7,17:19,금요일,10,4,0,주식회사 청운(cw86****),미친 존재감의 영화 시간이 소중하다는걸 느끼는 명작  
7-6-2017,2017,7,6,20:00,목요일,10,4,0,차딱남(yuna****),"""인생영화""입니다.  "
7-6-2017,2017,7,6,02:37,목요일,10,4,0,보라돌이(nooo****),진짜 끝까지 다 보고 매기는 별점  
7-4-2017,2017,7,4,20:44,화요일,10,4,0,전우태(jwt0****),꿀잼이네요 이제야 본게 후회됩니다  
7-4-2017,2017,7,4,20:42,화요일,10,4,0,너(bitt****),"인생 최고의 영화 입니다 한국의 영화는 클레멘타인 전과 후로 나뉜다고 봅니다,.  "
7-3-2017,2017,7,3,20:03,월요일,10,4,0,VVV(hjh8****),왜 리얼이란 졸작이랑 연관돼서 나오는 지 모르겠는 작품이다..한국인의 한을 보여주는 명작이다..  
7-2-2017,2017,7,2,17:45,일요일,10,4,0,kms5****,최고의 영화입니다 꼭 보세요  
7-2-2017,2017,7,2,17:37,일요일,10,4,0,야채버거(gygh****),내 생에 최고의 영화였다.  
6-28-2017,2017,6,28,17:58,수요일,10,4,0,라크슈미(sada****),건강한사람이 보면 죽을병에 걸리고죽기직전의 사람이 보면 불로장생 한다는~전설같은영화.  
6-17-2017,2017,6,17,18:55,토요일,10,4,0,kkgh****,이 영화를 보고 여친이 생겼습니다  
5-31-2017,2017,5,31,13:19,수요일,10,4,0,fasc****,인생영화입니다...  
5-29-2017,2017,5,29,22:45,월요일,10,4,0,덤(wo1d****),난 왜 아직까지 이 영화를 보지 못했을까..  
5-26-2017,2017,5,26,14:24,금요일,10,4,0,포인트(snow****),나도 한번 거들어보자 ㅋ  
5-21-2017,2017,5,21,14:44,일요일,10,4,0,그겨울(4543****),"이 영화를 보지 않고서, 영화를 논하지 말라는  지인의 추천으로 봅니다. 미리 10점 드립니다.  "
5-4-2017,2017,5,4,15:02,목요일,10,4,0,이현승(eodr****),내 나이 20살에 본 영화... 이 영화 이후로 제 삶이 완전히 달라졌습니다.. 감사합니다..  
4-28-2017,2017,4,28,15:17,금요일,10,4,0,밤의냄새(sega****),진짜 최고다.. 먹먹해진다..여운이 깊다.. 이런 영화를 21세기에 만날 수 있다는 것에 감사히 생각한다..  
4-27-2017,2017,4,27,08:15,목요일,10,4,0,짱아에게(doza****),재개봉을 기다립니다. 극장에서 꼭 다시 한 번 감동을 느끼고 싶네요  
4-25-2017,2017,4,25,13:31,화요일,10,4,0,tigr****,이 영화를 보지 않은채 살아온 여태까지의 삶이 무의미하게 느껴졌다.  
4-24-2017,2017,4,24,13:21,월요일,10,4,0,식물과물고기(wlgh****),내 인생을 구원한 역작이다.  
4-23-2017,2017,4,23,15:17,일요일,10,4,0,도둑잡기(pull****),"'눈물 젖은 빵을 먹어보지 않은 자와 인생을 논하지 말라'는 유명한 옛말이 있다. 나는 이 말을 현대적으로 바꿔, '클레멘타인을 보고 눈물로 젖어보지 않은 자와 인생을 논하지 말라'라고 표현하고 싶다.  "
4-14-2017,2017,4,14,23:17,금요일,10,4,0,shuu****,보고 또 보고 평생소장용  
4-14-2017,2017,4,14,21:03,금요일,10,4,0,cusco(pooq****),십점 만점에 뷁점!!!  
4-14-2017,2017,4,14,15:02,금요일,10,4,0,zl몽몽7(skyc****),최고의 영화입니다..  
4-3-2017,2017,4,3,13:55,월요일,10,4,0,이산사(minh****),이영화가 최고인 이유는 딱하나다 내가슴에 숨어있던 진실된 순수한 누불을 흘리게 해준것 만으로도 이영화는 최고다  
4-2-2017,2017,4,2,12:06,일요일,10,4,0,fore****,내가 클레멘타인을 만나기 전나는 다만 하나의 인간에 불과했다클레멘타인이 나에게 와주었을때나는 비로소 마법사가 되었다  
3-27-2017,2017,3,27,00:42,월요일,10,4,0,양촌댁(lsj4****),혼자 보기 너무 아깝네요 하하하  
3-26-2017,2017,3,26,00:50,일요일,10,4,0,송민경(sals****),희대의 명작.이 영화를 보지 않고 영화를 평했던 내가 수치스럽다.  
3-26-2017,2017,3,26,00:05,일요일,10,4,0,태희(yan2****),신이시여~ 어찌하여 이 영화를 보게 하셨나이까... 이걸 본 후론 어떤 영화도 흥이 나질 않습니다...  
3-23-2017,2017,3,23,04:15,목요일,10,4,0,kuk1****,인생에 슬럼프가 왔네요. 그 시절 나를 일어나게 했던 이 영화를 다시 꺼냅니다.  
3-17-2017,2017,3,17,12:06,금요일,10,4,0,dreamworld(worl****),아니 한국에서이런영화를? 이건뭐 요즘도힘들지않을까.. 감성이면감성 액션이면액션 뭐하나흠잡을데가없다 가지고있던 발톱무좀이영화가끝나고 무심결에보니사라졌다 열번씩들보시길!  
3-12-2017,2017,3,12,17:13,일요일,10,4,0,Justin(blac****),감동의 쓰나미가 몰려오는 기분이었습니다!!  
3-8-2017,2017,3,8,21:59,수요일,10,4,0,천산흑협(alst****),아빠아아아ㅏ아ㅓ어아빠일어나아아아이장면에아파서누워있던사람도일어났다는..그클레멘타인  
3-8-2017,2017,3,8,01:37,수요일,10,4,0,냥늉냥(yuna****),와...한국에 이런 명작이...!  
3-6-2017,2017,3,6,07:32,월요일,10,4,0,에휴(mk_k****),영화 끝나고 감동받아서 박수치다가 손에 물집생겼습니다...왜 이제서야 이 명작을 접한건지 모르겠네요ㅠㅠ  
3-5-2017,2017,3,5,14:49,일요일,10,4,0,Paris(duda****),이영화를 보고 나서 암이 나았다는게 사실이네요  
3-4-2017,2017,3,4,22:29,토요일,10,4,0,감쟈(dmst****),와.... 주인공 동생역으로 나오신분이 형일어나!라고 외치면서 오열하는데 밀정에 송강호가 생각나는 연기였음 왜 이분 영화에 안나오시는거지?? 블랙리스트이신가ㅠㅠ  
3-4-2017,2017,3,4,18:38,토요일,10,4,0,howb****,이게 진짜 영화다. 아직도 가슴이 두근댄다.  
3-1-2017,2017,3,1,20:23,수요일,10,4,0,flws****,정말 숨은 명작입니다.  
3-1-2017,2017,3,1,19:30,수요일,10,4,0,미남키퍼쿠르투아(wjdg****),말이안나온다....  
2-28-2017,2017,2,28,21:46,화요일,10,4,0,모래시계(hjm9****),내 인생 최고의 반전영화! 이 영화를 보는 모두 속지 않고는 못배길 것이다  
2-28-2017,2017,2,28,14:37,화요일,10,4,0,ikr9****,클레멘타인 클레멘타인  
2-27-2017,2017,2,27,21:04,월요일,10,4,0,스카이(sky2****),안본눈 산다. 이 영화를 보지않은 눈으로 다시한번 이명작을 감상하고 싶다  
2-26-2017,2017,2,26,01:23,일요일,10,4,0,CT(cakt****),"이 영화는 ""진짜"" 다.  "
2-25-2017,2017,2,25,17:25,토요일,9,4,0,짜장이짜장짜장(7389****),너무평정이좋아서 다들뻥치는 건줄알고 속는셈 치고보자 하고봤는데 보길잘했네요 진짜 안보시면 후회합니다 꼭보세요  
2-25-2017,2017,2,25,15:40,토요일,10,4,0,기명(hski****),아직도 평점을 달고 있네. 수작은 뭔가 다르군  
2-23-2017,2017,2,23,18:39,목요일,10,4,0,이전밍(dlwj****),비운의 영화.. 시대의 역작  
2-23-2017,2017,2,23,16:47,목요일,10,4,0,윤정(mary****),왜 이 영화가 오스카 시상식을 싹슬이 하지 못했는지 의문이 든다.  아역의 연기는 여우주연상을 받고도 남는다.  
2-23-2017,2017,2,23,05:29,목요일,10,4,0,THERED(bbug****)," 타이타닉, 양들의 침묵 , 바람과 함께 사라진다는 이 영화를 보면 단지b급영화에 지나지 않는다 이 영화는 10점이라는 평점도 과소할정도이다  "
2-22-2017,2017,2,22,19:57,수요일,10,4,0,라자(well****),명작이다. 또 보고 싶다.  
2-22-2017,2017,2,22,19:38,수요일,10,4,0,카라멜(pear****),정말 최고의 영화...아직도 감동이 가시지 않아요  
2-22-2017,2017,2,22,18:36,수요일,10,4,0,개짜증(wooi****),'아빠 일어나' 이것 말고 더 이상 무엇이 더 필요한가  
2-19-2017,2017,2,19,09:50,일요일,10,4,0,shad****,꼭 보세요 물론 전 보진 않았습니다.  
2-14-2017,2017,2,14,16:44,화요일,10,4,0,김재환(wogh****),발렌타인에는 연인과 함께 클레멘타인을...  
2-14-2017,2017,2,14,01:20,화요일,10,4,0,학생(ppar****),아빠!!일어나!!!  
2-13-2017,2017,2,13,20:58,월요일,10,4,0,하늘색용(hsun****),제 인생의 첫영화였었죠.마지막도 함께 하고픈 영화입니다.아빠 일어나!!  
2-5-2017,2017,2,5,12:32,일요일,10,4,0,usd(xodu****),노아가 살아있었다면 방주에 이영화를 실었을것이다.  
2-4-2017,2017,2,4,07:13,토요일,10,4,0,Juni(qudw****),이만한게 없지 왜 평점이 이리 높은지 다들 확인 해 봐라  
2-1-2017,2017,2,1,23:42,수요일,10,4,0,Olympus(az20****),외국영화보다 재밌네요  
2-1-2017,2017,2,1,18:42,수요일,10,4,0,김범수(jerr****),이 영화 재밌구만 뭘!!!!  
1-28-2017,2017,1,28,14:56,토요일,10,4,0,TaylorSwift(jh99****),오랜만에 좋은 영화 한편 봤네요~  
1-26-2017,2017,1,26,11:19,목요일,10,4,0,전기의길(adex****),우리나라 정치판은 망했어도 영화계는 살아있다는 것을 증명하는 영화라고 할만 합니다. 잊을 수 없는 이름 잊어선 안되는 이름 너의 이름은 클레멘타인!  
1-26-2017,2017,1,26,03:31,목요일,10,4,0,Me(eve5****),인간이 가진 언어는 이 영화를 표현하기에 너무나 초라하다..  
1-15-2017,2017,1,15,17:25,일요일,10,4,0,살아있는 전설(moch****),이영화는 F다 판타스틱의 F...  
1-13-2017,2017,1,13,23:56,금요일,10,4,0,dlal****,자살생각날때 우울할때 한번씩보세요힘이납니다!  
1-12-2017,2017,1,12,18:21,목요일,10,4,0,콜드(apri****),라섹이후로 안구건조증이 심해서 인공눈물을 수시로 넣었었다. 클레멘타인을 보고 눈물샘이 터졌다...  
1-10-2017,2017,1,10,03:15,화요일,10,4,0,6842(4999****),신이 세상을 만든 이유는 클레멘타인이 제작되길 바라서였다...  
1-10-2017,2017,1,10,00:36,화요일,10,4,0,suicidesquad(kcor****),"클레멘타인 속편 제작 발표났네요 배급사는 cj고요. 주연으로는 송강호,최민식,김고은,오달수 악역엔 곽도원이 연기하고 아역배우엔 곡성에 김환희양이 연기한다고 합니다.또 저번에 스티븐시걸에 이어서 이번엔 크리스 에반스가 나온다고 하네요.  "
1-9-2017,2017,1,9,17:57,월요일,10,4,0,드으래곤(rage****),스티븐 시걸도 이 영화를 찍기전에는 그저그런 삼류배우에 불과했지...이 영화를 계기로 월드스타가 될 수 있었다.  
1-6-2017,2017,1,6,11:51,금요일,10,4,0,이름(igec****),"휴대폰에 반복재생을 눌러놓은지 모른채 8번을 다시봤지만 볼떄마다 새롭고 감정적이었으며, 몰입되었다. 그 이후 반복재생을 눌러놓았던 30분전에 내 폰을 빌려갔던 우리형의 침소 방향으로 삼배를 하며 하루를 시작한다.  "
12-20-2016,2016,12,20,00:08,화요일,10,4,0,Prairie Dog(wnsg****),아나 데체 평점 왜이러냐ㅋㅋㅋ 글고 시걸 어따 팔아먹음?  
12-17-2016,2016,12,17,22:54,토요일,10,4,0,스(pome****),명작은 세월이 흘러도 명작이라는 말을 확고히 지지해주는 영화네요.  이걸 추천해준 친구 치킨사주러 가야겠어요  
12-15-2016,2016,12,15,00:42,목요일,10,4,0,이종민(dlwh****),한반도의 가장 위대한 업적은 클레멘타인을 만든 것.  
12-14-2016,2016,12,14,18:11,수요일,10,4,0,팔난봉(hees****),최근들어 이런 명작을 봐서 너무 행복하다  
12-14-2016,2016,12,14,01:45,수요일,10,4,0,역설소년(para****),네이버 영화가 아니라 유네스코에 있어야 할 작품  
12-12-2016,2016,12,12,01:01,월요일,10,4,0,보니(dmlf****),보고또봐도 계속보고싶은영화!  
12-11-2016,2016,12,11,23:08,일요일,10,4,0,아맛나(jyh3****),담백한 감동이 밀려드는 영화 주옥같은 평가를 받은데엔 이유가 있다  
12-11-2016,2016,12,11,22:15,일요일,10,4,0,히릿(ssam****),10점.... 최고....  
12-11-2016,2016,12,11,17:22,일요일,10,4,0,Beauty(qpdk****),자기가 재미 없었다고 대다수의 사람들이 인정하는 명작을 망작이라고 하지는 맙시다... 전 이 감독님 영화 다 찾아서 봐야겠네요.  
12-10-2016,2016,12,10,16:52,토요일,10,4,0,뷰징(vyuj****),클레멘타인 최고의 영화!  
12-2-2016,2016,12,2,17:43,금요일,10,4,0,아이마루(deat****),a must to be seen  
11-30-2016,2016,11,30,21:42,수요일,10,4,0,Coblatic(sukm****),아직 평점 못드린것 죄송히 생각하며 10점 올립니다.  
11-27-2016,2016,11,27,06:37,일요일,10,4,0,장하림(zes6****),이 영화를  본 사람 보다 평점을 준 사람이 많은거 아닌가요?  
11-24-2016,2016,11,24,04:31,목요일,10,4,0,라이어게임(skin****),꼭 봐라 두번봐라 명작이니까  
11-23-2016,2016,11,23,03:22,수요일,10,4,0,ever****,이 영화 보지마세요... 눈만 높아져요~~~ 전 이제 극장을 못가겠어요ㅜㅜ 이보다 나은 영화를 볼수 있을런지...  
11-21-2016,2016,11,21,18:58,월요일,10,4,0,창천항로(ktok****),나도 울었다.  이렇게 감동적일수가 없다. .  
11-18-2016,2016,11,18,15:01,금요일,10,4,0,wlsg****,100번 정도는 봐줘야 함  
11-13-2016,2016,11,13,01:54,일요일,10,4,0,Ryu H Y(yhy0****),와...진짜...넘사벽이다  
11-11-2016,2016,11,11,21:48,금요일,10,4,0,커피사와(sd35****),이영화를 보고 암이 암에 걸려 나았습니다.  
11-8-2016,2016,11,8,02:56,화요일,10,4,0,last****,사랑합니다. 인생 대역전 드라마한국흥행 길이남는역사다  
11-7-2016,2016,11,7,02:30,월요일,10,4,0,IMZ(minj****),영화를 보지 않은것에 감사하며 10점을 주겟다  
11-2-2016,2016,11,2,23:05,수요일,10,4,0,성연(tatg****),이 영화는.. 경이롭다.  
10-24-2016,2016,10,24,21:11,월요일,10,4,0,meen****,"클레멘타인 성냥팔이 소녀의 재림, 영웅 은 내 인생의 최고의 명작이다. 이러한 명작을 본 내가 자랑스럽고 기특하다. 향후 100년간 이런 명작 영화가 나올 수 있을지 의문이다.  "
10-22-2016,2016,10,22,23:49,토요일,10,4,0,he(tyu_****),"관람객  스스로  알바가  되는  영화,  10년  이  지나도  헤어나올 수 없는  심오함  "
10-18-2016,2016,10,18,16:20,화요일,10,4,0,웹툰(ksgm****),말로 표현할수없는영화  
10-16-2016,2016,10,16,20:59,일요일,10,4,0,별명없다(sfaa****),이영화 DVD를 구했다. 그러나 아직 볼 수가 없었다. 예고편에서 느껴진 치밀어 오르는 감동과 오열을 감당하기에는 나는 아직 젊다. 죽기 직전에 반드시 볼것이다. 그럼 나는 다시 살아나겠지?  
10-15-2016,2016,10,15,10:45,토요일,10,4,0,썩은만두(kang****),영화를 안보았지만 마음으로 느끼는 영화 10점 만점에 10점  
10-14-2016,2016,10,14,10:59,금요일,10,4,0,achh****,역대급 영화입니다 헐리웃저리가라입니다 온가족이 활짝웃을수 있어서 정말 감사드립니다 최고의영화 입니다  
10-13-2016,2016,10,13,22:33,목요일,10,4,0,starshine123(fair****),말이필요없는 명작....  
10-13-2016,2016,10,13,21:57,목요일,10,4,0,타프탈렌(redz****),이동준 님의 명연기를 볼 수 있는 영화!!  
10-13-2016,2016,10,13,21:24,목요일,10,4,0,티칸이(rkdx****),정말최고의명작...  
10-12-2016,2016,10,12,11:01,수요일,10,4,0,KBS수신료인상반대(jm_n****),네티즌이 극찬한 이영화 덕분에 새로운 인생을 경험.. 수고했다.  
10-12-2016,2016,10,12,01:33,수요일,10,4,0,경느님(ruds****),아직도 안본사람이 있나??  
10-11-2016,2016,10,11,22:32,화요일,10,4,0,su00****,클레멘타인평생을 기억할만한 제목이네요.영화 평론을 꿈꾸시는 분들은 반드시 보셨으면 합니다. 이걸 봐야지 영화계에 큰 거장으로 성장할 수 있을 것 같습니다.  
10-11-2016,2016,10,11,16:23,화요일,10,4,0,네임리스(creb****),대한민국 영화사에 평생 기억 될 명작  
10-10-2016,2016,10,10,01:10,월요일,10,4,0,쿠니오빠(shri****),다들 진짜 보기나 하고 올린건지..나는 10 여년 전 이 영화를 보고 이제서야 마음을 잡고 글을 쓴다. 클레멘타인을 검색할 때마다 포스터를 보고 눈물이 앞을 가려 글을 쓸 수 없었기 때문이다.  
10-9-2016,2016,10,9,22:24,일요일,10,4,0,벤야민(tomc****),"위험한 영화, 신의 영역까지 기어코  넘어서려는 천재들의 향연  "
10-7-2016,2016,10,7,19:36,금요일,10,4,0,Bae(qodm****),인생영화 이 한마디로 정의한다  
10-7-2016,2016,10,7,18:10,금요일,10,4,0,Fact폭행(xorh****),하늘도 울고 나도 울었다.  
10-6-2016,2016,10,6,00:13,목요일,10,4,0,라이코스(asd7****),극장에서 재개봉 하면  꼭 봐야지..  
10-2-2016,2016,10,2,20:44,일요일,10,4,0,엄훠(gant****),"세계적인 음악가, 운동선수, 예술가 들이 세계적인 작품을 만들기 위해서 그것에 미쳐야 된다고 하던데 나는 이 영화에서 미친것을 넘은 광기를 보았다....  "
10-2-2016,2016,10,2,00:26,일요일,10,4,0,ymek****,이제 다른영화는 어떻게보지?..  
9-29-2016,2016,9,29,08:45,목요일,10,4,0,dark****,30년동안 건강하던 내가 이 영화를 보고 요실금이 생겨버렸다.. 하루에 팬티 5장 이상 갈아 입는 내 자신이 초라하지만 결코 후회하지 않는다.  
9-19-2016,2016,9,19,16:34,월요일,10,4,0,어구몬(kye9****),진짜 재미있네요 ㅎㅎㅎ  
9-19-2016,2016,9,19,13:03,월요일,10,4,0,Lune(powe****),정말 감명깊게 봤다. 그래서 감독님을 만나보고싶다.  
8-23-2016,2016,8,23,19:34,화요일,10,4,0,친절한이팀장(khle****),이 영화 명작이고 재밌다며 나와 싸웠던 태권도사범 최모군아! 니가옳았다. 우리 다시 화해하자! 보고싶다! 철길아!  
8-23-2016,2016,8,23,18:58,화요일,10,4,0,순대볶음(gdcv****),가슴이 뜨거워지는 영화  
8-23-2016,2016,8,23,17:21,화요일,10,4,0,ibel****,솔직히 인생에 남을 명작을지금 볼 준비가 되지않아서아직 못보고 있습니다.인생의 가장 아름다운날 보렵니다.  
8-23-2016,2016,8,23,15:55,화요일,10,4,0,ㅈㅁㄱ(aaab****),이 영화를 보지않고 영화에 대해 논하지 말라  
8-23-2016,2016,8,23,13:41,화요일,10,4,0,바람같은(poem****),한국영화중 남자주인공 액션으로 평가되는 역작 4편이 있다 정우성의 비트 이병헌의 달콤한 인생 김래원의 해바라기 원빈의 아저씨.하지만 아직까지 내인생에 대작이라 불릴만한 영화는 아직도 클레멘타인 이 영화하나다. 아직도 그 감동이 대뇌 전두염에 남아있다  
8-17-2016,2016,8,17,21:36,수요일,10,4,0,nryjhy(kman****),너무 늦게 영화를 접했습니다. 와이프에게 권하였는데 고맙다고 카톡을 보내네요. 감독님 건승하세요  
8-17-2016,2016,8,17,21:03,수요일,10,4,0,star****,내일점장님을가만두지않을거에요이런영화소개해줘서 감사해서 평생같이일하려고요^^  
8-17-2016,2016,8,17,00:14,수요일,10,4,0,aust****,일단 보고 나면 감동때문에 다른 영화를 볼수가 없을겁니다.  
8-16-2016,2016,8,16,21:52,화요일,10,4,0,변정현(wjdg****),내 인생 최고의 영화.... 아직까지도 여운이 가시지 않는다. 단 10분만 보고 컴퓨터를 끌수 밖에 없었던 상황이 너무 안타깝다  
8-16-2016,2016,8,16,02:19,화요일,10,4,0,준바리(jsl2****),이 영화를 이제서야 봤다니....  
8-14-2016,2016,8,14,16:54,일요일,10,4,0,아이디어(fred****),10점밖에 못줘서 죄송합니다...  
8-14-2016,2016,8,14,13:33,일요일,10,4,0,OO(mooc****),김두한과 구마적의 싸움보다 더 흥미진진한 격투씬이 들어있다.  
8-8-2016,2016,8,8,18:24,월요일,10,4,0,shar****,7번 보면 불치병도 낫는다는 신의작품입니다.  
8-6-2016,2016,8,6,20:19,토요일,10,4,0,임윤찬(whit****),암세포가 이영화를 보고 암에걸려 죽었습니다.  
8-6-2016,2016,8,6,00:10,토요일,10,4,0,경매투자(k_a1****),".,.,.,.,.,..,  "
8-5-2016,2016,8,5,16:04,금요일,10,4,0,귀찮은작명(shyu****),의외로 괜찮았는데 마치 이영화가 쓰레기인냥 비꼬시는 분들은 뭐죠?  
8-2-2016,2016,8,2,00:22,화요일,10,4,0,timi****,명불허전...감동임...  
8-1-2016,2016,8,1,21:59,월요일,10,4,0,삼수맨(nams****),와..내나이 서른넘도록 이런 명작영화는 손에 꼽을 정도네요 꼭보세요ㅠㅠ 아직도 감동의 물결이 가슴속 잔잔하게 남네요  
8-1-2016,2016,8,1,06:20,월요일,10,4,0,gkgu****,나는 이 영화를 보기전까지 대한민국 최고의 액션영화는 '아저씨'라고 생각했었다..평점이 높은 이유는 괜히 높은게 아니었다내가 살아있는 동안 우리나라에서 이 영화를 능가하는 작품은 보지 못 할꺼 같다  
7-31-2016,2016,7,31,15:59,일요일,10,4,0,써니(l123****),이것은 문화혁명이다.  
7-30-2016,2016,7,30,22:46,토요일,10,4,0,옆집아저씨(refr****),이 영화를 보고  치질이 나았습니다.  
7-30-2016,2016,7,30,16:25,토요일,10,4,0,ROUND2(roun****),내인생을 바꾼 영화 : 직장생활 10년차 이영화를 보고 회사를 떄려치우고 영화감독의 꿈을 꾸기 시작했다  
7-30-2016,2016,7,30,12:27,토요일,10,4,0,모카픽스(hetz****),최고의 영화! 추천합니다!  
7-30-2016,2016,7,30,11:31,토요일,10,4,0,델몬트(conr****),9.4까지 가고싶다. 도와줘  
7-30-2016,2016,7,30,05:10,토요일,10,4,0,다니엘(555b****),"클럽에서 김태희닮은여자꼬셔서  dvd방에 갔는데아무생각없이  이영화 고르고   방에들어가서 여자한테 작업치려는  그순간  ""아빠 일어나,, 그대사에  그여자 니킥  날리면서 꺼지라고 했 습니다  "
7-30-2016,2016,7,30,02:03,토요일,10,4,0,파이내플(manh****),더이상 점수를 못준다는게 아쉬울 뿐이다  이영화를  신께 바칩니다  
7-30-2016,2016,7,30,00:52,토요일,10,4,0,무림산중(gust****),무조건 봐라 진짜..너무감동적이다.형이 보다가 우는거 보고 안봤다.. 앞으로도 안볼거고  
7-30-2016,2016,7,30,00:41,토요일,10,4,0,항상네곁에(grey****),아니 별점 테러들때문에 9.5는 받을 영화인데 ㅠㅠ  
7-29-2016,2016,7,29,17:25,금요일,10,4,0,ktg8****,영화재밋다고해서 봣는데 재밋다  
7-28-2016,2016,7,28,00:42,목요일,10,4,0,무기경신(sieg****),어떻게 여기 오시게 됐죠?클레멘타인을 끝까지 봤습니다.---- 정신병원 인터뷰중 ----  
7-27-2016,2016,7,27,23:51,수요일,10,4,0,sd(shad****),너무재밌어요잘봤어요  
7-26-2016,2016,7,26,02:56,화요일,9,4,0,shon****,수능보기전 마음과 머리를 비우고 싶다면 저는 한치의 고민없이 이영화를 추천합니다.  
7-25-2016,2016,7,25,14:21,월요일,9,4,0,바나나라떼(hydf****),그냥저냥 볼만 하네요~ㅋ  
7-24-2016,2016,7,24,01:05,일요일,10,4,0,fdsa(rlat****),"장담하건대, 이 영화가 백 년 정에 개봉했다면 세계대전은 일어나지 않았을 겁니다.  "
7-23-2016,2016,7,23,02:17,토요일,10,4,0,kami****,아빠 아빠라는 외침에 저도 모르게 눈물이 흘렸습니다.  
7-21-2016,2016,7,21,21:20,목요일,10,4,0,cuj0****,친구가 추천해줘서 봤는데 저도 추천합니다!  
7-20-2016,2016,7,20,13:12,수요일,10,4,0,합흐(ex5r****),아름답다...아름다운 이야기를 아름답게 담은 아름다운 영화...  
7-19-2016,2016,7,19,16:51,화요일,10,4,0,점심밥(cona****),충격과 감동의 하모니...  
7-18-2016,2016,7,18,20:43,월요일,10,4,0,ㅇㅇ(cjs2****),시대를 잘못 타고난 비운의 명작. 지금 개봉했으면 박평식 최초의 10점을 볼 수 있었을텐데  
7-18-2016,2016,7,18,00:43,월요일,10,4,0,곰담(dpek****),내가 왜사는지 알게해주는영화  
7-15-2016,2016,7,15,23:21,금요일,10,4,0,찐쿤(wjsw****),인생이란 무엇인가. 사랑이란 무엇인가. 삶이란 무었인가에 대한 깊은 철학적 사유가 담겨져 있는 한국영화의 정수.  한국영화에서 다시 나오기 힘든 수작중 수작. 세계의 명작의 반열에 오를 영화  
7-14-2016,2016,7,14,00:00,목요일,10,4,0,자작나무(cori****),삶이 힘들때마다 반복해서 보고 있습니다. 내 인생의 바이블같은 클레멘타인..진심으로 고맙고 감사드립니다..  
7-13-2016,2016,7,13,15:21,수요일,10,4,0,강승대(tmde****),'일단 해라' 라는 말이 있듯이 일단 봐라.  
7-13-2016,2016,7,13,14:38,수요일,10,4,0,가밀(ksr7****),클레멘타인이 내 머리 속을 가득 채웠다  
7-12-2016,2016,7,12,18:05,화요일,10,4,0,종겅(gggg****),우리는 클레멘타인의 시대에 살고있다  
7-11-2016,2016,7,11,13:31,월요일,10,4,0,ads(will****),2016년에 다시 보는 클레멘타인...아직도 눈물이 마르질 않네요.  
7-10-2016,2016,7,10,10:44,일요일,10,4,0,한레인(batt****),이 영화를 보고 취업 성공했습니다 감사합니다ㅠㅠ  
7-9-2016,2016,7,9,10:10,토요일,10,4,0,토비0920(shka****),감동적인영화굳10자  
7-9-2016,2016,7,9,07:31,토요일,10,4,0,유터넷(uter****),이런감동적인 영화는처음이다  
7-8-2016,2016,7,8,10:42,금요일,10,4,0,우노(just****),.이 영화를 넘어설 명작은 몇세기가 지나도 나오지 않을 것이다!  
7-8-2016,2016,7,8,03:16,금요일,10,4,0,HasegawaJun(seak****),뜨거운 박수가 필요합니데이  
7-7-2016,2016,7,7,18:52,목요일,10,4,0,ILH(tmdw****),전체 평점 건수는 15000건이 넘으나 관람객 평점은 0건인 전설의 영화.  
7-7-2016,2016,7,7,07:56,목요일,10,4,0,Fps1(gnlg****),"한국 역사상 아니 인류역사상 가장 뛰어난 작품이 아닌가 생각이 듭니다 시공을 초월한 부성애와 마치 실화같은 연기력, 시나리오... 소름이 쫙 돋았습니다 아직도 이 떨림이 멈추지 않네요.. 이건 죽기전 꼭 봐야할 영화 top1위 안에 드는 영화입니다.  "
6-26-2016,2016,6,26,16:40,일요일,10,4,0,lollol(tjdc****),평점 높아서 한번 봤는데 지렸습니다.  
6-20-2016,2016,6,20,18:56,월요일,10,4,0,김영신(wmki****),너무 감동적이여서 친구에게 추천을해줬습니다 다른애들과 함께볼거라네요 정말이런 명작을 뒤늦게나마 보게되어서 참으로 영광으로생각합니다 감사합니다.  
6-4-2016,2016,6,4,01:24,토요일,10,4,0,Engineer(jwja****),20대에 이 영화를 볼 수 있어서 행복하다. ^^ 당장 집 앞 태권도 도장을 등록하고 이단 발차기를 배워야겠다.  
6-3-2016,2016,6,3,19:24,금요일,10,4,0,직박구리(zigp****),이 영화가 헐리웃에서 제작되었다면 헐리웃의 모든 기록은 뒤바뀌었을 것이다.  
6-3-2016,2016,6,3,11:36,금요일,10,4,0,PhantomMaster(abg2****),레알 재밌음 이건 대대손손 물려줘야 되는 명작임.. 나 혼자보기 아까움  
5-30-2016,2016,5,30,13:06,월요일,10,4,0,hgy0****,클레멘타인은 나에게 마치 첫사랑과 같은  존재이다.다시 보고 싶어도 첫사랑은 첫사랑으로 남아야 하기에 오늘도 다시보고 싶은 마음을 꾸욱 눌러본다.아직 첫사랑을 못해본 사람들이 부러울 뿐이다.  
5-29-2016,2016,5,29,13:47,일요일,10,4,0,기린(mike****),"이 영화를 다시는 보고 싶지 않습니다. 두번, 세번 같은 영화를 또 보게 되면 첫번째 느꼈던 그 위대한 경이로움과 감동이 줄어들기 때문에 처음 봤을 때 느낀 마음을 그대로 간직하고 싶습니다. 그러니 꼭, 아직 보시지 않았다면 꼭 한번 보시기를 바랍니다  "
5-26-2016,2016,5,26,09:17,목요일,10,4,0,CoolLife(daeh****),이 영화를 보고 만성비염이 완치되었습니다.  
5-26-2016,2016,5,26,08:52,목요일,10,4,0,코닉세그(ice1****),진심 인생영화!!!!  
5-25-2016,2016,5,25,11:24,수요일,9,4,0,dani****,유명한 영화라 넘 보고 싶어 정말 어렵사리 곰티비에서 봤습니다. 시간이 부족한 늦은 저녁 12시정도쯤이라 중간중간 스킵하면서 봤는데..10점 줄 정도는 아니더라구요. 스토리나 액션은 탄탄하네요. 다만 너무 슬픈 내용이라 1점 깍고 9점 줍니다.  
5-25-2016,2016,5,25,01:54,수요일,10,4,0,쿠레멘타인(garo****),이 영화 그래도 화끈한 베드씬 있어서 10점 줍니다 이동준이랑 여자애랑 침대에 같이 누워서 껴안거나 침대에 누워서 바지 지퍼열어주는 장면 나옴  
5-24-2016,2016,5,24,15:12,화요일,10,4,0,dogl****,우을증에 걸려 자살을 몇번 시도했으나 실패했습니다. 그러던 중 의사 선생님이 DVD 로 이 영화를 선물하시며 시청을 권유하셔서 보았으며 저는 새롭게 태어났습니다. 시대를 잘못 만나서 흥행에는 실패했지만 제 인생을 송두리째 바꾼 최고의 영화입니다.  
5-23-2016,2016,5,23,21:04,월요일,10,4,0,김태오(theo****),인생에 한번씩은 봐야할 명작  
5-23-2016,2016,5,23,03:27,월요일,10,4,0,냐햐(says****),여긴 알바생들이 있을필요가없네요 일단한번보고 평점남기시죠 그럼 왜 한국최고의 평점들이 나오는지  알수있어요  10분만보셔요  
5-22-2016,2016,5,22,09:15,일요일,10,4,0,Shira(7979****),영화 안본 뇌 삽니다너무 감동적이어서 그 감동을 다시 느끼고 싶습니다  
5-19-2016,2016,5,19,23:52,목요일,10,4,0,kgs9****,나아가 이것은 영화 산업의 한 보 전진이었던 것입니다.  
5-18-2016,2016,5,18,14:04,수요일,10,4,0,스댕(jsaj****),백수드라듣고 별점주러왓씁니닼ㅋㅋㅋ  
5-18-2016,2016,5,18,08:34,수요일,10,4,0,후회없는날(kom4****),전 이영화를 잘때 꼭 생각하고잡니다.다음날이면 일이 잘풀리거든요  
5-17-2016,2016,5,17,23:43,화요일,10,4,0,U산균(ingy****),신이 이 영화를 만든 뒤 그걸 자랑하기 위해서 이 우주를 창조했다.  
5-17-2016,2016,5,17,13:03,화요일,10,4,0,Haseghy(qkrt****),엄청나다 이것은 후회가없다  
5-17-2016,2016,5,17,01:41,화요일,10,4,0,youn****,내인생은 두가지로 나뉜다 클레멘타인을 보기 전과 후  
5-17-2016,2016,5,17,00:33,화요일,10,4,0,awnmps(p020****),이세끼들어떻게9점까지만들었냐ㅋㅋ  
5-15-2016,2016,5,15,14:15,일요일,10,4,0,rhan****,이것은 10점이 아니다. 100점을 주고싶은 내 맘이다.  
5-10-2016,2016,5,10,22:59,화요일,10,4,0,토요타자동차(chu0****),평점을 줄 수 있단것만으로 영광입니다.  
5-10-2016,2016,5,10,21:47,화요일,10,4,0,hyoy****,이 영화를 보고 딸을 끊었습니다.  
5-9-2016,2016,5,9,13:00,월요일,10,4,0,김승현(sam9****),One Clementine a day makes a doctor go away. -미국 속담-  
5-5-2016,2016,5,5,11:58,목요일,10,4,0,위로d(whal****),"2091년, 지구를 침략한 외계인 무리에 수세에 몰린 대항군 일동이 외쳤다. 클레멘타인, 그것만은 파괴하지 말아주시오... 유일무이한 인류의 자산입니다.  "
4-25-2016,2016,4,25,22:08,월요일,10,4,0,긍정규희(dk23****),마이크 타이슨이 이 영화를 보고 글러브를 벗었고마이클 젝슨이  죽기전날  홈시어터로 본 마지막영화였고스티븐잡스의 끈기는 영화가 끝난 후부터 시작됐으며비틀즈 멤버들 모두 유일한게 공감하고 동시소장한 영화였고 신이 인간을 만들때 이영화를 염두했다!  
4-25-2016,2016,4,25,17:32,월요일,10,4,0,빠따코코(4rgn****),최고입니다. 꼭 보세요.  
4-22-2016,2016,4,22,21:40,금요일,10,4,0,mrq1****,이동준 옹의 역작 ^^ 말이 필요없는 하드코어 액션  
4-22-2016,2016,4,22,17:42,금요일,10,4,0,블래슈(hero****),점수 그 이상의 의미를 준 영화. 가족의 따뜻함과 인생의 의미를 찾아준 휴머니즘의 극치중요한 일을 마친 뒤 치킨에 맥주와 함께 즐기면 더 좋은 영화.  
4-22-2016,2016,4,22,02:37,금요일,10,4,0,M3M(ansr****),태어나서 내가본영화중에 처음으로 눈물을 입에서 흘려본영화.. 이토록 감동적이었던영화는 처음이었다...  
4-21-2016,2016,4,21,14:37,목요일,10,4,0,0901****,난 이거 보고 진짜 펑펑 울었다.  
4-18-2016,2016,4,18,13:17,월요일,10,4,0,9회말2아웃(kiss****),이 영화를 보지 않은 사람들은 삶의 이유가 한가지는 남아있다!  
4-18-2016,2016,4,18,10:53,월요일,10,4,0,박성민(last****),믿지 않았어요...당신들의 말을...하지만 이제 알게되었어요 내 인생 최고의 영화라는것을  
4-18-2016,2016,4,18,09:15,월요일,10,4,0,lkm9****,"2편, 3편.. 언제까지라도 기다릴게요  "
4-18-2016,2016,4,18,06:33,월요일,10,4,0,멸향(nbk0****),최고의 감동이었다.. 내 장담하건데 예수는 클레멘타인 보기위해 재림할것이다  
4-16-2016,2016,4,16,11:29,토요일,10,4,0,미스터송(song****),높은 평점과 가치있는 댓글이 이 영화를 대변해 주네요...  
4-16-2016,2016,4,16,05:19,토요일,10,4,0,DogSeller(winn****),시대를 앞서간 역작 클레멘타인 2가 기달려 지네요  
4-10-2016,2016,4,10,23:52,일요일,10,4,0,9989****,가끔 인생이 지칠때가 있습니다...그럴때마다 귓가에 스쳐지나가는 아빠 일어나!와 머릿속에서 자동재생되는 클레멘타인이 절 일으켜주었습니다 클레멘타인은 단순히 명작영화가 아닌 제 정신적 지주이자 저의 신입니다  
4-4-2016,2016,4,4,20:37,월요일,10,4,0,냐옹(gimd****),평점순위 1위로 보내줄게  
4-3-2016,2016,4,3,09:08,일요일,10,4,0,치킨먹고싶어(soeu****),내나이 33 이영화를 10대에 봤었다면 나는 지금 다른 삶을 살고있었을텐데 ㅠ  
4-1-2016,2016,4,1,23:12,금요일,10,4,0,LC34변항무(qusg****),이 영화보고 10점을 안 줄 수가 없네요  
4-1-2016,2016,4,1,18:11,금요일,10,4,0,졸렬킹리온(maju****),"진짜 평점으로 장난치는줄 알았는데 속는 셈 치고 보다가 인생에서 제일 크게 감동받아 울은듯,,, 주위 친구들에게도 추천중  "
3-31-2016,2016,3,31,11:52,목요일,10,4,0,닭다리(dudg****),믿고보는 영화!!!@@@  
3-26-2016,2016,3,26,19:29,토요일,10,4,0,씨네(cine****),홍보로 얼룩진 다른 영화들과 다르게 이 영화의 평점과 리뷰에서는 진정성이 느껴진다~삶은 늘 이래야 하거늘...  
3-26-2016,2016,3,26,09:41,토요일,10,4,0,찌니찌니(chld****),말이필요없네요 10자  
3-25-2016,2016,3,25,21:44,금요일,10,4,0,산들애(cjst****),간만에 액션 영화가 생각났는데 다시보게 되네요^^  
3-20-2016,2016,3,20,16:44,일요일,10,4,0,Bordeaux330(hdo0****),명작중의 명작 한국영화 역사에 한 획을 그은 작품 극장에서 재개봉하면 보러갈것이다  
3-16-2016,2016,3,16,19:37,수요일,10,4,0,다일어나라(dash****),심한변비를 앓고있었습니다. 영화보다 화장실가는 시간이 아까워서 바지에 그만 ㅠㅠ  
3-14-2016,2016,3,14,19:11,월요일,10,4,0,바퀴벌레(xfig****),말로 표현이 불가능한 작품  
3-13-2016,2016,3,13,23:07,일요일,10,4,0,마리오(njs0****),이 영화를 보고 3일간 밥도 안먹고 자아 성찰을 가졌습니다. 클레멘타인 덕분에 인생을 낭비하지 않는 인간이 되었습니다.  
3-13-2016,2016,3,13,21:03,일요일,10,4,0,아헤가오더블피스(tkda****),내가 왜 이런 작품을 이제야 알게되었을까..  
3-13-2016,2016,3,13,14:49,일요일,10,4,0,2년만(ghkw****),모든 영화의 표본이 되는 영화  
3-12-2016,2016,3,12,19:35,토요일,10,4,0,beans(mid3****),많은 친구들에게 추천해주렵니다. 정말 감동스러운 명작이네요  
3-11-2016,2016,3,11,01:47,금요일,10,4,0,asur****,삶은 고독하고 내일은 아빠일어나  
3-7-2016,2016,3,7,14:37,월요일,10,4,0,rudh****,롤 승급전중에 보다가 승급전 때려치고 끝까지 본 영화  
3-5-2016,2016,3,5,20:06,토요일,10,4,0,김기정(kims****),핵꿀잼~~~~!!!!  
3-3-2016,2016,3,3,23:30,목요일,10,4,0,말(joyo****),이 영화 재미없다는 평점테러알바들 눈알뽑아서 기증하길바란다  
2-29-2016,2016,2,29,19:34,월요일,10,4,0,klmz****,이영화는 신이아닌이상 다시는밀들지못하는작품  
2-29-2016,2016,2,29,19:13,월요일,10,4,0,chus(kham****),감동 그 자체. 꼭 한번 보자.  
2-21-2016,2016,2,21,22:02,일요일,10,4,0,cort****,이 영화에 말이 필요한가요? 인생영화  
2-21-2016,2016,2,21,13:23,일요일,10,4,0,TeiG(oeo1****),말이 필요한가? 최고의 영화임  
2-21-2016,2016,2,21,12:48,일요일,10,4,0,must****,정말 대단한 영화입니다  
2-19-2016,2016,2,19,13:31,금요일,10,4,0,감또속(wlsd****),평가가 너무 좋기에 봤더니 역시 평가대로다 정말 후회없는 명작이다  
2-18-2016,2016,2,18,09:38,목요일,10,4,0,ipark2020(hl5j****),10점밖에 줄 수 없는 부들거리는 내 손이 원망스럽다.  
2-16-2016,2016,2,16,18:50,화요일,10,4,0,승승장구(sunn****),시간의 소중함을 깨닫게 한 영화  
2-15-2016,2016,2,15,22:49,월요일,10,4,0,bria****,스티븐 시거의 열혈팬으로서 이 작품은 단언컨데 시대의 명작임에 틀림없습니다. 저는 이 작품을 본뒤 7번방의 선물을 봐서 그런지 7번방을 볼때는 눈물이 한방울도 나지 않았습니다. 농담이 아니라 7번정도 다시본것같네요. 제발 꼭 한번 보시길 추천드립니다!  
2-15-2016,2016,2,15,03:05,월요일,10,4,0,remmikim(joey****),전 언제나 중요한 시험 전애는 꼭 이 영화를  챙겨봅나다.  
2-14-2016,2016,2,14,22:49,일요일,10,4,0,김건우(k2wh****),한국영화는 클레멘타인 전과후로 나뉜다  
2-14-2016,2016,2,14,21:28,일요일,10,4,0,xen(akai****),이 영화는 한국 영화계의 전설이다... 왜? 전설일까?   직접 보시고 그 해답을 찾아보시길...  
12-31-2015,2015,12,31,20:14,목요일,10,4,0,위즐(lord****),보지 않아도 알 수 있는 영화다.  
12-31-2015,2015,12,31,15:15,목요일,9,4,0,빈집(been****),암이 걸리셨던 분들도 피라미드에 가입하신분들도 이걸 보고 바로 집으로 돌아갈수 있었다고 합니다.  
12-29-2015,2015,12,29,18:23,화요일,10,4,0,지민사랑(kfc1****),한국  최고의영화  할리웃작품인 쇼생크탈출을뛰어넘는 대작 한국영화 한국의영화는 클레멘타인후와 전으로 나뉜다 연기 스토리 개연성 이 다 좋은작품 입니다  인간이만든작품이아닙니다 너무 대단합니다 김두영감독 거장입니다  
12-27-2015,2015,12,27,10:16,일요일,10,4,0,랜스(sisa****),제인생은 BC와 AC로 나뉘어졌습니다. BeforeClementine과 After Clementine으로요.  
12-26-2015,2015,12,26,19:10,토요일,10,4,0,박쇼(tpgh****),크리스마스 같은 연휴에는 이런 감동을 주는 영화를 상영하여 사람들의 마음에 따뜻함을 심어주어야한다 생각합니다  
12-26-2015,2015,12,26,10:52,토요일,10,4,0,차수환(ange****),"아... 이것은 한국영화계의 유일한 한 줄기 빛이요,위대한 승리로다 한번 보지말고 두번 봐라 두번 보지말고 세번봐봐라.느껴지는 감동의 깊이가  서서히 커질 것이다.  "
12-26-2015,2015,12,26,03:38,토요일,10,4,0,장통(cezz****),예쁜 아이 갖게 해주세요  
12-25-2015,2015,12,25,22:02,금요일,10,4,0,천년이라도사랑하다(done****),이 영화를 아직 보지 않았다는 당신이 불행하다는 증거다.  
12-24-2015,2015,12,24,22:02,목요일,10,4,0,Lokir(ohay****),오늘은 크리스마스 이브이다. 그리고 난 내일 온가족과 함께 이 영화를 볼것이다.  
12-24-2015,2015,12,24,17:22,목요일,10,4,0,enij****,네티즌들의 평점을 본 후 기대감을 가지며 경건한 마음으로 이영화를 보았다. 10분부터 엔딩의 그순간 까지 흥분을 숨기기 위해 많은 노력을 하였다. 이런 좋은 영화를 추천 해 주신 대한민국 영화 매니아 여러분 감사합니다...  
12-23-2015,2015,12,23,12:22,수요일,10,4,0,동도나(munz****),성공은 1퍼센트의 노력과 99퍼센트의 클레멘타인으로 이루어진다.  
12-22-2015,2015,12,22,16:58,화요일,10,4,0,콩은까야제맛이제(99wo****),아아아.... 신은 우리에게 이런 영화를 주셨다...  
12-18-2015,2015,12,18,12:04,금요일,10,4,0,tjdg****,세상에 이런 명작이 있다니...  
11-30-2015,2015,11,30,16:03,월요일,10,4,0,러브미(rmut****),난 긴 말 안한다. 보면 안다.  
11-28-2015,2015,11,28,21:37,토요일,10,4,0,하하하헤헤헤(cona****),머리로 생각할 필요가없다 머리보다 손이 먼저10점을 눌렀다  
11-26-2015,2015,11,26,00:32,목요일,10,4,0,윤정(real****),정말..눈물없이 볼 수 없는 대작.  
11-25-2015,2015,11,25,14:19,수요일,10,4,0,정세조(jgeo****),E234DFGFRGF43  
11-25-2015,2015,11,25,00:12,수요일,10,4,0,최하연(gkdu****),"선별점후감상 무척..,,, 기대가 된다..!!!!,,,  "
11-24-2015,2015,11,24,17:41,화요일,10,4,0,aulc****,"삼포시대에 살고 있는 우리들에게  삶의희망을 알려준 거장 김두영감독의 메세지(아빠 일어나)와 배우들의 혼이 담긴 연기  이것이  정녕영화란말인가...  ""나에게 오늘이 마지막이라면 사과나무를 심겠다는 말보다 클레멘타인을 다시 보겠다는 말을 할것이다.  "
11-24-2015,2015,11,24,08:43,화요일,10,4,0,SUE(seol****),암세포도 암에 걸려 치유 됩니다.  
11-17-2015,2015,11,17,17:28,화요일,10,4,0,davi****,DVD 원판 가지신분....제가 3천만원에 사겠습니다. 아빠 일어나!! 할때  오줌쌌습니다. 신이 내려주신 영화  
11-12-2015,2015,11,12,13:25,목요일,10,4,0,puc1****,이영화를 보고 팔이 6개가 되었습니다.  
10-28-2015,2015,10,28,20:42,수요일,10,4,0,노력중(vkst****),"세계의 모든 영화는 클레멘타인 이전과, 이후로 나뉜다. 클레멘타인은 관객에게 익숙한 70~80년대의 정통적인 스토리라인을 충실히 따르면서도 색다른 하나의 패러다임을 그었다. 놀랍고도 단조롭고 예상이 가능하지만 보는 이의 인생 자체를 바꾸어 버린다.  "
10-27-2015,2015,10,27,22:28,화요일,10,4,0,나나리찌(lee2****),이영화의 평점이 그강을 건너지 마오 보다 낮다는것이 의아할뿐이다 .애들이 청년이 되면 꼭 보아야할 영화. 10년주기로 재상영 되어야한다  
10-27-2015,2015,10,27,19:48,화요일,10,4,0,네임벨(dxd0****),이영화를 보고 시각장애였던 제가 시력이 2.0이 되었습니다.  
10-27-2015,2015,10,27,02:11,화요일,10,4,0,kmougbba(kmou****),평점아 일어나! 재개봉 강력히 희망합니다  
10-23-2015,2015,10,23,21:54,금요일,10,4,0,샘(sgtc****),10점 만점에 10점이 아깝지 않은 영화!  
10-23-2015,2015,10,23,18:07,금요일,10,4,0,에이스(kyh2****),전율이 돋는다. 10자  
10-20-2015,2015,10,20,16:14,화요일,10,4,0,심바(snig****),가족과 함께 이영화를 보고 가족애를 키우시길  
10-19-2015,2015,10,19,17:18,월요일,10,4,0,토비(dls9****),내 인생 최고의 영화. 가히 인생영화이다.  
10-13-2015,2015,10,13,19:21,화요일,10,4,0,검도맨(huh0****),이영화보고 와이프와 눈물을 흘리면 기립박수를 쳤습니다 따뜻한 감동을 느끼는 영화 였습니다평생 소장용으로 결재 했네요  
10-12-2015,2015,10,12,04:03,월요일,10,4,0,kdoy****,올해 첨으로 10점 줘보네요...^^  
10-8-2015,2015,10,8,19:12,목요일,10,4,0,고동균(rhtj****),이것을 평가하는 것 자체가 신성 모독이다.  
10-2-2015,2015,10,2,10:36,금요일,10,4,0,이쁜 공주(ksh6****),욕나올정도로재밌습니다  
9-5-2015,2015,9,5,19:54,토요일,10,4,0,tubt****,스티븐시걸...10자  
9-5-2015,2015,9,5,12:58,토요일,10,4,0,와피(scot****),한국 영화계의 한획을 그은 명작  
9-2-2015,2015,9,2,18:38,수요일,10,4,0,윤발형님(sst1****),내가 왜 이걸 이제봤을까..  
9-2-2015,2015,9,2,17:36,수요일,10,4,0,늦마(naye****),역작 중의 역작이다..  
9-1-2015,2015,9,1,15:38,화요일,10,4,0,파란볼펜(enej****),이 영화가 개봉한 날을 기념일로 삼아야 마땅하다고 생각한다.  
8-30-2015,2015,8,30,18:03,일요일,10,4,0,신쨩(mirz****),"클레멘타인을 보지 않은 자, 영화를 논하지 말라  "
8-30-2015,2015,8,30,09:42,일요일,10,4,0,신기(sooc****),이영화를 아직 안봤다면 당신은 아직 세상을 살 이유가 남아있습니다.  
8-27-2015,2015,8,27,12:11,목요일,10,4,0,kyg0****,신은 클레멘타인이 이 세상에 나올수 있다는걸 자랑하기 위해 이 세상을 만드셨다.  
8-18-2015,2015,8,18,11:13,화요일,10,4,0,ghks****,소화가 잘안되던 저입니다이 영화를보고 자갈밥에 무쇠반찬을 먹고있어요  
7-25-2015,2015,7,25,22:35,토요일,10,4,0,옹잉옹잉(ky96****),이영화를 보고 살고싶어졌어요  
7-22-2015,2015,7,22,22:29,수요일,10,4,0,뻑쇠(thez****),난 이 영화를 보기전 비루한 삶에 찌든 일개 시민에 불과했다. 하지만 영화를 본 후 내 남은 삶은 클레멘타인 재개봉과 그 후속작이 나오는데에 바치기로 결심했다. 나를 갱생하게끔 만든 걸작중의 걸작. 내 인생영화 레옹과 감히 비교할 가치도없다.  
7-22-2015,2015,7,22,11:37,수요일,10,4,0,trin****,"쵝오,눈물바다나서 집에 물퍼내느라 힘둘었어요  "
7-22-2015,2015,7,22,00:39,수요일,10,4,0,한종훈(hang****),이 영화를 보고 지옥에서 예토전생을 하였습니다.  
7-21-2015,2015,7,21,23:50,화요일,10,4,0,비둘기(qgaz****),이영화를  보고 인생이 행복해졋습니다  
7-16-2015,2015,7,16,13:52,목요일,10,4,0,핫망고(lhh1****),지금 평점을 보고 이 영화를 보았습니다.강한 교훈과 가르침을 얻었습니다.앞으로의 삶에서 이 가르침과 교훈이 밑거름으로 쓰일것입니다.지금도 멈추지 않는 심장의 열기. 이 영화는 한국인의 보물입니다.  
6-30-2015,2015,6,30,21:42,화요일,10,4,0,내이름뭘까(ksw9****),이영화보자마자 울면서 글올립니다...이영화를 이제 알게 된 저에게 부끄럽습니다.오랜만에 제 눈물샘을 터트려주신 영화감독님에게 감사드립니다.결말을 보고 안우신분은 과연 그게 인간일까요...?  
6-13-2015,2015,6,13,00:13,토요일,10,4,0,오준호(tomm****),클레멘타인.. 다락방 낡은 책상서랍속에서 발견한 어린시절의 보물같은 영화..  
6-12-2015,2015,6,12,20:10,금요일,10,4,0,헝그리샤크(smh8****),눈물 없이는 볼 수 없는 영화  
6-11-2015,2015,6,11,17:02,목요일,10,4,0,alsr****,우울할때마다 삶의 활력소가 됩니다. 발가락끝에서부터의 찌릿찌릿함을 느끼시고 싶다면 추천  
6-8-2015,2015,6,8,07:57,월요일,10,4,0,하하호호(akas****),재 개봉을 강력히 촉구 합니다!!  
6-6-2015,2015,6,6,15:25,토요일,10,4,0,catd****,영화를 볼 때 주인공의 동선이 아닌 주변에 시선을 두세요. 이 영화는 미제국주의에 대항하는 민족의 혼이 담겨 있습니다.  
6-5-2015,2015,6,5,02:15,금요일,10,4,0,MiHo(para****),이런건 꼭 죽기전에 봐야한다 진짜..  
5-28-2015,2015,5,28,14:50,목요일,10,4,0,효우(itsh****),"유네스코 기록유산으로 지정하여야 하는 영화입니다. 훈민정음 혜례본, 조선왕조실록에 버금가는 기록유산입니다.  "
5-16-2015,2015,5,16,19:08,토요일,10,4,0,Rhythmer(gudr****),이 영화는 앞으로도 나오지 않을 최고의 명작이다.  
5-16-2015,2015,5,16,14:01,토요일,10,4,0,쌍동(oper****),잊혀질번한 명작 클레멘타인 네이버웹툰과 함께 살아나다  
5-7-2015,2015,5,7,22:07,목요일,10,4,0,xxoxxoxxo(rmad****),클레멘타린2 나온다는 소문이 있던데 제발 연기못하는 아이돌쓰지마세요 감독님!!진짜 신중하게 결정해주세요이런 명작을 감히....더럽힐수는없습니다  
4-27-2015,2015,4,27,20:38,월요일,10,4,0,hello(lshk****),"클레멘타인,스티븐 시걸,성공적  "
2-24-2015,2015,2,24,02:10,화요일,10,4,0,l인생예찬l(dbsq****),무슨 말이 더 필요한가?!  
2-22-2015,2015,2,22,00:33,일요일,10,4,0,meta****,우리나라 영화이기에 아카데미를 놓친 수작  
2-21-2015,2015,2,21,19:58,토요일,10,4,0,boss****,다시봐도 최고의 영화였다  
2-14-2015,2015,2,14,22:26,토요일,10,4,0,ㅈㄶㅇㅈ교(cust****),2014년 인터스텔라와 겨울왕국의 모티브는 바로 이 영화이다!!  
2-14-2015,2015,2,14,19:00,토요일,10,4,0,정그리(jb_b****),클레멘타인...제가 고1때 본 영화가 수능날에 생각나서 제 발목을 잡네요. 후회는 없습니다.  
2-10-2015,2015,2,10,16:03,화요일,10,4,0,ㅇ(rhru****),좀만더 노력하면 네이버 역대 최고평점 찍겟다  
2-8-2015,2015,2,8,17:37,일요일,10,4,0,술이조아(nrgn****),이 영화를 여친 부모님께 추천해드리고 결혼 승낙을 받았습니다.  
2-8-2015,2015,2,8,15:13,일요일,10,4,0,qkrg****,눈물이 차올라서 고갤들어  
2-2-2015,2015,2,2,00:11,월요일,10,4,0,jika****,보고싶네.은근히..  
2-1-2015,2015,2,1,21:42,일요일,10,4,0,augu****,눈물난다 이게 영화가 아닌가싶다  
1-28-2015,2015,1,28,20:03,수요일,10,4,0,kkst****,나이 40에 태권도를 시작했습니다  
1-24-2015,2015,1,24,00:27,토요일,10,4,0,Trace(spir****),별의 갯수로 감히 평가할 수 없는 영화  
1-23-2015,2015,1,23,20:00,금요일,10,4,0,프링보노(yimc****),죽기전에 다시 보려고 버킷리스트에 넣어놨습니다  
1-22-2015,2015,1,22,12:09,목요일,10,4,0,노정민(anwa****),아....아...아..  
1-22-2015,2015,1,22,05:29,목요일,10,4,0,ㅇㅇ(sunn****),아빠일어나!!!!.  
1-22-2015,2015,1,22,00:04,목요일,10,4,0,박우진(akdl****),화려한 출연진과 탄탄한 스토리!  더할 나위 없는  최고의 영화  
1-21-2015,2015,1,21,20:39,수요일,10,4,0,박찬영(seng****),11년전의 저는 불확실한 미래가 두려워 자살을 결심하고 있었습니다.그러나 이 한편의 영화가 인생에 대한 제 눈을 뜨게만들어줫고 지금의 제가 이렇게 평점을 남기게 됬습니다.지금도 하루에 한번씩 아침에 눈을 뜰때마다 이 영화에 대해 감사하게 생각합니다.  
1-21-2015,2015,1,21,00:28,수요일,10,4,0,djw1****,인류가만든 영화중에 가장 위대하고 슬픈영화였다  
1-12-2015,2015,1,12,16:50,월요일,10,4,0,유지빈(yjb1****),명작입니다. 더이상의 수식어는 생략 하겠습니다.  
1-11-2015,2015,1,11,02:57,일요일,10,4,0,유틱톡(eldo****),수능 보기 전 희망을 얻고갑니다  
1-10-2015,2015,1,10,23:23,토요일,10,4,0,aim(dhdu****),이런 영화를 볼수있어서 행복했다.  
1-10-2015,2015,1,10,19:29,토요일,10,4,0,스티브준(ihj3****),이 영화를 보고 암이 나았습니다.  
1-8-2015,2015,1,8,17:40,목요일,10,4,0,DRJ(jdhd****),이영화를 보지 않고 살아왔던 내 30년 인생... 미치도록 허무하고 안타까워 눈물이 나네요  
1-7-2015,2015,1,7,19:11,수요일,10,4,0,새로운나(heoi****),오늘 중국에서 클레멘타인을 봤다.나도 울고 중국도 울었다  
8-3-2014,2014,8,3,17:30,일요일,10,4,0,개동v(ldh7****),10점이 아까운 작품..난 왜 지금에서야 보게된걸까...  
7-23-2014,2014,7,23,12:12,수요일,9,4,0,빈대떡(tjtj****),영화를보고나서 충격에 말을잃었네요... 이영화가2004년 영화라는 사실에또놀라게됩니다. 지금개봉하는영화보다도 세련된연출.. 영화장면하나하나가 놀랍도록 치밀합니다. 다만 한가지흠은 결말에서의 아쉬움.왜그렇게 평론가들이 극찬을하는지.. 보시면 압니다^^  
7-17-2014,2014,7,17,13:04,목요일,10,4,0,케인리(kane****),난 이영화를 건너뛰기 하지않고 정주행으로 본 사람입니다  이제 제가 무엇이든 못할 일이 어디 있겠믑니까  
7-17-2014,2014,7,17,12:55,목요일,10,4,0,감성남(wpfa****),"너무 몰입했던 탓일까? ""아빠 일어나"" 명대사를 들은 이후 난 주체할 수 없는 감동의 소용돌이에 빠져 영화가 끝난 후에도  한동안 자리에서 일어날 수 없었다. 지쳐 쓰러질 때면 그 대사가 환청처럼 귓가에 맴돈다.  "
6-3-2014,2014,6,3,16:10,화요일,10,4,0,whhh****,내인생의 히어로..다시없는 감동..  
6-1-2014,2014,6,1,23:39,일요일,10,4,0,활명수(ehdk****),아는 형님에게 추천을 받았고 그날부터 내 인생은 바꿨다. 클레멘타인. 그 이름을 불러본다.  
5-4-2014,2014,5,4,00:03,일요일,10,4,0,snip****,이 영화를 만나고 나 자신을 돌아보았다..난 쓰래기였어!!!  나의 내면에 절제된 가족애와 부성애를 이 한편의 영화로 끄집어 낼수있었다...고맙고또고맙다거장 이동준감독!!  
2-27-2014,2014,2,27,00:21,목요일,10,4,0,두물다리(badu****),"""클레멘타인을 모티브로 다크나이트 3부작을 연출할 수 있었습니다. 이동준의 연기에서 브루스 웨인을, 스티븐 시걸의 시크한 표정에서 조커를 떠올렸습니다. 이 영화가 없었다면 다크나이트는 존재하지 않았습니다."" - 크리스토퍼 놀란(다크나이트 3부작 감독)  "
2-26-2014,2014,2,26,12:47,수요일,10,4,0,김현무대노중(dhkw****),문화재로 지정해야 한다  
5-14-2019,2019,5,14,23:17,화요일,10,5,1,낭낭(muni****),죽기전에봐야할영화에 한국영화가있네? 하고 보니 제목이 클레멘타인이네요 역시 레전드는 다르네요  
3-28-2019,2019,3,28,07:26,목요일,10,5,1,wow음(wodu****),꼭 봐야하는 인생영화...22년 영화장인이 추천합니다  
3-27-2019,2019,3,27,23:04,수요일,10,5,1,늑대(junl****),아직도 전율이 사그라들질않네요~  
3-26-2019,2019,3,26,14:00,화요일,10,5,1,지렁이(ohho****),타이타닉을 능가하는 인생영화라 가히 말씀드리고 싶습니다.  
3-25-2019,2019,3,25,23:29,월요일,10,5,1,현태(tjst****),포스터만 봤는데 눈물이 난다  
3-20-2019,2019,3,20,05:58,수요일,10,5,1,튜닝샵(f245****),평생 소장하고싶은영화. DVD 소유하신분 저한테 파세요.  
3-20-2019,2019,3,20,01:06,수요일,10,5,1,매콤한맛(over****),하느님은 클레멘타인을 안본 사람들을 위해서 살아 돌아올 수 있는 왕복승차권을 발행하지 않으셨습니다!!  
3-17-2019,2019,3,17,22:45,일요일,10,5,1,Maar(rhk5****),일주일에 한번씩 이 영화를 보며 소원을 빌었더니 여자친구가 생겼습니다. 감사합니다. 아빠 일어나!  
3-14-2019,2019,3,14,22:32,목요일,10,5,1,잎사시(tjdw****),솔직히 기대 안 했는데... 기대 이상이었습니다. 클레멘타인을 볼 수 있는 시대에 태어난 게 감사가 됩니다. 추천합니다.  
3-14-2019,2019,3,14,05:22,목요일,10,5,1,음악들려주는남자(nade****),아빠 일어나! 는 평생 뇌리에서 떠나지 않게되었다.수능 볼때 오직 이 환청밖에 안들림.  
3-10-2019,2019,3,10,08:47,일요일,10,5,1,salgu(salg****),사는게 힘들어 기도를 드렸더니 하느님이 클레멘타인을 보아라 하셨습니다. 이건 영화가 아닙니다. 주님의 은총입니다.  
2-21-2019,2019,2,21,03:57,목요일,10,5,1,kdud****,이 영화를 보고 공부자극을 느꼈습니다  
2-21-2019,2019,2,21,02:52,목요일,10,5,1,신수빈(5myt****),남자는 총 3번 우는데 태어날때 울고 부모님 돌아가셨을때 울고 이 영화를 보고 운다고한다  
2-20-2019,2019,2,20,16:03,수요일,10,5,1,ㅇㅇ(king****),이 암을 보고 영화를 나았습니다  
2-19-2019,2019,2,19,20:58,화요일,10,5,1,석이(wang****),이영화를 보지 않고서는 영화를 논하지말라.  
2-11-2019,2019,2,11,17:40,월요일,10,5,1,대마왕(hide****),삶의 희망..그것은 바로 여기서  시작 된다.  희망..별거 아니다. 이영화를 보면 희망은 바로 당신 앞에 와 있다.  
2-8-2019,2019,2,8,00:56,금요일,10,5,1,담담(ydda****),누가 예술은 등수를 매길 수 없다 하였는가... 난 주저없이 1등을 주겠다!  
2-6-2019,2019,2,6,21:14,수요일,10,5,1,안 사요(bio_****),영화 안 봤습니다. 평점 읽고 일단 10점 줍니다.  
1-25-2019,2019,1,25,13:21,금요일,10,5,1,박준하(junh****),누군가 영화계의 미래를 묻거든 고개를 들어 클레멘타인을 보게 하라  
12-10-2018,2018,12,10,12:59,월요일,10,5,1,이미자(sins****),와 수업시간에 보다가 너무 감동먹어서.담임한테 폰뺏겼습니다. 진자 이건 가족들과 거실에서 앉아서 볼 오락영화입니다.  
11-30-2018,2018,11,30,16:11,금요일,10,5,1,짜장(cjy2****),다시는 볼수없을 역작!!!  
11-29-2018,2018,11,29,18:38,목요일,10,5,1,동건(dnfl****),대한민국의 최고의 명작 보고 눈물이 10L정도 흘린것 같네요.  
11-28-2018,2018,11,28,10:33,수요일,10,5,1,켄터(cdke****),죽을때까지 기억에 남을 명작  
11-9-2018,2018,11,9,15:28,금요일,10,5,1,gomm(chem****),평점보고 이거뭐지?? 했었는데...보고나니 이럴수가??  했다  
11-8-2018,2018,11,8,22:59,목요일,10,5,1,cggo****,미친영화... 한  영화로 mcu를 뛰어넘고 그에따른 기막힌 감동...5번 봤는데 다울음  
11-8-2018,2018,11,8,16:07,목요일,10,5,1,boook(aksg****),음~~~!~~!~~ 쌌다.  
10-19-2018,2018,10,19,11:10,금요일,10,5,1,yasi****,와 기대이상의 반전이 숨어있네요 이런거 좋아요^^ 안보신분 적극추천드립니다.  
10-16-2018,2018,10,16,10:53,화요일,10,5,1,강소어(soea****),영웅: 샐러멘더의 비밀에 비견 되는 영화라고 들어서 왔습니다  
10-14-2018,2018,10,14,23:58,일요일,10,5,1,미카엘(yij1****),눈물없이는 볼수없는 영화  
10-14-2018,2018,10,14,21:37,일요일,10,5,1,이종주(whdw****),시대를 넘나드는 명작중에 명작중에 명작중에 명작이다  
9-4-2018,2018,9,4,20:46,화요일,10,5,1,신진(sssc****),말이 필요없는 명작이다.  
8-27-2018,2018,8,27,18:25,월요일,10,5,1,8강탈락 이병 느그흥(smgo****),감히 이 레전드를 내가 평가할수 있을까....  
8-13-2018,2018,8,13,15:04,월요일,10,5,1,CrucialZint(kkg4****),더운 여름 카페에서 이 영화의 감동을 다시 느끼고 싶어서 영화평을 보았습니다. 영화평만 보았는데도 그날의 감동이 올라와서 엉엉 울었습니다. 삶이 힘들때마다 보겠습니다  
7-21-2018,2018,7,21,13:53,토요일,10,5,1,Tade(kore****),최고의 영화. 앞으로 나오지 않아야함  
6-18-2018,2018,6,18,11:21,월요일,10,5,1,그곳의 끝은(oyj5****),이 영화는 국민을 울고 웃기고 욕하게 만든 영화다 강추^^  
5-22-2018,2018,5,22,15:10,화요일,10,5,1,닭저씨(qjat****),대한민국 역사상 다시는 없을영화..!  
4-14-2018,2018,4,14,14:14,토요일,10,5,1,IRIS(ehdr****),이 영화는 '진짜'다.  
3-26-2018,2018,3,26,19:08,월요일,10,5,1,chog****,15년째 찾아 보는 인생 영화  교과서에 실려야 함 청와대 국민청원 가즈아  
3-9-2018,2018,3,9,15:00,금요일,10,5,1,hsch****,아 감동으로 인해 눈물이 멈추지 않네요  ㅠㅠ  
2-19-2018,2018,2,19,17:25,월요일,10,5,1,환타(luxt****),누가 감히 이 영화에 점수를 메기는가  
2-16-2018,2018,2,16,19:37,금요일,10,5,1,airw****,사랑하는 사람과 같이 보세요. 사랑하는 사람만 보게 됩니다.  
2-15-2018,2018,2,15,00:49,목요일,10,5,1,김용준(kyj0****),나는 오늘도 클레멘타인을 보고 눈물을 흘린다. 사람들은 참 이기적이다...자신들만 보려고 1점 주는 분들 반성하세요. 제 인생영화입니다. 제 롤모델은 이동준이고 제 영어 이름도 클레멘타인입니다. 사랑합니다  그리고 이 명작을 만들어주셔서 감사합니다..  
2-11-2018,2018,2,11,00:02,일요일,10,5,1,aass****,한국영화계가 2004년을 되돌아보는 가장 큰이유  
2-9-2018,2018,2,9,16:44,금요일,10,5,1,뜨뜨뜨뜨(davi****),감히 평론가같은 나부랭이는  평가할수없는 인류 최고의영화  
2-7-2018,2018,2,7,20:33,수요일,10,5,1,kidj****,아직도 안 본 사람이 있다면 말해주고 싶다 미친편집과 충격적인 스토리라인 오장육부에서 뜨겁게 솓구치는 진정한 감정을 느낄수 있다. 리얼이주는 공허함을 클레만타인이 치유해줬다  
2-5-2018,2018,2,5,03:27,월요일,10,5,1,박희재(heez****),"""일어나~"" 라는 대사에서 내것이 발딱 일어났다.얼마만에 일어났는지 감격했다ㅠㅠ내게 풀발기를 일깨워준 영화...꼭봐라. 일어난다!!  "
2-1-2018,2018,2,1,17:11,목요일,10,5,1,김종현(jjon****),'아빠 일어나'에서 여자친구랑 키스했습니다. 감독님 감사합니다  
11-29-2017,2017,11,29,00:13,수요일,10,5,1,어제오늘내일(toch****),이제서야 이 영화를 알았다니.. 정말 재밌는건 꼭 숨겨둔다더니 그꼴.. 내가 사는 시대에 이런 위대한 영화가 탄생한 것은 신이 주신 축복  
11-11-2017,2017,11,11,12:31,토요일,10,5,1,상하이노비(gnsr****),이영화를안보고 영화를평하지마라!!  
11-10-2017,2017,11,10,12:13,금요일,10,5,1,LiveDK(iris****),이 영화를 보고 로또가 당첨되었습니다.  
10-30-2017,2017,10,30,00:06,월요일,10,5,1,던힐(pase****),너무 주연들의 연기만을 칭찬하지 마라극 속에 녹아있는 명품조연들이 있기에 몰입도가 높고 스토리가 탄탄한 것이다.  
10-27-2017,2017,10,27,17:04,금요일,10,5,1,마이콜작슨(niki****),내 인생 최고의 영화. 잊을 수 없다.  
10-6-2017,2017,10,6,22:13,금요일,10,5,1,강승훈(shka****),자는사람도 깨우고 죽은사람도 살리는 희대의 명작!!  
8-27-2017,2017,8,27,22:58,일요일,10,5,1,ONLY ONE(monm****),극장에서 남편과 봤던영화. 와..대박!! 아직도 못보신분들이 있다면 강추해요^^  
8-27-2017,2017,8,27,21:09,일요일,10,5,1,메룽(nacl****),정말 대한민국 국가대표 영홰  
8-1-2017,2017,8,1,01:51,화요일,10,5,1,MJLEE(pure****),김수현의 리얼이 나오기 전까지 한국 영화 역사상 최고의 영화. 이제 리얼에게 그 자리를 넘겨줬지만..  
7-31-2017,2017,7,31,14:25,월요일,10,5,1,호롤롤로(rlaa****),"김치워리어, 다세포소녀, 리얼, 긴급조치 19호, 반지닦이, 고무닦이, 정의닦이를 먼저 보고 오시면 이 우주띵작 클레멘타인을 더욱 재밌게 보실 수 있습니다.  "
7-29-2017,2017,7,29,23:59,토요일,10,5,1,노영윤(rrr1****),"세계 3대 영화감독 1.스티븐 스필버그: 드림웍스의 공동 창업자이며 타임지""20세기의 가장 유명한 인물 100인""에 이름을 올린 명감독 2.제임스 카메론: 터미네이터, 타이타닉, 아바타 등으로 할리우드를 이끈 명감독 3.김두영: 클레멘타인의 감독  "
7-20-2017,2017,7,20,02:00,목요일,10,5,1,rnfl****,발가락에 티눈이 이 영화를보고 눈물을흘리며 뛰쳐나갔습니다  티눈인들은 이영화를꼭보세요!  
7-18-2017,2017,7,18,14:08,화요일,10,5,1,오리지(kjy1****),이 영화를 보고 차라리 영화가 없던 조선시대에서 살고 싶다는 생각이 들었다.. 이 영화를 못보고 돌아가신 조상님들이 부럽다..내 인생 유일한 오점이 클레멘타인을 본2시간이다. 카메라가 이런 영화 찍으라고 만들어진게 아닐텐데..  
7-2-2017,2017,7,2,15:55,일요일,10,5,1,seleny(kooh****),포스터만 보고 십점 줍니다  
7-1-2017,2017,7,1,22:25,토요일,10,5,1,꼬꾸마(whdl****),나이를 먹고나서 또 보게 되었어요 역시...전 나이를 먹어 변했지만 명작이라는 사실은 변치 않네요...캬..  
6-30-2017,2017,6,30,01:12,금요일,10,5,1,그녕(whdk****),아 사람들 존나웃겨 ㅋㅋㅋ드립 치는것들봐 진짴ㅋ  
6-29-2017,2017,6,29,22:27,목요일,10,5,1,즘점(asto****),성지순례중. 나무아비타불 관세음보살  
6-29-2017,2017,6,29,16:11,목요일,10,5,1,빅보스(navy****),말이 필요없는 영화라서 벙어리가 되었다.  
6-29-2017,2017,6,29,13:58,목요일,10,5,1,21gram(myna****),이사랑감독님 차기작으로 클레멘타인 더 리로리드 꼭 만들어주세요!  
6-28-2017,2017,6,28,11:56,수요일,10,5,1,힐끗(drag****),이 영화 보고 탈수증상 왔습니다. 온몸의 수분을 다 빼내는 감동대작  
6-27-2017,2017,6,27,17:32,화요일,10,5,1,qkdn****,아빠 일어나에 누워계시던 아버지가 일어나셨습니다  
6-27-2017,2017,6,27,12:38,화요일,10,5,1,aheartofgold(gora****),와... 대박이네요.보고오랜만에움  
6-27-2017,2017,6,27,11:56,화요일,10,5,1,느껴봐(mhj3****),영화를 옆으로 누워서 보는 나는 이영화를 보고 와상불이 되었다. 그리고 척추측만증으로 오른쪽 골반이 방광을 눌러 20분 마다 소변을 봐야 하는 몸이 되었지만 후회하지 않는다.  
6-26-2017,2017,6,26,22:40,월요일,10,5,1,w1113(sky1****),1점평들은 다 낚시에요 이 영화는 정말 최고입니다  
6-26-2017,2017,6,26,17:22,월요일,10,5,1,도도(chea****),다시봐도 눈물만 나오는 군요...  
6-21-2017,2017,6,21,00:54,수요일,10,5,1,행복하십니까(sso0****),이 영화는 암세포도 암에걸려  암을 낫게하는 영화다. 최고의 힐링 걸작  
6-18-2017,2017,6,18,03:22,일요일,10,5,1,김차문(soor****),진짜  나도 10점 준다  최고의 영화  
6-11-2017,2017,6,11,21:09,일요일,10,5,1,강준우(shsh****),할리우드에 라이언 일병 구하기가 있다면 충무로에는 클리멘타인이 있다.  
6-11-2017,2017,6,11,12:01,일요일,10,5,1,박민광(vefa****),예고편으로도 내 눈을 촉촉하게 만들고 내폰도 울고 베터리에 물이들어가서 고장났다..  
5-15-2017,2017,5,15,21:22,월요일,10,5,1,주니(hann****),최고의 영화~ 최고의 연기  
4-20-2017,2017,4,20,23:06,목요일,10,5,1,hish****,콜로설 한국배우들을 보고 클레멘타인은 살아있음을 느꼈습니다.  
3-10-2017,2017,3,10,16:04,금요일,10,5,1,nsh0523(nsh0****),나만 당할수 없지 이거냐 이것들아 ㅋㅋ  
12-29-2016,2016,12,29,21:51,목요일,10,5,1,새우(taew****),친구가 추천해준 영화. 이 영화를 보고 친구와 연을 끊었습니다. 왜냐하면 왜 이런 영화를 이제야 소개시켜 주었는지 배신감을 느껴서 입니다.  
12-29-2016,2016,12,29,13:24,목요일,10,5,1,soli****,"클레멘타인을 본 이후, 난 이 영화를 잊지 않으리라 다짐했고 개봉일인 5월 21일을 기념일로 여기며 매년 다시보곤 했다. 어느샌가 매월 21일만 되면 이 영화를 다시 보는 나를 발견했고, 이젠 매일 5시 21분에 클레멘타인을 감상하는게 일상이 되었다.  "
12-7-2016,2016,12,7,17:30,수요일,10,5,1,크레마뇽(pmjj****),세상은 두부류로 나뉨니다. 클레멘타인을 본사람과 안본사람  
12-4-2016,2016,12,4,15:30,일요일,10,5,1,기억의습작(chan****),이 영화를 보고 스티븐 시갈을 보기위해 러시아로 향했습니다..  
12-3-2016,2016,12,3,01:17,토요일,10,5,1,free****,이 영화를 보고 머리가 자라나기 시작했습니다.  
11-25-2016,2016,11,25,10:13,금요일,10,5,1,dbwo****,한번도 안본 사람은 있어도 한번만 본 사람은 없다....  
9-22-2016,2016,9,22,02:12,목요일,10,5,1,숭굴당당(jcjc****),지금 평점을 읽고 있는 지금도 늦지 않았다. 빨리 봐라~ 보고 난 후 감동이 식기전에 평점을 남겨라  
9-16-2016,2016,9,16,23:52,금요일,10,5,1,KMQ(sajo****),진짜 인생 걸작... 스티븐시걸작  
9-7-2016,2016,9,7,10:17,수요일,10,5,1,russ****,평점  9.9 만듭시다..  
8-27-2016,2016,8,27,03:31,토요일,10,5,1,FlCE(kts9****),내인생에 큰부분이된영화  
8-26-2016,2016,8,26,14:37,금요일,10,5,1,ㅇ(ekzm****),아직 영화는 보지않았지만 영화의 감동이 얼마나 큰지 느껴지네요  인류 최고의 선물 클레멘타인.  전 오늘 이걸로 선택했습니다  
8-26-2016,2016,8,26,12:40,금요일,10,5,1,마내(jsk7****),평점으로 이 영화를 평가해야 한다는것 자체가 부끄럽다...  
8-26-2016,2016,8,26,10:45,금요일,10,5,1,dbse****,언젠가 돌아가신 제 의사이셨던 조부께서 버릇처럼 이야기하신곤 했습니다.  내가 죽을때 들고 갈것은 단 두가지그간 치료한 환자명부와 클레멘타인 dvd 그게 전부다.  
8-25-2016,2016,8,25,05:09,목요일,10,5,1,푸른피(whdr****),"전 노숙자였습니다.구걸해서 틈틈히 모은 7천원을 가지고 만화방에가서 자려고 들어갔습니다.그때 만화방에서 틀어준 영화가 클레멘타인이었죠.그영화를 보구 큰 감명과 끌어오르는 힘으로 재기에 성공하여, 지금은 빌게이츠보다 더많은 자산은 보유하게 되었습니다  "
8-25-2016,2016,8,25,01:24,목요일,10,5,1,tidh****,내인생은 이영화를 보기전과 후로나뉜다내친구들에게도 이영화를 추천할것이다이영화를보면서 깨달았다 난클레멘타인을보기위해태어났다는것을  
8-25-2016,2016,8,25,00:21,목요일,10,5,1,수지(brea****),꼭 보세요 님인생이달라짐..  
8-24-2016,2016,8,24,23:59,수요일,10,5,1,kang****,이 영화를 보고 삶의 소중함을 알았습니다.  
8-24-2016,2016,8,24,15:25,수요일,10,5,1,걸어세계로(drea****),이것이 바러 최고의 영화!!  
8-24-2016,2016,8,24,14:41,수요일,10,5,1,택티컬커맨더스(batc****),많은분들꼐서 감동에만 치중해서 말씀하시는데 경쾌한 액션과 웃음또한 놓치지않은 희대의 명작이라고 감히 평가해드릴수있겠습니다. 코믹 멜로 액션 에로 어느장르를 좋아하시던간에 모두를 만족시켜드릴 영화라고 봅니다. 당연히 10점드립니다.  
8-24-2016,2016,8,24,11:45,수요일,10,5,1,hado****,"어머님은 말하셨지, 인생을 즐겨라, 그리고 ""클레멘타인""을 보아라. 옛말에 어른들의 말씀을 듣다가 떡이 생긴다고 했는데. 나에겐 클레멘타인이 그런 영화다.  "
8-20-2016,2016,8,20,23:37,토요일,10,5,1,kib2****,클레멘타인..정말 다시 없을 명작..  
8-20-2016,2016,8,20,11:49,토요일,10,5,1,맹강(zerg****),명예의 전당에 올라야 할 각 아님?  
8-19-2016,2016,8,19,15:14,금요일,10,5,1,구조쟁이(gwje****),죽기전에 영화 한 편 정도는 괜찮겠다는 생각에 이 영화를 선택해서 보았습니다. 그 후 저는 살아야 할 이유가 생겼습니다. 동준형님 집에 계시죠?  
8-19-2016,2016,8,19,12:47,금요일,10,5,1,주달인(j1y3****),보고 싶다 클레멘타인 10자  
8-19-2016,2016,8,19,07:53,금요일,10,5,1,도파민(addi****),내 인생 최고의 영화!!  
8-16-2016,2016,8,16,19:04,화요일,10,5,1,미란다꺼커(veni****),"무슨 말이 필요한가?? 우리나라 영화 역사에 3대 명적성냥팔이 소녀 재림,다세포 소녀,클레멘타인 꼭 봐라  "
7-25-2016,2016,7,25,22:52,월요일,10,5,1,도루왕 허부기(miru****),와 이건 진짜 명작이다...만점이 10점이 아니라 100점이어도 모자랄듯.. 완전 울면서 봤네;;ㅜ  
6-30-2016,2016,6,30,03:08,목요일,10,5,1,도양(soso****),평점이 높아서 보게되었는데 그 이유를 알것같습니다  
6-6-2016,2016,6,6,02:38,월요일,10,5,1,유종경(bell****),사랑합니다 고맙습니다  
6-5-2016,2016,6,5,21:06,일요일,10,5,1,dbwn****,의리로 참고 보는 영화 10자10자  
3-14-2016,2016,3,14,23:30,월요일,10,5,1,미셔니(kail****),평점보고 나도 울었다~~  
2-25-2016,2016,2,25,13:16,목요일,10,5,1,lych****,이 영화를보고  서울대에합격했습니다.  
2-16-2016,2016,2,16,00:13,화요일,10,5,1,잠만보(qhtj****),이런말이 있다. 인생은 B(birth) 와 D(dead) 사이에 C(clementine)이 있다고.  
2-5-2016,2016,2,5,17:22,금요일,10,5,1,기억나(hotf****),영화학도입니다. 이영화를 보고 꿈을 접었습니다.영화가 끝난 후 제가 배운건 쓰레기였다는 확신이 들었고 모든 영화학이 클레멘타인 안에 다 있었습니다.만세~~~~  
2-1-2016,2016,2,1,14:54,월요일,10,5,1,금동자(pang****),이 영화를 30번 넘게봤다. 볼때마다 새로운 감동이 밀려온다. 앞으로도 내 인생과 함께할 영화다.  
12-27-2015,2015,12,27,14:10,일요일,10,5,1,동엽느(tame****),이걸안봤어?아직까지?  
12-22-2015,2015,12,22,21:28,화요일,10,5,1,피터팬1티(deve****),정말 많은 분들께 이 영화를 추천받았는데요. 그 분들을 찾아가고 싶어질 정도의 내용들이었답니다.  
11-28-2015,2015,11,28,17:42,토요일,10,5,1,범블비(mine****),클레멘타인을 보지않았지만 본것같은 기분이 든다. 기분탓인가...  
11-23-2015,2015,11,23,12:03,월요일,10,5,1,원스(tita****),한국영화계의 '대부'인 클레멘타인이 세계 최대의 영화 평론 사이트 IMDB에서 3점대를 기록하고 있는것은 동서양의 극단적인 문화차이를 반증하는 대표적 사례이다.  
11-2-2015,2015,11,2,13:04,월요일,10,5,1,사랑해(k2s7****),훌륭합니다. 결말이 궁금해서 4배속으로 봐버렸습니다.  
7-27-2015,2015,7,27,23:07,월요일,10,5,1,뭘로하지(wdw0****),방금 유네스코에다가 세계문화유산 신청하고 왔습니다  
7-19-2015,2015,7,19,21:26,일요일,10,5,1,치키(chic****),가족과 함께 클레멘타인을 보지 않은 자 인생을 논하지 말라...  
7-19-2015,2015,7,19,12:32,일요일,10,5,1,임진혁(ahrt****),하.. 정말경이롭다는말밖에할말이없네요 마치축구로비유하자면 메시의 드리블능력 지단의 경기지배력 호날두의 득점력 으로도 비빌수없는정도입니다. 영화=클레멘타인  
7-17-2015,2015,7,17,23:48,금요일,10,5,1,recluse97sy(poor****),이 영화를 보고 민둥산처럼 반들반들 하던 제 머리에서 머리털이 자라났습니 탈모갤 회원분이시라면 좆극 추천합니다  
7-4-2015,2015,7,4,15:20,토요일,10,5,1,멜로디(kiki****),"넘쳐나는 감동과 눈물 때문에 비록 영화를 끝까지 볼 순 없었지만, 제 생에 최고의 영화 였습니다. 아아...  "
6-25-2015,2015,6,25,17:06,목요일,10,5,1,골고십삼(pck0****),저는 본래 선천적으로 시각장애를 가지고 태어났습니다. 하지만 이 영화를 본 후 눈을 떴고 현재 시력은 2.0입니다.  
6-25-2015,2015,6,25,15:33,목요일,10,5,1,겸둥이아장이(ilji****),별이 다섯개 인게 한스러운 영화... 이 영화로  모든이가 하나가 될것이다  
4-15-2015,2015,4,15,22:11,수요일,10,5,1,도망가자(thdr****),내 옆에서 같이보던 개가 울더라  
2-17-2015,2015,2,17,23:29,화요일,10,5,1,파츄리야(rkdt****),클레멘타인을 보며 드는 생각은 역시....! 라는 단어입니다.  
2-17-2015,2015,2,17,21:08,화요일,10,5,1,신기루(issa****),이건 역시 희대의 명작이다.  
2-17-2015,2015,2,17,11:27,화요일,10,5,1,Batterios(wjha****),이건 정말 세계 최대의 명작입니다. 강추!  
2-16-2015,2015,2,16,08:32,월요일,10,5,1,차가워(rabb****),혹자는 이 영화를 끝까지 보는데 용기가 필요하다고 말합니다. 그 말대로 자라나는 소년 소녀들에게 살아갈 용기와 어떤 역경에도 굴복하지 않을 정신력을길러줄 영화라 생각합니다. 더불어 시간의 소중함도 깨닫게해주는영화  
2-14-2015,2015,2,14,01:29,토요일,10,5,1,안알려주지렁2(jkin****),노아가 살아있다면 이 영화를 방주에 실었을거 같다  
11-14-2014,2014,11,14,02:56,금요일,10,5,1,토토(toto****),"""아빠일어나""를 외치는 장면에서 극장안은 그야말로 아수라장이었습니다 오열하며 실신하는 사람들도 태반이었고 주인공이 스티븐시걸에게 한방먹이는 장면에선 태극기를 휘날리는 사람까지 있었습니다 엔딩자막이올라갈땐 애국가를부르며모두가 하나되어영화표를찢어발겼습니다  "
8-23-2014,2014,8,23,03:00,토요일,10,5,1,엽(sy50****),이영화 보지 않았으면 말을 하지 마세요...  
8-12-2014,2014,8,12,22:37,화요일,10,5,1,fant****,이것은절대1점이아니다11점을주고싶은 내마음이다  
8-5-2014,2014,8,5,23:21,화요일,10,5,1,미니(gea0****),꼭 보세요 두번 보세요 세번도 볼만함  
7-29-2014,2014,7,29,04:59,화요일,10,5,1,유틸맨(mybs****),이 영화를 보고 수년째 복용하던 비아그라를 끊었습니다. 일어나!!!  
7-28-2014,2014,7,28,17:12,월요일,10,5,1,mcsa****,좋아요 아주 좋아요 ㅎㅎ  
7-28-2014,2014,7,28,03:07,월요일,10,5,1,양씨(yang****),이 영화를보고 발바닥에 깊숙히박혀있던 티눈이 빠졌습니다.  
7-28-2014,2014,7,28,01:55,월요일,10,5,1,호야(hole****),이 영화를 보지 않은 사람은 한국영화를 논하지 말라. 아직 이보다 슬프고 위대한 영화는 본적이 없다. 세월이 흘러도 여전히 최고.  
7-28-2014,2014,7,28,01:51,월요일,10,5,1,오싸(5lov****),와....명작이네.  
7-28-2014,2014,7,28,01:33,월요일,10,5,1,zoza****,만약 신이 이 영화를 보고 세상을 창조했다면 이 세상에 슬픔따위 존재하지 않았을지도 모른다.  
7-27-2014,2014,7,27,22:47,일요일,10,5,1,호야(sieg****),후속편이 기대됩니다.  
7-27-2014,2014,7,27,01:57,일요일,10,5,1,원빈(q1q1****),이것은 영화가아닌 역사다  
7-27-2014,2014,7,27,01:55,일요일,10,5,1,문학소년(coba****),식스센스 이후의 최고의 반전이네요.  
7-27-2014,2014,7,27,01:54,일요일,10,5,1,Browneye(pakf****),흑흑 눈물만 흐르네요 ㅜㅜ  
7-27-2014,2014,7,27,01:53,일요일,10,5,1,하마(zpdl****),"남자의,남자에 의한,남자를 위한 영화  "
7-27-2014,2014,7,27,01:53,일요일,10,5,1,환상의시내루(hoyo****),감사합니다 이런영화를 선물해주셔서  
7-27-2014,2014,7,27,01:53,일요일,10,5,1,유동민(ehda****),예술이다이건예술이야아  
7-27-2014,2014,7,27,01:50,일요일,10,5,1,gowl****,이 영화를 보고 꿈을 찾았습니다.  
7-27-2014,2014,7,27,01:32,일요일,10,5,1,알피(myla****),"평이 너무 좋아서 의심 했는데, 내 의심이 잘못됐다...진짜 감동이다....  "
7-26-2014,2014,7,26,20:46,토요일,10,5,1,ksky****,이 영화를 10년이 지난 지금에야 보다니... 10년간 인생을 헛살았다는 생각이다  
7-26-2014,2014,7,26,15:20,토요일,10,5,1,Sir taiji(foge****),이 영화는 미쳤다 -제임스 카메론-  
7-25-2014,2014,7,25,23:23,금요일,10,5,1,sjh1****,이 영화를 못본 관객을 위해서 이 영화는 필히 재개봉을 해야된다.  
7-17-2014,2014,7,17,16:14,목요일,10,5,1,댜밍(peac****),진지하게 재개봉을 원합니다.  
7-17-2014,2014,7,17,12:11,목요일,10,5,1,kwon****,클레멘타인을 안본사람은 있어도.. 한번본 사람은 없다..나는 밥먹다 영화를 봤는데 너무 몰입한 나머지 밥그릇끼지 먹었다..  
7-17-2014,2014,7,17,01:26,목요일,10,5,1,dron****,이 영화를 다 본 뒤 찾아올 허무함을 최대한 늦추기 위해 일주일에 30초씩만 보고 있습니다  
7-17-2014,2014,7,17,00:44,목요일,10,5,1,스탐(yshy****),환상의 똥꼬쇼! 뭔가 보여드리겠습니다!!  
6-24-2014,2014,6,24,17:46,화요일,10,5,1,흰검love(kimj****),바보같은삶 이걸보고 열심히 살수있었습니다 꼭보세요  
6-22-2014,2014,6,22,23:41,일요일,10,5,1,소금지출(cleo****),보고 또 보고 잊혀지지 않는 감동  
6-22-2014,2014,6,22,13:26,일요일,10,5,1,HODO(apt1****),숭고한 인간과 못난 인간의 차이는 클레멘타인을 봣느냐 안봣느냐의 차이밖에 나지 않는다  
6-21-2014,2014,6,21,14:00,토요일,10,5,1,leey****,이 영화를 보고나서 군대에 갈때보다 더 큰 슬픔을 느꼈고 입대한다고 질질짜던 지난 내 과거를 생각하니 내 자신에 대한 한심함이 나를 짓누르고 있다.  
6-17-2014,2014,6,17,15:36,화요일,10,5,1,쿠키야(dora****),오늘 류현진이 8승을 거뒀는데 경기직전 클레멘타인을 보고 힘을 냈다고 하네요 메팅리 감독이 단체 관람도 추진중이라고 합니다  
6-17-2014,2014,6,17,12:11,화요일,10,5,1,알랍(dbsk****),아니 이런 영화가 천만을 못 넘다니 재개봉 부탁드립니다  
6-15-2014,2014,6,15,20:28,일요일,10,5,1,박상원(bora****),무엇을 상상해도 그 이상!!!  
6-13-2014,2014,6,13,14:58,금요일,10,5,1,cand****,초반에 스토리가 늘어져 살짝지루한 감이있지만 30분만 참고보면 그야말로 통쾌하고 격렬한감동이 몰려옵니다.잘알려지지않은 수작중의 수작.스티븐시걸 역시 강추입니다  
6-4-2014,2014,6,4,02:07,수요일,10,5,1,녹색나무(yune****),황금주말에 네이버평점 하나랑 달린 댓글보고 봤습니다. 참고 또 참고 봤습니다.먼가 나오겠지 네이버 평점은 거짓말을 하지않아 먼가 나오겠지~ 하다가 울었습니다. 아빠 일어나~ 정말 최고더군요 의심하지말고 보세요! 의심한거 여러분 죄송합니다. ㅠ.ㅠ  
6-2-2014,2014,6,2,15:52,월요일,10,5,1,프림은한스푼(yoow****),한국 영화사에 길이 남을 마스터피스.  
5-27-2014,2014,5,27,06:24,화요일,10,5,1,해병장(sssw****),이영화를 보고  발기부전이 였던 제가 아침마다 빳빳해집니다  
5-17-2014,2014,5,17,11:35,토요일,10,5,1,sail****,이영화 평점이 왜이리 높나 하고 봤는데 보고 나서 알았습니다.이영화는 말로 표현하기 힘듭니다. 제가 감히 표현하자면 액션을 예술로 승화시킨 영화  
5-17-2014,2014,5,17,10:56,토요일,10,5,1,capa****,깐느영화제 부럽지 않다. 우리에겐 클레멘타인이 있다. 클레멘타인 후속편이랑 프리퀄만으로도 우리 영화의 미래는 20년정도 밝다고 자부한다.  
5-16-2014,2014,5,16,12:22,금요일,10,5,1,한재민(hjm0****),영화를 보고 나서 난 클레멘타인을 보지 않은이들이 가장 부러워졌다 그들은 최고의 감동을 맞이할 셀렘을 갖고있기 때문이다  
4-24-2014,2014,4,24,17:46,목요일,10,5,1,송기욱(terr****),눈물샘을 자극하는....  
4-24-2014,2014,4,24,17:21,목요일,10,5,1,눌와(nulw****),진지 빠는 놈들  때문에 평점이..  
4-13-2014,2014,4,13,21:37,일요일,10,5,1,Friendship(dl33****),"현실적으로 말씀드리면, 제가 지금까지 봤던 영화들 중에 가장 연기력이 출중했던 영화라고 말하고 싶습니다.스토리는 비슷한 영화중에선 괜찮은 편이지만폴 에크먼이 말한 인간의 6대 표정을 매우 잘 표현했으며, 실제같은 감정을 느낄 수 있는 영화입니다.  "
4-12-2014,2014,4,12,19:08,토요일,10,5,1,보뚜(prin****),이런 감동과 스릴은 정말 오랜만에 느껴봅니다.  제 가슴 속에 남을 명품 영화입니다.  
4-12-2014,2014,4,12,11:39,토요일,10,5,1,mins****,지금까지 5 번 봤습니다.  
4-11-2014,2014,4,11,21:44,금요일,10,5,1,유노르(grim****),정말 환상의 똥1꼬쇼였습니다  
4-11-2014,2014,4,11,14:58,금요일,10,5,1,퍼펙트(kuku****),엔딩 크레딧 아빠 일어나!!라고 외치는 나는 아무말도 할수 없었다. 그 감동이란 말을 이을수가 없게 만들었어  
4-6-2014,2014,4,6,02:13,일요일,10,5,1,용애콘물(yong****),중국에는 삼국지가 있다. 유대인들에게는 탈무드가 있다. 아랍인들에겐 코란이 있다.하지만 우리에겐 클레멘타인이있다.  
2-14-2014,2014,2,14,04:18,금요일,10,5,1,CHEDA(nolj****),제작사 뭐하는가 내년이 개봉10주년이다재개봉 준비착수하라! 이 인생의 참 이치를 스크린으로느끼지못한 천추의 한을 풀어야 한다!!  
2-11-2014,2014,2,11,18:25,화요일,10,5,1,돌체(iwai****),첫 네이버 평점을 클레멘타인에게 바칩니다..  
1-17-2014,2014,1,17,00:55,금요일,10,5,1,min1****,최근 많이 힘들었습니다. 얼마 전에 겪었던 안좋은 사건이 도저히 머리속에서 없어지질 않았습니다. 하지만 이 영화를 보며 펑펑 울고나니 극복이 되어지더군요. 단언코 대한민국 최고의 영화입니다.  
11-2-2013,2013,11,2,04:09,토요일,10,5,1,아이오페(camu****),"정말 열번도더본영화.. 무심결에 다운받아서본후로 내컴터에서 야동을밀어내노 최고의영화로자리잡은명작, 속는셈치고 한번보시면 두번세번은그냥봅니다 아직까지여운이남네 역시명작  "
10-31-2013,2013,10,31,19:20,목요일,10,5,1,바싯다(zero****),보고나서 여운이 많이 남네요.~ 이거 1점 주는 사람은 가서 우뢰매나 보시길!!  
10-11-2013,2013,10,11,13:20,금요일,10,5,1,podo****,이 영화를 보고 발기부전이 고쳐졌습니다..  
7-31-2013,2013,7,31,23:43,수요일,10,5,1,아마데우스(qndd****),한국인이면 꼭 한번씩 봅시다  
7-25-2013,2013,7,25,17:06,목요일,10,5,1,kong****,진정한 영화 입니다.  
7-3-2013,2013,7,3,00:16,수요일,10,5,1,키키(haru****),ㅋㅋ 풍문듣고왔어요  
7-2-2013,2013,7,2,22:44,화요일,10,5,1,LEDO(lsc2****),한국영화 성공할려면 으리 밖에 없다 으리으리!!  
6-25-2013,2013,6,25,19:06,화요일,10,5,1,dlfmadjqtekrn(dlfm****),성지순례  
6-3-2013,2013,6,3,14:43,월요일,10,5,1,킴군(yama****),의리!  
6-3-2013,2013,6,3,12:17,월요일,10,5,1,Thor(bloo****),말이필요없음  
6-1-2013,2013,6,1,02:20,토요일,10,5,1,레몬강아지(kjs1****),지금껏 이 영화를 보지 않았다니...  인생을 헛살았네요... 영화 한편에서 인생을 배워갑니다  
5-31-2013,2013,5,31,17:43,금요일,10,5,1,shar****,이 영화가 날 사람으로 만들었다. 만약 이것을 보지 않았다면 가스배달이나 하고 있겠지  
5-24-2013,2013,5,24,15:38,금요일,10,5,1,ikfo****,한국 영화의 고전.나도 모르게 눈물이 터졌다....아빠...일어나..!!  
3-10-2019,2019,3,10,01:42,일요일,10,6,2,김(kudo****),실수로 배아픈상태로 영화봤는데 너무 몰입해서 영화가 끝난 뒤에야 팬티에 싸버린걸 알았다  
2-20-2019,2019,2,20,18:19,수요일,10,6,2,woos****,누가 이영화를심판하는가?이영화가 바로 정의다!!  
12-3-2018,2018,12,3,21:30,월요일,10,6,2,오십원(gibs****),요새 몸이 좋지 않은 30대입니다. 최근 관람하고 몸이 많이 가벼워졌읍니다.  
8-24-2018,2018,8,24,12:08,금요일,10,6,2,noci****,남북 정상회담때 상영하면 평화통일을 이룰 영화  
7-25-2018,2018,7,25,23:53,수요일,10,6,2,김태정(zter****),어....음....예  
7-9-2018,2018,7,9,00:38,월요일,10,6,2,wjdd****,평점 댓글보고 봐버렸다...개소리라는걸 이제야 알았다...  
3-15-2017,2017,3,15,21:00,수요일,10,6,2,동사(dong****),야 이새퀴들아 그만해라..이러다 이동준 클레멘타인2 만들면 다 니네 책임인거여~  
2-28-2017,2017,2,28,20:39,화요일,10,6,2,대완(keya****),"이영화 하도 유명해서 본적은 없지만 상당히 재미있을거란 생각이 든다, 그래서 난 이거 봤고 앞으로도 계속 볼건데 솔직히 물어보자 이거 만들고 희대의 명작이라고 평가받는데 그렇게 비꼬아대면 재밌냐? 이득남는거라도 있냐?  "
9-14-2016,2016,9,14,03:02,수요일,10,6,2,뷰티풀마인드(shan****),진짜 몸에 전율을 느낀건 오랜만이에요..클레인타인 dvd 사고싶네요 ㅠ  
9-12-2016,2016,9,12,19:14,월요일,10,6,2,귀염둥이(cspe****),스티븐 스필버그도 보면서 눈물흘렸던 영화군요  
9-11-2016,2016,9,11,13:46,일요일,10,6,2,sent****,지금까지 8번 봤는데요  dvd를 구하고 싶습니다./  
9-7-2016,2016,9,7,21:20,수요일,10,6,2,레나(skds****),이영화 DVD를 주석궁에 투하한다면 김정은 은 눈물을흘리며 뛰쳐나와 무조건항복을 외칠것이다  
8-27-2016,2016,8,27,22:55,토요일,10,6,2,봉오리(inka****),이 영화는 환상의 똥꼬쑈  
8-25-2016,2016,8,25,03:51,목요일,10,6,2,1사로격발이상무(orac****),보면 알게될 것이다.연출. 내용. 배우들의 수준높은 감정묘사. 이 완벽에 가까운 삼박자의 심포니엄  
6-7-2016,2016,6,7,00:28,화요일,10,6,2,원석(won_****),테이큰이 이 영화를 모티브로 제작 되었다는  것을 아는 사람은 많이 있지 않다. 그러나 역시 원작을 뛰어 넘는 모방작은 없다는 걸 이 영화를 보신 분이라면 알 것이다.  
6-6-2016,2016,6,6,19:53,월요일,10,6,2,캬하하(kamz****),아빠일어나 엉엉 ㅠㅠ흐ㄱㅍ  
3-22-2016,2016,3,22,13:38,화요일,10,6,2,타키온(mye0****),"평점검색하다 반지의제왕 위에 위치한 클레멘타인을 발견하고, 본디스크에서 140포인트를 지불하고 다운받아봤습니다.네티즌여러분 감사합니다.  "
2-5-2016,2016,2,5,23:45,금요일,10,6,2,비지나무(qudw****),"제 친구는 암으로 투병 중이었습니다. 그런데 제가 병문안을 가서 클레멘타인을 보여준 날, 암세포가 암에 걸려 뒤졌습니다. 실제로 WHO에서는 이 영화를 떠오르는 암치료제로 개발도상국  "
4-11-2015,2015,4,11,19:52,토요일,10,6,2,jdh2****,"B (Birth, 출생) 와 D(Death, 죽음) 사이에는 C (Clementine, 클레멘타인) 가 있습니다.  "
3-17-2015,2015,3,17,22:22,화요일,10,6,2,웨스트(jise****),이 영화는 숫자로  평가하는것 자체가 문화에 대한 모독이다  
9-16-2014,2014,9,16,11:52,화요일,10,6,2,크오오(gofu****),돌아가신 김머중슨상님께 이영화를 바칩니다.  
9-2-2014,2014,9,2,10:28,화요일,10,6,2,kim0****,댓글을 보는 영화 ㅋㅋㅋ  
7-27-2014,2014,7,27,02:21,일요일,10,6,2,qhrtlfdl(tj43****),내인생의 터닝포인트를 만들어준 영화 동준이형 따봉!!  
7-25-2014,2014,7,25,23:02,금요일,10,6,2,소공녀(vale****),암 투병중입니다. 이 영화를 보면 암이 낫는대서 일주일에 한번씩 보고 있습니다. 감사합니다.  
7-19-2014,2014,7,19,10:39,토요일,10,6,2,hwj0****,사람들은 말한다 가요계는 서태지의 전과후라고 만약에 이 영화가 서태지가활동할때 있었다면 서태지는 잊혀졋을것이다.  
7-18-2014,2014,7,18,01:11,금요일,10,6,2,추사마(goin****),이 영화를 아직도 안봤다면 인생에 대한 직무유기  
7-18-2014,2014,7,18,00:53,금요일,10,6,2,지롤(ldh9****),스크린쿼터제???? 다 자신없어서 하는 말 클레멘타임을 본 사람이라면 스크린 쿼터 폐지가 답이다 아직도 내 두눈엔 뜨거운 사나이의 눈물이 흐른다  
7-17-2014,2014,7,17,15:26,목요일,10,6,2,겔포(losa****),평점보고 사람들이 단체로 낚시하는줄알았는데 웬걸;;;; 진짜 감동이었다.  
5-26-2014,2014,5,26,22:02,월요일,10,6,2,오삼오(bug2****),와 눈물 콧물 다 뽑아버렸네  
5-26-2014,2014,5,26,19:02,월요일,10,6,2,ROYKIM(efe2****),코리안대부 김보성에대한 의리!  
5-26-2014,2014,5,26,18:11,월요일,10,6,2,공부해야(guyy****),33년 인생 살면서 평점을 처음 남겨 봅니다.  아직도 여운이 남습니다.  
5-1-2014,2014,5,1,04:33,목요일,10,6,2,dark****,"오늘 밤 내 생에 잊지 못할 영화 한편,,감동 한편 가슴에 꼭 간직하고 잠듭니다. 최고의 영화였네요  "
4-16-2014,2014,4,16,19:43,수요일,10,6,2,지지않아(josh****),2004년작이라고는 도저히 믿기 힘든 세련된 카메라기법과 주연배우인 준리와 스티븐시걸의 숨막히는 내면연기. 스티비원더가 극찬할만합니다.  
4-16-2014,2014,4,16,00:13,수요일,10,6,2,히로히로(hero****),소문으로만 듣던 클레멘타인... 왜 이제서야 보게 된건지... 우리나라에도 이런 자랑스런 영화가 있다니 놀랍습니다... 외국인 친구들에게 이제 더이상 김치 싸이 얘기하지 말고 당당하게 Do you know 클레멘타인? 외칩시다  
7-25-2013,2013,7,25,21:43,목요일,10,6,2,나비(rlav****),영화보면서 운적이 단 한번도 없었는데...  
7-23-2013,2013,7,23,16:55,화요일,10,6,2,흥겹네(daeb****),아빠 일어나... 이한마디가 아직 가슴을 울리네요  
3-8-2019,2019,3,8,12:48,금요일,10,7,3,eunc****,부산국제영화제 오프닝 영화로 강력추천합니다.  
3-8-2019,2019,3,8,12:45,금요일,10,7,3,필립안젤모(kore****),이 영화를 보고 발기부전이 치료되었습니다  
2-26-2019,2019,2,26,13:35,화요일,10,7,3,ALH(godt****),누가 1점 주시는 겁니까?  
2-25-2019,2019,2,25,23:38,월요일,10,7,3,듀공듀공(stre****),드디어 이 영화를 봤더니 나같은 놈에게도 하느님이 왕복승차권을 사주셨습니다.  
8-20-2018,2018,8,20,15:41,월요일,10,7,3,이제쥐를잡자(huhs****),"나만 당하는가, 나만 당할 수 없는가.. 나의 선택은  "
5-15-2018,2018,5,15,20:59,화요일,10,7,3,dato(jls4****),아니 왜 이영화가 대한민국 역대평점 순위57위예요jQuery22402825378494982702_1526385523534??당연히 1윈줄알고 제가 손가락을 얼마나 내렸는지 하 당장 1위만들죠 안만들면 ㄹㅇ 국민들 수준 ㅎㅌㅊ입니다  
4-5-2015,2015,4,5,13:40,일요일,10,7,3,반수(phil****),1점 줘서 낚시댓글 다는 분들 정말 야속하네요. 자기들만 볼려고 그런 거 다 압니다. 너무한 거 아닌가요? 명작은 다같이 봐야죠.  
3-16-2015,2015,3,16,14:13,월요일,10,7,3,gksa****,(클)라스가 다른 영화(레)일로 여행중에 보게 되었습니다 그런데(멘)날보게되는 중독성이 있네요 혼자보기 아까운영화(타)인에게 이 영화를 추천해주세요 (인)생에 있어서 가장 큰 보람을 느낄실 겁니다  
7-27-2014,2014,7,27,02:06,일요일,10,7,3,test****,아빠 일어나 똥꼬쇼 하러가야지 아  
11-19-2014,2014,11,19,12:00,수요일,1,27,23,야시(dudw****),추천해준 친구놈의 목을따러 가야겠습니다  
7-2-2019,2019,7,2,05:22,화요일,10,3,0,고수님(whal****),"영화를 볼 때 가장 중요한 것은 뜨거운 피날레와 주요 맥락을 다루는 스토리, 몰입을 위한 배우와 스탭들의 고생이다 이 영화는 그걸 다 가졌다  "
7-1-2019,2019,7,1,13:19,월요일,10,3,0,귀여운조커(han4****),"최근에 불면증을 겪다가 지인의 추천으로 이 영화를 보게되었고, 오랜만에 꿀잠을 잘 수 있었습니다. 정말 좋은 영화군요.  "
6-30-2019,2019,6,30,15:38,일요일,10,3,0,juwal(jgm4****),와 이건 그냥 대체 뭐라 설명할지 모르겠다  
6-30-2019,2019,6,30,14:21,일요일,10,3,0,푸우도리(mjiq****),예술 그자체 감동의 똥꼬쇼  
6-30-2019,2019,6,30,01:41,일요일,10,3,0,김원(kgrh****),새벽에 클레멘타인를 본 중2 학생입니다 영화가 아니라 한편의 드라마를 본거 같습니다 앞으로 부모님 말씀 잘듣겠습니다  
6-29-2019,2019,6,29,23:31,토요일,10,3,0,날가져가(moha****),어떤 말로도 표현할 수가 없네요  
6-25-2019,2019,6,25,22:01,화요일,10,3,0,공룡증후군(kuma****),1점을 준 놈은 시험볼때마다 1점만 받음  
6-24-2019,2019,6,24,21:02,월요일,10,3,0,Er(geon****),무인도에 dvd 한장만 들고갈수있다면주저하지않고 고를 한장  
6-22-2019,2019,6,22,20:52,토요일,10,3,0,박박정현(skee****),영화를 보고 운적은 처음입니다. 감사합니다 클레맨타인...  
6-22-2019,2019,6,22,13:16,토요일,10,3,0,서동화(note****),5번을 봐도 질리는 않는 희대의 명작  
6-22-2019,2019,6,22,08:46,토요일,10,3,0,괴물초장이(ansa****),소감은 아직보지않았고 명절에 티비에서 틀어주기전까진 한국영화계의 발전을위해불법다운로드하지않을것을선서합니다.아직보지않았고 명절에 티비에서 틀어주기전까진 한국영화계의 발전을위해불법다운로드하지않을것을선서합니다.기억이 나진 않는데 명작입니다!  
6-21-2019,2019,6,21,21:51,금요일,10,3,0,디자이니어(lo81****),재개봉해서 천만 가즈아~  
6-21-2019,2019,6,21,15:12,금요일,10,3,0,우리들의친구문규현(sh4s****),한국 영화의 뿌리와도 같은 존재  
6-21-2019,2019,6,21,09:31,금요일,10,3,0,잉여(1ksj****),봉준호감독은 기생충으로 황금종려상을 받았지만 김두영감독은 클레멘타인으로 구충제를 대체하는 업적을 세웠다  
6-20-2019,2019,6,20,11:20,목요일,10,3,0,감자우유(rate****),2019년도에 다시 보았습니다만..역시 최고의 영화  
6-19-2019,2019,6,19,23:45,수요일,10,3,0,크루누스(tkft****),평점보고 봤는데 명작이네요.. 마지막 부분에 감동받았습니다 아버지랑 꼭 보세요  
6-19-2019,2019,6,19,22:49,수요일,10,3,0,시루(ukir****),개웃기네 ㅋㅋㅋ이것들아 이건 점수를 매길수 없는 국보급  문화예술이다  
6-19-2019,2019,6,19,22:08,수요일,10,3,0,depo****,타임캡슐에 고이 넣어야 할 영화  
6-19-2019,2019,6,19,21:47,수요일,10,3,0,낮감독님(lovf****),오늘 가족과 다투고 온 학생에게 이 영화를 보여줬습니다.다 보고 제 앞에서 다툰일을 후회하며 오열했습니다.  
6-19-2019,2019,6,19,18:39,수요일,10,3,0,더비(bonz****),소리소문없이 4천만이상 봤다고 이동준형님의 똥꼬를 걸며 자부합니다  
6-19-2019,2019,6,19,16:19,수요일,10,3,0,kimn****,HOW AWESOME MOVIE  
6-19-2019,2019,6,19,15:31,수요일,10,3,0,준레옹(warp****),상승과 하강으로 명징하게 직조해낸 신랄하면서 처연한 계급 우화  
6-18-2019,2019,6,18,16:18,화요일,10,3,0,93쮸(wj07****),이 영화를 보고 여자친구가 생겼습니다.  
6-17-2019,2019,6,17,17:53,월요일,10,3,0,초보초보(cjst****),이영화가 왜 대작인지 보고나서야 알았다. 강추합니다~ 인생영화에요  
6-17-2019,2019,6,17,16:21,월요일,10,3,0,김민(rlaa****),명작이다.정말 감사합니다  
6-17-2019,2019,6,17,12:46,월요일,10,3,0,Thesis(fine****),이영화를 보고 암이 나았습니다  
6-15-2019,2019,6,15,20:13,토요일,10,3,0,o9lu****,여친과 헤어지고 울적함에 찾아본 영화.  헤어짐 이런 하찮은것 따위에 울적했다니...우주의 먼지 처럼 느끼게 해준 영화입니다.  
6-15-2019,2019,6,15,19:38,토요일,10,3,0,인생이막(nasu****),이래서야 어디 평점보고 영화를 고를수가 있나...우리 같은 즐겨요...  
6-15-2019,2019,6,15,14:07,토요일,10,3,0,기능활롱(ever****),한번보고 암이 나았고 두번보고 영생을 살게 됐습니대  
6-13-2019,2019,6,13,12:20,목요일,10,3,0,터보(turb****),생각보다 잼있네요 눈물도 펑펑나고 액션신도 볼만합니다 추천합니다  
6-12-2019,2019,6,12,03:29,수요일,10,3,0,이승훈(skrk****),잘 봤습니다.^^~ㅎㅎㅎ  
6-11-2019,2019,6,11,17:09,화요일,10,3,0,케이시(tjle****),그동안 서양영화에만 빠져.. 국산 영화의 진정성을 못 느껴봤던 내가 한심했다.. 비록 오래전 영화지만 국산 영화를 사랑하게 된 계기를 준 영화. 감사합니다..  
6-11-2019,2019,6,11,13:04,화요일,10,3,0,fox9****,이영화를 보고 공황장애가 나았습니다  
6-9-2019,2019,6,9,17:04,일요일,10,3,0,패러데이(pink****),삶을 뒤돌아 보고싶을때 가끔 꺼내봐요.. 저만의 힐링법!  
6-8-2019,2019,6,8,21:32,토요일,10,3,0,충취(sc3h****),인생작. 안보신분들은 꼭 보셈  
6-8-2019,2019,6,8,19:28,토요일,10,3,0,popy****,위아래로 우럭따리 우럭따  
5-30-2019,2019,5,30,23:42,목요일,10,3,0,루(x99x****),이 명작을 극장에서 보지 못 했다는 것이 인생 최고의 한 입니다.. 다시 태어난다면 클레멘타인 100차 찍겠습니다..  
5-29-2019,2019,5,29,18:58,수요일,10,3,0,pedr****,"아바타처럼 화려한 그래픽과 어벤져스급의 비쥬얼, 타이타닉만큼 슬프면서 감동을 주는 스토리와 다크나이트보다 깊게 다가오는 철학적 메세지를 1회차 관람으로 제 미천한 영혼이 받아들일수 없어 2회차, 5회차까지 갔습니다. 1번 본 사람과는 대회가 안되네요.  "
5-29-2019,2019,5,29,13:19,수요일,10,3,0,메가톤맨(maga****),"어이, 클레멘타인을 보고 오기 때문에 기다리고 있어요  "
5-29-2019,2019,5,29,01:28,수요일,10,3,0,제이디(jade****),"봉준호 감독은 “클레멘타인이 없었더라면 기생충의 단 한 장면도 촬영하지 못했을 것”이라고 말한 뒤, “이번 수상은 칸이 클레멘타인의 개봉 15주년에 준 큰 선물이 아닐까 싶다”고 했다.  "
5-28-2019,2019,5,28,14:17,화요일,10,3,0,GoTwins(stub****),이동준이 건들릿을 돌리며 인류를 구한 한마디:I am the Clementine!!!  
5-28-2019,2019,5,28,11:47,화요일,10,3,0,김민채(rlaa****),아빠 일어나!! 이걸듣고 귀에있는 귀지가 다 사라져서 깜짝놀랐습니다  
5-26-2019,2019,5,26,18:11,일요일,10,3,0,hoto****,대한민국 건국이래 최고의 명작  
5-25-2019,2019,5,25,03:25,토요일,10,3,0,kbj123(aa22****),인간이 평가하기에는 너무 과분한 작품입니다...  
5-24-2019,2019,5,24,15:49,금요일,10,3,0,jung****,지나가다 성지순례 왔습니다.  
5-24-2019,2019,5,24,15:38,금요일,10,3,0,무릎(memo****),포스터만봐도 이 영화가 얼마나 명작인지 느껴진다  
5-23-2019,2019,5,23,17:31,목요일,10,3,0,장원영(jsy5****),아무도 이 영화를 보진 않았지만 평점 만큼은 만점을 주고 싶은 영화  
5-23-2019,2019,5,23,10:40,목요일,10,3,0,포스(pak0****),사랑하는 아내와 결혼생활 10년째이영화를 몰랐다고 합니다이혼을 결심했습니다..  
5-22-2019,2019,5,22,13:16,수요일,10,3,0,김민석(alst****),"""클레멘타인  어셈블.""  "
5-22-2019,2019,5,22,11:41,수요일,10,3,0,Life(gheh****),"2019년에야 이 영화를 보게 되었다니 이때까지의 인생은 무엇이었을까요,,,, 20대의 마지막, 이 영화를 만난것 만으로도 저의 20대는 후회없었다고, 제 청춘은 찬란했었다고 모두에게 당당히 말할수 있을것 같습니다.  "
5-22-2019,2019,5,22,03:12,수요일,10,3,0,워키토키요(kimk****),이 영화를 보고 삶의 의미를 되찾았습니다.  
5-22-2019,2019,5,22,00:10,수요일,10,3,0,xhal(koku****),감동적인 이야기네요 마지막에 아빠 일어나!! 할때 울었어요 ㅠ  
5-21-2019,2019,5,21,23:52,화요일,10,3,0,다이노마트(chem****),액션의 진수를 보여주는 수작입니다 !!! 개 강추  
5-20-2019,2019,5,20,23:07,월요일,10,3,0,bebe****,이동준최고 완전멋있어  
5-20-2019,2019,5,20,16:22,월요일,10,3,0,아침이다(zepi****),와...평가보고 봤는데 대박이네요  과연 명불허전입니다!!!!  
5-18-2019,2019,5,18,08:18,토요일,10,3,0,아가(asdf****),끝까찌 보았씁니다 10점 짞쨖쨖  
5-17-2019,2019,5,17,22:24,금요일,9,3,0,국민거품국거박(clas****),클레멘타인과 타이타닉2  당신의 선택은?  
5-16-2019,2019,5,16,14:54,목요일,10,3,0,율마사랑(will****),굳~~~===÷÷÷  
5-15-2019,2019,5,15,07:10,수요일,10,3,0,신정분(rlad****),10점 안줄수가 없는 명화  
5-13-2019,2019,5,13,10:18,월요일,10,3,0,TINO(zscf****),어흑 ㅠㅠ 너무 빨리 나와서 빛을 보지 못했어  
5-12-2019,2019,5,12,01:02,일요일,10,3,0,내꿈은뭔가(casi****),하도 평점이 좋아서 뒤늦게 봤습니다. 이제서야 본게 너무 후회되네요. 10점주고 갑니다.  
5-9-2019,2019,5,9,16:40,목요일,10,3,0,룰루(wndm****),인생 최고의 영화!! 띵작이다  
5-8-2019,2019,5,8,14:27,수요일,10,3,0,레오나르도(hslo****),내인생 최고의 영화 감동♡♡  
5-7-2019,2019,5,7,00:25,화요일,10,3,0,앵그리 폭스(syuo****),내가 아직 살아있는 이유  
5-6-2019,2019,5,6,21:31,월요일,10,3,0,푸헤(youl****),104번째보고있다..  
5-6-2019,2019,5,6,18:16,월요일,10,3,0,HalfSeal(gm10****),정말 위대한 작품이다.  
5-6-2019,2019,5,6,15:55,월요일,10,3,0,djjin(alie****),무슨말이필요한가....  
5-6-2019,2019,5,6,12:10,월요일,10,3,0,북(duck****),씨..씹..십점....  
5-5-2019,2019,5,5,23:36,일요일,10,3,0,ghytdu(ik48****),10점 10점 10점  10자  
5-5-2019,2019,5,5,22:25,일요일,10,3,0,호야(path****),"괜히 10점짜리 영화가 아닙니다, 액션과 감동 스토리까지 다 완벽한 영화네요, 강추합니다  "
5-4-2019,2019,5,4,15:26,토요일,10,3,0,JWFootballcoach(c431****),이런 영화는 없었다. 충격 그 자체  
5-3-2019,2019,5,3,06:16,금요일,10,3,0,릭오웬(kmc7****),"숨겨진 맛집처럼, 나만 알고 싶은 작품인데....이제는 너무 많은 사람들이 알아버렸다.1980년대 비정성시, 90년대 내친구의 집은 어디인가? 2000년대는 감히 클레멘타인이 아닌가 싶다.  "
5-1-2019,2019,5,1,14:23,수요일,10,3,0,건휘(seoj****),우울해서 클레멘타인 평점을 다시 보러 들어왔다. 댓글만 보아도 느껴지는 짜릿한 감동은 영화를 보지 않아도 다본것 같은 신기한 경험이었다. 안본 내가 승자다.  
4-30-2019,2019,4,30,22:44,화요일,10,3,0,이민우(zzmi****),내가 살아있음을 알게해주는  
4-29-2019,2019,4,29,03:13,월요일,10,3,0,정민영(jung****),인생이 함들때마다 이 영화를 보고 힘을 얻네요  
4-27-2019,2019,4,27,21:24,토요일,10,3,0,구다미(good****),말이 필요 없는 인생작!  
4-27-2019,2019,4,27,07:45,토요일,10,3,0,다쓰베이더(tige****),이영화는 세계 문화 유산으로 영구보존되어야 한다  
4-25-2019,2019,4,25,09:27,목요일,10,3,0,hans****,한달에 한번 꼭 봅니다 오늘도 봤네요  
4-25-2019,2019,4,25,07:34,목요일,10,3,0,김영호(rica****),"다들 10점 주니 나도 10점, 그냥 십점  "
4-24-2019,2019,4,24,23:21,수요일,10,3,0,vice****,정말 감동입니다. 인생최고의 영화입니다  
4-24-2019,2019,4,24,00:10,수요일,10,3,0,세인트디(ytjd****),이 영화는 신이 내린 명작입니다  
4-23-2019,2019,4,23,18:22,화요일,10,3,0,rmfb****,희대의 명작입니다 꼭 보셔야합니다  
4-23-2019,2019,4,23,15:43,화요일,10,3,0,단추(9511****),아 ㅈㄴ 웃기네 ㅅㅂ ㅋ ㅋㅋ  
4-23-2019,2019,4,23,12:49,화요일,10,3,0,ceas****,감동의 실화 울고 말았네요  
4-23-2019,2019,4,23,12:46,화요일,10,3,0,coco****,댓글들 존나 웃기네 ㅋㅋ  
4-23-2019,2019,4,23,10:37,화요일,10,3,0,blis****,짱짱 말이필요없음 최고의영화  
4-22-2019,2019,4,22,23:26,월요일,10,3,0,권혁주(sssa****),평점보고 보러 가요 기대되네요 ㅎㅎ  
4-22-2019,2019,4,22,21:12,월요일,10,3,0,whdd****,아빠... 자지마...  
4-22-2019,2019,4,22,13:26,월요일,10,3,0,ahki****,영화의 시작과 끝...  
4-21-2019,2019,4,21,04:30,일요일,10,3,0,크하하하하(leem****),미국 헐리우드에서 코딱지만한 우리나라의 영화를 무시하지못하는 이유가있다... 우리에겐 클레멘타인이 있기 때문이다.  
4-21-2019,2019,4,21,01:25,일요일,10,3,0,갱스터(drea****),감독님 감사합니다..같은 시대라 영광입니다  
4-21-2019,2019,4,21,00:52,일요일,10,3,0,보노보노봅(whdg****),"한국의 출산률을 높이는데 이바지한 명대사""아빠 일어나""  "
4-20-2019,2019,4,20,16:23,토요일,10,3,0,유성환(entj****)," 세상사와 모든 번뇌, 상념, 감정 따위의 짐들을 잠시 잊어버릴 수 있었습니다. 명상하시는 스님들께 추천드립니다  "
4-19-2019,2019,4,19,16:23,금요일,10,3,0,chad****,10점 만점에 10점 드립니다  
4-19-2019,2019,4,19,14:06,금요일,10,3,0,바비킴(xeoe****),눈물과 감동의 서스펜스~ 미친듯한 액션  
4-19-2019,2019,4,19,12:42,금요일,10,3,0,정재욱(choi****),정말 재밋네요 추천드립니다  
4-19-2019,2019,4,19,01:02,금요일,10,3,0,삼촌(gura****),다시 없을 감동의 영화입니다.  
4-18-2019,2019,4,18,20:45,목요일,10,3,0,멍멍아야옹해봐(blau****),10번째 다시 보기중인 단하나의 영화  
4-18-2019,2019,4,18,14:59,목요일,10,3,0,별명ㅋ(ldy6****),우선 영화를 봐라!영화가 끝나면 알수없는 감동으로온몸이 전율을 일으킬것이다.  
4-18-2019,2019,4,18,11:22,목요일,10,3,0,ㅎㅎ(jees****),꼭  봐야할 인생영화~ 스티븐 갈매기의 띵작~~  
4-17-2019,2019,4,17,18:11,수요일,10,3,0,부산인(tomm****),안봤지만 10점을 줘야할거같다  
4-17-2019,2019,4,17,00:20,수요일,10,3,0,PJK(jpar****),80년대로 시간이 거꾸로 돌아가는 기적을 맛 보았습니다  
4-16-2019,2019,4,16,00:09,화요일,10,3,0,백호야(sam1****),세상에..처음에는 믿지 않았습니다..클레멘타인을 보고 기적을 보았다는 말을 하지만 저는 리뷰만 봤는데도 바로  챔피언분대 되었습니다..  
4-15-2019,2019,4,15,10:41,월요일,10,3,0,사과먹는시계(come****),영화가 끝난 뒤 여운 때문에 한참이나 말을 잃었습니다.정신차려보니 내 아들 이름이 이동갈...  
4-11-2019,2019,4,11,02:35,목요일,10,3,0,PeperoDj(pym5****),아 명성대로 정말 최고입니다.. 웃다가 눈물나서 죽을뻔했네  
4-2-2019,2019,4,2,02:53,화요일,10,3,0,Zeff(jaik****),아놔 넘 감동적인 영화입니다  
3-31-2019,2019,3,31,17:22,일요일,10,3,0,17JAN1415(yhch****),재밌네요.. 인생 최고의 영화  
3-23-2019,2019,3,23,23:53,토요일,10,3,0,미국토끼(wjdd****),갓띵작이다 어떻게 이렇게 잘만든영화를 이제본것인가  
3-21-2019,2019,3,21,14:01,목요일,10,3,0,초밥집(hund****),이제야 성지순례를 합니다 용서하소서 경건한 마음으로 이 명작을  영접한 후..비로소 전 빠졌던 머리가 다시 돋아나기 시작했습니다 할렐루야!!  
3-19-2019,2019,3,19,23:10,화요일,10,3,0,iheee(ihg0****),대체 무슨일이 벌어진거야  
2-19-2019,2019,2,19,02:03,화요일,10,3,0,이병진(qudw****),인생영화 진짜 꼭 추천드립니다  
2-18-2019,2019,2,18,19:08,월요일,10,3,0,이정민(gaum****),시대를 앞서간 영화다...  
2-18-2019,2019,2,18,15:09,월요일,10,3,0,감귤(cay2****),재밌음ㅋㅋ재밌음ㅋㅋ재밌음ㅋㅋ재밌음재밌음ㅋㅋ  
2-18-2019,2019,2,18,00:13,월요일,10,3,0,ㅏㅏㅏ(ttcm****),열시쯤인가 영화를 보고 정신을 차리니 아침이더군요.. 정말 시간가는줄 모르고 봤습니다.  
2-17-2019,2019,2,17,23:32,일요일,10,3,0,살아있는돌(mobu****),명작중에 명작... 꼭 감상하세요  
2-14-2019,2019,2,14,20:46,목요일,10,3,0,Beyond Universe(beyo****),만점 그 자체이다. 더 설명이 필요한가?  
2-14-2019,2019,2,14,13:44,목요일,10,3,0,황금잉어(luna****),사랑이 잘 살고 있니????  
2-13-2019,2019,2,13,19:47,수요일,10,3,0,이현우(magi****),이름값 하는 영화. 진짜다 이건  
2-13-2019,2019,2,13,16:19,수요일,10,3,0,w9a0****,제가 감히 이영화를 평가할 수 있을까요? 이영화를 보고 암이 나았습니다.  
2-13-2019,2019,2,13,14:01,수요일,10,3,0,30726최건(spdl****),그야말로 엄청난 영화다.  
2-12-2019,2019,2,12,22:25,화요일,10,3,0,코어왕자(qq15****),ㅋㅋ와 이 영화는 진짜다  
2-12-2019,2019,2,12,19:30,화요일,10,3,0,든든(babu****),시갈형님이 나오는것만으로도 안볼수가없음  
2-12-2019,2019,2,12,17:30,화요일,10,3,0,epfv****,개띵작 열번정도 본듯 합니다  
2-12-2019,2019,2,12,15:44,화요일,10,3,0,사랑으로99(vict****),명불허접목불인척과대포장   말이  필요없는인생최상  영화   입니다  
2-3-2019,2019,2,3,22:36,일요일,10,3,0,Damien(yoos****),뭔지 모르겠지만 그냥..  
1-4-2019,2019,1,4,21:27,금요일,10,3,0,Turtle(hear****),아빠 일어나 똥꼬쇼 해야지  
1-3-2019,2019,1,3,04:23,목요일,10,3,0,즈쉰(thek****),??影?好看。而且有感?  
1-3-2019,2019,1,3,03:03,목요일,10,3,0,변우진(boxe****),He is korean.  
1-2-2019,2019,1,2,23:03,수요일,10,3,0,ketepong(shpa****),나한테 5점은 이 영화 하나뿐  
1-2-2019,2019,1,2,17:31,수요일,10,3,0,젊은날의고뇌(rest****),이런 영화는 선 별점 후. 감상이다.시걸형님 나오면 무조건이지 앙그래?이번 생이 끝나면. 다음생엔 꼭 보렵니다.  
12-14-2018,2018,12,14,11:19,금요일,10,3,0,The Soul(h975****),오랜만에 다시 봤습니다. 역쉬 길이 남을 명작입니다.  
12-13-2018,2018,12,13,02:08,목요일,10,3,0,kmli****,네이버 영화는 별점 10점을 클레멘타인이라고 불러야 할 것이다.  
12-9-2018,2018,12,9,05:11,일요일,10,3,0,뱀이(juhu****),아주재미있었습니다.  
12-6-2018,2018,12,6,02:40,목요일,10,3,0,yisa****,머찌다 진짜 머찌다  진짜 진짜 멋지다  
12-6-2018,2018,12,6,00:51,목요일,10,3,0,코난바라기(ko94****),이 영화를보고 최고의 영화를 찾았습니다  
12-5-2018,2018,12,5,15:13,수요일,10,3,0,스페셜리스트(huwo****),무슨말이 더 필요한가? 이 영화의 필름은 몇OO이 지나면 문화재로 등록이 필요하다.  
12-5-2018,2018,12,5,12:29,수요일,10,3,0,시지프스(radi****),"아인슈타인의 일반상대성이론은 클레멘타인을 보고 영감을 얻어서 만들어진 이론이며,  스티븐 호킹 박사가 시간의 역사를 집필 한 것도 클레멘타인에서 영감을 얻었기 때문이다.클레멘타인은 시공간을 뛰어넘는 물리학의 패러독스이며, 인류 문화의 패러독스이다!  "
12-3-2018,2018,12,3,14:03,월요일,10,3,0,쪼메(impc****),아직 안봤지만 댓글만으로도 10점  
12-1-2018,2018,12,1,20:01,토요일,10,3,0,진키아줌마(ssia****),10점 줘야한다는 영화라더군요  
12-1-2018,2018,12,1,14:49,토요일,10,3,0,뚜리뚜밥(tpck****),상쾌한 주말 오후 완벽한 하루에 클레멘타인을 얹는다  
12-1-2018,2018,12,1,05:02,토요일,10,3,0,노나(sams****),오늘도 인생을 느꼈습니다.  감사합니다..!  
11-29-2018,2018,11,29,07:20,목요일,10,3,0,slal****,말이필요없다 개명작!ㄷㄷ  
11-27-2018,2018,11,27,20:03,화요일,10,3,0,Prime(dool****),ㅎ정말 정말 최고입니다.  
11-27-2018,2018,11,27,18:47,화요일,10,3,0,pretty(sky7****),이런 작품이 지구상에 있다는게 놀라울 따름.  
11-27-2018,2018,11,27,00:56,화요일,10,3,0,보라도으리(alst****),죽기전에 꼭 봐야 하는 영화  
11-26-2018,2018,11,26,23:10,월요일,10,3,0,오페라몬(hcho****),UFC회장이 이 영화보고 ufc 창단했다면서요?Ultimate Fighting Clementine.  
11-26-2018,2018,11,26,11:38,월요일,10,3,0,chan****,"여러분, 회사에서 휴가내는 법이 뭔지 아십니까? 클레멘타인을 본다고 하세요. 바로 집으로 직행입니다!  "
11-26-2018,2018,11,26,11:12,월요일,10,3,0,레트르스(qpwq****),명작입니다 안보신분들은 한번조시길바래요  
11-25-2018,2018,11,25,22:42,일요일,10,3,0,쿨 조(love****),"이 영화와 어께를 나란히 할 수 있는  한국영화는 존재하지 않는다. 아직도 그 대사가 귀에 맴돈다.아빠 일어나 , 아빠 일어나.  "
11-25-2018,2018,11,25,00:41,일요일,10,3,0,esmo****,클레멘타인2 간절히 기다립니다  
11-24-2018,2018,11,24,21:44,토요일,10,3,0,syd6****,저는2004년이후 집에서 딸이  아빠하고 부르면 자다가도힘이납니다~~  
11-22-2018,2018,11,22,05:18,목요일,10,3,0,sjgl****,주모~! 셔터 내료잇!  
11-20-2018,2018,11,20,23:42,화요일,10,3,0,NOW(doen****),영화 십계와도 견줄만한 종교적 영화~  
11-18-2018,2018,11,18,19:22,일요일,10,3,0,무지개(sung****),리얼과 인랑을피해 이곳에 왔는데 그곳은 빛이였습니다  
11-16-2018,2018,11,16,14:55,금요일,10,3,0,포플러나무아래(jso2****),"보헤미안 랩소디!! 마지막 20분의 감동에 젖어 살던 이번주,,,, 하지만 어제 보았던 클레멘타인!!""아빠 일어나"" 이 한마디가 퀸의 20분 공연을 압도하는 감동이었습니다. 감사하고 감사합니다.  "
11-15-2018,2018,11,15,11:55,목요일,10,3,0,김민준(gsdf****),천년에 한 번 나와야 할 영화  
11-12-2018,2018,11,12,23:50,월요일,10,3,0,이희준(dign****),이영화 안봐도10점입니다  
11-11-2018,2018,11,11,22:55,일요일,10,3,0,오늘도감사(reca****),모든것을 내려놓고 싶은 작품.  
11-10-2018,2018,11,10,15:13,토요일,10,3,0,성환(tom7****),내가 2만 번째로 간다 ㅎㅎ  
11-10-2018,2018,11,10,10:33,토요일,10,3,0,서동휘(chri****),죽기직전에 이 영화를 봐라 살아야 할 이유 하나가 생기는 것이다..그 만큼 이 영화는 애들말로 개 씹 띵작이다. 꼭 봐야한다. 정말 미친듯이 좋다.  내 죽을뻔한 심정을 살렸다.죽을만큼 씹명작이라 10000번 추천한다. 특히 아빠 어디가란대사는 최강  
11-7-2018,2018,11,7,18:41,수요일,10,3,0,최윤석(bi01****),이 영화야 말로 금세기에 최고의 아웃풋이 아닐까  
11-7-2018,2018,11,7,17:45,수요일,10,3,0,okdk2689(oh66****),희대의 명작...감동의 대서사시....  
11-1-2018,2018,11,1,01:01,목요일,10,3,0,tgh7****,태권도 이즈 스테이트 오브 마인드~!  
10-30-2018,2018,10,30,15:04,화요일,10,3,0,이동호(ldh2****),강추 영화 PC 하드디스크가 날라갔습니다.  
10-29-2018,2018,10,29,03:30,월요일,10,3,0,액티브(booc****),아빠.. 일어나..!  
10-28-2018,2018,10,28,03:23,일요일,10,3,0,안녕하세요(favo****),주변사람들과 꼭 함께 봐야하는 영화입니다  
10-27-2018,2018,10,27,16:20,토요일,10,3,0,JBstax(tkdd****),삶이란 어쩌면 살아갈 가치가 있는게 아닌가.. 라는 생각을 일깨워준 영화였습니다. 그래서 가끔 우울할때마다 좋아하는 너구리라면과 김치를 곁들여서 먹으며 보곤합니다  
10-26-2018,2018,10,26,11:30,금요일,10,3,0,euru****,클레멘타인을 보지않은자 세상을 논할필요없다  
10-25-2018,2018,10,25,04:41,목요일,10,3,0,느림보(love****),꼭봐라 두번봐라 지려서팬티갈아입고왔다  
10-23-2018,2018,10,23,21:23,화요일,10,3,0,kksg****,이영화를 보게해줘서 깐싸한니다  
10-14-2018,2018,10,14,13:53,일요일,10,3,0,쁘띠(qorb****),이영화의 평점을 감히 내손으로 낼수가 없다.... 만약 신이  있다면 그가 평점을 낼수 있을것이다.  
10-7-2018,2018,10,7,16:38,일요일,10,3,0,박현우(chae****),희대의 명작이다.. 죽기전에 꼭 봐야한다..  
10-7-2018,2018,10,7,00:45,일요일,10,3,0,ㅇㅠㅇ(sis0****),이 영화를 보지 않았다면 인생을 헛 산것이다  
10-4-2018,2018,10,4,11:40,목요일,10,3,0,Hex(vkeh****),이영화를 보고 암세포가 암이걸려 그암이 스스료 자가치료를 하고 암이 나았습니다  
10-3-2018,2018,10,3,21:09,수요일,10,3,0,슈타인즈(yuch****),지리는 명작 살면서 3번은 더 본듯  
10-2-2018,2018,10,2,20:11,화요일,10,3,0,김포SK(apc9****),재개봉혁명이 일어날때입니다!!  
10-2-2018,2018,10,2,01:35,화요일,10,3,0,펩시티에 살다(wins****),꼭 보고싶다!! 언젠가는..  
9-29-2018,2018,9,29,19:10,토요일,10,3,0,부비몬(bu01****),이 영화를 계기로 인생이 달라진다.  
9-26-2018,2018,9,26,23:02,수요일,10,3,0,번둥천개(jueu****),ㅎ...ㅎㅎ...ㅎ....  
9-26-2018,2018,9,26,15:06,수요일,10,3,0,사람비슷한거(tjrd****),제 인생작이에요 아직 안보신분들은 살아갈 이유가 하나 있으시네요 ;ㅅ;  
9-26-2018,2018,9,26,13:51,수요일,10,3,0,클레버(jmha****),언젠간 꼭 봐야지...  
9-26-2018,2018,9,26,12:39,수요일,10,3,0,달(xla1****),한국이 만들어낸 최고의 걸작  
9-25-2018,2018,9,25,23:35,화요일,10,3,0,Godhan(gksq****),지구 최고의 영화. 아빠 일어나!  
9-24-2018,2018,9,24,15:52,월요일,10,3,0,스마일(smil****),단언컨대 대한민국 영화사에 한 획을 그은 수작임  
9-24-2018,2018,9,24,13:45,월요일,10,3,0,스쳐가다(ee13****),단순히 감동이다라는 말로 이 영화를  감히 표현할 수 있을까. 단연컨대 이 영화는 인류의  역사에 한 획을 그을 것이다.  
9-24-2018,2018,9,24,03:53,월요일,10,3,0,만운(magn****),인류라면 꼭 보자♡♡♡:(  
9-23-2018,2018,9,23,23:04,일요일,10,3,0,크닭(har1****),갓 오브 무비 ...ㅋㅋ  
9-23-2018,2018,9,23,21:19,일요일,10,3,0,http****,하느님은 마지막 날 클레멘타인을 만드셨다.  
9-22-2018,2018,9,22,13:21,토요일,10,3,0,파이널강공(chie****),아빠!!!!10점 드리고 갑니다. 꼭 돈주고 사서 보세요.그 이상의 값어치를 합니다.  
9-22-2018,2018,9,22,11:49,토요일,9,3,0,관사마(ilov****),추석특선영화로 추천합니다  
9-15-2018,2018,9,15,10:58,토요일,10,3,0,박창규(gkdl****),내 숨어있는 감정을 깨워준 영화  
9-12-2018,2018,9,12,17:53,수요일,10,3,0,smse****,내 생애 10점을 줄 수 있는 영화가 있을 줄이야  
9-12-2018,2018,9,12,17:34,수요일,10,3,0,CCR(nada****),이건 정말 말이 필요 없다.  
9-12-2018,2018,9,12,17:22,수요일,10,3,0,짜대(pill****),10점은 이 영화에게 너무 당연한 평점이다  
9-12-2018,2018,9,12,15:23,수요일,10,3,0,별명(dktm****),명작입니다 꼭 보시길 바랍니다  
8-29-2018,2018,8,29,01:12,수요일,10,3,0,게이크(demo****),반박할 수 없는 한국 영화계의 전설이다 부족하지만 10점 드립니다  
8-27-2018,2018,8,27,23:12,월요일,10,3,0,어흥(ckht****),암이 암을 낳았다...  
8-22-2018,2018,8,22,22:47,수요일,9,3,0,프로피버스(mego****),스티븐 시걸의 출연이 생각보다 적었습니다. 안타깝더군요. 별점은 9점입니다  
8-18-2018,2018,8,18,04:48,토요일,10,3,0,지훈(wlgn****),간만에 진짜 영화라고 할 수 있는 영화  
8-16-2018,2018,8,16,12:27,목요일,10,3,0,cd(tkfk****),내가 태어난 이유는... 클레멘타인을 보기 위해서가 아닐까..  
8-15-2018,2018,8,15,00:32,수요일,10,3,0,행복의나라로(sgwa****),지렸다... 꼭 보세요!  
8-14-2018,2018,8,14,19:02,화요일,10,3,0,najk****,영화를 보고 머리털이 났습니다  
8-11-2018,2018,8,11,23:19,토요일,10,3,0,사막여우 조련사(love****),이 영화를 볼 수 있음에 감사합니다  
8-11-2018,2018,8,11,22:52,토요일,10,3,0,조예찬(xxsn****),클레멘타읻은 말이 필요없는영화  
8-7-2018,2018,8,7,15:29,화요일,10,3,0,oiii****,와우..ㅋㅋ 진짜 존잼이에요!  
8-6-2018,2018,8,6,21:39,월요일,10,3,0,디카프리오(kwd9****),이 영화를 보고 암이 나왔습니다  
8-5-2018,2018,8,5,19:20,일요일,10,3,0,yaro****,제 인생의 액션영화입니다  
7-16-2018,2018,7,16,22:36,월요일,10,3,0,싸대기(cafa****),내 인생의 갓 띵작....눈물없인 볼수 없는 영화  
7-16-2018,2018,7,16,11:11,월요일,10,3,0,김인겸(kje6****),한번보면 헤어나올수 없는영화....  
7-15-2018,2018,7,15,06:47,일요일,10,3,0,사쿵(mala****),왜 이영화를 극장에서 못 봤을까...  
7-14-2018,2018,7,14,08:32,토요일,10,3,0,신윤호(yunh****),말이필요한가? 난 아직도 이영화가 시리즈로 제작되면 좋겠다고 생각한다.  
7-12-2018,2018,7,12,23:26,목요일,10,3,0,pjwn****,적어도 나에겐 역대 최고의 영화  
7-10-2018,2018,7,10,10:56,화요일,10,3,0,vane****,전설의 그 클라멘타인이군  
7-9-2018,2018,7,9,11:50,월요일,10,3,0,축구계 명언 봇(kogu****),결국은 리중딱이라는 거자나  
6-26-2018,2018,6,26,17:40,화요일,10,3,0,Nick(apol****),영화 역사상 최고의 영화.영화를 보고 로또에 당첨이 됐어요!!!!  
6-10-2018,2018,6,10,18:01,일요일,10,3,0,레쓰비(zpzg****),주변에 연을 끈고싶은 인간이 있는가?? 묶어 놓고 이것부터 틀어라..  
5-22-2018,2018,5,22,00:36,화요일,10,3,0,2h5c****,"아빠, 일어나! 가 가슴깊이 남는 영화.  "
5-22-2018,2018,5,22,00:17,화요일,10,3,0,st04****,정말 감명깊게봤습니다 이런 명작을 이제서야보았네요 네이버평점 믿을만한것같습니다!  
5-21-2018,2018,5,21,22:21,월요일,10,3,0,어뷰즈(yjm2****),32년 인생 최고의영화  
5-21-2018,2018,5,21,22:09,월요일,10,3,0,서진우(8907****),이 영화는 한국 아니 세계를 대표하는 영화입니다.  
5-13-2018,2018,5,13,15:49,일요일,10,3,0,하히호(vcmm****),나의 표현의 한계가 고작 10점이라니.. 이거보고 눈물안나오면 병원가보세요  
5-13-2018,2018,5,13,15:08,일요일,10,3,0,Kimgoon(japa****),이 영화를 보고 병이 다 나앗다  
5-13-2018,2018,5,13,13:31,일요일,10,3,0,dras****,핵잼!!! 심심해서 뭘볼까하다 봤는데 감동적이구 좋네요  
5-13-2018,2018,5,13,01:10,일요일,10,3,0,김혜진(huny****),영화 평점 하락 방지용으로 작성  
5-13-2018,2018,5,13,01:10,일요일,10,3,0,RJ(rj04****),10점이란 점수에 걸맞는 작품.  
5-12-2018,2018,5,12,21:31,토요일,10,3,0,Aroha(sekk****),최고다 꼭봐라 제발 꼭봐  
5-12-2018,2018,5,12,20:35,토요일,10,3,0,eugu****,성지구경 잘 하고 갑니다  
5-12-2018,2018,5,12,20:27,토요일,10,3,0,seou****,후회하고 후회합니다. 이 영화를 이제서야 보았다는 걸요..  
5-12-2018,2018,5,12,20:12,토요일,10,3,0,dhdms04(a543****),전설의 영화... 지금 만나러 갑니다  
5-12-2018,2018,5,12,16:02,토요일,10,3,0,ICNY(shim****),보고 운 영화는 처음입니다 ㅠㅠ  
5-10-2018,2018,5,10,21:39,목요일,10,3,0,Pacific(maki****),감동 그 자체 내가 이 영화를 감히 평가할수없다  
5-10-2018,2018,5,10,15:22,목요일,10,3,0,VJ Zambo(morn****),말이 필요없다. 과거도 앞으로도 이보다 좋은 영화는 나올 수 없다.  
5-10-2018,2018,5,10,10:18,목요일,10,3,0,starring child(uk65****),이 영화의 개봉은 영화계 역사의 한획을 그은 사건이다  
5-7-2018,2018,5,7,18:43,월요일,10,3,0,roon****,인생최고의 영화!!!  
5-7-2018,2018,5,7,11:28,월요일,10,3,0,밤밤나성밤(1114****),이 영화를보고 살이빠졌읍니다  
5-6-2018,2018,5,6,14:17,일요일,10,3,0,Manaka(wnsg****),"최고의 영화!, 주말이 순삭!  "
4-1-2018,2018,4,1,22:16,일요일,10,3,0,James(krat****),영구소장 중입니다. 여러분들 꼭 보세요!!!  
3-31-2018,2018,3,31,13:26,토요일,10,3,0,수능특곽(c12m****),이런 좋은영화에게 찬사를 보내지 아니할수 없습니다  
3-28-2018,2018,3,28,23:17,수요일,10,3,0,스마일어게인(zmfp****),100점을 주고 싶지만 10점밖에 줄수없는 내 마음  
3-28-2018,2018,3,28,18:32,수요일,10,3,0,Peter Lim(lksl****),희대의 명장입니다.@@ㅇㅇㄹ  
3-28-2018,2018,3,28,12:01,수요일,10,3,0,tkaq****,지금보고왔는데요..하 ..이거뭐야?  
3-28-2018,2018,3,28,01:12,수요일,10,3,0,AsuRa BalBalTa(craz****),정말 명작입니다 두번보세요 .  
3-27-2018,2018,3,27,18:19,화요일,10,3,0,오동헌(ghdx****),세상이 망해갈때 꼭 챙겨야하는 영화중best1  
3-27-2018,2018,3,27,16:13,화요일,10,3,0,ksli****,무슨 말이 필요한가...  
3-25-2018,2018,3,25,12:36,일요일,10,3,0,Thomas Gang(mora****),성지 순례 왔습니다. 전설의 리뷰들 보고 갑니다.  
3-24-2018,2018,3,24,19:48,토요일,10,3,0,신촌노숙자(pjk_****),감히 역대급 최고의 영화  
3-24-2018,2018,3,24,18:30,토요일,10,3,0,민수(jms1****),나의 인생영화....  
3-23-2018,2018,3,23,18:28,금요일,10,3,0,Kryhme(voca****),평점 9점!관객수는 3천명당신은 선택받은 사람입니다.이영화를 영화관에서 본 당신이대한민국의 영화인입니다.클레멘타인 수호대에게 전한다.이영화를 사랑한다면 당장 영화관에서본3천명중 1명이라도 찾는다면. 선물을 선사하기바란다  
3-23-2018,2018,3,23,17:12,금요일,10,3,0,밥죠이(bobj****),나는 영화가 끝난후에 흐르는 눈물때문에 한동안 일어설수 없었다.  
3-23-2018,2018,3,23,15:55,금요일,10,3,0,Calin(shab****),10점을 줘야겠군요.  
3-22-2018,2018,3,22,20:24,목요일,10,3,0,poet****,"산타클로스, 네잎클로버, 불량써클, 핑클, 백태클...아무 것도 아닌 단어들 같은데 왜 눈에서 눈물이 나는지 도무지 알 길이 없습니다.  "
3-21-2018,2018,3,21,19:38,수요일,10,3,0,갸브리(wows****),퍼시픽림보단 재밌다 대박  
3-21-2018,2018,3,21,16:12,수요일,10,3,0,Viserys(viic****),'클레멘타인' 포스터만 보이면 다들 홀려서 여길 온다. 아마 지금은 지금 만나러 갑니다 클릭했다가 연관영화에 있는 클레멘타인 보고 다들 예전의 소름돋던 추억과 감동에 자신도 모르게 이끌려 10점 평점을 주고 가는 길일 것이다. 다들 똑같군  
3-20-2018,2018,3,20,23:15,화요일,10,3,0,thdw****,눈물이 멈추지가 않아요ㅜ  
3-20-2018,2018,3,20,20:53,화요일,10,3,0,고구마마(good****),로또 일등 되게 해주세요!!!  
3-20-2018,2018,3,20,10:10,화요일,10,3,0,lvmon(dbej****),앞으로 이런 영화를 다시 볼 기회가 있을까...?  
3-16-2018,2018,3,16,21:18,금요일,10,3,0,pghz****,"최고의 반전, 최고의 스토리  "
3-14-2018,2018,3,14,18:29,수요일,10,3,0,박지운(jiun****),나이먹고 보니까 느끼는바가 있네요 좋습니다...  
3-12-2018,2018,3,12,17:54,월요일,10,3,0,드림까까오(cele****),클레멘타인을 보기전에 영화를 논하지 말라  
3-11-2018,2018,3,11,13:17,일요일,10,3,0,hsjq8391(sh11****),140자로는 평가 불가능하다.  
3-10-2018,2018,3,10,21:48,토요일,10,3,0,차차(cami****),한줄평따윈 필요없다.  
3-10-2018,2018,3,10,18:40,토요일,10,3,0,삼돌이(snic****),항암치료 성공했습니다  
3-10-2018,2018,3,10,14:01,토요일,10,3,0,조이(good****),최고의 명작입니다.말이 필요한가요? 무조건 보세요  
3-10-2018,2018,3,10,11:13,토요일,10,3,0,모소대나무(psma****),순례왔습니다. 로또 되게해주세요.저와 제 주변사람 모두 건강하고 웃을 일 많게 해주세요.부족함을 알고 배움을 실천하는 지혜와 용기를 주세요.  
3-9-2018,2018,3,9,07:00,금요일,10,3,0,hys3****,아빠! 일어나!!  ㅠㅠ  
3-7-2018,2018,3,7,19:06,수요일,10,3,0,이왕지사(nun5****),엉엉 내인생 최고의 걸작 한번씩 꼭 보시길  
3-7-2018,2018,3,7,18:35,수요일,10,3,0,팔으(kdh0****),태권도를 세계에 알리는 명작  
3-7-2018,2018,3,7,14:28,수요일,10,3,0,조제(aha2****),평점이 너무 높아 꼭 보려합니다  
3-6-2018,2018,3,6,22:21,화요일,10,3,0,guse****,간혹 1점을 주시는 분이 있는데..그러시면 안됩니다. 잊을 수 없는 그 대사 “아빠~ 일어나!!”  
3-6-2018,2018,3,6,01:25,화요일,10,3,0,ㅇㅇ(hi87****),평생 평점이란걸 줘본적이 없는 사람인데. 처음으로 평점 주기위래 로그인 했습니다. 해외에도 널리 퍼져 다시는 한국을 무시하지 못했으면 하네요.  
3-5-2018,2018,3,5,02:02,월요일,10,3,0,어험(simi****),내 인생 최고의 영화 ㅠㅠㅠㅠ  
3-4-2018,2018,3,4,18:59,일요일,10,3,0,dl99****,진짜 재미있네요 저의 내면의 한구석이 움직이는 영화입니다 여러분도 꼭 보시고 당신이 정상이구나 생각을 할 수 있기 바랍니다  
3-4-2018,2018,3,4,11:12,일요일,10,3,0,화공과 빌런(gnld****),역사가 높게 평가할 최고의 영화  
2-28-2018,2018,2,28,21:21,수요일,10,3,0,java****,재미와 감동 둘다 좋았다. 강력추천!  
2-28-2018,2018,2,28,20:44,수요일,10,3,0,올쿤회장(jeju****),꼭 보십시오. 한마디로 주옥같은 영화입니다.  
2-28-2018,2018,2,28,20:43,수요일,10,3,0,redb****,유네스코 기록 유산에 등재되어야 할 클래스.  
2-28-2018,2018,2,28,19:24,수요일,10,3,0,낙월향(dkdl****),정말 리뷰들보고 접햇지만 제평생 이런 영화는 처음입니다. 죽기전에  꼭봐야합니다. 진짜 이영화를보고 제 여드름과 혓바늘이 나았습니다. 만병통치약  
2-28-2018,2018,2,28,19:11,수요일,10,3,0,귀염쭈니(s251****),긴말안합니다. 감동입니다. ㅜㅜ  
2-28-2018,2018,2,28,18:34,수요일,10,3,0,꿀천사(asd7****),아껴두지마세요 꼭 보세요  
2-28-2018,2018,2,28,18:21,수요일,10,3,0,oo(daze****),정말 감동적인 영화...  
2-28-2018,2018,2,28,12:58,수요일,10,3,0,이군(leeg****),최고의 영화입니다. 진짜 리얼  
2-28-2018,2018,2,28,12:22,수요일,10,3,0,WaltzWaltMearsheimer(kbp1****),죽기전에 꼭 볼 영화 (뜻밖의 불로장생행)  
2-28-2018,2018,2,28,11:18,수요일,10,3,0,한규(hang****),이 영화를 보고 드래곤볼을 모아 기도하듯이주무시는 아버지 앞에서 외쳤습니다 “아빠 일어나”기적일까요 그 이후로 주무시질 않습니다이 영화는 제 인생 최고의 영화입니다감히 제가 평가할수가...  
2-28-2018,2018,2,28,08:39,수요일,10,3,0,lhj_****,띵작이다.. 엄지춱 춱췌  
2-28-2018,2018,2,28,03:36,수요일,10,3,0,장준혁(fuvm****),시험 전날 이 영화를 보고 만점 받았습니다. 감사합니다!  
2-28-2018,2018,2,28,01:37,수요일,10,3,0,아미노산(song****),내 장담하는데.. 그 누구라도.. 영화를 본후 10점을 주지 않을 수 없을 것이다.. 우리집 고양이도  울었다.. 냐옹 ㅠㅠ  
2-28-2018,2018,2,28,00:52,수요일,10,3,0,targ****,신이 인간을 만든이유는 이영화를 만들기위해서가 아니었을까...  
2-27-2018,2018,2,27,22:50,화요일,10,3,0,1004****,클레멘타인에 어디에서도 준적이 없는 별점 10점을 보낸다.  
2-27-2018,2018,2,27,20:55,화요일,10,3,0,Ddddddo(qwer****),그도 울고 나도 울었다 진정한 명작  
2-27-2018,2018,2,27,18:35,화요일,10,3,0,하막(hama****),한줄평만 읽어도 눈물이 절로 나요  
2-27-2018,2018,2,27,11:45,화요일,10,3,0,TenTen(luca****),내가 이영화를 볼 수 있다니... 진짜 감동이다.. 완벽한 명작...  
2-27-2018,2018,2,27,11:02,화요일,10,3,0,동훈5916(pete****),말해 무엇하겠는가. 눈을 감아도 그 여운 사라지지 않으니.  
2-27-2018,2018,2,27,10:56,화요일,10,3,0,노아(kaha****),이 영화를 본 자중 앞이 안보이는자 두눈 뜨게 할것이며 다리아픈자 스카이콩콩을 탈것이며 일어나지 않은자 텐트를 칠것이다  
2-27-2018,2018,2,27,09:49,화요일,10,3,0,더데이(air_****),지인 추천을 보게 되었는데 정말 눈물이 멈추지 않네요...부모님과 함께 보시면 더 좋을것 같습니다  
2-26-2018,2018,2,26,20:59,월요일,10,3,0,동명(took****),중학교 2학년때 남천동 kbs홀에서 전교생이 단체관람했었지 졸라 동준이형 시사회도 아닌데 와서 악수해주고 그때 내꿈은 동준이형 같은 사람이 되리라고 결심했었지  
2-26-2018,2018,2,26,12:23,월요일,10,3,0,karu****,클레멘타인을 보고 느꼈다. 찬란함을 가장한 비극이였다고이 영화를 보는 순간 이불을 붙잡고 봐야한다손수건으로는 부족할 정도  
2-26-2018,2018,2,26,11:19,월요일,10,3,0,gmld****,성지순례 왔습니다!!!  
2-26-2018,2018,2,26,03:09,월요일,10,3,0,정지후니(jiho****),올림픽이 끝났다 여운이남는다오늘 밤 클레멘타인을 보았다 난 그 허전함을 채울 수 있었다 금메달 그 이상의 감동을 받았다  
2-26-2018,2018,2,26,02:37,월요일,10,3,0,똑똑똑페니(bulb****),영화를 본건지 도를 닦은건지 엄청나구나  
2-26-2018,2018,2,26,01:22,월요일,10,3,0,bear****,진짜 이건 재개봉해야된다  
2-22-2018,2018,2,22,16:18,목요일,10,3,0,샤아넬(ad11****),살면서 극장에서 본 영화 중에 처음 극장에서 본 우뢰매 다음으로 기억에 남는 영화입니다. 뇌리에서 잊혀지지가 않습니다.  
2-20-2018,2018,2,20,15:38,화요일,10,3,0,홍승우(dang****),이거 암세포가 암에걸려 OO 암이 낳는다는 전설의 영화아님?  
2-20-2018,2018,2,20,01:45,화요일,10,3,0,Danny Ocean(whun****),오~ 신이시여. 정령 사람이 만든 작품이옵니까? 진짜 이 영화는 제가 점수를 줄 수 없눈 희대의 명작입니다~!  
2-19-2018,2018,2,19,22:56,월요일,10,3,0,데스티니(cand****),아빠 일어나!!!!ㅠㅠ  
2-19-2018,2018,2,19,02:08,월요일,10,3,0,똑똑한놈(smar****),대단하다 엄청나군..  
2-18-2018,2018,2,18,17:51,일요일,10,3,0,나무(mugz****),아그만얄때 되지 않았냐 그러면 나도 십점 ㅋㅋㅋ  
2-14-2018,2018,2,14,14:51,수요일,10,3,0,꽈자마진(verg****),클레멘타인을 본후..앉을수가없습니다..계속 일어나서 지내고있어요...이명을 얻었어요. 감사합니다  
2-14-2018,2018,2,14,03:18,수요일,10,3,0,kggy****,와.. 이런 명작을 10점밖에줄수없다는 사실에 분노한다  
2-13-2018,2018,2,13,19:20,화요일,10,3,0,cool****,15년이 지나도 빛을 잃지않는 명작!!  
2-12-2018,2018,2,12,20:43,월요일,10,3,0,여신갓혜린(hw50****),시대의 역작 말이 필요한가?  
2-12-2018,2018,2,12,20:37,월요일,10,3,0,여인재변리사(soda****),최고의 영화..추천합니다  
2-12-2018,2018,2,12,14:22,월요일,10,3,0,에포네(minh****),이 영화에 대해서 말이 필요한가  
2-12-2018,2018,2,12,05:18,월요일,10,3,0,져니맨(yoo1****),어디를 까야할지 모르겠다  
2-10-2018,2018,2,10,12:20,토요일,10,3,0,손현익(chhu****),친구들이랑 보고 울었다.  
2-10-2018,2018,2,10,09:16,토요일,10,3,0,반딧불묘(mira****),"영화를본지 몇년이 지났지만 아직도 그때의 ""감정""이   오래감니다.  "
2-9-2018,2018,2,9,11:44,금요일,10,3,0,비움(viwo****),영화를 보지 않아도  평점을 줄 수 있을 만큼 감동적이다.  
2-7-2018,2018,2,7,12:08,수요일,10,3,0,김전구(kimj****),제 인생 영화입니다. 정말 강추!! 마지막에 너무 감동스러워서 눈물을 흘렸네요.  
2-7-2018,2018,2,7,09:56,수요일,10,3,0,영후리(khy8****),만병통치약 좀 더 일찍 이 영화를 알았다면  
2-7-2018,2018,2,7,03:02,수요일,10,3,0,mgsu****,"인간이 만들어 냈다고는 도저히 믿기지 않는, 세계 9대 불가사이 로 등록되어야 할 명작.  "
2-6-2018,2018,2,6,23:42,화요일,10,3,0,tkry****,전설의 영화  안봤다면 지금 당장 봐라...  
2-5-2018,2018,2,5,19:35,월요일,10,3,0,별명뭐하징(qkrw****),이 영화  꼭보세요 진짜..하 눈물콧물다뺏네요  
2-5-2018,2018,2,5,19:06,월요일,10,3,0,포격(swh1****),내 인생을 바꿔버린 최고의 영화였어요  
2-5-2018,2018,2,5,11:22,월요일,10,3,0,역대급4번타자김재환(myh1****),아빠 울지마~ 라고 포스터에 나와있는 꼬마가 주인공의 아들이 아닌 딸이었다는것을 오늘 영화보고 알았습니다. 역시 소문대로 명작이었습니다 ^^  
2-4-2018,2018,2,4,16:23,일요일,10,3,0,jung****,...네이버 영화 첫  평점..  
2-2-2018,2018,2,2,00:15,금요일,10,3,0,sogk****,jQuery22409616968243994968_1517497749916??:여기는 찌찌는 없으니 돌려차기나 보세요~!  
1-31-2018,2018,1,31,14:42,수요일,10,3,0,aaaa(chal****),"7번방의 선물, 신과 함께가 모티프 삼은 부모님의 사랑을 느낄 수 있는 영화. 위 두 영화를 보고도 눈물 안흘렸는데 클레멘타인을 보고 눈물 엄청 흘렸다.  "
1-29-2018,2018,1,29,22:19,월요일,10,3,0,leonel(7joo****),과연 전설적인 영화 태어나서 펑펑 울어보기는 처음이네요  
1-29-2018,2018,1,29,20:27,월요일,10,3,0,mica****,아빠 일어나 일어나 일어나  
1-29-2018,2018,1,29,11:33,월요일,10,3,0,사랑해(leed****),정말 보고싶네요. 근데 어디서봐야하죠  
1-29-2018,2018,1,29,02:44,월요일,10,3,0,예리남편(nhs2****),"한국 영화의 거장 ,, 한류의 시작  "
1-29-2018,2018,1,29,02:08,월요일,10,3,0,이재남(dlwo****),이런 감정과 상상력을 가지고 있어 인류는 진보한다  
1-29-2018,2018,1,29,02:02,월요일,10,3,0,cjdc****,아름다운 한 편의 시같은 영화  
1-28-2018,2018,1,28,03:10,일요일,10,3,0,룰룰랄(wogu****),영화를 보고난 후 내 눈과 귀에게 엄청난 고마움을 느꼈다..만약 이 둘 중 하나라도 없었더라면 클레멘타인을 시청하지 못했을테니까.  
1-27-2018,2018,1,27,00:08,토요일,10,3,0,쌍둥이여라(copi****),잘 놀라지 않는 성격의 크리스토퍼 놀란 감독도 깜짝 놀란 놀라운 논란의 명작!!  
1-25-2018,2018,1,25,09:03,목요일,10,3,0,모범택시(wolf****),이 영화를 보거전엔 몰랐지만영화를 보고 시간의 소중함이 얼마나 큰지 알게되네요감동입니다. 감동  
1-24-2018,2018,1,24,23:46,수요일,10,3,0,tnse****,이 영화는 신 의 영역 성전 이다 태초의 탄생이고 끝이다 죽기전에 봐야할 역작이다 아니 태어난 시초 부터 인류의 존재를 알수 있는 기원이다 이 알수 없는 부르찢음 갈망은 무엇인가 오 신이시여 당신은 보았는가 ~  
1-24-2018,2018,1,24,20:39,수요일,10,3,0,hororo(dire****),이런 영화를 혼자만 볼순 없죠  
1-23-2018,2018,1,23,15:14,화요일,10,3,0,이창희(ozkn****),"'가슴을 부여잡고 운다'는 말은 책에서나 읽었던 말인데, 그게 어떤 뜻인지 직접 체험하게 되었습니다. 영화가 끝날 때쯤 남방 단추가 다 뜯어질 정도로 가슴을 잡고 울고 있는 절 발견했습니다.  "
1-21-2018,2018,1,21,19:48,일요일,10,3,0,잉여(3569****),마성의 띵작 클레멘타임  
1-19-2018,2018,1,19,02:51,금요일,10,3,0,서강원(etyw****),"항상 사람들이 시간이 금이다 라는 말을 할때마다 나는 머리론 알아도 가슴으로 느끼지 못하였다. 하지만 클레멘타인을 보고 깨달았다. 100분이란 시간, 참 소중한 시간이라는것을.  "
1-18-2018,2018,1,18,19:26,목요일,10,3,0,손(hoon****),갸꿀이네요 ㄷㄷ 꿀쟘입니다  
1-18-2018,2018,1,18,14:03,목요일,10,3,0,뿡뿡이(juss****),이소룡이 그냥 커피라면 이동준은 티오피다  
1-16-2018,2018,1,16,13:12,화요일,10,3,0,따뜻한햇살(prot****),너무 보고 싶은 영화에요  
1-16-2018,2018,1,16,10:40,화요일,10,3,0,Yung Lean(djsn****),무슨 말이 더 필요하랴..  
1-15-2018,2018,1,15,13:58,월요일,10,3,0,헐띵파(ktg0****),"킹갓제너럴 짱짱 영화 유튜버. 김스카이의 하늘담에서 이 영화의 대해서 리뷰를 해서 보았습니다. 왜 이런 영화를 안보고 살았는지 자괴감이 느껴질정도로 매우 완벽한 영화였습니다. 이영화 무조건 10점입니다. 아니다. 100점,1000점 그이상의 영화.  "
1-15-2018,2018,1,15,01:07,월요일,10,3,0,come****,역시 네티즌 평점대로 재밌네요  
1-14-2018,2018,1,14,18:45,일요일,10,3,0,선우(jblb****),재밌게 잘 봤습니다. 여자친구랑 봤는데 여자친구가 엄청 울면서 보더라구요.. 저도 눈에 고인 눈물 애써 말리느라 고생많았네여  
1-14-2018,2018,1,14,04:32,일요일,10,3,0,고복수(sgr2****),아직도 가슴이 짠하다...이런영화 언제 또나올려나  
1-14-2018,2018,1,14,03:30,일요일,10,3,0,도미닉손(sdh0****),눈물이 흐른다. 이 영화는 절대 리메이크를 할 수 없을꺼다. 원작을 절대 못따라올꺼니까. 시걸의 연기와 이동준의 내면 연기에서 소름이 쫙 돋았다.  
1-13-2018,2018,1,13,09:33,토요일,10,3,0,juve(zi04****),클레멘타인을 뒤이을 작품은 없을것이다(없길 바란다)  
1-13-2018,2018,1,13,03:08,토요일,10,3,0,lIllIIlIIIlllIlIllIl(ydi1****),죽어도 여한이 없다는 말이 무슨 뜻인지 알게 해준 영화  
1-9-2018,2018,1,9,23:56,화요일,10,3,0,lehh****,10점뿐이없는게  안타까울  따름이다100점있으면100점주고싶다이영화를왜이제야봤는지 너무감동깊게 잘  보았다  
1-9-2018,2018,1,9,21:58,화요일,10,3,0,미리내(john****),클레멘타인한다. 살아야겠다  
1-9-2018,2018,1,9,11:43,화요일,10,3,0,MUGI(tumu****),내  인생  최고의  영화 입니다  
1-8-2018,2018,1,8,00:11,월요일,8,3,0,정민서(jms0****),이시대 초걸작이다!!  
1-7-2018,2018,1,7,18:34,일요일,10,3,0,범이(supe****),개명작십자집자아아아  
1-3-2018,2018,1,3,06:08,수요일,10,3,0,zzan****,죽기전에 꼭봐야하는 영화  
12-28-2017,2017,12,28,21:16,목요일,10,3,0,벌레먹은망고(tjeh****),이거 안보면 하ㅏㅏㅏ 지발 보소  
12-26-2017,2017,12,26,22:49,화요일,10,3,0,아잉잇팅(hyck****),걸작 시걸이 나와서 걸작  
12-24-2017,2017,12,24,02:35,일요일,10,3,0,ㄱ(muy1****),재밋다!!이영화를보고처음으로평점을남긴다  
12-22-2017,2017,12,22,13:45,금요일,10,3,0,피톤114(kimj****),김두영감독님 차기작 기다립니다 화이팅  
12-22-2017,2017,12,22,12:34,금요일,10,3,0,이공만(furk****),세기의 걸작 대부를 제친 작품  
12-20-2017,2017,12,20,20:31,수요일,10,3,0,Ulessusah(psju****),똥꼬쇼 보고싶어요 헤헤  
12-20-2017,2017,12,20,16:40,수요일,10,3,0,최양재(ooin****),영화 보고 나서 처음으로 로그인해서 리뷰를 남깁니다.  
12-19-2017,2017,12,19,22:20,화요일,10,3,0,박호성(over****),그냥 갓띵작 43분대에 명장면 나와요  
12-19-2017,2017,12,19,17:48,화요일,10,3,0,광개토(gyfy****),꼭 소장하고싶습니다 이 영화를 이미 보았다는 것은 이미 삶에 이유를 잃은 것입니다 이런영화를 이제야 보다니...  
12-19-2017,2017,12,19,16:24,화요일,10,3,0,수달(kjin****),하..인생 최고의 영화다.  
12-19-2017,2017,12,19,15:41,화요일,10,3,0,박재형(idsu****),보세요 두번 보세요아...  
12-19-2017,2017,12,19,12:58,화요일,10,3,0,우형제(duga****),곧 다가올 6살 3살 크리스마스 선물. 고민하다가 아직 옹알이하는 3살 둘째녀석이  또박또박 '아버지...클레멘타인 시청하고싶습니다' 라고 세상의 중심에서 외치더라구요 ...이 영화는 기적입니다  
12-19-2017,2017,12,19,12:05,화요일,10,3,0,시끄룽(roma****),최고중의 최고의 영화다.  
12-18-2017,2017,12,18,10:51,월요일,10,3,0,김경연(rudd****),너무 재밌고 감동받았습니다.  
12-18-2017,2017,12,18,10:38,월요일,10,3,0,ghcn****,이유불문 지구의 탄생이래 최고  
12-16-2017,2017,12,16,06:52,토요일,10,3,0,이고(leej****),김혜리씨의 연기는 정말 최고였다.  
12-16-2017,2017,12,16,06:40,토요일,10,3,0,초아(ths2****),말이 필요없는 명작입니다.  
12-16-2017,2017,12,16,04:15,토요일,10,3,0,음(boxe****),시작과 동시에 눈물이 흐르더니 끝나는 순간까지 영화 내내 멈추지 않더군요...정말이지 말로 표현할수가 없습니다. .  
12-16-2017,2017,12,16,03:28,토요일,10,3,0,우리가누구(sksm****),예고편만 봐도 눈물이ㅠㅜ  
12-16-2017,2017,12,16,03:21,토요일,10,3,0,phph****,숨막히는 액션의 향연 그 뒤에 몰려오는 숨막히는 감동내 생전 이렇게 작품성과 예술성 흥행성까지 어느 하나 부족함 없는 영화를 볼 수 있었다는게 믿기지 않는다  
12-16-2017,2017,12,16,01:17,토요일,10,3,0,YJ(hist****),후기만 봐도 감동이 밀려오네요  
12-15-2017,2017,12,15,21:57,금요일,10,3,0,juns****,수면 기피증이 나았어요  
12-15-2017,2017,12,15,17:39,금요일,10,3,0,Brico(nemo****),인생을 사랑하게 되었습니다... 감동  
12-15-2017,2017,12,15,17:24,금요일,10,3,0,데해헤헤헤햇(bybh****),와 감동×9999 꼭 보세요 강추  
12-15-2017,2017,12,15,17:08,금요일,10,3,0,rhww****,진짜 점수를 안줄 이유가없더라  
12-15-2017,2017,12,15,16:43,금요일,10,3,0,jeme****,인생영화 입니다~ 눈물이 나네요..  
12-15-2017,2017,12,15,16:39,금요일,10,3,0,야채스프(qnfg****),"""아빠! 일어나!!!"" 눈물없인 볼 수 없는 명작중에 명작입니다.  "
12-15-2017,2017,12,15,15:51,금요일,10,3,0,탁구부(psho****),연말연시에 가족과 함께 새해를 맞이하며 볼만한 영화로 추천합니다.  
12-15-2017,2017,12,15,15:16,금요일,9,3,0,골걔(le_o****),울고 싶을때마다 이영화를 본다  
12-15-2017,2017,12,15,12:49,금요일,10,3,0,대랑(supe****),이 영화 보고 아버지께 바로 전화드렸습니다..아버지 감사합니다. 사랑합니다  
12-15-2017,2017,12,15,12:28,금요일,10,3,0,bigb****,원래도 스티븐시갈 좋아하는데 이 영화는 진짜 더더더더 좋아하게 만들어 주었습니다 !강추하고 싶은 영화!  
12-15-2017,2017,12,15,12:22,금요일,10,3,0,너구리(z052****),왜 이걸 이제야봤지..  
12-15-2017,2017,12,15,11:49,금요일,10,3,0,뽀삐(jbkw****),곧 봅니다ㅎㅎ기대되네용  
12-15-2017,2017,12,15,11:35,금요일,10,3,0,jhho****,너무 감동적입니다 눈물이 ㅜㅜ  
12-15-2017,2017,12,15,11:33,금요일,10,3,0,정미남(s234****),네이버에서 평점보고 궁금해서 봤는데 역시..클레멘타인 사랑합니다  
12-15-2017,2017,12,15,11:02,금요일,10,3,0,486y****,평점 알바들에게 속지마라 한번은 볼만한 영화이다 영화 광해급 정도는 된다  
12-15-2017,2017,12,15,02:44,금요일,10,3,0,개털(dksr****),실망이란없는영화!! 소문대로 엄청남  
12-14-2017,2017,12,14,21:41,목요일,10,3,0,유찬(dbck****),올해의 영화로 추천합니다^^ 벌써 12번째 보는데요. 볼 때마다 마지막엔 항상 눈물을 흘린답니다. 1점 주면서 욕하는 분들 재밌는 걸 혼자 보려고 하는 이기적인 사람들입니다. 이 영화는 유네스코에 지정되어야만 합니다.  
12-14-2017,2017,12,14,16:18,목요일,10,3,0,AAAA(kbj8****),볼만하네요 잘봤습니다  
12-14-2017,2017,12,14,14:54,목요일,10,3,0,성큰(youw****),영화보다 댓글이 더 재밌다는 그 영화인가  
12-14-2017,2017,12,14,08:45,목요일,10,3,0,해운대좌동갈매기(doak****),명작중 명작임 벌떡 일어나게 만듬  
12-10-2017,2017,12,10,12:50,일요일,10,3,0,꼴리건 무서워(dldb****),"얼마나 망작인지 궁금해 DVD를 사서 보는순간 잘못된생각이었음을 깨달았다. 내가 왜 이제서야 이런 위대한 명작을 봤는지, 영화 마니아로서 부끄럽다. 또한 남에게 이 영화를 보여주기 싫어 평점에 장난치는것도 이해가 될 수 밖에 없었다  "
12-10-2017,2017,12,10,10:10,일요일,10,3,0,송염치약솔구두(dkdj****),왜 9.31밖에 되질 않는걸까..정말 억울하기 짝이없는 영화다...이 영화는 한국 영화 별점 1위로 빛나야하는 영웅같은 영화인데...  
12-9-2017,2017,12,9,22:05,토요일,10,3,0,hb16****,2017년에 들어 이 영화를 보게 되었다.... 이 영화를 보기 전 나의 삶이 정말 허탈하고 무의미하게 느껴진다... 왜 이 영화를 이제야 본것인가.... 내가 이렇게 많은 눈물을 흘리게 될줄이야...  
12-9-2017,2017,12,9,10:50,토요일,10,3,0,사랑in(esel****),예고편만 봤는데 불치병이 나았습니다.  
12-7-2017,2017,12,7,21:25,목요일,10,3,0,얍샵레고(gear****),아직 못 보셨나요?? 무엇을 망설이나요!!  
12-7-2017,2017,12,7,20:04,목요일,10,3,0,준익(rudi****),차영태 맞춤형 개명작 영화  
12-7-2017,2017,12,7,13:35,목요일,10,3,0,택아택아(wear****),본격 항암영화!!!!  
12-7-2017,2017,12,7,07:28,목요일,10,3,0,정대영(memo****),타이탄 감독  수상소감이 생각 나네요 !나는 왕이다. 더이상 말이 필요한가요?믿고 보는 네이버 평점  
12-7-2017,2017,12,7,04:14,목요일,10,3,0,lyh(dldp****),진짴ㅋ댓글 도른자들 아 미치겠다  
12-6-2017,2017,12,6,12:42,수요일,10,3,0,oys7****,대단한 영화다  2002월드컵 이후로 국민을 하나로 묶다니....!!!!  
11-25-2017,2017,11,25,22:29,토요일,10,3,0,깡(yoro****),BC AC 그것은 괜히 만들어진 말이 아니였읍니다.  
11-20-2017,2017,11,20,14:37,월요일,10,3,0,돌스(2381****),대한민국 국민들의 단결력을 느낄수있는 영화!! 새삼 우리들의 단결력이 자랑스럽습니다!! 손에 손잡고~  
11-20-2017,2017,11,20,10:11,월요일,10,3,0,알리나(royb****),말이 필요없는 영화당신의 감동을 극한까지 끌어올리는...  
11-19-2017,2017,11,19,23:42,일요일,10,3,0,김재덕(dunh****),이런 명작을 이제야 봤는지... 고민하지 마시고 꼭 보시길 추천합니다.  
11-19-2017,2017,11,19,21:07,일요일,10,3,0,서영빈(tjdu****),한국영화의 영원할 이정표  
11-19-2017,2017,11,19,05:36,일요일,10,3,0,특수전(kc10****),안봐도 10점드립니다  
11-19-2017,2017,11,19,04:09,일요일,10,3,0,atom****,인생최고의영화ㅠㅠㅠㅠ  
11-18-2017,2017,11,18,22:02,토요일,10,3,0,lott****,영화도 최고지만 우울할때 평점댓글 죽봐라 호감순 최신순 상관없다 즐거워진다  
11-18-2017,2017,11,18,13:02,토요일,10,3,0,hyun(khyu****),외화를 좋아하는 사람인데 지금까지 봐왔던 어떠한 외화보다 훌륭한 한국영화다.  
11-17-2017,2017,11,17,20:16,금요일,10,3,0,su69****,영화끝날때쯤 아버지와 껴안고 울었습니다. 어머니와 10년전 이혼하신후 한번도 서로 얘기하지않고  눈빛도 마주치지 않던 아버지와 말이죠.  
11-13-2017,2017,11,13,09:37,월요일,10,3,0,nono****,한국영화의 대거장 꼭보셈  
11-12-2017,2017,11,12,23:22,일요일,10,3,0,페니인구(tuyb****),두번 없을 명작...!!!  
11-7-2017,2017,11,7,02:42,화요일,10,3,0,로멜루 육각수(wjdc****),천명관객 돌파.. 내인생최고  
11-6-2017,2017,11,6,20:53,월요일,10,3,0,최고(vict****),말이 핗요 없는 명작 ㅇㅇ  
11-6-2017,2017,11,6,00:05,월요일,10,3,0,쥔(kyib****),말이 필요없는 명작...  
11-5-2017,2017,11,5,23:46,일요일,10,3,0,Dope(kdw1****),최곱니다.  제 영화 인생중에 최고로 꼽힘  
11-5-2017,2017,11,5,02:35,일요일,10,3,0,anvY(qkrw****),나의 인생은 클레멘타인 하나로 설명이 가능하다  
10-24-2017,2017,10,24,22:41,화요일,10,3,0,MrTheQ(vent****),명성은 들었습니다만 정말 그 한계가 어느정도인지 알고 싶네요. 곧 찾아서 볼려고 합니다.  
10-24-2017,2017,10,24,15:43,화요일,10,3,0,여민이아빠(nian****),이제서야 이 영화를 봤다는게.... 가히 충격적이다  
10-24-2017,2017,10,24,10:39,화요일,10,3,0,호롱불(amcs****),"말이 필요없다. ""Legend""  "
10-24-2017,2017,10,24,10:02,화요일,10,3,0,베텔기우스(mell****),제가 한국사람이란게 자랑스럽습니다  
10-23-2017,2017,10,23,22:50,월요일,10,3,0,필링느낌(xmkl****),아빠 일어나~에서 어느새 울고 있는 나 자신을 발견했다  
10-21-2017,2017,10,21,21:01,토요일,10,3,0,tkfka(kay_****),"보는 순간 자신이이제까지 무슨 영화를 봐왔던건지 부끄러웠습니다,, 낚시라시는 분들 보고 말하세요 진짜  "
10-20-2017,2017,10,20,16:16,금요일,10,3,0,bieyrd(vdqv****),안봤지만 이미 재밌습니다.... 개꿀잼입니다  
10-20-2017,2017,10,20,13:25,금요일,10,3,0,출루머싱 김출루(ljw9****),최고의영화 영화역사상 이렇게 완벽한영화는 없었다!  
10-20-2017,2017,10,20,12:56,금요일,10,3,0,고무장갑(kth1****),눈뜨고 볼수 없어서 눈 감고 본 영화  
10-15-2017,2017,10,15,18:23,일요일,10,3,0,wngud119(wngu****),오~~김두영  오~~클레멘타인  
10-15-2017,2017,10,15,10:42,일요일,10,3,0,시크릿(rpgh****),희대의 역작 그 한마디면 충분하다  
10-13-2017,2017,10,13,22:44,금요일,10,3,0,화양동인사불성(coke****),야이 정신나간 미친사람들..  
10-12-2017,2017,10,12,15:38,목요일,10,3,0,Human Dream(jung****),역시 스티븐시걸은 작품보는 안목이 높더군요. 요즘은 왜 이런 명작이 없을까..  
10-8-2017,2017,10,8,19:02,일요일,9,3,0,열시미(lese****),이거 진짜 잼있어요? 아직 안봤는데.. 화면은 좀 허접해 뵈는데....  
10-8-2017,2017,10,8,18:48,일요일,10,3,0,우리집고양이(poo_****),장난이아니다  재평가 받아야한다.  
10-8-2017,2017,10,8,16:10,일요일,10,3,0,lwh1****,암세포가 암에걸려 암이낳았다 ㅋㅋ  
10-4-2017,2017,10,4,22:12,수요일,10,3,0,jms3****,공백을제외하고10자이상십자  
10-4-2017,2017,10,4,22:10,수요일,10,3,0,wlsr****,추석을 맞아 보게되었습니다울고오겠습니다  
10-4-2017,2017,10,4,22:00,수요일,10,3,0,김민상(alst****),굿 내인생 최고의 영화ㅡㅡㅡ  
10-4-2017,2017,10,4,20:19,수요일,10,3,0,순록(jang****),한국영화의 역사 그자체  
10-4-2017,2017,10,4,17:01,수요일,10,3,0,바람이부는대로(huss****),죽기 전에 꼭 봐야할 영화  
10-4-2017,2017,10,4,16:17,수요일,10,3,0,AWESOME(unit****),ㅅㅂ나혼자 보기 아깝다. 여러분도 꼭 봐라ㄷㄷ  
10-4-2017,2017,10,4,15:23,수요일,10,3,0,선샤인(hnhh****),최고의 영화몰입해서 봤어요  
10-4-2017,2017,10,4,14:36,수요일,10,3,0,레이니(hyun****),아빠!!! 일어나!!!!  
10-4-2017,2017,10,4,08:00,수요일,10,3,0,신원철(ksps****),추석 기념 클레멘타인 추천넣고~~~  
10-2-2017,2017,10,2,21:30,월요일,10,3,0,히히히(hind****),굿영화입니다 꼭보세요  
10-1-2017,2017,10,1,23:56,일요일,10,3,0,검색(ahgu****),난 평점을 매기지않겠다. 이10점은 평점을 안매길수없기때문에 어쩔수없이 고른10점이며 이영화는 내가 감히 평점을 매길수없는 영화다. 앙 기모띠.  
9-29-2017,2017,9,29,14:29,금요일,10,3,0,JS(syk1****),와 진짜 클레멘타인 보고 태어나서 처음으로 울었습니다ㅜ  
9-28-2017,2017,9,28,20:47,목요일,10,3,0,김민승(kmsj****),"이영화는 과연 무엇으로 표현할까요? 뼛속까지 소름이 돋는것과 동시에 어릴적 엄마의 몽둥이때문에 흘렸던 푸르고 맑은 눈물이 수많은 인생의 흐름후에 다시 흘릴수 있었던 영화일까요. 이영화를 본 순간, 전 갓 튀긴 팝콘을 떨어뜨릴수밖에 없었습니다.  "
9-27-2017,2017,9,27,14:50,수요일,10,3,0,회자정리(djni****),시대를 잘못 타고난 비운의 명작  
9-21-2017,2017,9,21,00:15,목요일,10,3,0,INiXiE(ligh****),늦게나마 명작을 확인했다  
9-19-2017,2017,9,19,18:57,화요일,10,3,0,ks8k****,영화계 최고의 미스터리는 클레멘타인 2편이 제작되지 않는것이다.  
9-16-2017,2017,9,16,19:45,토요일,10,3,0,진지성(sds6****),심청이가 공양미 삼백석 주고 시청햇다던 영화가 이영화인가요?  
9-15-2017,2017,9,15,19:00,금요일,10,3,0,alsd****,성지순례 왔습니다..  
9-14-2017,2017,9,14,04:25,목요일,10,3,0,강문정(arom****),이 놀라운 영화를 이제서야 보다니한국영화는 클레만타인 전과 후로 나뉜다는 말이 실감나네요  
9-13-2017,2017,9,13,10:19,수요일,10,3,0,soon****,"좋은 영화, 강력추천합니다.  "
9-12-2017,2017,9,12,22:15,화요일,10,3,0,SIN(woo1****),"이 영화를 보고 새로운 형용사가 생겨버렸다. 나는 감동적이거나 슬플때, 기쁠때, 감탄할때, 사랑할때  통틀어서 이렇게 말한다 . 클레멘타인.  "
9-12-2017,2017,9,12,17:22,화요일,10,3,0,인생뭐있(1894****),평점이 너무 높아서 기대하고 봤는데.. 확실히 감동은 있더라.  
9-12-2017,2017,9,12,00:54,화요일,10,3,0,교라구요(kiho****),엄청난 감동이었습니다. 왜 이제 봤을까요?  
9-10-2017,2017,9,10,20:03,일요일,10,3,0,범(bbub****),ㅎㅎ클레멘타인ㅎㅎㅎ  
9-10-2017,2017,9,10,14:57,일요일,10,3,0,760807(dokv****),전설이라 불리우는 명작이라면서요  
9-9-2017,2017,9,9,21:48,토요일,10,3,0,끝(happ****),정말 명작입니다...  
9-7-2017,2017,9,7,10:21,목요일,10,3,0,skdl****,최고다  희대의 명작이다  죽기전에 봐야할영화  
9-7-2017,2017,9,7,02:04,목요일,10,3,0,정한빈(hami****),영화라 쓰고 클레멘타인이라 읽는다.  
9-6-2017,2017,9,6,23:36,수요일,10,3,0,ssmi****,OO 이런 피융신같은것들아 밑에 좀 내려서 어떤 블로그에서 이 영화가 저주받은졸작 이라는 사실을 알게되고 이 평점의 진정한 의미를 알게됬다.  
9-4-2017,2017,9,4,16:53,월요일,10,3,0,kyun****,와 진짜 잼있다~~^^  
9-4-2017,2017,9,4,16:16,월요일,10,3,0,소망(oneb****),이 영화를 보고 3번째 다리가 힘을 찾았네요!  
9-4-2017,2017,9,4,15:05,월요일,10,3,0,didi****,외국사람인데 이영화를 보고 귀화를 결정했습니다.알러뷰 한국 알러뷰 클레맨타인  
9-4-2017,2017,9,4,15:00,월요일,10,3,0,0100110(qkfl****),평점은 배신하지않네요  
9-4-2017,2017,9,4,14:45,월요일,10,3,0,꼬마(dude****),와 오랜만에 본 인생영화....  
9-4-2017,2017,9,4,14:26,월요일,10,3,0,adam****,재밌다 시간나면 보는걸 추천한다  
9-4-2017,2017,9,4,14:06,월요일,10,3,0,토사구팽(leed****),내인생 명작이다 정리하고 싶은 이성이랑 같이 보면 된다  
9-4-2017,2017,9,4,12:57,월요일,10,3,0,cjwk****,이영화는 내인생의 길잡이같은영화 짱임  
9-4-2017,2017,9,4,12:44,월요일,10,3,0,Fast Pace(tkql****),"내게 눈, 귀, 입이 있는 이유는 클레멘타인을 보고 듣고 전파하기 위해서이다  "
9-4-2017,2017,9,4,12:21,월요일,10,3,0,임호준(joke****),클레멘타인과의 오후. 최상의 조합입니다.  
9-4-2017,2017,9,4,12:05,월요일,10,3,0,김동진(west****),한국최고의 액션영화재개봉시 800만 예상  
9-4-2017,2017,9,4,02:00,월요일,10,3,0,labo****,이런 명작을 이제서야 보다니... 누군가 인생영화가 뭐냐고 물어보면 망설임 없이 대답할만한 작품이 이제 생겼습니다.  
9-3-2017,2017,9,3,17:24,일요일,10,3,0,namz****,재개봉 계획 없나요? 아이맥스로 보고싶다  
9-3-2017,2017,9,3,14:14,일요일,10,3,0,SYL(syl4****),도대체 더 무슨말이 필요한가  
9-3-2017,2017,9,3,13:45,일요일,10,3,0,스트렙실(zsu2****),아무리 봐도 명작입니다...  
9-3-2017,2017,9,3,12:40,일요일,10,3,0,개나리(zpzg****),감동의 여운이 오래갑니다...  
9-3-2017,2017,9,3,12:25,일요일,10,3,0,뿌잉삐용(judg****),이걸 보고 자고있던 저의 세포 하나 하나가 일어났습니다  
9-2-2017,2017,9,2,07:26,토요일,10,3,0,yios****,우리세대에 다시 이런 명작이 나올수 있을까  
9-2-2017,2017,9,2,03:08,토요일,10,3,0,스탠답(yogi****),기원 후 두 번의 1000년이 지나고 드디어 탄생한 작품. 앞으로 또 두 번의 1000년이 다시 지나면 이 정도 작품이 다시 탄생할 수 있을는 지...  
9-2-2017,2017,9,2,02:09,토요일,10,3,0,mits****,"가을의전설을 내인생의 최고의 영화라고 단정지었고ost인 the rudlows는 수년째 알람음이었다하지만 이 걸작을 본 후 섣부른 판단을 한 날 용서할 수 없었다한달전부터  ""아빠일어나"" 로 알람음을 바꾸었는데 일어날때마다 감동의 눈물이 앞을가린다  "
9-1-2017,2017,9,1,16:29,금요일,10,3,0,꿀꿀꿀이(ghde****),"제가 눈이 보이지않았는데 ""아빠 일어나""라는 소리를 듣고 어느덧 눈을 뜨게 되었습니다.  "
8-30-2017,2017,8,30,13:07,수요일,10,3,0,엉부이(lyso****),말이필요없는 최고의 띵작  
8-30-2017,2017,8,30,12:45,수요일,10,3,0,메이크굿(inuk****),최애영화 안본사람 꼭 보시길  
8-29-2017,2017,8,29,15:47,화요일,10,3,0,atap****,불후의 마스터피스!!!!  
8-29-2017,2017,8,29,10:34,화요일,10,3,0,장산커(bine****),평점과 영화평 보니 꼭 봐야하겠네요.  
8-29-2017,2017,8,29,08:09,화요일,10,3,0,김민준(fran****),"깨달았다 ,유는 무로 창조된다.  "
8-29-2017,2017,8,29,08:02,화요일,10,3,0,꺄르륵(ehdd****),와 진짜 이영화는 진짜..와  
8-28-2017,2017,8,28,19:18,월요일,10,3,0,Webs(wlst****),힌국 역사에 길이 남을 영화  
8-27-2017,2017,8,27,23:42,일요일,9,3,0,토레스비야(3wou****),한국의 에드우드. 그와 함께 지구에 있다는것에 감사합니다.  
8-25-2017,2017,8,25,23:06,금요일,10,3,0,이슬이(seo1****),말이 필요 없는 영화 최고다  
8-24-2017,2017,8,24,23:57,목요일,10,3,0,FANA(0r0l****),갓갓갓 무슨말이 필요한가  
8-24-2017,2017,8,24,06:50,목요일,10,3,0,김지선(rlaw****),올해 본 영화 중 제일 감명깊었습니다. 시간이 안아까운 영화였습니다.  
8-24-2017,2017,8,24,05:57,목요일,10,3,0,end(endl****),이영화가 베니스영화제에 못나갔다니 정말 이해가 안되네요  
8-21-2017,2017,8,21,17:10,월요일,10,3,0,zero****,야동에 김본좌가 있다면 영화엔 클레멘타인이 있다.  
8-20-2017,2017,8,20,21:38,일요일,10,3,0,틱택톡(lhyo****),꼭 봐라  역대급 띵작이다  
8-17-2017,2017,8,17,16:21,목요일,10,3,0,마하데바(down****),인생 최고의 영화...  
8-16-2017,2017,8,16,12:23,수요일,10,3,0,리퍼(hyos****),감사합니다.. 이영화를 보게 해주셔서  
8-16-2017,2017,8,16,05:44,수요일,10,3,0,토리토이(tory****),살아야될 이유를 알게해준 영화. 이 영화는 생명입니다.  
8-16-2017,2017,8,16,04:03,수요일,10,3,0,rlag****,세상엔 아직도 볼 영화가 많다  
8-16-2017,2017,8,16,00:58,수요일,10,3,0,자갈짱(picn****),역대 최고의 영화입니다  
8-15-2017,2017,8,15,18:35,화요일,10,3,0,만나서반가워요(asz0****),"""아빠, 일어나!"" 할 때 전미가 울었다.  "
8-14-2017,2017,8,14,22:55,월요일,10,3,0,김민재(ddir****),죽기전 봐야하는영화 꼭입니다  
8-13-2017,2017,8,13,03:11,일요일,10,3,0,밀덕(dong****),아....아....  
8-12-2017,2017,8,12,19:54,토요일,10,3,0,리오넬최씨(suns****),군대를 다시 가도 좋으니..클레맨타인을 개봉한 2004년으로 돌아가 극장에서 펑펑  울며 보고 싶습니다...아빠 일어나 대한민국 일어나!!  
8-11-2017,2017,8,11,22:02,금요일,10,3,0,워킹데드(byza****),이정도 수작이 어딨다고 1점 테러를 하는지...  
8-10-2017,2017,8,10,20:41,목요일,10,3,0,엘롯기화이팅(cjft****),흑흑 평생 잊지못할작품  
8-10-2017,2017,8,10,20:37,목요일,10,3,0,가비(psm6****),왜 이제서야 이영화를 봤을까...친구 10명에게 추천해주고 싶어서 10점 드립니다  
8-10-2017,2017,8,10,20:35,목요일,10,3,0,최민수(mins****),말이 필요없는 희대의 명작  
8-10-2017,2017,8,10,19:21,목요일,10,3,0,빈디젤(inew****),인생 대작입니다 꼭 보시길 10번 보시길!!  
8-10-2017,2017,8,10,17:34,목요일,10,3,0,라이타(s1lo****),이제서야 이영화를 접하다니.. 지금까지의 인생은 헛이였네요.  
8-10-2017,2017,8,10,17:00,목요일,10,3,0,식어버린홍차(urus****),한국 영화계는 이 영화의 제작 전과 후로 나뉜다.  
8-9-2017,2017,8,9,03:21,수요일,10,3,0,막시무스(1kka****),어머 전원주씨 젊은것 봐 ~~~  
8-7-2017,2017,8,7,16:08,월요일,10,3,0,뒷북(ran0****),오늘 내일 하던 할매한테 이 영화를 보여줬더니 생리가 다시 시작되었어요  
8-7-2017,2017,8,7,14:44,월요일,10,3,0,Forever Man(luca****),탈모로 고생중에 이 영화를 본 후 머리털이 다시 자라기 시작했다.  옆집에선 집나간 와이프와 가출했던 딸내미가 비됴방에서 이 영화보고 눈물 흘리며 귀가 했다 하드라.  
8-6-2017,2017,8,6,23:28,일요일,10,3,0,HJ(real****),이동준의 똥꼬쇼를 보기전에 한번 꼭 봐야하는 영화. 강추.  
8-6-2017,2017,8,6,02:42,일요일,10,3,0,dldm****,91년에 터미네이터2를 첨봤을때 그 충격을 클레멘타인을보며 한번 더 느낌 이게 어떻게10년도 더지난 영화라니...  
8-5-2017,2017,8,5,21:27,토요일,10,3,0,7175****,평점이 높아 보고 말았습니다.  모든게  치유되는군요  
8-5-2017,2017,8,5,19:34,토요일,10,3,0,gvsbzbz123(onet****),이거 안본사람도있음?명작이다 당장가서 보도록하자  
8-5-2017,2017,8,5,15:11,토요일,10,3,0,MVP(wins****),이 영화가 지금 개봉한다면 3000만 관객은 넘을것이다. 희대의 역작!  
8-5-2017,2017,8,5,14:49,토요일,10,3,0,ch46****,내가 죽기전에 하고 싶은일을 하라고 하면 이영화를 100번 볼것이다.... 그정도로 감동적인 영화...ㅠㅠ  
8-4-2017,2017,8,4,10:23,금요일,10,3,0,nepe****,"이렇게 감동적인 작품이 너무 저평가받는것 같다.""아빠 일어나!""에서 이미 내 눈시울은 붉어져 있었고엔딩 크레딧이 올라오는순간 참았던 눈물이 쏟아져나왔다.  "
8-4-2017,2017,8,4,07:43,금요일,10,3,0,qazw****,이런 명작을 학교친구들에게 추천해주고 왔습니다  
8-3-2017,2017,8,3,12:54,목요일,9,3,0,bobs****,이 악마 같은 사람들 같으니라고....  
8-3-2017,2017,8,3,12:19,목요일,10,3,0,미누(alsd****),나이가 들면 눈물이 많아진다는데 그나마 젊을때 본게 다행이네요  나이 먹고 봤으면 저희집이 수해지역 될뻔 했습니다.  
8-3-2017,2017,8,3,03:54,목요일,9,3,0,베짱베짱(hpla****),리얼보다 완성도가 떨어져서 별 하나 뺍니다  
7-28-2017,2017,7,28,17:47,금요일,10,3,0,상시운전중(rrr2****),"남자는 살면서 3번 울어야한다고 하죠.첫번째, 클레멘타인을 볼때.두번째,로 볼때입니다.  "
7-28-2017,2017,7,28,11:12,금요일,10,3,0,Myer(sktf****),명작을 비로소 보게 되었습니다  
7-28-2017,2017,7,28,00:21,금요일,10,3,0,어(tmdw****),키야아이이이아아아지렴다  
7-27-2017,2017,7,27,18:13,목요일,10,3,0,루키(jmsl****),"요즘 이런 영화를 만들 수 있을까 싶네요...이 영화는 다음 세가지로 표현할 수 있습니다. 리얼 액션, 가슴저미는 멜로, 가족애사람들은 평점 장난으로 올려놨다...그런 말을 하지만 전 진심으로 저 세가지를 느꼈습니다.  "
7-27-2017,2017,7,27,14:45,목요일,10,3,0,2685****,제가본영화중에 제일 xx 입니다 저 x 는 상상의 맡기겠습니다       사랑해요 클레멘타인 ♥  
7-27-2017,2017,7,27,06:04,목요일,10,3,0,cold****,내가 이 영화에 10점을 주는 이유는 10같은 영화이기 때문입니다.  
7-20-2017,2017,7,20,23:36,목요일,10,3,0,이재원(dsdf****),아빠아아아 일어나아아 라는 사랑이의 한마디에 그리고 다시 이루어진 화목한 가정에 난 오늘도 다시 뜨거운 눈물을 흘렸다  
7-18-2017,2017,7,18,12:44,화요일,10,3,0,노른남자(khgo****),"사랑이의 ""아빠 일어나"" 를 듣고 죽었던 내 똘똘이가 곧추 섰다.  "
7-18-2017,2017,7,18,10:01,화요일,10,3,0,쿨하게살자(bong****),"오케 굿 무비...,,  "
7-14-2017,2017,7,14,08:37,금요일,10,3,0,세라산업 조형진 대리(whqk****),이번휴가에  대한민국역사상 최고의 감동을 이 영화로 느껴보세요.  
7-13-2017,2017,7,13,16:04,목요일,10,3,0,꽁떡역(subi****),대한민국 영화계의 최후의 보루  
7-11-2017,2017,7,11,17:26,화요일,10,3,0,qnf4****,한국 영화계에 길이남을 명작이다.  
7-10-2017,2017,7,10,13:31,월요일,10,3,0,So아즈(kaka****),말이 필요없습니다 대박입니다.  
7-10-2017,2017,7,10,10:15,월요일,10,3,0,진준호(wlsw****),너무 재밌어서 눈물이 날 지경  
7-10-2017,2017,7,10,09:47,월요일,10,3,0,Love(lawb****),이런 역대급 폭뿡감동 ㅠ 왜 요샌 이런영화 안나오나  
7-10-2017,2017,7,10,01:56,월요일,10,3,0,2son****,10년동안 백수 폐인 짓하던 옆집 형님께서 이 영화를 본후 무술을 시작하고 득도하여  현계사 주지스님이 되었다고 합니다  
7-10-2017,2017,7,10,01:22,월요일,10,3,0,히키(inmy****),이건 신이 만든 영화다!내 인생에 이런 영화가 다신 없을거다  
7-8-2017,2017,7,8,20:50,토요일,10,3,0,나혼자쌌다(ice_****),말이 필요없이 별점 10개  
7-8-2017,2017,7,8,15:27,토요일,10,3,0,y7u8****,멈추지가 않네요 눈물이...  
7-8-2017,2017,7,8,15:02,토요일,10,3,0,xhsp****,내손으로 이런평점을 적다니 감격스럽습니다 역사에 이름을 남기는것같습니다  
7-7-2017,2017,7,7,11:17,금요일,10,3,0,memorizer(2mem****),평점 유지를 위해 10점  
7-6-2017,2017,7,6,20:29,목요일,10,3,0,이종성(wogn****),선10점 후감상 10자  
7-6-2017,2017,7,6,13:13,목요일,10,3,0,와니카(yooh****),점수에 보태러 왔습니다~! 국내 최고의 영화중 하나라고 하죠.  
7-6-2017,2017,7,6,09:59,목요일,10,3,0,crds****,리얼 보고 찾아 왔습니다 ㅎㅎ  
7-4-2017,2017,7,4,23:06,화요일,10,3,0,아빠딸(xcla****),딸을 둔 아빠로서 더 진한 감동을 느꼈습니다.  
7-4-2017,2017,7,4,11:49,화요일,10,3,0,yhyh777(yhyh****),말이 필요없는 지구상 최고의 영화. 아니 한 남자의 인생을 느낄수 있었습니다.  싸이코패스조차 감동받아 눈물을 흘릴 명작입니다.  
6-28-2017,2017,6,28,16:00,수요일,10,3,0,빛의수레(cars****),아빠!! 일어나.. 20세기의 기적  
5-5-2017,2017,5,5,18:45,금요일,10,3,0,Battle시미터(jame****),저는 이 영화를 보지 않았지만 이 영화를 표현하자면 사이다 입니다. 볼경우 사이다의 농도가 당신의 혈액농도보다 높아질것입니다.  
5-5-2017,2017,5,5,18:13,금요일,10,3,0,김첨지(dbrx****),명작.... 10점찍고감으다 ㅋ  
5-4-2017,2017,5,4,16:44,목요일,10,3,0,YngChng(ycpa****),명작입니닼명작이라고  
4-23-2017,2017,4,23,04:38,일요일,10,3,0,호떡집에 불이 났어요(gfor****),"내가 영화 20번 넘게 본 영화가 딱 3편 있다.  하나는 원빈의 아저씨, 또 하나는 권상우의 말죽거리 잔혹사, 그리고 마지막 하나가 클레멘타인이다. 이 3편의 영화를 초고화질로  다운받았는데, 이걸 외장하드에 넣어 자식들한테 대대로 물려주련다.  "
4-16-2017,2017,4,16,20:17,일요일,10,3,0,완전개(osun****),아빠 일어나! 아빠 일어나!  
4-15-2017,2017,4,15,21:42,토요일,10,3,0,000000(guli****),최고의 영화 인생영화 이다  
4-15-2017,2017,4,15,07:58,토요일,10,3,0,bjjmania(gusw****),이런 영화가 있었나 인생작 ㅜ  
4-14-2017,2017,4,14,23:50,금요일,10,3,0,스포(goda****),안보셨나요? 꼭보세요  
4-8-2017,2017,4,8,18:24,토요일,10,3,0,쉐도우팍(cono****),클레멘타인을 본 사람들은 다른영화를 보고 클레멘타인이라 말하지 않는다 ~  
4-8-2017,2017,4,8,18:24,토요일,10,3,0,쉐도우팍(cono****),클레멘타인을 본 사람들은 다른영화를 보고 클레멘타인이라 말하지 않는다 ~  
4-7-2017,2017,4,7,07:53,금요일,10,3,0,캉캉이(gun0****),이영화를안보았다면사는이유가없다  
4-7-2017,2017,4,7,00:08,금요일,10,3,0,화니(swai****),고작 별 10개는 사치이다 이 영화는 역사에 남겨서 후대에서 평가해야된다  
4-6-2017,2017,4,6,22:18,목요일,10,3,0,사자나미(last****),가장 아름다운 영화. 액션도 감동도 부성애도 느낄 수 있어서 마음 한켠이 뜨거워졌습니다.  
4-3-2017,2017,4,3,20:11,월요일,10,3,0,sdsg****,정말 재밌을듯 나중에 꼭보겠음  
4-1-2017,2017,4,1,23:45,토요일,10,3,0,황봉알100(msw1****),유네스코 문화유산으로 추진하자  
3-26-2017,2017,3,26,22:55,일요일,10,3,0,여러분사랑합니다(cann****),내가 평점을 꼭 줘야할거같아서 굳이 찾아들어오ㅡㅅ다  
3-26-2017,2017,3,26,20:23,일요일,10,3,0,Desire Drivers(taem****),직접 보지 않고는 절대 느껴볼 수 없는 이 감동!  
3-26-2017,2017,3,26,20:22,일요일,10,3,0,dltp****,짱짱맨 점수 대단하네ㅋㅋㅋㅋ  
3-26-2017,2017,3,26,09:53,일요일,10,3,0,줄리앙(hira****),안 보면 알수 없답니다.  
3-26-2017,2017,3,26,00:02,일요일,10,3,0,새벽엔커피(last****),하하핳ㅎ하핳하파하ㅏ파파하하  
3-25-2017,2017,3,25,19:23,토요일,10,3,0,백이(enjo****),"보통의명작들은 시간이지나면 ""아!,이것도있었지!""로 기억되지만클레멘타인은 무조건 처음부터이야기거리가되는 명작이다오늘도 이영화를안주삼아 한잔하러간다  "
3-23-2017,2017,3,23,20:21,목요일,10,3,0,HJ(yuki****),핫바가 먹고 싶어지는 영화  
3-15-2017,2017,3,15,20:47,수요일,10,3,0,털려도살자(jdh0****),내 생애 최고의 작품!!  
3-15-2017,2017,3,15,18:47,수요일,10,3,0,파란하늘(dlgy****),와 진짜 호불호가 갈리지않는 진짜중에 진짜영화!!매  
3-3-2017,2017,3,3,17:32,금요일,10,3,0,미지근한스무디(lkra****),'링'의 저주는 클레멘타인에서 부터 시작되었다.. 난 그 저주를 풀기 위해 여친에게 DVD를 빌려주기로 하였다. 나는 풀렸다. 그녀의 차례다.  
3-1-2017,2017,3,1,23:38,수요일,10,3,0,kod6****,이건 ㄹㅇ 띵작입니다. 꼭 보십시오  
3-1-2017,2017,3,1,12:37,수요일,10,3,0,티스퀘어(tntz****),대한민국 영화의 한 페이지를 장식할 걸작 중 걸작!  
3-1-2017,2017,3,1,00:42,수요일,10,3,0,jmpa****,깊은 감동 받았습니다.  
2-23-2017,2017,2,23,23:02,목요일,10,3,0,황상현(noul****),수출안하나요???(10자)  
2-14-2017,2017,2,14,01:26,화요일,10,3,0,임주헌(isw1****),앙앙등등등등딩동옹옹  
2-13-2017,2017,2,13,14:30,월요일,10,3,0,홍파니(hy96****),후에 인류의 다음세대에 전해것. 사랑. 행복. 그리고 클레멘타인.  
2-12-2017,2017,2,12,15:52,일요일,10,3,0,가나다라마바사(rms1****),무슨 말이 소용이 있겠습니까...  
2-9-2017,2017,2,9,18:40,목요일,10,3,0,주물(jumo****),이 영화를 보고 10 명의 친구에게 추천해 주자.  
2-5-2017,2017,2,5,00:13,일요일,10,3,0,갈대숲(iamc****),모 사이트에서 적극 추천을 받아 보게 됬습니다..그야말로 전설의 레전드...라고...다보고나서 전 도저히 자리에서 일어날 수 가 없었습니다. 나도 울고하늘도 울고같이보던 우리 딸도 울고...  
1-29-2017,2017,1,29,21:49,일요일,10,3,0,shje****,올드보이를 뛰어넘는 명작중의 명작인 한국영화 이런영화를 극장에서 보지 못한게 아쉽다  
1-27-2017,2017,1,27,16:42,금요일,10,3,0,pdbl****,클라멘타인은 나도 몰르게 눈물이 흘렸습니다이영화가 재미 있어서 웃겨서도 아닙니다그냥 뜨거운 눈물이 북받혀서 서럽게울었습니다 제작진이 대성통곡한 이유가이 한편을 보고 그들이 얼마나 고생하고 아팠다는것을알고 그들을 사랑하기로 했습니다 또 눈물이  
1-27-2017,2017,1,27,15:12,금요일,10,3,0,철견무적(kimt****),어릴땐 몰랐지만 이제야 알았다.치킨의 C는 클레멘타인이다.  
1-27-2017,2017,1,27,14:08,금요일,10,3,0,후후후후후(kaon****),최고의영화! 이생에본것중 가장최고였습니다 농후한연기와 탄탄한스토리까지! 소매로눈물을 흠쳤습니다  
1-26-2017,2017,1,26,10:25,목요일,10,3,0,000000(pubb****),아직까지도 감동이 가시질 않습니다. 요즘 매일아침 저의 하루일과가 되어버린 클레멘타인. 이동준 선생님 감사합니다.  
1-22-2017,2017,1,22,15:47,일요일,10,3,0,청임(smic****),인생 최고의 영화 2가지. 쇼생크 탈출 그리고 클레멘타인  
1-20-2017,2017,1,20,13:58,금요일,10,3,0,yess****,이 영화를 통해 대한민국 국민은 역시 하나라는 걸 느꼈다.  
1-19-2017,2017,1,19,20:30,목요일,10,3,0,호로(gunk****),꼭보시길...씹명작  
1-16-2017,2017,1,16,13:15,월요일,10,3,0,fbrj****,2004년 영화지만 이제서야 보았다.. 이제라도 알게되어 볼수있음에 하늘에 감사하고 용석이에게 감사한다.  
1-14-2017,2017,1,14,21:25,토요일,10,3,0,중국집(tale****),나같은게 어찌 이런 영화를 평가할 수 있단 말이오...  
1-14-2017,2017,1,14,14:54,토요일,10,3,0,잭그레인키(wind****),안본사람은있어도 한번만본사람은 없다.  
1-14-2017,2017,1,14,02:07,토요일,10,3,0,crea****,"무슨 말이 필요한가?,,,,  "
1-13-2017,2017,1,13,21:10,금요일,10,3,0,tjdgus(tjdg****),이 영화를 보지는 않았지만 표지만 봐도 답이 나옵니다.  
1-13-2017,2017,1,13,15:43,금요일,10,3,0,신유정(alys****),스...스고이!! 칸코쿠노 에이가와 스고이 데스!!  
1-13-2017,2017,1,13,12:51,금요일,10,3,0,김현규(davi****),구렇다니까 이것이 영화다  
1-12-2017,2017,1,12,01:11,목요일,10,3,0,shj1****,한국 영화는 클레멘타인 개봉전과 개봉후로 나뉜다.  
1-9-2017,2017,1,9,00:27,월요일,10,3,0,KATC(huns****),사람들은 그 누구보다 클레멘타인을 좋아하면서 왜 본심을 숨길까?  
1-7-2017,2017,1,7,15:06,토요일,10,3,0,리겔라이온(mmee****),친구 추천으로 봤어요.이런 명작을 이제야 보게되다니~어서 눈물닦고 친구년 잡으러 가야겠네요~^^제발!꼭 !보세요~^^  
1-6-2017,2017,1,6,02:19,금요일,10,3,0,필승(nexo****),시간을 앞서간 대우주상의 역작  
12-26-2016,2016,12,26,12:32,월요일,10,3,0,박준우(juno****),누가 쓰러진 상황만 보면 몇 년이 지난 지금도 아빠 일어나라는 대사가  아른거리더라.  
12-18-2016,2016,12,18,18:45,일요일,10,3,0,bric****,10대에 이 영화를 보고20대에 평점을 올리고지금은 30대가 되었네요역시 명작은 영원한 듯  
12-18-2016,2016,12,18,04:43,일요일,10,3,0,삑삑이(kay6****),"솔직히 클레멘타인을 안보고 영화를 논할 수 있을까? 영화를 보고나서인지 지금도 누워있는 아빠를 보며 소리치게 된다. ""아빠! 일어..나!""  "
12-17-2016,2016,12,17,20:50,토요일,10,3,0,없어(move****),한국액션영화의 한 획을 그은 영화  
12-17-2016,2016,12,17,11:16,토요일,10,3,0,학자(a2lo****),으리에살고 으리에죽고 으리에 또보고 으리에 평남기고 정말 으리 으리한 영화 의리  
12-16-2016,2016,12,16,21:08,금요일,10,3,0,hunt****,다봤습니다.슬프네요.아빠 이러나 이후 나오는 대사는 명언이였습니다.10점만점에10점  
12-16-2016,2016,12,16,01:56,금요일,10,3,0,홀든(summ****),내 영화 관람의 처음과 끝이라고 할 수 있는 영화!  
12-15-2016,2016,12,15,03:27,목요일,10,3,0,솔로몬(roma****),의리형님이출현하는 영화가 아닌가?  
12-15-2016,2016,12,15,03:17,목요일,10,3,0,김풉(rlav****),"내인생 최고의 영화다. 살면서 이런 영화를 접하기 힘들꺼란 예감이 든다. 언제, 어디를 살아도 이런 영화를 보기 쉽지 않다.  "
12-14-2016,2016,12,14,13:01,수요일,10,3,0,yooh****,한국영화는 클레멘타인 전과후로 나뉜다.  
12-13-2016,2016,12,13,18:19,화요일,10,3,0,상추(jewi****),난이거 5분만에 껏다. 눈물이 앞을가려 더이상은 볼 수 없어서... 내일부터 5분씩 봐야겠다.  
12-13-2016,2016,12,13,09:19,화요일,10,3,0,A380(skma****),이 영화는....극장에서 내려오면 안된다...  
12-12-2016,2016,12,12,17:00,월요일,10,3,0,drea****,글쎄 이 영화를 본 후의 이 감정들을 단순히 몇마디의 말들로 표현 할 수 있을까..이 영화를 다 보고 다시금 어린 시절의 꿈이 가슴 안에서 올라왔다.. 그래 나 다시 영화를 하고 싶다..진정한 예술이란 이런 것이다 라고 슬며시 얘기해주는 영화..  
12-12-2016,2016,12,12,15:37,월요일,10,3,0,Freesia(juha****),"우리 동네에는 이 영화가 개봉할 때 즈음부터, 잘 씼지 않는 가족이 늘었다. 클레멘타인을 보고 난 후, 눈물로 한바탕 샤워를 하게 되기 때문이다.  "
12-10-2016,2016,12,10,09:29,토요일,10,3,0,삭개오(holy****),최고의 영화 ㅠㅠ 고맙습니다 준 리  
12-2-2016,2016,12,2,00:41,금요일,10,3,0,비둘기(twel****),몇번을 봐도 정말 최고의 영화입니다. 꼭 세번 이상 보세요. 그래야 제대로된 감동을 느낍니다. 너무 시대를 앞서가서 좀 안타깝긴해요ㅠ  
12-2-2016,2016,12,2,00:32,금요일,10,3,0,김치번개(joy3****),희대의 명작... 역사에 길이 남을 작품.  
12-2-2016,2016,12,2,00:03,금요일,10,3,0,몽땅샤프(qazs****),진짜  대박인 것 같아요 강추  
12-1-2016,2016,12,1,14:06,목요일,10,3,0,불연(albu****),난 이영화가 재밌다. 신고해도 좋다.  
11-27-2016,2016,11,27,18:20,일요일,10,3,0,Mens(gmp8****),긴 말이 필요 없는 영화...  
11-23-2016,2016,11,23,09:40,수요일,10,3,0,iip_****,감사합니다. 살아있음을 느낍니다.  
11-23-2016,2016,11,23,05:16,수요일,10,3,0,니똥내똥(tutu****),이 영화 어떻게 보죠 보고 싶은데 다운로드도 안되고 님들은 어떻게 봤나요  
11-13-2016,2016,11,13,12:35,일요일,10,3,0,asd 111(nee8****),친구의 추천으로 봤어요. 역시 명작이라 그런지 감동이었고 평점도 높네요.  
11-12-2016,2016,11,12,21:41,토요일,10,3,0,엔젤라(kimg****),말이 필요없다 내 인생 최고의 영화이다  
11-12-2016,2016,11,12,19:40,토요일,10,3,0,바운드독(yisa****),우주 최고의 영화!!!  
11-11-2016,2016,11,11,13:54,금요일,10,3,0,석규이다(sukg****),태어났는가? 이 영화를 봐라 그것은 곧 삶의 지향점이니  
11-10-2016,2016,11,10,22:19,목요일,10,3,0,th트로우(kiky****),레알꿀잼 이런영화는나올수없다  
11-10-2016,2016,11,10,22:10,목요일,10,3,0,chri****,제발....cgv 재개봉해주세요  
11-10-2016,2016,11,10,21:24,목요일,10,3,0,jyjjang(jyjj****),내가 영화를보고 오열을하다니..  
11-8-2016,2016,11,8,02:18,화요일,10,3,0,lsh7****,최고입니다.클레멘타인  
11-3-2016,2016,11,3,04:13,목요일,10,3,0,우왕ㅋ굳(hhb0****),감사합니다 많은 것을 깨닫게 되었습니다. 자고일어나면 앞으로 저를 실망하지않도록 승승장구 하게 해주세요  
11-2-2016,2016,11,2,10:42,수요일,10,3,0,소나무(and1****),말이 필요없는 대한민국 네티즌 선정 최고의 영화.  
10-30-2016,2016,10,30,19:55,일요일,10,3,0,아르에타(jijc****),5번째 봅니다.. 이제 죽어도 여한이 없네요  
10-30-2016,2016,10,30,18:18,일요일,10,3,0,장재(hieg****),나는 이 명작을 평가할 가치가 없다  
10-29-2016,2016,10,29,23:54,토요일,10,3,0,다부술꺼야(kuku****),생략...말이필요하나요? 진짜  
10-28-2016,2016,10,28,00:12,금요일,10,3,0,미국급식충(torn****),인생영화.!!!쾅쾅쾅  
10-27-2016,2016,10,27,19:53,목요일,10,3,0,김혜리(khr0****),내 인생에 다시는 없을 최고의 영화.  
10-24-2016,2016,10,24,23:23,월요일,10,3,0,광찌릿(synm****),"평점이 높은데는 모두 이유가 있었군요.. 마지막 대사 ""아빠 일어나""가 가장 감동적이였습니다.  "
10-24-2016,2016,10,24,15:18,월요일,10,3,0,yeso****,이거는 정말 10점 밖에 못줘서 정말 아쉽습니다 . 분명히 새벽2시에 봤는데 4시게 그냥 끝나져있더라구요 띵작입니다  
10-21-2016,2016,10,21,15:44,금요일,10,3,0,고정운 축구교실(kran****),용병이반과  쌍벽을 이루는 명작.  
10-20-2016,2016,10,20,19:29,목요일,10,3,0,Paul Ahn(serc****),"비로소 이 영화를 보게 되었습니다. 감상평을 도무지 어떻게 써야 할 지 몰르겠습니다. 그저 그림말로 대신합니다....""ㅜㅜ""  "
10-19-2016,2016,10,19,00:00,수요일,10,3,0,햇님이알라뷰(tlsl****),진짜 대단한 영화입니다  
10-18-2016,2016,10,18,12:38,화요일,10,3,0,185cm77kg(mand****),10여년전 7년을 사귄 여자친구와 헤어지며 이별여행을 다녀오다 마지막으로 우리 같이 영화라도 볼까?하며 이영화를 보고 난뒤 그녀와 제 아이가 초등학생입니다 이별을 앞둔 연인은 디비디방에 가서라도 꼭 보세요  
10-17-2016,2016,10,17,20:39,월요일,10,3,0,ㅁㄴㅇㄻㄴㅇㄹ(ccci****),♥♥♥♥.♥♥♥♥.♥  
10-17-2016,2016,10,17,17:51,월요일,10,3,0,더듬스(asdf****),10점10점10점10점  
10-17-2016,2016,10,17,02:41,월요일,10,3,0,min9****,아 주여 저는 정신과를 다녔는데 이제 죽어도 여한이 없습니다이영화를 그디어 보았습니다  
10-17-2016,2016,10,17,02:24,월요일,10,3,0,오르막길(dong****),성지순례 왔습니다 아 정말 암이 나을정도네요  
10-17-2016,2016,10,17,01:06,월요일,10,3,0,kang****,눈물이나서잠이안오네ㅠㅠ  
10-16-2016,2016,10,16,19:20,일요일,10,3,0,qlql****,이 영화를 보고 암이 나았습니다.  
10-16-2016,2016,10,16,15:37,일요일,10,3,0,kbk9****,왜 진작 이 영화를 보지 않았을까 생각한다..고로 내 인생은 영화를 본 후 완전히 새로운 삶을 살고 있지...1일1클레멘타인을 행동으로 실천하는 중..  
10-15-2016,2016,10,15,02:53,토요일,10,3,0,에쿠스(equu****),죽기전에 꼭 봐야할 명작입니다...  
10-11-2016,2016,10,11,09:39,화요일,10,3,0,메이(dudr****),3일이 지났는데 아직도 눈물이 안말라요ㅠ  
10-10-2016,2016,10,10,23:24,월요일,10,3,0,쿠우(chan****),갓 오브더 무비 : 이걸 안본자 영화를 논하지 말라  
10-10-2016,2016,10,10,21:59,월요일,10,3,0,이쌍(dltk****),크으 클레멘타인이라 1-0점  
10-10-2016,2016,10,10,17:37,월요일,10,3,0,벤(dlsd****),신이 내린 영화다.. 설마 아직도 안본사람이 있단 말인가  
10-9-2016,2016,10,9,20:53,일요일,10,3,0,킹(tokk****),꼭 봐라 두번 봐라 세번 봐라  
10-9-2016,2016,10,9,13:10,일요일,10,3,0,hiya****,정말 최고....정말 최고....정말 최고....정말 최고....정말 최고....  
10-8-2016,2016,10,8,15:33,토요일,10,3,0,디올에러(tbj1****),명작은 명작이네요....  
10-8-2016,2016,10,8,12:53,토요일,10,3,0,핑키파이(cool****),말이 필요없는 명작입니다. 준리의 열연과 스티븐 시걸의 숨막히는 액션 10점이 아니라 100점을 주고 싶은 마음입니다.  
10-8-2016,2016,10,8,04:03,토요일,10,3,0,teah****,별10개로는 내 마음속의 감동을 다 표현하지 못할 영화 별점이 백점까지 있다면 100점을 줘도 아쉬울 영화  
10-7-2016,2016,10,7,19:42,금요일,10,3,0,공장장(xotk****),신데렐라보다 김혜리의 리즈시절을 보러 왔음  
10-4-2016,2016,10,4,22:08,화요일,10,3,0,mist****,아빠! 일어나!! 영화를 본지 10년이 지났지만 아직도 귓가에 맴도는거 갔습니다!!대한민국  천만 관객의 시초가 된  영화!10년 전에 헐리 우드 영화를 압도한 영화!!대한민국의  전설 이라는 이름으로 기억되는 영화!!  
10-3-2016,2016,10,3,22:07,월요일,10,3,0,kjff****,"영화란 서론과 본론과 결론이 있어 그때마다 감정의 기복이 있고 마지막에 감정이 정점에 이른다. 하지만 기복이 존재한다.그런데 ""클레멘타인""이란 영화는 시작과 중간과 결과물이 평행선으로 가면서 그 감정이 마지막에 극에 달한다.  "
10-3-2016,2016,10,3,19:46,월요일,10,3,0,똥빛장미(dhdk****),나의 인생은 클레멘타인을 보기 전과 본 후로 나뉜다.  
10-3-2016,2016,10,3,10:31,월요일,10,3,0,하하하하(risa****),평점 좀 더 올려서  아직 보지 못한 많은 분들이 보셨으면 좋겠어요...정말이요...진심으로요..  
9-30-2016,2016,9,30,22:05,금요일,10,3,0,hshl****,"과거, 현재, 미래 어디에도 다시 없을 영화  "
9-30-2016,2016,9,30,03:13,금요일,10,3,0,좋은일만(seji****),12년전 모든 관객이 숨죽이고 있을때 나온 아빠! 일어나~~하~그때 그 감동이란...명대사가 끝나고 졸고있던 모든 관객이 잠들어 버렷다  
9-29-2016,2016,9,29,19:44,목요일,10,3,0,dook****,재 개봉이 시급하다고 봅니다... 아이맥스 4D 화면에서 감동을 다시 느끼고 싶습니다. 감독판이나 확장판도 기대해 봅니다.  
9-18-2016,2016,9,18,19:35,일요일,10,3,0,jini****,대단하다..내가 생각한 그 영화가 맞나.. 싶었다..  
9-18-2016,2016,9,18,16:27,일요일,10,3,0,정류장찾아(eunj****),이 영화는 내마음의 별이다  
8-23-2016,2016,8,23,18:30,화요일,10,3,0,병신(park****),이 영화를 보고 암이 암에 걸려 치유가 되었습니다  
8-23-2016,2016,8,23,17:48,화요일,10,3,0,whyb****,"캠핑장에서 클레멘타인을 보고 있었는데, 하나둘 클레멘타인을 보러온 사람들로 결국엔 광화문 광장보다 많은 사람들로 빼곡했다. 아빠. 일어나라는 대사에 다들 부둥켜 안고 희열을 느꼈던 그때의 감동이란....2002년 길거리 응원보다 뜨거웠다.  "
8-23-2016,2016,8,23,17:43,화요일,10,3,0,영(chlc****),아..남자가 봐도 멋있다 좋은작품 만나서 떳네..영화배우 하고싶다..사람들이 날 보면서 감동 받게 하고싶다 보는내내 꿈틀거렸다..오디션보러 갑니다.  
8-23-2016,2016,8,23,17:08,화요일,10,3,0,Sakray(hi34****),영화를 보고 암세포가 암에걸려 죽었습니다.  
8-23-2016,2016,8,23,15:40,화요일,10,3,0,정운호(into****),이영화가  얼만큼잘만든영화 인지  말로 설명할수도 없습니다 영화를 보는내내 흐르는 눈물과 감동의대서사시를  제가 보고말았습니다 넓고넓은  우주에 단연최고의 작품ㅈ입니다  
8-23-2016,2016,8,23,15:32,화요일,10,3,0,김재혁(oms0****),아바타가 3D의최초라니 클레멘타인이 진짜 3D의 최초다 보고 암이낫고 눈물이흐르니  
8-23-2016,2016,8,23,15:25,화요일,10,3,0,마초(stre****),평점을 10점밖에 줄수없다는게 한이네요 내평생 인생 영화입니다!!!  
8-23-2016,2016,8,23,13:37,화요일,10,3,0,GDL(tach****),이  영화를 보고  내  자신을  되돌아보게  되었습니다.  
8-23-2016,2016,8,23,11:00,화요일,10,3,0,비움(oasi****),아직 안봤는데 이게 그렇게 감동적인가요?  
8-15-2016,2016,8,15,22:52,월요일,10,3,0,파누르(p134****),내인생에 후회는 없었다  
8-15-2016,2016,8,15,20:44,월요일,10,3,0,구사(azxm****),말이 필요없다. 어느영화 하고도 비교하고 싶지 않다  
8-15-2016,2016,8,15,17:23,월요일,10,3,0,마리오ㅋ(ghwn****),10점 이상은 없나요??  
8-15-2016,2016,8,15,14:39,월요일,10,3,0,GEpitaphR(hku9****),명작이란 말 밖에 할수없다  
8-14-2016,2016,8,14,17:55,일요일,10,3,0,ME야국이짜다(litt****),감독께서 명장면 5번과 명대사 2번으로 5천 관객을 감동시키니 그러고도 12개의극장을 가득 채울만큼 관객이 남았다고 한다.  
8-13-2016,2016,8,13,13:23,토요일,10,3,0,복순맘(eyun****),대한민국 역사상 최고의 영화... 감동  
8-13-2016,2016,8,13,13:06,토요일,10,3,0,지르ㅡㄱ니(pro5****),감사합니다 이런 영화를 만들어주셔서...  
8-12-2016,2016,8,12,22:11,금요일,10,3,0,훔냐하(hone****),명작 이름만 듣다가 이제서야 봅니다...보는 내내 눈물만 줄줄 흘렀습니다. 오랫동안 준비하던 시험에서 탈락한 아픔마저도 이 영화를 보고 치유가 되는 느낌입니다. 아직 보지 않았다면 꼭 보시길 바랍니다.  
8-12-2016,2016,8,12,22:08,금요일,10,3,0,박태종(lesh****),10년동안 난 뭐했는가....이런 명작을 아직도 못봤다니  
8-11-2016,2016,8,11,11:53,목요일,10,3,0,김민철(kmc0****),이영화를보고 가족간의 사랑을 깨우쳤습니다  
8-11-2016,2016,8,11,01:59,목요일,10,3,0,able(dbst****),와 이 영화보고 몸에 있는 액체란 액체는 다쏟았습니다 눈물 콧물 오줌 침  
8-4-2016,2016,8,4,21:56,목요일,9,3,0,모범시민(tagh****),1점이 빠진이유는 영화중간에 똥꼬쇼가 없기 때문이다  
7-30-2016,2016,7,30,17:02,토요일,10,3,0,도마뱀(4576****),보고 발기부전이 치료되었습니다  
7-27-2016,2016,7,27,21:06,수요일,10,3,0,sky피디(gih4****),댓글들보고 영화를 보게되었는데 정말 이때까지 봤던영화중 가장  명작이 었습니다 너무기뻐서 폰으로보다가 폰을던져 액정이  깨졌지만 이영화를 봤다는게 너무감격스럽습니다.  
7-27-2016,2016,7,27,17:41,수요일,10,3,0,skhs****,보지않았는데 벌써부터 감동의 눈물이 흐르네요  
7-27-2016,2016,7,27,14:21,수요일,10,3,0,ttemm(wooj****),아빠 일어나....!!!  
7-24-2016,2016,7,24,16:43,일요일,10,3,0,아티(oxdr****),사람이 영화를 감상하고 우는 경우는 두가지이다.1.영화가 너무 감동적일때2.클레멘타인을 보았을때  
7-24-2016,2016,7,24,13:10,일요일,10,3,0,루팡길동(jbhj****),말이 필요 없는 영화입니다. 이제라도 보게되어 다행이네요  
7-24-2016,2016,7,24,02:02,일요일,10,3,0,뚜루뚜룹(4561****),저야 말로 감동이 벅차 오릅니다..영화계의 역사에 남을 만한 이 영화를 볼 수 있는 현시대에 살고 있는 제가 감사 하고 또 감사합니다..자 우리 다같이 외칩시다.명대사를. 아빠 일어나!  
7-21-2016,2016,7,21,05:58,목요일,10,3,0,곽철용(isgo****),쇼생크탈출에 유일하게 견줄수있는 시대를 잘못타고난 비운의 명작.  
7-21-2016,2016,7,21,04:34,목요일,10,3,0,rlaa****,댓글만 읽었는데도 변비가 나았습니다...아직 영화는 보지 않았지만 10점 주고 싶네요. 내년에 제아이가 초등학교에 입학하면 입학 선물로 클레멘타인을 함께 볼겁니다  
7-19-2016,2016,7,19,15:30,화요일,10,3,0,한보(redn****),시대를 잘 못 타고난 영화  
7-17-2016,2016,7,17,17:58,일요일,10,3,0,Clare_McCoy(davi****),긴 말이 필요 없습니다. 그저 보십시오.  
7-17-2016,2016,7,17,13:50,일요일,10,3,0,해밀(ange****),시간 가는 줄 모르고 봤어요  
7-17-2016,2016,7,17,11:48,일요일,10,3,0,서독(just****),"클레멘타인을 본 순간, 내가 살아가는 이유를 하나 잃었다.하지만, 엔딩 크레딧을 본 순간 느낀 깊은 감동은 인생의 어느 때나 영원히 남을것이다.  "
7-16-2016,2016,7,16,00:28,토요일,10,3,0,김근호(kkhg****),1점주고 쓰레기라고 하는데 이영화 덕에 진짜 생각없이 웃었네요 정확히는 이영화의 댓글이지만 그래도 여유가지고 재미로 보시면 즐거움 너무 심각하게 받아 들이지 말고 웃읍시다  
7-15-2016,2016,7,15,17:43,금요일,10,3,0,발제뷰트(dkcl****),울지마 이미 지난일이야  
7-15-2016,2016,7,15,13:56,금요일,10,3,0,jaca****,"21세기 최고의 명작입니다. 지루한 부분 하나도 없고 끝없는 액션과 감동, 우정 최고의 작품입니다  "
7-15-2016,2016,7,15,13:17,금요일,10,3,0,프로불편러(bign****),이 시대에 이런 명작이..  
7-14-2016,2016,7,14,19:18,목요일,10,3,0,이경열(leew****),이 영화를 보고 다시 힘을내서 살아보고 싶어졌습니다 정말 감사합니다  
7-14-2016,2016,7,14,17:46,목요일,10,3,0,드록바(drog****),피는 물보다 진하다. 뜨거운 가족애.  
7-12-2016,2016,7,12,17:53,화요일,10,3,0,kusub(kusu****),내가 살아숨쉬는동안 이런 명작이 나와 무한한 감사를느낀다  
7-9-2016,2016,7,9,14:18,토요일,10,3,0,핑쿨(mari****),내가 이걸 드디어 봤구나..아~힐링하고 갑니다..  
7-7-2016,2016,7,7,21:52,목요일,10,3,0,심문규(kbsg****),클레멘타인을 보고 세상 모든것 을 가진 느낌이였다면 설표를 본것은  우주 모든것 을 가진느낌이었습니다  
7-7-2016,2016,7,7,21:27,목요일,10,3,0,안녕(vh33****),그저... 내가 이 영화를 볼 수 있는 두 눈에게 감사한다  
7-7-2016,2016,7,7,00:33,목요일,10,3,0,ghdtjd1(samk****),가끔 생각나서 봅니다.  
7-5-2016,2016,7,5,17:58,화요일,10,3,0,mtig****,말이 필요한가?히히힝  
7-4-2016,2016,7,4,09:28,월요일,10,3,0,떠려니(love****),너무 큰 기대감에 아직까지도 볼수없었다. 어쩌면 앞으로도...  
7-4-2016,2016,7,4,00:18,월요일,10,3,0,오랜만(rkaw****),이 영화를보고 무모증이였던 제가 머리가 자라기 시작했습니다  
6-29-2016,2016,6,29,16:42,수요일,10,3,0,은하수(mist****),한달에 한번씩은 꼭 다시 보게 되는 그런 영화..  
6-29-2016,2016,6,29,15:16,수요일,10,3,0,바룸(qquu****),내 인생 영화 타이타닉 하고 붙이면 뭘 골라야 할지 진지하게 망설이게되는 유일한 영화  
6-29-2016,2016,6,29,08:17,수요일,10,3,0,라이(tigi****),오늘 이 영화를  우리집  OOO 땡칠이와  같이 봤는데 개가 말을 합니다  '일어나 이 주인 새끼야..'그럽니다  
6-26-2016,2016,6,26,08:08,일요일,10,3,0,불낙지볶음(that****),대한민국의 길이길이 남을 명작입니다 .  
6-24-2016,2016,6,24,01:21,금요일,10,3,0,멋쟁이(byno****),내가 가장 존경하는 영화감독님은 김자 두자 영자를 쓰신다. 김두영 감독님 클레멘타인 속편을 애타게기다리고 있는 국민이 4500만명이 넘었습니다.  
6-21-2016,2016,6,21,06:52,화요일,10,3,0,삼삼알(doyu****),아직도 이영화를 보며 울며 하루를 마감하는 중입니다.21세기 최고의 신파극  
6-14-2016,2016,6,14,09:44,화요일,10,3,0,코코아(sang****),"먼 훗날 정철의 관동별곡처럼 교과서에 단골로 등장하는 그런 영화가 되지 않을까 싶다. 이 영화는 알프스 산맥 깊숙이, 지구가 재난에 처했을 때도 보존가능한 그런 곳에 보관되어야한다.  "
6-2-2016,2016,6,2,19:53,목요일,10,3,0,차핑기(ckvl****),스크린 점유율 100%로 한달간 극장 재개봉했으면 좋겠습니다.  
5-30-2016,2016,5,30,17:26,월요일,10,3,0,gadi****,다시한번 그떄그감동 또보고가요 아 눈물이나  
5-30-2016,2016,5,30,02:33,월요일,10,3,0,김승혁(cds9****),아직도 안봤나?! 클레멘타인!!  
5-27-2016,2016,5,27,03:13,금요일,10,3,0,suga****,충격과 감동!! 영화본후 하루종일 지인들에게 추천하느냐고 바쁜하루 였습니다  이영화를 접할수 있게 도와주신 당정동 도토리님께 깊은 감사를 드립니다!!  
5-26-2016,2016,5,26,21:44,목요일,10,3,0,haen****,창조경제의 초석이라 할수있는 대작입니다.암에 걸린분과  몸과 정신에 이상이  있으신분들을  사회에 복귀할수있게 하시여 진정한 밀알로 만드신 대작입니다.감사합니다.사랑합니다.  
5-26-2016,2016,5,26,01:02,목요일,10,3,0,쏠파(myga****),어떻게 이게 액션영화 추천 누르면 나오지?  
5-24-2016,2016,5,24,14:55,화요일,10,3,0,모모(zkzk****),내일 지구가 멸망하더라도 클레멘타인을 볼테다!!! 명작이다  
5-22-2016,2016,5,22,15:48,일요일,10,3,0,선비(ksh9****),우리시대 지성인을 위한 알람시계 '아빠 일어나'  
5-22-2016,2016,5,22,13:19,일요일,10,3,0,kiju****,너무 재미있어서 피똥오줌 방귀쥐렸습니다  
5-22-2016,2016,5,22,13:02,일요일,10,3,0,skyi****,이 작품을 만난지 어언 십여년 감동의 여운은 가슴에 남아 내인생을 지탱해주는 큰힘이 되어 주고있다.  
5-21-2016,2016,5,21,18:53,토요일,10,3,0,낵가이버(ddon****),이 영화를 보지 못했다면 당신은 영화를 보지 못한것입니다  
5-20-2016,2016,5,20,12:57,금요일,10,3,0,토마토(sun3****)," 치열한 회사에 치여 이리저리 몸도 마음도 상해 지쳐갈 즈음 클레멘타인을 보았습니다. 아... 영화를 보는 내내 나약했던 제 자신이 부끄럽더군요. 인생을 되돌아보고 잊었던 인생의 의미를 되찾고 싶을 때, 당신에겐 클레멘타인이 있습니다.  "
5-20-2016,2016,5,20,12:05,금요일,10,3,0,ANN(rimi****),진짜 재개봉 언제해요????!!!!  
5-20-2016,2016,5,20,09:31,금요일,10,3,0,호연지기(ecla****),전율에 손이떨려 입력을할수가 없음ㅠㅠ  
5-19-2016,2016,5,19,23:37,목요일,10,3,0,ah(uooe****),이렇게 좋은 영화를...나만 당할 순 없지  
5-19-2016,2016,5,19,22:55,목요일,10,3,0,케이시(kob0****),영화가 시작하고 끝날때까지 이리  집중해서 본 영화는 인셉션 이후로 처음이네요  
5-19-2016,2016,5,19,20:01,목요일,10,3,0,cbh97(ahtt****),이또한지나가리라 -솔로몬-  
5-18-2016,2016,5,18,12:05,수요일,10,3,0,tndu****,같이느껴요 감동의도가니  
5-18-2016,2016,5,18,11:47,수요일,10,3,0,스윗루머(nblo****),실로 감탄하지 않을수 없었다.  
5-18-2016,2016,5,18,10:29,수요일,10,3,0,대박나자(seac****),최고의 영화 10점 주고싶다ㅣ  
5-17-2016,2016,5,17,14:00,화요일,10,3,0,치키차카쵸쿄쵸쿄쵸(di_s****),인류 역사상 최고를 내 두눈으로 보았다. 죽어도 여한이 없다.  
5-17-2016,2016,5,17,02:05,화요일,10,3,0,작은나무(tfgh****),은서우를 은퇴시킨 한국의 자랑.. 서울표준어를 공부한다면 꼭 봐라! 토익점수...난 클레멘타인을 보면서 점수높였다! 사투리쓰면서 친숙한 이미지를 만들고 싶냐? 난 클레멘타인으로 사투리 익혔다  
5-17-2016,2016,5,17,00:40,화요일,10,3,0,hwa7****,힘들고 지치고 좌절하고 모든걸 놓고싶을때 나의 뒤통수를 마구 내리치며 삶으로 인도해준 바로 이 영화.왜 이 영화를 평점 10점만으로 표현할수 없는 내자신이 너무 밉다.  
5-16-2016,2016,5,16,22:43,월요일,10,3,0,라울미니미(shoo****),세계평화를 찾기 위해 IS에게 이 영화를 보여주고 싶다. '아빠 일어나!!'를 보고도 지금과 같은 참혹한 짓을 할 수 있을까?  
5-16-2016,2016,5,16,13:42,월요일,10,3,0,카미조 토우마(kami****),절대로 후회하지 않을 만한 좋은 영화입니다.  
5-15-2016,2016,5,15,23:50,일요일,10,3,0,mylo****,이 영화를 본순간 내가 살아있을 이유하나를 잃었다...  
5-15-2016,2016,5,15,22:55,일요일,10,3,0,나만미더오키(fore****),내 인생의 이유가 된 영화  
5-15-2016,2016,5,15,22:13,일요일,10,3,0,pdw1****,감히 함부로 말할수 없는 영화다. 이런 감동을 다시 느낄수  있는 영화를 볼수 있다면 그것은 행운일 것이다.  
5-15-2016,2016,5,15,17:14,일요일,10,3,0,rhyt****,명작을 이제야 봤네요!! 10점드립니다!!  
5-15-2016,2016,5,15,00:18,일요일,10,3,0,d140****,저는 이 영화를 보고 기말고사에서 100점을 맞았습니다 왜냐면주인공들이힘든상황에서도끊임없는 모성애를보고  감동을받아 앞으로 살아갈방향을찾아 공부에집중하는데도움을주었기때문입니다  
5-14-2016,2016,5,14,22:04,토요일,10,3,0,geronimo(gero****),정말 감동적이다... 쌓여있던 스트레스가 풀렸다.  
5-12-2016,2016,5,12,19:12,목요일,10,3,0,누돌프(nudo****),내 인생 최고의 영화 입니다. 1점 테러 날리는 사람들 도대체 뭐지? 장담하건데 우리나라 최고의 영화 입니다. 우리나라의 영화는 클레멘타인으로 시작해서 클레멘타인으로 끝날 겁니다. 더이상 이런 영화는  볼 수 없겠죠? 슬프네요..  
5-12-2016,2016,5,12,14:20,목요일,10,3,0,kazi****,말하면 입만 아픔...  
5-12-2016,2016,5,12,13:07,목요일,10,3,0,찬물(ksmc****),자살을 생각한 그대에게 헌정하고 싶다. 다시 살아갈 희망을 느낄수 있도록  
5-11-2016,2016,5,11,17:34,수요일,10,3,0,루스패스(wqaq****),이 영화를 보진 않았지만 단번에 느껴진다 1000년에 한번 나올 영화라는것을  
5-10-2016,2016,5,10,21:26,화요일,10,3,0,멀리(roya****),내 인생 최고에 영화  ㅠㅠ  
5-10-2016,2016,5,10,20:56,화요일,10,3,0,토론과비판(kimj****),'아빠 일어나!' 단 한마디의 전율  
5-10-2016,2016,5,10,20:54,화요일,10,3,0,suwo****,저또한 이영화를 보고 인생을 다시 살게 되었어요아빠 일어나 똥꼬쇼 해야지  
5-9-2016,2016,5,9,01:08,월요일,10,3,0,제우스(wun0****),당시 대한민국이 조금만 더 선진국에 가까웠더라면... 아카데미에 이런 명작을 보내지 못한 대한민국의 현실이 안타까울 뿐입니다...  
5-8-2016,2016,5,8,00:21,일요일,10,3,0,Edeniaz(niaz****),오지고 또 오지는영화 ㅉㅉ  
5-5-2016,2016,5,5,23:50,목요일,10,3,0,고구마(otwo****),하... 안봤으면 빨리봐라..  
5-5-2016,2016,5,5,19:43,목요일,10,3,0,cjst****,이 영화에 10점을 줄 이유는 없었다. 다만 이 영화가 클레멘타인이기 때문이다  
5-4-2016,2016,5,4,02:14,수요일,10,3,0,가나다파카타(skwk****),이 영화는 관람객 평점이 없습니다.  
4-30-2016,2016,4,30,21:23,토요일,10,3,0,버물리(qjan****),"옛 시대에 이 영화가 방영되었다면, 인류를 위해 노아는 분명 홍수 전 이 영화를 배에 실었을 것이다.  "
4-30-2016,2016,4,30,02:01,토요일,10,3,0,챔스우승0회아스날(hwan****),점수 테러하는놈들 제정신이냐?  
4-29-2016,2016,4,29,19:41,금요일,10,3,0,진형민(jinh****),죽을래 살래를 뛰어넘는 세기의 명작!  
4-28-2016,2016,4,28,20:15,목요일,10,3,0,부산(dkdk****),이렇게 니가 한걸음 멀어지면 내가 한걸음 다가가면 되잖아..  
4-27-2016,2016,4,27,00:15,수요일,10,3,0,아스터(azo7****),우리집개도 이영화를본뒤 말을하기시작했다 아빠일어나  
4-25-2016,2016,4,25,01:13,월요일,10,3,0,빙빙꿍꿍(love****),이때는 진짜사나이셧던 이동준씨  
4-24-2016,2016,4,24,19:38,일요일,10,3,0,mega****,솔직히  이영화보면  쇼생크탈출이나 인생은 아름다워 따위의 영화가 얼마나 허접해보이는지 알 수있다.  
4-24-2016,2016,4,24,07:47,일요일,10,3,0,즐거운녀석(myuc****),0점영화.평점을 한번만 주게만든 네이버를 원망하며. 제마음의 100점을 표현한것입니다.  
4-22-2016,2016,4,22,21:46,금요일,10,3,0,ksjm****,그 어떤 찬사를 입혀도 이 영화에게는 누더기가 될 뿐  
4-21-2016,2016,4,21,21:52,목요일,10,3,0,다이내믹교(kkoe****),아빠 일어나..영화보며 눈물을 흘린적이 있던가..아직 이 걸작을 보지 못 한 그대가 더 부럽다.다시 한번 그 감동을 느끼기 위해 다시 보러가야겠다.  
4-18-2016,2016,4,18,10:26,월요일,10,3,0,찍콩이(yisl****),대작용가리보다 한수위. 죽기전에 꼭 봐야할영화입니다. 가장들 일어나요~  
4-15-2016,2016,4,15,17:00,금요일,10,3,0,귀찮(jjo0****),대한민국 영화계에 한 획을 그었다고 할 수 있는 세기의 작품. 클레멘타인을 보지 않았다면 영화 매니아가 아니다  
4-15-2016,2016,4,15,09:42,금요일,10,3,0,USAS12(leey****),ㅣ바... 할말을 잃음  
4-15-2016,2016,4,15,01:26,금요일,10,3,0,yooh****,이것보다 감동적인 영화는 본적조차없습니다. 강력 추천합니다!!!  
4-14-2016,2016,4,14,21:23,목요일,10,3,0,초코맛슬라임(skwl****),영원히 끝나지 않는 10점  
4-14-2016,2016,4,14,18:55,목요일,10,3,0,강영철(dudc****),나무아미타불관세음보살  
4-10-2016,2016,4,10,23:46,일요일,10,3,0,모나미(ram2****),흐르는 눈물을 주체할수가 없었습니다. 아빠 일어나... 아직도 귓가에 맴도네요. 인생을 깨닫게 해준 제 인생영화!! 쇼생크 탈출과 비견될만한 유일한 영화!  
4-10-2016,2016,4,10,09:46,일요일,10,3,0,권민혁(km54****),이영화배우들은 칸영화제를 가야한다고 생각한다  
4-10-2016,2016,4,10,08:29,일요일,10,3,0,파킹랏(grox****),클레멘타인 불쌍해 ㅠㅠ 1등한번시켜줬으면 좋겟어 ㅠㅠ  
4-10-2016,2016,4,10,01:51,일요일,10,3,0,일섭이(zorq****),클레멘타인 10주년 기념 리마스터링이 나온다는군요!!  
4-9-2016,2016,4,9,01:01,토요일,10,3,0,SeureureuK(hih0****),개명작인거같다. 내인생 이런영화는 오랜만  
4-8-2016,2016,4,8,16:10,금요일,10,3,0,사류(wind****),이 영화를 본후 너무나 앞만보면서 각박하게 살아왔던 제 인생을 뒤돌아 보게되었습니다.  
4-7-2016,2016,4,7,22:31,목요일,10,3,0,양동주(dide****),내나이 올해로 열일곱..이 영화를보고 삶의가치를 다시한번 느꼇다  
4-5-2016,2016,4,5,12:23,화요일,10,3,0,해파리(sinb****),이영화를 10번 넘게봐야 온몸의 독소가 정화되고 초능력을 얻게될것이다  
4-1-2016,2016,4,1,13:18,금요일,10,3,0,LMH(leem****),평가할수 없는 영화...  
3-31-2016,2016,3,31,00:35,목요일,10,3,0,nhk(chk3****),최고의 영화. 나중에라도 재평가되어서 기쁜 영화.  
3-28-2016,2016,3,28,15:14,월요일,10,3,0,wys0****,이영화를보고 감동받아 말을잃었다..10년 넘게 지났지만 아직도 말을못한다...  
3-28-2016,2016,3,28,04:48,월요일,10,3,0,축구야구배구농구(jeon****),한국영화는 클레멘타인 전과 후로 나뉜다시대를 앞서간 영화 100년뒤에나 나올까너무 멋진 작품이다  영화가 아니라  예술 그자체  
3-26-2016,2016,3,26,21:18,토요일,10,3,0,에스더(ymh5****),"너무 감동적이었습니다. 매우 많이 감동적이고, 슬펐습니다.한국에서 이런 대작이 나오다니, 너무 감동적이었습니다.  "
3-26-2016,2016,3,26,16:26,토요일,10,3,0,청소하자(blue****),쉿! 더이상 이 영화를 논하지 말자.최고라는 표현이 아깝다  
3-26-2016,2016,3,26,15:01,토요일,10,3,0,히트(trum****),빵쌤! 추천영화~ㅋㅋ  
3-26-2016,2016,3,26,14:05,토요일,10,3,0,우주정복(hswa****),우리 태권도의 화려한 이단 돌려차기 만큼이나엄청난 액션신.. 재개봉 하면 꼭 다시 보고 싶네요  
3-26-2016,2016,3,26,13:53,토요일,10,3,0,맨체스터주인은맨시티(lila****),어제의 나를 다시 되돌아본 인생 최고의 영화  
3-26-2016,2016,3,26,10:12,토요일,10,3,0,juni****,갠찮은 영화네요 잘봤어요 굿굿  
3-25-2016,2016,3,25,20:42,금요일,10,3,0,바이키(bike****),명작 이영화를안보곤 한국영화를 논하지마라  
3-25-2016,2016,3,25,07:42,금요일,10,3,0,리눅스(antj****),꼭 보시기를 기원합니다!  
3-24-2016,2016,3,24,08:39,목요일,10,3,0,엠제이(cbj0****),이 영화는 감동 그 자체입니다. 눈물이 흘러서 욕조를 다 채울 정도였습니다. 홍수가 안 나 다행입니다.  
3-24-2016,2016,3,24,02:57,목요일,10,3,0,헤니오(aosj****),아침에 일어나클레멘타인을 보고 하루를 시작한다  
3-23-2016,2016,3,23,18:52,수요일,10,3,0,hya1****,진정한 불후의 명작이죠.  
3-21-2016,2016,3,21,12:46,월요일,10,3,0,조으리(newg****),이 영화는 성지가 됩니다  
3-17-2016,2016,3,17,13:48,목요일,10,3,0,이그먼트(zmtj****),이영화를 보고 암이 나았습니다  
3-17-2016,2016,3,17,13:47,목요일,10,3,0,platina(dldy****),환상의 똥꼬쑈!  뭔가 보여드리겠습니다!  
3-16-2016,2016,3,16,15:44,수요일,10,3,0,올마이티(kang****),드디어 봤다.나의 영화 인생은 클레멘타인 전과 클레멘타인 후로 나뉜다.  
3-16-2016,2016,3,16,15:05,수요일,10,3,0,찍찍이(vipe****),10점도 모자른 영화 정말 최고  
3-15-2016,2016,3,15,01:03,화요일,10,3,0,reto****,'평점을 사랑한 남자와  그의 영화 클레멘타인'... 정말 불후의 명작입니다.  
3-9-2016,2016,3,9,07:43,수요일,10,3,0,V11_go_go(mins****),이 영화 짱 재밌어요! 꺄악~  
3-6-2016,2016,3,6,19:37,일요일,10,3,0,비밀(gami****),말이 필요없다....  
3-5-2016,2016,3,5,14:08,토요일,10,3,0,난사왕(gjwo****),평점 조작하는 갓오브이집트 보다 훨씬 재미있었다  
3-4-2016,2016,3,4,03:41,금요일,10,3,0,개발살(rain****),한국 액션 영화의 이정표.  
3-3-2016,2016,3,3,01:10,목요일,10,3,0,커피(tlfn****),이 영화를 얼마전에 알게 되었다. 나는 그동안 무엇을 하며 살아왔는가?  
3-1-2016,2016,3,1,19:55,화요일,10,3,0,뿜뜨킥트뿜뿜킥트빡트(heeh****),당시 트로이라는 영화와 함께 개봉했는데 주위사람들은 모두다 트로이를 보자고 했지만 저혼자 클레멘타인을 보았죠 제옆좌석에는 모자가 씩씩거리고 있었는데 영화가 중반부쯤으로 흘러가니 모자가 눈물을 흘리며 손을잡고 있더군요 그래서저도 말없이 손을 잡아주었죠.  
3-1-2016,2016,3,1,17:06,화요일,10,3,0,에카(ghkd****),정말 다시는볼수없는명작. 보고 울고 또울었다.  
2-29-2016,2016,2,29,23:07,월요일,10,3,0,채종건(coat****),말이 필요없는 영화 ...  
2-28-2016,2016,2,28,21:02,일요일,10,3,0,축알못손흥민(rktx****),당신이 쇼크사하지않는다면 소독을하듯 몸과 마음의 모든 바이러스들을 죽여버릴수있다...  
2-21-2016,2016,2,21,17:28,일요일,10,3,0,일상(kkmr****),성지순례 왔다갑니다.  
2-19-2016,2016,2,19,22:19,금요일,10,3,0,tjal****,삶의유일한행복이다.  
2-19-2016,2016,2,19,14:03,금요일,10,3,0,gksc****,대다나다대다나다대다네  
2-17-2016,2016,2,17,23:26,수요일,10,3,0,쏘리요(jins****),사람은 클레멘타인을 만들었고 클레멘타인은 사람을 만든다  
2-17-2016,2016,2,17,21:00,수요일,10,3,0,대낮에위스키(dh80****),거두절미하고 감동 그자체..  
2-17-2016,2016,2,17,20:40,수요일,10,3,0,천랑(whdt****),말이 필요한가요 엄청난 명작이조  
2-17-2016,2016,2,17,17:08,수요일,10,3,0,꾸꾸까까(bakm****),이 영화 평점이 10점을 못 찍는건 사기다  
2-17-2016,2016,2,17,13:16,수요일,10,3,0,하늘구름(vada****),Jesus Christ  
2-17-2016,2016,2,17,12:23,수요일,10,3,0,43(kcg1****),인생 최고의 영화!! 꼭 보세요  
2-17-2016,2016,2,17,01:10,수요일,10,3,0,올ㅋ(smch****),이 영화를 보고 눈에서 물이멈추지않아 탈수증세로 병원에 입원했습니다 정말 감동적인 명작 중 명작입니다  
2-16-2016,2016,2,16,21:04,화요일,10,3,0,그문덴(scvk****),바라만 볼 것인가...  
2-16-2016,2016,2,16,17:44,화요일,10,3,0,조영도(jyd1****),안본사람은 말도하지말라!  
2-16-2016,2016,2,16,14:47,화요일,5,3,0,결이(skex****),5점.... 이 영화를 덜 본 나로써는 감히 어떤 평가를 내려야 할지 모르겠다 더 보고 싶었는데 영화에 남아있는 더 심오하고 깊은뜻을 이 우매한 인간인 내가 느낄수있을지에대한 회의감이 들자 이 영화를 껐다... 나같은 무지몽매한 사람이 아는 사람만보길  
2-16-2016,2016,2,16,11:36,화요일,10,3,0,yo(ksjy****),돌았나ㅋㅋㅋ네이버도 한패네.. 이 영화가 숨은명작에 왜있냐? 누가봐도 대작 그자체인데..  
2-16-2016,2016,2,16,11:17,화요일,10,3,0,조드미(asd5****),내인생최고의영화♥잊을래야잊을수없다  
2-16-2016,2016,2,16,02:19,화요일,10,3,0,임팩트(sms_****),말이 필요 읍다 10자10자  
2-15-2016,2016,2,15,22:35,월요일,10,3,0,한동우(hmk4****),명작 그 자체... 이세상 모든 사람에게 추천한다  
2-15-2016,2016,2,15,21:01,월요일,10,3,0,ㅇㅇㅇㅇㅇ(pty6****),최고!! 명불허전 21세기 영화중 가장 감명깊이 봤네요  
2-15-2016,2016,2,15,19:01,월요일,10,3,0,팟포(dieb****),제한클 제발 한국인이면 클레멘타임 봅시다  
2-15-2016,2016,2,15,18:53,월요일,10,3,0,미도(jd3u****),인생 최고의 영화!! 꼭 보시길  
2-15-2016,2016,2,15,13:34,월요일,10,3,0,Mun_Jim(gang****),지하철 역에 계시던 앉은뱅이분한테 클레멘타인 포스터를 보여드렸습니다. 갑자기 기적처럼 일어나시더니 펑펑 우시면서 달려가셨습니다. 역시 엄청난 클레멘타인... 항암치료 말고도 다른 치유효과가 있는듯 합니다.  
2-14-2016,2016,2,14,16:17,일요일,10,3,0,건전지(junj****),세기의 시작을 알리는 명영화  
2-14-2016,2016,2,14,13:30,일요일,10,3,0,라구리(elli****),완벽한 신의영화임 ㄹㅇ보시면 압니다  
2-14-2016,2016,2,14,00:09,일요일,10,3,0,세일러문짱(dani****),딱 북한정은이한테 보여주고싶은 영화입니다 김정은이는 통일되면 아빠손잡고 꼭 보시길  
2-13-2016,2016,2,13,01:20,토요일,10,3,0,베텔게우스(qmff****),이런 개ㅡ새들ㅋㅋㅋ어케든 다른사람 보게할려곸ㅋㅋㅋ아 물론 제 인생 역대급 영화입니다  
1-1-2016,2016,1,1,14:16,금요일,10,3,0,2000****,이영화를보고 30후반까지 안했던 포경수술을 결심했습니다.  
1-1-2016,2016,1,1,03:39,금요일,10,3,0,mica(hyun****),강추.. 넘 울어서 힘드네요  
12-31-2015,2015,12,31,14:53,목요일,10,3,0,pyth****,"철학없는 정치, 도덕 없는 경제, 노동 없는 부, 인격 없는 교육, 인간성 없는 과학, 윤리없는 쾌락, 헌신없는 종교, 클레멘타인 없는 인생 - 간디븐 시걸의 8가지 악덕  "
12-31-2015,2015,12,31,11:13,목요일,10,3,0,치토스(mfon****),아직도 안 본 사람이 있나..?  
12-30-2015,2015,12,30,22:34,수요일,10,3,0,삼돌이(jing****),"2015년을 김성모의 최고의 명작만화""럭키짱""과  김두영  최고의 영화 ""클레멘타인""으로  마무리  하려한다...  "
12-30-2015,2015,12,30,19:28,수요일,10,3,0,도영재(dkwl****),아...너무 아름다워  
12-30-2015,2015,12,30,08:36,수요일,10,3,0,감자(k360****),대작이다. 대작...  
12-29-2015,2015,12,29,21:38,화요일,10,3,0,xz03****,딴 말 말고 일단 보면 아실겁니다  
12-29-2015,2015,12,29,20:16,화요일,10,3,0,사막의(sjja****),그러하다...ㅇㅇㅇ  
12-25-2015,2015,12,25,21:20,금요일,10,3,0,jay(pjs0****),모두가 이 영화를 봤으면 하는  마음뿐이다  
12-24-2015,2015,12,24,18:23,목요일,10,3,0,김재성(27da****),이영화의단점은엔딩이있다는거다  
12-21-2015,2015,12,21,23:24,월요일,10,3,0,인과(qkrw****),전설의 레전드 ~!! 명불허전 !  
12-21-2015,2015,12,21,17:12,월요일,10,3,0,동성로파(dydt****),전무후무의걸작입니다...발기부전이지만 아빠일어나! 를듣고 저의세번째다리가 일어났습니다  
12-21-2015,2015,12,21,01:34,월요일,10,3,0,뽀빠이(magi****),영화보기 싫어하는 놈임니다ㆍ어쩌다 보고말았습니다ㆍ 이제서야본걸 후회했습니다ㆍ내인생 최고로 감명깁게본영화ㆍ 클레멘타인ㆍ명대사 ㅡ아빠 일어나ㅡ   여러분께 적극 추천합니다ㆍ암걸린분 귀가안들리신분 근심걱정있으신분 이영화를 본후 여러분 인생이 바뀔것입니다ㆍ  
12-20-2015,2015,12,20,17:03,일요일,10,3,0,훈훈(ilil****),크리스마스에는 꼭 이영화와 함께  
12-18-2015,2015,12,18,18:10,금요일,10,3,0,Slamat siang(dlaa****),이 영화를 보고 삶의 이유를 찾았습니다.  
12-17-2015,2015,12,17,15:56,목요일,10,3,0,Earlgrey(land****),"우리나라 내로라 하는 대표적인 연기파, 흥행보증 배우들이 클레멘타인 주인공 이동준씨 앞에서 늘 자신을 성찰하며 부끄러워한다는 얘기를 들었습니다. 이 영화에서 이동준 선생님의 연기는 러닝타임 내내 영화를 장악하고 관객의 마음을 뒤흔듭니다.  "
12-17-2015,2015,12,17,14:46,목요일,10,3,0,ㅈㅁ(rudg****),역시 클레멘타인이 최고야  
12-17-2015,2015,12,17,14:20,목요일,10,3,0,BUSHWICK(jjyy****),인생영화 101010  
12-9-2015,2015,12,9,17:02,수요일,10,3,0,어네스트(heis****),내나이 이제 한달후믄 40세 40년을 살면서 클레멘타인 하나 건졌으니 이정도믄 성공한 인생 아닌가!!!  
12-4-2015,2015,12,4,10:13,금요일,10,3,0,ㅡㅡ(jles****),"하... 너무 짠하네요.. 괜히 네이버 영화랭킹 80위가 아닙니다. 추천하는 데는 그만한 이유가 있는 것이지요, 꼭 한 번 보길 바랍니다  "
12-3-2015,2015,12,3,03:52,목요일,10,3,0,노마드(m878****),2016년에 재상영 부탁드립니다.  
11-29-2015,2015,11,29,23:16,일요일,10,3,0,칡냉이(bjk2****),"'아빠, 일어나!'우리나라의 저출산문제를 해결할 수 있는 가장좋은 방법은 클레멘타인을 재상영하는 것이다하지만 자칫 중국처럼 인구가 과도하게 많아질 수 있기 때문에 하지않는 것이다  "
11-28-2015,2015,11,28,22:27,토요일,10,3,0,하레와구(ehdu****),"축록자 불견산이라는 말이 있다. 노루를 쫓는 자는 산을 보지 못한다... 나는 그동안 소위 명작이라는 노루들을 쫓느라 얼마나 많은 시간을 허비했나! 하지만 이제는 괜찮다. 에베레스트에 버금가는 태산 ""클레멘타인""을 발견했으니.  "
11-28-2015,2015,11,28,20:23,토요일,10,3,0,켄신(kens****),감히 함부로 이 영화를 평하지말라  
11-28-2015,2015,11,28,17:20,토요일,10,3,0,비밀케릭(wjsq****),아직 이영화를 보지않았다 봐야한다.. 아직은아니다를 하루수십번 고뇌하며 참고있는것이다이미 오래전 하드깊숙히 보관해두었지만 내가 살아있어야할이유하나쯤은 남기고싶었다 평글만봐도 이영화의 가치를알수가있다 절대감동을느끼지않고선 이런평들을남길수가없는것이다..  
11-27-2015,2015,11,27,19:44,금요일,10,3,0,김정환(luck****),내 인생의 전환점이 되어 준 영화. 세상에 이런 영화도 존재할 수 있다는 점을 알고 충격을 감출 수 없었다. 인상적인 영화.  
11-26-2015,2015,11,26,02:27,목요일,10,3,0,성북동비둘기(sher****),이 영화로 인해 한국영화는 50년 앞으로 도약했다고 볼 수 있다  
11-25-2015,2015,11,25,18:01,수요일,10,3,0,보살(laaa****),이영화를 볼수있는 동시대 사람이라는게 자랑스럽습니다  
11-24-2015,2015,11,24,22:23,화요일,10,3,0,52(skys****),'와우'이 한마디 밖에 나오질 않네요  
11-24-2015,2015,11,24,20:02,화요일,10,3,0,코코리(pent****),꽃들이 떨어지는구나...  
11-23-2015,2015,11,23,10:36,월요일,10,3,0,love****,크리스마스날 이영화를 공중파에서 방송한다면 따뜻한 크리스마스가 되지않을까요~  
11-23-2015,2015,11,23,07:33,월요일,10,3,0,ZYUO(kmgy****),과연 레전드라 할만하다.  
11-22-2015,2015,11,22,08:02,일요일,10,3,0,노란복수초(broj****),계속설사중이었는데 이영화의 평점을 읽고 바로 방구가 나오네요 감사합니다.   오랫동안 마음에 담아두었던 영화 입니다. 클레멘타인은 사랑입니다.  
11-14-2015,2015,11,14,18:39,토요일,10,3,0,가가거거(flvm****),"'인간은 클레멘타인을 본다. 고로, 존재한다'  "
11-14-2015,2015,11,14,09:45,토요일,10,3,0,겐또(fait****),더 이상 무엇을 바라겠는가??  
11-12-2015,2015,11,12,23:42,목요일,10,3,0,이명진(lmji****),앉은뱅이가 일어나고 봉사가 눈을 뜬다는 전설의 영화라는 소문듣고 별점 남기고 갑니다^^  
11-12-2015,2015,11,12,18:03,목요일,10,3,0,김기윤(goog****),이 영화가 평점의 기준이 될 줄 몰랐다  
11-11-2015,2015,11,11,14:58,수요일,10,3,0,kik1****,"내 나이 올해 30 살아온 ㄴㅏㄹ보다 살아갈 날이 더마 ㄶ지만 오늘 이영화르ㅜㄹ 보고 지금것 살아온 30년이 죄스러어 오른손 중지,검지 손가락 ㄷ개 잘랐습니다. 지금도 왼손으로ㅁ ㅏㄴ  키보ㄷ드 두드 ㅀ겨서 불편 하지만 후회는 업습니다.  "
11-3-2015,2015,11,3,22:52,화요일,10,3,0,다오리(daor****),누구나 볼 수 있지만 함부로 볼 수 없는 영화  
10-30-2015,2015,10,30,23:07,금요일,10,3,0,슬픈향기(eldo****),"2004년도에 만든 영화라서 그런지, 그당시 활약하던 배우들이 만이 나왔습니다. . 더욱 압권인것은 그당시 국회의원이었던 자민련의 ""구천서의원""이 나온것입니다. 보육원장역으로 나온사람임. 약력을 보니 태권도협회 회장을 역임해서 우정출연한듯 합니다.  "
10-30-2015,2015,10,30,14:25,금요일,10,3,0,용이(myth****),아빠 일어나~!!똥꼬쇼 해야지  
10-27-2015,2015,10,27,21:43,화요일,10,3,0,kkmi****,"각본, 연출, 연기력 삼박자 고루 갖춘 마스터피스. 국내에서 놀 만한 영화가 아니다.  "
10-27-2015,2015,10,27,01:05,화요일,10,3,0,David Hwang(davi****),우리나라의 전설의 레전드가 될 영화  
10-24-2015,2015,10,24,22:44,토요일,10,3,0,SkyBlue(2581****),가려진 비운의 역작이다  
10-24-2015,2015,10,24,05:40,토요일,10,3,0,바리스타(fox8****),이걸보고  부전증이 나았습니다  
10-22-2015,2015,10,22,17:04,목요일,10,3,0,스폰(azak****),눈이 정상이고 귀도 정상이고 머리와 가슴도 정상인것을 확인 시켜주는 눈과 귀와 가슴을 매료시키는 영화  
10-22-2015,2015,10,22,00:43,목요일,10,3,0,whtj****,니인생 최고의 영화 공백열자  
10-18-2015,2015,10,18,13:27,일요일,10,3,0,wpep****,이 영화는 뭐랄까요.  지금까지 20번도 넘게 보았지만 늘 볼때마다 새롭고 감동이 북받쳐오르는 그런 영화입니다.  
10-12-2015,2015,10,12,06:13,월요일,10,3,0,MIH(kv01****),정말 아름다운 이야깁니다.  
10-11-2015,2015,10,11,22:17,일요일,10,3,0,1000c(mskl****),인류역사상 다신 볼 수 없는 작품  
10-10-2015,2015,10,10,16:53,토요일,10,3,0,팔복(parb****),이 영화를 보지 않았다면 영화 봤다고 말하지 마라  
10-8-2015,2015,10,8,21:28,목요일,10,3,0,kgm7****,이런 영화가 묻히면 안 됩니다. 이런 영화가 묻히면 우리나라 영화계는 미래가 없습니다.  
10-5-2015,2015,10,5,17:58,월요일,10,3,0,총없는군인(adkd****),아빠 일어나!ㅠㅠㅠㅠ  
10-5-2015,2015,10,5,17:49,월요일,10,3,0,ghks****,이 영화 안본눈 삽니다 그 감동 다시한번 느껴보고싶습니다 ㅠㅠ  
10-4-2015,2015,10,4,16:02,일요일,10,3,0,틈메이러(eogn****),이 영화가 병인양요때 있었더라면 프랑스군은 외규장각 대신 이 영화를 가져갔을 것 이다.  
9-26-2015,2015,9,26,23:36,토요일,10,3,0,me8u****,말이필요없다..최고의영화  
9-26-2015,2015,9,26,21:50,토요일,10,3,0,아름누리(iykh****),한국영화 역사상 내 인생 최고의 영화네요  
9-20-2015,2015,9,20,22:06,일요일,10,3,0,민동(dhmi****),10억 감동의 대작.  60억 인구가 이 영화를 보게 되는 그 날까지  
9-20-2015,2015,9,20,18:47,일요일,10,3,0,100마일하이바투척(qwas****),내 나이 서른중반에서야  오늘 이 영화를 보았다. 밀려오는 감동에 눈에서는 눈물이 코에서는 콧물이 온몸으로 전해지는 이 전율은 신병교육대에서 처음 접한 CS탄을 경험했을때의 그것과도 비교할수 없었다.  
9-20-2015,2015,9,20,00:29,일요일,10,3,0,구두(dhk5****),한국영화계는 클레멘타인 이전과 이후로 나뉜다.  
9-15-2015,2015,9,15,02:42,화요일,10,3,0,밀라노(tpdl****),"옆동네 ""무서운집""의 호평이 클레멘타인을 위협하고 있지만 난 클레멘타인을 끝까지 지지할 것이다.  "
9-7-2015,2015,9,7,20:25,월요일,10,3,0,으아니(rhwk****),이 영화를 보고 감동받아 삼일 낮 삼일 밤을 울었습니다  
8-31-2015,2015,8,31,01:22,월요일,10,3,0,윈간(mari****),나름 영화좀 봤구나 했었는데 평점9점이 넘는 이런 영화가 있었나...하고 다운 받아서 봤다. 왜 이제서야 봤을까?최고의 영화는 아니지만서도 다섯손가락에 꼽히는 명작으로 남을듯 하다.  
8-30-2015,2015,8,30,13:04,일요일,10,3,0,뭐(skt1****),최고의 영화. 자세한 설명은 생략한다.  
8-27-2015,2015,8,27,15:30,목요일,10,3,0,ghfk****,태어나서 느껴보지 못한 전율을 느꼈습니다...고맙습니다..클레멘타인..  
8-15-2015,2015,8,15,10:29,토요일,10,3,0,암소서리(pjh7****),이 영화를 보고 여자친구가 생겻습니다  
8-13-2015,2015,8,13,11:26,목요일,10,3,0,샹꾸(kkur****),아직 안봤고 앞으로 볼 생각도 없지만 추천 합니다.  
8-11-2015,2015,8,11,18:19,화요일,10,3,0,코코아(qkdr****),날가져요 클라멘타인 엉엉  
8-11-2015,2015,8,11,01:04,화요일,10,3,0,흰밥(munj****),이응이응님 혼자만 재밌는거볼라구;; 낚시하시넹  
8-8-2015,2015,8,8,01:05,토요일,10,3,0,하이라이트(jwys****),도대체 무슨말이 필요한가?  
8-5-2015,2015,8,5,18:33,수요일,10,3,0,그림글쟁이(sayo****),진짜 다시는 나오지 않을 명작입니다.평점깎아내리는 테러도 몇몇개 있긴 하지만 그건 낚시입니다. 꼭 보세요.  
8-5-2015,2015,8,5,11:06,수요일,10,3,0,하시칸(jimi****),이 영화 1점주는사람 뭔가요? 안티인가요?  
8-1-2015,2015,8,1,05:44,토요일,10,3,0,shin****,이 영화를 본지 3분 14초만에 감동이 벅차올라 더 보지 못하고 꺼버렸습니다...  
7-27-2015,2015,7,27,14:02,월요일,10,3,0,weby****,이 영화를 보고 삶의 의미를 찾았습니다.  속편이 나온다면 4D로 보고 싶습니다.  
7-27-2015,2015,7,27,12:55,월요일,10,3,0,마시부르(kimj****),하기스는 필수입니다.  
7-25-2015,2015,7,25,22:00,토요일,10,3,0,ArchNemesis(kkoo****),이 영화는 매우 훌륭한 영화이며 10점 받을 가치가 있는 영화입니다. 이것은 저 뿐만 아니라 평점을 매긴 수 많은 사람들 또한 동감하는 내용일 것입니다.  
7-24-2015,2015,7,24,00:43,금요일,10,3,0,빠돌이(tjdd****),평점 높아서 찾아서 봤는데 평점이 높은 이유를 알게됐습니다  
7-22-2015,2015,7,22,18:11,수요일,10,3,0,뒤퐁(k790****),"아, 도대체 재개봉은 언제 하는거지...  "
7-22-2015,2015,7,22,17:08,수요일,10,3,0,제라툴(jh51****),한국 영화계의 자존심이다. 꼭 보시길  
7-22-2015,2015,7,22,16:01,수요일,10,3,0,some****,한국의 엑스펜더블..  
7-17-2015,2015,7,17,00:17,금요일,10,3,0,tagdal(hotm****),전무후무한 캐스팅 !!  
7-15-2015,2015,7,15,18:40,수요일,10,3,0,thtrjhyy(sspo****),아빠!일어나! 할때의 내 마음에 순간 전율이 일었고 나는 그 자리에서 일어나 기립박수를 했다  
7-13-2015,2015,7,13,00:44,월요일,10,3,0,ckc1****,전부 무시하고 내말만 들어라...영웅 샐러멘더의비밀 부터 보고 이 영화를 봐라 한국이 세계의 중심이라는 걸 너희들도 알게 될거다..극장에서 안보고 컴퓨터 모니터로 본게 후회되서 모니터를 발로 차버렸다..발에서는 피가나는데 눈물이 멈추질않아서 눈물부터.  
7-10-2015,2015,7,10,13:53,금요일,10,3,0,응냐흠냐(rnr7****),제가 영화를 많이봐왓지만 이렇게 대작은 없음  
7-9-2015,2015,7,9,07:22,목요일,10,3,0,꼬마니콜라(yugi****),내  인생 바로 그 자체다.  
6-29-2015,2015,6,29,03:18,월요일,10,3,0,로너판타(reco****),며칠전 외계인들에게 납치되어 검사와 취조와 고문으로 그만 정신을 놓았다 근데 한줄기 빛같은  소리가 들려서 정신을 차렸는데 외계인둘이 내 노트북으로 이영화를 보면서 '아빠 일어나'를 연호하고 있더군요. 한 외계인이 미안하다며  꼭 안아주었습니다.  
6-29-2015,2015,6,29,00:21,월요일,10,3,0,dsdd(dusd****),최고의 영화. 딸의 울음을 보고서 참지못하고 시갈을 줘패서 결국 돈을잃고 똥꼬쇼를 하게되는 결말은 정말 최고입니다....  
6-27-2015,2015,6,27,13:43,토요일,10,3,0,율무차(csvo****),엄지 척!11점 주고싶은데 방법이 없네  
6-26-2015,2015,6,26,16:26,금요일,10,3,0,punk****,이 영화를 보고 암이 남았습니다.  
6-26-2015,2015,6,26,14:43,금요일,10,3,0,mxml****,진짜 최고영화인데 말로 설명할 방법이 없네.  
6-26-2015,2015,6,26,14:07,금요일,10,3,0,리암(jigg****),여기서 주목할 점은 의리의 사나이 김보성이 의리출연 했다는 점이다.   9점이상 평점의 영화가 두편이나 있다니... 역시 그는 대한민국 대표 명배우며 흥행보증수표다!!  
6-9-2015,2015,6,9,18:42,화요일,10,3,0,brilliant(xuyi****),내 인생은 클레멘타인을 본 기점으로 새로이 시작됐다.  
6-8-2015,2015,6,8,16:48,월요일,10,3,0,수비요정(jjam****),이 영화를 보고 저도 암이 나았어요  
6-8-2015,2015,6,8,15:20,월요일,10,3,0,국립화공과학생이예요(sda2****),제가 20년동안 이 영화를  보지 못한 것은 제 인생의 큰 실수였습니다  
6-7-2015,2015,6,7,21:48,일요일,10,3,0,강석범(arie****),정말 대단한 영화라고밖에는..  
6-7-2015,2015,6,7,17:01,일요일,10,3,0,guke****,연휴특집영화로 방영 안되는 이유가 저작권료가 엄청나다고 하네요.한 아이의 아버지의 삶...법보다 주먹이 빠르다는걸 느꼈습니다.영웅본색이 총이라면 클레멘타인은 주먹입니다.제 부인 보여주면서 울었던 첫 영화입니다  
6-7-2015,2015,6,7,07:46,일요일,10,3,0,jyk7****,최고의.액션..와대단한영화다..  
6-7-2015,2015,6,7,02:54,일요일,10,3,0,뻐끔(kids****),영화를보고 ㅂㄷㅂㄷ 거리며 잠이들었는데 깨어보니 철창 안 이었다 잠이들었을때 조차 내 몸을 움직이게 한 어마무시한 영화다.  
6-6-2015,2015,6,6,16:31,토요일,10,3,0,짜녕찡(1jjo****),"이 영화를 보면 무슨 병이든 낫는다는 건 이젠 공식이 돼버렸죠.암을 앓고 있던 제게 지인이 선물로 하나 주더군요. 이걸보면 나을 거라면서. 혹시나 하고 한 번 보았는데, 암이 정말 나았어요.투병하고 계신분들께 강추입니다  "
6-6-2015,2015,6,6,14:19,토요일,10,3,0,무패신화(789y****),"내가 살면서 가장 후회는 이 영화를 11년만에 안 것이며,가장 잘한건 지금이라도 이 영화를 안 것이다  "
6-5-2015,2015,6,5,01:21,금요일,10,3,0,바락버럭(arom****),이 영화를 보고 불면증이 나았습니다.  
5-30-2015,2015,5,30,00:06,토요일,10,3,0,Holmes(open****),"평화로운 일요일아침, 아빠일어나! 난 일어날 수 밖에 없었다.  "
5-24-2015,2015,5,24,04:25,일요일,10,3,0,삼청(klis****),"No Clementine , No Life  "
5-24-2015,2015,5,24,03:47,일요일,10,3,0,간지(dngm****),컴퓨터 고장으로 인해 A/S를 맡겼지만 바탕화면에 있는 클레멘타인을 A/S기사님께서 보시곤 아직도 컴퓨터를 돌려받지못했습니다.  
5-24-2015,2015,5,24,00:07,일요일,10,3,0,부띠끄(zuzu****),난 이걸  10번도 넘게 봤지만  또 보고싶다.  
5-23-2015,2015,5,23,21:26,토요일,10,3,0,alcl****,당장 내일 죽더라도 클레멘타인은 보고 죽어야 지옥에 가서도 행복하다  
5-23-2015,2015,5,23,00:50,토요일,10,3,0,mywa****,나는 10점을 준 게 아니다. 여기에 8점을 더해 OO점을 주고싶은 마음이다. 18  
5-16-2015,2015,5,16,16:46,토요일,10,3,0,카밀로(mlp9****),여러분의 소중한 시간 클레멘타인이 책임집니다. 꼭 보세요  
5-16-2015,2015,5,16,15:02,토요일,10,3,0,Neutimulus(sooo****),이 화가 9점 초반대밖에 되지 않는다니.. 정말 한탄스럽습니다.  
5-16-2015,2015,5,16,05:29,토요일,10,3,0,kim9****,처음이었습니다. 영화에 몰입해서 팝콘을 한입도 먹지않았던 것은...  
5-16-2015,2015,5,16,00:50,토요일,10,3,0,귤고양이(gyul****),투자자들이 2편을 만들라했지만 팬들의 만류로 못만들어지고 있는 속편... 심지어 임권택 봉준호 강재규 같은 명 감독들조차 본편의 누가 될까봐 연출을 거부하고있다....원작을 뛰어넘을수 없다는 팬들의 확신이 있는 유일한 영화. 클레맨타인은 그런영화다  
5-14-2015,2015,5,14,18:55,목요일,10,3,0,TOOL(xkdl****),4DX 로 리부트 하자! 전율을 다각도로 느끼고 싶다!  
5-14-2015,2015,5,14,11:30,목요일,10,3,0,박민우(minw****),개나이스이다 이건ㅇㅇㅇㅇ  
5-14-2015,2015,5,14,05:07,목요일,10,3,0,rrhl****,"내일 만약 지구가 멸망한다면, 한 그루의 사과나무를 심는대신 클레멘타인을 한번 더 볼것입니다  "
5-12-2015,2015,5,12,20:25,화요일,10,3,0,하스타(60tt****),최고의영화라생각합니다.  
5-12-2015,2015,5,12,16:32,화요일,10,3,0,선짱님(kiki****),이 영화는 혁명입니다 레볼루션 피스  
5-7-2015,2015,5,7,20:22,목요일,10,3,0,Diaco(rube****),다시는 나올 수 없는 작품  
5-5-2015,2015,5,5,23:48,화요일,10,3,0,빈둥비인둥(dnlf****),이세상 최고의 영화~ 보고나서 보지않았던을 후회하게 되었습니다  
5-5-2015,2015,5,5,13:57,화요일,10,3,0,Rose(alst****),이 영화를 본지 11시간째 아직도 눈물이납니다  
5-2-2015,2015,5,2,20:21,토요일,10,3,0,까치(west****),"저급한 국내 영화계에 다시는 나오지 않을 명작. 삼류 느와르,성인 물이나 찍는 국내 영화 감독들은 본받길 바란다.  "
5-1-2015,2015,5,1,16:28,금요일,10,3,0,9804****,사이코패스도 보면 울고나올 영화  
4-27-2015,2015,4,27,04:10,월요일,10,3,0,swimstar(swim****),모니터도 울고 스피커도 울고 데스크탑도 울고 나도 울었다  
4-27-2015,2015,4,27,00:39,월요일,10,3,0,TheCrazyDemon(demo****),이걸보고 이런영화를 만들고 싶다는 생각에 영화감독이 되야겠다고 느꼈습니다  
4-24-2015,2015,4,24,21:16,금요일,10,3,0,회오리감자(naya****),박수칠때 떠나라고? 이 영화는 그 말이 틀렸음을 증명해냈다  
2-23-2015,2015,2,23,23:35,월요일,10,3,0,형(tkat****),이 영화를 보고 제 모니터가 울었습니다  
2-23-2015,2015,2,23,12:44,월요일,10,3,0,Electronic(drea****),가장 힘든 순간 보면 힘이나는 그런 영화!  
2-21-2015,2015,2,21,23:20,토요일,10,3,0,승호(ysh9****),전설의영화입니다..  
2-21-2015,2015,2,21,16:48,토요일,10,3,0,안심이(woog****),제가 46인데 이런영화가 있는줄 몰랐네요...평점이 너무 좋아서 한번 빌려볼까합니다...감사합니다...^^  
2-14-2015,2015,2,14,19:57,토요일,10,3,0,그냥커피(rkdi****),정말감동적인영화. 내인생 탑 파이브에꼽히는  
2-14-2015,2015,2,14,19:43,토요일,10,3,0,일리늄(dlff****),스무번도 넘게봤지만 볼때마다 가슴속 깊은곳에서부터 쏟아져나오는 눈물만큼은 막을수 없었습니다...ㅜㅜ  
2-14-2015,2015,2,14,16:29,토요일,10,3,0,동네춤꾼(sibi****),이 영화를 보기위해 지옥에서 돌아왔다..  
2-14-2015,2015,2,14,11:57,토요일,10,3,0,감자탕(gusa****),성지순례. 꼭 한번 봐야지  
2-12-2015,2015,2,12,21:23,목요일,10,3,0,유별희(dt72****),저는 학생인데요 어느날 선생님께서 감동적인 영화라며 보여주셨고 그날 전교생이 울고 선생도 울고 전미가 울었다  
2-11-2015,2015,2,11,21:12,수요일,10,3,0,loir****,나는 이 영화를 봤다 고로 존재한다.  
2-11-2015,2015,2,11,16:47,수요일,10,3,0,츄파춥스(js79****),이번 구정 연휴는 이 영화와 함께...5일 쉬니까 25번은 볼 수 있겠네요.  
2-9-2015,2015,2,9,03:15,월요일,10,3,0,르누와르(gjwl****),"내가 클레멘타인 이고, 클레멘타인이 나다.  "
2-7-2015,2015,2,7,16:05,토요일,10,3,0,MrDear(dir1****),얼마전 위암 말기로 5일밖에 살지 못한다는 판정을 받았습니다. 하지만 얼마전 어린이 극장에서 개봉한 클레멘타인을 보고나서 위암 완치판정을 받고 퇴원했습니다.  
2-6-2015,2015,2,6,00:44,금요일,10,3,0,랄라뽕(dldn****),말기암환자도 살린다는 항암치료제  
2-5-2015,2015,2,5,10:12,목요일,10,3,0,밥(hyo0****),"김두영씨, 고맙습니다. 똥꼬쇼까지 하며 이 영화를 만들어주셔서...  "
2-5-2015,2015,2,5,06:24,목요일,10,3,0,오뎅탕(vlov****),이영화를볼수있어행복했습니다  
2-4-2015,2015,2,4,16:54,수요일,10,3,0,산체스의축구화(stai****),10점을 주면서 제 스스로 대견해서 머리를  한번 쓰담쓰담 했습니다.  
2-3-2015,2015,2,3,10:00,화요일,10,3,0,알마니 루이까(kdl6****),진짜 차가웠던 내마음이 영화가 끝나가며 스르르 녹아내렸다....  
2-2-2015,2015,2,2,18:06,월요일,10,3,0,geor****,이제야 이런명작을 보다니..  
2-2-2015,2015,2,2,14:59,월요일,10,3,0,아프리카노(sju2****),이 시대 진정한 아버지의 이야기.정신을 차려보니 영화는 끝나있었다. 몰입도 굿  
2-2-2015,2015,2,2,09:22,월요일,10,3,0,한정훈(wjdg****),와대박..반전소름...  
2-1-2015,2015,2,1,23:26,일요일,10,3,0,compact(comp****),10점을 줘야 할꺼 같아서  
2-1-2015,2015,2,1,17:31,일요일,10,3,0,미츠자네(chms****),그냥 울었습니다....  
2-1-2015,2015,2,1,13:31,일요일,10,3,0,검은호랑이(crit****),안보고 뭐하냐 너희는 지금 인생을 낭비하고있다  
2-1-2015,2015,2,1,00:54,일요일,10,3,0,바므(colt****),감독님. 감사합니다. 감독님의 OOO살래와 클레멘타인은 제 인생을 송두리째 바꿨습니다.  
1-31-2015,2015,1,31,23:53,토요일,10,3,0,스마슈(coc4****),지구 최강의 영화 진심임.  
1-31-2015,2015,1,31,22:09,토요일,10,3,0,lilac(leej****),아직보진안앗지만 이름만들어더 눈물ㅇ...  
1-29-2015,2015,1,29,22:33,목요일,10,3,0,Park_SoY(namy****),지금에서야 이런 명작을 보게 되다니...  
1-27-2015,2015,1,27,23:55,화요일,10,3,0,쩔춘(joo8****),인생영화 꼭 두번 보세요~  
1-27-2015,2015,1,27,12:06,화요일,10,3,0,이로운(hats****),영화보다 연관영화가 더 꿀잼이네요!  
1-24-2015,2015,1,24,21:44,토요일,10,3,0,wnst****,이 영화를 보고 초능력이 생겼어요  
1-23-2015,2015,1,23,16:02,금요일,10,3,0,ssps****,죽기 직전 이영화를 생각하면.. 다시 일어날수 있습니다...그런의미에서 이영화는 꼭 봐둬야합니다.  
1-23-2015,2015,1,23,14:56,금요일,10,3,0,의사양반(kdwy****),전설의 병작 그이상..  
1-23-2015,2015,1,23,09:13,금요일,10,3,0,1q(kkd0****),이건 별점으로 평가할수있는 영화가 아니다  
1-21-2015,2015,1,21,18:47,수요일,10,3,0,9704****,"아니, 다들 너무하시네.이렇게 좋은영화를 왜 평점을 낯추시는지-_-이런영화, 여럿이서 보면 좋잖아요?DVD로 사도 괜찮을듯 싶은 영환데... 저는 안사긴 했지만;;  "
1-20-2015,2015,1,20,22:57,화요일,10,3,0,ㅇㅇㅅ(youn****),내 생애 최고의 영화였다..  
1-20-2015,2015,1,20,15:47,화요일,10,3,0,그래요나에요(jc40****),내 인생 최고의 영화다....  
1-20-2015,2015,1,20,12:56,화요일,10,3,0,이영호(lees****),인간의 정신은 아직 이 영화를 이해할 수 있을만큼 성숙하지 못하다  
1-20-2015,2015,1,20,12:28,화요일,10,3,0,bluesky(jins****),희대의 영화다인간의 죄중 하나는 클레멘타인을 보지않는것이다  
1-18-2015,2015,1,18,20:46,일요일,10,3,0,언제나(mala****),함께할까합니다. 힘냅시다.  
1-18-2015,2015,1,18,03:24,일요일,10,3,0,요화(tjsc****),경이롭다란 말밖에 안나온다..  
1-18-2015,2015,1,18,01:31,일요일,10,3,0,금요일밤(ssju****),이영화를 보고 관절염이 나았습니다  
1-17-2015,2015,1,17,14:37,토요일,10,3,0,킹곰(rich****),아....'아빠 일어나!' 이 대사를 듣는 순간 저도 모르게자리에서 일어나면서 20°가까이 휘어져 있던 제 등뼈가 꼿꼿하게 펴졌습니다 정말 제 인생을 바꿔준 영화입니다!  
1-11-2015,2015,1,11,00:57,일요일,10,3,0,mr KUKEKO(qjel****),이 영화 감상평만 읽고 암이 나았습니다  
1-8-2015,2015,1,8,23:24,목요일,10,3,0,im45****,지구는 이영화를 만들기위해 만들어졌다.  
1-4-2015,2015,1,4,13:49,일요일,10,3,0,LOEL(cat8****),"1점 준 사람들 반성해라, 한국영화 명작에 남을 희대의 작품이다. 왠만한 영화인들 클레멘타인 모르는 사람없다. 제대로 보고 반성해라  "
1-3-2015,2015,1,3,23:19,토요일,10,3,0,갓성대15학번찡(saoj****),아직 이 영화를 보지 못했다면 당신은 죽을 자격이 없다. 그 어떤 시궁창 인생일지라도  
1-2-2015,2015,1,2,10:45,금요일,10,3,0,Oing(kimm****),이 영화가 한국 영화라는것이 너무나도 가슴벅차고 감격스럽다.  
12-19-2014,2014,12,19,01:25,금요일,10,3,0,풍경(acid****),인간의 수명은 90년 정도일것이다. 그 90년 중에 90분이 얼마나 소중한지를 알게해준 영화!!!! 내 인생은 왜 이리 고달플까. 라고 한탄하는 당신에게 이 영화를 추천한다!  
12-16-2014,2014,12,16,20:29,화요일,10,3,0,사람(skdm****),클레멘타인 보지않은 뇌 구합니다... 처음 이 영화를 접했을 때의 감동이 잊혀지지않네요...  
12-13-2014,2014,12,13,03:30,토요일,10,3,0,베릴(enje****),인생 최고의 영화인듯!  
11-29-2014,2014,11,29,15:33,토요일,10,3,0,xo태극(tree****),내 인생의 최대의 오점은 이 영화에 10점 밖에 줄 수 없는 것이다.  
11-28-2014,2014,11,28,23:01,금요일,10,3,0,ㅇㅇ(lolc****),아빠!!!!일어나!!!! ㅠㅠ  
11-28-2014,2014,11,28,11:38,금요일,10,3,0,haha****,감히 평점을 줄수 있는 그런 영화가 아니다..  
11-28-2014,2014,11,28,09:56,금요일,10,3,0,가브리엘(flar****),역대 최고의 영화..말이 필요없다  
11-27-2014,2014,11,27,02:26,목요일,10,3,0,위닉(wnwj****),이걸 본후 다이아로 승급했습니다.  
11-25-2014,2014,11,25,05:24,화요일,10,3,0,감자(rlat****),퇴근 후 클레멘타인 보면서 소주 한잔. 이것이 인생의 낙  
11-24-2014,2014,11,24,17:09,월요일,10,3,0,뱃살크루져(juno****),불후의 명작입니다 10점 ㅇㅇ  
11-17-2014,2014,11,17,16:36,월요일,10,3,0,공원달캐슬(giga****),클레멘타인2가 나온다는 소리에 인터스텔라의 몰락을 걱정하게 되었다  
11-12-2014,2014,11,12,21:37,수요일,10,3,0,박우한(mkql****),곧 클레멘타인2가곧 개봉한다고한다...  인터스텔라는 곧 극장에서 내려갈것임.. 이영화를 처음볼당시 어쩔수없는.엔딩크레딧을보고도한참이나 멍하니서잇엇습니다... 제가하찮게 생각됫고 몇일간 아무것도할수없엇습니다... 이것은  세계영화의 유산입니다  
10-24-2014,2014,10,24,23:09,금요일,10,3,0,말이오(sung****),스티븐잡스가  세상을 뜨기전 이영화를 먼저 봤다면 우리는 새로운 애플의 패러다임을 만났을것이다.  
9-27-2014,2014,9,27,19:55,토요일,10,3,0,헐레벌떡(bong****),"취업이 어려워 우울증에 빠졌는데, 다시금 일어설수있게해준 멘토영화입니다.  "
9-24-2014,2014,9,24,21:19,수요일,10,3,0,도연상(cys1****),단언컨데 노아가 살아있다면 이 영화를 가장먼저 방주에 넣었을 것입니다.  
9-24-2014,2014,9,24,17:36,수요일,10,3,0,귀염인형(llg1****),보고 말을 잃었다.한동안 아무 말도 할 수 없을 듯 하다.  
9-24-2014,2014,9,24,14:21,수요일,10,3,0,박민석(sasi****),보지 않아도 느낄 수 있다. 만점  
9-24-2014,2014,9,24,13:15,수요일,10,3,0,Duke(duke****),이 영화를 통해 내 자신이 얼마나 나약한 존재인줄 깨닭았습니다.  
9-23-2014,2014,9,23,20:35,화요일,10,3,0,sun0****,역시 평점은 무시못합니다.. 두번보세요 세번보세요.. 내인생 최고의 영화..ㅠㅠ  
9-23-2014,2014,9,23,16:29,화요일,10,3,0,좀생이별(w692****),이제야 보는구나. 역시 네이버 평점이 높은데는 이유가있네요  
9-23-2014,2014,9,23,03:34,화요일,10,3,0,nots****,제 아들의 컴퓨터 재생목록에 클레맨타인이 있었습니다. 그 후로 서로 눈을 마주치지 못합니다. 주체할 수 없는 눈물때문에...  
9-19-2014,2014,9,19,00:19,금요일,10,3,0,보리빵(ria1****),우선 이런 명작을 저에게 보게하신 신에게 감사드립니다.   키우는 고양이와 보고 있었어요 중간쯤 보는데 냥이가  갑자기 야멍이라고 하더군요 제귀를 의심했죠 엔딩부분에서는 멍멍이라고 하더군요... 냥이가 개가되는 순간이었어요...  
9-17-2014,2014,9,17,16:55,수요일,10,3,0,verone(cm15****),140칸으로 부족하다  
9-17-2014,2014,9,17,14:51,수요일,10,3,0,js43****,강심장이 아니라면 절대 보지 말것! 왠만한 심장으로는 이 영화를 감당할 수 없기 때문이다!  
9-17-2014,2014,9,17,11:19,수요일,10,3,0,블랙로즈(spdl****),한국 아니 세계 영화계의 센세이션을 일으킬 명작이다!!  
9-17-2014,2014,9,17,04:07,수요일,10,3,0,분당맨(gmlq****),내인생최고의영화!추천  
9-16-2014,2014,9,16,15:28,화요일,10,3,0,슈퍼맨(sieu****),내 인생 최고의 영화. 지금 배꼽이 흔들리고 눈물이 나와서 질문 안 받아요  
9-16-2014,2014,9,16,12:48,화요일,10,3,0,jsh8****,이 영화가 끝나는 순간 생전 처음 느껴보는 오르가슴을 느꼈다.  
9-16-2014,2014,9,16,12:00,화요일,10,3,0,작카(lsj9****),클레멘타인은 인류가 표현할 수있는 스토리와 시각예술의 정점에 이르렀다.  내 인생에 이 영화를 만난것은 벼락같은 축복이었다. 외계문명조차도 클레멘타인 DVD를 탐낼 것이다.  
9-16-2014,2014,9,16,11:56,화요일,10,3,0,천루(song****),내인생 최고의영화!!!!  
9-16-2014,2014,9,16,11:42,화요일,10,3,0,likk****,이 영화를 보고 연영과 여대생을 꼬셔보기로 마음 먹었습니다.  
9-14-2014,2014,9,14,14:45,일요일,10,3,0,파인애플(sing****),인생의 역작입니다. 이걸보고 저는 보이지않던 앞이 보였습니다. 효녀 심청같은 영화 강추합니다.  
9-14-2014,2014,9,14,12:04,일요일,10,3,0,만쭈리(alsn****),그냥 전설.. 아직 안봤으면 더 이상 영화를 논하지 말라.  
9-13-2014,2014,9,13,20:23,토요일,10,3,0,sjsm****,내 인생에 터닝포인트를 준 영화영화가 삶을 바꿔줄수있다는 기적을보여준 조물주의 가장 커다란 선물  
9-13-2014,2014,9,13,17:41,토요일,10,3,0,emotiunstablePath(jyk6****),"천재는 외로운 법이다.반 고흐가 그러했듯, 이 영화도 반드시 재평가를 받게 될 날이 올 것이다.  "
9-13-2014,2014,9,13,00:16,토요일,10,3,0,룽베리(ocel****),"스티븐 스필버그   ""아아 하늘은 쥬라기공원만 내리면됫지 클레맨타인은 왜 같은 시대에 내렸단말인가""    그의 회고록중- 아카데미 시상식에서 받은 최우수 감독영화상을 내던지며..  "
9-12-2014,2014,9,12,16:04,금요일,10,3,0,Karmilo(karm****),성지순례하고 갑니다...  
9-12-2014,2014,9,12,00:48,금요일,10,3,0,게임님(game****),쵝오. 겅백을제외하고10자  
9-11-2014,2014,9,11,16:59,목요일,10,3,0,땡칠이(8012****),장끌로드 반담을 은퇴시킨 바로 그 영화인가요?  
9-11-2014,2014,9,11,10:45,목요일,10,3,0,zzul****,평점 주고 싶어서 영화를 본 건 처음이네요. 여러분과 함께 그 기분 나눌수있게 되어서 영광입니다. 눈물때문에 탈수증상 일어날수잇으니 영화관람 전후로 물한컵씩 드시는건 다들 알고계신거죠?  
9-11-2014,2014,9,11,09:06,목요일,10,3,0,세창이아빠(qwec****),여태까지 주옥같은 댓글들이 많았지만 그러한 댓글들은 영화가 주는 감동의 단 1%도 표현하지 못했다. 이 영화는 진심 베토벤의 비창과 바흐의 G선상의 아리아보다 더 위대한 하나의 예술이다.  
9-10-2014,2014,9,10,18:16,수요일,10,3,0,duor****,추석에는 클레멘타인이죠  
9-5-2014,2014,9,5,21:09,금요일,10,3,0,meathook(syme****),말이필요없는영화 죽기전에 봐야할 영화 0순위  
9-5-2014,2014,9,5,19:15,금요일,10,3,0,젠투(j100****),아!!! 꼭 보고 싶어요! 어디서 볼 수 있나요???  
9-5-2014,2014,9,5,00:44,금요일,10,3,0,윤지훈(wlgn****),"와씨,, 액션영화인줄로만 알았지 이렇게 감동적일줄은 몰랐습니다. 혹시 보실 분들은 마음의 준비 단단히하시고 휴지 꼭 준비하십시오ㅠㅠ 아빠!! 일어나!!!  "
9-4-2014,2014,9,4,22:11,목요일,10,3,0,이즈칸(semy****),이 영화가 내머리속의 지우개같은 영화와 같은 해에 나온 명작이라니....정말...우선 꼭 봐라...  
9-4-2014,2014,9,4,15:38,목요일,10,3,0,김묘랑(alac****),삼십 년 인생 최고의 영화...  
9-4-2014,2014,9,4,06:48,목요일,10,3,0,quillRow(xogu****),중학교때 학교에서 단체로 관람하러 갔습니다. 아직도 친구들의 표정이 생생합니다...  
9-3-2014,2014,9,3,22:57,수요일,10,3,0,백동(sell****),슬픈영화 입니다....휴지 준비해두세요...남자라면 한번쯤..  
8-30-2014,2014,8,30,16:51,토요일,10,3,0,yoon****,내가 찾던 영화가 바로 여기있었군  
8-29-2014,2014,8,29,22:50,금요일,10,3,0,webmaster(webm****),내인생 최고의영화입니다.. 정말 잊을수가 없습니다..  
8-29-2014,2014,8,29,22:47,금요일,10,3,0,피트웬츠(psyd****),말이 필요없다 죽기전에 꼭 한번 보시길 권함  
8-29-2014,2014,8,29,03:41,금요일,10,3,0,하드리아누스(xowl****),말이 필요없는 최고의 작품입니다^^  
8-28-2014,2014,8,28,22:08,목요일,10,3,0,zzz(dlad****),클레멘타인을보고 저는 108번뇌를 잊고 해탈의경지에 이르렀습니다. 부처 미륵 소크라테스 솔로몬 무하마드 공자  또한 이영화를 보았다고합니다  
8-28-2014,2014,8,28,18:04,목요일,10,3,0,금강반야바라밀(nazz****),이 영화를 보고 로또에 당첨됐습니다.  
8-28-2014,2014,8,28,16:57,목요일,10,3,0,홍로(ware****),미쳤다 미쳤어 최고의 영화  
8-28-2014,2014,8,28,16:24,목요일,10,3,0,윤(smil****),감덩이치밀어오르는영화.  
8-28-2014,2014,8,28,10:01,목요일,10,3,0,스티기(lcj7****),말이 필요한가  다시나올수없는 명작이다  
8-27-2014,2014,8,27,23:52,수요일,10,3,0,pps0****,이세상을 통틀어 존재하는 명작  
8-27-2014,2014,8,27,23:32,수요일,10,3,0,양거리(like****),세달된 딸도..이 영화를 보고..아빠 일어나...라고 울면서 말하네요..운물위 대 서사시..  
8-27-2014,2014,8,27,23:13,수요일,10,3,0,훈련병(cowg****),정말 재미있어요 꼭 보세요  
8-27-2014,2014,8,27,10:59,수요일,10,3,0,leo(sust****),"남자가 일생에서 울어야 할 때는 딱 세번 뿐이다. 태어날 때, 부모가 돌아가실 때, 나라를 잃을 때. 허나, 이 영화를 보고 아이의 '아빠 일어나!' 그 애잔한 한 마디에 나도 모르게 눈물이 왈칵 쏟아지고 말았다.  "
8-26-2014,2014,8,26,12:12,화요일,10,3,0,우탄이(gre1****),이제 보니까 저거 줄거리 읽으면 안된다. 결말만 말 안하면 스포일러 아닌 줄 아냐. 나는 줄거리 보고 암이 나았다.  
8-24-2014,2014,8,24,18:54,일요일,10,3,0,중립국(gote****),똥꼬에서도 벅찬 감동의 눈물이 흐른다  
8-24-2014,2014,8,24,16:53,일요일,10,3,0,마돈(chae****),이 10점은  마이너스 10점을 주기위해서이다.  
8-22-2014,2014,8,22,11:20,금요일,10,3,0,키드니키(yhwa****),2004년에 나온 이영화를 10년만에 본 것이 나에게는 잃어버린 10년이었다.왜 이제야 보게 되었을까..  
8-21-2014,2014,8,21,21:43,목요일,10,3,0,수정(smar****),내가 멀리까지 볼 수 있었던 것은 거인의 어깨위에 있었기 때문이다  
8-21-2014,2014,8,21,20:17,목요일,10,3,0,삼분말하기(rlad****),이 영화를 보고 두가지를 깨달았다... 내가 태어난 이유와 자식을 낳아야하는 이유....  
8-20-2014,2014,8,20,12:11,수요일,10,3,0,star****,"내 생애 가장 탁월했던 선택... 감히 저 따위가 한국 영화계를 여덞 걸음 진보시킨 위대한 액션 걸작 클레멘타인에게 별점을 매기다니, 이제 죽어도 여한이 없습니다. 사랑합니다, 클레멘타인. 사랑합니다, 스티븐 시걸.  "
8-20-2014,2014,8,20,08:46,수요일,10,3,0,cc85****,최고다9000점주고싶다  
8-20-2014,2014,8,20,01:23,수요일,10,3,0,파란새(para****),의심하지 마라. 끝까지 봐라. 엔딩크레딧까지 정신놓고 보고있는 자신을 발견하게 될 것이다.  
8-19-2014,2014,8,19,19:54,화요일,10,3,0,jyj5****,사나이는 태어나서 3번 운다고 합니다첫째.태어났을때둘째.세상이망했을때셋째.클래멘타인을보았을때  
8-19-2014,2014,8,19,04:49,화요일,10,3,0,vaffosn(over****),저는 손발이 오무려 지지 않는 장애인 이였습니다 그런데 이영화를 보고 손발이 드디어 오그라들었고 장애들 고쳤습니다 그리고 지금은 피아니스트가 되어 베를린필과 협연 계획이 있습니다  
8-16-2014,2014,8,16,01:58,토요일,10,3,0,센고쿠(0616****),이영화는 한국영화역사에 길이남을것이다  
8-15-2014,2014,8,15,23:00,금요일,10,3,0,임성열(agai****),내일 지구가 망할지라도 한그루의 사과나무를 심긴개뿔 클레멘타인을 보세요.  
8-15-2014,2014,8,15,17:56,금요일,10,3,0,간지몽키(swk0****),예고편만 보고 눈물을 흘렸습니다....  
8-15-2014,2014,8,15,17:31,금요일,10,3,0,flam****,치질 수술 후 입원중인 나의 통증마저도 잊게 만든 영화.  
8-14-2014,2014,8,14,13:56,목요일,10,3,0,tlatnrdhdh(dhdl****),지금 내 나인 10대이다 이 영화를 보기 전 나는 삶을 살아야할 이유가없었다 하지만 크레멘타인을 본 이후 나에겐 커다란 삶의 목적이생겼다. 꼭 감독의 얼굴을보고싶다!! 꼭!!!  
8-13-2014,2014,8,13,14:33,수요일,10,3,0,sww1****,캬 진짜 말이 필요읎다 fldjf  
8-13-2014,2014,8,13,05:04,수요일,10,3,0,김수로(rock****),보진 않았지만 평점과 평들 만으로도 충분히 그 전율이 전해진다. 영원히 함께 할 여자친구가 있다면 꼭 같이 보고싶은 영화.  
8-12-2014,2014,8,12,23:53,화요일,10,3,0,판크라스(pan4****),대한민국 남자로 살아가면서 꼭 봐야할 명화 강력 추천합니다  
8-12-2014,2014,8,12,02:50,화요일,10,3,0,akdm****,진짜 최고의 명화! 세상을 살아가는 가장 중요한 가치를 생각하게 해주는 영화다.  
8-10-2014,2014,8,10,15:52,일요일,10,3,0,화신(wsk0****),아빠!!!!일어나....!  
8-10-2014,2014,8,10,15:36,일요일,10,3,0,민석(qwe4****),거짓말안치고 숨이 멎을뻔 했습니다  
8-9-2014,2014,8,9,22:17,토요일,10,3,0,Printhelper(mins****),내 인생에 최고영화~추천합니다.~  
8-9-2014,2014,8,9,21:29,토요일,10,3,0,ghrtgrtthr(hjh1****),영화라는게 뭔지 확실하게 깨닫게 해주었습니다  
8-9-2014,2014,8,9,16:16,토요일,10,3,0,kdw3****,스티븐시걸 멋지네요.  
8-6-2014,2014,8,6,19:14,수요일,10,3,0,COOLGUN(geon****),잘만들었네요 스티븐시걸 영화중 최고인듯!!이동준도 생각보다 연기잘하고요 엑션도 뛰어나네요 아쉬운점은 아역배우가 비호감  
8-6-2014,2014,8,6,14:25,수요일,10,3,0,새벽비(magi****),"아, 이런 영화를 왜 개봉 당시에 몰랐을까...  영화를 보고 나서 자신이 이렇게 바보같이 느껴졌던 적이 없었다. 만약 타임머신이 있어서 과거로 돌아갈 수만 있다면 난 한치의 망설임도 없이 클레멘타인 개봉시점으로 돌아갈 것이다.  "
8-6-2014,2014,8,6,10:46,수요일,10,3,0,Lunatixist(zxon****),성지순례 재개봉 갑시다  
8-6-2014,2014,8,6,05:02,수요일,10,3,0,p393****,그 어떠한 영화도 클레멘타인의 영향권 안에 들지 않은 영화는 없다  
8-4-2014,2014,8,4,09:57,월요일,10,3,0,굉장하게될그분(kho7****),"""클레멘타인을 본다는것은 단 하나의 노력없이 성공할수있는 지름길이다.(sola****)"" 시험이 3개월 남은 제게 클레멘타인은 그 어느것보다 강렬한 유혹입니다. DVD를 구입했지만 아직도 감히 포장지를 뜯지 못했습니다.  "
8-4-2014,2014,8,4,05:50,월요일,10,3,0,Supreme(heyi****),영화보다 평점에 감동을받아 손가락에 감각이생기기시작했습니다.  
8-4-2014,2014,8,4,02:27,월요일,10,3,0,전설의미소년(wwfh****),대한민국 영화사에 다시없을 만한쾌거! 로마의휴일-쇼생크탈출-타이타닉-클레멘타인으로 이어지는 감동의 계보에 정점에선영화.  
8-1-2014,2014,8,1,16:34,금요일,10,3,0,favo****,말할것도 없다  걍봐라  ㅉㅇㅈㅂ  
8-1-2014,2014,8,1,12:34,금요일,10,3,0,네이벼(lyd0****),사업실패로 아픔을 겪고 있을 때 우리 딸아이 생각하면서 큰 슬픔에 잠겼을때 희망을 준 영화였습니다. 평생 소장하렵니다.  
7-30-2014,2014,7,30,21:38,수요일,10,3,0,sayd****,진짜 시대를 뛰어넘은 역작이다! 안본사람은 꼭 보시길  
7-30-2014,2014,7,30,19:36,수요일,10,3,0,검은전사(davi****),오늘 클레멘타인을 보던 여친이 제게 청혼했습니다.준리 선생님... 감사드립니다.  
7-29-2014,2014,7,29,02:49,화요일,10,3,0,국김(babo****),이 시대 최고의 영화입니다 강추합니다  
7-26-2014,2014,7,26,15:41,토요일,9,3,0,구데타(pp1s****),내 인생에 뻘건 사랑을 그린 대작..보고 난후 황홀하기 그지없었다...  
7-22-2014,2014,7,22,21:48,화요일,10,3,0,엄마저년이야(choo****),유병언이 태권도 수련을 결심한 그 영화....  
7-22-2014,2014,7,22,13:04,화요일,10,3,0,만원짜리(lajo****),아직 못봤어요~ 차마 볼수 없었다가 맞는 거 같습니다. 저같은 사람이 봐도 괜찮을까요? 수많은 댓글을 봤을때 제가 그 감동을 감당할 수 있을지 걱정입니다.  
7-22-2014,2014,7,22,11:06,화요일,10,3,0,slee****,저는 솔직히 이 영화를 보고 암이 나았다는 말이 무슨 말인지 몰랐습니다. 어제 정말 이 영화를 보았고 영화를 보는 중에 암에 걸리고 있는것을 느낄 수 있었습니다.  그런데 영화가 끝나자 암이 씻은듯이 나았습니다.  
7-21-2014,2014,7,21,19:12,월요일,10,3,0,시콥콕한(noxk****),영화를 보고나니 어느 새 제 옆에서 벌레들이 가득하네요. 정말 이 영화는 벌레같습니다. 추천합니다.  
7-20-2014,2014,7,20,19:46,일요일,10,3,0,멍시리(jomo****),진심감동적이다!ㅜㅜㅜ  
7-19-2014,2014,7,19,23:29,토요일,10,3,0,렁렁(fnfj****),제 인생 기억에 남는 영화 1위가 될 것 같습니다..  
7-19-2014,2014,7,19,21:44,토요일,10,3,0,와니(cwsw****),이제서야  이런 명작을 보다니..  
7-19-2014,2014,7,19,02:25,토요일,10,3,0,힐(haji****),재개봉해야합니다. 이 아까운 영화를 이렇게.... ㅠㅠ; 시갈횽의 엄청난 액션에 감동합니다.  
7-18-2014,2014,7,18,22:24,금요일,10,3,0,hs22****,그 유명한 클레멘타인 성지순례왔습니다.앞으로 좋은일만 생기게 해주세요!  
7-18-2014,2014,7,18,19:52,금요일,10,3,0,Kmx(time****),하느님... 부처님... 그리고 클레멘타인  
7-18-2014,2014,7,18,15:43,금요일,10,3,0,감사하며살자(lume****),트렌스포머 아바타 타이타닉  반지의제왕 헤리포터를 봤다면 이 영화가 역사에 남을 대작이라는 것을 알수가 있을 것이다.  한국에서 나올수없는 감동의 물결을 느끼고 싶다면 추천한다.  
7-18-2014,2014,7,18,13:06,금요일,10,3,0,페코스(peco****),"평소에 포레스트검프,쇼생크탈출등 명작영화 찾아보는게 취미인데 그 어떤영화도 클레멘타인만큼의 감동을 주는 영화는 없었습니다. 최고의영화.  "
7-18-2014,2014,7,18,10:47,금요일,10,3,0,아름답게살자(tuna****),눈물 흘리는 방법을 잊었다면 추천.  
7-18-2014,2014,7,18,08:45,금요일,10,3,0,목이아파요(qnjf****),ㅋㅋㅋㅋ 꼭보세요ㅋㅋ정말 인생 최고         영화ㅋㅋㅋ 미침 이건 평정 10점으로는 부족한데 ㅋㅋ아놔 왜 열받지 줌인효과를 잘보셔야합니다 따당  
7-18-2014,2014,7,18,05:28,금요일,10,3,0,joro****,정말 최고의 영화입니다.  
7-18-2014,2014,7,18,03:20,금요일,10,3,0,CeeSo(cees****),댓글보고 훼이크인가 했는데 정말 재밌어요  
7-18-2014,2014,7,18,02:32,금요일,10,3,0,첼시코기(pyj0****),"죽는순간 생각했어요..아, 클레멘타인은 보고 죽어야지, 재밌다던데... 전 영화를 다보고 깨달았습니다. 이런대작을 못보고 죽을뻔한제가 한심하고어리석었습니다. 이영화를보고 열심히 살겠다고 다짐했습니다  "
7-18-2014,2014,7,18,02:11,금요일,10,3,0,건하짱짱맨(alqa****),사랑해 언제까지나 항상  
7-18-2014,2014,7,18,01:03,금요일,10,3,0,좋습니다(jcn0****),남들이 10점 주길래 10점줌  
7-17-2014,2014,7,17,22:41,목요일,10,3,0,키으(vick****),말이필요없음. 최고 bb  
7-17-2014,2014,7,17,22:35,목요일,10,3,0,dhta****,큰일났습니다.  이 영화의 감동때문에 이제 다른 어떤 영화를 봐도 시시할거 같습니다. 내 인생 최고의 영화!!!  
7-17-2014,2014,7,17,22:15,목요일,10,3,0,할수있어(poea****),영화를 전공하는 학생은 무조껀 봐야하는 명작 !!!  
7-17-2014,2014,7,17,22:15,목요일,10,3,0,OlElvsUN(asdr****),?진짜 재밋는데 좀 넘겨서봣지만 졸잼  
7-17-2014,2014,7,17,22:15,목요일,10,3,0,nezl****,김자연 꼭 봐라 나는 울었다  
7-17-2014,2014,7,17,22:15,목요일,10,3,0,나는한다(spik****),무슨 말이 필요할까. 눈물의 똥꼬쇼마저도 잠재울  이동준의 회심의 발차기가 얼어붙은 대한민국의 마음을 적신다  
7-17-2014,2014,7,17,22:10,목요일,10,3,0,덕배(us11****),스티븐시..ㅂ..걸..  
7-17-2014,2014,7,17,22:01,목요일,10,3,0,희야(poli****),세상에 태어난걸 감사하게 만들어준 영화!! 어찌 이 기쁨을 혼자 나눌 수 있을까요!! 전 국민이 봐야할 1등 영화입니다!! 강추 강추  
7-17-2014,2014,7,17,20:34,목요일,10,3,0,헤쳐리(jjw3****),이영화를 보지 않고서는 한국영화를 논하지말라 내 일생 이같은 영화를 본것에 감사를 한다 11번을 보면서 한번도 울지 않은적이 없다  
7-17-2014,2014,7,17,20:34,목요일,10,3,0,천을귀인(77sa****),태어나서 첨으로  다섯번 본 영화  
7-17-2014,2014,7,17,20:06,목요일,10,3,0,걸사비우(9039****),잠시만요.. 눈물좀 닦고~~  
7-17-2014,2014,7,17,19:36,목요일,10,3,0,sin123(bioc****),이 영화의 평점에 글을 남길 수 있다는 것은 최고의 기쁨이다  
7-17-2014,2014,7,17,19:22,목요일,10,3,0,eva0****,최고의 영화. 추천합니다.  
7-17-2014,2014,7,17,19:11,목요일,10,3,0,Noah(gian****),감동적이다.. 정말 멋진영화  
7-17-2014,2014,7,17,19:08,목요일,10,3,0,유다이다이(muru****),내 나이 서른하나  드디어 살아갈 이유를 찾았다. 영화의 대사하나하나가 명대사다 오늘 나는 다시 이영화를 볼 생각이다  
7-17-2014,2014,7,17,18:56,목요일,10,3,0,60tqepuuo(nyxo****),클레멘타인 대한민국 건국 이래 최고의 역작  
7-17-2014,2014,7,17,18:55,목요일,10,3,0,섹시코만도(kuki****),이런 명작을 이제서야 보다니....ㅎㅎㅎ  
7-17-2014,2014,7,17,18:40,목요일,9,3,0,은접지(dlal****),감히 10점을 줄 수 없다.내가 완벽이라는 단어를 붙일 수 있는 영화가 아니다한가지는 완벽하게 보장한다 이거 다 보면 운다.  
7-17-2014,2014,7,17,18:20,목요일,10,3,0,나무(tree****),"신은 클레멘타인을 만들었고, 클레멘타인의 위대함을 알리기 위해서 인간을 만들었다.  "
7-17-2014,2014,7,17,18:16,목요일,10,3,0,네입(secr****),이 영화를 보고 심장이 두개가 되었습니다  
7-17-2014,2014,7,17,18:10,목요일,10,3,0,김기린(ovar****),이걸보고 두발로 걸어다닙니다  
7-17-2014,2014,7,17,18:04,목요일,10,3,0,leek****,다시 일어서시기를  기원합니다.  
7-17-2014,2014,7,17,18:03,목요일,10,3,0,전지현(ones****),시간이 왜존재하는지 생각해본적이있는가.. 클레멘타인을 보는 순간 당신은 당신인생에 있어 가장 중요한 시간을 보내고있다는걸 알아야한다..  -  
7-17-2014,2014,7,17,18:02,목요일,10,3,0,알아서뭐하게(allu****),....말로 표현을 어떻게해.  
7-17-2014,2014,7,17,17:50,목요일,10,3,0,유나미(swee****),클레멘타인 재개봉 합시다  
7-17-2014,2014,7,17,17:49,목요일,10,3,0,김민근(mink****),개잼데헿헤헿 안본사람들개부럽ㅜㅠ  
7-17-2014,2014,7,17,17:46,목요일,10,3,0,백골(supe****),김치워리어도 이 영화를 보고 태권도를 배워야 할 것이다.  
7-17-2014,2014,7,17,15:35,목요일,10,3,0,꼼지락(luna****),아직도 안보신분 들이 있었던가...정말이지.. 삶이 지루할때 뭔가 돌파구가 필요할때 꼭 봐야하는 영화..  보고나면 인생이  바뀔듯한 무언가가 쓰나미처럼 온몸을 감싸는 영화.  
7-17-2014,2014,7,17,15:24,목요일,10,3,0,오케바리(cass****),한대 치고 으아아아아~~ 한대 맞고 으아아아아...현대인들에게 시간의 소중함을 느끼게 해주는 소중한 영화...의리~  
7-17-2014,2014,7,17,15:22,목요일,10,3,0,ppyp****,50억을 주고 본다해도 아깝지 않은 영화 감독님 대단하십니다  
7-17-2014,2014,7,17,15:18,목요일,10,3,0,동설킹카(king****),최고라는 말은 이영화를 위해 존재하는듯  
7-17-2014,2014,7,17,15:18,목요일,10,3,0,우마황(dudn****),이영화를 안보고 영화를 논하지 마라  
7-17-2014,2014,7,17,15:15,목요일,10,3,0,사쿠(hinn****),이걸 보고 난 후 인간으로서 아주 소중한 것을 하나 잃은 기분이었다.... 많은 것을 깨닫게 해준 눈물의 감동 영화. 후유증으로 아직도 마음이 물먹은 듯 하네요.  
7-17-2014,2014,7,17,14:32,목요일,10,3,0,우히부카(ozoo****),언젠가 꼭 보고 싶은 영화 >_<  
7-17-2014,2014,7,17,14:30,목요일,10,3,0,스시로우(godl****),그냥 말이필요없다 .... 쩐다..  
7-17-2014,2014,7,17,14:08,목요일,10,3,0,이병기(byun****),영화 공부를 하고 있는 저는 지금도 이 영화를 참고해서 시나리오를 쓰고 있습니다. 구성 촬영 연출 그리고 후반작업으로 이루어진 효과까지... 왜 이 영화가 묻혔는지 이해가 안 가네요.. 영화학도로써.. 충무로가 인맥으로 돌고 돈다는게 맞는 말 같습니다  
7-17-2014,2014,7,17,14:03,목요일,10,3,0,knk0****,이 영화를 보고 (pneumonoultramicroscopicsilicovolcanoconios)진폐증이 나았습니다.  
7-17-2014,2014,7,17,14:00,목요일,10,3,0,질리아스(kj90****),사람은 영화를 만든다. 클레멘타인은 사람을 만든다.  
7-17-2014,2014,7,17,13:42,목요일,10,3,0,롤리팝(aaaa****),진지병 새끼들 진짜 꼴보기싫다 어휴  
7-17-2014,2014,7,17,13:11,목요일,10,3,0,오달재(a513****),기독교 천주교 불교 그리고 클레멘타인  
7-17-2014,2014,7,17,13:08,목요일,10,3,0,짱이(scle****),오늘 검색어 2위까지 올라왔더군요. 역시 명작은 세월도 가 빛을 바라게 할수 없나봅니다  
7-17-2014,2014,7,17,12:54,목요일,8,3,0,조이(joy_****),"평가가 왜 이렇게 장난스러운 글이 많지요? 저는 실제로 봤는데 영화 꽤 괜찮은데요. 스토리가 좀 뻔하지만, 영화 볼만합니다. 임혁필이 욕을 많이 해서 12세는 좀 그렇구요.  반전도 있고, 전원주, 임혁필, 김보성씨등 예상치도 못한 분들도 나와요.  "
7-17-2014,2014,7,17,12:54,목요일,10,3,0,영필이(dkny****),아빠 어디가? 보다 더 감동적인아빠 일어나!!!  
7-17-2014,2014,7,17,10:15,목요일,10,3,0,아날로그(h_kt****),어머니 이 영화를 보라고 절 낳으신거군요T-T  
7-17-2014,2014,7,17,09:58,목요일,10,3,0,terra(sara****),아빠 일어나... 이 영화를 보고 딸은 갖고 싶은 마음에.. 내 나이 오십에 결혼을 결심했다.  
7-17-2014,2014,7,17,09:58,목요일,10,3,0,구르미(cloo****),도저히 안보고는 못버티겠어서 동참하기 위해서 없는 시간 쪼개서 봤다. 영화 보는 시각이 확실히 넓어진 느낌이다.  
7-17-2014,2014,7,17,09:57,목요일,10,3,0,why so serious(frhy****),더이상의 똥꼬 쑈는 없다  
7-17-2014,2014,7,17,08:13,목요일,10,3,0,설탕(suga****),"한국 영화의 수작! 탄탄한 시나리오와 월드클래스급 배우들. 흥행 대박의 신화! 더 무슨말이 필요한가요! 대한민국 국민 모두에게 보여주고 싶은 바로 그영화. 언니,오빠,친구,동생,고모,이모,할아버지,할머니,모두모두 보여주고 싶은 바로 그영화!  "
7-17-2014,2014,7,17,06:58,목요일,10,3,0,그해여름(kimd****),어제 밤 열한시 넘어서 5살난 딸과 함께 오랜만에 클레멘타인을 다시 보았습니다. 아침에 일어났는데 이미 딸이 먼저 일어나 아침상을 차려놓았습니다. 기적은 영화 한편이 만들수도 있다는 것을 깨달았습니다.  
7-17-2014,2014,7,17,04:44,목요일,10,3,0,nohope(ehdw****),눈물이 저절로 나옵니다  
7-17-2014,2014,7,17,02:28,목요일,10,3,0,얍얍(defe****),이 영화를 보고 감탄하지않을수없었다.  신이 내린 재능이란게 이런것이구나 -스티븐 스필버그  
7-17-2014,2014,7,17,02:15,목요일,10,3,0,곰돌이20(delp****),100년에 한 번 나올까 말까한 명작  
7-17-2014,2014,7,17,02:09,목요일,10,3,0,eshi****,"무지감동적이고 재밌네요..,개봉시기 잘못타서 흥행실패 아쉽네요..감동적..재개봉하길..  "
7-17-2014,2014,7,17,01:39,목요일,10,3,0,Iris(ybs8****),이동준 인생의 역작 클레멘타인  
7-17-2014,2014,7,17,01:33,목요일,10,3,0,블록폐쇄(juny****),이 영화를 같이 보자고 하자 헤어진 여친이 울며 돌아왔습니다.  
7-17-2014,2014,7,17,00:47,목요일,10,3,0,chud****,2002 월드컵 이후 국민들의 자발적인 단합력을 이끌어내는 특 대작  
7-17-2014,2014,7,17,00:46,목요일,10,3,0,kjb8****,이 영화를 보지 않으면 남자가 아니다  
7-17-2014,2014,7,17,00:46,목요일,10,3,0,인증부탁합니다(dlfq****),예전에 보고 평가했지만 다시 화제가 되고 있어 다시 이야기한다. 이 영화는 대단하다... 대기업의 횡포로 흥행하지 못한것이 안타깝다..  
7-17-2014,2014,7,17,00:45,목요일,10,3,0,nix7****,불후의 명작...한국 최고의 명작!!  
7-17-2014,2014,7,17,00:22,목요일,10,3,0,리본(rebo****),아 라스보고 들어와봤는데  평점보니까 진짜 다운받아봐야겠네 진짜 트로이랑 동시개봉해서 망했나보네   궁금하다  
7-17-2014,2014,7,17,00:15,목요일,10,3,0,아주좋은(play****),아 형님.ㅋㅋㅋ 라스보고있습니다.  
7-16-2014,2014,7,16,19:39,수요일,10,3,0,kjh3****,이 영화를 본후 감춰져있던 나의 나쁜감정이 모두 정화가 된느낌이다!! 앞으로 인생을!살아가며!크나큰!교훈을 얻을수 있는 엄청난 대작!!!  마음의 병이 치유됬다 엄청난 영화 강추  
7-14-2014,2014,7,14,00:26,월요일,9,3,0,무진(toto****),내가 감히 이작품에 10점을 줄수가없다...  
7-12-2014,2014,7,12,02:09,토요일,10,3,0,5cmp****,오늘 평점1위인걸 알고 다운받았다 와 새벽2시이다 잠이안온다 자고있는 와이프 깨워서 같이한번 다시봐야겠다  
7-11-2014,2014,7,11,22:35,금요일,10,3,0,so11****,내 불금을 받칩니다 클레멘타인님  하하하  
7-11-2014,2014,7,11,10:00,금요일,10,3,0,50사못쓰(xnfl****),나는 어느정도 성공한 감독으로 평가받고 있지만 클리멘타인 정도는 아니다. -제임스 카메룬-  
7-10-2014,2014,7,10,17:44,목요일,10,3,0,화력(hosi****),인간의 기본4요소 의.식.주.클레멘타인  
6-22-2014,2014,6,22,23:25,일요일,10,3,0,skowqu(akfe****),속세에찌들어 삶의 진정한 의미를 왜곡하고 감추려햇던 나였지만 클레멘타인을 본후에 자연과함께 안빈낙도하며 공중부양을 할 수 있게되엇다  
6-22-2014,2014,6,22,13:18,일요일,10,3,0,우정(yuki****),더 이상 말이 필요없습니다  
6-18-2014,2014,6,18,23:02,수요일,10,3,0,q344****,안구건조증이 있던나.. 이영화를 보고 그동안 나오지않던 눈물이 났습니다 . 그리고 약도 안듣던 안구건조증이 없어졌습니다  저에겐 이영화는 신의선물입니다  
6-17-2014,2014,6,17,22:42,화요일,10,3,0,Rematar(neoe****),마치 2002년 한일월드컵 미국과의 2차전 후반 43분59초 최용수의 벼락같은 논스톱슛팅을 보는듯하다..  
6-14-2014,2014,6,14,00:58,토요일,10,3,0,엘버린(luff****),아빠일어나눈좀떠봐ㅠㅠㅜ으허어어ㅡ으으어허으  
6-12-2014,2014,6,12,10:50,목요일,10,3,0,luke****,최고의 명작.다시 한번 나오지 않을 영화 퀄리티  
6-12-2014,2014,6,12,07:50,목요일,10,3,0,분홍리본(rnjs****),미친진짜ㅋㅋㅋㅋ이사람들이!!  
6-11-2014,2014,6,11,23:01,수요일,10,3,0,땅콩(ekdz****),정말 내 생애 최고의영화..!  
6-11-2014,2014,6,11,21:25,수요일,10,3,0,파일론(pylo****),선리플 후감상 하려고 합니다.. 재미있는 영화 찾다가 보니 횡재 하네요 ㅎㅎ 한국인들이랑 스티븐쉬갈 형님이랑 같이 모여서 대체 어떤 이야기를 만들었길래 이렇게 모든 사람들의 찬사를 받을 수 있는건지 진심 궁금합니다 모두 감사해요 잘볼게요  
6-9-2014,2014,6,9,12:03,월요일,10,3,0,chun****,이거 보고나서 롤했더니 다이아 찍음요 롤 슬럼프가 오시면 꼭보세요  
6-6-2014,2014,6,6,21:43,금요일,10,3,0,취달(lym2****),난 모두가 부러워하는 이 영화를 아직 보지 않은 사람이다. 그런데 신기하게도 평점 10점을 누르는 나를 발견했다.  
6-5-2014,2014,6,5,12:33,목요일,10,3,0,좋은것(rtw1****),줄수있는 평점이 10점 뿐이라는게 안타깝네요..  
6-5-2014,2014,6,5,12:19,목요일,10,3,0,닭살튀김(frie****),이 영화를 보고 어찌 눈물을 흘리지 않을 수 있을까..  
6-4-2014,2014,6,4,08:33,수요일,10,3,0,상진(vfba****),엑션쾌감과 눈물을 쥐어짜는게  동시에 가능  
6-2-2014,2014,6,2,13:12,월요일,10,3,0,모소리글(moso****),고만해 미친 놈들아....는 개뿔 이거슨 기념비적인 영상물이다...  
4-7-2014,2014,4,7,14:14,월요일,10,3,0,EDEN13(dys0****),진정한 국산 대작 아직 보지 않았다면 당신은 신세계를 경험하지 못햇다  
3-24-2014,2014,3,24,10:20,월요일,10,3,0,바보녀석(jsjb****),인생 헛살았다. 이걸 이제야보다니  
3-19-2014,2014,3,19,05:39,수요일,10,3,0,얄리(wwwy****),나도 모르게 좌석에서 일어났다.  
3-16-2014,2014,3,16,18:05,일요일,10,3,0,Now(maes****),당신이 죽기전 무조건 보아야할 작품.  
3-16-2014,2014,3,16,16:24,일요일,10,3,0,인벤(dhsl****),평점이 높아서 보았다...봐야한다.  
3-8-2014,2014,3,8,18:03,토요일,10,3,0,아하(limi****),누가 감히 이 영화를 평하는가.  
3-8-2014,2014,3,8,11:07,토요일,10,3,0,play****,이 영화를 보고 우울증이 나았어요  
2-27-2014,2014,2,27,19:17,목요일,10,3,0,하이드(hyde****),10주년이군요. 팬들이 이렇게 목놓아 기다립니다. 얼른 재개봉하시죠.  
2-23-2014,2014,2,23,20:03,일요일,10,3,0,little dreamer(zino****),와..몰입력 최강입니다  
2-21-2014,2014,2,21,00:11,금요일,10,3,0,김학민(dark****),보았노라 느꼈노라 남겼노라  
2-20-2014,2014,2,20,22:36,목요일,10,3,0,goh3****,정말감동 ㅠㅠ인생영화  
2-19-2014,2014,2,19,13:52,수요일,10,3,0,팝동(wh17****),하품으로 펑펑울수있다는 깨달음을 준 영화입니다꼭보세요  
2-18-2014,2014,2,18,15:25,화요일,10,3,0,bron****,세계 유수의 명작들과 어깨를 나란히 하고 있는 이유를 알 것 같습니다. 똥꼬가 간지러울 정도로 감동의 전율이 온 몸을 휘감는 영화.  
2-18-2014,2014,2,18,13:02,화요일,10,3,0,손리더(brav****),누군가가 한국영화중 단하나만 볼 수 있을때 무엇을 보겠냐고 물어본다면 당연히 첫손에 꼽게될 영화  
2-18-2014,2014,2,18,01:26,화요일,10,3,0,days****,이 영화를 찍는동안은 내인생의 기적과 같은 순간이었다.  -스티븐 시걸  
2-18-2014,2014,2,18,01:22,화요일,10,3,0,shki****,당신의 인생은 두가지로 나눌수있다. 클레멘타인을 보기전과 보고난 후로  
2-17-2014,2014,2,17,16:14,월요일,10,3,0,트랏바우신(dirt****),"영화를 자세히 보면 은서우양이 ""아빠 일어나""라고 외칠때 동준훃아의 몸보다 먼저 일어난게 있었으니.. 그때의 므흣한 광경을 잊을 수가 없네요  "
2-16-2014,2014,2,16,17:29,일요일,10,3,0,유나짱(marc****),참 아이러니 하네. 이런 명작 DVD를 천원에 구입했다니...  
2-16-2014,2014,2,16,03:28,일요일,10,3,0,EQ(blac****),이영화를 보며 지난 10년간 짝사랑했던 여자에게 결혼 승낙을 받아 결혼까지 골인 하게 되었습니다. 그녀도 울고 나도울고 미래에 태어날 우리의 아기마저도 눈물을 흘리는듯 하였습니다.  
2-15-2014,2014,2,15,17:01,토요일,10,3,0,powe****,100점을 주고 싶은 영화  
2-15-2014,2014,2,15,05:45,토요일,10,3,0,주디홀릭(judi****),영화가 끝나고 아빠가 일어났다  
2-14-2014,2014,2,14,21:55,금요일,10,3,0,맛있는라면(dong****),이 영화를 보고 탈수증이 걸려 죽을 고비를 넘겼습니다 하지만 이 명작을 볼수만 있다면 나는 몇번이고 다시 볼 것입니다.  
2-14-2014,2014,2,14,21:21,금요일,10,3,0,저링(zerl****),아빠 일어나! 아역의 감동적인 연기 감동의드라마  
2-14-2014,2014,2,14,16:18,금요일,10,3,0,파티오(joon****),한국 영화사에 다시 없을 명작입니다.꼭보세요. 두번보세요.  
2-9-2014,2014,2,9,21:44,일요일,10,3,0,유효핵전하량(snue****),영화는 클레맨타인 전과 후로 나뉜다  
2-8-2014,2014,2,8,11:35,토요일,10,3,0,Sawol(dnfl****),"눈물 없인 볼 수 없는 영화, 평점이 모든 걸 말해주고 있다.  "
1-2-2014,2014,1,2,13:08,목요일,10,3,0,굿잡맨(vkav****),인생은 클레멘타인을 보기전과 후로 나뉜다.  
1-2-2014,2014,1,2,01:57,목요일,10,3,0,마늘(oiy6****),환상의 똥꼬쇼를 보여드리겠습니다  
1-2-2014,2014,1,2,01:28,목요일,10,3,0,goro****,[깊은 유혹의 꽃미남]  
12-29-2013,2013,12,29,21:22,일요일,10,3,0,루크중령(tlaw****),경건한 마음으로 봐야하는 영화  
12-27-2013,2013,12,27,00:29,금요일,10,3,0,dfagd(mill****),냉랭해지는 오늘날의 사회에 대한 경각심을 다시 한 번 환기시켜주는 뜻깊은 영화였습니다 특히 액션스타 스티븐시걸과의 혈투는 잊혀지지 않네요 타이타닉처럼 3D로 재개봉했으면 하는 바람입니다  
12-26-2013,2013,12,26,17:14,목요일,10,3,0,유성추(ever****),저도 어쩔 수 없는 사람인가 봅니다...  
12-24-2013,2013,12,24,23:57,화요일,10,3,0,starian(dexs****),크리스마스 이브에 이렇게 감동적인 영화를 봤다라는건 .. 내 인생에  최대의 감동이 아닐까 싶다...  
12-24-2013,2013,12,24,23:18,화요일,10,3,0,wbsl****,내가 21세기에 살아있는건 이영화를 보기 위해서가 아닐까?  
12-24-2013,2013,12,24,20:41,화요일,10,3,0,rtgs****,이영화를 보고 수능만점이 되었습니다  
12-24-2013,2013,12,24,13:28,화요일,10,3,0,h520****,이영화를보고 후진영화라하는사람들은 그자체가 후진것이다.감동이 살아있는 영화!  
12-24-2013,2013,12,24,11:42,화요일,10,3,0,쇼타임(sang****),크리스마스 이브날 여자친구랑 이 영화를 보려고 합니다. 벌써부터 설레이네요 ^^ 이런 명작을 볼수있게  두눈과 귀를 만들어 주신 하나님께 감사드립니다.  
11-18-2013,2013,11,18,15:14,월요일,10,3,0,Jiraishin(baed****),다윗이 이 영화를 봤다면 골리앗을 돌려차기로 끝장냈을것이다....  
11-1-2013,2013,11,1,12:16,금요일,10,3,0,lskjna(wlsd****),이런 명작을아직까지 모르고 있었다니..  
10-31-2013,2013,10,31,22:47,목요일,10,3,0,c493****,"이 영화를 본 이후... 세상을 새롭게 살게 되었습니다. 이 영화는 내게 극한의 인내심을 주었고, 세상의 모든 스트레스를 우습게 보게 했습니다. 정말 감사합니다.  "
10-27-2013,2013,10,27,12:50,일요일,10,3,0,칙칙칙(gnt3****),이 영화를 보고 난후 내 2G폰이 스마트폰이 되어있었다.  
10-25-2013,2013,10,25,16:39,금요일,10,3,0,발퀴레(walk****),제 친구는 이 영화를 보고 큰 깨달음을 얻어 스님이 되었습니다.  
10-25-2013,2013,10,25,16:03,금요일,8,3,0,사이안(sahi****),제발 보고 욕하세요 안보고 욕하지 말고 유료영화 강추합니다 화질과 타격음이 ㅈㅈ함 감동은 덤!  
10-20-2013,2013,10,20,17:09,일요일,10,3,0,sfggd(yds9****),보는내내 눈물이 흘렀습니다. 진짜감동이뭔가 다시생각하게해준영화  
9-29-2013,2013,9,29,22:48,일요일,10,3,0,min2****,사람이 큰 충격을 받으면 그 자세 그대로 굳어있게 되며 최고의 충격을 받을시 10년을 굳어 있게 된다... 2004년 이 영화 개봉때 보고 굳어 있던 내가 10년후 2013년 오늘 깨어서 유일하게 할 수 있는  일은 이 영화의 평점을 남기는 일이었다!  
9-29-2013,2013,9,29,15:06,일요일,10,3,0,cnwj****,두말하면 입이 아프다. 일단 보고 이야기하자  
8-30-2013,2013,8,30,17:18,금요일,10,3,0,헥(hard****),개봉 10주년 기념으로 다시 보았습니다. 여전히 두눈에 뜨거운 줄기가 흐르네요.  
8-5-2013,2013,8,5,11:05,월요일,10,3,0,항해자(noh3****),전 언제나 이 영화를 2배속으로 봅니다. 한번 볼 시간에 두번보고 싶기 때문입니다.  
7-28-2013,2013,7,28,15:37,일요일,10,3,0,이니(iniw****),으리!  
7-21-2013,2013,7,21,12:51,일요일,10,3,0,원츄(guno****),..  
7-20-2013,2013,7,20,00:42,토요일,10,3,0,ssai****,이제서야 내인생의 명화를 만났네요 감사합니다  
7-10-2013,2013,7,10,16:18,수요일,10,3,0,cain(sug0****),제발 한국인이면 클레멘타인 봅시다!!  
6-17-2013,2013,6,17,00:39,월요일,10,3,0,토마마토(qkrc****),스티븐시걸이 나왔다 말할필요가없다  
6-16-2013,2013,6,16,01:24,일요일,10,3,0,jdks****,와...정말 말로 표현할 수가 없네요. 죽기전에 이런 영화를 보았다는게 제 인생의 가장 큰 행운이 아닐까 싶어요..  
6-10-2013,2013,6,10,13:34,월요일,10,3,0,백영(choe****),대작을 맞이하라..  
6-9-2013,2013,6,9,13:25,일요일,10,3,0,Gareth Gates(anyo****),으리 없는 샛기들 ㅡㅡ 으리 !  
6-7-2013,2013,6,7,07:40,금요일,10,3,0,닉스(igho****),여태까지 본 한국영화 중에서 최고였다.  
6-2-2013,2013,6,2,21:56,일요일,10,3,0,알탱탱(arbs****),말이 필요한가? 10년이 다되가는 지금도 최고의 영화.... 10번은 넘게 봤다  
6-1-2013,2013,6,1,21:19,토요일,10,3,0,왕건(dlrj****),재밌는 영화 일부로 평점떨어뜨리려는사람들 정말이기적이네요. 그렇게살지마십시오  
6-1-2013,2013,6,1,09:59,토요일,10,3,0,hyun****,이런 숨겨진 보물같은 영화는 널리널리 퍼져야됩니다.  
6-1-2013,2013,6,1,05:35,토요일,9,3,0,파이(dkfk****),이런 명작은 같이 봐야죠^^  
5-24-2013,2013,5,24,10:59,금요일,10,3,0,selfconfid(conf****),말이 필요없다 명작이다  
5-24-2013,2013,5,24,01:52,금요일,10,3,0,홍킁킁(ddol****),가슴이 뜨거워지는영화... 아빠... 일어나..!!  
5-23-2013,2013,5,23,17:24,목요일,10,3,0,맛탱(emar****),정말 최고 입니다. 인생의 명작  
5-23-2013,2013,5,23,16:04,목요일,10,3,0,뿌우(simb****),이 영화를 접할 수 있었던건 내 인생 최고의 행운  
5-23-2013,2013,5,23,14:25,목요일,10,3,0,미키(sunr****),전설의 출현....  
4-19-2019,2019,4,19,17:03,금요일,10,4,1,su(shy_****),진짜 나쁜사람들....  
4-15-2019,2019,4,15,10:01,월요일,10,4,1,작은기환(stry****),나만당할순없지 재밋습니다  
3-28-2019,2019,3,28,15:12,목요일,10,4,1,ment****,모든 장르를 초월한 영화계의 바이블!감독이 되고 싶은 자!  배우가 되고 싶은 자!모두 이 영화를 교본으로 삼는다면 꼭 성공할 것입니다!!  
3-25-2019,2019,3,25,19:20,월요일,10,4,1,멍멍사우르스(kkmb****),이 영화를 보고 머리털이 났읍니다  
3-20-2019,2019,3,20,04:46,수요일,10,4,1,별명없음(ymh3****),성지순례 왔습니다. 더도말고 딱 5천만원만 줍게 해주세요. 5천만원 때문에 살기가 힘들어 질땐 이 영화를 한번씩 보곤 합니다.  
3-16-2019,2019,3,16,17:25,토요일,10,4,1,늴리리야 니나노(woo9****),인생은 멀리서 보면 희극이지만 가까이에서 보면 클레멘타인이다. - 찰리 채플린  
3-16-2019,2019,3,16,02:44,토요일,10,4,1,우롱차(braa****),마지막 패배가 예정된 결투씬을 보며 참았던 눈물이 터져버렸습니다 이런 작품이 앞으로 다시 나올수 있을지...  
2-21-2019,2019,2,21,12:48,목요일,10,4,1,MEME(mj79****),"세상에는 단 두종류의 인간이 있다. 클레멘타인을 본인간과 안본인간, 수십 수백년후 인문철학예술을 논할때 클레멘타인은 하나의 바이블이 될것이다. 끝까지 다 본 나자신이 너무나 대견스럽다.  "
2-20-2019,2019,2,20,08:32,수요일,10,4,1,알맹이(kyun****),"네이버 영화 평점을 보다  평점이 너무 높길래 "" 이 영화는 뭘까?"" 의구심을 가지고 봤습니다.내 평생 이런 완벽한 영화는 또  없을겁니다.  "
2-19-2019,2019,2,19,15:55,화요일,10,4,1,화랑(dlwj****),예고편만봤는데 암이 나았습니다  
2-11-2019,2019,2,11,08:52,월요일,10,4,1,arar****,역사의 한페이지를 장식했다  
2-8-2019,2019,2,8,15:02,금요일,10,4,1,Donza(donz****),이거 안본 사람은 영화 평가하지 마라  
12-7-2018,2018,12,7,21:24,금요일,10,4,1,맑음이(kim0****),평점댓글을 보니. 보고싶다  
12-4-2018,2018,12,4,19:26,화요일,10,4,1,s994****,이제 영화를 봤습니다 이런명작은 재개봉을 해야 합니다  
12-4-2018,2018,12,4,01:05,화요일,10,4,1,조지운(jkj9****),최고의 영화ㅜㅠ아직도 제 마음속 1위인 영화입니다죽기전에 꼭 봐야하는 한국영화 입니다.  
11-30-2018,2018,11,30,07:04,금요일,10,4,1,미스란디르(reje****),댓글만 봤는데도 눈물이 나고 감동이 밀려와 글을  쓰기 힘들다죽음의 직전에 이 영화와 함께 하고 싶다  
11-30-2018,2018,11,30,00:59,금요일,10,4,1,나(mast****),일어나~ 감동의 순간이 기억나 일주일째 잠을 못  이루고 있다.  
11-29-2018,2018,11,29,22:36,목요일,10,4,1,단탄지단탄지(toss****),힘들때 마다 이영화를 보고 다시 일어나곤 합니다  
11-29-2018,2018,11,29,10:37,목요일,10,4,1,수호천사(nana****),지금까지 무수한 영화를 봤지만 이영화만큼 기억에남는 명대사는 처음 인거같습니다 신이 인간을 민들었다면인간은 클레멘타인을 만들었습니다  
11-25-2018,2018,11,25,16:52,일요일,10,4,1,첼시바라기(bonj****),평가하지마라. 그냥 느껴라. 이 영화는 그럴 자격이 있는 영화다  
11-25-2018,2018,11,25,15:10,일요일,10,4,1,Yong(siry****),절대 여기 평점알바없습니다 나의 영혼을 빼앗아간 악마같은 영화  
11-25-2018,2018,11,25,08:50,일요일,10,4,1,urbansky(skyl****),타임캡슐에 단 하나의 영화만을 넣어야 한다면. 당연히 클레멘타인이 선정되어야 할 것이다.  
11-9-2018,2018,11,9,18:31,금요일,10,4,1,캘배로시스(zofq****),스포없는 한 마디 요약 : 정말 재밌다.  
10-29-2018,2018,10,29,22:48,월요일,10,4,1,한글이름(yit3****),3562만명이 본 대한민국 최고 흥행작  
10-9-2018,2018,10,9,09:00,화요일,10,4,1,juno****,인생이 아직 살만한다는것을 보여주는영화  
10-6-2018,2018,10,6,15:37,토요일,10,4,1,2018가즈아(viva****),정말 할 말이 없습니다... 제가 감히 클레멘타인 dvd 를 팔겠습니다.  당연히 절 욕하셔도 좋습니다.. 일단 살고 보겠습니다. 흥정없이 큰거 열장입니다. 하도 많이 돌려 봐서 사용감은 많지만 재생은 여전히 잘되요.  
9-9-2018,2018,9,9,22:10,일요일,10,4,1,민종현(mjh0****),하느님 감사합니다 이런 걸작을 보게 해주셔서  
9-7-2018,2018,9,7,19:40,금요일,10,4,1,풍맞은것처럼(lsm7****),웃고싶으면 여기 평점보고 웃으시면 됩니다  
9-6-2018,2018,9,6,01:30,목요일,9,4,1,재용(wjdw****),"이런 영화에는 10점을 줄수가 없다. 왜냐하면 세상에는 완벽이라는 것이 없기 때문이다. 하지만, 가장 완벽에 가까운 영화를 물어본다면 나는 클레멘타인 이라고 대답할것이다.  "
8-13-2018,2018,8,13,19:55,월요일,10,4,1,111(jw_6****),완벽이란 단어는 이 영화를 위해 만들어진것 아닐까  
7-30-2018,2018,7,30,22:25,월요일,10,4,1,쿤타맨(kunt****),",., .,.. ..,완  "
7-23-2018,2018,7,23,10:00,월요일,10,4,1,hown****,ㅎ너무너개잼이다진짜류  
5-6-2018,2018,5,6,17:37,일요일,10,4,1,아(gang****),세상에서 가장 재미있는 영화입니다 한번보고 눈물이 찔끔나오고 암이 낫는 기적을 보실수있습니다 꼭 추천드려요  
3-21-2018,2018,3,21,00:01,수요일,10,4,1,볼라드(qkrw****),제 인생에서 영화보고 오줌지린적이 없었는데 이 영화가 얼마나 그런 명작이였는지 정말로 오줌을 지렸습니다.  
2-17-2018,2018,2,17,14:10,토요일,10,4,1,강산사랑(play****),당신들은 지금 신의선물을 마주하고있다  
2-17-2018,2018,2,17,12:47,토요일,10,4,1,vvfu****,평점이 너무 좋아서 찾아서 보았다 OOO들아 !!이건 국가가 나서서 북한에 보급해야 한다  
2-16-2018,2018,2,16,13:35,금요일,10,4,1,내일의 희망(fish****),우울한 고시생활에 너무나도 지친마음에 평점 좋은 옛날 영화한편을 보았습니다. 설마했습니다. 눈물이납니다. 그냥 눈물이 납니다. 하염없이 오열을하다. 인생의 참의미를 깨달았습니다. 감독님 감사합니다 정말..  
2-16-2018,2018,2,16,02:06,금요일,10,4,1,브라보(jun1****),클레멘타인만 보았는데 짝사랑하던 여자에게서 연락이 왔고 지금은 결혼을 앞두고 있습니다 내 자식에게도 보여주고 싶은 영화입니다  
2-16-2018,2018,2,16,01:43,금요일,10,4,1,대추방망이(dieg****),힘든날마다 꼭 클레멘타인을 보곤 했습니다.어느날 회사에서 너무 힘들어서 몰래 클레멘타인을 봤습니다.보다가 전무님께 걸렸는데 다음날 전 상무가 되었습니다.클레멘타인을 보면 좋은 일이 생깁니다.영원히 사랑합니다. 이동준님♥  
2-15-2018,2018,2,15,11:53,목요일,10,4,1,와인한잔(ehdx****),반지의제왕같은 망작이랑 비교하면 안되는 명작이네요!!  
2-8-2018,2018,2,8,01:03,목요일,10,4,1,미소녀 사냥꾼(love****),이 영화를 보고 암이 나왔습니다.  
1-26-2018,2018,1,26,17:54,금요일,10,4,1,38317(weed****),이 영화를  보지 않은 당신에게 죄를 묻겠다.인생을 낭비한 죄.  
1-1-2018,2018,1,1,17:56,월요일,10,4,1,고민있는 곰인형(dduu****),123548969822  
12-29-2017,2017,12,29,19:30,금요일,10,4,1,심원보(reso****),평점을 왜이렇게 높게 줍니까 다들!!  
11-10-2017,2017,11,10,10:36,금요일,10,4,1,광난(oak1****),한국영화의 끝없는 도전 그 이상을 보고 갑니다.  
10-7-2017,2017,10,7,02:00,토요일,10,4,1,홀스(supa****),이영화를 안 봤다면 다른 영화를 볼 자격이 없다  
10-7-2017,2017,10,7,01:12,토요일,10,4,1,영롱한빤쓰(choi****),이건 영화가 아니다.우주이다.  
8-20-2017,2017,8,20,15:40,일요일,10,4,1,아이디비밀(zati****),김연아를 심사하는 Ioc의 위원의 마음으로 평점을 부여했습니다  
8-2-2017,2017,8,2,05:17,수요일,10,4,1,ljj8****,이 영화가 아직 이정도 평점밖에 못받다니 대한민국 관객의 수준이 너무 낮습니다.  
8-2-2017,2017,8,2,01:55,수요일,10,4,1,히어로즈 엘리펀츠(007t****),돌아온럭키짱에10점주는 심정으로  
7-31-2017,2017,7,31,12:30,월요일,10,4,1,werhmacht(woon****),이 영화를 보지 않은자 먹지도 말라  
7-30-2017,2017,7,30,12:03,일요일,10,4,1,PARK(pch4****),처음 봤을때의 전율을 다시 느끼기 위해<이터널 선샤인>을 보았다  
7-29-2017,2017,7,29,17:49,토요일,10,4,1,루비(crs9****),클레멘타인이냐 리얼이냐 그것이 문제로다  
7-20-2017,2017,7,20,01:21,목요일,10,4,1,사마열혈(wzch****),100억 넘게들이고도 이영화만큼 재미나게못만드는 사람도 많다 역시 명작은 시간이 지나도 변하지 않는다 ..  
7-5-2017,2017,7,5,13:22,수요일,10,4,1,The ph J(kug3****),한국영화는 뭐다? 클레멘타인 전과 후로 나뉜다! 역대급 명작  
7-3-2017,2017,7,3,21:47,월요일,10,4,1,검은콩두유(hodu****),에라이 나쁜 놈들아.... 평점만 얼핏 보고 봐버렸잖아.... 나도 10점 줘야지.  
7-2-2017,2017,7,2,16:56,일요일,10,4,1,애드펑(chld****),"세계 3대 영화제 에서 호평을 받으며세계 시장에서 코리안 파워를 보여준 영화.스티븐 스필버그 曰""제가 만든 모든 영화는 클레멘타인에서 비롯되어 나왔죠""제임스 카메론 曰""에일리언의 전투씬은 클레멘타인을 봐서 영감을 얻었습니다.""  "
6-30-2017,2017,6,30,00:57,금요일,10,4,1,이얏호(ilov****),이 영화와 동시대에 살수 있었던건 정말 신의 축복이다  
6-29-2017,2017,6,29,14:17,목요일,10,4,1,조효성(spri****),영화 '리얼'이 평가 받을 수 있도록 한 명작  
6-29-2017,2017,6,29,01:38,목요일,10,4,1,프로쥬스101(burb****),여기 댓글이 재밌어서 10점  
6-28-2017,2017,6,28,21:31,수요일,5,4,1,woni(851h****),리얼이 하도 욕먹길래 혹시나 해서 와봤더니 ..ㅋㅋ~!!  
6-28-2017,2017,6,28,13:39,수요일,10,4,1,최재훈(hunj****),리얼을 보고나니 10점을 드릴수밖애없네요.10년전영화지만 명작  
6-21-2017,2017,6,21,19:11,수요일,10,4,1,dnth****,사람들은 말한다. 신은 존재하지 않는다고. 물론 나도 그렇게 생각했었다. 하지만 난 이 영화를 보고 생각이 바뀌었다. 그리고 지금 나는 말한다. 신은 존재한다고. 신이 존재하지 않는다면 무지한 인간의 뇌에서 이런 신작(神作)이 나올리가 없기 때문이다.  
6-21-2017,2017,6,21,17:01,수요일,10,4,1,김원식(gusg****),"대단함정말 우리나라영화맞나요,  "
6-20-2017,2017,6,20,04:56,화요일,10,4,1,onlyhope(koyo****),감동 또 감동 후회없는 영화  
6-18-2017,2017,6,18,02:47,일요일,10,4,1,빨간펜(nano****),감동이 몰려와 울컥합니다. 감상 후 여운이 남아 잠시동안 움직일 수 가 없었습니다.  대형 스크린으로 보지 못한 것이  너무  아쉽습니다.  
6-17-2017,2017,6,17,19:43,토요일,10,4,1,홍서범(last****),죽을때까지 잊을수없는 내 인생영화  
6-16-2017,2017,6,16,13:07,금요일,10,4,1,마법사(osko****),숨겨진 명작이네요. 소름끼치네요.  
6-16-2017,2017,6,16,09:15,금요일,10,4,1,people(feel****),(이건 아주 수준높은 관객님들만 보는 영화로군요...댓글들 보니 함부로 볼 영화가 아니라는.... ) 아까데미 후보깜인가요?  
6-5-2017,2017,6,5,22:20,월요일,10,4,1,김승환(new_****),클레멘타인 사랑합니다  
3-25-2017,2017,3,25,11:37,토요일,10,4,1,ㅁㄴㅇㄹ(choi****),눈물이 납니다... 어찌 이런 대작을 지금 봤을까요...  
3-2-2017,2017,3,2,22:40,목요일,10,4,1,scloin(sooh****),"한국영화 최고의 아니 전세계를 통틀어 디워, 7광구와 함께 최고의 갓작, 클레멘타인!!  "
2-27-2017,2017,2,27,13:38,월요일,10,4,1,목동체리(yyd3****),인생최고의 영화  감동 인간의 존엄성은 역시.  
2-10-2017,2017,2,10,00:58,금요일,10,4,1,px98****,고맙습니다 인생영화 ㅠㅠ  
12-30-2016,2016,12,30,17:24,금요일,10,4,1,sibu(qw76****),왜이리 추천들이 많을까 항상궁금했었는데 이제서야 의문이 플렸다.  나한텐 인생영화가 될꺼같다. 꼭봐라! 3번봐라ㅜ  
12-27-2016,2016,12,27,17:27,화요일,10,4,1,욱이(woog****),이  영화의 아빠 일어나라는 명대사를 듣고 저희 아버지도 일어나셨습니다  
12-20-2016,2016,12,20,13:38,화요일,10,4,1,choc****,미만잡!!!!퍄퍄용  
12-11-2016,2016,12,11,00:14,일요일,10,4,1,jae9****,스티븐 시걸이 최고입니다  
12-9-2016,2016,12,9,09:05,금요일,10,4,1,kby8****,"2016년 재조명 되어야 할 영화 - 2002년 정왕고 졸업생 김보영, 심영태, 정광성-  "
12-8-2016,2016,12,8,23:51,목요일,10,4,1,Robert(kgdm****),어마어마한 영화 암이 나앗습니다  
12-8-2016,2016,12,8,22:07,목요일,10,4,1,ocd(ghkt****),감동할수없는형용입니다  
12-7-2016,2016,12,7,20:29,수요일,10,4,1,구회말이사만루32(mini****), '죽기 전 한번은 이 영화를 봐야한다' 제가 살아가야 하는 이유가 한가지 남아있어 행복합니다.  
12-6-2016,2016,12,6,16:44,화요일,10,4,1,경서비(socc****),이런 명화가 숨어있을줄이야...3일동안 잠을 못잤네요..계속 다시보느냐...  
11-26-2016,2016,11,26,23:05,토요일,10,4,1,bobo****,내인생에 이처럼 감동적인영화를  다시볼수있을까?  
11-25-2016,2016,11,25,21:51,금요일,10,4,1,추미애쌍연(firs****),폴 그린그래스 감독이 클레멘타인을 보았더라면 본 시리즈의 개봉이 2년은 늦어졌을 것이다. 이유는 폴 감독이 한국으로 와서 이동준에게 영화수업을 받고 있었을 테니까  
11-13-2016,2016,11,13,08:41,일요일,10,4,1,jun6****,누가 감히 이 영화를 평가하려 하는가?아버지는 조용히 영화를 다 보시고는 재털이를TV에 던지셨다...  
10-19-2016,2016,10,19,19:08,수요일,10,4,1,대한민국만세(jjan****),"층간 소음으로 아랫집과 싸움이 났었습니다. 저는 클레멘타인을 전축에 연결하여 틀었고, 영화가 끝날 때즘, 제 옆에 아랫집 분께서 같이 눈물을 흘리는 것을 발견했습니다.전세계가 클레멘타인을 본다면, 세계 평화가 바로 이루어질텐데....안타깝네요. ㅜ  "
10-1-2016,2016,10,1,12:16,토요일,10,4,1,Nicole_Fawcett(indi****),스티브 잡스가 이 영화를 봤다면 아이폰은 더 일찍 세상에 나왔을 것입니다. 그만큼 혁신적이며 감성을 자극하는 한국 영화의  최대  걸작이라고  감히 평해  봅니다.  
9-23-2016,2016,9,23,14:32,금요일,10,4,1,봄(tjdd****),이 영화에 1점을 주는사람들 정말 이기적이네요.그렇게 꼭 혼자만 전율을 느끼고 싶습니까?  
9-18-2016,2016,9,18,08:38,일요일,10,4,1,야호(ijy7****),복수혈전은 비디오로소장중입니다.클레멘타인은 dvd로소장하려고 하는데 매물이 잘안나오는 희귀템이라서 구하기힘드네요.죽기전에 구하고싶은 매물입니다.그감동을돌비싸운드6.1에 느끼고싶어요.네티즌평론가들이추천한명작.  
9-18-2016,2016,9,18,04:53,일요일,10,4,1,아낙수나문(hera****),소문 익히 들었습니다...영화보기전입니다..긴장 됩니다..이 기분 좋은 설렘은 뭘까요?  
9-2-2016,2016,9,2,19:25,금요일,10,4,1,야생멧돼지(park****),제 10년지기 친구가 이 영화를 추천해주었습니다.이 영화를 보는 내내 그 친구의 얼굴이 떠올랐습니다.이제 영화는 끝이났고 저는 친구에게 감사의 마음을 전하러 갑니다...  
9-1-2016,2016,9,1,17:22,목요일,10,4,1,청청당(tetr****),2부를 기다리며...  
8-26-2016,2016,8,26,17:23,금요일,10,4,1,S라인엉아(kiki****),정말 재밌게 봤습니다. 시간가는줄 몰랐네요.  
8-26-2016,2016,8,26,09:01,금요일,10,4,1,도리도리(nice****),참 좋은데...남자한테 참 좋은데...아 그게 남자한테 참 좋은데...  
8-26-2016,2016,8,26,07:07,금요일,10,4,1,gnkhul061(ptfk****),이영화는 내인생을 바꾼 영화  
8-26-2016,2016,8,26,05:02,금요일,10,4,1,is21****,이 영화를 보지 않았다. 하지만 내 손을 10을 누르고 있었다  
8-25-2016,2016,8,25,19:47,목요일,10,4,1,tjrr****,뿜보고왔습니다 ㅎㅎㅎ  
8-25-2016,2016,8,25,19:06,목요일,10,4,1,monica K(mk_m****),외국배우들 방한하면 꼭 물어봐주세요두 유 노우 클레멘타인?  
8-25-2016,2016,8,25,13:59,목요일,10,4,1,춘천호랑(nado****),극장 재개봉을 강력히 요구합니다. 집에서 볼 영화가 아닙니다  
8-25-2016,2016,8,25,11:55,목요일,10,4,1,모름(lege****),좋네요 ! 눈물흘리면서 봤어요  
8-25-2016,2016,8,25,09:05,목요일,10,4,1,paul****,하.. 지렷다.. 님들 팬티여벌준비하세요  
8-25-2016,2016,8,25,07:59,목요일,10,4,1,움하하(kdw6****),할말없다 그냥 보면됩니다.  
8-25-2016,2016,8,25,07:48,목요일,10,4,1,간지도치(dong****),이영화를 보고 여친이생겼습니다.  
8-24-2016,2016,8,24,23:36,수요일,10,4,1,업무용(work****),털나고 이런 기분 처음이다.  
8-24-2016,2016,8,24,14:08,수요일,10,4,1,러쉬(thsd****),내 인생은 이 영화를 보기 전과 후로 나뉜다 -즐라탄 이브라히모비치-  
8-24-2016,2016,8,24,07:46,수요일,10,4,1,베스트쵸이스(stig****),"제 인생 4대 영화를 고르라면 4위 쇼생크 탈출,  3위 스타워즈,  2위 메트릭스,  1위 클레멘타인입니다.다시 재개봉하기를 간절히 바랍니다.  "
8-23-2016,2016,8,23,22:17,화요일,10,4,1,kwnh0628(s_om****),난 몰입감없는 영화는 보다가 끄는데...이건 스토리도 탄탄하고 볼만했음 액션좋아하시는분들에게 추천함  
8-23-2016,2016,8,23,20:18,화요일,10,4,1,털은내가슴에(kms6****),"알람음에 한회을 그은 수작 ""아빠 일어나"" 도저히 잊혀지지가않아!!  "
8-22-2016,2016,8,22,07:15,월요일,10,4,1,mtak****,"할리우드 리메이크 확정인듯해요, 주연은 맷데이먼  과 밴 애플렉이 경합중인듯 합니다  "
8-21-2016,2016,8,21,12:34,일요일,10,4,1,개보다남자(juda****),명작을 마주하고도 알아보지 못한다면 그것은 인생을 낭비하는것이다! 감히말하건대 남자로서 살아갈 이유하나를 이영화를 통해 만들어보기를!!  
8-20-2016,2016,8,20,14:19,토요일,10,4,1,개구리(aptl****),지려버렸다....와  
8-18-2016,2016,8,18,17:23,목요일,10,4,1,리미테(dbst****),이 클레멘타인에 10점을 줄 수 있다니 영광입니다.  
8-18-2016,2016,8,18,06:54,목요일,10,4,1,jiyo****,이동준님!! 정말 감사합니다~~!!  ㅜㅜ  
7-3-2016,2016,7,3,14:55,일요일,10,4,1,박지형(real****),일단 먼저 보시라....  
7-2-2016,2016,7,2,23:16,토요일,10,4,1,양웬리z(deat****),와 진심 개명작.이런 명작 영화를 왜 이제야 봤지  
6-30-2016,2016,6,30,10:28,목요일,10,4,1,안찡(ahnz****),우리나라를 대표하는 시대의 걸작! 아버지의 무게감이 느껴진다  
6-15-2016,2016,6,15,14:16,수요일,10,4,1,천재소년(dygk****),미하일 발락이 물었다 이곳이 클레멘타인의 나라입니가? 꼭한번 와보고 싶었습니다  
6-8-2016,2016,6,8,20:39,수요일,10,4,1,약산의진달래꽃(chun****),테이큰?? 개나줘버라 그래. 테이큰이 이 영화 이전에 개봉했다면 인정하겠지만 이미 이전에 이 영화가 나왔기 때문에 테이큰은 아류작에 불과하다.  
6-5-2016,2016,6,5,21:02,일요일,10,4,1,rjsg****,아... 결국 눈물을 흘리고 말았습니다.  
6-4-2016,2016,6,4,21:44,토요일,10,4,1,전환돈(jaeh****),이 영화를 보고 암이 암에 걸렸습니다.  
5-25-2016,2016,5,25,01:20,수요일,10,4,1,DY(abcw****),이영화는 타임캡슐에 묻어서 대대손손 물려주어야 한다  
4-22-2016,2016,4,22,10:23,금요일,10,4,1,dbsg****,영화를 보고 암이 나았습니다  
2-22-2016,2016,2,22,19:11,월요일,10,4,1,유히니(anab****),예고편조차 지리는...너란클라멘타인..★  
2-22-2016,2016,2,22,11:59,월요일,10,4,1,ddddd788(skk2****),너무나도 좋은 영화에요  
2-22-2016,2016,2,22,11:15,월요일,10,4,1,메타쉐콰이어(scid****),"어마어마한 영화라고 말하고싶다,,  "
2-6-2016,2016,2,6,01:55,토요일,10,4,1,뽕잎(pals****),침묵하는 평론가들이여... 이 작품을 씹기에는 양심이 허락하지 않더냐?  
2-4-2016,2016,2,4,23:51,목요일,10,4,1,possible(n2wo****),보고나서 가슴에 총을 맞은 느낌이었다.  
2-3-2016,2016,2,3,00:02,수요일,10,4,1,옆집엉아(ryo1****),사람들 누구에게나 본인이 이 세상에 태어난 이유가 있을 것이다. 아직 그 이유를 모른다면 바로 이 영화를 보기 위해서라고 말해도 충분하다.  
1-28-2016,2016,1,28,19:14,목요일,10,4,1,jun(wnsd****),아버지가 주무시는 모습을 보면서 난 이렇게 말했다. 아빠 일어나.. 아버지는 일어나셨다... 같이 울었다...  
1-28-2016,2016,1,28,00:55,목요일,10,4,1,초코빅파이(dlfb****),인생은 B(Birth-탄생)와 D(Death-죽음) 사이의 C(Clementine)다.  
1-26-2016,2016,1,26,13:50,화요일,10,4,1,어나니없스(0_0k****),이걸 핸드폰으로보고 핸드폰이고장났네요 ..눈물이 너무많이떨어져 핸드폰이 고장이났어요 이영화를 이제야보다니 인생을 되돌아보는 그런시간이였습니다.  
1-24-2016,2016,1,24,15:54,일요일,10,4,1,독해의신(sunr****),"테이큰을 능가하는 액션과 아버지의 사랑,,,강추합니다  "
1-24-2016,2016,1,24,08:59,일요일,10,4,1,유비(bnm0****),나는이 영화를 하루에 한번씩본다  
1-24-2016,2016,1,24,07:32,일요일,10,4,1,타천사(yesm****),이런 희대의 명작이 평점이 이것밖에 안돼  
1-23-2016,2016,1,23,22:07,토요일,10,4,1,곽종현(sinc****),뒤늦게 본걸 후회하게 한 영화...개봉한지 10년이 지난후에 봤을까 하는 후회를 남기게 만든 영화 감동의 쓰나미 그 자체  
1-21-2016,2016,1,21,17:50,목요일,10,4,1,ghost(ljho****),'갓레멘타인' 그누구도 따라올수없는 최고의 작품이다이 영화를 모욕하면 하늘이 천벌을 내릴것이다!  
1-21-2016,2016,1,21,00:03,목요일,10,4,1,OoO(gust****),내 삶의 터닝포인트같은 영화  
1-17-2016,2016,1,17,20:07,일요일,10,4,1,킨플란트(kint****),요즘 러브레터도 그렇고 많은 명영화가 재개봉하고 있습니다. 시대를 앞서간 세기의 이 명작을 재개봉해야한다고  생각하시는 분  공감눌러주세요  
1-11-2016,2016,1,11,22:57,월요일,10,4,1,한국대표뉴비(tkda****),아버지라면 자녀들과 이 영화를 필히 보아야할 것이다.  
1-7-2016,2016,1,7,22:45,목요일,10,4,1,문덕환(mhc4****),가장 나쁜 삶은 가난한 삶이 아닌 이 영화를 보지 못한 삶이다.  
1-5-2016,2016,1,5,19:19,화요일,10,4,1,dang****,전국민이 이 영화를 봐야한다고 생각합니다.  
1-3-2016,2016,1,3,20:24,일요일,10,4,1,만화용(shin****),이 영화를 보니 깨졌던 스마트폰 액정이 붙었습니다.  
12-27-2015,2015,12,27,16:24,일요일,10,4,1,Sean(lees****),한국영화의 힘을 세계에 알려야할 때다.인간으로서 이런 영화를 찍을 수 있다는게 믿기지 않는다.  
12-22-2015,2015,12,22,21:43,화요일,10,4,1,vnfl****,한국 영화의 한 획이다... 진짜 숨은 명작  
10-22-2015,2015,10,22,19:46,목요일,9,4,1,으으음(sunw****),"'이 시대의 불멸의 명작' -New York Times '최고의 영화, 추천합니다.'-박평식 '끝부분에선 나도 울고 내 가족도 울고 친구들도 울고 전미(全美)도 울었다'-버락 오바마, 개인 트위터에 올린 글  "
9-10-2015,2015,9,10,23:51,목요일,10,4,1,귀베린(dain****),사회에서는 삐뚤어진 반골들이 꼭 있다. 예컨데 이 영화에 10점을 주지 않는 자들이다!  
7-27-2015,2015,7,27,17:36,월요일,10,4,1,캡틴호야(hehe****),이 영화를 보고 암을 낳았습니다.(죄가 한쿡말이 서툴러서 암이 사라졌다눈 뜻임니다.)  
7-21-2015,2015,7,21,18:57,화요일,10,4,1,인디오(dbgu****),세계적인 영화와 어깨를 나란히 할만하다... 왜 명작이라고 하는지 알겠네..  
7-19-2015,2015,7,19,20:44,일요일,10,4,1,아르필켈리에(acw9****),클레멘타인을 재생한 사람과 용기를 논하지 말며클레맨타인을 끝까지 본 사람과 인내심을 논하지 마라.  
7-19-2015,2015,7,19,13:32,일요일,10,4,1,도돌(tal7****),점수가 10점이 한계란게 아쉬울 뿐이다  
7-19-2015,2015,7,19,02:04,일요일,10,4,1,park****,훌륭합니다. 이런영화야  말로 한국 영화를 이끌어가는 영화죠!!-  
7-18-2015,2015,7,18,02:55,토요일,10,4,1,함박웃음(ddle****),감동이네요..일을 할수가 없어요  
7-17-2015,2015,7,17,20:38,금요일,10,4,1,극한극한(isk0****),난 클레멘타인을 보고난 후의 감동을 표현할 완벽한 말을 알아냈지만 여백이 좁아 여기에 옮기지는 않는다  
7-2-2015,2015,7,2,20:16,목요일,10,4,1,Fio P(hdj0****),ㅆㅍ 너네 말듣고 봤다가 빡쳐서 덧글쓴다. 왜 이런 명작을 이제야 알려 준거냐? 낚시라고 생각해서 안봤는데 사람 갖고 노는거 아니다.  
6-9-2015,2015,6,9,14:37,화요일,10,4,1,틀링사마(kbas****),내나이 40초..이제야 이 영화를 보다니.11년전 개봉관에서 보았으면  30대가 바뀌지 않았을까 하네요..  이제 유치원생인 우리아이..곧 이영화를 보여주고 인생을 배워주려합니다..tv도 큰걸로 바꾸려고합니다  
5-24-2015,2015,5,24,14:24,일요일,10,4,1,sten****,아직 보지도 않았는데 네티즌들의 단결력에 감동...  
4-20-2015,2015,4,20,23:54,월요일,10,4,1,난나다(emog****),"영화를 보고 눈물을 흘리며 아버지께 한달음에 뛰어가 안기며 말했다. ""아빠 일어나..."" 아버지는 아무말 없이 안아주셨다...  "
4-18-2015,2015,4,18,13:55,토요일,10,4,1,뉴욕치즈케익(kima****),이 영화를 보고  1주일동안 나오지않던 똥이 나왔습니다.  
4-14-2015,2015,4,14,21:36,화요일,10,4,1,heog****,최고의 명작....이 영화를보고 다른 영화를 볼수가 없다....  
3-8-2015,2015,3,8,22:35,일요일,10,4,1,드루와(dprt****),한강물의80퍼센트는 이영화를본 모든것의눈무리라카더라  
2-26-2015,2015,2,26,10:52,목요일,10,4,1,tokk****,이 영화를 보시면 목표없이 반복되는 지루한 일상은 아무 것도 아니라는 걸 느끼게 되는 삶의 중요한 교훈을 주는 뜻 깊은 영화입니다. 이런 교훈을 이렇게 극적으로 표현하는 영화가 어디 또 있을까요?  
2-25-2015,2015,2,25,19:22,수요일,10,4,1,땡글이(samy****),말이 안나온다...가슴이 먹먹하다  
2-18-2015,2015,2,18,20:04,수요일,10,4,1,whj6****,제 인생은 이 영화 전과 후로 나뉩니다  
2-18-2015,2015,2,18,19:59,수요일,10,4,1,먼치킨(aodw****),진짜 와.... 감동 그 자체  
2-16-2015,2015,2,16,18:58,월요일,10,4,1,가노(baed****),신이시여! 이 영화를 진정 인간이 만들었습니까?  
2-16-2015,2015,2,16,17:09,월요일,10,4,1,긴8원숭이(jmki****),이렇게 감동적인 영화를 보게된것은 저에게 있어 너무나 크나큰 축복이었습니다.  
2-15-2015,2015,2,15,21:02,일요일,10,4,1,김맹(lool****),똥꼬쇼 같은 걸작...  
2-15-2015,2015,2,15,11:28,일요일,10,4,1,23u7mq04(doog****),"그는 우리에게 '뭔가 보여드리겠다.'하였고, 그것은 사실이었다.  "
2-15-2015,2015,2,15,09:33,일요일,10,4,1,코이시뱅(wltj****),감동에 끝을 볼 수 있던 영화다  
2-13-2015,2015,2,13,23:14,금요일,10,4,1,kjjy****,내 인생의 터닝포인트같은 영화.꼭봐야한다  
2-5-2015,2015,2,5,18:43,목요일,10,4,1,바나나맛(1217****),진지충들 꼴보기싫네 ㅋㅋㅋㅋ 희대의 씹명화  
